Date,Article_title,Stock_symbol,Url,Publisher,Author,Article,Lsa_summary,Luhn_summary,Textrank_summary,Lexrank_summary,Year,sentiment_score
2021-10-02 00:00:00+00:00,Is Micron Technology Stock a Buy?,INTC,https://www.nasdaq.com/articles/is-micron-technology-stock-a-buy-2021-10-02,,,"Micron Technology (NASDAQ: MU) stock dropped in the two following days after it announced its fourth-quarter and full-year 2021 earnings. The memory chipmaker beat estimates, but concerns about capital spending and rising supply prompted investors to unload shares. Although Micron can continue to benefit from the current chip shortage and remain a leading memory chip company longer-term, investors face questions about whether that success will translate into gains for the chip stock.
Image source: Getty Images.
How Micron performed
For the fourth quarter of 2021, revenue climbed 36% to almost $8.3 billion. Net income surged 175% higher during that period to over $2.7 billion as the company limited operating expense growth during that time to only 5%. Full-year 2021 revenue of $28 billion rose 29% compared with 2020. This solid revenue growth allowed net income to expand by 116% during that period to $5.9 billion, as operating expense increases remained minimal throughout the year.
While Micron did not project beyond the first quarter of 2022, the company expects between $7.45 billion and $7.85 billion in revenue. Hitting the midpoint of this range would amount to a 33% year-over-year increase.
However, both that projection and the report on earlier quarters hint at a critical concern. The fact that the company only projected one quarter into the future could indicate that the company may struggle to match the numbers beyond Q1.
Why the numbers should concern investors
This worry points to moves by Micron and its peers that should eventually end the chip shortage. Amid the current shortfall, chipmakers all over the world, including Micron, have begun expanding capacity. As a result, Micron expects to spend between $11 billion and $12 billion on capital expenditures in fiscal 2022 on research and increasing production, well above the $9.7 billion allocated in 2021.
Moreover, one of its biggest competitors, Samsung, has pledged to spend $146 billion on product development and foundry expansion over the next three years, according to SDxCentral.
While Micron and its peers will likely not struggle to sell more memory chips, the production capacity expansion highlights the adverse effects on shareholders as Micron stock cools off. Micron's share price depends more heavily on chip pricing than a semiconductor stock such as Nvidia or Intel.
Due to higher demand for chips stemming from artificial intelligence, virtual reality, and the Internet of Things, the 2018 price drop did not affect Micron stock as severely. Instead of falling below $10 per share as it did in previous price cycles, the 2018 low came in at approximately $28 per share. Still, this was a 56% drop from its 2018 high of around $65 per share. An equivalent drop from the 2021 high of $97 per share would take Micron to approximately $43 per share, well below the $70 per share price as of the time of this writing. The sharp swings in memory prices over time make Micron a deeply cyclical stock.
Should investors consider Micron?
Micron stock has prospered amid the memory chip shortage that arose amid the COVID-19 pandemic. However, with companies all across the chip industry increasing capacity, supply will likely rise, causing chip prices to fall. The history of Micron stock points to significant selling when such a phenomenon occurs. Thus, while Micron should remain a leading provider of memory chips, investors may have to brace for more near-term declines and reduced long-term gains.
10 stocks we like better than Micron Technology
When our award-winning analyst team has a stock tip, it can pay to listen. After all, the newsletter they have run for over a decade, Motley Fool Stock Advisor, has tripled the market.*
They just revealed what they believe are the ten best stocks for investors to buy right now... and Micron Technology wasn't one of them! That's right -- they think these 10 stocks are even better buys.
See the 10 stocks
*Stock Advisor returns as of September 17, 2021
Will Healy has no position in any of the stocks mentioned. The Motley Fool owns shares of and recommends Nvidia. The Motley Fool recommends Intel and recommends the following options: long January 2023 $57.50 calls on Intel and short January 2023 $57.50 puts on Intel. The Motley Fool has a disclosure policy.
The views and opinions expressed herein are the views and opinions of the author and do not necessarily reflect those of Nasdaq, Inc.","This solid revenue growth allowed net income to expand by 116% during that period to $5.9 billion, as operating expense increases remained minimal throughout the year. Due to higher demand for chips stemming from artificial intelligence, virtual reality, and the Internet of Things, the 2018 price drop did not affect Micron stock as severely. Thus, while Micron should remain a leading provider of memory chips, investors may have to brace for more near-term declines and reduced long-term gains.","Although Micron can continue to benefit from the current chip shortage and remain a leading memory chip company longer-term, investors face questions about whether that success will translate into gains for the chip stock. Net income surged 175% higher during that period to over $2.7 billion as the company limited operating expense growth during that time to only 5%. This solid revenue growth allowed net income to expand by 116% during that period to $5.9 billion, as operating expense increases remained minimal throughout the year.","Although Micron can continue to benefit from the current chip shortage and remain a leading memory chip company longer-term, investors face questions about whether that success will translate into gains for the chip stock. While Micron and its peers will likely not struggle to sell more memory chips, the production capacity expansion highlights the adverse effects on shareholders as Micron stock cools off. Micron's share price depends more heavily on chip pricing than a semiconductor stock such as Nvidia or Intel.","While Micron did not project beyond the first quarter of 2022, the company expects between $7.45 billion and $7.85 billion in revenue. Micron's share price depends more heavily on chip pricing than a semiconductor stock such as Nvidia or Intel. The Motley Fool owns shares of and recommends Nvidia.",2021,3
2021-10-02 00:00:00+00:00,"$10,000 Invested in These Growth Stocks Could Make You a Fortune Over the Next 10 Years",INTC,https://www.nasdaq.com/articles/%2410000-invested-in-these-growth-stocks-could-make-you-a-fortune-over-the-next-10-years-0,,,"If you have $10,000 to invest, of course you want to do it wisely. If you want a better-than-average return on your investment, you need to find growth stocks that have already proven themselves and have business models that point to reasons for continued growth.
Start with MercadoLibre (NASDAQ: MELI), Advanced Micro Devices (NASDAQ: AMD), and Seagate Technology (NASDAQ: STX), companies whose shares have risen more than 10% this year and more than 100% over the past five years.
Image source: Getty Images.
1. MercadoLibre is just getting started
MercadoLibre is often called the Amazon of Latin America, it is an e-commerce and fintech giant. The company, which started out as an Argentine company in 1999, is now in 18 countries in the region. Over the past five years, Mercado Libre has seen a quarterly revenue increase of 637% and share growth of nearly 800%.
The company just completed its second quarter on June 30, reporting record numbers in revenue and volume. MercadoLibre said it had net revenue in the quarter of $1.7 billion (figures were reported in USD), up 102.6% year over year. Also, sales volume was $7 billion, up 46% over the same period in 2020.
The company has especially been strong in Argentina and Mexico, two countries where it has seen triple-digit percentage increases in revenue in the quarter, year over year.
MercadoLibre also generated net income of $68.2 million, compared to $55.9 million in the same period last year. The growth in the number of COVID-19 cases in Latin America, while tragic, has increased conversion toward more e-commerce and online payment systems. Last year, an estimated 13 million people in Latin America made an online purchase for the first time.
The poor roads and difficult terrain make it costly to ship products throughout South America. In many ways, this provides MercadoLibre a moat over new entrants in the region, such as Amazon. The company, whose shipping arm is known as Mercado Envios, bought Kangu, a Brazilian logistics company that operates in Brazil, Colombia, and Mexico, giving it more delivery vehicles and personnel in key nations. The transaction was completed in August for an undisclosed amount.
What makes MercadoLibre a great long-term stock is it has only begun to scratch the surface of the capability of e-commerce in South America. One report by OMR Global puts the compound annual growth rate (CAGR) for e-commerce in the region to be 25.6% over the next six years. Making it, a stock with long-term potential and one for investors to buy.
2. Advanced Micro Devices has a bright future
Demand for semiconductor chips has gone through the roof since the pandemic started. Primarily there's been a surge for the company's central processing and graphics processing units. Several things have driven this surge, the 5G rollout, the growth of cloud computing, and increased purchases of laptops and tablets. These things will likely still be there long after the pandemic is over.
The CAGR for the global semiconductor market, according to a report by Fortune Business Insights, is expected to be 8.6% over the next seven years and to become an $803.15 billion market during that period. That's great news for Advanced Micro Devices (AMD) investors. The stock is up more than 15% for the year and 1,520% over the past five years.
The company has had double-digit revenue growth for seven consecutive quarters. In the company's second-quarter report, it said it had revenue of $3.85 billion, up 99% year over year. Gross profit was $1.83 billion, up 116% year over year and 15% higher than the first quarter of 2021. Net income was reported as $710 million, up 352% over the same period in 2020. The company said it expected revenue in 2021 to be up 60% over 2020. Additionally, the company reported its highest free cash flow of $888 million for the second quarter compared to $152 million in the same period in 2020.
The company is also putting its extra cash to use to return value to stockholders and to spur more growth. It initiated a $4 billion share repurchase program in May. And the company stated that it is on track to complete its $135 billion acquisition of Xilinx, known for making programmable logic devices, by the end of the year. The Xilinx deal should help AMD better compete with Intel in the data center side of its business that runs digital applications.
Likely AMD's biggest advantage is that making semiconductors is expensive. It must be done in sterile environments, using cutting-edge machinery, and the science of microchips is changing so fast that it's difficult for new companies to come along and catch up in terms of market share. That's a great moat for existing chipmakers, particularly AMD.
3. Seagate Technology is ahead up in the cloud
Seagate Technology is a global leader in data storage, making portable hard drives and SSD external hard drives, essential elements for laptops and cloud computing. The company's stock is up more than 38% this year and more than 106% over the past five years.
On July 2, the company closed its 2021 fiscal year and all of its numbers were above last year's. Annual revenue was a reported $10.6 billion, up 1.6% year over year. While the operating margin was 14% compared to 12.4% in 2020. And net income was $1.3 billion, up 30.8% over 2020. The company's fourth-quarter revenue of $3 billion was its best quarter in six years.
The company signed a multi-year deal last month with Zoom Video Communications for the videoconferencing company that will allow Zoom customers to use Seagate's Lyve Cloud platform to store meeting recordings. This helps Seagate's business because it shows a high-profile client sees the benefits of the Lyve Cloud storage-as-a-service.
Although Seagate's shares have not shown as much momentum the past three years as the other two companies mentioned here, it seems to be catching fire this year. According to Seagate data, the rise of cloud computing has accelerated the need for mass storage devices. In 2015, 25% of data was stored in the cloud. By last year, 40% of data was stored in the cloud. Certain trends, such as the rise of autonomous vehicles, smart factories, and human genomics research, have boosted the need for cloud computing.
Another reason to like Seagate stock is it is well-priced, with a price-to-earnings ratio of only 15.46. It also has something the other two stocks don't: a dividend -- and a generous one at that. The company raised its dividend by 3% to $0.67 a share in October 2020 and its current yield is 3.18% at Wednesday's share prices. With all the evidence, this stock shows great potential in the changing world.
10 stocks we like better than Advanced Micro Devices
When our award-winning analyst team has a stock tip, it can pay to listen. After all, the newsletter they have run for over a decade, Motley Fool Stock Advisor, has tripled the market.*
They just revealed what they believe are the ten best stocks for investors to buy right now... and Advanced Micro Devices wasn't one of them! That's right -- they think these 10 stocks are even better buys.
See the 10 stocks
*Stock Advisor returns as of September 17, 2021
John Mackey, CEO of Whole Foods Market, an Amazon subsidiary, is a member of The Motley Fool’s board of directors. Jim Halley owns shares of Seagate Technology Holdings plc. The Motley Fool owns shares of and recommends Advanced Micro Devices, Amazon, MercadoLibre, and Zoom Video Communications. The Motley Fool recommends Intel and Xilinx and recommends the following options: long January 2022 $1,920 calls on Amazon, long January 2023 $57.50 calls on Intel, short January 2022 $1,940 calls on Amazon, and short January 2023 $57.50 puts on Intel. The Motley Fool has a disclosure policy.
The views and opinions expressed herein are the views and opinions of the author and do not necessarily reflect those of Nasdaq, Inc.","And the company stated that it is on track to complete its $135 billion acquisition of Xilinx, known for making programmable logic devices, by the end of the year. The Xilinx deal should help AMD better compete with Intel in the data center side of its business that runs digital applications. It must be done in sterile environments, using cutting-edge machinery, and the science of microchips is changing so fast that it's difficult for new companies to come along and catch up in terms of market share.","Start with MercadoLibre (NASDAQ: MELI), Advanced Micro Devices (NASDAQ: AMD), and Seagate Technology (NASDAQ: STX), companies whose shares have risen more than 10% this year and more than 100% over the past five years. The Motley Fool owns shares of and recommends Advanced Micro Devices, Amazon, MercadoLibre, and Zoom Video Communications. The Motley Fool recommends Intel and Xilinx and recommends the following options: long January 2022 $1,920 calls on Amazon, long January 2023 $57.50 calls on Intel, short January 2022 $1,940 calls on Amazon, and short January 2023 $57.50 puts on Intel.","Start with MercadoLibre (NASDAQ: MELI), Advanced Micro Devices (NASDAQ: AMD), and Seagate Technology (NASDAQ: STX), companies whose shares have risen more than 10% this year and more than 100% over the past five years. In the company's second-quarter report, it said it had revenue of $3.85 billion, up 99% year over year. The company's stock is up more than 38% this year and more than 106% over the past five years.","Start with MercadoLibre (NASDAQ: MELI), Advanced Micro Devices (NASDAQ: AMD), and Seagate Technology (NASDAQ: STX), companies whose shares have risen more than 10% this year and more than 100% over the past five years. In the company's second-quarter report, it said it had revenue of $3.85 billion, up 99% year over year. The Motley Fool owns shares of and recommends Advanced Micro Devices, Amazon, MercadoLibre, and Zoom Video Communications.",2021,4
2021-10-02 00:00:00+00:00,Better Semiconductor Stock: ASML vs. Intel,INTC,https://www.nasdaq.com/articles/better-semiconductor-stock%3A-asml-vs.-intel-2021-10-02,,,"ASML (NASDAQ: ASML) and Intel (NASDAQ: INTC) are two of the most important semiconductor companies in the world. ASML is the top supplier of photolithography systems, which are used to etch circuit patterns into silicon wafers. Intel is the top producer of CPUs for PCs and data centers.
ASML is also the world's only provider of high-end EUV (extreme ultraviolet) systems, which are used to manufacture the world's smallest chips. That's why it's a key partner for Intel, which owns a small stake in ASML, as well as its top foundry competitors TSMC and Samsung.
Image source: Getty Images.
ASML and Intel both attracted a lot of attention throughout the global chip shortage, which started in late 2019 and worsened throughout the pandemic. But over the past three years, ASML's stock surged about 300% as Intel's stock rose less than 15%.
ASML benefited from the market's insatiable appetite for new photolithography systems, while Intel struggled with ongoing shortages, delays, and manufacturing issues. Let's take a fresh look at both companies and see if ASML remains a stronger investment than Intel.
ASML continues to fire on all cylinders
ASML's revenue rose just 8% in 2019 as the global glut in memory chips curbed the market's appetite for new systems. However, its revenue increased 18% in 2020 as the memory market stabilized and the top foundries boosted their capacity to cope with the surging demand for new chips.
ASML's earnings per share increased just 1% in 2019, but jumped 38% in 2020 as it sold more higher-margin EUV systems. Its total EUV sales rose 60% and accounted for 32% of its full-year revenues.
In the first half of 2021, ASML's revenue rose 45% year over year as its EPS soared 110%. Analysts expect its full-year revenue and earnings to grow 35% and 58%, respectively, as TSMC, Samsung, and Intel install more EUV systems. All three foundries are spending billions of dollars on building new plants, and a lot of that money will flow to ASML.
Next year, analysts expect ASML's revenue and earnings to increase 15% and 22%, respectively. Its growth will likely decelerate as the chip shortage ends, but its business should keep expanding over the long term as it rolls out its next generation of high-NA EUV systems -- which will be used to manufacture chips that are even smaller than today's tiniest chips.
Intel prepares for a painful turnaround
Intel's revenue grew just 2% in 2019, but rose 8% in 2020 as it shipped more PC and data center chips throughout the pandemic. The shift to remote work boosted demand for new PCs, while the heavier usage of online services forced data centers to upgrade their hardware.
Intel's adjusted EPS rose 6% in 2019 and grew 9% in 2020. However, it boosted its EPS with billions of dollars in buybacks throughout both years instead of allocating that cash toward improving its R&D and manufacturing capabilities. That trend worried investors, since Intel had already fallen behind TSMC and Samsung in the ""process race"" to create smaller and more advanced chips.
In the first half of 2021, Intel's revenue dipped 1% year over year as its EPS fell 18%. Those declines can be attributed to its market-share losses to AMD (NASDAQ: AMD) in the PC and data center markets, as well as tough comparisons to the pandemic's initial impact a year ago.
Analysts expect Intel's revenue and earnings to decline 6% and 10%, respectively, this year. Intel's new CEO Pat Gelsinger, who took the helm in February, plans to aggressively expand Intel's manufacturing plants to reclaim the process lead from TSMC by 2025. That's an ambitious goal, but there's no guarantee that it will succeed and reverse its market losses to AMD -- which currently outsources the production of its chips to TSMC's superior foundries.
The obvious winner: ASML
ASML trades at 47 times forward earnings, while Intel has a much lower forward P/E ratio of 11. However, ASML's near-monopoly in photolithography systems, its role as a linchpin of the global semiconductor market, and its robust growth rates all justify that higher valuation. Meanwhile, Intel's stock deserves a lower valuation because it faces a grueling uphill battle against TSMC and AMD.
Intel's downside potential could be limited at these levels, but ASML has a lot more upside potential -- especially as the global chip shortage drags on and highlights the importance of its EUV systems.
10 stocks we like better than ASML Holding
When our award-winning analyst team has a stock tip, it can pay to listen. After all, the newsletter they have run for over a decade, Motley Fool Stock Advisor, has tripled the market.*
They just revealed what they believe are the ten best stocks for investors to buy right now… and ASML Holding wasn't one of them! That's right -- they think these 10 stocks are even better buys.
See the 10 stocks
*Stock Advisor returns as of September 17, 2021
Leo Sun owns shares of ASML Holding. The Motley Fool owns shares of and recommends Advanced Micro Devices and Taiwan Semiconductor Manufacturing. The Motley Fool recommends ASML Holding and Intel and recommends the following options: long January 2023 $57.50 calls on Intel and short January 2023 $57.50 puts on Intel. The Motley Fool has a disclosure policy.
The views and opinions expressed herein are the views and opinions of the author and do not necessarily reflect those of Nasdaq, Inc.","ASML (NASDAQ: ASML) and Intel (NASDAQ: INTC) are two of the most important semiconductor companies in the world. ASML benefited from the market's insatiable appetite for new photolithography systems, while Intel struggled with ongoing shortages, delays, and manufacturing issues. The shift to remote work boosted demand for new PCs, while the heavier usage of online services forced data centers to upgrade their hardware.","ASML (NASDAQ: ASML) and Intel (NASDAQ: INTC) are two of the most important semiconductor companies in the world. But over the past three years, ASML's stock surged about 300% as Intel's stock rose less than 15%. Next year, analysts expect ASML's revenue and earnings to increase 15% and 22%, respectively.","ASML (NASDAQ: ASML) and Intel (NASDAQ: INTC) are two of the most important semiconductor companies in the world. But over the past three years, ASML's stock surged about 300% as Intel's stock rose less than 15%. ASML continues to fire on all cylinders ASML's revenue rose just 8% in 2019 as the global glut in memory chips curbed the market's appetite for new systems.","ASML (NASDAQ: ASML) and Intel (NASDAQ: INTC) are two of the most important semiconductor companies in the world. But over the past three years, ASML's stock surged about 300% as Intel's stock rose less than 15%. That trend worried investors, since Intel had already fallen behind TSMC and Samsung in the ""process race"" to create smaller and more advanced chips.",2021,2
