Date,Article_title,Stock_symbol,Url,Publisher,Author,Article,Lsa_summary,Luhn_summary,Textrank_summary,Lexrank_summary,Year,sentiment_score
2021-04-18 00:00:00+00:00,3 International Tech Stocks to Buy Right Now,INTC,https://www.nasdaq.com/articles/3-international-tech-stocks-to-buy-right-now-2021-04-18,,,"When it comes to the latest and greatest technology companies, yes, the U.S. is still a great place to invest. But it's certainly not the only place. In fact, some of today's most essential technologies and platforms came not from Silicon Valley, but overseas -- especially East Asia.
Tech-led growth is happening at a fast pace in the region, from China to Taiwan, South Korea, and other Southeast Asian countries. So for those looking to turbocharge your portfolio returns for the 2020s, adding exposure to these three top Asian tech stocks could be a very smart move.
Image source: Getty Images.
Naspers/Prosus
South African media company Naspers (OTC: NPSNY) made perhaps the single greatest venture investment of all-time back in 2001, when it purchased a large 33% stake in Chinese tech start-up Tencent (OTC: TCEHY) for just $32 million. Fast-forward 20 years, and that stake, if held in its entirety, would be worth $258 billion, plus dividends. Naspers did sell off about $10 billion in 2018, and it just sold another $14.6 billion at the beginning of this month. Still, even after those sales, Naspers' international holding company, Prosus (OTC: PROSY), still owns 28.9% of the Chinese giant.
However, that success posed a problem, as Naspers' size became so overwhelming on the Johannesburg Stock Exchange that it began to trade well below the value of its skyrocketing Tencent stake beginning a few years ago. In 2019, Naspers spun off Tencent and all of its other international holdings into Prosus, which listed on the Euronext exchange, with Naspers retaining roughly a 73% stake in Prosus.
Unfortunately, that didn't close the discount, as Prosus continues to trade well below the value of the Tencent stake, and Naspers trades at a discount to the value of its Prosus stake.
However, Naspers/Prosus is trying valiantly and intelligently to change that. Prosus just sold $14.6 billion of Tencent stock after Tencent's run-up during the pandemic. Although Prosus is still bullish on Tencent and has pledged not to sell any more shares for another three years, the sale could help close the discount.
Prosus may increase its $5 billion share repurchase program announced last fall, which would instantly add value, or it can also use that money to grow its non-Tencent businesses across online classifieds, food delivery, social media, and e-commerce. Analysts estimate that collection of businesses was worth another $30 billion as of last September, and probably even more now. It's likely that Prosus will do a bit of both -- growing its other businesses while repurchasing shares at a big discount -- over the next thee years.
Investors have reacted positively to the news, but Naspers and Prosus still trade at large discounts to the fair value of their publicly traded assets. Management has every incentive to close that discount, and if history is any guide, Prosus' management should allocate those new billions wisely. In any case, an investment in either Naspers or Prosus is a chance to invest in Tencent at a big discount, while also sidestepping a direct investment in China, which has become riskier because of a deterioration in U.S.-China relations.
Image source: Getty Images.
Taiwan Semiconductor Manufacturing
The world's most important company today may just be Taiwan Semiconductor Manufacturing (NYSE: TSM). As the world's largest and most advanced semiconductor foundry, many of the world's greatest tech companies depend on TSM's manufacturing expertise to actually produce their leading-edge chips. Semiconductors are becoming more and more complex and their production more difficult, and Taiwan Semi has technologically moved ahead of rivals over the past few years, leading to massive growth.
Yet Taiwan Semi's stock has retreated recently, down about 17% from recent all-time highs. Why is that? A couple of reasons. First, Taiwan Semi had gone up a lot over the past year -- about 144%, while its P/E multiple has increased from about 20 to 35, even as earnings have grown.
Second, lots of attention has gone to its competitors in recent months, including Samsung and Intel (NASDAQ: INTC), each of which has announced ambitious foundry investment plans in a bid to catch up to TSMC. Samsung recently announced a $116 billion spending plan to reach 3-nanometer chip production by 2022, matching Taiwan Semi by that time, and adopting gate-all-around technology before Taiwan Semi does as well.
Meanwhile, Intel, which ceded the leading-edge lead to Taiwan Semi a few years ago, also announced its intentions not only to catch up in leading-edge chip production but also to become a foundry for other chip designers as well. In conjunction, new CEO Pat Gelsinger announced that Intel would be investing $20 billion in two new fabs in Arizona.
Still, I think it's premature to say either Samsung or Intel will be able to catch up anytime soon. After all, there is a reason Taiwan Semi took the chip technology lead in the first place, and it's not unthinkable that Taiwan Semi will retain its lead past this year. It's also not a sure thing that Samsung and Intel will be successful in their high-stakes bets.
With the global pandemic accelerating digital trends, we are now in a semiconductor shortage that should last well into 2022. That rising tide should lift all boats, even if Taiwan Semi needs to share more of the pie with its rivals. While TSMC has forecast 10%-15% annualized growth over the next five years, management on the recent conference call with analysts just raised its 2021 guidance to 20% growth, and it has a track record of underpromising and overdelivering.
In short, the recent dip may be a good time to add to this long-term dividend growth stock.
Image source: Getty Images.
Sea Limited
A potential giant in the making, Sea Limited (NYSE: SE) has very quickly leapt over its competitors to become the leading e-commerce platform in Southeast Asia.
Of course, Sea didn't start that way. Initially, it was a communication platform for video gamers, before distributing games made by Tencent for the Southeast Asian audience. The company then went on to produce its own in-house game, Free Fire, which became an international phenomenon on the company's first try out of the gate.
But Sea's ambition went well beyond video games, and the company then launched Shopee, its e-commerce platform, in 2015, along with SeaMoney, its digital financial-services arm around the same time. Shopee has been wildly successful, overtaking early e-commerce players in the region just as Southeast Asians began to adopt e-commerce in a bigger and bigger way. The pandemic then hit just as Shopee was overtaking its rivals, leading to stratospheric growth last year.
While Sea's stock has pulled back over 10% from its all-time highs recently, it is up massively over the past year, having appreciated 385% in 2020. Still, the company has proved itself with absolutely massive growth. Last quarter, revenue surged 102%, fueled by 178% e-commerce growth and 72% growth in its digital entertainment division, which includes Free Fire. Digital payments revenue rose eightfold, albeit off a very small base.
And the company isn't taking its foot off the gas, either. In 2021, Sea has already taken steps that signal even bigger growth ambitions. First, it continued to invest in its fintech ambitions by buying Jakarta-based bank Bank BKE. Acquiring a bank signals Sea's ambition to become an all-encompassing super app with lots of financial services beyond mere e-commerce payments.
Second, Sea has also entered Latin America in a bigger way. After starting with a small e-commerce team in Brazil in 2019, Shopee just launched its app in Mexico in February. The launch signaled that Sea still has bigger ambitions in Latin America, where e-commerce is underpenetrated, and where it can cross-market effectively with the many Free Fire players in the region. Moreover, Latin America has an even bigger population than Southeast Asia, with 2019 GDP of $5.2 trillion, versus Southeast Asia's $3.6 trillion.
Basically, Sea continues to grow both its product portfolio and its geographic reach, while also executing flawlessly on its core gaming and e-commerce platforms at home. A potential successful Latin American expansion could definitely push Sea's stock higher, despite the impressive run over the past year.
10 stocks we like better than Taiwan Semiconductor Manufacturing
When investing geniuses David and Tom Gardner have a stock tip, it can pay to listen. After all, the newsletter they have run for over a decade, Motley Fool Stock Advisor, has tripled the market.*
David and Tom just revealed what they believe are the ten best stocks for investors to buy right now... and Taiwan Semiconductor Manufacturing wasn't one of them! That's right -- they think these 10 stocks are even better buys.
See the 10 stocks
*Stock Advisor returns as of February 24, 2021
Billy Duberstein owns shares of Naspers Limited (ADR), Prosus, Sea Limited, and Taiwan Semiconductor Manufacturing. The Motley Fool owns shares of and recommends Sea Limited, Taiwan Semiconductor Manufacturing, and Tencent Holdings. The Motley Fool recommends Intel and recommends the following options: long January 2023 $57.5 calls on Intel and short January 2023 $57.5 puts on Intel. The Motley Fool has a disclosure policy.
The views and opinions expressed herein are the views and opinions of the author and do not necessarily reflect those of Nasdaq, Inc.","Second, lots of attention has gone to its competitors in recent months, including Samsung and Intel (NASDAQ: INTC), each of which has announced ambitious foundry investment plans in a bid to catch up to TSMC. However, that success posed a problem, as Naspers' size became so overwhelming on the Johannesburg Stock Exchange that it began to trade well below the value of its skyrocketing Tencent stake beginning a few years ago. Prosus may increase its $5 billion share repurchase program announced last fall, which would instantly add value, or it can also use that money to grow its non-Tencent businesses across online classifieds, food delivery, social media, and e-commerce.","Second, lots of attention has gone to its competitors in recent months, including Samsung and Intel (NASDAQ: INTC), each of which has announced ambitious foundry investment plans in a bid to catch up to TSMC. Samsung recently announced a $116 billion spending plan to reach 3-nanometer chip production by 2022, matching Taiwan Semi by that time, and adopting gate-all-around technology before Taiwan Semi does as well. See the 10 stocks *Stock Advisor returns as of February 24, 2021 Billy Duberstein owns shares of Naspers Limited (ADR), Prosus, Sea Limited, and Taiwan Semiconductor Manufacturing.","Second, lots of attention has gone to its competitors in recent months, including Samsung and Intel (NASDAQ: INTC), each of which has announced ambitious foundry investment plans in a bid to catch up to TSMC. Samsung recently announced a $116 billion spending plan to reach 3-nanometer chip production by 2022, matching Taiwan Semi by that time, and adopting gate-all-around technology before Taiwan Semi does as well. After all, there is a reason Taiwan Semi took the chip technology lead in the first place, and it's not unthinkable that Taiwan Semi will retain its lead past this year.","Second, lots of attention has gone to its competitors in recent months, including Samsung and Intel (NASDAQ: INTC), each of which has announced ambitious foundry investment plans in a bid to catch up to TSMC. Unfortunately, that didn't close the discount, as Prosus continues to trade well below the value of the Tencent stake, and Naspers trades at a discount to the value of its Prosus stake. After all, there is a reason Taiwan Semi took the chip technology lead in the first place, and it's not unthinkable that Taiwan Semi will retain its lead past this year.",2021,3
2021-04-18 00:00:00+00:00,3 5G Stocks to Buy Before They Take Off Again,INTC,https://www.nasdaq.com/articles/3-5g-stocks-to-buy-before-they-take-off-again-2021-04-18,,,"2021 will go down as the year nationwide 5G networks made their debut -- at least in the U.S. It was the culmination of years of research and buildout of new network equipment operating behind the scenes, but the movement is far from over. Network providers are in a never-ending process of improving performance and expanding coverage, and consumers have only just begun purchasing devices that can connect to 5G. Though stocks that play in the space had a great run since last summer, there's plenty of room for some of them to run higher. To that end, three Fool.com contributors think Skyworks Solutions (NASDAQ: SWKS), American Tower (NYSE: AMT), and Western Digital (NASDAQ: WDC) are a buy right now.
The 5G smartphone upgrade cycle is real
Nicholas Rossolillo (Skyworks Solutions): After a few years of slumber that started in 2018 (the start of the last chip and tech hardware downturn, hastened by the U.S.-China trade war and culminating in the economic lockdown last spring), Skyworks Solutions has been on a tear. Shares of the connectivity chipmaker are up nearly 60% since the start of 2020. However, even after the big jump higher, the stock trades for 36 times trailing-12-month free cash flow.
Sure, it's not the cheapest name in the semiconductor industry. But I like where Skyworks is at right now. It's poised to benefit from a massive 5G smartphone upgrade cycle. Its largest customer, Apple, makes up about half of sales, so it has a lot to gain as iPhone fans purchase a new device with a 5G connectivity chip. It's won some other design contests for other tier one smartphone makers that could send sales soaring higher for the rest of this year, and its non-smartphone portfolio (about one-quarter of revenue) is also growing by double-digit percentages as businesses and consumers start to upgrade to Wi-Fi 6 hardware.
As to specific growth figures, Skyworks' first-quarter 2021 revenue grew 69% year over year to $1.51 billion and management forecast second-quarter sales to jump 50% from a year ago to about $1.15 billion. I'd expect the trajectory to moderate as the year progresses, but I nonetheless think demand will remain high for some time. A global chip shortage is putting a top on how many devices manufacturers can crank out right now (which should extend this sales up cycle for a while). Additionally, tech researcher Gartner estimates smartphone shipments will increase 11% in 2021, but only about one-third of phone shipments will be equipped with 5G hardware. It's a big jump from very few 5G phones sold at all in 2020, but hundreds of millions of consumers around the globe will still end 2021 without 5G.
Put another way, this next smartphone upgrade supercycle is only just beginning this year. Skyworks Solutions is in prime position to sell lots of next-gen connectivity equipment for the foreseeable future. Shares aren't totally unreasonable given the rosy outlook, so now's the time to give this semiconductor leader another look.
Image source: Getty Images.
The best of many worlds
Anders Bylund (American Tower): Mobile devices, their components, and the network operators that serve them are crucial pieces of the 5G networking puzzle, but none of them matter without a nationwide network of cell towers. That's where American Tower comes in.
The company operates 186,000 towers and small cell sites around the world. Despite the all-American name, American Tower is a global giant. Only 43,000 of the operating sites are found within the U.S., with large tower networks in high-growth markets such as Mexico, Brazil, and Nigeria. American Tower's largest market is actually India and its 76,000 cell sites.
American Tower owns and maintains the physical infrastructure around each communications base station, leaving the networking technology to its tenants. Adding more clients to an existing tower is an effective way to increase the revenue generated by that site at a forgettable cost of capital upgrades. Allowing each customer to move in more equipment is another method. 5G networks are particularly well suited to support edge computing, which gives AMT another opportunity to boost its revenue per installation.
I'm talking about a highly profitable company with a generous dividend policy. American Tower's adjusted earnings before interest, taxes, depreciation, and amortization (EBITDA) increased by an annual average of 14% in the last decade. Dividend payouts have doubled in four years, offering an effective yield of 2% today. Meanwhile, the stock has gained just 8% since the start of 2020. The S&P 500 rose 29% in the same period.
That's how American Tower offers a unique combination of 5G-based growth, bountiful dividends, and reasonable share prices. It really is the best of several worlds.
All of that 5G data needs to be stored somewhere
Billy Duberstein (Western Digital): The advent of 5G will bring with it a massive amount of data flying back and forth among customers, businesses, and the data centers in between, both in the cloud and at the edge.
IDC anticipates data creation will grow at a 23% annual growth rate between 2020 and 2025. Even more stunning, that means the world will create over two times the amount of data during those years as the entire amount stored since data storage was created! Massive data storage needs could spell good things for Western Digital, which produces the two dominant types of data storage today: hard disk drives and NAND flash.
The data storage industry is coming off of a rough two years since the beginning of the U.S.-China trade war. Western Digital's profits have plummeted, and the company suspended its dividend after new CEO David Goeckeler took over last year, opting to use all excess free cash flow to pay down debt.
Yet there is reason for optimism. First, Western Digital's profitable HDD business, while thought to be in decline due to the rise of the faster and more dynamic NAND flash, should have longevity thanks to the massive storage needs of cloud data centers.
But perhaps more important, NAND flash prices, which have plummeted over the past two years amid oversupply, are supposed to grow about 3% to 8% this quarter, according to Trendforce. That may not seem like much, but it's actually rare, since NAND flash prices tend to decline over the long term. Flash producers attempt to keep pace with cost reductions from more advanced manufacturing techniques. For its part, Western Digital targets 15% per-bit annual cost declines.
While NAND flash is definitely a growth industry, it has more competitors than the more consolidated (and more profitable) DRAM memory and HDD industries, each of which only has three large players.
However, that could be changing. Last year, Intel (NASDAQ: INTC) agreed to sell its NAND Flash unit to SK Hynix. More recently, the Wall Street Journal reported Western Digital and another rival were considering buying Japan's Kioxia, the private equity-owned NAND flash producer that used to belong to Toshiba. Western Digital may have a leg up, as it's already a joint venture partner with Kioxia, and the two companies share manufacturing facilities.
If Toshiba is bought, either by Western Digital or someone else, the major NAND producers will have gone from six to four -- a significant consolidation that could lead to structurally better profit margins. Of course, there are also rising Chinese NAND players to watch out for, so consolidation may be necessary.
If a deal for Kioxia happens, significant industry consolidation right at the beginning of a potential NAND price up cycle could be a recipe for success for all industry players -- especially Western Digital, the stock that's perhaps most closely tied to NAND flash prices.
10 stocks we like better than Skyworks Solutions
When investing geniuses David and Tom Gardner have a stock tip, it can pay to listen. After all, the newsletter they have run for over a decade, Motley Fool Stock Advisor, has tripled the market.*
David and Tom just revealed what they believe are the ten best stocks for investors to buy right now… and Skyworks Solutions wasn't one of them! That's right -- they think these 10 stocks are even better buys.
See the 10 stocks
*Stock Advisor returns as of February 24, 2021
Anders Bylund owns shares of American Tower, Intel, and Western Digital. Billy Duberstein owns shares of Apple and has the following options: short April 2021 $90.0 puts on Apple, short August 2020 $350.0 puts on Apple, short August 2020 $45.0 puts on Intel, short December 2020 $75.0 puts on Apple, short January 2021 $160.0 calls on Apple, short May 2021 $75.0 puts on Apple, short November 2020 $83.75 puts on Apple, and short September 2020 $160.0 calls on Apple. Nicholas Rossolillo owns shares of Apple and Skyworks Solutions. The Motley Fool owns shares of and recommends American Tower, Apple, and Skyworks Solutions. The Motley Fool recommends Gartner and Intel and recommends the following options: long January 2023 $57.5 calls on Intel, long March 2023 $120.0 calls on Apple, short January 2023 $57.5 puts on Intel, and short March 2023 $130.0 calls on Apple. The Motley Fool has a disclosure policy.
The views and opinions expressed herein are the views and opinions of the author and do not necessarily reflect those of Nasdaq, Inc.","Last year, Intel (NASDAQ: INTC) agreed to sell its NAND Flash unit to SK Hynix. It's won some other design contests for other tier one smartphone makers that could send sales soaring higher for the rest of this year, and its non-smartphone portfolio (about one-quarter of revenue) is also growing by double-digit percentages as businesses and consumers start to upgrade to Wi-Fi 6 hardware. First, Western Digital's profitable HDD business, while thought to be in decline due to the rise of the faster and more dynamic NAND flash, should have longevity thanks to the massive storage needs of cloud data centers.","Last year, Intel (NASDAQ: INTC) agreed to sell its NAND Flash unit to SK Hynix. Billy Duberstein owns shares of Apple and has the following options: short April 2021 $90.0 puts on Apple, short August 2020 $350.0 puts on Apple, short August 2020 $45.0 puts on Intel, short December 2020 $75.0 puts on Apple, short January 2021 $160.0 calls on Apple, short May 2021 $75.0 puts on Apple, short November 2020 $83.75 puts on Apple, and short September 2020 $160.0 calls on Apple. The Motley Fool owns shares of and recommends American Tower, Apple, and Skyworks Solutions.","Last year, Intel (NASDAQ: INTC) agreed to sell its NAND Flash unit to SK Hynix. If a deal for Kioxia happens, significant industry consolidation right at the beginning of a potential NAND price up cycle could be a recipe for success for all industry players -- especially Western Digital, the stock that's perhaps most closely tied to NAND flash prices. See the 10 stocks *Stock Advisor returns as of February 24, 2021 Anders Bylund owns shares of American Tower, Intel, and Western Digital.","Last year, Intel (NASDAQ: INTC) agreed to sell its NAND Flash unit to SK Hynix. The 5G smartphone upgrade cycle is real Nicholas Rossolillo (Skyworks Solutions): After a few years of slumber that started in 2018 (the start of the last chip and tech hardware downturn, hastened by the U.S.-China trade war and culminating in the economic lockdown last spring), Skyworks Solutions has been on a tear. If a deal for Kioxia happens, significant industry consolidation right at the beginning of a potential NAND price up cycle could be a recipe for success for all industry players -- especially Western Digital, the stock that's perhaps most closely tied to NAND flash prices.",2021,3
