Date,Article_title,Stock_symbol,Url,Publisher,Author,Article,Lsa_summary,Luhn_summary,Textrank_summary,Lexrank_summary,Year,sentiment_score
2021-04-15 00:00:00+00:00,Insiders Buy the Holdings of VLUE ETF,INTC,https://www.nasdaq.com/articles/insiders-buy-the-holdings-of-vlue-etf-2021-04-15,,,"A look at the weighted underlying holdings of the iShares MSCI USA Value Factor ETF (VLUE) shows an impressive 12.7% of holdings on a weighted basis have experienced insider buying within the past six months.
Intel Corp (Symbol: INTC), which makes up 8.03% of the iShares MSCI USA Value Factor ETF (VLUE), has seen 2 directors and officers purchase shares in the past six months, according to the recent Form 4 data. The ETF holds a total of $1,148,733,971 worth of INTC, making it the #1 largest holding. The table below details the recent insider buying activity observed at INTC:
INTC — last trade: $64.19 — Recent Insider Buys:
PURCHASED INSIDER TITLE SHARES PRICE/SHARE VALUE
10/28/2020 Robert Holmes Swan CEO 8,021 $44.96 $360,624
01/25/2021 Robert Holmes Swan CEO 27,244 $55.57 $1,514,004
01/26/2021 George S. Davis Chief Financial Officer 9,095 $55.34 $503,317
10 ETFs With Stocks That Insiders Are Buying »
The views and opinions expressed herein are the views and opinions of the author and do not necessarily reflect those of Nasdaq, Inc.","Intel Corp (Symbol: INTC), which makes up 8.03% of the iShares MSCI USA Value Factor ETF (VLUE), has seen 2 directors and officers purchase shares in the past six months, according to the recent Form 4 data. The ETF holds a total of $1,148,733,971 worth of INTC, making it the #1 largest holding. The table below details the recent insider buying activity observed at INTC: INTC — last trade: $64.19 — Recent Insider Buys:","Intel Corp (Symbol: INTC), which makes up 8.03% of the iShares MSCI USA Value Factor ETF (VLUE), has seen 2 directors and officers purchase shares in the past six months, according to the recent Form 4 data. The ETF holds a total of $1,148,733,971 worth of INTC, making it the #1 largest holding. The table below details the recent insider buying activity observed at INTC: INTC — last trade: $64.19 — Recent Insider Buys:","The table below details the recent insider buying activity observed at INTC: INTC — last trade: $64.19 — Recent Insider Buys: Intel Corp (Symbol: INTC), which makes up 8.03% of the iShares MSCI USA Value Factor ETF (VLUE), has seen 2 directors and officers purchase shares in the past six months, according to the recent Form 4 data. The ETF holds a total of $1,148,733,971 worth of INTC, making it the #1 largest holding.","The table below details the recent insider buying activity observed at INTC: INTC — last trade: $64.19 — Recent Insider Buys: Intel Corp (Symbol: INTC), which makes up 8.03% of the iShares MSCI USA Value Factor ETF (VLUE), has seen 2 directors and officers purchase shares in the past six months, according to the recent Form 4 data. The ETF holds a total of $1,148,733,971 worth of INTC, making it the #1 largest holding.",2021,3
2021-04-15 00:00:00+00:00,NVIDIA's Continued Innovation Makes It a Name to Watch Closely,INTC,https://www.nasdaq.com/articles/nvidias-continued-innovation-makes-it-a-name-to-watch-closely-2021-04-15,,,"NVIDIA's (NASDAQ: NVDA) graphics card business has been a tremendous growth engine propelling its stock to multibagger status for shareholders who have held the stock even for just a few years. But this innovator isn't resting on its success. On a Fool Live episode recorded on March 17, Fool.com contributors Brian Feroldi, Brian Stoffel, and Brian Withers discuss an exciting growth avenue it is pursuing and why this growth stock is still a solid investment for shareholders with a long-term mindset.
10 stocks we like better than NVIDIA
When investing geniuses David and Tom Gardner have a stock tip, it can pay to listen. After all, the newsletter they have run for over a decade, Motley Fool Stock Advisor, has tripled the market.*
David and Tom just revealed what they believe are the ten best stocks for investors to buy right now... and NVIDIA wasn't one of them! That's right -- they think these 10 stocks are even better buys.
See the 10 stocks
*Stock Advisor returns as of February 24, 2021
Brian Withers: There's an MIT spin-off called Derq, D-E-R-Q, that's using NVIDIA products to make AI and traffic intersections in roads safer. They have been gathering data for three years on real-world insights from an intersection in Detroit that's had a lot of crashes. The company has used their hardware to run their system. This AI bot that they are creating will be incorporated into NVIDIA's Metropolis software ecosystem that will help create smart cities. Derq is helping NVIDIA and NVIDIA is helping Derq. They've successfully shown that they can predict cars running red lights. This is the cool part for me, they can warn driver assistance systems and driverless cars to the potential of the accident before it can happen. You imagine sitting in traffic light and all of a sudden, your dash lights up and tells you not to go because somebody's coming the other direction. That's the power of what NVIDIA's video platform that's taking the world in and then transferring the data and converting it to real-world information.
What to watch for NVIDIA? They have an analyst day coming up on April 12. The optionality for this company is just amazing. Like I said, the graphics cards capabilities is still their biggest unit, AI is still pretty small, but just the power of this Derq example shows how NVIDIA can play in this next big wave of AI and interpreting visual information into real-world information. What do you guys think about NVIDIA? You're muted.
Brian Stoffel: I was muted. I have a question about NVIDIA. Normally, I stay away from hardware makers. I don't own shares of NVIDIA and part of that is because I believe that there's potential to get leapfrogged and to be commoditized. Do you see that as a threat? It's obviously always there, but who do you see as the biggest threat to that, for investors looking to buy shares of NVIDIA?
Withers: I'm like you. I'm not a big hardware player, but what I would say of NVIDIA is competition has always been a threat for them. Intel could have done it, AMD could've done it, but nobody has innovated as fast as NVIDIA. Sometimes, they come out with a graphics chip that isn't as great, but then they figure it out and roll it out the next time. I would watch to make sure NVIDIA's innovation engine is still humming at a high speed and that would be the [way it's] keeping the competition at bay.
Brian Feroldi: Brian, if you look at Tesla, they're making investments into their own chip and they have said that they plan on offering their system to other automakers. If they leapfrog NVIDIA and their chip dominates, does that kill the NVIDIA thesis?
Withers: I don't know that anything can kill the NVIDIA thesis because they have multiple streams of revenue. They have a pretty anti-fragile business with multiple streams. But Tesla's not the only car out there that's going to need these systems.
Stoffel: Before Brian Feroldi takes the next one, I will just say, of all hardware makers, NVIDIA gets one of the highest anti-fragile scores.
Feroldi: For sure. Super high-quality company.
Brian Feroldi owns shares of Tesla. Brian Stoffel has no position in any of the stocks mentioned. Brian Withers has no position in any of the stocks mentioned. The Motley Fool owns shares of and recommends NVIDIA and Tesla. The Motley Fool recommends Intel and recommends the following options: long January 2023 $57.5 calls on Intel and short January 2023 $57.5 puts on Intel. The Motley Fool has a disclosure policy.
The views and opinions expressed herein are the views and opinions of the author and do not necessarily reflect those of Nasdaq, Inc.","This is the cool part for me, they can warn driver assistance systems and driverless cars to the potential of the accident before it can happen. That's the power of what NVIDIA's video platform that's taking the world in and then transferring the data and converting it to real-world information. I would watch to make sure NVIDIA's innovation engine is still humming at a high speed and that would be the [way it's] keeping the competition at bay.","On a Fool Live episode recorded on March 17, Fool.com contributors Brian Feroldi, Brian Stoffel, and Brian Withers discuss an exciting growth avenue it is pursuing and why this growth stock is still a solid investment for shareholders with a long-term mindset. The Motley Fool owns shares of and recommends NVIDIA and Tesla. The Motley Fool recommends Intel and recommends the following options: long January 2023 $57.5 calls on Intel and short January 2023 $57.5 puts on Intel.","On a Fool Live episode recorded on March 17, Fool.com contributors Brian Feroldi, Brian Stoffel, and Brian Withers discuss an exciting growth avenue it is pursuing and why this growth stock is still a solid investment for shareholders with a long-term mindset. See the 10 stocks *Stock Advisor returns as of February 24, 2021 Brian Withers: There's an MIT spin-off called Derq, D-E-R-Q, that's using NVIDIA products to make AI and traffic intersections in roads safer. Derq is helping NVIDIA and NVIDIA is helping Derq.","But this innovator isn't resting on its success. The company has used their hardware to run their system. Stoffel: Before Brian Feroldi takes the next one, I will just say, of all hardware makers, NVIDIA gets one of the highest anti-fragile scores.",2021,4
2021-04-14 00:00:00+00:00,"After Hours Most Active for Apr 14, 2021 : IQ, ABEV, DISCK, DISCA, NLY, INTC, AAPL, AGNC, GM, SLB, ALLY, AJAX",INTC,https://www.nasdaq.com/articles/after-hours-most-active-for-apr-14-2021-%3A-iq-abev-disck-disca-nly-intc-aapl-agnc-gm-slb,,,"The NASDAQ 100 After Hours Indicator is up 15.24 to 13,819.15. The total After hours volume is currently 94,987,350 shares traded.

The following are the most active stocks for the after hours session:

iQIYI, Inc. (IQ) is +0.05 at $15.40, with 13,434,027 shares traded. IQ's current last sale is 69.06% of the target price of $22.3.

Ambev S.A. (ABEV) is +0.01 at $2.83, with 12,197,030 shares traded. ABEV's current last sale is 101.07% of the target price of $2.8.

Discovery, Inc. (DISCK) is unchanged at $33.08, with 8,106,570 shares traded. DISCK's current last sale is 76.93% of the target price of $43.

Discovery, Inc. (DISCA) is unchanged at $38.38, with 3,774,240 shares traded. DISCA's current last sale is 95.95% of the target price of $40.

Annaly Capital Management Inc (NLY) is unchanged at $8.84, with 3,258,155 shares traded. As reported by Zacks, the current mean recommendation for NLY is in the ""buy range"".

Intel Corporation (INTC) is +0.14 at $64.33, with 3,193,914 shares traded. Over the last four weeks they have had 11 up revisions for the earnings forecast, for the fiscal quarter ending Mar 2021. The consensus EPS forecast is $1.15. INTC's current last sale is 95.3% of the target price of $67.5.

Apple Inc. (AAPL) is +0.15 at $132.18, with 2,801,127 shares traded. As reported by Zacks, the current mean recommendation for AAPL is in the ""buy range"".

AGNC Investment Corp. (AGNC) is +0.015 at $17.37, with 2,105,775 shares traded., following a 52-week high recorded in today's regular session.

General Motors Company (GM) is -0.05 at $58.43, with 1,696,977 shares traded. As reported by Zacks, the current mean recommendation for GM is in the ""buy range"".

Schlumberger N.V. (SLB) is -0.01 at $27.30, with 1,693,811 shares traded. Over the last four weeks they have had 3 up revisions for the earnings forecast, for the fiscal quarter ending Dec 2021. The consensus EPS forecast is $0.32. As reported by Zacks, the current mean recommendation for SLB is in the ""buy range"".

Ally Financial Inc. (ALLY) is unchanged at $47.75, with 1,672,891 shares traded. Over the last four weeks they have had 3 up revisions for the earnings forecast, for the fiscal quarter ending Mar 2021. The consensus EPS forecast is $1.13. ALLY is scheduled to provide an earnings report on 4/16/2021, for the fiscal quarter ending Mar2021. The consensus earnings per share forecast is 1.13 per share, which represents a -44 percent increase over the EPS one Year Ago

Ajax I (AJAX) is -0.03 at $10.08, with 1,577,401 shares traded.
The views and opinions expressed herein are the views and opinions of the author and do not necessarily reflect those of Nasdaq, Inc.","Intel Corporation (INTC) is +0.14 at $64.33, with 3,193,914 shares traded. INTC's current last sale is 95.3% of the target price of $67.5. Over the last four weeks they have had 11 up revisions for the earnings forecast, for the fiscal quarter ending Mar 2021.","Intel Corporation (INTC) is +0.14 at $64.33, with 3,193,914 shares traded. INTC's current last sale is 95.3% of the target price of $67.5. Over the last four weeks they have had 11 up revisions for the earnings forecast, for the fiscal quarter ending Mar 2021.","Intel Corporation (INTC) is +0.14 at $64.33, with 3,193,914 shares traded. INTC's current last sale is 95.3% of the target price of $67.5. The total After hours volume is currently 94,987,350 shares traded.","Intel Corporation (INTC) is +0.14 at $64.33, with 3,193,914 shares traded. INTC's current last sale is 95.3% of the target price of $67.5. The NASDAQ 100 After Hours Indicator is up 15.24 to 13,819.15.",2021,3
2021-04-14 00:00:00+00:00,"Dow Movers: JPM, GS",INTC,https://www.nasdaq.com/articles/dow-movers%3A-jpm-gs-2021-04-14,,,"In early trading on Wednesday, shares of Goldman Sachs Group topped the list of the day's best performing Dow Jones Industrial Average components, trading up 3.0%. Year to date, Goldman Sachs Group registers a 28.0% gain.
And the worst performing Dow component thus far on the day is JPMorgan Chase, trading down 1.3%. JPMorgan Chase & Co is showing a gain of 19.7% looking at the year to date performance.
Two other components making moves today are Intel, trading down 1.3%, and Caterpillar, trading up 1.8% on the day.
VIDEO: Dow Movers: JPM, GS
The views and opinions expressed herein are the views and opinions of the author and do not necessarily reflect those of Nasdaq, Inc.","Year to date, Goldman Sachs Group registers a 28.0% gain. And the worst performing Dow component thus far on the day is JPMorgan Chase, trading down 1.3%. JPMorgan Chase & Co is showing a gain of 19.7% looking at the year to date performance.","In early trading on Wednesday, shares of Goldman Sachs Group topped the list of the day's best performing Dow Jones Industrial Average components, trading up 3.0%. Year to date, Goldman Sachs Group registers a 28.0% gain. And the worst performing Dow component thus far on the day is JPMorgan Chase, trading down 1.3%.","In early trading on Wednesday, shares of Goldman Sachs Group topped the list of the day's best performing Dow Jones Industrial Average components, trading up 3.0%. And the worst performing Dow component thus far on the day is JPMorgan Chase, trading down 1.3%. Two other components making moves today are Intel, trading down 1.3%, and Caterpillar, trading up 1.8% on the day.","In early trading on Wednesday, shares of Goldman Sachs Group topped the list of the day's best performing Dow Jones Industrial Average components, trading up 3.0%. And the worst performing Dow component thus far on the day is JPMorgan Chase, trading down 1.3%. VIDEO: Dow Movers: JPM, GS The views and opinions expressed herein are the views and opinions of the author and do not necessarily reflect those of Nasdaq, Inc.",2021,3
2021-04-13 00:00:00+00:00,"Notable ETF Inflow Detected - QQQ, INTC, CMCSA, NFLX",INTC,https://www.nasdaq.com/articles/notable-etf-inflow-detected-qqq-intc-cmcsa-nflx-2021-04-13,,,"Looking today at week-over-week shares outstanding changes among the universe of ETFs covered at ETF Channel, one standout is the Invesco QQQ (Symbol: QQQ) where we have detected an approximate $1.9 billion dollar inflow -- that's a 1.2% increase week over week in outstanding units (from 482,300,000 to 488,050,000). Among the largest underlying components of QQQ, in trading today Intel Corp (Symbol: INTC) is off about 1.6%, Comcast Corp (Symbol: CMCSA) is up about 0.5%, and Netflix Inc (Symbol: NFLX) is higher by about 0.9%. For a complete list of holdings, visit the QQQ Holdings page » The chart below shows the one year price performance of QQQ, versus its 200 day moving average:
Looking at the chart above, QQQ's low point in its 52 week range is $203.63 per share, with $339.985 as the 52 week high point — that compares with a last trade of $339.24. Comparing the most recent share price to the 200 day moving average can also be a useful technical analysis technique -- learn more about the 200 day moving average ».
Free Report: Top 7%+ Dividends (paid monthly)
Exchange traded funds (ETFs) trade just like stocks, but instead of ''shares'' investors are actually buying and selling ''units''. These ''units'' can be traded back and forth just like stocks, but can also be created or destroyed to accommodate investor demand. Each week we monitor the week-over-week change in shares outstanding data, to keep a lookout for those ETFs experiencing notable inflows (many new units created) or outflows (many old units destroyed). Creation of new units will mean the underlying holdings of the ETF need to be purchased, while destruction of units involves selling underlying holdings, so large flows can also impact the individual components held within ETFs.
Click here to find out which 9 other ETFs had notable inflows »
The views and opinions expressed herein are the views and opinions of the author and do not necessarily reflect those of Nasdaq, Inc.","Among the largest underlying components of QQQ, in trading today Intel Corp (Symbol: INTC) is off about 1.6%, Comcast Corp (Symbol: CMCSA) is up about 0.5%, and Netflix Inc (Symbol: NFLX) is higher by about 0.9%. Looking today at week-over-week shares outstanding changes among the universe of ETFs covered at ETF Channel, one standout is the Invesco QQQ (Symbol: QQQ) where we have detected an approximate $1.9 billion dollar inflow -- that's a 1.2% increase week over week in outstanding units (from 482,300,000 to 488,050,000). These ''units'' can be traded back and forth just like stocks, but can also be created or destroyed to accommodate investor demand.","Among the largest underlying components of QQQ, in trading today Intel Corp (Symbol: INTC) is off about 1.6%, Comcast Corp (Symbol: CMCSA) is up about 0.5%, and Netflix Inc (Symbol: NFLX) is higher by about 0.9%. For a complete list of holdings, visit the QQQ Holdings page » The chart below shows the one year price performance of QQQ, versus its 200 day moving average: Looking at the chart above, QQQ's low point in its 52 week range is $203.63 per share, with $339.985 as the 52 week high point — that compares with a last trade of $339.24. Comparing the most recent share price to the 200 day moving average can also be a useful technical analysis technique -- learn more about the 200 day moving average ».","Among the largest underlying components of QQQ, in trading today Intel Corp (Symbol: INTC) is off about 1.6%, Comcast Corp (Symbol: CMCSA) is up about 0.5%, and Netflix Inc (Symbol: NFLX) is higher by about 0.9%. Looking today at week-over-week shares outstanding changes among the universe of ETFs covered at ETF Channel, one standout is the Invesco QQQ (Symbol: QQQ) where we have detected an approximate $1.9 billion dollar inflow -- that's a 1.2% increase week over week in outstanding units (from 482,300,000 to 488,050,000). For a complete list of holdings, visit the QQQ Holdings page » The chart below shows the one year price performance of QQQ, versus its 200 day moving average: Looking at the chart above, QQQ's low point in its 52 week range is $203.63 per share, with $339.985 as the 52 week high point — that compares with a last trade of $339.24.","Among the largest underlying components of QQQ, in trading today Intel Corp (Symbol: INTC) is off about 1.6%, Comcast Corp (Symbol: CMCSA) is up about 0.5%, and Netflix Inc (Symbol: NFLX) is higher by about 0.9%. Looking today at week-over-week shares outstanding changes among the universe of ETFs covered at ETF Channel, one standout is the Invesco QQQ (Symbol: QQQ) where we have detected an approximate $1.9 billion dollar inflow -- that's a 1.2% increase week over week in outstanding units (from 482,300,000 to 488,050,000). For a complete list of holdings, visit the QQQ Holdings page » The chart below shows the one year price performance of QQQ, versus its 200 day moving average: Looking at the chart above, QQQ's low point in its 52 week range is $203.63 per share, with $339.985 as the 52 week high point — that compares with a last trade of $339.24.",2021,3
2021-04-13 00:00:00+00:00,"Technology Sector Update for 04/13/2021: CDLX, INTC, MTLS, XLK, SOXX",INTC,https://www.nasdaq.com/articles/technology-sector-update-for-04-13-2021%3A-cdlx-intc-mtls-xlk-soxx-2021-04-13,,,"Technology stocks were advancing premarket Tuesday. The Technology Select Sector SPDR ETF (XLK) was 0.47% higher and the Semiconductor Sector Index Fund (SOXX) was recently advancing by 0.9%.
Cardlytics (CDLX) was up almost 6% after saying it plans to acquire customer data platform Bridg for about $350 million in cash, plus up to $100 million to $300 million in potential earnout payments.
Intel (INTC) is in discussions to begin making chips for carmakers to ease a shortage that has disrupted assembly lines at US automotive factories, Reuters reported, citing chief executive officer Pat Gelsinger as saying in an interview. Intel was marginally higher in recent trading.
Materialise (MTLS) purchased an option to buy New York-based Link3D Inc., a developer of additive workflow and manufacturing execution systems. Materialis was 0.2% higher.
The views and opinions expressed herein are the views and opinions of the author and do not necessarily reflect those of Nasdaq, Inc.","Intel (INTC) is in discussions to begin making chips for carmakers to ease a shortage that has disrupted assembly lines at US automotive factories, Reuters reported, citing chief executive officer Pat Gelsinger as saying in an interview. The Technology Select Sector SPDR ETF (XLK) was 0.47% higher and the Semiconductor Sector Index Fund (SOXX) was recently advancing by 0.9%. Materialise (MTLS) purchased an option to buy New York-based Link3D Inc., a developer of additive workflow and manufacturing execution systems.","Intel (INTC) is in discussions to begin making chips for carmakers to ease a shortage that has disrupted assembly lines at US automotive factories, Reuters reported, citing chief executive officer Pat Gelsinger as saying in an interview. The Technology Select Sector SPDR ETF (XLK) was 0.47% higher and the Semiconductor Sector Index Fund (SOXX) was recently advancing by 0.9%. Cardlytics (CDLX) was up almost 6% after saying it plans to acquire customer data platform Bridg for about $350 million in cash, plus up to $100 million to $300 million in potential earnout payments.","Intel (INTC) is in discussions to begin making chips for carmakers to ease a shortage that has disrupted assembly lines at US automotive factories, Reuters reported, citing chief executive officer Pat Gelsinger as saying in an interview. The Technology Select Sector SPDR ETF (XLK) was 0.47% higher and the Semiconductor Sector Index Fund (SOXX) was recently advancing by 0.9%. Cardlytics (CDLX) was up almost 6% after saying it plans to acquire customer data platform Bridg for about $350 million in cash, plus up to $100 million to $300 million in potential earnout payments.","Intel (INTC) is in discussions to begin making chips for carmakers to ease a shortage that has disrupted assembly lines at US automotive factories, Reuters reported, citing chief executive officer Pat Gelsinger as saying in an interview. The Technology Select Sector SPDR ETF (XLK) was 0.47% higher and the Semiconductor Sector Index Fund (SOXX) was recently advancing by 0.9%. Cardlytics (CDLX) was up almost 6% after saying it plans to acquire customer data platform Bridg for about $350 million in cash, plus up to $100 million to $300 million in potential earnout payments.",2021,4
