Date,Article_title,Stock_symbol,Url,Publisher,Author,Article,Lsa_summary,Luhn_summary,Textrank_summary,Lexrank_summary,Year,sentiment_score
2021-10-04 00:00:00+00:00,"GlobalFoundries shows revenue jump, smaller loss in U.S. IPO paperwork",INTC,https://www.nasdaq.com/articles/globalfoundries-shows-revenue-jump-smaller-loss-in-u.s.-ipo-paperwork-2021-10-04,,,"By Niket Nishant and Anirban Sen
Oct 4 (Reuters) - Chipmaker GlobalFoundries revealed a jump in revenue in its filing for a stock market flotation, setting the stage for a blockbuster finish to a record year for initial public offerings in the United States.
GlobalFoundries, which is owned by Abu Dhabi's sovereign wealth fund Mubadala Investment Co, has not set terms for its listing yet, but it could seek a valuation of about $25 billion, Reuters first reported in August.
The IPO, one of the most hotly anticipated deals of the year, is expected to round out a record year for flotations, after several other big names such as Robinhood Markets Inc HOOD.O, Coinbase Global Inc COIN.O and Roblox Corp RBLX.N capitalized on the capital markets boom earlier in 2021.
Alongside electric-vehicle maker Rivian's stock market debut, GlobalFoundries is expected to headline an unusually crowded year-end IPO schedule, as companies look to make the most of sky-high investor appetite for listings of high-growth tech companies.
During the pandemic, the broader industry that includes automakers and electronics producers has been crimped by a global shortage of chips, which has fuelled manufacturing delays.
GlobalFoundries' revenue had been in decline since 2018, but over the past 12 months its growth rebounded as worldwide demand for chips sky-rocketed.
""Although the supply-demand imbalance is expected to improve over the medium-term, the semiconductor industry will require a significant increase in investment to keep up with demand,"" GlobalFoundries said in the filing. (https://bit.ly/2YgEJuh)
The chipmaker has been consolidating its product lines and announced plans to expand into new factories in the U.S. and Singapore. GlobalFoundries plans to build a second factory near its Malta, New York, headquarters, and spend $1 billion to boost output.
The company's net revenue for the six months ended June 30 was $3.04 billion, up nearly 13% from a year earlier. Net loss in the same period narrowed to $301 million, from $534 million a year earlier.
GlobalFoundries was created when Mubadala bought Advanced Micro Devices Inc's AMD.O manufacturing facilities in 2009, and later merged it with Singapore's Chartered Semiconductor Manufacturing Ltd.
The company, which makes radio-frequency communications chips for 5G, automotive, and other specialized semiconductors, counts Advanced Micro Devices and Broadcom Inc AVGO.O among its customers.
GlobalFoundries was initially targeting a listing in late 2022 or early 2023, but moved up the timetable to capitalize on the current IPO boom, people familiar with the matter said.
TAKEOVER TARGET
GlobalFoundries' decision to file for an IPO is a clear sign that it is not eager to accept a potential merger with Intel Corp or other potential buyers during the current chip boom.
The Wall Street Journal reported in July that Intel Corp INTC.O was weighing a buyout of GlobalFoundries. It stopped short of making a formal offer, Reuters reported in August.
GlobalFoundries was concerned such a tie-up would upset some of its key customers that are Intel's rivals, Reuters previously reported.
GlobalFoundries is the world's third-largest foundry by revenue behind Taiwan Semiconductor Manufacturing Co Ltd 2330.TW and Samsung Electronics Co Ltd 005930.KS, but ranks second when factoring out Samsung's foundry business that makes chips for other elements of the South Korean firm.
The U.S.-based chipmaker, which has invested about $23 billion to build five manufacturing facilities across three continents since the company was started in 2009, has about 10,000 patents, according to its filing.
GlobalFoundries plans to list on the Nasdaq under the symbol ""GFS"".
Morgan Stanley, BofA Securities, J.P. Morgan, Citigroup and Credit Suisse are the lead underwriters for the IPO.
(Reporting by Niket Nishant and Noor Zainab Hussain in Bengaluru and Krystal Hu in New York; Writing by Anirban Sen; Editing by Shounak Dasgupta)
((Niket.Nishant@thomsonreuters.com))
The views and opinions expressed herein are the views and opinions of the author and do not necessarily reflect those of Nasdaq, Inc.","The Wall Street Journal reported in July that Intel Corp INTC.O was weighing a buyout of GlobalFoundries. By Niket Nishant and Anirban Sen Oct 4 (Reuters) - Chipmaker GlobalFoundries revealed a jump in revenue in its filing for a stock market flotation, setting the stage for a blockbuster finish to a record year for initial public offerings in the United States. GlobalFoundries, which is owned by Abu Dhabi's sovereign wealth fund Mubadala Investment Co, has not set terms for its listing yet, but it could seek a valuation of about $25 billion, Reuters first reported in August.","The Wall Street Journal reported in July that Intel Corp INTC.O was weighing a buyout of GlobalFoundries. By Niket Nishant and Anirban Sen Oct 4 (Reuters) - Chipmaker GlobalFoundries revealed a jump in revenue in its filing for a stock market flotation, setting the stage for a blockbuster finish to a record year for initial public offerings in the United States. The IPO, one of the most hotly anticipated deals of the year, is expected to round out a record year for flotations, after several other big names such as Robinhood Markets Inc HOOD.O, Coinbase Global Inc COIN.O and Roblox Corp RBLX.N capitalized on the capital markets boom earlier in 2021.","The Wall Street Journal reported in July that Intel Corp INTC.O was weighing a buyout of GlobalFoundries. By Niket Nishant and Anirban Sen Oct 4 (Reuters) - Chipmaker GlobalFoundries revealed a jump in revenue in its filing for a stock market flotation, setting the stage for a blockbuster finish to a record year for initial public offerings in the United States. Alongside electric-vehicle maker Rivian's stock market debut, GlobalFoundries is expected to headline an unusually crowded year-end IPO schedule, as companies look to make the most of sky-high investor appetite for listings of high-growth tech companies.","The Wall Street Journal reported in July that Intel Corp INTC.O was weighing a buyout of GlobalFoundries. GlobalFoundries plans to build a second factory near its Malta, New York, headquarters, and spend $1 billion to boost output. The company's net revenue for the six months ended June 30 was $3.04 billion, up nearly 13% from a year earlier.",2021,3
2021-10-04 00:00:00+00:00,Nvidia Commands Respect on Wall Street,INTC,https://www.nasdaq.com/articles/nvidia-commands-respect-on-wall-street-2021-10-04,,,"InvestorPlace - Stock Market News, Stock Advice & Trading Tips
September brought about a 12% correction in Nvidia (NASDAQ:NVDA) stock. That merely reverted it back to the neckline from which it broke out a month ago. Overall, it is still outperforming its two major stock rivals. Advanced Micro Devices (NASDAQ:AMD) and Intel (NASDAQ:INTC) have already given back 20% from their recent highs.
NVDA) logo on wall"" width=""300"" height=""169"">
Source: JHVEPhoto / Shutterstock.com
My thesis today is that the bulls have a short-term opportunity. Also, that there is no need to panic out of NVDA stock for the long term. However, I acknowledge that it is occasionally vulnerable because of how fast it rallied to these levels.
Losing that much in NVDA stock does not guarantee it can’t fall further. The stock broke out in a 40% rally from June. Therefore, there’s still room to give back some, but not alone. I doubt that it will correct without the markets in general also faltering.
If the equity markets hold up, this one will continue to shine
Pace-Setter Role
Source: Charts by TradingView
Consensus is that fundamentally this is the pacesetter of the group. The whole sector is under pressure from supply constraints, yet the VanEck vectors semiconductor ETF (NASDAQ:SMH) is up almost 50% in one year. Nvidia stock constitutes 10% of the SMH and it’s up 20% more. AMD is also up but only half as much, like the S&P 500. INTC lags far behind in single digits.
7 Best Dividend Stocks to Buy for October
Clearly, investors perceive NVDA as the cream of the crop. It makes for a long-term investment thesis but not with a full-size position starting now. Building it over time makes sense, or actively trading around the edges shorter term.
Both strategies work in spite of what some experts might try to tell you. In theory, buying and holding forever works. Don’t take my word for it, NVDA stock is up 1,400% in five years.
Since this is a momentum stock, skillful short-term investors have dozens of opportunities to profit from big rallies and corrections.
What makes sense is a strategy that blends both without taking obvious excessive risks. Chasing a rally late opens the investor to potential immediate losses. In this case, the stock has already given back the mid-August rally. The risk of being too late has greatly diminished. There is room for it to fall into $190, which would make for excellent starting zone throughout. These have served as baselines for two rallies of 15% or more.
Every prior breakout line presents an opportunity for the bulls to find support on the way down. There was a significant one in June but far below price at $160 per share. I never say never because stocks fall even if not through their own fault. Meaning it might be inconceivable for Nvidia stock to correct another 15%, but it could happen with the right circumstances.
NVDA Stock Thesis
My overall assumption is still bullish on the markets, so I expect Nvidia to find footing. My conviction level is medium just because of extrinsic reasons. I don’t believe that the world has a good handle on its current macroeconomic fundamentals. There are too many new situations, especially from experimental monetary policies.
In other words, the experts are not really that. They might know a lot, but no one has seen this scenario before. I am conscious that I don’t know what I don’t know, so I should be cautious. The cliche statement of “cautiously optimistic” fits perfectly here.
The recent round of earnings reports were mostly strong. The negative stock reactions came in spite of that because of unrealistic expectations. The ongoing correction in the markets is somewhat worrisome, but it’s not yet an absolute top yet.
With so much stimulus money floating around, it will continue to work for a while longer past the Federal Reserve’s taper. Besides, the Fed suggested that they are still our friend. If the markets get in trouble, they will step back into it.
Valuation is not a concern even though NVDA stock is not cheap. It doesn’t need to be for as long as management is delivering rapid growth. Even then, profitability is also improving. Critics should not fault it for carrying a premium versus its competitors. If the stock markets are higher in the future, this one is also winning.
On the date of publication, Nicolas Chahine did not have (either directly or indirectly) any positions in the securities mentioned in this article. The opinions expressed in this article are those of the writer, subject to the InvestorPlace.com Publishing Guidelines.
Nicolas Chahine is the managing director of SellSpreads.com.
The post Nvidia Commands Respect on Wall Street appeared first on InvestorPlace.
The views and opinions expressed herein are the views and opinions of the author and do not necessarily reflect those of Nasdaq, Inc.","Advanced Micro Devices (NASDAQ:AMD) and Intel (NASDAQ:INTC) have already given back 20% from their recent highs. INTC lags far behind in single digits. If the equity markets hold up, this one will continue to shine Pace-Setter Role Source: Charts by TradingView Consensus is that fundamentally this is the pacesetter of the group.","Advanced Micro Devices (NASDAQ:AMD) and Intel (NASDAQ:INTC) have already given back 20% from their recent highs. INTC lags far behind in single digits. InvestorPlace - Stock Market News, Stock Advice & Trading Tips September brought about a 12% correction in Nvidia (NASDAQ:NVDA) stock.","Advanced Micro Devices (NASDAQ:AMD) and Intel (NASDAQ:INTC) have already given back 20% from their recent highs. INTC lags far behind in single digits. InvestorPlace - Stock Market News, Stock Advice & Trading Tips September brought about a 12% correction in Nvidia (NASDAQ:NVDA) stock.","Advanced Micro Devices (NASDAQ:AMD) and Intel (NASDAQ:INTC) have already given back 20% from their recent highs. INTC lags far behind in single digits. InvestorPlace - Stock Market News, Stock Advice & Trading Tips September brought about a 12% correction in Nvidia (NASDAQ:NVDA) stock.",2021,2
2021-10-04 00:00:00+00:00,Here's Why the Chip Shortage May Hurt Chipmakers Like NXP and TSMC in 2023,INTC,https://www.nasdaq.com/articles/heres-why-the-chip-shortage-may-hurt-chipmakers-like-nxp-and-tsmc-in-2023-2021-10-04,,,"On the off chance that you're unaware, the world is in the grips of a microchip shortage. Technology-intensive goods ranging from automobiles to smartphones to solar panels (just to name a few) are being adversely impact by the supply crunch. Semiconductor manufacturers like Intel (NASDAQ: INTC) and NXP Semiconductors (NASDAQ: NXPI) are working hard to catch up with demand, including investing in new production capacity. But it's still not been enough. The end result? Microchip makers can pretty much charge whatever they want for their wares, yet revenue is still crimped by a lack of inventory.
The response to the supply shortage, however, could be setting up a huge future problem that's difficult to see in the present. Namely, the massive investments being made in greater production potential right now set the stage for a price-killing chip glut in 2023.
Image source: Getty Images.
A self-induced glut awaits
That's the argument being made by technology market research outfit IDC, anyway. Late last month the company said this year's likely 17.3% growth of the undersupplied semiconductor market would ""normalize and balance"" by mid-2022. Then, in 2023, there's a ""potential for overcapacity"" as ""larger scale capacity expansions begin to come online toward the end of 2022.""
It admittedly sounds a bit insane, given the current environment and shortage rhetoric. But know that IDC isn't the only organization warning the world of this possibility. Bond and equity markets research name Moody's is worried too. In August a report published by Moody's on the matter explained, ""The [Chinese] government's semiconductor industry investment plans could lead to fierce competition, resulting in overcapacity of certain types [of chips]."" That report went on to warn that ""overcapacity is a particular risk at the fabrication stage as a result of the large amount of capital spending needed to set up fabrication plants.""
Although Moody's specifically pointed to China's role in expanding the industry's output, it's hardly going to be solely responsible for any oversupply issue. Intel is spending $20 billion to build two new semiconductor foundries in Arizona and has earmarked nearly $100 billion to expand its chipmaking capacity in Europe. Taiwan Semiconductor Manufacturing (NYSE: TSM) is planning to spend $100 billion over the course of the next three years to beef up its output volume. Samsung (OTC: SSNLF) is ponying up more than $200 billion to expand its capacity.
At least one big name in the industry may somewhat see the prospective problem, however.
That name is Texas Instruments (NASDAQ: TXN). Its third-quarter guidance issued as part of its second-quarter report posted back in July wasn't exactly better than expected. More notably, although the company already has a great deal of production capacity, Q3's revenue guidance of between $4.40 billion to $4.76 billion isn't remarkably better -- given the high-demand and COVID-crimped supply at the time -- than last year's Q3 revenue of $3.82 billion. The outlook loosely suggests the headwind is already starting to blow. As Raymond James analyst Chris Caso put it, ""management likely suffers from a lack of confidence at the macro level, despite what clearly continues to be tight supply conditions,"" perhaps articulating the impending challenge in a way that Texas Instruments itself couldn't.
Think ahead, because stock prices are forward-looking
OK, fine. Too much semiconductor manufacturing capacity is on the horizon, but it won't be a problem for at least a year, and possibly two years. These names are poised to perform well in the meantime, right?
Maybe. Or maybe not.
While the demand is clearly solid and the need for chips isn't likely to ebb anytime soon, the stock market doesn't operate so straightforwardly. It's predictive in nature, meaning stocks have a way of reflecting what's likely to happen in the future as much as (if not more than) what's happening in the present.
And there's the rub. A chip glut is probably part of our foreseeable future, even if we don't know exactly when it will become readily evident. IDC reckons equilibrium will be found sometime next year, but a year is a long time. Investors as a group could see that writing on the wall anytime between now and then, and start repricing these stocks accordingly.
Bottom line? This isn't a call to sell any and all foundry/fab names right now, to be clear. It is a suggestion, however, to go ahead and put this brewing headwind on your mental radars. Once it starts to blow against these stocks, it could stiffen in a hurry.
10 stocks we like better than Intel
When our award-winning analyst team has a stock tip, it can pay to listen. After all, the newsletter they have run for over a decade, Motley Fool Stock Advisor, has tripled the market.*
They just revealed what they believe are the ten best stocks for investors to buy right now... and Intel wasn't one of them! That's right -- they think these 10 stocks are even better buys.
See the 10 stocks
*Stock Advisor returns as of September 17, 2021
James Brumley has no position in any of the stocks mentioned. The Motley Fool owns shares of and recommends Moodys, Taiwan Semiconductor Manufacturing, and Texas Instruments. The Motley Fool recommends Intel and NXP Semiconductors and recommends the following options: long January 2023 $57.50 calls on Intel and short January 2023 $57.50 puts on Intel. The Motley Fool has a disclosure policy.
The views and opinions expressed herein are the views and opinions of the author and do not necessarily reflect those of Nasdaq, Inc.","Semiconductor manufacturers like Intel (NASDAQ: INTC) and NXP Semiconductors (NASDAQ: NXPI) are working hard to catch up with demand, including investing in new production capacity. In August a report published by Moody's on the matter explained, ""The [Chinese] government's semiconductor industry investment plans could lead to fierce competition, resulting in overcapacity of certain types [of chips]."" Although Moody's specifically pointed to China's role in expanding the industry's output, it's hardly going to be solely responsible for any oversupply issue.","Semiconductor manufacturers like Intel (NASDAQ: INTC) and NXP Semiconductors (NASDAQ: NXPI) are working hard to catch up with demand, including investing in new production capacity. The Motley Fool owns shares of and recommends Moodys, Taiwan Semiconductor Manufacturing, and Texas Instruments. The Motley Fool recommends Intel and NXP Semiconductors and recommends the following options: long January 2023 $57.50 calls on Intel and short January 2023 $57.50 puts on Intel.","Semiconductor manufacturers like Intel (NASDAQ: INTC) and NXP Semiconductors (NASDAQ: NXPI) are working hard to catch up with demand, including investing in new production capacity. More notably, although the company already has a great deal of production capacity, Q3's revenue guidance of between $4.40 billion to $4.76 billion isn't remarkably better -- given the high-demand and COVID-crimped supply at the time -- than last year's Q3 revenue of $3.82 billion. Too much semiconductor manufacturing capacity is on the horizon, but it won't be a problem for at least a year, and possibly two years.","Semiconductor manufacturers like Intel (NASDAQ: INTC) and NXP Semiconductors (NASDAQ: NXPI) are working hard to catch up with demand, including investing in new production capacity. More notably, although the company already has a great deal of production capacity, Q3's revenue guidance of between $4.40 billion to $4.76 billion isn't remarkably better -- given the high-demand and COVID-crimped supply at the time -- than last year's Q3 revenue of $3.82 billion. Too much semiconductor manufacturing capacity is on the horizon, but it won't be a problem for at least a year, and possibly two years.",2021,2
