Date,Article_title,Stock_symbol,Url,Publisher,Author,Article,Lsa_summary,Luhn_summary,Textrank_summary,Lexrank_summary,Year,sentiment_score
2021-04-12 00:00:00+00:00,Why NVIDIA Stock Climbed While Intel and AMD Dipped Today,INTC,https://www.nasdaq.com/articles/why-nvidia-stock-climbed-while-intel-and-amd-dipped-today-2021-04-12,,,"What happened
Shares of NVIDIA (NASDAQ: NVDA) climbed today while shares of rivals Intel (NASDAQ: INTC) and AMD (NASDAQ: AMD) dipped after NVIDIA unveiled a new CPU that will put competitive pressure on the latter companies in the important market for data center processors. As of 3:15 p.m. EDT, here's where all three semiconductor stocks were trading:
NVIDIA: Up 6%.
Intel: Down 5%.
AMD: Down 5%.
So what
NVIDIA kicked off its annual GPU Technology Conference (GTC) today with a slew of announcements, but the unveiling of a new CPU easily stole the show as the most meaningful new product. The company has long specialized primarily in GPUs instead of CPUs, and NVIDIA's prior efforts to develop CPUs have been lackluster. NVIDIA used to make Tegra processors for mobile devices, and it discontinued the Project Denver CPU core several years ago.
Image source: NVIDIA.
The company has now detailed a new chip called the NVIDIA Grace CPU, which is designed specifically to cater to the needs of the data center market. NVIDIA's GPUs have already been making inroads in data centers, powering cloud-based artificial intelligence (AI) workloads and other high-performance computing (HPC) applications. NVIDIA says Grace will deliver massive 10-time performance gains on servers for complex AI and HPC tasks.
The Grace chip, named after renowned computer scientist Grace Hopper, is built using Arm's high-efficiency architecture to enable that performance while using relatively less energy. NVIDIA is currently in the process of trying to acquire Arm, the British chip company that designs the architecture that nearly all mobile devices use, from Softbank for $40 billion in a deal that could reshape the chip industry.
""Leading-edge AI and data science are pushing today's computer architecture beyond its limits – processing unthinkable amounts of data,"" NVIDIA CEO Jensen Huang said in a statement. ""Using licensed Arm IP, NVIDIA has designed Grace as a CPU specifically for giant-scale AI and HPC.""
The data center market has become increasingly important to NVIDIA's fortunes, with that business generating $6.7 billion in revenue last fiscal year. The segment is NVIDIA's fastest-growing business, with sales jumping 124% in fiscal 2021 while the core gaming business grew by a relatively more modest 41% to $7.76 billion.
Now what
Grace represents a significant competitive threat to Intel and AMD. Intel has long dominated the market for data center processors, and its Data Center Group (DCG) is among its most profitable businesses, generating $10.6 billion in operating profits in 2020. But DCG revenue declined 16% in the fourth quarter as rivals like AMD have been chipping away at Intel's market share.
The volume of data that needs to be processed in the age of AI and HPC is massive and growing exponentially, and NVIDIA believes it has the best chip for the job.
10 stocks we like better than NVIDIA
When investing geniuses David and Tom Gardner have a stock tip, it can pay to listen. After all, the newsletter they have run for over a decade, Motley Fool Stock Advisor, has tripled the market.*
David and Tom just revealed what they believe are the ten best stocks for investors to buy right now... and NVIDIA wasn't one of them! That's right -- they think these 10 stocks are even better buys.
See the 10 stocks
*Stock Advisor returns as of February 24, 2021
Evan Niu, CFA has no position in any of the stocks mentioned. The Motley Fool owns shares of and recommends NVIDIA. The Motley Fool recommends Intel and recommends the following options: long January 2023 $57.5 calls on Intel and short January 2023 $57.5 puts on Intel. The Motley Fool has a disclosure policy.
The views and opinions expressed herein are the views and opinions of the author and do not necessarily reflect those of Nasdaq, Inc.","What happened Shares of NVIDIA (NASDAQ: NVDA) climbed today while shares of rivals Intel (NASDAQ: INTC) and AMD (NASDAQ: AMD) dipped after NVIDIA unveiled a new CPU that will put competitive pressure on the latter companies in the important market for data center processors. So what NVIDIA kicked off its annual GPU Technology Conference (GTC) today with a slew of announcements, but the unveiling of a new CPU easily stole the show as the most meaningful new product. NVIDIA used to make Tegra processors for mobile devices, and it discontinued the Project Denver CPU core several years ago.","What happened Shares of NVIDIA (NASDAQ: NVDA) climbed today while shares of rivals Intel (NASDAQ: INTC) and AMD (NASDAQ: AMD) dipped after NVIDIA unveiled a new CPU that will put competitive pressure on the latter companies in the important market for data center processors. The data center market has become increasingly important to NVIDIA's fortunes, with that business generating $6.7 billion in revenue last fiscal year. The Motley Fool recommends Intel and recommends the following options: long January 2023 $57.5 calls on Intel and short January 2023 $57.5 puts on Intel.","What happened Shares of NVIDIA (NASDAQ: NVDA) climbed today while shares of rivals Intel (NASDAQ: INTC) and AMD (NASDAQ: AMD) dipped after NVIDIA unveiled a new CPU that will put competitive pressure on the latter companies in the important market for data center processors. The company has now detailed a new chip called the NVIDIA Grace CPU, which is designed specifically to cater to the needs of the data center market. Intel has long dominated the market for data center processors, and its Data Center Group (DCG) is among its most profitable businesses, generating $10.6 billion in operating profits in 2020.","What happened Shares of NVIDIA (NASDAQ: NVDA) climbed today while shares of rivals Intel (NASDAQ: INTC) and AMD (NASDAQ: AMD) dipped after NVIDIA unveiled a new CPU that will put competitive pressure on the latter companies in the important market for data center processors. NVIDIA is currently in the process of trying to acquire Arm, the British chip company that designs the architecture that nearly all mobile devices use, from Softbank for $40 billion in a deal that could reshape the chip industry. The volume of data that needs to be processed in the age of AI and HPC is massive and growing exponentially, and NVIDIA believes it has the best chip for the job.",2021,2
2021-04-12 00:00:00+00:00,"After Hours Most Active for Apr 12, 2021 : AAPL, VIAC, VICI, DISCK, VIPS, KMI, INTC, XOM, BP, BABA, IQ, MSFT",INTC,https://www.nasdaq.com/articles/after-hours-most-active-for-apr-12-2021-%3A-aapl-viac-vici-disck-vips-kmi-intc-xom-bp-baba,,,"The NASDAQ 100 After Hours Indicator is up 7.99 to 13,827.34. The total After hours volume is currently 87,968,480 shares traded.

The following are the most active stocks for the after hours session:

Apple Inc. (AAPL) is +0.0001 at $131.24, with 5,703,641 shares traded. As reported by Zacks, the current mean recommendation for AAPL is in the ""buy range"".

ViacomCBS Inc. (VIAC) is +0.03 at $39.80, with 5,054,051 shares traded. VIAC's current last sale is 82.06% of the target price of $48.5.

VICI Properties Inc. (VICI) is -0.0599 at $28.58, with 4,357,579 shares traded. As reported by Zacks, the current mean recommendation for VICI is in the ""buy range"".

Discovery, Inc. (DISCK) is unchanged at $35.01, with 4,102,966 shares traded. DISCK's current last sale is 81.42% of the target price of $43.

Vipshop Holdings Limited (VIPS) is +0.11 at $26.52, with 3,234,639 shares traded. As reported by Zacks, the current mean recommendation for VIPS is in the ""buy range"".

Kinder Morgan, Inc. (KMI) is -0.05 at $16.45, with 2,819,773 shares traded. KMI's current last sale is 96.76% of the target price of $17.

Intel Corporation (INTC) is +0.005 at $65.41, with 2,674,471 shares traded. Over the last four weeks they have had 11 up revisions for the earnings forecast, for the fiscal quarter ending Mar 2021. The consensus EPS forecast is $1.15. INTC's current last sale is 96.9% of the target price of $67.5.

Exxon Mobil Corporation (XOM) is -0.05 at $55.45, with 2,626,712 shares traded. Over the last four weeks they have had 3 up revisions for the earnings forecast, for the fiscal quarter ending Mar 2021. The consensus EPS forecast is $0.59. XOM's current last sale is 100.82% of the target price of $55.

BP p.l.c. (BP) is +0.01 at $24.63, with 2,529,855 shares traded. BP's current last sale is 87.96% of the target price of $28.

Alibaba Group Holding Limited (BABA) is -0.16 at $243.85, with 2,503,683 shares traded. As reported by Zacks, the current mean recommendation for BABA is in the ""buy range"".

iQIYI, Inc. (IQ) is +0.09 at $16.25, with 2,423,800 shares traded. IQ's current last sale is 72.87% of the target price of $22.3.

Microsoft Corporation (MSFT) is -0.02 at $255.89, with 1,920,582 shares traded. MSFT's current last sale is 93.05% of the target price of $275.
The views and opinions expressed herein are the views and opinions of the author and do not necessarily reflect those of Nasdaq, Inc.","Intel Corporation (INTC) is +0.005 at $65.41, with 2,674,471 shares traded. INTC's current last sale is 96.9% of the target price of $67.5. Over the last four weeks they have had 11 up revisions for the earnings forecast, for the fiscal quarter ending Mar 2021.","Intel Corporation (INTC) is +0.005 at $65.41, with 2,674,471 shares traded. INTC's current last sale is 96.9% of the target price of $67.5. As reported by Zacks, the current mean recommendation for AAPL is in the ""buy range"".","Intel Corporation (INTC) is +0.005 at $65.41, with 2,674,471 shares traded. INTC's current last sale is 96.9% of the target price of $67.5. The total After hours volume is currently 87,968,480 shares traded.","Intel Corporation (INTC) is +0.005 at $65.41, with 2,674,471 shares traded. INTC's current last sale is 96.9% of the target price of $67.5. The NASDAQ 100 After Hours Indicator is up 7.99 to 13,827.34.",2021,3
2021-04-12 00:00:00+00:00,Stock Market Today: Stocks Sag on Sleepy Monday (But the Alarm Is Set),INTC,https://www.nasdaq.com/articles/stock-market-today%3A-stocks-sag-on-sleepy-monday-but-the-alarm-is-set-2021-04-12,,,"The market stumbled out of the blocks this week, with the major indexes all logging modest declines on a Monday that was low on trading volume and slow on broader macro news.
Consider it the calm before the (potentially fruitful) storm.
SEE MORE 10 Stocks Warren Buffett Is Buying (And 11 He's Selling)
The first-quarter earnings season kicks off in earnest later this week, and it could be a big one.
""The outstanding fourth-quarter earnings season we had in 2020 is a tough act to follow, but 2021's first quarter has the makings of another potentially great earnings season,"" say LPL Financial strategists Jeffrey Buchbinder and Ryan Detrick. ""The reopening of the economy continues to move forward, and corporate America has done an excellent job managing through the pandemic. In fact, it won't take much of an upside surprise for year-over-year S&P 500 Index earnings growth to reach 30% this quarter.""
For today, however, declines in the energy (-0.8%) and technology (-0.5%) sectors weighed on the wider market, including a 0.2% loss for the Dow, which closed at 33,745.
Sign up for Kiplinger's FREE Closing Bell e-letter: Our daily look at the stock market's moves, and what moves investors should make.
Other action in thestock market today
The S&P 500 finished marginally lower to 4,127.
The Nasdaq Composite declined 0.4% to 13,850.
The small-cap Russell 2000 also fell 0.4% to finish at 2,233.
U.S. crude oil futures started the week higher, adding 38 cents, or 0.6%, to settle at $59.70 per barrel.
Gold futures fell $12.10, or 0.7%, to close at $1,732.70 an ounce.
The CBOE Volatility Index (VIX) jumped 2.2% to 17.05.
YCharts
Where the Market's Making Sparks
But even on a yawner like Monday, there's plenty for investors to pay attention to.
SEE MORE Hedge Funds' 25 Top Blue-Chip Stocks to Buy Now
For instance, Microsoft (MSFT, up marginally) advanced further into the health technology space by announcing a $16 billion all-cash deal for speech-recognition software company Nuance Communications (NUAN, +16.0%).
And an already firework-filled 2021 for semiconductor stocks became even more electric as Nvidia (NVDA, +5.6%) announced its first server CPUs – another shot across the bow of competitor Intel (INTC, -4.2%). The firm also says Q1 revenues are tracking above the $5.3 billion outlook it previously provided.
Also, a number of digital currencies headed higher ahead of Wednesday's public-market debut of Coinbase, which allows investors to buy and sell cryptocurrencies. That includes bitcoin, which at $60,068 is hovering near its all-time high of $61,712 set in March.
The offering is expected to further bolster individual and institutional interest – a key potential driver ofbitcoin pricesthat we highlighted in our annual outlook.
If you want to learn more ahead of what should be a busy week not just for stocks, but for digital currencies, check out our primer that answers common questions about bitcoin. Or, have a listen to our recent conversation with Onramp Invest CEO Tyrone Ross, who provides his expert insight into what bitcoin can be for investors and consumers alike.
Kyle Woodley was long NVDA as of this writing.
SEE MORE 21 Best Retirement Stocks for an Income-Rich 2021
The views and opinions expressed herein are the views and opinions of the author and do not necessarily reflect those of Nasdaq, Inc.","And an already firework-filled 2021 for semiconductor stocks became even more electric as Nvidia (NVDA, +5.6%) announced its first server CPUs – another shot across the bow of competitor Intel (INTC, -4.2%). The market stumbled out of the blocks this week, with the major indexes all logging modest declines on a Monday that was low on trading volume and slow on broader macro news. SEE MORE Hedge Funds' 25 Top Blue-Chip Stocks to Buy Now For instance, Microsoft (MSFT, up marginally) advanced further into the health technology space by announcing a $16 billion all-cash deal for speech-recognition software company Nuance Communications (NUAN, +16.0%).","And an already firework-filled 2021 for semiconductor stocks became even more electric as Nvidia (NVDA, +5.6%) announced its first server CPUs – another shot across the bow of competitor Intel (INTC, -4.2%). ""The outstanding fourth-quarter earnings season we had in 2020 is a tough act to follow, but 2021's first quarter has the makings of another potentially great earnings season,"" say LPL Financial strategists Jeffrey Buchbinder and Ryan Detrick. Sign up for Kiplinger's FREE Closing Bell e-letter: Our daily look at the stock market's moves, and what moves investors should make.","And an already firework-filled 2021 for semiconductor stocks became even more electric as Nvidia (NVDA, +5.6%) announced its first server CPUs – another shot across the bow of competitor Intel (INTC, -4.2%). The market stumbled out of the blocks this week, with the major indexes all logging modest declines on a Monday that was low on trading volume and slow on broader macro news. ""The outstanding fourth-quarter earnings season we had in 2020 is a tough act to follow, but 2021's first quarter has the makings of another potentially great earnings season,"" say LPL Financial strategists Jeffrey Buchbinder and Ryan Detrick.","And an already firework-filled 2021 for semiconductor stocks became even more electric as Nvidia (NVDA, +5.6%) announced its first server CPUs – another shot across the bow of competitor Intel (INTC, -4.2%). ""The outstanding fourth-quarter earnings season we had in 2020 is a tough act to follow, but 2021's first quarter has the makings of another potentially great earnings season,"" say LPL Financial strategists Jeffrey Buchbinder and Ryan Detrick. Sign up for Kiplinger's FREE Closing Bell e-letter: Our daily look at the stock market's moves, and what moves investors should make.",2021,2
2021-04-12 00:00:00+00:00,See Which Of The Latest 13F Filers Holds Intel,INTC,https://www.nasdaq.com/articles/see-which-of-the-latest-13f-filers-holds-intel-2021-04-12,,,"At Holdings Channel, we have reviewed the latest batch of the 25 most recent 13F filings for the 03/31/2021 reporting period, and noticed that Intel Corp (Symbol: INTC) was held by 19 of these funds. When hedge fund managers appear to be thinking alike, we find it is a good idea to take a closer look.
Before we proceed, it is important to point out that 13F filings do not tell the whole story, because these funds are only required to disclose their long positions with the SEC, but are not required to disclose their short positions. A fund making a bearish bet against a stock by shorting calls, for example, might also be long some amount of stock as they trade around their overall bearish position. This long component could show up in a 13F filing and everyone might assume the fund is bullish, but this tells only part of the story because the bearish/short side of the position is not seen.
Having given that caveat, we believe that looking at groups of 13F filings can be revealing, especially when comparing one holding period to another. Below, let's take a look at the change in INTC positions, for this latest batch of 13F filers:
FUND NEW POSITION? CHANGE IN SHARE COUNT CHANGE IN MARKET VALUE ($ IN 1000'S)
Wedge Capital Management L L P NC Existing +998,556 +$64,035
Investment Counsel Inc. Existing -3,450 +$829
CHICAGO TRUST Co NA Existing +3,723 +$1,142
FARMERS & MERCHANTS TRUST Co OF LONG BEACH Existing UNCH +$129
E&G Advisors LP Existing +69 +$188
Courier Capital LLC Existing -1,938 +$2,918
O Keefe Stevens Advisory Inc. Existing +39,550 +$3,174
Fulcrum Capital LLC Existing +1,001 +$147
Vanguard Capital Wealth Advisors Existing +73 +$765
Acropolis Investment Management LLC Existing +1,632 +$961
Founders Capital Management LLC Existing +3,610 +$3,903
Phoenix Wealth Advisors Existing +82 +$213
First National Bank Sioux Falls Existing +860 +$256
Grassi Investment Management Existing +15,900 +$1,133
Jackson Wealth Management LLC NEW +227,950 +$14,589
Highland Private Wealth Management Existing +370 +$258
Hemington Wealth Management NEW +4,332 +$277
Coastal Investment Advisors Inc. Existing +2,977 +$541
Livingston Group Asset Management CO operating as Southport Capital Management Existing -24,587 -$897
Aggregate Change: +1,270,710 +$94,561
In terms of shares owned, we count 13 of the above funds having increased existing INTC positions from 12/31/2020 to 03/31/2021, with 3 having decreased their positions and 2 new positions. Worth noting is that Hohimer Wealth Management LLC, included in this recent batch of 13F filers, exited INTC common stock as of 03/31/2021.
Looking beyond these particular funds in this one batch of most recent filers, we tallied up the INTC share count in the aggregate among all of the funds which held INTC at the 03/31/2021 reporting period (out of the 159 we looked at in total). We then compared that number to the sum total of INTC shares those same funds held back at the 12/31/2020 period, to see how the aggregate share count held by hedge funds has moved for INTC. We found that between these two periods, funds reduced their holdings by 317,847 shares in the aggregate, from 8,326,377 down to 8,008,530 for a share count decline of approximately -3.82%. The overall top three funds holding INTC on 03/31/2021 were:
» FUND SHARES OF INTC HELD
1. State of Alaska Department of Revenue 965,858
2. Park National Corp OH 811,927
3. Pacer Advisors Inc. 469,705
4-10 Find out the full Top 10 Hedge Funds Holding INTC »
We'll keep following the latest 13F filings by hedge fund managers and bring you interesting stories derived from a look at the aggregate information across groups of managers between filing periods. While looking at individual 13F filings can sometimes be misleading due to the long-only nature of the information, the sum total across groups of funds from one reporting period to another can be a lot more revealing and relevant, providing interesting stock ideas that merit further research, like Intel Corp (Symbol: INTC).
10 S&P 500 Components Hedge Funds Are Buying »
The views and opinions expressed herein are the views and opinions of the author and do not necessarily reflect those of Nasdaq, Inc.","At Holdings Channel, we have reviewed the latest batch of the 25 most recent 13F filings for the 03/31/2021 reporting period, and noticed that Intel Corp (Symbol: INTC) was held by 19 of these funds. Worth noting is that Hohimer Wealth Management LLC, included in this recent batch of 13F filers, exited INTC common stock as of 03/31/2021. While looking at individual 13F filings can sometimes be misleading due to the long-only nature of the information, the sum total across groups of funds from one reporting period to another can be a lot more revealing and relevant, providing interesting stock ideas that merit further research, like Intel Corp (Symbol: INTC).","At Holdings Channel, we have reviewed the latest batch of the 25 most recent 13F filings for the 03/31/2021 reporting period, and noticed that Intel Corp (Symbol: INTC) was held by 19 of these funds. Existing +2,977 +$541 Livingston Group Asset Management CO operating as Southport Capital Management Existing -24,587 -$897 Aggregate Change: +1,270,710 +$94,561 In terms of shares owned, we count 13 of the above funds having increased existing INTC positions from 12/31/2020 to 03/31/2021, with 3 having decreased their positions and 2 new positions. Below, let's take a look at the change in INTC positions, for this latest batch of 13F filers:","Existing +2,977 +$541 Livingston Group Asset Management CO operating as Southport Capital Management Existing -24,587 -$897 Aggregate Change: +1,270,710 +$94,561 In terms of shares owned, we count 13 of the above funds having increased existing INTC positions from 12/31/2020 to 03/31/2021, with 3 having decreased their positions and 2 new positions. Pacer Advisors Inc. 469,705 4-10 Find out the full Top 10 Hedge Funds Holding INTC » We'll keep following the latest 13F filings by hedge fund managers and bring you interesting stories derived from a look at the aggregate information across groups of managers between filing periods. At Holdings Channel, we have reviewed the latest batch of the 25 most recent 13F filings for the 03/31/2021 reporting period, and noticed that Intel Corp (Symbol: INTC) was held by 19 of these funds.","At Holdings Channel, we have reviewed the latest batch of the 25 most recent 13F filings for the 03/31/2021 reporting period, and noticed that Intel Corp (Symbol: INTC) was held by 19 of these funds. Existing +2,977 +$541 Livingston Group Asset Management CO operating as Southport Capital Management Existing -24,587 -$897 Aggregate Change: +1,270,710 +$94,561 In terms of shares owned, we count 13 of the above funds having increased existing INTC positions from 12/31/2020 to 03/31/2021, with 3 having decreased their positions and 2 new positions. Pacer Advisors Inc. 469,705 4-10 Find out the full Top 10 Hedge Funds Holding INTC » We'll keep following the latest 13F filings by hedge fund managers and bring you interesting stories derived from a look at the aggregate information across groups of managers between filing periods.",2021,4
