Date,Article_title,Stock_symbol,Url,Publisher,Author,Article,Lsa_summary,Luhn_summary,Textrank_summary,Lexrank_summary,Year,sentiment_score
2021-04-19 00:00:00+00:00,PREVIEW-Investors turn to growth stocks' results after strong earnings start,INTC,https://www.nasdaq.com/articles/preview-investors-turn-to-growth-stocks-results-after-strong-earnings-start-2021-04-19,,,"(Updates with IBM results after the bell, Netflix's YTD gain)
By Caroline Valetkevitch
NEW YORK, April 19 (Reuters) - On the heels of blockbuster earnings from major U.S. banks, investors are focused on whether an upcoming batch of earnings from major technology-related companies can sustain the season's early momentum.
Estimated year-over-year first-quarter earnings growth for S&P 500 companies rose to 31% from 25% in the past week, based on Refinitiv data, driven by last week's stronger-than-expected results from Wells Fargo & Co , Goldman Sachs Group Inc and other banks.
Tuesday brings results from stay-at-home winner Netflix Inc , which is part of the FAANG group of high-profile tech-related names. Chipmaker Intel Corp's results are due later this week.
After the bell Monday, shares of International Business Machines Corp were up more than 2% as the company resumed sales growth in the first quarter after a year of declines and beat Wall Street targets.
Earnings for the technology sector , which continued to grow last year while S&P 500 overall earnings dropped as the pandemic took its toll on businesses and consumers, are on track for 25% year-over-year growth in the first quarter.
But this year, tech is expected to lag profit growth of sectors that should benefit from the reopening of the economy, such as financials.
First-quarter profit growth for the S&P 500 financials sector , is now estimated at 116%, compared with 76% a week earlier.
""Every time we go to earnings, there's always the question of whether (tech) can keep delivering, especially in terms of guidance,"" said Quincy Krosby, chief market strategist at Prudential Financial in Newark, New Jersey.
""And they have,"" she said. ""What you are seeing is investors are prepared to have them - or some of them - in their portfolios along with cyclicals.""
To be sure, many strategists have been bullish on economically focused sectors, and U.S. technology and growth stocks have recently begun to gain again after months of being outpaced by economically sensitive names that appear to be a better value.
Netflix still lags the broader market. Its stock is up 2.5% so far in 2021 after gaining 67% in 2020, when consumers embraced at-home entertainment during the early pandemic lockdowns, but some analysts are optimistic Netflix's strong run is not over.
""It is reasonable to anticipate reduced engagement on the platform as the global economy reopens,"" Brian White, an internet and software analyst at Monness Crespi Hardt who recommends buying the stock, wrote in a recent note.
""However, this crisis has acted as a catalyst in introducing more consumers to the service and we believe this story has a long runway of growth in the coming years.""
The current cycle of rising chip demand is expected to help semiconductors, said Daniel Morgan, senior portfolio manager at Synovus Trust Company.
""Semiconductors are operating on all cylinders right now. They can't make them fast enough,"" he said.
Micron Technology Inc shares rose when it forecast quarterly revenue above Wall Street estimates due to a rise in demand for memory chips, thanks to 5G smartphones and artificial intelligence software.
As companies have more money to increase their technology spending, that will support tech companies as well.
""With tech, either way they win. They're really in a great position right now,"" Morgan said.
Microsoft Corp is expected to report April 27.
Rounding out the FAANG reports, Google parent Alphabet Inc , Apple Inc , Facebook Inc and Amazon.com Inc also are due to report results later this month.
(Reporting by Caroline Valetkevitch; Editing by Alden Bentley, Nick Zieminski and Richard Chang) ((caroline.valetkevitch@thomsonreuters.com; +1 646 223 6393; Reuters Messaging: caroline.valetkevitch.thomsonreuters.com@reuters.net)) Keywords: USA RESULTS/TECH (UPDATE 1, PREVIEW, PIX)
The views and opinions expressed herein are the views and opinions of the author and do not necessarily reflect those of Nasdaq, Inc.","After the bell Monday, shares of International Business Machines Corp were up more than 2% as the company resumed sales growth in the first quarter after a year of declines and beat Wall Street targets. ""It is reasonable to anticipate reduced engagement on the platform as the global economy reopens,"" Brian White, an internet and software analyst at Monness Crespi Hardt who recommends buying the stock, wrote in a recent note. Micron Technology Inc shares rose when it forecast quarterly revenue above Wall Street estimates due to a rise in demand for memory chips, thanks to 5G smartphones and artificial intelligence software.","Estimated year-over-year first-quarter earnings growth for S&P 500 companies rose to 31% from 25% in the past week, based on Refinitiv data, driven by last week's stronger-than-expected results from Wells Fargo & Co , Goldman Sachs Group Inc and other banks. To be sure, many strategists have been bullish on economically focused sectors, and U.S. technology and growth stocks have recently begun to gain again after months of being outpaced by economically sensitive names that appear to be a better value. Micron Technology Inc shares rose when it forecast quarterly revenue above Wall Street estimates due to a rise in demand for memory chips, thanks to 5G smartphones and artificial intelligence software.","(Updates with IBM results after the bell, Netflix's YTD gain) By Caroline Valetkevitch NEW YORK, April 19 (Reuters) - On the heels of blockbuster earnings from major U.S. banks, investors are focused on whether an upcoming batch of earnings from major technology-related companies can sustain the season's early momentum. Estimated year-over-year first-quarter earnings growth for S&P 500 companies rose to 31% from 25% in the past week, based on Refinitiv data, driven by last week's stronger-than-expected results from Wells Fargo & Co , Goldman Sachs Group Inc and other banks. Earnings for the technology sector , which continued to grow last year while S&P 500 overall earnings dropped as the pandemic took its toll on businesses and consumers, are on track for 25% year-over-year growth in the first quarter.","Earnings for the technology sector , which continued to grow last year while S&P 500 overall earnings dropped as the pandemic took its toll on businesses and consumers, are on track for 25% year-over-year growth in the first quarter. But this year, tech is expected to lag profit growth of sectors that should benefit from the reopening of the economy, such as financials. The current cycle of rising chip demand is expected to help semiconductors, said Daniel Morgan, senior portfolio manager at Synovus Trust Company.",2021,3
2021-04-19 00:00:00+00:00,[WATCH] 5 Stocks You Need to Know About This Week,INTC,https://www.nasdaq.com/articles/watch-5-stocks-you-need-to-know-about-this-week-2021-04-19,,,"In today's video, I look at five stocks reporting earnings this week and explain why investors should keep an eye on them, even if they don't own the stock. I also take a look at price targets for each stock.
The five stocks to watch:
IBM (NYSE: IBM) is reporting earnings on Monday after hours. Investors should keep an eye on IBM because it has seen growth in its cloud revenues. If it sees strong growth this quarter, it can give cloud investors insight into how the market is doing.
Netflix (NASDAQ: NFLX) is reporting earnings on Tuesday after hours. This will be the first quarter since vaccines started rolling out. Netflix subscription growth or decline can give investors insight into how stocks might do as the economy reopens.
Silvergate Capital Corp (NYSE: SI) is reporting earnings on Tuesday after hours. Silvergate develops solutions for many of the largest fintech and digital currency companies. With the continued momentum of cryptocurrency and the recent IPOs in the market, SI can offer insight into how some of the largest fintechs are moving toward cryptocurrency.
Snapchat (NYSE: SNAP) is reporting earnings on Thursday after hours. Snapchat gains most of its revenue from advertisements. These earnings can give insight into how advertisement-dependent companies might be doing.
Intel (NASDAQ: INTC) is reporting earnings on Thursday after hours. Intel may provide insight to semiconductor investors about how long the chip shortage might last.
Click the video below for my full thoughts.
*Stock Prices used were the closing prices of April 16, 2021. The video was published on April 18, 2021.

10 stocks we like better than Netflix
When investing geniuses David and Tom Gardner have a stock tip, it can pay to listen. After all, the newsletter they have run for over a decade, Motley Fool Stock Advisor, has tripled the market.*
David and Tom just revealed what they believe are the ten best stocks for investors to buy right now... and Netflix wasn't one of them! That's right -- they think these 10 stocks are even better buys.
See the 10 stocks
*Stock Advisor returns as of February 24, 2021

Jose Najarro has no position in any of the stocks mentioned. The Motley Fool owns shares of and recommends Netflix. The Motley Fool recommends Intel and recommends the following options: long January 2023 $57.5 calls on Intel and short January 2023 $57.5 puts on Intel. The Motley Fool has a disclosure policy. Jose is an affiliate of The Motley Fool and may be compensated for promoting its services. If you choose to subscribe through his link, he will earn some extra money that supports his channel. His opinions remain his own and are unaffected by The Motley Fool.
The views and opinions expressed herein are the views and opinions of the author and do not necessarily reflect those of Nasdaq, Inc.","Intel (NASDAQ: INTC) is reporting earnings on Thursday after hours. If it sees strong growth this quarter, it can give cloud investors insight into how the market is doing. Netflix subscription growth or decline can give investors insight into how stocks might do as the economy reopens.",Intel (NASDAQ: INTC) is reporting earnings on Thursday after hours. The five stocks to watch: IBM (NYSE: IBM) is reporting earnings on Monday after hours. Silvergate Capital Corp (NYSE: SI) is reporting earnings on Tuesday after hours.,"Intel (NASDAQ: INTC) is reporting earnings on Thursday after hours. In today's video, I look at five stocks reporting earnings this week and explain why investors should keep an eye on them, even if they don't own the stock. The five stocks to watch: IBM (NYSE: IBM) is reporting earnings on Monday after hours.","Intel (NASDAQ: INTC) is reporting earnings on Thursday after hours. In today's video, I look at five stocks reporting earnings this week and explain why investors should keep an eye on them, even if they don't own the stock. If it sees strong growth this quarter, it can give cloud investors insight into how the market is doing.",2021,3
2021-04-19 00:00:00+00:00,Raymond James: 2 Chip Giants to Buy Now (And 1 to Avoid),INTC,https://www.nasdaq.com/articles/raymond-james%3A-2-chip-giants-to-buy-now-and-1-to-avoid-2021-04-19,,,"Semiconductors are one of the modern world’s essential industries, making possible so much of what we rely on or take for granted: internet access, high-speed computers with high-speed memory, even the thermostats that control our air conditioning – there isn’t much, tech-wise, that doesn’t use semiconductor chips.
The global semiconductor chip market was valued at over $513 billion in 2019, and despite the worst the pandemic could do, the chip sector rose to $726 billion in 2020. It’s a market based on a near-limitless customer base; it’s estimated that 2.5 billion people own at least one smartphone. That’s 1 in 3 of the total world population, enough to ensure that demand for semiconductor chips will never slacken.
And with that background, Raymond James analyst Chris Caso sees two chip giant poised to make gains this year – but one that investors should avoid. Let's take a closer look.
Advanced Micro Devices (AMD)
The first chip stock we’ll look at, AMD, is consistently ranked among the top 20 largest chip makers – by sales – globally. The company held the fifteenth spot last year, with $9.76 billion in total revenues. That top line was up 45% from 2019, when AMD was ranked eighteenth. AMD’s position in the industry is based on its high-quality products, including microprocessors, motherboard chipsets, and graphics processors. AMD’s Ryzen Mobile 4000 chip was the first 7nm x86 processor on the market.
The chip company showed a solid second half in 2020, with revenues in Q3 and Q4 rapidly recovering the 1H20 dip and rising above 2019 level. Earnings in Q4 skyrocketed, growing from Q3’s 32 cents per share to an impressive $1.45 per share. For all of 2020, earnings came in at $2.06, compared to 30 cents for 2019. The strong second half pushed the full-year revenue to a company record, on the strength of expanding demand in the PC, gaming, and data center markets.
AMD’s prospects have attracted Raymond James’ Chris Caso, who compares the company favorably to competitor Intel.
“We are using the pullback since the start of the year to get involved with AMD, which we expect to be a secular winner due to what we believe to be a durable technical advantage vs. Intel. We think the stock’s pullback has been driven by improved sentiment that Intel will solve their manufacturing challenges, which will reverse AMD’s successes. We’re taking the other side of that view,"" the 5-star analyst noted.
Caso continued, ""Nowthat Intel has committed to internal manufacturing, we think it’s unlikely that Intel ever regains a transistor advantage vs. AMD, and the current roadmaps ensure an advantage for AMD/TSMC through at least 2024. In the meantime, we think Street numbers are too low for both server and consoles, putting our base case 2022 EPS estimate of $2.81 12% ahead of the Street, with an upside case to about $3.00.""
In line with this outlook, Caso initiated coverage of AMD with an Outperform (i.e. Buy) rating, and $100 price target to suggest a 23% one-year upside potential. (To watch Caso’s track record, click here)
The Raymond James view is no bullish outlier; AMD has 13 positive reviews on record. These are partly balanced by 5 Holds and 1 Sell, making the analyst consensus rating a Moderate Buy. The share are selling for $81.11, and their $104.44 average price target implies an upside of ~29% for the next 12 months. (See AMD stock analysis on TipRanks)
Nvidia Corporation (NVDA)
Next up, Nvidia, is another of the chip industry’s giants. Like AMD, Nvidia is slowly rising in the rankings; going by total sales, the company was rated number 10 in 2019 – and number 8 in 2020. Nvidia’s sales last year totaled more than $16 billion, a gain of 53% year-over-year. Nvidia rode to its success on the combination of memory chips – which have a strong market in the data center segment – and graphics processors – which are popular among both hardcore gamers and professional graphic designers.
For the most recent quarter, Q4 of fiscal 2021, ending on December 31, Nvidia reported $5 billion in revenue, a company record, and a 61% gain from the year before. EPS rose from $1.53 in the prior Q4 to $2.31 in the current print, a gain of 51%. Full year numbers were strong; the $16.68 billion at the top line was a record, and the EPS, at $6.90, was 53% higher than the previous year.
Company management noted the strength of the data center segment, but also pointed out that Nvidia has a growing AI business. The company makes between 5% and 10% of its total sales in the automotive market, and more than half of that is AI-related, in the autonomous vehicle niche.
Raymond James’ Chris Caso notes this, too, in his report upgrading his stance on NVDA.
“Our call is not really new, as we’ve been positive on NVDA for some time. Our call rather is meant to express our conviction in both the short and long term. In the short term, we think NVDA results will be more dependent on supply than demand given widespread shortages – and we do expect incremental supply as the year progresses…. Our longer term conviction is driven by the fact that NVDA has more shots on goal than anyone else in our coverage, and their success in AI has earned them a permanent seat at the table in both hyperscale and enterprise compute,” Caso opined.
Caso bumps his stance up from Outperform to Strong Buy, and sets a price target of $750. At current levels, this indicates room for a 17% one-year upside.
NVDA’s strong share appreciation over the past 12 months (115%) has pushed the stock price close to the average price target. Shares are selling for $614.47, with an average target of $670.20 suggesting room for 9% growth. Nonetheless, the stock holds a Strong Buy consensus rating based on 22 Buys and 4 Hold given in recent weeks. (See NVDA stock analysis on TipRanks)
Intel Corporation (INTC)
The third stock we’re looking at, Intel, is the one that Raymond James says to avoid. This may seem counterintuitive; Intel is, by sales, the world’s largest semiconductor chip maker, with more than $77 billion in annual revenue last year and a leading position in a $720+ billion market. So why does Caso advise caution here?
“Intel’s stock has risen of late due to optimism that new leadership from their very capable new CEO will allow them to turn around their manufacturing issues and return to their former dominance. Our Underperform rating reflects not just the risk that Intel won’t reach that goal, but also the pain they will likely endure in pursuit of that goal in terms of capex, lost market share, and a shifting landscape in datacenter that will make the industry less dependent on Intel,"" Caso explained.
The analyst added, ""In addition, we’re concerned that demand in the PC market, on which Intel remains highly dependent, has been significantly pulled forward due to the pandemic, and expect an eventual mean reversion – which may unfortunately occur just as Intel needs to ramp investment.”
Caso, as noted, rates INTC an Underperform (i.e. Sell), and does not put a price target on it.
All in all, the market’s current view on INTC is a mixed bag, indicating uncertainty as to its prospects. The stock has a Hold analyst consensus rating based on 12 Buys, 10 Holds, and 8 Sells. Meanwhile, the $67.68 price target suggests a modest upside potential of nearly 6%. (See INTC stock analysis on TipRanks)
To find good chip ideas for stocks trading at attractive valuations, visit TipRanks’ Best Stocks to Buy, a newly launched tool that unites all of TipRanks’ equity insights.
Disclaimer: The opinions expressed in this article are solely those of the featured analysts. The content is intended to be used for informational purposes only. It is very important to do your own analysis before making any investment.
The views and opinions expressed herein are the views and opinions of the author and do not necessarily reflect those of Nasdaq, Inc.","(See NVDA stock analysis on TipRanks) Intel Corporation (INTC) The third stock we’re looking at, Intel, is the one that Raymond James says to avoid. The analyst added, ""In addition, we’re concerned that demand in the PC market, on which Intel remains highly dependent, has been significantly pulled forward due to the pandemic, and expect an eventual mean reversion – which may unfortunately occur just as Intel needs to ramp investment.” Caso, as noted, rates INTC an Underperform (i.e. Sell), and does not put a price target on it. All in all, the market’s current view on INTC is a mixed bag, indicating uncertainty as to its prospects.","(See NVDA stock analysis on TipRanks) Intel Corporation (INTC) The third stock we’re looking at, Intel, is the one that Raymond James says to avoid. The analyst added, ""In addition, we’re concerned that demand in the PC market, on which Intel remains highly dependent, has been significantly pulled forward due to the pandemic, and expect an eventual mean reversion – which may unfortunately occur just as Intel needs to ramp investment.” Caso, as noted, rates INTC an Underperform (i.e. Sell), and does not put a price target on it. All in all, the market’s current view on INTC is a mixed bag, indicating uncertainty as to its prospects.","The analyst added, ""In addition, we’re concerned that demand in the PC market, on which Intel remains highly dependent, has been significantly pulled forward due to the pandemic, and expect an eventual mean reversion – which may unfortunately occur just as Intel needs to ramp investment.” Caso, as noted, rates INTC an Underperform (i.e. Sell), and does not put a price target on it. (See NVDA stock analysis on TipRanks) Intel Corporation (INTC) The third stock we’re looking at, Intel, is the one that Raymond James says to avoid. All in all, the market’s current view on INTC is a mixed bag, indicating uncertainty as to its prospects.","(See NVDA stock analysis on TipRanks) Intel Corporation (INTC) The third stock we’re looking at, Intel, is the one that Raymond James says to avoid. The analyst added, ""In addition, we’re concerned that demand in the PC market, on which Intel remains highly dependent, has been significantly pulled forward due to the pandemic, and expect an eventual mean reversion – which may unfortunately occur just as Intel needs to ramp investment.” Caso, as noted, rates INTC an Underperform (i.e. Sell), and does not put a price target on it. All in all, the market’s current view on INTC is a mixed bag, indicating uncertainty as to its prospects.",2021,2
