Date,Article_title,Stock_symbol,Url,Publisher,Author,Article,Lsa_summary,Luhn_summary,Textrank_summary,Lexrank_summary,Year,sentiment_score
2021-04-17 00:00:00+00:00,3 Game-Changing Stocks to Buy and Hold for the Next Decade,INTC,https://www.nasdaq.com/articles/3-game-changing-stocks-to-buy-and-hold-for-the-next-decade-2021-04-17,,,"Has the pandemic-fueled growth stock rally ended for good? Although no one can perfectly predict the market, the signs are there. The rising 10-year yield curve has made investors jittery about the possibility of capital moving away from stocks to bonds, and of the Federal Reserve having to increase interest rates. For a long time, high-growth companies have depended on cheap capital to fund their expansions. Facing the possibility of almost zero-interest capital vanishing, many investors are shifting their focus to value stocks.
However, high-growth stocks such as Shopify (NYSE: SHOP), Advanced Micro Devices (NASDAQ: AMD), and Intuitive Surgical (NASDAQ: ISRG) have robust balance sheets and solid structural trends. I wouldn't run away from these picks so soon.
Image source: Getty Images.
1. Shopify
In 2020, Shopify accounted for 8.6% of the market share of U.S. retail e-commerce sales. Although far behind Amazon's leading market share of 39%, Shopify is still ahead of bigger players such as Walmart and eBay.
Shopify is not directly competing with any of these e-commerce players. Amazon and Walmart are focused on customers and on driving sales of their own products or third-party listings on their online marketplaces. Shopify's core focus is on providing merchants with tools to take their businesses online. The company also offers solutions to manage other aspects of retail business such as payments, capital, inventory and fulfillment, shipping, order management, marketing, and data analytics in a centralized fashion across all channels. Shopify's revenue stems from two sources: monthly tiered subscription payments from merchants and merchant payments for other customized solutions.
Pandemic-related e-commerce adoption and digitization of business have been the two most important growth drivers for Shopify in 2020. Although some amount of online spending could shift to brick-and-mortar channels after the pandemic, these trends will continue to transform the world for many years to come. Global retail e-commerce sales are estimated to grow almost 49% from $4.3 trillion in 2020 to $6.4 trillion in 2024.
Shopify had more than 1.7 million merchants on its platform at the end of 2020, a steep jump from its 1-million-strong merchant base at end of 2019. The rapidly expanding merchant base is attracting more developers and partners to Shopify's ecosystem, which in turn makes its platform sturdier, and thereby attracts even more merchants. This network effect has played a significant role in pushing up the company's revenue by 86% year over year to $2.9 billion and gross merchandise volume (GMV) by 96% year over year to $119.6 billion. The company also reported net income of $319.5 million in 2020, its first full year of profitability.
Shopify is trading at over 50 times sales, which is quite expensive. But because the company is helping so many businesses make a direct brand connection with their customers, I think it is still an attractive buy even at its current level. Shopify's retail strategy will assume a bigger role in future years, since Gen Z and millennials are increasingly opting for more personalized purchases. This is a multi-year opportunity, and can return rich returns to patient investors in the next decade.
2. Advanced Micro Devices
A darling of the stock market in 2020, AMD has mostly floundered in 2021. The culprits for the company's lackluster share price performance are losing some of its central processing unit (CPU) market share to Intel (NASDAQ: INTC) in the fourth quarter of 2020 and not being able to do much about it due to severe semiconductor shortages. While Intel designs and manufactures its chips, it is Taiwan Semiconductor Manufacturing (NYSE: TSM) that does most of the chip production work for AMD. With tight foundry capacity, AMD was unable to meet all demand in the fourth quarter.
However, these problems may be close to resolution. According to a Steam Hardware & Software survey, AMD's CPU market share for Microsoft's Windows operating systems increased from 25% to 28.97% from December 2020 to March 2021. At the same time, Intel's market share dropped from 75% to 71.02%. Although the survey only pertains to Steam gaming platform users, it highlights a trend in the overall CPU market, considering that Steam had 120 million active users globally in 2020.
AMD can also expect these production worries to ease, now that Taiwan Semiconductor Manufacturing has announced plans to invest $100 billion in capacity expansion over the next three years. With AMD being a prominent TSM client, these investments are bound to help the company.
Despite the many concerns, AMD's fiscal 2020 performance is quite encouraging, thanks to the company's focus on high-end CPUs and graphical processing units (GPUs), which are used extensively in the rapidly expanding gaming and data center markets. The company's revenue jumped 45% year over year, while net income more than doubled in 2020. Yet AMD is trading just over 10 times trailing-12-month sales, which is the lowest valuation for the company in the past 10 years. With a significant technological advantage over peers and gradually improving foundry capacity, AMD could prove to be an attractive investment for patient investors.
3. Intuitive Surgical
Leading robotic surgery player Intuitive Surgical's stock has gained just under 60% in the last year. This is especially commendable considering the pandemic caused hospitals to delay elective procedures, thereby reducing demand for the company's robotic da Vinci surgery system.
The company's fourth-quarter (ended Dec. 31, 2020) revenue grew by only 4% year over year, a significant decline from 22% year-over-year growth in the prior-year quarter. However, even the modest fourth-quarter top-line growth in such trying times is a testament to the success of the company's solid razor-and-blades business model.
Currently, there are 5,989 da Vinci systems installed across the world. So, although revenue from the sale of systems declined year over year by 12% to $1.2 billion, recurring revenue earned from the sale of instruments and accessories as well as service contracts increased by 6% year over year to $3.4 billion in 2020. Recurring revenue accounted for 77% of the company's total sales in 2020, which implies significant top-line visibility and low revenue volatility in coming years.
Intuitive Surgical is focused on expanding the type of procedures that can be performed with da Vinci as well as on expanding in international markets such as China, Taiwan, and India. The company also boasts the highest number of robotic surgery systems installed compared to the competition. Once surgeons and healthcare professionals are trained on one system, there are significant costs in terms of the learning curve and comfort level involved in switching to other systems. Each da Vinci system costs between $1 million and $2 million. Hence, it is not easy for hospitals to forgo such huge capital investments and switch to competing systems.
Trading over 21 times trailing-12-month sales, Intuitive Surgical is not cheap. However, considering that the company dominates the robot-assisted surgical systems market, expected to be worth $17.8 billion by 2027, there is much room for this healthcare stock to grow in coming years.
10 stocks we like better than Shopify
When investing geniuses David and Tom Gardner have a stock tip, it can pay to listen. After all, the newsletter they have run for over a decade, Motley Fool Stock Advisor, has tripled the market.*
David and Tom just revealed what they believe are the ten best stocks for investors to buy right now... and Shopify wasn't one of them! That's right -- they think these 10 stocks are even better buys.
See the 10 stocks
*Stock Advisor returns as of February 24, 2021
Manali Bhade has no position in any of the stocks mentioned. John Mackey, CEO of Whole Foods Market, an Amazon subsidiary, is a member of The Motley Fool's board of directors. The Motley Fool owns shares of and recommends Amazon, Intuitive Surgical, Shopify, and Taiwan Semiconductor Manufacturing. The Motley Fool recommends Intel and eBay and recommends the following options: long January 2022 $1920.0 calls on Amazon, long January 2022 $580.0 calls on Intuitive Surgical, long January 2023 $57.5 calls on Intel, short January 2022 $1940.0 calls on Amazon, short January 2022 $600.0 calls on Intuitive Surgical, short January 2023 $57.5 puts on Intel, and short June 2021 $65.0 calls on eBay. The Motley Fool has a disclosure policy.
The views and opinions expressed herein are the views and opinions of the author and do not necessarily reflect those of Nasdaq, Inc.","The culprits for the company's lackluster share price performance are losing some of its central processing unit (CPU) market share to Intel (NASDAQ: INTC) in the fourth quarter of 2020 and not being able to do much about it due to severe semiconductor shortages. The rising 10-year yield curve has made investors jittery about the possibility of capital moving away from stocks to bonds, and of the Federal Reserve having to increase interest rates. According to a Steam Hardware & Software survey, AMD's CPU market share for Microsoft's Windows operating systems increased from 25% to 28.97% from December 2020 to March 2021.","The culprits for the company's lackluster share price performance are losing some of its central processing unit (CPU) market share to Intel (NASDAQ: INTC) in the fourth quarter of 2020 and not being able to do much about it due to severe semiconductor shortages. However, high-growth stocks such as Shopify (NYSE: SHOP), Advanced Micro Devices (NASDAQ: AMD), and Intuitive Surgical (NASDAQ: ISRG) have robust balance sheets and solid structural trends. Intuitive Surgical Leading robotic surgery player Intuitive Surgical's stock has gained just under 60% in the last year.","The culprits for the company's lackluster share price performance are losing some of its central processing unit (CPU) market share to Intel (NASDAQ: INTC) in the fourth quarter of 2020 and not being able to do much about it due to severe semiconductor shortages. This network effect has played a significant role in pushing up the company's revenue by 86% year over year to $2.9 billion and gross merchandise volume (GMV) by 96% year over year to $119.6 billion. So, although revenue from the sale of systems declined year over year by 12% to $1.2 billion, recurring revenue earned from the sale of instruments and accessories as well as service contracts increased by 6% year over year to $3.4 billion in 2020.","The culprits for the company's lackluster share price performance are losing some of its central processing unit (CPU) market share to Intel (NASDAQ: INTC) in the fourth quarter of 2020 and not being able to do much about it due to severe semiconductor shortages. Shopify In 2020, Shopify accounted for 8.6% of the market share of U.S. retail e-commerce sales. Intuitive Surgical Leading robotic surgery player Intuitive Surgical's stock has gained just under 60% in the last year.",2021,4
2021-04-16 00:00:00+00:00,"Wall St Week Ahead-Tech retakes market lead as investors eye yields, earnings",INTC,https://www.nasdaq.com/articles/wall-st-week-ahead-tech-retakes-market-lead-as-investors-eye-yields-earnings-2021-04-16,,,"By Lewis Krauskopf
NEW YORK, April 16 (Reuters) - U.S. technology and growth stocks have taken the market's reins in recent weeks, pausing a rotation into value shares as investors assess the trajectory of bond yields and upcoming earnings reports.
Technology .SPLRCT has been the top-performing S&P 500 .SPX sector in April, rising 8% versus a 5% rise for the benchmark index. Big tech-related growth stocks in other S&P 500 sectors such as Amazon Inc AMZN.O, Tesla Inc TSLA.O and Google-parent Alphabet Inc GOOGL.O have also charged higher.
The gains have followed a months-long rotation in which tech stocks were outpaced by shares of banks, energy companies and other economically-sensitive names that have surged since breakthroughs in COVID-19 vaccines late last year.
The increases in many of these so-called value stocks have slowed lately, while U.S. Treasury prices have come galloping back in April after a sharp first-quarter sell-off. This suggests that some investors may have already priced in a rapid growth spurt that is showing up in economic data.
""Tech and growth has started to pick up a little bit because people are getting a little more cautious,"" said Lindsey Bell, chief investment strategist at Ally Invest. ""Investors are in this wait-and-see mode ... at least until earnings get underway.""
One of the key drivers of the move in tech has been the Treasury market, with the benchmark 10-year note yield falling about 15 basis points in April to about 1.6% on Friday.
Higher bond yields are particularly challenging for the performance of tech and other shares with high valuations and high expected future profits, as rising yields reduce the stocks' values in many standard models. The 10-year yield US10YT=RR rose about 83 basis points in the first quarter.
""People are probably taking a little bit of a deep breath and saying, 'OK, maybe rates aren't going to go straight to (2.50%),'"" said Chris Galipeau, senior market strategist at Putnam Investments.
Shares of tech and other companies with strong ""stay-at-home"" businesses could also strengthen if there are snags in the countrywide vaccination drive or other problems with the recovery, investors said.
For example, a call by U.S. health agencies this week to pause use of Johnson & Johnson's JNJ.N coronavirus vaccine spurred a move into some stay-at-home stocks and out of travel names tied to the economic reopening.
Investors also pointed to the impending influx of quarterly reports as key to determining market leadership, with Netflix Inc NFLX.O and Intel Corp INTC.O among the major tech and growth company earnings due next week.
Many investors think the recent market shift is just a pause, with value and cyclical stocks due to regain command after years of lagging, as investors seize on shares expected to benefit most from what the Federal Reserve expects will be the strongest economic growth in nearly 40 years.
""My guess is we will see more of this internal rotation where growth takes a break and then it comes on and then value takes a break and then it comes on,"" Galipeau said. ""It won't surprise me if that continues for a couple of years.""
Others have become more wary of the equity market in general. Strategists at BofA Global Research recently issued a report listing five reasons for caution on stocks, including high valuations and outsized returns over the past year. The bank kept its year-end S&P 500 target at 3,800, some 9% below current levels. The index has risen 11% this year.
""Amid increasingly euphoric sentiment, lofty valuations, and peak stimulus, we continue to believe the market has overly priced in the good news,"" BofA's strategists wrote.
6-month chart of S&P tech sector and 10-yr U.S. Treasuryhttps://tmsnrt.rs/3slrQrC
(Reporting by Lewis Krauskopf; Editing by Richard Chang)
((lewis.krauskopf@thomsonreuters.com; 646-223-6082; Reuters Messaging: lewis.krauskopf.thomsonreuters.com@reuters.net, Twitter: @LKrauskopf))
The views and opinions expressed herein are the views and opinions of the author and do not necessarily reflect those of Nasdaq, Inc.","Investors also pointed to the impending influx of quarterly reports as key to determining market leadership, with Netflix Inc NFLX.O and Intel Corp INTC.O among the major tech and growth company earnings due next week. By Lewis Krauskopf NEW YORK, April 16 (Reuters) - U.S. technology and growth stocks have taken the market's reins in recent weeks, pausing a rotation into value shares as investors assess the trajectory of bond yields and upcoming earnings reports. Strategists at BofA Global Research recently issued a report listing five reasons for caution on stocks, including high valuations and outsized returns over the past year.","Investors also pointed to the impending influx of quarterly reports as key to determining market leadership, with Netflix Inc NFLX.O and Intel Corp INTC.O among the major tech and growth company earnings due next week. By Lewis Krauskopf NEW YORK, April 16 (Reuters) - U.S. technology and growth stocks have taken the market's reins in recent weeks, pausing a rotation into value shares as investors assess the trajectory of bond yields and upcoming earnings reports. Higher bond yields are particularly challenging for the performance of tech and other shares with high valuations and high expected future profits, as rising yields reduce the stocks' values in many standard models.","Investors also pointed to the impending influx of quarterly reports as key to determining market leadership, with Netflix Inc NFLX.O and Intel Corp INTC.O among the major tech and growth company earnings due next week. By Lewis Krauskopf NEW YORK, April 16 (Reuters) - U.S. technology and growth stocks have taken the market's reins in recent weeks, pausing a rotation into value shares as investors assess the trajectory of bond yields and upcoming earnings reports. Many investors think the recent market shift is just a pause, with value and cyclical stocks due to regain command after years of lagging, as investors seize on shares expected to benefit most from what the Federal Reserve expects will be the strongest economic growth in nearly 40 years.","Investors also pointed to the impending influx of quarterly reports as key to determining market leadership, with Netflix Inc NFLX.O and Intel Corp INTC.O among the major tech and growth company earnings due next week. By Lewis Krauskopf NEW YORK, April 16 (Reuters) - U.S. technology and growth stocks have taken the market's reins in recent weeks, pausing a rotation into value shares as investors assess the trajectory of bond yields and upcoming earnings reports. ""People are probably taking a little bit of a deep breath and saying, 'OK, maybe rates aren't going to go straight to (2.50%),'"" said Chris Galipeau, senior market strategist at Putnam Investments.",2021,3
2021-04-16 00:00:00+00:00,Dow Analyst Moves: INTC,INTC,https://www.nasdaq.com/articles/dow-analyst-moves%3A-intc-2021-04-16,,,"The latest tally of analyst opinions from the major brokerage houses shows that among the 30 stocks making up the Dow Jones Industrial Average, Intel is the #30 analyst pick. Within the broader S&P 500, when components were ranked in terms of analyst favorites, INTC claims the #487 spot.
Looking at the stock price movement year to date, Intel is showing a gain of 30.3%.
VIDEO: Dow Analyst Moves: INTC
The views and opinions expressed herein are the views and opinions of the author and do not necessarily reflect those of Nasdaq, Inc.","Within the broader S&P 500, when components were ranked in terms of analyst favorites, INTC claims the #487 spot. VIDEO: Dow Analyst Moves: INTC The views and opinions expressed herein are the views and opinions of the author and do not necessarily reflect those of Nasdaq, Inc. The latest tally of analyst opinions from the major brokerage houses shows that among the 30 stocks making up the Dow Jones Industrial Average, Intel is the #30 analyst pick.","Within the broader S&P 500, when components were ranked in terms of analyst favorites, INTC claims the #487 spot. VIDEO: Dow Analyst Moves: INTC The views and opinions expressed herein are the views and opinions of the author and do not necessarily reflect those of Nasdaq, Inc. The latest tally of analyst opinions from the major brokerage houses shows that among the 30 stocks making up the Dow Jones Industrial Average, Intel is the #30 analyst pick.","Within the broader S&P 500, when components were ranked in terms of analyst favorites, INTC claims the #487 spot. VIDEO: Dow Analyst Moves: INTC The views and opinions expressed herein are the views and opinions of the author and do not necessarily reflect those of Nasdaq, Inc. The latest tally of analyst opinions from the major brokerage houses shows that among the 30 stocks making up the Dow Jones Industrial Average, Intel is the #30 analyst pick.","Within the broader S&P 500, when components were ranked in terms of analyst favorites, INTC claims the #487 spot. VIDEO: Dow Analyst Moves: INTC The views and opinions expressed herein are the views and opinions of the author and do not necessarily reflect those of Nasdaq, Inc. The latest tally of analyst opinions from the major brokerage houses shows that among the 30 stocks making up the Dow Jones Industrial Average, Intel is the #30 analyst pick.",2021,3
