Date,Article_title,Stock_symbol,Url,Publisher,Author,Article,Lsa_summary,Luhn_summary,Textrank_summary,Lexrank_summary,Year,sentiment_score
2021-09-27 00:00:00+00:00,Keep Buying AMD Stock as Charts Favor More Gains,INTC,https://www.nasdaq.com/articles/keep-buying-amd-stock-as-charts-favor-more-gains-2021-09-27,,,"InvestorPlace - Stock Market News, Stock Advice & Trading Tips
I have pointed this out before and will do so again, because Advanced Micro Devices (NASDAQ:AMD) stock is known for making massive moves to the upside in a short period of time, then consolidating for several months or quarters.
AMD) logo outside of a corporate building"" width=""300"" height=""169"">
Source: Sundry Photography / Shutterstock.com
AMD stock recently repeated this pattern, ripping to new highs last month. However, it has since come back under pressure. 
After consolidating in a wide range for almost a year, AMD stock ripped higher by more than 34% in just six trading sessions. That came on a high-volume burst, which led the stock to all-time highs. 
Still down 15% from this highs though and this stock has many bulls rethinking their long position. Not to worry though. Like Nvidia (NASDAQ:NVDA), AMD continues to enjoy long-term secular growth, while at the same time, eating into Intel’s (NASDAQ:INTC) market share. 
Breaking Down Advanced Micro Devices
Why do I like AMD stock? Well, it’s pretty simple: The growth. 
The company sports trailing 12-month revenue growth of roughly 75%. For the current year, consensus expectations call for almost 60% growth. However, the issue of 2022 and beyond then crops up. Forecasts call for 17.5% revenue growth in 2022 and 13% growth in 2023.
First, that’s several years of double-digit revenue growth and 17.5% is certainly nothing to balk at. That said, after growing revenue by 45% in 2020 and with forecasts calling for 60% growth this year, 17.5% is going to feel like a real slow down. 
7 Clean Energy Stocks Trading Too Hot at the Moment
Or at least the market could interpret it like that.
My issue is that analysts have been woefully conservative with AMD. The same is true for Nvidia. Listen up, because this part is important. 
Despite knowing how much momentum AMD was riding as it entered 2021 — undeterred by the novel coronavirus pandemic — analysts expected less than $10 billion in revenue for this year. That figure is now at almost $16 billion!
At the start of this year, analysts expected next year’s revenue to be around $12 billion. That figure is already north of $18 billion. In a span of just a few quarters, these estimates have exploded higher. The same thing happened for fiscal 2020 before it was in the books. 
So my argument is, why bet against a winning entity? AMD clearly has the formula for growth, even if the estimates can’t keep up. 
AMD Does More Than That
It’s not just revenue growth that has me excited here. CEO Lisa Su has done so much to turn this company around over the years. 
Revenue in 2017 stood at $5.3 billion, while the trailing 12 months boasts sales of $13.3 billion. That’s up 150%, which is great. But operating income in the same periods stand at $204 million and $2.5 billion, respectively, a more than 10-fold increase. 
Net income exploded from $43 million in 2017 to $3.43 billion. The increases have resulted in booming free cash flow and margin. It’s also allowed the company to pay down debt, which has gone from $1.4 billion at year-end 2017 to just over $500 million at year-end 2020. 
It also put AMD in position to acquire Xilinx (NASDAQ:XLNX) for $36 billion in an all-stock deal. 
That will have an impact on AMD stock in the intermediate term, but it should only help bolster AMD’s financials in the future. Speaking of the stock price, let’s look at the chart. 
Trading AMD Stock

Click to Enlarge
Source: TrendSpider
A look at the chart shows the explosive rally the stock underwent in late July and early August. Just for a minute, forget all the revenue growth and positive developments in the company’s financials. Instead, just look at the volume on that spike. 
AMD stock exploded higher in six straight sessions with incredible volume. To me, that says “accumulation” by the big institutions. 
The stock then gave use a pretty orderly “ABC” correction back down to the 50-day moving average and the former all-time high at $99.23. Now pressing higher, the bulls are regaining control.
I want to see that the stock can clear the 21-day moving average downtrend resistance, but as long as it stays above $99.23, it looks OK on the long side. Above $107.50 puts $114.50 in play, followed by $120-plus. 
On the date of publication, Bret Kenwell held a long position in AMD and NVDA. The opinions expressed in this article are those of the writer, subject to the InvestorPlace.com Publishing Guidelines.
Bret Kenwell is the manager and author of Future Blue Chips and is on Twitter @BretKenwell. 
The post Keep Buying AMD Stock as Charts Favor More Gains appeared first on InvestorPlace.
The views and opinions expressed herein are the views and opinions of the author and do not necessarily reflect those of Nasdaq, Inc.","Like Nvidia (NASDAQ:NVDA), AMD continues to enjoy long-term secular growth, while at the same time, eating into Intel’s (NASDAQ:INTC) market share. Despite knowing how much momentum AMD was riding as it entered 2021 — undeterred by the novel coronavirus pandemic — analysts expected less than $10 billion in revenue for this year. Click to Enlarge Source: TrendSpider A look at the chart shows the explosive rally the stock underwent in late July and early August.","Like Nvidia (NASDAQ:NVDA), AMD continues to enjoy long-term secular growth, while at the same time, eating into Intel’s (NASDAQ:INTC) market share. InvestorPlace - Stock Market News, Stock Advice & Trading Tips I have pointed this out before and will do so again, because Advanced Micro Devices (NASDAQ:AMD) stock is known for making massive moves to the upside in a short period of time, then consolidating for several months or quarters. After consolidating in a wide range for almost a year, AMD stock ripped higher by more than 34% in just six trading sessions.","Like Nvidia (NASDAQ:NVDA), AMD continues to enjoy long-term secular growth, while at the same time, eating into Intel’s (NASDAQ:INTC) market share. InvestorPlace - Stock Market News, Stock Advice & Trading Tips I have pointed this out before and will do so again, because Advanced Micro Devices (NASDAQ:AMD) stock is known for making massive moves to the upside in a short period of time, then consolidating for several months or quarters. AMD) logo outside of a corporate building"" width=""300"" height=""169""> Source: Sundry Photography / Shutterstock.com AMD stock recently repeated this pattern, ripping to new highs last month.","Like Nvidia (NASDAQ:NVDA), AMD continues to enjoy long-term secular growth, while at the same time, eating into Intel’s (NASDAQ:INTC) market share. Still down 15% from this highs though and this stock has many bulls rethinking their long position. At the start of this year, analysts expected next year’s revenue to be around $12 billion.",2021,2
2021-09-26 00:00:00+00:00,"Chinese tech execs support 'common prosperity', helping SMEs at internet summit",INTC,https://www.nasdaq.com/articles/chinese-tech-execs-support-common-prosperity-helping-smes-at-internet-summit-2021-09-26,,,"WUZHEN, China, Sept 26 (Reuters) - Chinese technology executives, facing a crackdown by the authorities, pledged support on Sunday for Beijing's ""common prosperity"" drive and to help smaller companies.
Alibaba Group 9988.HK CEO Daniel Zhang, a prime target of the broad crackdown, told a conference organised by China's top internet regulator that his company's $15 billion plan to boost common prosperity in China was ""steadily advancing"".
Common prosperity - China's term for narrowing the gap between rich and poor - is ""not just a number"", Zhang said, stressing the importance of helping local talent in poor regions to ""teach a man to fish"".
The World Internet Conference in Wuzhen in eastern China is organised by the Cyberspace Administration of China. The conference in the past has drawn such foreign executives as Tim Cook and Sundar Pichai, but overseas attendance was hurt this year by COVID-19 protocols and souring U.S.-China relations.
Qualcomm Inc QCOM.O CEO Cristiano Amon, Intel Corp INTC.O, INTC.O CEO Patrick Gelsinger and Tesla Inc TSLA.O founder Elon Musk provided taped remarks.
China's regulatory crackdown has hit sectors from cryptocurrencies and the internet, to entertainment, education and property, wiping hundreds of billions off the market value some of its largest companies and putting investors on alert over who may be next.
The listing of Alibaba's financial affiliate was halted and the e-commerce giant was fined a record $2.75 for anti-competitive behaviour.
Policymakers and executives at the conference did not address the crackdown directly, though Liu He, China's vice premier, said the digital economy can at times stifle competition.
Common prosperity has re-emerged as a slogan this year after President Xi Jinping used it in public remarks.
Xiaomi Corp 1810.HK CEO Lei Jun called on large tech companies to help more small and midsize firms, saying they must ""not let any group fall behind"".
In videotaped remarks, Neil Shen, the founding partner of Sequoia Capital China, which has backed tech giants such as ByteDance and Didi Global Inc DIDI.N, praised a planned tech bourse in Beijing as helping smaller firms.
(Reporting by Josh Horwitz; Editing by William Mallard)
((Y.Sun@thomsonreuters.com; +86 10 66271262; Reuters Messaging: y.sun.thomsonreuters.com@reuters.net))
The views and opinions expressed herein are the views and opinions of the author and do not necessarily reflect those of Nasdaq, Inc.","Qualcomm Inc QCOM.O CEO Cristiano Amon, Intel Corp INTC.O, INTC.O CEO Patrick Gelsinger and Tesla Inc TSLA.O founder Elon Musk provided taped remarks. WUZHEN, China, Sept 26 (Reuters) - Chinese technology executives, facing a crackdown by the authorities, pledged support on Sunday for Beijing's ""common prosperity"" drive and to help smaller companies. The conference in the past has drawn such foreign executives as Tim Cook and Sundar Pichai, but overseas attendance was hurt this year by COVID-19 protocols and souring U.S.-China relations.","Qualcomm Inc QCOM.O CEO Cristiano Amon, Intel Corp INTC.O, INTC.O CEO Patrick Gelsinger and Tesla Inc TSLA.O founder Elon Musk provided taped remarks. WUZHEN, China, Sept 26 (Reuters) - Chinese technology executives, facing a crackdown by the authorities, pledged support on Sunday for Beijing's ""common prosperity"" drive and to help smaller companies. Alibaba Group 9988.HK CEO Daniel Zhang, a prime target of the broad crackdown, told a conference organised by China's top internet regulator that his company's $15 billion plan to boost common prosperity in China was ""steadily advancing"".","Qualcomm Inc QCOM.O CEO Cristiano Amon, Intel Corp INTC.O, INTC.O CEO Patrick Gelsinger and Tesla Inc TSLA.O founder Elon Musk provided taped remarks. WUZHEN, China, Sept 26 (Reuters) - Chinese technology executives, facing a crackdown by the authorities, pledged support on Sunday for Beijing's ""common prosperity"" drive and to help smaller companies. Alibaba Group 9988.HK CEO Daniel Zhang, a prime target of the broad crackdown, told a conference organised by China's top internet regulator that his company's $15 billion plan to boost common prosperity in China was ""steadily advancing"".","Qualcomm Inc QCOM.O CEO Cristiano Amon, Intel Corp INTC.O, INTC.O CEO Patrick Gelsinger and Tesla Inc TSLA.O founder Elon Musk provided taped remarks. WUZHEN, China, Sept 26 (Reuters) - Chinese technology executives, facing a crackdown by the authorities, pledged support on Sunday for Beijing's ""common prosperity"" drive and to help smaller companies. Alibaba Group 9988.HK CEO Daniel Zhang, a prime target of the broad crackdown, told a conference organised by China's top internet regulator that his company's $15 billion plan to boost common prosperity in China was ""steadily advancing"".",2021,3
2021-09-24 00:00:00+00:00,Intel breaks ground on $20 bln Arizona plants as U.S. chip factory race heats up,INTC,https://www.nasdaq.com/articles/intel-breaks-ground-on-%2420-bln-arizona-plants-as-u.s.-chip-factory-race-heats-up-2021-09,,,"By Stephen Nellis
Sept 24 (Reuters) - Intel Corp INTC.O on Friday broke ground on two new factories in Arizona as part of its turnaround plan to become a major manufacturer of chips for outside customers.
The $20 billion plants - dubbed Fab 52 and Fab 62 - will bring the total number of Intel factories at its campus in Chandler, Arizona, to six. They will house Intel's most advanced chipmaking technology and play a central role in the Santa Clara, California-based company's effort to regain its lead in making the smallest, fastest chips by 2025, after having fallen behind rival Taiwan Semiconductor Manufacturing Co Ltd 2330.TW.
The new Arizona plants will also be the first Intel has built from the ground up with space reserved for outside customers. Intel has long made its own chips, but its turnaround plan calls for taking on work for outsiders such as Qualcomm Inc QCOM.O Amazon.com's AMZN.O cloud unit, as well as deepening its manufacturing relationship with the U.S. military.
""We want to have more resilience to the supply chain,"" Intel Chief Executive Pat Gelsinger, who earlier in the week attended a White House meeting on the global chip shortage, told Reuters in an interview. ""As the only company on U.S. soil that can do the most advanced lithography processes in the world, we are going to step up in a big way.""
Gelsinger said it was too early to say how much of the new plants' capacity would be reserved for outside customers. He said the plants would produce ""thousands"" of wafers per week.
Wafers are the silicon discs on which chips are made, and each can hold hundreds or even thousands of chips.
Intel rival TSMC has also purchased land to build its first U.S. campus in Phoenix, not far from Intel's location, where TSMC plans up to six chip factories, Reuters previously reported.
Gelsinger said Intel plans to announce another U.S. campus site before the end of the year that will eventually hold eight chip factories.
(Reporting by Stephen Nellis in San Francisco; Editing by Dan Grebler)
((Stephen.Nellis@thomsonreuters.com; (415) 344-4934;))
The views and opinions expressed herein are the views and opinions of the author and do not necessarily reflect those of Nasdaq, Inc.","By Stephen Nellis Sept 24 (Reuters) - Intel Corp INTC.O on Friday broke ground on two new factories in Arizona as part of its turnaround plan to become a major manufacturer of chips for outside customers. They will house Intel's most advanced chipmaking technology and play a central role in the Santa Clara, California-based company's effort to regain its lead in making the smallest, fastest chips by 2025, after having fallen behind rival Taiwan Semiconductor Manufacturing Co Ltd 2330.TW. ""We want to have more resilience to the supply chain,"" Intel Chief Executive Pat Gelsinger, who earlier in the week attended a White House meeting on the global chip shortage, told Reuters in an interview.","By Stephen Nellis Sept 24 (Reuters) - Intel Corp INTC.O on Friday broke ground on two new factories in Arizona as part of its turnaround plan to become a major manufacturer of chips for outside customers. Intel has long made its own chips, but its turnaround plan calls for taking on work for outsiders such as Qualcomm Inc QCOM.O Amazon.com's AMZN.O cloud unit, as well as deepening its manufacturing relationship with the U.S. military. Intel rival TSMC has also purchased land to build its first U.S. campus in Phoenix, not far from Intel's location, where TSMC plans up to six chip factories, Reuters previously reported.","By Stephen Nellis Sept 24 (Reuters) - Intel Corp INTC.O on Friday broke ground on two new factories in Arizona as part of its turnaround plan to become a major manufacturer of chips for outside customers. They will house Intel's most advanced chipmaking technology and play a central role in the Santa Clara, California-based company's effort to regain its lead in making the smallest, fastest chips by 2025, after having fallen behind rival Taiwan Semiconductor Manufacturing Co Ltd 2330.TW. Intel rival TSMC has also purchased land to build its first U.S. campus in Phoenix, not far from Intel's location, where TSMC plans up to six chip factories, Reuters previously reported.","By Stephen Nellis Sept 24 (Reuters) - Intel Corp INTC.O on Friday broke ground on two new factories in Arizona as part of its turnaround plan to become a major manufacturer of chips for outside customers. The new Arizona plants will also be the first Intel has built from the ground up with space reserved for outside customers. Wafers are the silicon discs on which chips are made, and each can hold hundreds or even thousands of chips.",2021,4
