Date,Article_title,Stock_symbol,Url,Publisher,Author,Article,Lsa_summary,Luhn_summary,Textrank_summary,Lexrank_summary,Year,sentiment_score
2021-09-30 00:00:00+00:00,"ANALYSIS-From chips to ships, shortages are making inflation stick",INTC,https://www.nasdaq.com/articles/analysis-from-chips-to-ships-shortages-are-making-inflation-stick-2021-09-30,,,"By Dhara Ranasinghe and Sujata Rao
LONDON, Sept 30 (Reuters) - Soaring gas prices, staff shortages, a lack of ships -- price pressures globally may be picking up faster than anticipated, challenging the view that inflation will prove transitory.
Central bankers, while adamant inflation will subside, are starting to concede it may stay higher for longer as a range of issues push up the prices of goods and services and lift future inflation expectations.
Their conclusions will ultimately determine how quickly policymakers unwind the trillions of dollars of monetary stimulus unleashed to ease the COVID-19 crisis.
""Will central bankers be more focused on growth and be a ""bit behind the curve""? Or will they be more concerned about inflation and take the punchbowl away quickly?,"" said Charles Diebel, head of fixed income at asset manager Mediolanum International Funds.
Here are five key elements in the inflation debate:
1/ GASFLATION
European TRNLTTFMc1 and U.S. NGc1 gas prices have soared more than 350% and more than 120% respectively this year. Oil LCOc1 is up around 50% and Goldman Sachs expects Brent crude to hit $90 a barrel by end-2021 from around $80 currently.
Gas and electricity make up 4.8% of the euro area harmonised-inflation (HICP) basket used by the European Central Bank. Rabobank reckons the price surge is a separate 'shock' that could add 0.15 percentage points (ppts) to its 2.2% euro zone inflation forecast for 2021 and another 0.25 ppts to 2022's 1.8% projection.
Many economists see higher gas prices as here to stay, due to slowing U.S. output, rising costs of carbon emissions permits for polluters and curbs on the usage of dirtier fuels.
In China, where factory inflation hit 9.5% in August, power cuts have slashed output of goods from cement to aluminum.
These outages are a risk to end-users such as those in auto supply chains, Morgan Stanley said, noting ""cost-push inflation and tightening upstream supply that could affect downstream production and profits.""
2/ CHIPFLATION
Semiconductors, or chips as they are known, are tiny but are having an outsized impact on global factories. At General Motors GM.N alone, chip shortages are seen cutting Q3 vehicle deliveries by 200,000, while falling output has sent used-car prices spiraling.
Chip prices have risen and semiconductor giant Taiwan's TSMC 2330.TW is mulling further hikes of up to 20%. That will ripple across everything from electronics to cars and phones to washing machines. But chipmakers themselves face higher input costs from commodities to power.
""It does seem likely that these semiconductor shortages are going to persist into next year,"" said Jack Allen-Reynolds, senior European economist at Capital Economics.
Or beyond. Intel's INTC.O CEO predicts chips will comprise a fifth of a car's cost by 2030, from 4% in 2019 as vehicles become self-driving or electric.
3/ FOODFLATION
Global food prices rose 30% year-on-year in August, an index compiled by the UN Food and Agriculture Organisation shows -- a sign of broadening price pressures.
While higher agricultural commodity prices are behind the jump, JPMorgan analysts also attribute food price inflation to pandemic-related pressures such as logistics disruptions and transport costs.
In emerging markets, where food makes up a large chunk of inflation baskets, there is more pressure to tighten monetary policy. It is less of a problem for developed nations but price rises look inevitable for items such as soft drinks and snacks.
4/GREENFLATION
Stringent rules to guide the transition to a greener future are blamed for stoking 'greenflation', for instance by shutting out polluting factories, vehicles, ships and mines, in turn reducing the supply of key goods and services.
Prices for European carbon emission allowances, have doubled this year to 65 euros a tonne. A price of 100 euros would lift European retail power prices 12%, adding 35 bps to headline euro zone inflation, Morgan Stanley estimated in June.
There are other examples. Falling ship orders due to upcoming rule changes on fuels may be a tailwind for shipping rates that have already surged 280% this year .BADI.
NatWest attributes the commodity rally at least partly to the shift to greener technologies raising mining and production costs.
All this may not fully have seeped into inflation calculations. For instance, markets see euro area inflation hitting 2% only after a decade, Danske Bank sees ""upside risks to inflation expectations...once implementation of the green transition gathers momentum"".
5/ WAGEFLATION
As prices rise, so do expectations of future inflation among consumers, who accordingly demand pay hikes.
The wage growth picture is mixed. U.S average hourly earnings jumped 0.6% in August and U.S. five-year inflation expectations are running around 3%, surveys show.
In some UK sectors, earnings have risen as much as 30% this year. Euro area labour costs fell in Q2 but inflation as well as inflation expectations are rising.
""Maybe markets are a little bit extreme in their pricing, but I'm not recommending investors should fade that move,"" Societe Generale senior rates strategist Jorge Garayo said.
""When we go into next year, that will be the big test.""
'Surprised' by inflationhttps://tmsnrt.rs/39J2IEv
Gas priceshttps://tmsnrt.rs/3zZbN6C
Taiwan semiconductor orders and exportshttps://tmsnrt.rs/3CSDX5a
Global food prices on a tearhttps://tmsnrt.rs/3im9J2B
US wages and inflationhttps://tmsnrt.rs/3F0La52
Inflation expectationshttps://tmsnrt.rs/3zYHih8
Carbon priceshttps://tmsnrt.rs/3m9tXOh
(Reporting by Dhara Ranasinghe and Sujata Rao; Additional reporting by Stefano Rebaudo ; Editing by Kirsten Donovan)
((Dhara.Ranasinghe@thomsonreuters.com; +442075422684;))
The views and opinions expressed herein are the views and opinions of the author and do not necessarily reflect those of Nasdaq, Inc.","Intel's INTC.O CEO predicts chips will comprise a fifth of a car's cost by 2030, from 4% in 2019 as vehicles become self-driving or electric. Many economists see higher gas prices as here to stay, due to slowing U.S. output, rising costs of carbon emissions permits for polluters and curbs on the usage of dirtier fuels. Stringent rules to guide the transition to a greener future are blamed for stoking 'greenflation', for instance by shutting out polluting factories, vehicles, ships and mines, in turn reducing the supply of key goods and services.","Intel's INTC.O CEO predicts chips will comprise a fifth of a car's cost by 2030, from 4% in 2019 as vehicles become self-driving or electric. By Dhara Ranasinghe and Sujata Rao LONDON, Sept 30 (Reuters) - Soaring gas prices, staff shortages, a lack of ships -- price pressures globally may be picking up faster than anticipated, challenging the view that inflation will prove transitory. Many economists see higher gas prices as here to stay, due to slowing U.S. output, rising costs of carbon emissions permits for polluters and curbs on the usage of dirtier fuels.","Intel's INTC.O CEO predicts chips will comprise a fifth of a car's cost by 2030, from 4% in 2019 as vehicles become self-driving or electric. Central bankers, while adamant inflation will subside, are starting to concede it may stay higher for longer as a range of issues push up the prices of goods and services and lift future inflation expectations. While higher agricultural commodity prices are behind the jump, JPMorgan analysts also attribute food price inflation to pandemic-related pressures such as logistics disruptions and transport costs.","Intel's INTC.O CEO predicts chips will comprise a fifth of a car's cost by 2030, from 4% in 2019 as vehicles become self-driving or electric. European TRNLTTFMc1 and U.S. NGc1 gas prices have soared more than 350% and more than 120% respectively this year. Stringent rules to guide the transition to a greener future are blamed for stoking 'greenflation', for instance by shutting out polluting factories, vehicles, ships and mines, in turn reducing the supply of key goods and services.",2021,3
2021-09-30 00:00:00+00:00,Google tells court 'staggering' $5 bln EU antitrust fine flawed,INTC,https://www.nasdaq.com/articles/google-tells-court-staggering-%245-bln-eu-antitrust-fine-flawed-2021-09-30,,,"By Foo Yun Chee
LUXEMBOURG, Sept 30 (Reuters) - A 4.34 billion euro ($5 billion) European Union antitrust fine was based on flawed calculations, Alphabet's GOOGL.O Google said on Thursday, urging Europe's second-highest court to scrap or reduce what it said was not an appropriate penalty.
Google was fined for using its Android mobile operating system to thwart rivals and cement its dominance in general internet search from 2011, in the largest penalty meted out to any company found guilty of breaching EU antitrust rules.
""The fine that was imposed, a staggering 4.34 billion euros, was not appropriate,"" Google's lawyer Genevra Forwood told the five-judge panel of the General Court on the fourth day of a week-long hearing, which is taking place three years after the European Commission sanctioned the company.
""The problem is not the headline-grabbing fine per se. The problem is how the Commission reached that figure,"" she said.
Forwood said there was no anti-competitive intent in Google's actions nor could it have known that its conduct was an abuse based on EU case law and there was no precedent for it.
""So it was wrong for the Commission to impose any fine at all, let alone turn up the dials to reach its biggest fine ever,"" Forwood said.
She also took issue with the EU competition enforcer adding a 11% gravity factor to Google's fine compared with 5% for Intel INTC.O in 2009 in a separate case.
""Even if this Court considers that a fine is appropriate, it would only be proper to turn the dials right down,"" she said.
However, the European Commission's lawyer Anthony Dawes said Google ""simply could not be unaware of the anti-competitive behaviour of its practices"".
""Infringements committed negligently are no less serious than those committed intentionally,"" Dawes said, adding that the fine was just 4.5% of Google's revenue in 2017 versus a 10% cap allowed under EU rules.
A verdict is likely to come next year. The case is T-604/18 Google vs European Commission
($1 = 1.1714 euros)
(Reporting by Foo Yun Chee; Editing by Alexander Smith)
((foo.yunchee@thomsonreuters.com; +32 2 287 6844; Reuters Messaging: foo.yunchee.thomsonreuters.com@reuters.net))
The views and opinions expressed herein are the views and opinions of the author and do not necessarily reflect those of Nasdaq, Inc.","She also took issue with the EU competition enforcer adding a 11% gravity factor to Google's fine compared with 5% for Intel INTC.O in 2009 in a separate case. Google was fined for using its Android mobile operating system to thwart rivals and cement its dominance in general internet search from 2011, in the largest penalty meted out to any company found guilty of breaching EU antitrust rules. ""The fine that was imposed, a staggering 4.34 billion euros, was not appropriate,"" Google's lawyer Genevra Forwood told the five-judge panel of the General Court on the fourth day of a week-long hearing, which is taking place three years after the European Commission sanctioned the company.","She also took issue with the EU competition enforcer adding a 11% gravity factor to Google's fine compared with 5% for Intel INTC.O in 2009 in a separate case. By Foo Yun Chee LUXEMBOURG, Sept 30 (Reuters) - A 4.34 billion euro ($5 billion) European Union antitrust fine was based on flawed calculations, Alphabet's GOOGL.O Google said on Thursday, urging Europe's second-highest court to scrap or reduce what it said was not an appropriate penalty. However, the European Commission's lawyer Anthony Dawes said Google ""simply could not be unaware of the anti-competitive behaviour of its practices"".","She also took issue with the EU competition enforcer adding a 11% gravity factor to Google's fine compared with 5% for Intel INTC.O in 2009 in a separate case. By Foo Yun Chee LUXEMBOURG, Sept 30 (Reuters) - A 4.34 billion euro ($5 billion) European Union antitrust fine was based on flawed calculations, Alphabet's GOOGL.O Google said on Thursday, urging Europe's second-highest court to scrap or reduce what it said was not an appropriate penalty. ""The fine that was imposed, a staggering 4.34 billion euros, was not appropriate,"" Google's lawyer Genevra Forwood told the five-judge panel of the General Court on the fourth day of a week-long hearing, which is taking place three years after the European Commission sanctioned the company.","She also took issue with the EU competition enforcer adding a 11% gravity factor to Google's fine compared with 5% for Intel INTC.O in 2009 in a separate case. By Foo Yun Chee LUXEMBOURG, Sept 30 (Reuters) - A 4.34 billion euro ($5 billion) European Union antitrust fine was based on flawed calculations, Alphabet's GOOGL.O Google said on Thursday, urging Europe's second-highest court to scrap or reduce what it said was not an appropriate penalty. ""The fine that was imposed, a staggering 4.34 billion euros, was not appropriate,"" Google's lawyer Genevra Forwood told the five-judge panel of the General Court on the fourth day of a week-long hearing, which is taking place three years after the European Commission sanctioned the company.",2021,2
2021-09-29 00:00:00+00:00,Delivery times for iPhone 13 stretch as COVID-19 hits Vietnam suppliers - Nikkei,INTC,https://www.nasdaq.com/articles/delivery-times-for-iphone-13-stretch-as-covid-19-hits-vietnam-suppliers-nikkei-2021-09-0,,,"Adds background, details
Sept 28 (Reuters) - Buyers of Apple's AAPL.O new iPhone 13 face longer-than-expected delivery times because of a wave of COVID-19 infections in Vietnam, where components for the device's new camera module are assembled, Nikkei Asia said.
The disruption, which could ease as soon as mid-October, is linked to a constriction in supplies of modules for the phone's four models, as a significant number of components are assembled in Vietnam, it said, citing people familiar with the matter.
The latest iPhone 13 models have an advanced camera that allows more light in to capture sharp images in low-lit areas and also offers a transition focus from foreground to background in the same frame.
Several users and Apple's partners, such as Verizon Communications Inc VZ.N and Best Buy BBY.N, have highlighted delays after pre-ordering began in September due to a shortage of supply and high demand, with analysts warning of one of the longest waiting times for the phone in recent years.
Apple relies on more than a dozen factories that manufacture components in Vietnam, which has been grappling with a rise in infections since April, mostly in its business hub Ho Chi Minh City and neighboring industrial provinces.
Some of these factories in Vietnam are operated by LG Display Company Ltd 034220.KS, Intel Corp INTC.O and Foxconn Technology Group 2317.TW.
Meanwhile, Apple suppliers in China have suspended production at some factories for a number of days to comply with tighter energy consumption policies.
(Reporting by Kanishka Singh and Nivedita Balu in Bengaluru; Editing by Clarence Fernandez and Sriraj Kalluvila)
((Kanishka.Singh@thomsonreuters.com; +91 8061822801;))
The views and opinions expressed herein are the views and opinions of the author and do not necessarily reflect those of Nasdaq, Inc.","Some of these factories in Vietnam are operated by LG Display Company Ltd 034220.KS, Intel Corp INTC.O and Foxconn Technology Group 2317.TW. Adds background, details Sept 28 (Reuters) - Buyers of Apple's AAPL.O new iPhone 13 face longer-than-expected delivery times because of a wave of COVID-19 infections in Vietnam, where components for the device's new camera module are assembled, Nikkei Asia said. Several users and Apple's partners, such as Verizon Communications Inc VZ.N and Best Buy BBY.N, have highlighted delays after pre-ordering began in September due to a shortage of supply and high demand, with analysts warning of one of the longest waiting times for the phone in recent years.","Some of these factories in Vietnam are operated by LG Display Company Ltd 034220.KS, Intel Corp INTC.O and Foxconn Technology Group 2317.TW. Adds background, details Sept 28 (Reuters) - Buyers of Apple's AAPL.O new iPhone 13 face longer-than-expected delivery times because of a wave of COVID-19 infections in Vietnam, where components for the device's new camera module are assembled, Nikkei Asia said. The disruption, which could ease as soon as mid-October, is linked to a constriction in supplies of modules for the phone's four models, as a significant number of components are assembled in Vietnam, it said, citing people familiar with the matter.","Some of these factories in Vietnam are operated by LG Display Company Ltd 034220.KS, Intel Corp INTC.O and Foxconn Technology Group 2317.TW. Adds background, details Sept 28 (Reuters) - Buyers of Apple's AAPL.O new iPhone 13 face longer-than-expected delivery times because of a wave of COVID-19 infections in Vietnam, where components for the device's new camera module are assembled, Nikkei Asia said. The disruption, which could ease as soon as mid-October, is linked to a constriction in supplies of modules for the phone's four models, as a significant number of components are assembled in Vietnam, it said, citing people familiar with the matter.","Some of these factories in Vietnam are operated by LG Display Company Ltd 034220.KS, Intel Corp INTC.O and Foxconn Technology Group 2317.TW. Adds background, details Sept 28 (Reuters) - Buyers of Apple's AAPL.O new iPhone 13 face longer-than-expected delivery times because of a wave of COVID-19 infections in Vietnam, where components for the device's new camera module are assembled, Nikkei Asia said. The disruption, which could ease as soon as mid-October, is linked to a constriction in supplies of modules for the phone's four models, as a significant number of components are assembled in Vietnam, it said, citing people familiar with the matter.",2021,2
