Date,Article_title,Stock_symbol,Url,Publisher,Author,Article,Lsa_summary,Luhn_summary,Textrank_summary,Lexrank_summary,Year,sentiment_score
2021-04-12 00:00:00+00:00,"Monday Sector Laggards: Energy, Technology & Communications",INTC,https://www.nasdaq.com/articles/monday-sector-laggards%3A-energy-technology-communications-2021-04-12,,,"The worst performing sector as of midday Monday is the Energy sector, showing a 1.2% loss. Within that group, Occidental Petroleum Corp (Symbol: OXY) and Cabot Oil & Gas Corp. (Symbol: COG) are two large stocks that are lagging, showing a loss of 2.4% and 2.2%, respectively. Among energy ETFs, one ETF following the sector is the Energy Select Sector SPDR ETF (Symbol: XLE), which is down 1.0% on the day, and up 27.23% year-to-date. Occidental Petroleum Corp, meanwhile, is up 38.71% year-to-date, and Cabot Oil & Gas Corp. is up 5.01% year-to-date. Combined, OXY and COG make up approximately 3.3% of the underlying holdings of XLE.
The next worst performing sector is the Technology & Communications sector, showing a 0.6% loss. Among large Technology & Communications stocks, IPG Photonics Corp (Symbol: IPGP) and Intel Corp (Symbol: INTC) are the most notable, showing a loss of 6.1% and 4.8%, respectively. One ETF closely tracking Technology & Communications stocks is the Technology Select Sector SPDR ETF (XLK), which is down 0.4% in midday trading, and up 8.90% on a year-to-date basis. IPG Photonics Corp, meanwhile, is up 0.12% year-to-date, and Intel Corp is up 31.17% year-to-date. Combined, IPGP and INTC make up approximately 3.0% of the underlying holdings of XLK.
Comparing these stocks and ETFs on a trailing twelve month basis, below is a relative stock price performance chart, with each of the symbols shown in a different color as labeled in the legend at the bottom:
Here's a snapshot of how the S&P 500 components within the various sectors are faring in afternoon trading on Monday. As you can see, five sectors are up on the day, while four sectors are down.
SECTOR % CHANGE
Consumer Products +0.4%
Financial +0.2%
Utilities +0.1%
Healthcare +0.1%
Materials +0.1%
Industrial -0.2%
Services -0.3%
Technology & Communications -0.6%
Energy -1.2%
10 ETFs With Stocks That Insiders Are Buying »
The views and opinions expressed herein are the views and opinions of the author and do not necessarily reflect those of Nasdaq, Inc.","Among large Technology & Communications stocks, IPG Photonics Corp (Symbol: IPGP) and Intel Corp (Symbol: INTC) are the most notable, showing a loss of 6.1% and 4.8%, respectively. Combined, IPGP and INTC make up approximately 3.0% of the underlying holdings of XLK. Combined, OXY and COG make up approximately 3.3% of the underlying holdings of XLE.","Among large Technology & Communications stocks, IPG Photonics Corp (Symbol: IPGP) and Intel Corp (Symbol: INTC) are the most notable, showing a loss of 6.1% and 4.8%, respectively. Combined, IPGP and INTC make up approximately 3.0% of the underlying holdings of XLK. Within that group, Occidental Petroleum Corp (Symbol: OXY) and Cabot Oil & Gas Corp. (Symbol: COG) are two large stocks that are lagging, showing a loss of 2.4% and 2.2%, respectively.","Among large Technology & Communications stocks, IPG Photonics Corp (Symbol: IPGP) and Intel Corp (Symbol: INTC) are the most notable, showing a loss of 6.1% and 4.8%, respectively. Combined, IPGP and INTC make up approximately 3.0% of the underlying holdings of XLK. Among energy ETFs, one ETF following the sector is the Energy Select Sector SPDR ETF (Symbol: XLE), which is down 1.0% on the day, and up 27.23% year-to-date.","Among large Technology & Communications stocks, IPG Photonics Corp (Symbol: IPGP) and Intel Corp (Symbol: INTC) are the most notable, showing a loss of 6.1% and 4.8%, respectively. Combined, IPGP and INTC make up approximately 3.0% of the underlying holdings of XLK. Among energy ETFs, one ETF following the sector is the Energy Select Sector SPDR ETF (Symbol: XLE), which is down 1.0% on the day, and up 27.23% year-to-date.",2021,2
2021-04-12 00:00:00+00:00,Nvidia announces Arm-based 'Grace' server chip in direct challenge to Intel,INTC,https://www.nasdaq.com/articles/nvidia-announces-arm-based-grace-server-chip-in-direct-challenge-to-intel-2021-04-12,,,"By making its own central processor, Nvidia is taking on Intel and AMD directly for the first time. In a keynote speech announcing the chip, Nvidia Chief Executive Officer Jensen Huang called the new server chip the ""final piece of the puzzle"" that will join Nvidia's graphics and networking chips to form the ""basic building block of the modern data center.”
Santa Clara, California-based Nvidia said the ""Grace"" server processor, which will be released in 2023, is designed to handle tasks like training artificial intelligence algorithms. Once known for its graphics chips to improve the play of video games, Nvidia has focused heavily on artificial intelligence computing in recent years, helping its market capitalization exceed Intel's to become the largest U.S. semiconductor firm.
Nvidia also said that the Swiss National Supercomputing Centre will make a new supercomputer dubbed ""Alps"" using the new ""Grace"" processors and built by Hewlett Packard Enterprise Co HPE.N. The computing system, which Huang said will be 10 times faster than the world's current best supercomputer, will be used for tasks such as weather forecasting and physics research.
Nvidia officials said that the company's accelerator chips will continue to support central processors from Intel and AMD even as it dives into the market itself. Huang said that Nvidia will alternate its focus, concentrating on making accelerator chips that work with Arm-processors one year, and then chips that work with AMD and Intel chips in the next year.
Nvidia did not disclose which Arm technology it would use for the chips but said they would use computing cores Arm's ""Neoverse"" family of server chip technology that will be released in the future. Huang said it was ""off-the-shelf"" technology from Arm.
Nvidia said in September that it will buy Arm for $40 billion.
Nvidia's rivals have expressed concerns that the company will use its potential ownership of Arm to get early access to Arm's technologies as they become more prevalent in the data center market.
Arm said that Nvidia has had the same access to its intellectual property as the rest of Arm's customer base and did not get early access to its technology.
UK competition watchdog to probe Nvidia's Arm takeover
Nvidia to buy chip designer Arm for $40 bln as SoftBank exits
(Reporting by Stephen Nellis in San Francisco; Editing by Lisa Shumaker)
((Stephen.Nellis@thomsonreuters.com; (415) 344-4934;))
The views and opinions expressed herein are the views and opinions of the author and do not necessarily reflect those of Nasdaq, Inc.","Once known for its graphics chips to improve the play of video games, Nvidia has focused heavily on artificial intelligence computing in recent years, helping its market capitalization exceed Intel's to become the largest U.S. semiconductor firm. Nvidia officials said that the company's accelerator chips will continue to support central processors from Intel and AMD even as it dives into the market itself. UK competition watchdog to probe Nvidia's Arm takeover Nvidia to buy chip designer Arm for $40 bln as SoftBank exits (Reporting by Stephen Nellis in San Francisco; Editing by Lisa Shumaker) ((Stephen.Nellis@thomsonreuters.com; (415) 344-4934;)) The views and opinions expressed herein are the views and opinions of the author and do not necessarily reflect those of Nasdaq, Inc.","In a keynote speech announcing the chip, Nvidia Chief Executive Officer Jensen Huang called the new server chip the ""final piece of the puzzle"" that will join Nvidia's graphics and networking chips to form the ""basic building block of the modern data center.” Santa Clara, California-based Nvidia said the ""Grace"" server processor, which will be released in 2023, is designed to handle tasks like training artificial intelligence algorithms. Huang said that Nvidia will alternate its focus, concentrating on making accelerator chips that work with Arm-processors one year, and then chips that work with AMD and Intel chips in the next year. UK competition watchdog to probe Nvidia's Arm takeover Nvidia to buy chip designer Arm for $40 bln as SoftBank exits (Reporting by Stephen Nellis in San Francisco; Editing by Lisa Shumaker) ((Stephen.Nellis@thomsonreuters.com; (415) 344-4934;)) The views and opinions expressed herein are the views and opinions of the author and do not necessarily reflect those of Nasdaq, Inc.","In a keynote speech announcing the chip, Nvidia Chief Executive Officer Jensen Huang called the new server chip the ""final piece of the puzzle"" that will join Nvidia's graphics and networking chips to form the ""basic building block of the modern data center.” Santa Clara, California-based Nvidia said the ""Grace"" server processor, which will be released in 2023, is designed to handle tasks like training artificial intelligence algorithms. Nvidia did not disclose which Arm technology it would use for the chips but said they would use computing cores Arm's ""Neoverse"" family of server chip technology that will be released in the future. UK competition watchdog to probe Nvidia's Arm takeover Nvidia to buy chip designer Arm for $40 bln as SoftBank exits (Reporting by Stephen Nellis in San Francisco; Editing by Lisa Shumaker) ((Stephen.Nellis@thomsonreuters.com; (415) 344-4934;)) The views and opinions expressed herein are the views and opinions of the author and do not necessarily reflect those of Nasdaq, Inc.","Huang said that Nvidia will alternate its focus, concentrating on making accelerator chips that work with Arm-processors one year, and then chips that work with AMD and Intel chips in the next year. Nvidia did not disclose which Arm technology it would use for the chips but said they would use computing cores Arm's ""Neoverse"" family of server chip technology that will be released in the future. Nvidia's rivals have expressed concerns that the company will use its potential ownership of Arm to get early access to Arm's technologies as they become more prevalent in the data center market.",2021,5
2021-04-12 00:00:00+00:00,White House to zero in on chip shortage in meeting with company officials,INTC,https://www.nasdaq.com/articles/white-house-to-zero-in-on-chip-shortage-in-meeting-with-company-officials-2021-04-12-0,,,"By Nandita Bose
WASHINGTON, April 12 (Reuters) - U.S. President Joe Biden will urge Congress to invest $50 billion in semiconductor manufacturing and research when he meets with top executives from nearly 20 major companies on Monday about the global chips shortage that has roiled the automotive industry and technology firms.
The push is part of his broader focus on rebuilding U.S. manufacturing as a powerhouse for the world's largest economy - and a source of good-paying jobs - after years of declining investments and productivity growth, a senior administration official said.
The White House meeting is billed as the ""CEO Summit on Semiconductor and Supply Chain Resilience"" and will include White House national security adviser Jake Sullivan and National Economic Council Director Brian Deese.
Biden is expected to stop by the meeting to push his $2 trillion infrastructure plan, which includes $300 billion aimed at expanding manufacturing, especially in disadvantaged areas and communities of color through loans, grants, investments and the targeted use of federal procurements.
While the proposed investments will take time to implement, the administration is also seeking ""short-term and medium-term solutions that will be discussed during the summit,"" the official said. No further details were immediately available.
As of midday Friday, 19 major companies had agreed to send executives, including General Motors GM.N Chief Executive Mary Barra, Ford Motor F.N Chief Executive Jim Farley and Chrysler-parent Stellantis NV STLA.MI CEO Carlos Tavares.
The ""summit reflects the urgent need to strengthen critical supply chains,"" Deese said in a statement.
Commerce Secretary Gina Raimondo will also take part, as well as executives from GlobalFoundries, PACCAR Inc PCAR.O, NXP and Taiwan Semiconductor Manufacturing Co 2330.TW, AT&T T.N, Samsung 005930.KS, Google-parent Alphabet GOOGL.O, Dell Technologies DELL.N, Intel Corp INTC.O, Medtronic MDT.N, Northrop Grumman NOC.N, Hewlett Packard Enterprises HPE.N, Cummins CMI.N and Micron Technology MU.O.
A U.S. auto industry group this week urged the government to help and warned that a global semiconductor shortage could result in 1.28 million fewer vehicles built this year and disrupt production for another six months.
Over the weekend, GM canceled more truck production shifts at two U.S. plants.
""Trying to address supply chains on a crisis-by-crisis basis creates critical national security vulnerabilities,"" Sullivan said in a statement.
Automakers have been hit particularly hard by the global chip shortage after many canceled orders when auto plants were idled during the coronavirus pandemic.
When they were ready to resume production, they found chipmakers were busy fulfilling orders for the consumer electronics industry, which has seen demand for premium devices - both for work and leisure - boom as people spent more time at home.
Broadband internet, cellphone and cable TV companies also face delays in receiving ""network switches, routers, and servers,"" according to an industry group.
""Shortages in semiconductors and the associated delays will result in hundreds of millions of dollars in impact to the broadband and cable television industry this year,"" the group said last week.
Biden wants at least $100 billion to boost U.S. semiconductor production and fund investments to support production of critical goods, but officials said this funding will not address short-term chip needs.
Later this week, the Senate Commerce Committee will hold its first hearing on a bipartisan measure to bolster technology research and development efforts in a bid to address Chinese competition.
(Reporting by David Shepardson and Andrea Shalal, Editing by Rosalba O'Brien and Bill Berkrot)
((Chris.Sanders@thomsonreuters.com; +1 202-558-8254; Reuters Messaging: chris.sanders.reuters.com@reuters.net))
The views and opinions expressed herein are the views and opinions of the author and do not necessarily reflect those of Nasdaq, Inc.","Commerce Secretary Gina Raimondo will also take part, as well as executives from GlobalFoundries, PACCAR Inc PCAR.O, NXP and Taiwan Semiconductor Manufacturing Co 2330.TW, AT&T T.N, Samsung 005930.KS, Google-parent Alphabet GOOGL.O, Dell Technologies DELL.N, Intel Corp INTC.O, Medtronic MDT.N, Northrop Grumman NOC.N, Hewlett Packard Enterprises HPE.N, Cummins CMI.N and Micron Technology MU.O. By Nandita Bose WASHINGTON, April 12 (Reuters) - U.S. President Joe Biden will urge Congress to invest $50 billion in semiconductor manufacturing and research when he meets with top executives from nearly 20 major companies on Monday about the global chips shortage that has roiled the automotive industry and technology firms. The push is part of his broader focus on rebuilding U.S. manufacturing as a powerhouse for the world's largest economy - and a source of good-paying jobs - after years of declining investments and productivity growth, a senior administration official said.","Commerce Secretary Gina Raimondo will also take part, as well as executives from GlobalFoundries, PACCAR Inc PCAR.O, NXP and Taiwan Semiconductor Manufacturing Co 2330.TW, AT&T T.N, Samsung 005930.KS, Google-parent Alphabet GOOGL.O, Dell Technologies DELL.N, Intel Corp INTC.O, Medtronic MDT.N, Northrop Grumman NOC.N, Hewlett Packard Enterprises HPE.N, Cummins CMI.N and Micron Technology MU.O. By Nandita Bose WASHINGTON, April 12 (Reuters) - U.S. President Joe Biden will urge Congress to invest $50 billion in semiconductor manufacturing and research when he meets with top executives from nearly 20 major companies on Monday about the global chips shortage that has roiled the automotive industry and technology firms. The White House meeting is billed as the ""CEO Summit on Semiconductor and Supply Chain Resilience"" and will include White House national security adviser Jake Sullivan and National Economic Council Director Brian Deese.","Commerce Secretary Gina Raimondo will also take part, as well as executives from GlobalFoundries, PACCAR Inc PCAR.O, NXP and Taiwan Semiconductor Manufacturing Co 2330.TW, AT&T T.N, Samsung 005930.KS, Google-parent Alphabet GOOGL.O, Dell Technologies DELL.N, Intel Corp INTC.O, Medtronic MDT.N, Northrop Grumman NOC.N, Hewlett Packard Enterprises HPE.N, Cummins CMI.N and Micron Technology MU.O. By Nandita Bose WASHINGTON, April 12 (Reuters) - U.S. President Joe Biden will urge Congress to invest $50 billion in semiconductor manufacturing and research when he meets with top executives from nearly 20 major companies on Monday about the global chips shortage that has roiled the automotive industry and technology firms. The White House meeting is billed as the ""CEO Summit on Semiconductor and Supply Chain Resilience"" and will include White House national security adviser Jake Sullivan and National Economic Council Director Brian Deese.","Commerce Secretary Gina Raimondo will also take part, as well as executives from GlobalFoundries, PACCAR Inc PCAR.O, NXP and Taiwan Semiconductor Manufacturing Co 2330.TW, AT&T T.N, Samsung 005930.KS, Google-parent Alphabet GOOGL.O, Dell Technologies DELL.N, Intel Corp INTC.O, Medtronic MDT.N, Northrop Grumman NOC.N, Hewlett Packard Enterprises HPE.N, Cummins CMI.N and Micron Technology MU.O. By Nandita Bose WASHINGTON, April 12 (Reuters) - U.S. President Joe Biden will urge Congress to invest $50 billion in semiconductor manufacturing and research when he meets with top executives from nearly 20 major companies on Monday about the global chips shortage that has roiled the automotive industry and technology firms. While the proposed investments will take time to implement, the administration is also seeking ""short-term and medium-term solutions that will be discussed during the summit,"" the official said.",2021,4
2021-04-12 00:00:00+00:00,"Intel's Mobileye, Udelv Partner On Autonomous Delivery Vehicles",INTC,https://www.nasdaq.com/articles/intels-mobileye-udelv-partner-on-autonomous-delivery-vehicles-2021-04-12,,,"(RTTNews) - Intel Corp's Mobileye and self-driving delivery startup Udelv have signed a deal to launch a fully driverless delivery service in the United States by 2023, the companies said in a statement.
Udelv said that Mobileye's self-driving system ""Mobileye Drive"" will drive Udelv's next-generation autonomous delivery vehicles ""Transporters.""
The companies plan to produce more than 35,000 Mobileye-driven Transporters by 2028, with commercial operations beginning in 2023.
The commercial fleet leasing and management company Donlen placed the first pre-order for 1,000 Transporters.
Mobileye plans to deploy autonomous shuttles with Transdev ATS and Lohr Group beginning in Europe. Mobileye also plans to begin operating an autonomous ride-hailing service in Israel in early 2022.
The views and opinions expressed herein are the views and opinions of the author and do not necessarily reflect those of Nasdaq, Inc.","The commercial fleet leasing and management company Donlen placed the first pre-order for 1,000 Transporters. Mobileye plans to deploy autonomous shuttles with Transdev ATS and Lohr Group beginning in Europe. Mobileye also plans to begin operating an autonomous ride-hailing service in Israel in early 2022.","(RTTNews) - Intel Corp's Mobileye and self-driving delivery startup Udelv have signed a deal to launch a fully driverless delivery service in the United States by 2023, the companies said in a statement. Udelv said that Mobileye's self-driving system ""Mobileye Drive"" will drive Udelv's next-generation autonomous delivery vehicles ""Transporters."" Mobileye also plans to begin operating an autonomous ride-hailing service in Israel in early 2022.","(RTTNews) - Intel Corp's Mobileye and self-driving delivery startup Udelv have signed a deal to launch a fully driverless delivery service in the United States by 2023, the companies said in a statement. Udelv said that Mobileye's self-driving system ""Mobileye Drive"" will drive Udelv's next-generation autonomous delivery vehicles ""Transporters."" The views and opinions expressed herein are the views and opinions of the author and do not necessarily reflect those of Nasdaq, Inc.","(RTTNews) - Intel Corp's Mobileye and self-driving delivery startup Udelv have signed a deal to launch a fully driverless delivery service in the United States by 2023, the companies said in a statement. The companies plan to produce more than 35,000 Mobileye-driven Transporters by 2028, with commercial operations beginning in 2023. Mobileye also plans to begin operating an autonomous ride-hailing service in Israel in early 2022.",2021,4
