Date,Article_title,Stock_symbol,Url,Publisher,Author,Article,Lsa_summary,Luhn_summary,Textrank_summary,Lexrank_summary,Year,sentiment_score
2021-04-20 00:00:00+00:00,US STOCKS-Wall St headed for lower open as focus turns to tech earnings,INTC,https://www.nasdaq.com/articles/us-stocks-wall-st-headed-for-lower-open-as-focus-turns-to-tech-earnings-2021-04-20,,,"By Shivani Kumaresan
April 20 (Reuters) - Futures pointed to a lower open for Wall Street's main indexes on Tuesday as investors banked on results from Netflix and other major technology-related companies this week to sustain the positive start to the earnings season.
Streaming service provider Netflix NFLX.O, which thrived during last year's lockdowns, will be the first among the so called FAANG group to report quarterly numbers. Its shares slipped about 0.3% in pre-market trading, ahead of its results after markets close.
International Business Machines Corp IBM.N rose 2.7% as it recorded the biggest rise in quarterly sales in more than two years, boosted by its bets on the high-margin cloud computing business.
Chipmaker Intel Corp INTC.O is slated to report results on Thursday.
""We are getting a little bit of weakness ... even though the earnings and economic data is good,"" said Ryan Detrick, senior market strategist at LPL Financial in Charlotte, North Carolina.
""The underlying fundamentals are extremely strong and it wouldn't be overly concerning after the rally we have seen in the past 13 months for the market to catch its breath a little bit more in the face of strong earnings.""
After blockbuster earnings from major U.S. banks last week, analysts expect first-quarter profit for overall S&P 500 firms to jump 30.9% from a year earlier, according to Refinitiv IBES data.
A pullback in longer-dated bond yields from 14-month highs has eased worries over higher borrowing costs, reviving demand for richly valued technology stocks.
Also, a string of robust economic data and expectations of a strong rebound in corporate earnings helped the S&P 500 and the Dow to hit record highs last week.
At 08:32 a.m. ET, Dow E-minis 1YMcv1 were down 154 points, or 0.45%, S&P 500 E-minis EScv1 were down 18 points, or 0.43% and Nasdaq 100 E-minis NQcv1 were down 48.75 points, or 0.35%.
Tobacco companies, including Altria Group MO.N and Philip Morris PM.N, fell as much as 4.2% after the Wall Street Journal reported that the Biden administration is considering a rule that would limit nicotine or ban menthol in cigarettes.
Abbott Laboratories ABT.N fell 3%, despite posting a three-fold jump in quarterly profit.
Nike Inc NKE.N dropped about 1.6% after Citigroup lowered its rating on the company's shares to ""neutral"" from ""buy"".
(Reporting by Shivani Kumaresan and Medha Singh in Bengaluru; Editing by Sriraj Kalluvila)
((Shivani.Kumaresan@thomsonreuters.com; +1 646 223 8780;))
The views and opinions expressed herein are the views and opinions of the author and do not necessarily reflect those of Nasdaq, Inc.","Chipmaker Intel Corp INTC.O is slated to report results on Thursday. By Shivani Kumaresan April 20 (Reuters) - Futures pointed to a lower open for Wall Street's main indexes on Tuesday as investors banked on results from Netflix and other major technology-related companies this week to sustain the positive start to the earnings season. A pullback in longer-dated bond yields from 14-month highs has eased worries over higher borrowing costs, reviving demand for richly valued technology stocks.","Chipmaker Intel Corp INTC.O is slated to report results on Thursday. By Shivani Kumaresan April 20 (Reuters) - Futures pointed to a lower open for Wall Street's main indexes on Tuesday as investors banked on results from Netflix and other major technology-related companies this week to sustain the positive start to the earnings season. After blockbuster earnings from major U.S. banks last week, analysts expect first-quarter profit for overall S&P 500 firms to jump 30.9% from a year earlier, according to Refinitiv IBES data.","Chipmaker Intel Corp INTC.O is slated to report results on Thursday. By Shivani Kumaresan April 20 (Reuters) - Futures pointed to a lower open for Wall Street's main indexes on Tuesday as investors banked on results from Netflix and other major technology-related companies this week to sustain the positive start to the earnings season. After blockbuster earnings from major U.S. banks last week, analysts expect first-quarter profit for overall S&P 500 firms to jump 30.9% from a year earlier, according to Refinitiv IBES data.","Chipmaker Intel Corp INTC.O is slated to report results on Thursday. By Shivani Kumaresan April 20 (Reuters) - Futures pointed to a lower open for Wall Street's main indexes on Tuesday as investors banked on results from Netflix and other major technology-related companies this week to sustain the positive start to the earnings season. After blockbuster earnings from major U.S. banks last week, analysts expect first-quarter profit for overall S&P 500 firms to jump 30.9% from a year earlier, according to Refinitiv IBES data.",2021,3
2021-04-20 00:00:00+00:00,"Apple podcast service, tags for lost items expected at iPad launch event",INTC,https://www.nasdaq.com/articles/apple-podcast-service-tags-for-lost-items-expected-at-ipad-launch-event-2021-04-20,,,"By Stephen Nellis
April 20 (Reuters) - Apple Inc AAPL.O is expected to unveil a new podcast subscription service and finally may show off tiny tags meant to locate lost items at a virtual event Tuesday that likely will feature new iPads and Mac computers.
Apple shares have risen nearly 95% over the past year, faster than the 64% rise in the Nasdaq Composite Index .IXIC, thanks to a record $274.5 billion in sales for fiscal 2020 as consumers stocked up on electronics during the pandemic.
Macs and iPads accounted for $52.3 billion during its fiscal 2020, and analysts expect updates to the top-end iPad Pro models on Tuesday, including better display and processing technology.
“The Pro iPads are not the volume sellers, but they blur the line between Mac and iPad. How Apple differentiates between the iPad Pro and the Mac will be very interesting to watch,"" Ben Bajarin, principal analyst for consumer market intelligence at Creative Strategies.
Analysts also expect Apple to take aim at podcasts, which have become a focus for its streaming music rival Spotify Technology SA SPOT.N, with a subscription service.
Apple may also release tracking devices called AirTags that would use the same technology that helps Apple customers locate lost phones and ear buds to locate lost wallets or keys.
The release could result in a new round of complaints to lawmakers that Apple is hurting smaller rivals. Tile, a startup that has sold a competing tracker for nearly a decade, last year testified before the U.S. House of Representatives that Apple's App Store rules had made it harder to use Tile's products and will be called before the U.S. Senate to testify on Wednesday.
Apple has said it subjects all apps, including its own, to the same App Store review rules.
Bob O'Donnell, head of TECHnalysis Research, said he does not believe the trackers will become a big business on their own. ""Because they are so late to this, it might not be that much different than when Apple got into set top boxes like Apple TV. They’re a player. They’re there, but they're not huge,"" he said.
But Bajarin said the trackers could keep people tied to their iPhones if they rely on them to find items like keys and wallets.
""The more you buy into just one hardware product, the less likely it is you’ll ever leave,"" Bajarin said.
O'Donnell said other announcements could include Apple moving some of its iMac models to its own processors from Intel Corp's INTC.O chips; and a consumer computer monitor in a lineup that recently has only had a high-priced screen for video professionals.
Google, Apple executives to testify in app store hearing on Wednesday
Apple sees revenue growth accelerating after setting record for iPhone sales, China strength
(Reporting by Stephen Nellis in San Francisco; Editing by Lisa Shumaker)
((Stephen.Nellis@thomsonreuters.com; (415) 344-4934;))
The views and opinions expressed herein are the views and opinions of the author and do not necessarily reflect those of Nasdaq, Inc.","O'Donnell said other announcements could include Apple moving some of its iMac models to its own processors from Intel Corp's INTC.O chips; and a consumer computer monitor in a lineup that recently has only had a high-priced screen for video professionals. By Stephen Nellis April 20 (Reuters) - Apple Inc AAPL.O is expected to unveil a new podcast subscription service and finally may show off tiny tags meant to locate lost items at a virtual event Tuesday that likely will feature new iPads and Mac computers. Apple shares have risen nearly 95% over the past year, faster than the 64% rise in the Nasdaq Composite Index .IXIC, thanks to a record $274.5 billion in sales for fiscal 2020 as consumers stocked up on electronics during the pandemic.","O'Donnell said other announcements could include Apple moving some of its iMac models to its own processors from Intel Corp's INTC.O chips; and a consumer computer monitor in a lineup that recently has only had a high-priced screen for video professionals. Macs and iPads accounted for $52.3 billion during its fiscal 2020, and analysts expect updates to the top-end iPad Pro models on Tuesday, including better display and processing technology. Tile, a startup that has sold a competing tracker for nearly a decade, last year testified before the U.S. House of Representatives that Apple's App Store rules had made it harder to use Tile's products and will be called before the U.S. Senate to testify on Wednesday.",O'Donnell said other announcements could include Apple moving some of its iMac models to its own processors from Intel Corp's INTC.O chips; and a consumer computer monitor in a lineup that recently has only had a high-priced screen for video professionals. By Stephen Nellis April 20 (Reuters) - Apple Inc AAPL.O is expected to unveil a new podcast subscription service and finally may show off tiny tags meant to locate lost items at a virtual event Tuesday that likely will feature new iPads and Mac computers. Apple may also release tracking devices called AirTags that would use the same technology that helps Apple customers locate lost phones and ear buds to locate lost wallets or keys.,"O'Donnell said other announcements could include Apple moving some of its iMac models to its own processors from Intel Corp's INTC.O chips; and a consumer computer monitor in a lineup that recently has only had a high-priced screen for video professionals. By Stephen Nellis April 20 (Reuters) - Apple Inc AAPL.O is expected to unveil a new podcast subscription service and finally may show off tiny tags meant to locate lost items at a virtual event Tuesday that likely will feature new iPads and Mac computers. Macs and iPads accounted for $52.3 billion during its fiscal 2020, and analysts expect updates to the top-end iPad Pro models on Tuesday, including better display and processing technology.",2021,2
2021-04-20 00:00:00+00:00,US STOCKS-Futures slip as focus shifts to earnings from tech-related firms,INTC,https://www.nasdaq.com/articles/us-stocks-futures-slip-as-focus-shifts-to-earnings-from-tech-related-firms-2021-04-20,,,"By Shivani Kumaresan
April 20 (Reuters) - U.S. stock index futures dipped on Tuesday as investors turned to results from Netflix and other major technology-related companies this week to sustain the positive start to the earnings season.
Streaming service provider Netflix NFLX.O that thrived during last year's lockdowns will be the first among the FAANG group to report quarterly numbers. Its shares slipped about 0.5% in pre-market trading, ahead of its results after markets close.
International Business Machines Corp IBM.N rose 2.6% as it recorded highest quarterly sales growth in more than two years, boosted by its bets on the high-margin cloud computing business.
Chipmaker Intel Corp INTC.O is slated to report results on Thursday.
""Optimism is running very high and the earnings outlook has likely been priced to perfection at these levels, so anything less than absolutely stellar results might be seen as a negative surprise,"" said Marios Hadjikyriacos, investment analyst at online broker XM in Cyprus.
After blockbuster earnings from major U.S. banks last week, analysts expect first-quarter profit for overall S&P 500 firms to jump 30.9% from a year earlier, according to Refinitiv IBES data.
A pullback in longer-dated bond yields from 14-month highs has eased worries over higher borrowing costs, reviving demand for high growth technology stocks.
A string of robust economic data and expectations of a strong rebound in corporate earnings helped the S&P 500 and the Dow to hit record highs last week.
At 06:51 a.m. ET, Dow E-minis 1YMcv1 were down 159 points, or 0.47%, S&P 500 E-minis EScv1 were down 20.75 points, or 0.49%. Nasdaq 100 E-minis NQcv1 were down 64.75 points, or 0.47%
Tobacco companies, including Altria Group MO.N and Philip Morris PM.N, fell as much as 2.2% after the Wall Street Journal reported that the Biden administration is considering a rule that would limit nicotine or ban menthol in cigarettes.
Johnson & Johnson JNJ.N, whose COVID-19 vaccine was put on pause last week to review reports of rare blood clots, tightened its forecast for profits this year. Its shares slipped 0.2%.
(Reporting by Shivani Kumaresan and Medha Singh in Bengaluru; Editing by Sriraj Kalluvila)
((Shivani.Kumaresan@thomsonreuters.com; +1 646 223 8780;))
The views and opinions expressed herein are the views and opinions of the author and do not necessarily reflect those of Nasdaq, Inc.","Chipmaker Intel Corp INTC.O is slated to report results on Thursday. By Shivani Kumaresan April 20 (Reuters) - U.S. stock index futures dipped on Tuesday as investors turned to results from Netflix and other major technology-related companies this week to sustain the positive start to the earnings season. ""Optimism is running very high and the earnings outlook has likely been priced to perfection at these levels, so anything less than absolutely stellar results might be seen as a negative surprise,"" said Marios Hadjikyriacos, investment analyst at online broker XM in Cyprus.","Chipmaker Intel Corp INTC.O is slated to report results on Thursday. By Shivani Kumaresan April 20 (Reuters) - U.S. stock index futures dipped on Tuesday as investors turned to results from Netflix and other major technology-related companies this week to sustain the positive start to the earnings season. After blockbuster earnings from major U.S. banks last week, analysts expect first-quarter profit for overall S&P 500 firms to jump 30.9% from a year earlier, according to Refinitiv IBES data.","Chipmaker Intel Corp INTC.O is slated to report results on Thursday. By Shivani Kumaresan April 20 (Reuters) - U.S. stock index futures dipped on Tuesday as investors turned to results from Netflix and other major technology-related companies this week to sustain the positive start to the earnings season. ""Optimism is running very high and the earnings outlook has likely been priced to perfection at these levels, so anything less than absolutely stellar results might be seen as a negative surprise,"" said Marios Hadjikyriacos, investment analyst at online broker XM in Cyprus.",Chipmaker Intel Corp INTC.O is slated to report results on Thursday. By Shivani Kumaresan April 20 (Reuters) - U.S. stock index futures dipped on Tuesday as investors turned to results from Netflix and other major technology-related companies this week to sustain the positive start to the earnings season. Streaming service provider Netflix NFLX.O that thrived during last year's lockdowns will be the first among the FAANG group to report quarterly numbers.,2021,3
2021-04-20 00:00:00+00:00,PREVIEW-Investors turn to growth stocks' results after strong earnings start,INTC,https://www.nasdaq.com/articles/preview-investors-turn-to-growth-stocks-results-after-strong-earnings-start-2021-04-20,,,"(Repeats with no change)
By Caroline Valetkevitch
NEW YORK, April 19 (Reuters) - On the heels of blockbuster earnings from major U.S. banks, investors are focused on whether an upcoming batch of earnings from major technology-related companies can sustain the season's early momentum.
Estimated year-over-year first-quarter earnings growth for S&P 500 companies rose to 31% from 25% in the past week, based on Refinitiv data, driven by last week's stronger-than-expected results from Wells Fargo & Co , Goldman Sachs Group Inc and other banks.
Tuesday brings results from stay-at-home winner Netflix Inc , which is part of the FAANG group of high-profile tech-related names. Chipmaker Intel Corp's results are due later this week.
After the bell Monday, shares of International Business Machines Corp were up more than 2% as the company resumed sales growth in the first quarter after a year of declines and beat Wall Street targets.
Earnings for the technology sector , which continued to grow last year while S&P 500 overall earnings dropped as the pandemic took its toll on businesses and consumers, are on track for 25% year-over-year growth in the first quarter.
But this year, tech is expected to lag profit growth of sectors that should benefit from the reopening of the economy, such as financials.
First-quarter profit growth for the S&P 500 financials sector , is now estimated at 116%, compared with 76% a week earlier.
""Every time we go to earnings, there's always the question of whether (tech) can keep delivering, especially in terms of guidance,"" said Quincy Krosby, chief market strategist at Prudential Financial in Newark, New Jersey.
""And they have,"" she said. ""What you are seeing is investors are prepared to have them - or some of them - in their portfolios along with cyclicals.""
To be sure, many strategists have been bullish on economically focused sectors, and U.S. technology and growth stocks have recently begun to gain again after months of being outpaced by economically sensitive names that appear to be a better value.
Netflix still lags the broader market. Its stock is up 2.5% so far in 2021 after gaining 67% in 2020, when consumers embraced at-home entertainment during the early pandemic lockdowns, but some analysts are optimistic Netflix's strong run is not over.
""It is reasonable to anticipate reduced engagement on the platform as the global economy reopens,"" Brian White, an internet and software analyst at Monness Crespi Hardt who recommends buying the stock, wrote in a recent note.
""However, this crisis has acted as a catalyst in introducing more consumers to the service and we believe this story has a long runway of growth in the coming years.""
The current cycle of rising chip demand is expected to help semiconductors, said Daniel Morgan, senior portfolio manager at Synovus Trust Company.
""Semiconductors are operating on all cylinders right now. They can't make them fast enough,"" he said.
Micron Technology Inc shares rose when it forecast quarterly revenue above Wall Street estimates due to a rise in demand for memory chips, thanks to 5G smartphones and artificial intelligence software.
As companies have more money to increase their technology spending, that will support tech companies as well.
""With tech, either way they win. They're really in a great position right now,"" Morgan said.
Microsoft Corp is expected to report April 27.
Rounding out the FAANG reports, Google parent Alphabet Inc , Apple Inc , Facebook Inc and Amazon.com Inc also are due to report results later this month.
(Reporting by Caroline Valetkevitch; Editing by Alden Bentley, Nick Zieminski and Richard Chang) ((caroline.valetkevitch@thomsonreuters.com; +1 646 223 6393; Reuters Messaging: caroline.valetkevitch.thomsonreuters.com@reuters.net)) Keywords: USA RESULTS/TECH (REPEAT, UPDATE 1, PREVIEW, PIX)
The views and opinions expressed herein are the views and opinions of the author and do not necessarily reflect those of Nasdaq, Inc.","After the bell Monday, shares of International Business Machines Corp were up more than 2% as the company resumed sales growth in the first quarter after a year of declines and beat Wall Street targets. ""It is reasonable to anticipate reduced engagement on the platform as the global economy reopens,"" Brian White, an internet and software analyst at Monness Crespi Hardt who recommends buying the stock, wrote in a recent note. Micron Technology Inc shares rose when it forecast quarterly revenue above Wall Street estimates due to a rise in demand for memory chips, thanks to 5G smartphones and artificial intelligence software.","Estimated year-over-year first-quarter earnings growth for S&P 500 companies rose to 31% from 25% in the past week, based on Refinitiv data, driven by last week's stronger-than-expected results from Wells Fargo & Co , Goldman Sachs Group Inc and other banks. To be sure, many strategists have been bullish on economically focused sectors, and U.S. technology and growth stocks have recently begun to gain again after months of being outpaced by economically sensitive names that appear to be a better value. Micron Technology Inc shares rose when it forecast quarterly revenue above Wall Street estimates due to a rise in demand for memory chips, thanks to 5G smartphones and artificial intelligence software.","(Repeats with no change) By Caroline Valetkevitch NEW YORK, April 19 (Reuters) - On the heels of blockbuster earnings from major U.S. banks, investors are focused on whether an upcoming batch of earnings from major technology-related companies can sustain the season's early momentum. Estimated year-over-year first-quarter earnings growth for S&P 500 companies rose to 31% from 25% in the past week, based on Refinitiv data, driven by last week's stronger-than-expected results from Wells Fargo & Co , Goldman Sachs Group Inc and other banks. Earnings for the technology sector , which continued to grow last year while S&P 500 overall earnings dropped as the pandemic took its toll on businesses and consumers, are on track for 25% year-over-year growth in the first quarter.","Earnings for the technology sector , which continued to grow last year while S&P 500 overall earnings dropped as the pandemic took its toll on businesses and consumers, are on track for 25% year-over-year growth in the first quarter. But this year, tech is expected to lag profit growth of sectors that should benefit from the reopening of the economy, such as financials. The current cycle of rising chip demand is expected to help semiconductors, said Daniel Morgan, senior portfolio manager at Synovus Trust Company.",2021,3
