Date,Article_title,Stock_symbol,Url,Publisher,Author,Article,Lsa_summary,Luhn_summary,Textrank_summary,Lexrank_summary,Year,sentiment_score
2021-09-29 00:00:00+00:00,"S&P 500 Movers: HPQ, DLTR",DLTR,https://www.nasdaq.com/articles/sp-500-movers%3A-hpq-dltr-2021-09-29,,,"In early trading on Wednesday, shares of Dollar Tree topped the list of the day's best performing components of the S&P 500 index, trading up 13.5%. Year to date, Dollar Tree has lost about 9.3% of its value.
And the worst performing S&P 500 component thus far on the day is HPQ, trading down 3.8%. HPQ is showing a gain of 11.8% looking at the year to date performance.
Two other components making moves today are APA, trading down 3.0%, and Boeing, trading up 4.2% on the day.
VIDEO: S&P 500 Movers: HPQ, DLTR
The views and opinions expressed herein are the views and opinions of the author and do not necessarily reflect those of Nasdaq, Inc.","VIDEO: S&P 500 Movers: HPQ, DLTR The views and opinions expressed herein are the views and opinions of the author and do not necessarily reflect those of Nasdaq, Inc. And the worst performing S&P 500 component thus far on the day is HPQ, trading down 3.8%. HPQ is showing a gain of 11.8% looking at the year to date performance.","VIDEO: S&P 500 Movers: HPQ, DLTR The views and opinions expressed herein are the views and opinions of the author and do not necessarily reflect those of Nasdaq, Inc. In early trading on Wednesday, shares of Dollar Tree topped the list of the day's best performing components of the S&P 500 index, trading up 13.5%. Year to date, Dollar Tree has lost about 9.3% of its value.","VIDEO: S&P 500 Movers: HPQ, DLTR The views and opinions expressed herein are the views and opinions of the author and do not necessarily reflect those of Nasdaq, Inc. In early trading on Wednesday, shares of Dollar Tree topped the list of the day's best performing components of the S&P 500 index, trading up 13.5%. And the worst performing S&P 500 component thus far on the day is HPQ, trading down 3.8%.","VIDEO: S&P 500 Movers: HPQ, DLTR The views and opinions expressed herein are the views and opinions of the author and do not necessarily reflect those of Nasdaq, Inc. In early trading on Wednesday, shares of Dollar Tree topped the list of the day's best performing components of the S&P 500 index, trading up 13.5%. And the worst performing S&P 500 component thus far on the day is HPQ, trading down 3.8%.",2021,4
2021-09-29 00:00:00+00:00,"US STOCKS-Wall Street rises, boosted by tech stocks, Boeing",DLTR,https://www.nasdaq.com/articles/us-stocks-wall-street-rises-boosted-by-tech-stocks-boeing-2021-09-29,,,"By Devik Jain
Sept 29 (Reuters) - Gains in beaten-down technology shares and Boeingled U.S. stock indexes higher on Wednesday, after concerns about inflation and rising Treasury yields sparked one of Wall Street's worst selloffs this year.
Ten of the 11 major S&P sectors rose in early trading, with technology .SPLRCI and communication services .SPLRCL among the top gainers.
Energy shares .SPNY were the worst performers, as a rally in crude prices petered out. Still, the sector has gained 3% so far this week and is on track for its best monthly performance since February.
Shares of heavyweights Amazon.com Inc AMZN.O, Facebook Inc FB.O, Microsoft Corp MSFT.O, Apple AAPL.O and Google-parent Alphabet Inc GOOGL.O rose slightly in early trade, but were nursing steep losses from the prior session.
A 4.4% jump in shares of Boeing Co BA.N also lifted the blue-chip Dow .DJI and the benchmark S&P 500 .SPX.
Boeing said its 737 MAX test flight for China's aviation regulator last month was successful and the planemaker hopes a two-year grounding will be lifted this year.
Rate-sensitive tech stocks got a boost as 10-yearU.S. Treasury yields fell after jumping 20 basis points on signals from the Federal Reserve that it could tighten its monetary policy in the months ahead. US/
""It's all coming down to the 10-year yield, the rate of change. The reason you're seeing a little relief (today) is because it's not going straight up, it's taking a bit of a breather and the market likes that,"" said Thomas Hayes, managing member at Great Hill Capital LLC in New York.
""The only game in town right now is going to be equities until those yields go up more materially and people can earn something in fixed income. There's nothing to compete with equities and that's why you're seeing every 3% to 5% dip bought.""
Analysts at Vanda Research said retail investors bought $1.9 billion in U.S. equities in Tuesday's broad market selloff, of which almost 50% of single stock purchases have been concentrated in technology stocks.
The S&P 500 index is now set to break its seven-month winning streak as fears about China Evergrande's default, potential higher corporate taxes and a sooner-than expected tapering of monetary support by the Fed clouded investor sentiment in what is usually a seasonally weak month.
At 9:53 a.m. ET, the Dow Jones Industrial Average .DJIwas up 156.80 points, or 0.46%, at 34,456.79, the S&P 500 .SPXwas up 25.21 points, or 0.58%, at 4,377.84 and the Nasdaq Composite .IXICwas up 114.56 points, or 0.79%, at 14,661.24.
Meanwhile, U.S. Senate Republicans blocked a bid by President Joe Biden's Democrats to head off a potentially crippling U.S. credit default for a second day in a row, as partisan tensions rattled an economy recovering from the COVID-19 pandemic.
JPMorgan Chase & Co JPM.N Chief Executive Jamie Dimon also cautioned a U.S. default would be a ""potentially catastrophic"" event.
Dollar Tree Inc DLTR.O jumped 10% after the discount retailer boosted its share buyback plan to a total of $2.5 billion.
Advancing issues outnumbered decliners by a 1.86-to-1 ratio on the NYSE and by a 1.34-to-1 ratio on the Nasdaq.
The S&P index recorded one new 52-week high and no new low, while the Nasdaq recorded nine new highs and 46 new lows.
(Reporting by Devik Jain in Bengaluru; Editing by Saumyadeb Chakrabarty and Maju Samuel)
((Devik.Jain@thomsonreuters.com; within U.S. +1 646 223 8780; outside U.S. +91 80 6182 2062; ;))
The views and opinions expressed herein are the views and opinions of the author and do not necessarily reflect those of Nasdaq, Inc.","Dollar Tree Inc DLTR.O jumped 10% after the discount retailer boosted its share buyback plan to a total of $2.5 billion. By Devik Jain Sept 29 (Reuters) - Gains in beaten-down technology shares and Boeingled U.S. stock indexes higher on Wednesday, after concerns about inflation and rising Treasury yields sparked one of Wall Street's worst selloffs this year. The S&P 500 index is now set to break its seven-month winning streak as fears about China Evergrande's default, potential higher corporate taxes and a sooner-than expected tapering of monetary support by the Fed clouded investor sentiment in what is usually a seasonally weak month.","Dollar Tree Inc DLTR.O jumped 10% after the discount retailer boosted its share buyback plan to a total of $2.5 billion. By Devik Jain Sept 29 (Reuters) - Gains in beaten-down technology shares and Boeingled U.S. stock indexes higher on Wednesday, after concerns about inflation and rising Treasury yields sparked one of Wall Street's worst selloffs this year. Ten of the 11 major S&P sectors rose in early trading, with technology .SPLRCI and communication services .SPLRCL among the top gainers.","Dollar Tree Inc DLTR.O jumped 10% after the discount retailer boosted its share buyback plan to a total of $2.5 billion. By Devik Jain Sept 29 (Reuters) - Gains in beaten-down technology shares and Boeingled U.S. stock indexes higher on Wednesday, after concerns about inflation and rising Treasury yields sparked one of Wall Street's worst selloffs this year. Analysts at Vanda Research said retail investors bought $1.9 billion in U.S. equities in Tuesday's broad market selloff, of which almost 50% of single stock purchases have been concentrated in technology stocks.","Dollar Tree Inc DLTR.O jumped 10% after the discount retailer boosted its share buyback plan to a total of $2.5 billion. A 4.4% jump in shares of Boeing Co BA.N also lifted the blue-chip Dow .DJI and the benchmark S&P 500 .SPX. Analysts at Vanda Research said retail investors bought $1.9 billion in U.S. equities in Tuesday's broad market selloff, of which almost 50% of single stock purchases have been concentrated in technology stocks.",2021,4
2021-09-29 00:00:00+00:00,"Consumer Sector Update for 09/29/2021: DLTR, ABG, VLTA, XLP, XLY",DLTR,https://www.nasdaq.com/articles/consumer-sector-update-for-09-29-2021%3A-dltr-abg-vlta-xlp-xly-2021-09-29,,,"Consumer stocks were flat to higher in Wednesday's premarket trading. The Consumer Staples Select Sector SPDR Fund (XLP) was flat and the Consumer Discretionary Select Sector SPDR Fund (XLY) was up 0.76% recently.
Dollar Tree (DLTR) was climbing past 6% after saying its board has increased the share repurchase authorization to $2.5 billion, reflecting an increase of $1.05 billion.
Asbury Automotive Group (ABG) was over 2% higher after announcing a deal with Larry H. Miller Group of Cos. to buy Larry H. Miller Dealerships and Total Care Auto, Powered by Landcar, for $3.2 billion.
Volta (VLTA) was gaining over 3% in value after saying it has been granted two utility patents by the US Patent and Trademark Office.
The views and opinions expressed herein are the views and opinions of the author and do not necessarily reflect those of Nasdaq, Inc.","Dollar Tree (DLTR) was climbing past 6% after saying its board has increased the share repurchase authorization to $2.5 billion, reflecting an increase of $1.05 billion. Consumer stocks were flat to higher in Wednesday's premarket trading. The Consumer Staples Select Sector SPDR Fund (XLP) was flat and the Consumer Discretionary Select Sector SPDR Fund (XLY) was up 0.76% recently.","Dollar Tree (DLTR) was climbing past 6% after saying its board has increased the share repurchase authorization to $2.5 billion, reflecting an increase of $1.05 billion. The Consumer Staples Select Sector SPDR Fund (XLP) was flat and the Consumer Discretionary Select Sector SPDR Fund (XLY) was up 0.76% recently. Asbury Automotive Group (ABG) was over 2% higher after announcing a deal with Larry H. Miller Group of Cos. to buy Larry H. Miller Dealerships and Total Care Auto, Powered by Landcar, for $3.2 billion.","Dollar Tree (DLTR) was climbing past 6% after saying its board has increased the share repurchase authorization to $2.5 billion, reflecting an increase of $1.05 billion. The Consumer Staples Select Sector SPDR Fund (XLP) was flat and the Consumer Discretionary Select Sector SPDR Fund (XLY) was up 0.76% recently. Asbury Automotive Group (ABG) was over 2% higher after announcing a deal with Larry H. Miller Group of Cos. to buy Larry H. Miller Dealerships and Total Care Auto, Powered by Landcar, for $3.2 billion.","Dollar Tree (DLTR) was climbing past 6% after saying its board has increased the share repurchase authorization to $2.5 billion, reflecting an increase of $1.05 billion. Consumer stocks were flat to higher in Wednesday's premarket trading. The Consumer Staples Select Sector SPDR Fund (XLP) was flat and the Consumer Discretionary Select Sector SPDR Fund (XLY) was up 0.76% recently.",2021,4
2021-09-29 00:00:00+00:00,Dollar Tree Boosts Share Repurchase Authorization By $1.05 Bln To $2.5 Bln - Quick Facts,DLTR,https://www.nasdaq.com/articles/dollar-tree-boosts-share-repurchase-authorization-by-%241.05-bln-to-%242.5-bln-quick-facts,,,"(RTTNews) - Dollar Tree, Inc. (DLTR) announced Wednesday that its Board of Directors has increased the Company's share repurchase authorization by $1.05 billion to an aggregate amount of $2.5 billion, including approximately $1.45 billion available for repurchases under the Board's previous repurchase authorization approved on March 2, 2021.
The Board's authorization permits the Company to make purchases of its Common Stock from time to time in the open market or through privately negotiated transactions, subject to market and other conditions, up to the aggregate amount authorized by the Board. The Board's authorization has no expiration date.
The views and opinions expressed herein are the views and opinions of the author and do not necessarily reflect those of Nasdaq, Inc.","(RTTNews) - Dollar Tree, Inc. (DLTR) announced Wednesday that its Board of Directors has increased the Company's share repurchase authorization by $1.05 billion to an aggregate amount of $2.5 billion, including approximately $1.45 billion available for repurchases under the Board's previous repurchase authorization approved on March 2, 2021. The Board's authorization permits the Company to make purchases of its Common Stock from time to time in the open market or through privately negotiated transactions, subject to market and other conditions, up to the aggregate amount authorized by the Board. The Board's authorization has no expiration date.","(RTTNews) - Dollar Tree, Inc. (DLTR) announced Wednesday that its Board of Directors has increased the Company's share repurchase authorization by $1.05 billion to an aggregate amount of $2.5 billion, including approximately $1.45 billion available for repurchases under the Board's previous repurchase authorization approved on March 2, 2021. The Board's authorization permits the Company to make purchases of its Common Stock from time to time in the open market or through privately negotiated transactions, subject to market and other conditions, up to the aggregate amount authorized by the Board. The Board's authorization has no expiration date.","(RTTNews) - Dollar Tree, Inc. (DLTR) announced Wednesday that its Board of Directors has increased the Company's share repurchase authorization by $1.05 billion to an aggregate amount of $2.5 billion, including approximately $1.45 billion available for repurchases under the Board's previous repurchase authorization approved on March 2, 2021. The Board's authorization permits the Company to make purchases of its Common Stock from time to time in the open market or through privately negotiated transactions, subject to market and other conditions, up to the aggregate amount authorized by the Board. The views and opinions expressed herein are the views and opinions of the author and do not necessarily reflect those of Nasdaq, Inc.","(RTTNews) - Dollar Tree, Inc. (DLTR) announced Wednesday that its Board of Directors has increased the Company's share repurchase authorization by $1.05 billion to an aggregate amount of $2.5 billion, including approximately $1.45 billion available for repurchases under the Board's previous repurchase authorization approved on March 2, 2021. The Board's authorization permits the Company to make purchases of its Common Stock from time to time in the open market or through privately negotiated transactions, subject to market and other conditions, up to the aggregate amount authorized by the Board. The Board's authorization has no expiration date.",2021,4
2021-09-29 00:00:00+00:00,"Are Dollar Tree, Inc.'s (NASDAQ:DLTR) Fundamentals Good Enough to Warrant Buying Given The Stock's Recent Weakness?",DLTR,https://www.nasdaq.com/articles/are-dollar-tree-inc.s-nasdaq%3Adltr-fundamentals-good-enough-to-warrant-buying-given-the,,,"With its stock down 13% over the past three months, it is easy to disregard Dollar Tree (NASDAQ:DLTR). But if you pay close attention, you might find that its key financial indicators look quite decent, which could mean that the stock could potentially rise in the long-term given how markets usually reward more resilient long-term fundamentals. Specifically, we decided to study Dollar Tree's ROE in this article.
Return on equity or ROE is an important factor to be considered by a shareholder because it tells them how effectively their capital is being reinvested. Put another way, it reveals the company's success at turning shareholder investments into profits.
How To Calculate Return On Equity?
The formula for ROE is:
Return on Equity = Net Profit (from continuing operations) ÷ Shareholders' Equity
So, based on the above formula, the ROE for Dollar Tree is:
21% = US$1.5b ÷ US$7.0b (Based on the trailing twelve months to July 2021).
The 'return' is the yearly profit. So, this means that for every $1 of its shareholder's investments, the company generates a profit of $0.21.
Why Is ROE Important For Earnings Growth?
So far, we've learned that ROE is a measure of a company's profitability. We now need to evaluate how much profit the company reinvests or ""retains"" for future growth which then gives us an idea about the growth potential of the company. Generally speaking, other things being equal, firms with a high return on equity and profit retention, have a higher growth rate than firms that don’t share these attributes.
A Side By Side comparison of Dollar Tree's Earnings Growth And 21% ROE
To start with, Dollar Tree's ROE looks acceptable. Even when compared to the industry average of 19% the company's ROE looks quite decent. As you might expect, the 2.7% net income decline reported by Dollar Tree is a bit of a surprise. We reckon that there could be some other factors at play here that are preventing the company's growth. Such as, the company pays out a huge portion of its earnings as dividends, or is faced with competitive pressures.
We then compared Dollar Tree's performance with the industry and found that the company has shrunk its earnings at a slower rate than the industry earnings which has seen its earnings shrink by 8.0% in the same period. This does offer shareholders some relief
NasdaqGS:DLTR Past Earnings Growth September 29th 2021
Earnings growth is a huge factor in stock valuation. What investors need to determine next is if the expected earnings growth, or the lack of it, is already built into the share price. By doing so, they will have an idea if the stock is headed into clear blue waters or if swampy waters await. Is DLTR fairly valued? This infographic on the company's intrinsic value has everything you need to know.
Is Dollar Tree Making Efficient Use Of Its Profits?
Because Dollar Tree doesn't pay any dividends, we infer that it is retaining all of its profits, which is rather perplexing when you consider the fact that there is no earnings growth to show for it. So there could be some other explanations in that regard. For instance, the company's business may be deteriorating.
Summary
Overall, we feel that Dollar Tree certainly does have some positive factors to consider. Yet, the low earnings growth is a bit concerning, especially given that the company has a high rate of return and is reinvesting ma huge portion of its profits. By the looks of it, there could be some other factors, not necessarily in control of the business, that's preventing growth. With that said, we studied the latest analyst forecasts and found that while the company has shrunk its earnings in the past, analysts expect its earnings to grow in the future. To know more about the latest analysts predictions for the company, check out this visualization of analyst forecasts for the company.
This article by Simply Wall St is general in nature. We provide commentary based on historical data and analyst forecasts only using an unbiased methodology and our articles are not intended to be financial advice. It does not constitute a recommendation to buy or sell any stock, and does not take account of your objectives, or your financial situation. We aim to bring you long-term focused analysis driven by fundamental data. Note that our analysis may not factor in the latest price-sensitive company announcements or qualitative material. Simply Wall St has no position in any stocks mentioned.

Have feedback on this article? Concerned about the content? Get in touch with us directly. Alternatively, email editorial-team (at) simplywallst.com.
The views and opinions expressed herein are the views and opinions of the author and do not necessarily reflect those of Nasdaq, Inc.","With its stock down 13% over the past three months, it is easy to disregard Dollar Tree (NASDAQ:DLTR). This does offer shareholders some relief NasdaqGS:DLTR Past Earnings Growth September 29th 2021 Earnings growth is a huge factor in stock valuation. Is DLTR fairly valued?","With its stock down 13% over the past three months, it is easy to disregard Dollar Tree (NASDAQ:DLTR). This does offer shareholders some relief NasdaqGS:DLTR Past Earnings Growth September 29th 2021 Earnings growth is a huge factor in stock valuation. Is DLTR fairly valued?","With its stock down 13% over the past three months, it is easy to disregard Dollar Tree (NASDAQ:DLTR). This does offer shareholders some relief NasdaqGS:DLTR Past Earnings Growth September 29th 2021 Earnings growth is a huge factor in stock valuation. Is DLTR fairly valued?","This does offer shareholders some relief NasdaqGS:DLTR Past Earnings Growth September 29th 2021 Earnings growth is a huge factor in stock valuation. With its stock down 13% over the past three months, it is easy to disregard Dollar Tree (NASDAQ:DLTR). Is DLTR fairly valued?",2021,3
