Date,Article_title,Stock_symbol,Url,Publisher,Author,Article,Lsa_summary,Luhn_summary,Textrank_summary,Lexrank_summary,Year,sentiment_score
2021-09-29 00:00:00+00:00,"4 Top Stock Trades for Thursday: LCID, DKNG, DLTR, EDIT",DLTR,https://www.nasdaq.com/articles/4-top-stock-trades-for-thursday%3A-lcid-dkng-dltr-edit-2021-09-29,,,"InvestorPlace - Stock Market News, Stock Advice & Trading Tips
After getting hammered on Tuesday, the stock market tried to find its footing on Wednesday. But the market isn’t doing a very good job convincing investors that it has bottomed. With that in mind, let’s look at a few top stock trades for Thursday.
Top Stock Trades for Tomorrow No. 1: Lucid Motors (LCID)

Click to Enlarge
Source: Chart courtesy of TrendSpider
I have not been all that optimistic on Lucid Motors (NASDAQ:LCID) when it comes to the business, but we have been hammering this thing on the technicals.
Remember, we were buyers on the aggressive long setup as LCID stock reclaimed $17.50. Then, the stock reclaimed the key $21 level, followed by its key moving averages. Now, we’re finding resistance right where it’s been drawn for an entire month.
See that the 10-day moving average continues to buoy Lucid stock and let’s see if we get a push up toward $30. Above $30, and this stock could run even further.
7 Risk-Averse Stocks to Buy for a Fortified Portfolio
At this point, though, investors should have been or should be locking in at least some profit, in my opinion.
Top Stock Trades for Tomorrow No. 2: DraftKings (DKNG)

Click to Enlarge
Source: Chart courtesy of TrendSpider
Like other growth stocks, DraftKings (NASDAQ:DKNG) has been under pressure. However, the company’s intention to go for a $22 billion mergers and acquisitions (M&A) move — when it itself only has about a$20 billion market capitalization — has clearly convinced some investors to de-risk by selling the stock.
It’s now down in seven of the past eight sessions.
With Tuesday’s decline below $50.72, we technically had a monthly-down rotation in DKNG stock. So that’s a level bulls need to reclaim if they want to squeeze the stock back up to the 50-day and 200-day moving averages.
Above that opens the door back to $60-plus.
On the downside, however, let’s see if the stock can fetch a bounce at uptrend support. Below that mark may put the 21-month moving average on the table.
Top Stock Trades for Tomorrow No. 3: Dollar Tree (DLTR)

Click to Enlarge
Source: Chart courtesy of TrendSpider
Dollar Tree (NASDAQ:DLTR) ripped higher on Wednesday, climbing more than 16% to $100. That said, it’s a fairly messy chart, which is why I used the weekly instead of the daily.
Back above the key $97 level and the 200-week moving average now, shares are struggling with the weekly VWAP measure and the 21-week moving average.
If the stock can push above those measures, it puts the 50-week in play. Above the 50-week and the third-quarter high is on the table near $107.
7 Meme Stocks Still Winning on Reddit Despite the Naysayers
On the downside, though, a move below $97 bulls may having bulls wanting to exercise some caution. Otherwise, buyers can be long against this level.
Top Trades for Tomorrow No. 4: Editas Medicine (EDIT)

Click to Enlarge
Source: Chart courtesy of TrendSpider
Editas Medicine (NASDAQ:EDIT) is enjoying the opposite price action from DLTR, down almost 19% and crashing through several key levels and moving averages. The most recent of which was uptrend support (blue line).
Now down four days in a row, Editas has fallen more than 31% in that span.
If it can reclaim uptrend support, look for a move back up toward the 200-day moving average and the gap-fill area. Above that could put the second gap-fill in play near the 50-day moving average.
On the downside, however, the $37.63 level and 21-month moving average could be on the table.
On the date of publication, Bret Kenwell held a long position in DKNG. The opinions expressed in this article are those of the writer, subject to the InvestorPlace.com Publishing Guidelines.
Bret Kenwell is the manager and author of Future Blue Chips and is on Twitter @BretKenwell.
The post 4 Top Stock Trades for Thursday: LCID, DKNG, DLTR, EDIT appeared first on InvestorPlace.
The views and opinions expressed herein are the views and opinions of the author and do not necessarily reflect those of Nasdaq, Inc.","Click to Enlarge Source: Chart courtesy of TrendSpider Dollar Tree (NASDAQ:DLTR) ripped higher on Wednesday, climbing more than 16% to $100. Click to Enlarge Source: Chart courtesy of TrendSpider Editas Medicine (NASDAQ:EDIT) is enjoying the opposite price action from DLTR, down almost 19% and crashing through several key levels and moving averages. 3: Dollar Tree (DLTR)","Click to Enlarge Source: Chart courtesy of TrendSpider Dollar Tree (NASDAQ:DLTR) ripped higher on Wednesday, climbing more than 16% to $100. Click to Enlarge Source: Chart courtesy of TrendSpider Editas Medicine (NASDAQ:EDIT) is enjoying the opposite price action from DLTR, down almost 19% and crashing through several key levels and moving averages. 3: Dollar Tree (DLTR)","Click to Enlarge Source: Chart courtesy of TrendSpider Editas Medicine (NASDAQ:EDIT) is enjoying the opposite price action from DLTR, down almost 19% and crashing through several key levels and moving averages. 3: Dollar Tree (DLTR) Click to Enlarge Source: Chart courtesy of TrendSpider Dollar Tree (NASDAQ:DLTR) ripped higher on Wednesday, climbing more than 16% to $100.","The post 4 Top Stock Trades for Thursday: LCID, DKNG, DLTR, EDIT appeared first on InvestorPlace. 3: Dollar Tree (DLTR) Click to Enlarge Source: Chart courtesy of TrendSpider Dollar Tree (NASDAQ:DLTR) ripped higher on Wednesday, climbing more than 16% to $100.",2021,4
2021-09-29 00:00:00+00:00,Stock Market Today: Relief Rally Fizzles Late,DLTR,https://www.nasdaq.com/articles/stock-market-today%3A-relief-rally-fizzles-late-2021-09-29,,,"The markets staged a slim, shaky rebound on a Wednesday that was light on data, with the gravitational pull of U.S. Treasuries' rate revival in plain sight.
A day after the 10-year Treasury yield reached 1.567%, putting a scare into the major indexes, it retreated to roughly 1.5% early on in the session ... but clawed its way back to 1.54% by the afternoon.
SEE MORE The 21 Best Stocks to Buy for the Rest of 2021
What did that do to equities?
It put a lid on technology stocks (-0.1%), which finished with the day's second-worst sector performance. Instead, investors were interested in defense. Utility stocks (+1.5%), consumer staples (+0.9%) and healthcare (+0.8%) led the markets higher, with notable gains coming from the likes of Eli Lilly (LLY, +4.0%), Sempra Energy (SRE, +3.1%) and ConAgra (CAG, +3.0%).
Even so, the major indices coughed up much of the day's progress during the session's final hour. The result was small gains for the Dow (+0.3% to 34,390) and S&P 500 (+0.2% to 4,359), while the tech-heavy Nasdaq finished with a 0.2% loss to 14,512.
Sign up for Kiplinger's FREE Investing Weekly e-letter for stock, ETF and mutual fund recommendations, and other investing advice.
Other news in thestock market today
The small-cap Russell 2000 also slid into the red shortly before the close, giving up 0.2% to 2,225.
Dollar Tree (DLTR) surged 16.5% today after the discount retailer said it will begin offering products priced up to $5 in its Dollar Tree Plus stores and will test the $1+ price points in select legacy stores. DLTR also announced that its board of directors has authorized a $1.05 billion-boost to its share repurchase program, bringing the aggregate amount to $2.5 billion. Already in fiscal 2021, the company has repurchased $950 million of its shares, according to Michael Witynski, president and CEO of Dollar Tree.
Eyewear startup Warby Parker (WRBY) made a splash in its market debut. WRBY went public via a direct listing, an alternative to traditional initial public offerings (IPOs). WRBY stock opened at $54.05 per share, more than 35% above its $40 reference point. Shares gained a little more ground from there, finishing the day up 36.2% to $54.49. There's still a host of companies set to go public over the next several months. Here's a running list of the most anticipated IPOs for the rest of 2021.
U.S. crude oil futures slipped 0.6% to finish at $74.83 per share.
Gold futures shed 0.8% to settle at $1,722.90 an ounce.
The CBOE Volatility Index (VIX) pulled back 2.3% to 22.71.
Bitcoin prices slid 1.0% to $41.178.28. (Bitcoin trades 24 hours a day; prices reported here are as of 4 p.m. each trading day.)
YCharts
Can AI Really Pick Stocks?
We frequently keep tabs on the so-called smart money.
SEE MORE 7 Bond Funds to Anchor Your Retirement Portfolio
While even the most revered investors can get it wrong from time to time (just ask Warren Buffett about his 1993 purchase of Dexter Shoe), hedge funds, billionaires and institutional investors have access to invaluable insights and research that makes their high-conviction moves worth monitoring. That's why we provide the occasional look into billionaire buys, hedge-fund favorites and, of course, Buffett's Berkshire Hathaway portfolio.
But from time to time, it also pays to see what the robots have to say.
Financial advice firm Danelfin (formerly Danel Capital) has developed an analytics platform that analyzes fundamental, technical and sentiment data for hundreds of U.S. stocks to determine which have the best setup for market outperformance over the next 90 days.
We've recently caught up with Danelfin, whose system continues to beat the market in 2021, and reviewed its 10 top stocks to watch at the moment. Check them out!
SEE MORE The 25 Best Low-Fee Mutual Funds You Can Buy
The views and opinions expressed herein are the views and opinions of the author and do not necessarily reflect those of Nasdaq, Inc.","Dollar Tree (DLTR) surged 16.5% today after the discount retailer said it will begin offering products priced up to $5 in its Dollar Tree Plus stores and will test the $1+ price points in select legacy stores. DLTR also announced that its board of directors has authorized a $1.05 billion-boost to its share repurchase program, bringing the aggregate amount to $2.5 billion. The markets staged a slim, shaky rebound on a Wednesday that was light on data, with the gravitational pull of U.S. Treasuries' rate revival in plain sight.","Dollar Tree (DLTR) surged 16.5% today after the discount retailer said it will begin offering products priced up to $5 in its Dollar Tree Plus stores and will test the $1+ price points in select legacy stores. DLTR also announced that its board of directors has authorized a $1.05 billion-boost to its share repurchase program, bringing the aggregate amount to $2.5 billion. WRBY went public via a direct listing, an alternative to traditional initial public offerings (IPOs).","Dollar Tree (DLTR) surged 16.5% today after the discount retailer said it will begin offering products priced up to $5 in its Dollar Tree Plus stores and will test the $1+ price points in select legacy stores. DLTR also announced that its board of directors has authorized a $1.05 billion-boost to its share repurchase program, bringing the aggregate amount to $2.5 billion. SEE MORE 7 Bond Funds to Anchor Your Retirement Portfolio While even the most revered investors can get it wrong from time to time (just ask Warren Buffett about his 1993 purchase of Dexter Shoe), hedge funds, billionaires and institutional investors have access to invaluable insights and research that makes their high-conviction moves worth monitoring.","Dollar Tree (DLTR) surged 16.5% today after the discount retailer said it will begin offering products priced up to $5 in its Dollar Tree Plus stores and will test the $1+ price points in select legacy stores. DLTR also announced that its board of directors has authorized a $1.05 billion-boost to its share repurchase program, bringing the aggregate amount to $2.5 billion. A day after the 10-year Treasury yield reached 1.567%, putting a scare into the major indexes, it retreated to roughly 1.5% early on in the session ... but clawed its way back to 1.54% by the afternoon.",2021,5
2021-09-29 00:00:00+00:00,"US STOCKS-S&P 500, Dow gain amid inflation concerns, debt ceiling debate",DLTR,https://www.nasdaq.com/articles/us-stocks-sp-500-dow-gain-amid-inflation-concerns-debt-ceiling-debate-2021-09-29,,,"By Stephen Culp
NEW YORK, Sept 29 (Reuters) - Wall Street ended firmer on Wednesday in a partial rebound from the previous day's broad sell-off, with remarks from U.S. Federal Reserve Chairman Jerome Powell and the ongoing debt ceiling debate keeping a lid on gains.
The S&P 500 index .SPX and the Dow Jones Industrial Average .DJI advanced, but the Nasdaq Composite .IXIC closed lower as Treasury yields halted their ascent. Defensive sectors took the lead as investors sought stability in the volatile market.
All three remain on course to post monthly declines, with the bellwether S&P 500 snapping a seven-month winning streak.
""The same story we've seen for a couple of weeks,"" said Oliver Pursche, senior vice president at Wealthspire Advisors, in New York.
""Investors are concerned about three things: the eventual taper of bond purchases by the Fed, ongoing inflation with Chairman Powell saying it's going to stick around longer than initially expected, and the debt ceiling issue that congress is grappling with.""
Powell, speaking at a European Central Bank event, expressed frustration over persistent supply chain woes which could keep inflation elevated for longer than expected.
The stock market strengthened following his remarks.
""Powell has been very good at delivering the news officially that everyone knows is coming,"" Pursche said.
Wrangling continued on Capitol Hill over funding the government as the Friday deadline to prevent a shutdown approached, with mounting concerns over a U.S. credit default.
U.S. Treasury yields paused after a runup in recent days as the debt ceiling debate unfolded in Washington.
The Dow Jones Industrial Average .DJIrose 90.73 points, or 0.26%, to 34,390.72; the S&P 500 .SPXgained 6.83 points, or 0.16%, at 4,359.46; and the Nasdaq Composite .IXICdropped 34.24 points, or 0.24%, to 14,512.44.
Of the 11 major sectors in the S&P 500, materials .SPLRCM suffered the largest percentage drop, with utilities .SPLRCU leading the way with a 1.3% gain.
Boeing Co BA.N provided the biggest lift to the Dow following China's aviation regulator's successful 737 MAX test. The planemaker's shares rose 3.2%.
Discount retailer Dollar Tree Inc DLTR.O jumped 16.5% after increasing its buyback authorization by $1.05 billion to $2.5 billion.
Drugmaker Eli Lilly & Co LLY.N gained 4.0% on Citigroup's rating upgrade to ""buy"" from ""neutral.""
Advancing issues outnumbered decliners on the NYSE by a 1.26-to-1 ratio; on Nasdaq, a 1.34-to-1 ratio favored decliners.
The S&P 500 posted seven new 52-week highs and two new lows; the Nasdaq Composite recorded 38 new highs and 151 new lows.
Volume on U.S. exchanges was 11.42 billion shares, compared with the 10.45 billion average over the last 20 trading days.
(Reporting by Stephen Culp; Additional reporting by Devik Jain in Bengaluru; Editing by Richard Chang)
((stephen.culp@thomsonreuters.com; 646-223-6076;))
The views and opinions expressed herein are the views and opinions of the author and do not necessarily reflect those of Nasdaq, Inc.","Discount retailer Dollar Tree Inc DLTR.O jumped 16.5% after increasing its buyback authorization by $1.05 billion to $2.5 billion. By Stephen Culp NEW YORK, Sept 29 (Reuters) - Wall Street ended firmer on Wednesday in a partial rebound from the previous day's broad sell-off, with remarks from U.S. Federal Reserve Chairman Jerome Powell and the ongoing debt ceiling debate keeping a lid on gains. ""Investors are concerned about three things: the eventual taper of bond purchases by the Fed, ongoing inflation with Chairman Powell saying it's going to stick around longer than initially expected, and the debt ceiling issue that congress is grappling with.""","Discount retailer Dollar Tree Inc DLTR.O jumped 16.5% after increasing its buyback authorization by $1.05 billion to $2.5 billion. By Stephen Culp NEW YORK, Sept 29 (Reuters) - Wall Street ended firmer on Wednesday in a partial rebound from the previous day's broad sell-off, with remarks from U.S. Federal Reserve Chairman Jerome Powell and the ongoing debt ceiling debate keeping a lid on gains. The S&P 500 index .SPX and the Dow Jones Industrial Average .DJI advanced, but the Nasdaq Composite .IXIC closed lower as Treasury yields halted their ascent.","Discount retailer Dollar Tree Inc DLTR.O jumped 16.5% after increasing its buyback authorization by $1.05 billion to $2.5 billion. By Stephen Culp NEW YORK, Sept 29 (Reuters) - Wall Street ended firmer on Wednesday in a partial rebound from the previous day's broad sell-off, with remarks from U.S. Federal Reserve Chairman Jerome Powell and the ongoing debt ceiling debate keeping a lid on gains. ""Investors are concerned about three things: the eventual taper of bond purchases by the Fed, ongoing inflation with Chairman Powell saying it's going to stick around longer than initially expected, and the debt ceiling issue that congress is grappling with.""","Discount retailer Dollar Tree Inc DLTR.O jumped 16.5% after increasing its buyback authorization by $1.05 billion to $2.5 billion. The S&P 500 index .SPX and the Dow Jones Industrial Average .DJI advanced, but the Nasdaq Composite .IXIC closed lower as Treasury yields halted their ascent. Defensive sectors took the lead as investors sought stability in the volatile market.",2021,4
2021-09-29 00:00:00+00:00,"US STOCKS-Wall Street closes up amid inflation concerns, debt ceiling debate",DLTR,https://www.nasdaq.com/articles/us-stocks-wall-street-closes-up-amid-inflation-concerns-debt-ceiling-debate-2021-09-29,,,"By Stephen Culp
NEW YORK, Sept 29 (Reuters) - Wall Street ended firmer on Wednesday in a partial rebound from the previous day's broad sell-off, with remarks from U.S. Federal Reserve Chairman Jerome Powell and the ongoing debt ceiling debate keeping a lid on gains.
The S&P 500 index .SPX and the Dow Jones Industrial Average .DJI advanced, but the Nasdaq Composite .IXIC closed lower as Treasury yields halted their ascent. Defensive sectors took the lead as investors sought stability in the volatile market.
Still, all three remain on course to post monthly declines, with the bellwether S&P 500 snapping a seven-month winning streak.
""The same story we've seen for a couple of weeks,"" said Oliver Pursche, senior vice president at Wealthspire Advisors, in New York.
""Investors are concerned about three things: the eventual taper of bond purchases by the Fed, ongoing inflation with Chairman Powell saying it's going to stick around longer than initially expected, and the debt ceiling issue that congress is grappling with.""
Powell, speaking at a European Central Bank event, expressed frustration over persistent supply chain woes which could keep inflation elevated for longer than expected.
The stock market strengthened following his remarks.
""Powell has been very good at delivering the news officially that everyone knows is coming,"" Pursche said.
Wrangling continued on Capitol Hill over funding the government as the Friday deadline to prevent a shutdown approached, with mounting concerns over a U.S. credit default.
U.S. Treasury yields paused after a runup in recent days as the debt ceiling debate unfolded in Washington.
Unofficially, the Dow Jones Industrial Average .DJI rose 90.93 points, or 0.27%, to 34,390.92, the S&P 500 .SPX gained 6.86 points, or 0.16%, to 4,359.49 and the Nasdaq Composite .IXIC dropped 34.24 points, or 0.24%, to 14,512.44.
Boeing Co BA.N provided the biggest lift to the Dow following China's aviation regulator's successful 737 MAX test.
Discount retailer Dollar Tree Inc DLTR.O jumped after increasing its buyback authorization by $1.05 billion to $2.5 billion.
Drugmaker Eli Lilly & Co LLY.Ngained on Citigroup's rating upgrade to ""buy"" from ""neutral.""
(Reporting by Stephen Culp; Additional reporting by Devik Jain in Bengaluru; Editing by Richard Chang)
((stephen.culp@thomsonreuters.com; 646-223-6076;))
The views and opinions expressed herein are the views and opinions of the author and do not necessarily reflect those of Nasdaq, Inc.","Discount retailer Dollar Tree Inc DLTR.O jumped after increasing its buyback authorization by $1.05 billion to $2.5 billion. By Stephen Culp NEW YORK, Sept 29 (Reuters) - Wall Street ended firmer on Wednesday in a partial rebound from the previous day's broad sell-off, with remarks from U.S. Federal Reserve Chairman Jerome Powell and the ongoing debt ceiling debate keeping a lid on gains. ""Investors are concerned about three things: the eventual taper of bond purchases by the Fed, ongoing inflation with Chairman Powell saying it's going to stick around longer than initially expected, and the debt ceiling issue that congress is grappling with.""","Discount retailer Dollar Tree Inc DLTR.O jumped after increasing its buyback authorization by $1.05 billion to $2.5 billion. By Stephen Culp NEW YORK, Sept 29 (Reuters) - Wall Street ended firmer on Wednesday in a partial rebound from the previous day's broad sell-off, with remarks from U.S. Federal Reserve Chairman Jerome Powell and the ongoing debt ceiling debate keeping a lid on gains. The S&P 500 index .SPX and the Dow Jones Industrial Average .DJI advanced, but the Nasdaq Composite .IXIC closed lower as Treasury yields halted their ascent.","Discount retailer Dollar Tree Inc DLTR.O jumped after increasing its buyback authorization by $1.05 billion to $2.5 billion. By Stephen Culp NEW YORK, Sept 29 (Reuters) - Wall Street ended firmer on Wednesday in a partial rebound from the previous day's broad sell-off, with remarks from U.S. Federal Reserve Chairman Jerome Powell and the ongoing debt ceiling debate keeping a lid on gains. ""Investors are concerned about three things: the eventual taper of bond purchases by the Fed, ongoing inflation with Chairman Powell saying it's going to stick around longer than initially expected, and the debt ceiling issue that congress is grappling with.""","Discount retailer Dollar Tree Inc DLTR.O jumped after increasing its buyback authorization by $1.05 billion to $2.5 billion. By Stephen Culp NEW YORK, Sept 29 (Reuters) - Wall Street ended firmer on Wednesday in a partial rebound from the previous day's broad sell-off, with remarks from U.S. Federal Reserve Chairman Jerome Powell and the ongoing debt ceiling debate keeping a lid on gains. The S&P 500 index .SPX and the Dow Jones Industrial Average .DJI advanced, but the Nasdaq Composite .IXIC closed lower as Treasury yields halted their ascent.",2021,4
