Date,Article_title,Stock_symbol,Url,Publisher,Author,Article,Lsa_summary,Luhn_summary,Textrank_summary,Lexrank_summary,Year,sentiment_score
2022-05-09 00:00:00+00:00,3 Dividend-Paying Tech Stocks to Buy in May,INTC,https://www.nasdaq.com/articles/3-dividend-paying-tech-stocks-to-buy-in-may,,,"Dividends are underrated by technology investors. If you buy into a stock that consistently raises its dividend per share, it can provide a growing stream of cash that you can take home as income or reinvest to buy more shares. A lot of the most popular technology stocks these days are unprofitable and don't pay out a dividend to shareholders, however, if you look at some older companies that are already profitable, there are plenty of technology stocks that pay out a dividend each year. These profitable businesses can be safer stocks to own in volatile market environments like the one facing investors today.
Here are three top dividend-paying technology stocks to buy this month.
Image source: Getty Images.
1. Microsoft: 0.86% yield
Everyone knows Microsoft (NASDAQ: MSFT), the technology giant that has been a leader in enterprise and consumer software for many decades. The company owns and operates multiple business lines, including Microsoft Office, Xbox video game consoles, LinkedIn, and Microsoft Azure.
Microsoft is one of the largest stocks in the world, with a market cap of $2.2 trillion, and for good reason. The company generated $49.4 billion in revenue just last quarter, up 19% year over year, and $20.4 billion in operating income, up 18% year over year. Steady growth is coming from Microsoft Office and the Xbox division, but the highlight of this business right now is Intelligent Cloud and Microsoft Azure. The Intelligent Cloud segment grew revenue 26% year over year to $19.1 billion in the quarter, with Microsoft Azure growing revenue 46% year over year (management doesn't disclose a specific revenue number). With the overall cloud computing market expected to grow at a double-digit rate through 2030, Azure should continue to benefit as one of the key infrastructure providers to the industry.
As of this writing, Microsoft has a 0.86% dividend yield and trades at a trailing price-to-operating income (P/OI) of 27. That P/OI is not cheap, and the dividend yield is not very high, but with consistent growth and a dominant position within its key operating segments, Microsoft looks like a safe technology stock you can own for many years.
2. Texas Instruments: 2.61% yield
If Microsoft Azure is one of the backbones of the cloud computing industry, then semiconductors are the backbone for computing in general. More simply, none of our digital or internet-connected devices would work without semiconductor-based computer chips in them. Texas Instruments (NASDAQ: TXN) is one of the leading manufacturers of semiconductors worldwide, specifically focusing on the industrial and automotive markets. It has over 80,000 products for numerous different industries, serving different niches that customers around the world need.
In the first quarter of this year, TI's revenue grew 14% year over year to $4.9 billion, and operating income grew 32% year over year to $2.56 billion. There is a durable tailwind for semiconductor products across both the industrial and automotive industries as more and more companies decide to digitize their products. The growth of electric vehicle manufacturing is a great example of this. This tailwind should benefit TI's demand over the next decade.
TI has a market cap of $162 billion. Free cash flow, management's preferred metric to measure profitability, was $6.45 billion over the last 12 months. That gives the stock a price-to-free cash flow (P/FCF) of 25. The dividend yield sits at 2.61%, giving investors a healthy stream of income each year just for owning shares. With the growing demand for semiconductors around the world, TI's free cash flow and dividend payouts should consistently grow over the next 10 years and beyond, benefiting shareholders who hold for the long term.
3. Taiwan Semiconductor: 1.57% yield
There is one more semiconductor company to look at: Taiwan Semiconductor Manufacturing Corporation (NYSE: TSM), or just TSMC. The Taiwanese manufacturer is the market leader in the semiconductor foundry industry. It has a unique business model compared to an integrated manufacturer like Intel. Instead of designing and building the chips themselves, TSMC lets other companies like Apple design chips for their electronic devices and solely focuses on the manufacturing process. This focus and decades of expertise has led TSMC to become the most technologically advanced semiconductor manufacturer in the world, with over 50% market share.
In the last 12 months, TSMC generated $59 billion in revenue and $25 billion in operating income. Management expects revenue to grow at a 15% to 20% compound growth rate through 2026 as the company rides the growing demand for semiconductors around the globe. This will give the company plenty of cash flow to support and likely grow its current 1.57% dividend yield. At a market cap of $468 billion, the stock trades at a P/OI of 18.7, which seems cheap given TSMC's dominance in the industry and a clear path to growing its financials over the next decade.
MSFT Dividend Per Share (TTM) data by YCharts
Over the last 10 years, the dividend per share for all three of these stocks has gone up by over 200%, making them some of the top large-cap dividend growers in the world. If their financials continue to grow over the next 10 years, it is highly likely this dividend-per-share growth will continue. This will build a growing stream of income for you if you buy and hold these stocks for the long haul.
10 stocks we like better than Microsoft
When our award-winning analyst team has a stock tip, it can pay to listen. After all, the newsletter they have run for over a decade, Motley Fool Stock Advisor, has tripled the market.*
They just revealed what they believe are the ten best stocks for investors to buy right now... and Microsoft wasn't one of them! That's right -- they think these 10 stocks are even better buys.
See the 10 stocks
*Stock Advisor returns as of April 7, 2022
Brett Schafer has no position in any of the stocks mentioned. The Motley Fool has positions in and recommends Apple, Intel, Microsoft, Taiwan Semiconductor Manufacturing, and Texas Instruments. The Motley Fool recommends the following options: long January 2023 $57.50 calls on Intel, long March 2023 $120 calls on Apple, short January 2023 $57.50 puts on Intel, and short March 2023 $130 calls on Apple. The Motley Fool has a disclosure policy.
The views and opinions expressed herein are the views and opinions of the author and do not necessarily reflect those of Nasdaq, Inc.","With the overall cloud computing market expected to grow at a double-digit rate through 2030, Azure should continue to benefit as one of the key infrastructure providers to the industry. That P/OI is not cheap, and the dividend yield is not very high, but with consistent growth and a dominant position within its key operating segments, Microsoft looks like a safe technology stock you can own for many years. At a market cap of $468 billion, the stock trades at a P/OI of 18.7, which seems cheap given TSMC's dominance in the industry and a clear path to growing its financials over the next decade.","The Intelligent Cloud segment grew revenue 26% year over year to $19.1 billion in the quarter, with Microsoft Azure growing revenue 46% year over year (management doesn't disclose a specific revenue number). In the first quarter of this year, TI's revenue grew 14% year over year to $4.9 billion, and operating income grew 32% year over year to $2.56 billion. The Motley Fool recommends the following options: long January 2023 $57.50 calls on Intel, long March 2023 $120 calls on Apple, short January 2023 $57.50 puts on Intel, and short March 2023 $130 calls on Apple.","The company generated $49.4 billion in revenue just last quarter, up 19% year over year, and $20.4 billion in operating income, up 18% year over year. The Intelligent Cloud segment grew revenue 26% year over year to $19.1 billion in the quarter, with Microsoft Azure growing revenue 46% year over year (management doesn't disclose a specific revenue number). In the first quarter of this year, TI's revenue grew 14% year over year to $4.9 billion, and operating income grew 32% year over year to $2.56 billion.","With the growing demand for semiconductors around the world, TI's free cash flow and dividend payouts should consistently grow over the next 10 years and beyond, benefiting shareholders who hold for the long term. This focus and decades of expertise has led TSMC to become the most technologically advanced semiconductor manufacturer in the world, with over 50% market share. The Motley Fool has positions in and recommends Apple, Intel, Microsoft, Taiwan Semiconductor Manufacturing, and Texas Instruments.",2022,4
2022-05-08 00:00:00+00:00,These 3 Tech Stocks Are Building the Future,INTC,https://www.nasdaq.com/articles/these-3-tech-stocks-are-building-the-future-1,,,"Companies don't earn profits just by magic. First, they have to invest in products, services, and infrastructure to provide useful goods and/or services for customers. The more useful the product or service, and the more difficult that product or service is to replicate, the more a company and its shareholders stand to benefit.
Today, there are three household-name tech giants investing billions of dollars in massive projects that could pay off hugely in the future. However, with the market concerned about interest rates and the economy, these stocks are getting punished for that very spending today.
But for long-term investors, a beaten-down stock with a big potential future revenue stream spells ""opportunity.""
Amazon is building a massive e-commerce infrastructure
Amazon.com (NASDAQ: AMZN) sold off after its recent earnings report. Revenue was in line with guidance, but operating income declined year over year, as Amazon's costs soared in its e-commerce business.
Before the pandemic hit, Amazon had been investing in its logistics infrastructure to provide free one-day delivery, down from its previous two-delivery promise for Prime customers. That was a huge undertaking.
Then, when the pandemic hit, Amazon had to turbocharge its spending on infrastructure to satisfy all the demand for its regular two-day service. Given rising labor and fuel costs, Amazon's costs and capital expenditures soared. Over the next two years, Amazon doubled the size of the fulfillment network that it had taken nearly 30 years to build prior to COVID-19.
On the Q1 conference call with analysts, Amazon said it had gone from undercapacity during the pandemic to overcapacity today, as e-commerce demand corrected back to its prior course. While that's pressuring margins in the near term, it also means that Amazon's logistics platform is ready to shine. Management said the company was only now just getting delivery speeds back to pre-COVID levels.
Now that Amazon has built out this massive logistics network, it should have a huge advantage over rivals. If you can get free shipping to your door in one day, or even the same day, you'll have even less of an impulse to visit a store -- especially if fuel prices stay this high. That could lead to increased sales in the second half of the year.
Moreover, Amazon just opened up ""Buy with Prime"" to online merchants off the Amazon platform, giving independent e-commerce companies access to its fast, free shipping, payments infrastructure, and free returns. Amazon's delivery network now rivals those of a FedEx or UPS -- and it can probably undercut their prices, since it will be using spare capacity from shipping its own goods.
Since revenue is decelerating in the first half of the year over difficult comparisons, Amazon's margins are down. However, profits should inflect upwards when revenue grows again, since Amazon won't be spending as much. That could happen as soon as Prime Day in Q3 or the holiday shopping season in Q4.
Meta Platforms: What's in a name?
The market has also punished Meta Platforms (NASDAQ: FB), formerly known as Facebook, for a massive project into which it's plowing billions of dollars every quarter. Late last year, Facebook CEO Mark Zuckerberg announced the company would be changing its name to Meta Platforms, while investing billions to build out the metaverse, a catchall term for a new digital world that feels like reality.
In combination with the name change, Meta Platforms began to break out results from the metaverse-focused ""Reality Labs"" segment. This exposure showed that Reality Labs is burning about $3 billion every quarter.
Today, investors really don't want to see companies spending billions of dollars on a futuristic vision with an uncertain payoff. On the recent conference call, Zuckerberg said: ""[T]his is laying the groundwork for what I expect to be a very exciting 2030s when this is like -- when this is sort of more established as the primary computing platform at that point. I think that there will be results along the way for that, too. But I do think that this is going to be a longer cycle.""
Meta Platforms will be releasing a version of its Horizon metaverse operating system this year, and it will likely monetize more opportunities along the way. Last quarter, sales of Oculus headsets were $695 million, up 30% over the past year. Meta is also likely to realize platform fees from sales of digital goods in its metaverse over the next few years.
The company's ambitions leave me torn. While I think the metaverse may be an enormous opportunity, of these three stocks, Meta Platforms is the most likely to cause disappointment. Will the metaverse be widely adopted as the ""next major computing platform,"" as Zuckerberg says? Or will it just be a niche application for gamers and tech enthusiasts? At this point, it's hard to say.
Image source: Getty Images.
Intel is attempting the ""biggest comeback in semiconductor history""
Meanwhile, the market has really soured on Intel (NASDAQ: INTC) in recent years. That's because Intel used to make the best and fastest chips in the world, but a few years ago, Taiwan Semiconductor Manufacturing Corp. (TSMC) passed it at the leading edge. That gave Intel's rivals a chance to leapfrog ""Chipzilla"" to produce the most advanced, power-efficient chips on the market.
TSMC doesn't produce its own chips, but rather acts as a third-party manufacturer for most of the world's leading chip designers. Under new CEO Pat Gelsinger, Intel is now embarking on an ambitious quest. Not only does the company hope to catch up to TSMC on leading-edge technology for its own chips, but Gelsinger also wants Intel to become an outsourced foundry to other designers too, rivaling TSMC. Given that more and more large tech companies are now designing their own custom chips for specific applications, that makes a lot of sense.
Can Intel pull it off? Again, it's uncertain what the payoff will be, but as of last quarter, it already had a $1 billion revenue run rate producing chips for third parties. Gelsinger also said on the recent earnings call that the company had engaged 10 qualified ""anchor clients"" to produce chips once it has built out its foundries. Intel is beginning construction on multibillion-dollar fabrication plants in Arizona and Ohio, and across Europe. And it jump-started its foundry ambitions recently, announcing the purchase of third-party foundry Tower Semiconductor for $5.4 billion.
Intel will be spending $27 billion in capital expenditures this year, and will likely ramp those investments over the next few years as it builds out a large manufacturing ecosystem outside of Asia, where most of chip production occurs today. The company will have to raise subsidies from governments to do so, but it seems momentum for legislation will lead it to pass, both in Europe and the U.S.
If I had to bet, I would say Intel pulls it off, but this will be a very expensive undertaking, and the payoff won't be for years. Still, it appears Gelsinger and new chief financial officer David Zinsner are believers: Each bought around $250,000 worth of stock on the open market last week after the market swooned. Intel now trades at just 7.4 times earnings, so if its investments pay off, that could be a huge boon for investors two to three years from now.
10 stocks we like better than Amazon
When our award-winning analyst team has a stock tip, it can pay to listen. After all, the newsletter they have run for over a decade, Motley Fool Stock Advisor, has tripled the market.*
They just revealed what they believe are the ten best stocks for investors to buy right now... and Amazon wasn't one of them! That's right -- they think these 10 stocks are even better buys.
See the 10 stocks
*Stock Advisor returns as of April 7, 2022
John Mackey, CEO of Whole Foods Market, an Amazon subsidiary, is a member of The Motley Fool's board of directors. Randi Zuckerberg, a former director of market development and spokeswoman for Facebook and sister to Meta Platforms CEO Mark Zuckerberg, is a member of The Motley Fool's board of directors.
Billy Duberstein has positions in Amazon, Meta Platforms, and Taiwan Semiconductor Manufacturing. His clients may own shares of the companies mentioned. The Motley Fool has positions in and recommends Amazon, FedEx, Intel, Meta Platforms, and Taiwan Semiconductor Manufacturing. The Motley Fool recommends the following options: long January 2023 $57.50 calls on Intel and short January 2023 $57.50 puts on Intel. The Motley Fool has a disclosure policy.
The views and opinions expressed herein are the views and opinions of the author and do not necessarily reflect those of Nasdaq, Inc.","Intel is attempting the ""biggest comeback in semiconductor history"" Meanwhile, the market has really soured on Intel (NASDAQ: INTC) in recent years. Before the pandemic hit, Amazon had been investing in its logistics infrastructure to provide free one-day delivery, down from its previous two-delivery promise for Prime customers. Late last year, Facebook CEO Mark Zuckerberg announced the company would be changing its name to Meta Platforms, while investing billions to build out the metaverse, a catchall term for a new digital world that feels like reality.","Intel is attempting the ""biggest comeback in semiconductor history"" Meanwhile, the market has really soured on Intel (NASDAQ: INTC) in recent years. Late last year, Facebook CEO Mark Zuckerberg announced the company would be changing its name to Meta Platforms, while investing billions to build out the metaverse, a catchall term for a new digital world that feels like reality. Randi Zuckerberg, a former director of market development and spokeswoman for Facebook and sister to Meta Platforms CEO Mark Zuckerberg, is a member of The Motley Fool's board of directors.","Intel is attempting the ""biggest comeback in semiconductor history"" Meanwhile, the market has really soured on Intel (NASDAQ: INTC) in recent years. Moreover, Amazon just opened up ""Buy with Prime"" to online merchants off the Amazon platform, giving independent e-commerce companies access to its fast, free shipping, payments infrastructure, and free returns. Late last year, Facebook CEO Mark Zuckerberg announced the company would be changing its name to Meta Platforms, while investing billions to build out the metaverse, a catchall term for a new digital world that feels like reality.","Intel is attempting the ""biggest comeback in semiconductor history"" Meanwhile, the market has really soured on Intel (NASDAQ: INTC) in recent years. Late last year, Facebook CEO Mark Zuckerberg announced the company would be changing its name to Meta Platforms, while investing billions to build out the metaverse, a catchall term for a new digital world that feels like reality. Gelsinger also said on the recent earnings call that the company had engaged 10 qualified ""anchor clients"" to produce chips once it has built out its foundries.",2022,4
2022-05-08 00:00:00+00:00,Nvidia Currently Has a Huge Lead on AMD,INTC,https://www.nasdaq.com/articles/nvidia-currently-has-a-huge-lead-on-amd,,,"The semiconductor market continues to get hammered regardless of the strong growth the industry has reported during earnings. Today's video focuses on recent news affecting Nvidia (NASDAQ: NVDA), Advanced Micro Devices (NASDAQ: AMD), and Intel (NASDAQ: INTC). Here are some highlights.
Nvidia is the only out of the three that has yet to report earnings. The wait is almost over as earnings are scheduled for Wednesday, May 25 after the market closes. I look at NewEgg's website in the video, a store used to purchase computer components. At the moment of recording, 29 out of the top 30 best-selling desktop graphics cards belong to Nvidia.
AMD recently announced a fantastic earnings quarter with double-digit growth in all of its markets. CEO Lisa Su mentioned that this is the third straight quarter of over 100% revenue growth for its server processors. AMD investors should put June 9 on their calendars, as AMD will host its financial analyst day and will inform investors on how Xilinx's technology will integrate with AMD's core products.
Intel has recently acquired Siru Innovations, a company with decades of experience in the graphics market. The acquisition will accelerate Intel's push into the discrete graphics market. Intel's consumer graphics cards are expected to hit shelves later this year, but this market has heavy competition from Nvidia and AMD.
*Stock prices used were the market prices of May 6, 2022. The video was published in May 6, 2022.

10 stocks we like better than Nvidia
When our award-winning analyst team has a stock tip, it can pay to listen. After all, the newsletter they have run for over a decade, Motley Fool Stock Advisor, has tripled the market.*
They just revealed what they believe are the ten best stocks for investors to buy right now... and Nvidia wasn't one of them! That's right -- they think these 10 stocks are even better buys.
See the 10 stocks
*Stock Advisor returns as of April 7, 2022

Jose Najarro has positions in Advanced Micro Devices and Nvidia. The Motley Fool has positions in and recommends Advanced Micro Devices, Intel, and Nvidia. The Motley Fool recommends the following options: long January 2023 $57.50 calls on Intel and short January 2023 $57.50 puts on Intel. The Motley Fool has a disclosure policy. Jose is an affiliate of The Motley Fool and may be compensated for promoting its services. If you choose to subscribe through his link, he will earn some extra money that supports his channel. His opinions remain his own and are unaffected by The Motley Fool.
The views and opinions expressed herein are the views and opinions of the author and do not necessarily reflect those of Nasdaq, Inc.","Today's video focuses on recent news affecting Nvidia (NASDAQ: NVDA), Advanced Micro Devices (NASDAQ: AMD), and Intel (NASDAQ: INTC). CEO Lisa Su mentioned that this is the third straight quarter of over 100% revenue growth for its server processors. Intel has recently acquired Siru Innovations, a company with decades of experience in the graphics market.","Today's video focuses on recent news affecting Nvidia (NASDAQ: NVDA), Advanced Micro Devices (NASDAQ: AMD), and Intel (NASDAQ: INTC). After all, the newsletter they have run for over a decade, Motley Fool Stock Advisor, has tripled the market. The Motley Fool has positions in and recommends Advanced Micro Devices, Intel, and Nvidia.","Today's video focuses on recent news affecting Nvidia (NASDAQ: NVDA), Advanced Micro Devices (NASDAQ: AMD), and Intel (NASDAQ: INTC). After all, the newsletter they have run for over a decade, Motley Fool Stock Advisor, has tripled the market. The Motley Fool has positions in and recommends Advanced Micro Devices, Intel, and Nvidia.","Today's video focuses on recent news affecting Nvidia (NASDAQ: NVDA), Advanced Micro Devices (NASDAQ: AMD), and Intel (NASDAQ: INTC). Nvidia is the only out of the three that has yet to report earnings. AMD recently announced a fantastic earnings quarter with double-digit growth in all of its markets.",2022,3
