Date,Article_title,Stock_symbol,Url,Publisher,Author,Article,Lsa_summary,Luhn_summary,Textrank_summary,Lexrank_summary,Year,sentiment_score
2022-01-26 00:00:00+00:00,Intel Q4 Results Beat Wall Street View,INTC,https://www.nasdaq.com/articles/intel-q4-results-beat-wall-street-view,,,"(RTTNews) - Intel Corp. (INTC) Wednesday reported a profit for the fourth quarter that trumped Wall Street estimates, as revenues grew 3% driven by Data Center Group' record revenues.
Santa Clara, California-based Intel reported fourth-quarter profit of $4.62 billion or $1.13 per share, down from $5.86 billion or $1.42 per share last year.
Adjusted earnings for the quarter were $1.09 per share, down from $1.48 per share last year. On average, 34 analysts polled by Thomson Reuters estimated earnings of $0.90 per share for the quarter.
Intel's revenues for the quarter rose 3% to $20.53 billion from last year's revenue of $19.98 billion. Adjusted revenues for the quarter were $19.5 billion, compared to $18.9 billion a year ago. Analysts had a consensus revenue estimate of $18.32 billion for the quarter.
The company said its fourth-quarter revenue was led by an all-time record quarter for Data Center Group (DCG), with strong server recovery in enterprise and government.
Looking forward to the first quarter, Intel expects adjusted revenues of about $18.3 billion and adjusted earnings of around $0.80 per share. Analysts currently estimate earnings of $0.86 per share and revenues of $17.62 billion.
INTC closed Tuesday's trading at $51.69, up $0.69 or 1.35%, on the Nasdaq. The stock, however, slipped $1.48 or 2.86%, in the after-hours trade.
The views and opinions expressed herein are the views and opinions of the author and do not necessarily reflect those of Nasdaq, Inc.","(RTTNews) - Intel Corp. (INTC) Wednesday reported a profit for the fourth quarter that trumped Wall Street estimates, as revenues grew 3% driven by Data Center Group' record revenues. INTC closed Tuesday's trading at $51.69, up $0.69 or 1.35%, on the Nasdaq. On average, 34 analysts polled by Thomson Reuters estimated earnings of $0.90 per share for the quarter.","(RTTNews) - Intel Corp. (INTC) Wednesday reported a profit for the fourth quarter that trumped Wall Street estimates, as revenues grew 3% driven by Data Center Group' record revenues. INTC closed Tuesday's trading at $51.69, up $0.69 or 1.35%, on the Nasdaq. Santa Clara, California-based Intel reported fourth-quarter profit of $4.62 billion or $1.13 per share, down from $5.86 billion or $1.42 per share last year.","(RTTNews) - Intel Corp. (INTC) Wednesday reported a profit for the fourth quarter that trumped Wall Street estimates, as revenues grew 3% driven by Data Center Group' record revenues. INTC closed Tuesday's trading at $51.69, up $0.69 or 1.35%, on the Nasdaq. Intel's revenues for the quarter rose 3% to $20.53 billion from last year's revenue of $19.98 billion.","(RTTNews) - Intel Corp. (INTC) Wednesday reported a profit for the fourth quarter that trumped Wall Street estimates, as revenues grew 3% driven by Data Center Group' record revenues. INTC closed Tuesday's trading at $51.69, up $0.69 or 1.35%, on the Nasdaq. Santa Clara, California-based Intel reported fourth-quarter profit of $4.62 billion or $1.13 per share, down from $5.86 billion or $1.42 per share last year.",2022,4
2022-01-26 00:00:00+00:00,Intel (INTC) Beats Q4 Earnings and Revenue Estimates,INTC,https://www.nasdaq.com/articles/intel-intc-beats-q4-earnings-and-revenue-estimates,,,"Intel (INTC) came out with quarterly earnings of $1.09 per share, beating the Zacks Consensus Estimate of $0.90 per share. This compares to earnings of $1.52 per share a year ago. These figures are adjusted for non-recurring items.
This quarterly report represents an earnings surprise of 21.11%. A quarter ago, it was expected that this world's largest chipmaker would post earnings of $1.11 per share when it actually produced earnings of $1.71, delivering a surprise of 54.05%.
Over the last four quarters, the company has surpassed consensus EPS estimates four times.
Intel, which belongs to the Zacks Semiconductor - General industry, posted revenues of $19.53 billion for the quarter ended December 2021, surpassing the Zacks Consensus Estimate by 6.70%. This compares to year-ago revenues of $19.98 billion. The company has topped consensus revenue estimates four times over the last four quarters.
The sustainability of the stock's immediate price movement based on the recently-released numbers and future earnings expectations will mostly depend on management's commentary on the earnings call.
Intel shares have lost about 1% since the beginning of the year versus the S&P 500's decline of -8.6%.
What's Next for Intel?
While Intel has outperformed the market so far this year, the question that comes to investors' minds is: what's next for the stock?
There are no easy answers to this key question, but one reliable measure that can help investors address this is the company's earnings outlook. Not only does this include current consensus earnings expectations for the coming quarter(s), but also how these expectations have changed lately.
Empirical research shows a strong correlation between near-term stock movements and trends in earnings estimate revisions. Investors can track such revisions by themselves or rely on a tried-and-tested rating tool like the Zacks Rank, which has an impressive track record of harnessing the power of earnings estimate revisions.
Ahead of this earnings release, the estimate revisions trend for Intel: unfavorable. While the magnitude and direction of estimate revisions could change following the company's just-released earnings report, the current status translates into a Zacks Rank #4 (Sell) for the stock. So, the shares are expected to underperform the market in the near future. You can see the complete list of today's Zacks #1 Rank (Strong Buy) stocks here.
It will be interesting to see how estimates for the coming quarters and current fiscal year change in the days ahead. The current consensus EPS estimate is $0.84 on $17.55 billion in revenues for the coming quarter and $3.66 on $73.56 billion in revenues for the current fiscal year.
Investors should be mindful of the fact that the outlook for the industry can have a material impact on the performance of the stock as well. In terms of the Zacks Industry Rank, Semiconductor - General is currently in the top 32% of the 250 plus Zacks industries. Our research shows that the top 50% of the Zacks-ranked industries outperform the bottom 50% by a factor of more than 2 to 1.
Amtech Systems (ASYS), another stock in the same industry, has yet to report results for the quarter ended December 2021.
This provider of equipment for solar panel and semiconductor makers is expected to post quarterly earnings of $0.05 per share in its upcoming report, which represents no change from the year-ago quarter. The consensus EPS estimate for the quarter has remained unchanged over the last 30 days.
Amtech Systems' revenues are expected to be $22 million, up 22.4% from the year-ago quarter.



Want the latest recommendations from Zacks Investment Research? Today, you can download 7 Best Stocks for the Next 30 Days. Click to get this free report
 
Intel Corporation (INTC): Free Stock Analysis Report
 
Amtech Systems, Inc. (ASYS): Free Stock Analysis Report
 
To read this article on Zacks.com click here.
 
Zacks Investment Research
The views and opinions expressed herein are the views and opinions of the author and do not necessarily reflect those of Nasdaq, Inc.","Intel (INTC) came out with quarterly earnings of $1.09 per share, beating the Zacks Consensus Estimate of $0.90 per share. Intel Corporation (INTC): Free Stock Analysis Report There are no easy answers to this key question, but one reliable measure that can help investors address this is the company's earnings outlook.","Intel (INTC) came out with quarterly earnings of $1.09 per share, beating the Zacks Consensus Estimate of $0.90 per share. Intel Corporation (INTC): Free Stock Analysis Report Intel, which belongs to the Zacks Semiconductor - General industry, posted revenues of $19.53 billion for the quarter ended December 2021, surpassing the Zacks Consensus Estimate by 6.70%.","Intel (INTC) came out with quarterly earnings of $1.09 per share, beating the Zacks Consensus Estimate of $0.90 per share. Intel Corporation (INTC): Free Stock Analysis Report Intel, which belongs to the Zacks Semiconductor - General industry, posted revenues of $19.53 billion for the quarter ended December 2021, surpassing the Zacks Consensus Estimate by 6.70%.","Intel (INTC) came out with quarterly earnings of $1.09 per share, beating the Zacks Consensus Estimate of $0.90 per share. Intel Corporation (INTC): Free Stock Analysis Report While Intel has outperformed the market so far this year, the question that comes to investors' minds is: what's next for the stock?",2022,4
2022-01-26 00:00:00+00:00,Intel first-quarter earnings forecast miss Street view,INTC,https://www.nasdaq.com/articles/intel-first-quarter-earnings-forecast-miss-street-view,,,"Adds details on outlook
Jan 26 (Reuters) - Chipmaker Intel Corp INTC.O forecast first-quarter earnings below analysts' expectations on Wednesday, sending the world's largest chipmaker's shares down 3% in late trade.
Intel forecast earnings per share of 80 cents, compared to an expectation of 86 cents, according to IBES data from Refinitiv.
The company expected first-quarter revenue above Wall Street expectations, placing bets on its in-house chip-making capacity to meet strong demand from PC, data center and artificial intelligence markets even through a global semiconductor supply crunch.
The company expects first-quarter revenue of about $18.3 billion, compared to analysts' average estimates of $17.62 billion, according to IBES data from Refinitiv.
(Reporting By Chavi Mehta and Jane Lanhee Lee; Editing by Bernard Orr)
((jane.lee@thomsonreuters.com; +1-415-344-3912; Reuters Messaging: jane.lee.thomsonreuters@reuters.net))
The views and opinions expressed herein are the views and opinions of the author and do not necessarily reflect those of Nasdaq, Inc.","Adds details on outlook Jan 26 (Reuters) - Chipmaker Intel Corp INTC.O forecast first-quarter earnings below analysts' expectations on Wednesday, sending the world's largest chipmaker's shares down 3% in late trade. The company expected first-quarter revenue above Wall Street expectations, placing bets on its in-house chip-making capacity to meet strong demand from PC, data center and artificial intelligence markets even through a global semiconductor supply crunch. (Reporting By Chavi Mehta and Jane Lanhee Lee; Editing by Bernard Orr) ((jane.lee@thomsonreuters.com; +1-415-344-3912; Reuters Messaging: jane.lee.thomsonreuters@reuters.net)) The views and opinions expressed herein are the views and opinions of the author and do not necessarily reflect those of Nasdaq, Inc.","Adds details on outlook Jan 26 (Reuters) - Chipmaker Intel Corp INTC.O forecast first-quarter earnings below analysts' expectations on Wednesday, sending the world's largest chipmaker's shares down 3% in late trade. Intel forecast earnings per share of 80 cents, compared to an expectation of 86 cents, according to IBES data from Refinitiv. The company expects first-quarter revenue of about $18.3 billion, compared to analysts' average estimates of $17.62 billion, according to IBES data from Refinitiv.","Adds details on outlook Jan 26 (Reuters) - Chipmaker Intel Corp INTC.O forecast first-quarter earnings below analysts' expectations on Wednesday, sending the world's largest chipmaker's shares down 3% in late trade. The company expected first-quarter revenue above Wall Street expectations, placing bets on its in-house chip-making capacity to meet strong demand from PC, data center and artificial intelligence markets even through a global semiconductor supply crunch. The company expects first-quarter revenue of about $18.3 billion, compared to analysts' average estimates of $17.62 billion, according to IBES data from Refinitiv.","Adds details on outlook Jan 26 (Reuters) - Chipmaker Intel Corp INTC.O forecast first-quarter earnings below analysts' expectations on Wednesday, sending the world's largest chipmaker's shares down 3% in late trade. Intel forecast earnings per share of 80 cents, compared to an expectation of 86 cents, according to IBES data from Refinitiv. The company expected first-quarter revenue above Wall Street expectations, placing bets on its in-house chip-making capacity to meet strong demand from PC, data center and artificial intelligence markets even through a global semiconductor supply crunch.",2022,2
2022-01-26 00:00:00+00:00,"Noteworthy Wednesday Option Activity: MRNA, MFA, INTC",INTC,https://www.nasdaq.com/articles/noteworthy-wednesday-option-activity%3A-mrna-mfa-intc,,,"Among the underlying components of the Russell 3000 index, we saw noteworthy options trading volume today in Moderna Inc (Symbol: MRNA), where a total of 76,027 contracts have traded so far, representing approximately 7.6 million underlying shares. That amounts to about 76.9% of MRNA's average daily trading volume over the past month of 9.9 million shares. Especially high volume was seen for the $170 strike call option expiring January 28, 2022, with 3,377 contracts trading so far today, representing approximately 337,700 underlying shares of MRNA. Below is a chart showing MRNA's trailing twelve month trading history, with the $170 strike highlighted in orange:
MFA Financial, Inc. (Symbol: MFA) options are showing a volume of 24,102 contracts thus far today. That number of contracts represents approximately 2.4 million underlying shares, working out to a sizeable 72.1% of MFA's average daily trading volume over the past month, of 3.3 million shares. Especially high volume was seen for the $5 strike call option expiring January 20, 2023, with 12,156 contracts trading so far today, representing approximately 1.2 million underlying shares of MFA. Below is a chart showing MFA's trailing twelve month trading history, with the $5 strike highlighted in orange:
And Intel Corp (Symbol: INTC) options are showing a volume of 247,981 contracts thus far today. That number of contracts represents approximately 24.8 million underlying shares, working out to a sizeable 70.8% of INTC's average daily trading volume over the past month, of 35.0 million shares. Especially high volume was seen for the $52.50 strike call option expiring May 20, 2022, with 8,538 contracts trading so far today, representing approximately 853,800 underlying shares of INTC. Below is a chart showing INTC's trailing twelve month trading history, with the $52.50 strike highlighted in orange:
For the various different available expirations for MRNA options, MFA options, or INTC options, visit StockOptionsChannel.com.
Today's Most Active Call & Put Options of the S&P 500 »
The views and opinions expressed herein are the views and opinions of the author and do not necessarily reflect those of Nasdaq, Inc.","Especially high volume was seen for the $52.50 strike call option expiring May 20, 2022, with 8,538 contracts trading so far today, representing approximately 853,800 underlying shares of INTC. Below is a chart showing MFA's trailing twelve month trading history, with the $5 strike highlighted in orange: And Intel Corp (Symbol: INTC) options are showing a volume of 247,981 contracts thus far today. That number of contracts represents approximately 24.8 million underlying shares, working out to a sizeable 70.8% of INTC's average daily trading volume over the past month, of 35.0 million shares.","That number of contracts represents approximately 24.8 million underlying shares, working out to a sizeable 70.8% of INTC's average daily trading volume over the past month, of 35.0 million shares. Below is a chart showing MFA's trailing twelve month trading history, with the $5 strike highlighted in orange: And Intel Corp (Symbol: INTC) options are showing a volume of 247,981 contracts thus far today. Especially high volume was seen for the $52.50 strike call option expiring May 20, 2022, with 8,538 contracts trading so far today, representing approximately 853,800 underlying shares of INTC.","Below is a chart showing MFA's trailing twelve month trading history, with the $5 strike highlighted in orange: And Intel Corp (Symbol: INTC) options are showing a volume of 247,981 contracts thus far today. That number of contracts represents approximately 24.8 million underlying shares, working out to a sizeable 70.8% of INTC's average daily trading volume over the past month, of 35.0 million shares. Especially high volume was seen for the $52.50 strike call option expiring May 20, 2022, with 8,538 contracts trading so far today, representing approximately 853,800 underlying shares of INTC.","That number of contracts represents approximately 24.8 million underlying shares, working out to a sizeable 70.8% of INTC's average daily trading volume over the past month, of 35.0 million shares. Especially high volume was seen for the $52.50 strike call option expiring May 20, 2022, with 8,538 contracts trading so far today, representing approximately 853,800 underlying shares of INTC. Below is a chart showing MFA's trailing twelve month trading history, with the $5 strike highlighted in orange: And Intel Corp (Symbol: INTC) options are showing a volume of 247,981 contracts thus far today.",2022,3
2022-01-26 00:00:00+00:00,Intel Q4 21 Earnings Conference Call At 5:00 PM ET,INTC,https://www.nasdaq.com/articles/intel-q4-21-earnings-conference-call-at-5%3A00-pm-et,,,"(RTTNews) - Intel Corporation (INTC) will host a conference call at 5:00 PM ET on January 26, 2022, to discuss Q4 21 earnings results.
To access the live webcast, log on to https://www.intc.com/news-events/ir-calendar
The views and opinions expressed herein are the views and opinions of the author and do not necessarily reflect those of Nasdaq, Inc.","(RTTNews) - Intel Corporation (INTC) will host a conference call at 5:00 PM ET on January 26, 2022, to discuss Q4 21 earnings results. To access the live webcast, log on to https://www.intc.com/news-events/ir-calendar The views and opinions expressed herein are the views and opinions of the author and do not necessarily reflect those of Nasdaq, Inc.","(RTTNews) - Intel Corporation (INTC) will host a conference call at 5:00 PM ET on January 26, 2022, to discuss Q4 21 earnings results. To access the live webcast, log on to https://www.intc.com/news-events/ir-calendar The views and opinions expressed herein are the views and opinions of the author and do not necessarily reflect those of Nasdaq, Inc.","(RTTNews) - Intel Corporation (INTC) will host a conference call at 5:00 PM ET on January 26, 2022, to discuss Q4 21 earnings results. To access the live webcast, log on to https://www.intc.com/news-events/ir-calendar The views and opinions expressed herein are the views and opinions of the author and do not necessarily reflect those of Nasdaq, Inc.","(RTTNews) - Intel Corporation (INTC) will host a conference call at 5:00 PM ET on January 26, 2022, to discuss Q4 21 earnings results. To access the live webcast, log on to https://www.intc.com/news-events/ir-calendar The views and opinions expressed herein are the views and opinions of the author and do not necessarily reflect those of Nasdaq, Inc.",2022,3
