Date,Article_title,Stock_symbol,Url,Publisher,Author,Article,Lsa_summary,Luhn_summary,Textrank_summary,Lexrank_summary,Year,sentiment_score
2022-03-31 00:00:00+00:00,EXCLUSIVE-U.S. warned firms about Russia's Kaspersky software day after invasion -sources,INTC,https://www.nasdaq.com/articles/exclusive-u.s.-warned-firms-about-russias-kaspersky-software-day-after-invasion-sources,,,"By Christopher Bing
March 31 (Reuters) - The U.S. government began privately warning some American companies the day after Russia invaded Ukraine that Moscow could manipulate software designed by Russian cybersecurity company Kaspersky to cause harm, according to a senior U.S. official and two people familiar with the matter.
The classified briefings are part of Washington's broader strategy to prepare providers of critical infrastructure such as water, telecoms and energy for potential Russian intrusions.
President Joe Biden said last week that sanctions imposed on Russia for its Feb. 24 attack on Ukraine could result in a backlash, including cyber disruptions, but the White House did not offer specifics.
""The risk calculation has changed with the Ukraine conflict,"" said the senior U.S. official about Kaspersky's software. ""It has increased.""
Kaspersky, one of the cybersecurity industry's most popular anti-virus software makers, is headquartered in Moscow and was founded by a former Russian intelligence officer, Eugene Kaspersky.
A Kaspersky spokeswoman said in a statement that the briefings about purported risks of Kaspersky software would be ""further damaging"" to Kaspersky’s reputation ""without giving the company the opportunity to respond directly to such concerns"" and that it ""is not appropriate or just.""
The senior U.S. official said Kaspersky's Russia-based staff could be coerced into providing or helping establish remote access into their customers' computers by Russian law enforcement or intelligence agencies.
Kaspersky, which has an office in the United States, lists partnerships with Microsoft, Intel and IBM on its website. Microsoft declined to comment. Intel and IBM did not respond to requests for comment.
On March 25, the Federal Communications Commission added Kaspersky to its list of communications equipment and service providers deemed threats to U.S. national security.
It is not the first time Washington has said Kaspersky could be influenced by the Kremlin.
The Trump administration spent months banning Kaspersky from government systems and warning numerous companies to not use the software in 2017 and 2018.
U.S. security agencies conducted a series of similar cybersecurity briefings surrounding the Trump ban. The content of those meetings four years ago was comparable to the new briefings, said one of the people familiar with the matter.
Over the years, Kaspersky has consistently denied wrongdoing or any secret partnership with Russian intelligence.
It is unclear whether a specific incident or piece of new intelligence led to the security briefings. The senior official declined to comment on classified information.
Until now no U.S. or allied intelligence agency has ever offered direct, public proof of a backdoor in Kaspersky software.
Following the Trump decision, Kaspersky opened a series of transparency centers, where it says partners can review its code to check for malicious activity. A company blog post at the time explained the goal was to build trust with customers after the U.S. accusations.
But the U.S. official said the transparency centers are not ""even a fig leaf"" because they do not address the U.S. government's concern.
""Moscow software engineers handle the [software] updates, that's where the risk comes,"" they said. ""They can send malicious commands through the updaters and that comes from Russia.""
Cybersecurity experts say that because of how anti-virus software normally functions on computers where it is installed, it requires a deep level of control to discovery malware. This makes anti-virus software an inherently advantageous channel to conduct espionage.
In addition, Kaspersky's products are also sometimes sold under white label sales agreements. This means the software can be packaged and renamed in commercial deals by information technology contractors, making their origin difficult to immediately determine.
While not referring to Kaspersky by name, Britain's cybersecurity centre on Tuesday said organizations providing services related to Ukraine or critical infrastructure should reconsider the risk associated with using Russian computer technology in their supply chains.
""We have no evidence that the Russian state intends to suborn Russian commercial products and services to cause damage to UK interests, but the absence of evidence is not evidence of absence,"" the National Cyber Security Centre said in a blog post.
(Reporting by Christopher Bing; editing by Chris Sanders and Grant McCool)
((Christopher.Bing@thomsonreuters.com; +1 202-510-0174;))
The views and opinions expressed herein are the views and opinions of the author and do not necessarily reflect those of Nasdaq, Inc.","President Joe Biden said last week that sanctions imposed on Russia for its Feb. 24 attack on Ukraine could result in a backlash, including cyber disruptions, but the White House did not offer specifics. The senior U.S. official said Kaspersky's Russia-based staff could be coerced into providing or helping establish remote access into their customers' computers by Russian law enforcement or intelligence agencies. While not referring to Kaspersky by name, Britain's cybersecurity centre on Tuesday said organizations providing services related to Ukraine or critical infrastructure should reconsider the risk associated with using Russian computer technology in their supply chains.","By Christopher Bing March 31 (Reuters) - The U.S. government began privately warning some American companies the day after Russia invaded Ukraine that Moscow could manipulate software designed by Russian cybersecurity company Kaspersky to cause harm, according to a senior U.S. official and two people familiar with the matter. U.S. security agencies conducted a series of similar cybersecurity briefings surrounding the Trump ban. ""We have no evidence that the Russian state intends to suborn Russian commercial products and services to cause damage to UK interests, but the absence of evidence is not evidence of absence,"" the National Cyber Security Centre said in a blog post.","By Christopher Bing March 31 (Reuters) - The U.S. government began privately warning some American companies the day after Russia invaded Ukraine that Moscow could manipulate software designed by Russian cybersecurity company Kaspersky to cause harm, according to a senior U.S. official and two people familiar with the matter. Kaspersky, one of the cybersecurity industry's most popular anti-virus software makers, is headquartered in Moscow and was founded by a former Russian intelligence officer, Eugene Kaspersky. A Kaspersky spokeswoman said in a statement that the briefings about purported risks of Kaspersky software would be ""further damaging"" to Kaspersky’s reputation ""without giving the company the opportunity to respond directly to such concerns"" and that it ""is not appropriate or just.""","Kaspersky, one of the cybersecurity industry's most popular anti-virus software makers, is headquartered in Moscow and was founded by a former Russian intelligence officer, Eugene Kaspersky. U.S. security agencies conducted a series of similar cybersecurity briefings surrounding the Trump ban. The senior official declined to comment on classified information.",2022,2
2022-03-31 00:00:00+00:00,Interesting INTC Put And Call Options For May 13th,INTC,https://www.nasdaq.com/articles/interesting-intc-put-and-call-options-for-may-13th,,,"Investors in Intel Corp (Symbol: INTC) saw new options become available today, for the May 13th expiration. At Stock Options Channel, our YieldBoost formula has looked up and down the INTC options chain for the new May 13th contracts and identified one put and one call contract of particular interest.
The put contract at the $49.00 strike price has a current bid of $1.71. If an investor was to sell-to-open that put contract, they are committing to purchase the stock at $49.00, but will also collect the premium, putting the cost basis of the shares at $47.29 (before broker commissions). To an investor already interested in purchasing shares of INTC, that could represent an attractive alternative to paying $50.74/share today.
Because the $49.00 strike represents an approximate 3% discount to the current trading price of the stock (in other words it is out-of-the-money by that percentage), there is also the possibility that the put contract would expire worthless. The current analytical data (including greeks and implied greeks) suggest the current odds of that happening are 99%. Stock Options Channel will track those odds over time to see how they change, publishing a chart of those numbers on our website under the contract detail page for this contract. Should the contract expire worthless, the premium would represent a 3.49% return on the cash commitment, or 29.62% annualized — at Stock Options Channel we call this the YieldBoost.
Below is a chart showing the trailing twelve month trading history for Intel Corp, and highlighting in green where the $49.00 strike is located relative to that history:
Turning to the calls side of the option chain, the call contract at the $51.00 strike price has a current bid of $2.07. If an investor was to purchase shares of INTC stock at the current price level of $50.74/share, and then sell-to-open that call contract as a ""covered call,"" they are committing to sell the stock at $51.00. Considering the call seller will also collect the premium, that would drive a total return (excluding dividends, if any) of 4.59% if the stock gets called away at the May 13th expiration (before broker commissions). Of course, a lot of upside could potentially be left on the table if INTC shares really soar, which is why looking at the trailing twelve month trading history for Intel Corp, as well as studying the business fundamentals becomes important. Below is a chart showing INTC's trailing twelve month trading history, with the $51.00 strike highlighted in red:
Considering the fact that the $51.00 strike represents an approximate 1% premium to the current trading price of the stock (in other words it is out-of-the-money by that percentage), there is also the possibility that the covered call contract would expire worthless, in which case the investor would keep both their shares of stock and the premium collected. The current analytical data (including greeks and implied greeks) suggest the current odds of that happening are 99%. On our website under the contract detail page for this contract, Stock Options Channel will track those odds over time to see how they change and publish a chart of those numbers (the trading history of the option contract will also be charted). Should the covered call contract expire worthless, the premium would represent a 4.08% boost of extra return to the investor, or 34.63% annualized, which we refer to as the YieldBoost.
Meanwhile, we calculate the actual trailing twelve month volatility (considering the last 253 trading day closing values as well as today's price of $50.74) to be 29%. For more put and call options contract ideas worth looking at, visit StockOptionsChannel.com.
Top YieldBoost Calls of the Nasdaq 100 »
The views and opinions expressed herein are the views and opinions of the author and do not necessarily reflect those of Nasdaq, Inc.","Of course, a lot of upside could potentially be left on the table if INTC shares really soar, which is why looking at the trailing twelve month trading history for Intel Corp, as well as studying the business fundamentals becomes important. Below is a chart showing INTC's trailing twelve month trading history, with the $51.00 strike highlighted in red: Considering the fact that the $51.00 strike represents an approximate 1% premium to the current trading price of the stock (in other words it is out-of-the-money by that percentage), there is also the possibility that the covered call contract would expire worthless, in which case the investor would keep both their shares of stock and the premium collected. Investors in Intel Corp (Symbol: INTC) saw new options become available today, for the May 13th expiration.","Below is a chart showing INTC's trailing twelve month trading history, with the $51.00 strike highlighted in red: Considering the fact that the $51.00 strike represents an approximate 1% premium to the current trading price of the stock (in other words it is out-of-the-money by that percentage), there is also the possibility that the covered call contract would expire worthless, in which case the investor would keep both their shares of stock and the premium collected. The current analytical data (including greeks and implied greeks) suggest the current odds of that happening are 99%. Investors in Intel Corp (Symbol: INTC) saw new options become available today, for the May 13th expiration.","Below is a chart showing INTC's trailing twelve month trading history, with the $51.00 strike highlighted in red: Considering the fact that the $51.00 strike represents an approximate 1% premium to the current trading price of the stock (in other words it is out-of-the-money by that percentage), there is also the possibility that the covered call contract would expire worthless, in which case the investor would keep both their shares of stock and the premium collected. Investors in Intel Corp (Symbol: INTC) saw new options become available today, for the May 13th expiration. At Stock Options Channel, our YieldBoost formula has looked up and down the INTC options chain for the new May 13th contracts and identified one put and one call contract of particular interest.","At Stock Options Channel, our YieldBoost formula has looked up and down the INTC options chain for the new May 13th contracts and identified one put and one call contract of particular interest. Below is a chart showing INTC's trailing twelve month trading history, with the $51.00 strike highlighted in red: Considering the fact that the $51.00 strike represents an approximate 1% premium to the current trading price of the stock (in other words it is out-of-the-money by that percentage), there is also the possibility that the covered call contract would expire worthless, in which case the investor would keep both their shares of stock and the premium collected. Investors in Intel Corp (Symbol: INTC) saw new options become available today, for the May 13th expiration.",2022,3
2022-03-31 00:00:00+00:00,Alphabet's (GOOGL) Waymo Gears up to Enter Downtown Phoenix,INTC,https://www.nasdaq.com/articles/alphabets-googl-waymo-gears-up-to-enter-downtown-phoenix,,,"In a bid to expand the reach of Waymo cars, Alphabet GOOGL is set to hit the streets of downtown Phoenix with its self-driving cars — Jaguar I-PACE and Chrysler Pacifica hybrid minivans.

Waymo has been taking measurements in downtown and midtown Phoenix for the past few weeks.

Per the plans, Waymo rides will be initially available to the company’s employees. Gradually, Waymo will roll out its Early Rider program, which is now called Trusted Tester, to the public.

The latest move marks Waymo’s further expansion in Phoenix. Notably, Waymo vehicles began its ride-hailing service from the East Valley of Phoenix.
Alphabet Inc. Price and Consensus
Alphabet Inc. price-consensus-chart | Alphabet Inc. Quote
Growing Waymo Efforts
The latest move bodes well for Waymo’s growing efforts toward expanding its ride-hailing service across the United States.

The company recently revealed that it would make its ride-hailing vehicles fully driverless on the streets of San Francisco. This also marks Waymo’s first expansion outside Phoenix.

The company recently partnered with Geely, a China-based automotive company. Per the terms of the deal, Geely’s electric mobility brand, Zeekr, will design and develop electric vehicles for Waymo, into which Waymo Driver will be integrated.

The vehicles will be first introduced on the roads of the United States. With the Geely partnership, Waymo will expand its Waymo One fleet.

Apart from this, Waymo teamed up with Google’s Maps to ensure a seamless booking experience for Waymo One. This enables customers to book Waymo One directly from the Maps app.

The endeavors will help Alphabet further penetrate the booming autonomous driving space.

Per a report by Mordor Intelligence, the worldwide driverless vehicle market is expected to see a CAGR of 18.06% between 2021 and 2026.
Intensifying Competition
Given the upbeat scenario, not only Alphabet but companies like Amazon AMZN, Intel INTC and Baidu BIDU are also making every effort to capitalize on the growth prospects in the autonomous driving space.

Amazon’s buyout of Zoox, a developer of autonomous ride-hailing vehicles, remains a major positive. Further, the company’s launch of its first self-driving robotaxi strengthened its position in the autonomous driving space.

Zoox has been testing its autonomous vehicles in San Francisco, Las Vegas and Foster City. It intends to open an engineering office and operations facility this year, which will act as a base for its autonomous vehicle testing.

Meanwhile, Intel is gaining from the low power consumption of Mobileye chips and the ability to create maps for self-driving systems. The company intends on introducing a pilot for autonomous taxis and ride-hailing services in Munich and Tel Aviv in 2022.

In addition to this, Mobileye recently teamed up with German electric mobility unit Benteler EV Systems and Beep to develop and deploy self-driving, fully electric shuttles in the United States by 2024.

Baidu is gaining from expanding the Apollo Go Robotaxi service, which features about 100 pick-up and drop-off stations across several residential, and business areas.

Nevertheless, Alphabet’s growing autonomous driving initiatives are likely to help it stay ahead of the curve.

Currently, Alphabet carries a Zacks Rank #3 (Hold). You can see the complete list of today’s Zacks #1 Rank (Strong Buy) stocks here.
 
Zacks Names ""Single Best Pick to Double""
From thousands of stocks, 5 Zacks experts each have chosen their favorite to skyrocket +100% or more in months to come. From those 5, Director of Research Sheraz Mian hand-picks one to have the most explosive upside of all.
It’s a little-known chemical company that’s up 65% over last year, yet still dirt cheap. With unrelenting demand, soaring 2022 earnings estimates, and $1.5 billion for repurchasing shares, retail investors could jump in at any time.
This company could rival or surpass other recent Zacks’ Stocks Set to Double like Boston Beer Company which shot up +143.0% in little more than 9 months and NVIDIA which boomed +175.9% in one year.
Free: See Our Top Stock and 4 Runners Up >>

Want the latest recommendations from Zacks Investment Research? Today, you can download 7 Best Stocks for the Next 30 Days. Click to get this free report
 
Amazon.com, Inc. (AMZN): Free Stock Analysis Report
 
Intel Corporation (INTC): Free Stock Analysis Report
 
Baidu, Inc. (BIDU): Free Stock Analysis Report
 
Alphabet Inc. (GOOGL): Free Stock Analysis Report
 
To read this article on Zacks.com click here.
 
Zacks Investment Research
The views and opinions expressed herein are the views and opinions of the author and do not necessarily reflect those of Nasdaq, Inc.","Intensifying Competition Given the upbeat scenario, not only Alphabet but companies like Amazon AMZN, Intel INTC and Baidu BIDU are also making every effort to capitalize on the growth prospects in the autonomous driving space. Intel Corporation (INTC): Free Stock Analysis Report Baidu is gaining from expanding the Apollo Go Robotaxi service, which features about 100 pick-up and drop-off stations across several residential, and business areas.","Intensifying Competition Given the upbeat scenario, not only Alphabet but companies like Amazon AMZN, Intel INTC and Baidu BIDU are also making every effort to capitalize on the growth prospects in the autonomous driving space. Intel Corporation (INTC): Free Stock Analysis Report Alphabet Inc. Price and Consensus Alphabet Inc. price-consensus-chart | Alphabet Inc. Quote Growing Waymo Efforts The latest move bodes well for Waymo’s growing efforts toward expanding its ride-hailing service across the United States.","Intensifying Competition Given the upbeat scenario, not only Alphabet but companies like Amazon AMZN, Intel INTC and Baidu BIDU are also making every effort to capitalize on the growth prospects in the autonomous driving space. Intel Corporation (INTC): Free Stock Analysis Report Alphabet Inc. Price and Consensus Alphabet Inc. price-consensus-chart | Alphabet Inc. Quote Growing Waymo Efforts The latest move bodes well for Waymo’s growing efforts toward expanding its ride-hailing service across the United States.","Intensifying Competition Given the upbeat scenario, not only Alphabet but companies like Amazon AMZN, Intel INTC and Baidu BIDU are also making every effort to capitalize on the growth prospects in the autonomous driving space. Intel Corporation (INTC): Free Stock Analysis Report Want the latest recommendations from Zacks Investment Research?",2022,3
