Date,Article_title,Stock_symbol,Url,Publisher,Author,Article,Lsa_summary,Luhn_summary,Textrank_summary,Lexrank_summary,Year,sentiment_score
2022-12-22 00:00:00+00:00,INTC February 2023 Options Begin Trading,INTC,https://www.nasdaq.com/articles/intc-february-2023-options-begin-trading,,,"Investors in Intel Corp (Symbol: INTC) saw new options become available today, for the February 2023 expiration. At Stock Options Channel, our YieldBoost formula has looked up and down the INTC options chain for the new February 2023 contracts and identified one put and one call contract of particular interest.
The put contract at the $24.00 strike price has a current bid of 73 cents. If an investor was to sell-to-open that put contract, they are committing to purchase the stock at $24.00, but will also collect the premium, putting the cost basis of the shares at $23.27 (before broker commissions). To an investor already interested in purchasing shares of INTC, that could represent an attractive alternative to paying $25.68/share today.
Because the $24.00 strike represents an approximate 7% discount to the current trading price of the stock (in other words it is out-of-the-money by that percentage), there is also the possibility that the put contract would expire worthless. The current analytical data (including greeks and implied greeks) suggest the current odds of that happening are 99%. Stock Options Channel will track those odds over time to see how they change, publishing a chart of those numbers on our website under the contract detail page for this contract. Should the contract expire worthless, the premium would represent a 3.04% return on the cash commitment, or 25.82% annualized — at Stock Options Channel we call this the YieldBoost.
Below is a chart showing the trailing twelve month trading history for Intel Corp, and highlighting in green where the $24.00 strike is located relative to that history:
Turning to the calls side of the option chain, the call contract at the $26.00 strike price has a current bid of $1.27. If an investor was to purchase shares of INTC stock at the current price level of $25.68/share, and then sell-to-open that call contract as a ""covered call,"" they are committing to sell the stock at $26.00. Considering the call seller will also collect the premium, that would drive a total return (excluding dividends, if any) of 6.19% if the stock gets called away at the February 2023 expiration (before broker commissions). Of course, a lot of upside could potentially be left on the table if INTC shares really soar, which is why looking at the trailing twelve month trading history for Intel Corp, as well as studying the business fundamentals becomes important. Below is a chart showing INTC's trailing twelve month trading history, with the $26.00 strike highlighted in red:
Considering the fact that the $26.00 strike represents an approximate 1% premium to the current trading price of the stock (in other words it is out-of-the-money by that percentage), there is also the possibility that the covered call contract would expire worthless, in which case the investor would keep both their shares of stock and the premium collected. The current analytical data (including greeks and implied greeks) suggest the current odds of that happening are 99%. On our website under the contract detail page for this contract, Stock Options Channel will track those odds over time to see how they change and publish a chart of those numbers (the trading history of the option contract will also be charted). Should the covered call contract expire worthless, the premium would represent a 4.95% boost of extra return to the investor, or 41.98% annualized, which we refer to as the YieldBoost.
Meanwhile, we calculate the actual trailing twelve month volatility (considering the last 252 trading day closing values as well as today's price of $25.68) to be 38%. For more put and call options contract ideas worth looking at, visit StockOptionsChannel.com.
Top YieldBoost Calls of the Nasdaq 100 »
Also see:
 TRNS market cap history
 Top Ten Hedge Funds Holding DNN
 AQD Historical Stock Prices
The views and opinions expressed herein are the views and opinions of the author and do not necessarily reflect those of Nasdaq, Inc.","Of course, a lot of upside could potentially be left on the table if INTC shares really soar, which is why looking at the trailing twelve month trading history for Intel Corp, as well as studying the business fundamentals becomes important. Below is a chart showing INTC's trailing twelve month trading history, with the $26.00 strike highlighted in red: Considering the fact that the $26.00 strike represents an approximate 1% premium to the current trading price of the stock (in other words it is out-of-the-money by that percentage), there is also the possibility that the covered call contract would expire worthless, in which case the investor would keep both their shares of stock and the premium collected. Investors in Intel Corp (Symbol: INTC) saw new options become available today, for the February 2023 expiration.","Below is a chart showing INTC's trailing twelve month trading history, with the $26.00 strike highlighted in red: Considering the fact that the $26.00 strike represents an approximate 1% premium to the current trading price of the stock (in other words it is out-of-the-money by that percentage), there is also the possibility that the covered call contract would expire worthless, in which case the investor would keep both their shares of stock and the premium collected. The current analytical data (including greeks and implied greeks) suggest the current odds of that happening are 99%. Investors in Intel Corp (Symbol: INTC) saw new options become available today, for the February 2023 expiration.","Below is a chart showing INTC's trailing twelve month trading history, with the $26.00 strike highlighted in red: Considering the fact that the $26.00 strike represents an approximate 1% premium to the current trading price of the stock (in other words it is out-of-the-money by that percentage), there is also the possibility that the covered call contract would expire worthless, in which case the investor would keep both their shares of stock and the premium collected. Investors in Intel Corp (Symbol: INTC) saw new options become available today, for the February 2023 expiration. At Stock Options Channel, our YieldBoost formula has looked up and down the INTC options chain for the new February 2023 contracts and identified one put and one call contract of particular interest.","Below is a chart showing INTC's trailing twelve month trading history, with the $26.00 strike highlighted in red: Considering the fact that the $26.00 strike represents an approximate 1% premium to the current trading price of the stock (in other words it is out-of-the-money by that percentage), there is also the possibility that the covered call contract would expire worthless, in which case the investor would keep both their shares of stock and the premium collected. Investors in Intel Corp (Symbol: INTC) saw new options become available today, for the February 2023 expiration. At Stock Options Channel, our YieldBoost formula has looked up and down the INTC options chain for the new February 2023 contracts and identified one put and one call contract of particular interest.",2022,3
2022-12-22 00:00:00+00:00,"Dow Movers: INTC, PG",INTC,https://www.nasdaq.com/articles/dow-movers%3A-intc-pg,,,"In early trading on Thursday, shares of Procter & Gamble topped the list of the day's best performing Dow Jones Industrial Average components, trading up 0.1%. Year to date, Procter & Gamble has lost about 7.1% of its value.
And the worst performing Dow component thus far on the day is Intel, trading down 2.3%. Intel is lower by about 49.1% looking at the year to date performance.
Two other components making moves today are Microsoft, trading down 2.1%, and Nike, trading down 0.0% on the day.
VIDEO: Dow Movers: INTC, PG
The views and opinions expressed herein are the views and opinions of the author and do not necessarily reflect those of Nasdaq, Inc.","VIDEO: Dow Movers: INTC, PG The views and opinions expressed herein are the views and opinions of the author and do not necessarily reflect those of Nasdaq, Inc. In early trading on Thursday, shares of Procter & Gamble topped the list of the day's best performing Dow Jones Industrial Average components, trading up 0.1%. And the worst performing Dow component thus far on the day is Intel, trading down 2.3%.","VIDEO: Dow Movers: INTC, PG The views and opinions expressed herein are the views and opinions of the author and do not necessarily reflect those of Nasdaq, Inc. In early trading on Thursday, shares of Procter & Gamble topped the list of the day's best performing Dow Jones Industrial Average components, trading up 0.1%. Year to date, Procter & Gamble has lost about 7.1% of its value.","VIDEO: Dow Movers: INTC, PG The views and opinions expressed herein are the views and opinions of the author and do not necessarily reflect those of Nasdaq, Inc. In early trading on Thursday, shares of Procter & Gamble topped the list of the day's best performing Dow Jones Industrial Average components, trading up 0.1%. And the worst performing Dow component thus far on the day is Intel, trading down 2.3%.","VIDEO: Dow Movers: INTC, PG The views and opinions expressed herein are the views and opinions of the author and do not necessarily reflect those of Nasdaq, Inc. In early trading on Thursday, shares of Procter & Gamble topped the list of the day's best performing Dow Jones Industrial Average components, trading up 0.1%. And the worst performing Dow component thus far on the day is Intel, trading down 2.3%.",2022,2
2022-12-22 00:00:00+00:00,US STOCKS-Wall Street slides as economic data fans rate hike worries,INTC,https://www.nasdaq.com/articles/us-stocks-wall-street-slides-as-economic-data-fans-rate-hike-worries,,,"For a Reuters live blog on U.S., UK and European stock markets, click LIVE/ or type LIVE/ in a news window
Q3 GDP estimate more than expected
Micron forecasts bigger-than-expected Q2 loss
Other chipmakers fall
AMC slumps on $110 mln equity raise
Indexes down: Dow 0.99%, S&P 1.31%, Nasdaq 1.84%
Adds details, updates prices to open
By Ankika Biswas and Johann M Cherian
Dec 22 (Reuters) - Wall Street's main indexes dropped on Thursday after fresh data underscored strength in the U.S. economy and aggravated concerns over the Federal Reserve's continued policy tightening.
Losses in rate-sensitive megacap growth stocks such as Apple Inc AAPL.O, Microsoft Corp MSFT.O and Amazon.com Inc AMZN.O pulled technology .SPLRCT and consumer discretionary shares .SPLRCD lower.
The final estimate of third-quarter U.S. GDP revealed gross domestic product increased at a 3.2% annualized rate, above the previous estimate of 2.9%.
Meanwhile, a Labor Department report showed the number of Americans filing for state unemployment benefits increased to 216,000 last week, much below economists' estimate of 222,000, indicating a still tight labor market.
""The GDP data beat a lot of expectations. There are concerns that the economy is not giving up too easily and it's putting up a fight that will likely require the Fed to remain hawkish and keep interest rates higher for longer,"" Sam Stovall, chief investment strategist at CFRA Research in New York, said.
Wall Street's main indexes marked their biggest daily gain so far in December on Wednesday, with help from upbeat Nike IncNKE.N and FedEx CorpFDX.N quarterly earnings, as well as improving consumer confidence and easing inflation expectations.
Fears of a recession following the U.S. central bank's prolonged interest rate hikes have weighed heavily on equities this year, with the benchmark S&P 500 .SPX set for annual declines of 19.7%, its worst such performance since the 2008 financial crisis.
The Fed struck a hawkish tone last week at its policy meeting by saying that it expects interest rates to remain higher for longer, sparking a selloff across stock markets.
The bets for a 25-basis point hike to 4.5%-4.75% in February by the Fed remained largely unchanged at around 70% following the data on Thursday, although expectations for the terminal rate inched up to 4.89% by May 2023. FEDWATCH
At 9:50 a.m. ET, the Dow Jones Industrial Average .DJI was down 331.19 points, or 0.99%, at 33,045.29, the S&P 500 .SPX was down 50.70 points, or 1.31%, at 3,827.74, and the Nasdaq Composite .IXIC was down 197.23 points, or 1.84%, at 10,512.14.
Micron Technology Inc MU.O slipped 3.2% after the chipmaker forecast a bigger-than-expected second-quarter loss, sparking declines in peers.
Nvidia Corp NVDA.O, Qualcomm Inc QCOM.O, Advanced Micro Devices Inc AMD.O and Intel Corp INTC.O were down between 3.0% and 5.1%, pushing the Philadelphia SE Semiconductor index .SOX more than 3% lower.
CarMax Inc KMX.N slid 8.6% to the bottom of the S&P 500 after the used-vehicles retailer paused share buybacks following an 86% plunge in quarterly profit.
AMC Entertainment Holdings Inc AMC.N slumped 12.5% after the world's largest cinema chain said it would raise $110 million through a preferred stock sale.
Declining issues outnumbered advancers for a 5.83-to-1 ratio on the NYSE and a 3.28-to-1 ratio on the Nasdaq.
The S&P index recorded no new 52-week highs and nine new lows, while the Nasdaq recorded 27 new highs and 180 new lows.
(Reporting by Shubham Batra, Amruta Khandekar, Ankika Biswas and Johann M Cherian in Bengaluru; Editing by Shounak Dasgupta)
((Shubham.Batra@thomsonreuters.com))
The views and opinions expressed herein are the views and opinions of the author and do not necessarily reflect those of Nasdaq, Inc.","Nvidia Corp NVDA.O, Qualcomm Inc QCOM.O, Advanced Micro Devices Inc AMD.O and Intel Corp INTC.O were down between 3.0% and 5.1%, pushing the Philadelphia SE Semiconductor index .SOX more than 3% lower. For a Reuters live blog on U.S., UK and European stock markets, click LIVE/ or type LIVE/ in a news window Q3 GDP estimate more than expected Micron forecasts bigger-than-expected Q2 loss Other chipmakers fall AMC slumps on $110 mln equity raise Indexes down: Dow 0.99%, S&P 1.31%, Nasdaq 1.84% Adds details, updates prices to open By Ankika Biswas and Johann M Cherian Dec 22 (Reuters) - Wall Street's main indexes dropped on Thursday after fresh data underscored strength in the U.S. economy and aggravated concerns over the Federal Reserve's continued policy tightening. There are concerns that the economy is not giving up too easily and it's putting up a fight that will likely require the Fed to remain hawkish and keep interest rates higher for longer,"" Sam Stovall, chief investment strategist at CFRA Research in New York, said.","Nvidia Corp NVDA.O, Qualcomm Inc QCOM.O, Advanced Micro Devices Inc AMD.O and Intel Corp INTC.O were down between 3.0% and 5.1%, pushing the Philadelphia SE Semiconductor index .SOX more than 3% lower. For a Reuters live blog on U.S., UK and European stock markets, click LIVE/ or type LIVE/ in a news window Q3 GDP estimate more than expected Micron forecasts bigger-than-expected Q2 loss Other chipmakers fall AMC slumps on $110 mln equity raise Indexes down: Dow 0.99%, S&P 1.31%, Nasdaq 1.84% Adds details, updates prices to open By Ankika Biswas and Johann M Cherian Dec 22 (Reuters) - Wall Street's main indexes dropped on Thursday after fresh data underscored strength in the U.S. economy and aggravated concerns over the Federal Reserve's continued policy tightening. The Fed struck a hawkish tone last week at its policy meeting by saying that it expects interest rates to remain higher for longer, sparking a selloff across stock markets.","Nvidia Corp NVDA.O, Qualcomm Inc QCOM.O, Advanced Micro Devices Inc AMD.O and Intel Corp INTC.O were down between 3.0% and 5.1%, pushing the Philadelphia SE Semiconductor index .SOX more than 3% lower. For a Reuters live blog on U.S., UK and European stock markets, click LIVE/ or type LIVE/ in a news window Q3 GDP estimate more than expected Micron forecasts bigger-than-expected Q2 loss Other chipmakers fall AMC slumps on $110 mln equity raise Indexes down: Dow 0.99%, S&P 1.31%, Nasdaq 1.84% Adds details, updates prices to open By Ankika Biswas and Johann M Cherian Dec 22 (Reuters) - Wall Street's main indexes dropped on Thursday after fresh data underscored strength in the U.S. economy and aggravated concerns over the Federal Reserve's continued policy tightening. The Fed struck a hawkish tone last week at its policy meeting by saying that it expects interest rates to remain higher for longer, sparking a selloff across stock markets.","Nvidia Corp NVDA.O, Qualcomm Inc QCOM.O, Advanced Micro Devices Inc AMD.O and Intel Corp INTC.O were down between 3.0% and 5.1%, pushing the Philadelphia SE Semiconductor index .SOX more than 3% lower. For a Reuters live blog on U.S., UK and European stock markets, click LIVE/ or type LIVE/ in a news window Q3 GDP estimate more than expected Micron forecasts bigger-than-expected Q2 loss Other chipmakers fall AMC slumps on $110 mln equity raise Indexes down: Dow 0.99%, S&P 1.31%, Nasdaq 1.84% Adds details, updates prices to open By Ankika Biswas and Johann M Cherian Dec 22 (Reuters) - Wall Street's main indexes dropped on Thursday after fresh data underscored strength in the U.S. economy and aggravated concerns over the Federal Reserve's continued policy tightening. Losses in rate-sensitive megacap growth stocks such as Apple Inc AAPL.O, Microsoft Corp MSFT.O and Amazon.com Inc AMZN.O pulled technology .SPLRCT and consumer discretionary shares .SPLRCD lower.",2022,2
2022-12-22 00:00:00+00:00,3 Ridiculously Cheap Dividend Stocks That Yield More Than 3%,INTC,https://www.nasdaq.com/articles/3-ridiculously-cheap-dividend-stocks-that-yield-more-than-3,,,"Buying dividend stocks that are trading at low earnings multiples can set investors up to earn recurring income while also potentially benefiting from capital gains in the future. While undervalued stocks can sometimes be value traps, that isn't the case with these quality investments.
Novartis (NYSE: NVS), Canadian Imperial Bank of Commerce (NYSE: CM), and Intel (NASDAQ: INTC) are solid stocks with great yields to consider buying right now.
1. Novartis
Swiss drugmaker Novartis is a top healthcare company that has generated close to $7 billion in sales this year just from two products alone -- Cosentyx and Entresto. And with $24.3 billion in revenue during the first nine months of the year, the company isn't overly dependent on those products. Good diversification is part of the reason the stock makes for a solid dividend investment.
Currently, Novartis pays a yield of 3.7%, which is two full points higher than the S&P 500 average of 1.7%. What's encouraging is that even with such a high yield, the healthcare stock's payout ratio remains modest at just 34% of earnings. This means that Novartis has room to increase its dividend in the future, something that it has been doing for 25 years in a row.
Novartis is also an attractive investment to buy and hold because the company is forecasting some modest and consistent growth. Through 2026, it's projecting that its sales will rise by 4% annually as it counts on 20-plus products that have the potential to be blockbusters (generating peak revenue of at least $1 billion).
Trading at just 9 times earnings, the stock is an incredibly cheap buy given the attractive growth and dividend income it offers investors; the average S&P 500 stock trades at a multiple of 19. Novartis is also the only stock on this list that has generated positive gains this year as its shares are up around 3%.
2. Canadian Imperial Bank of Commerce
Dividend-hungry investors can collect an even better yield from the Canadian Imperial Bank of Commerce (CIBC), whose stock pays 6.2% annually. That's a remarkably high payout for a bank stock. And considering that CIBC is a top chartered bank in Canada, there isn't a whole lot of risk here.
At around 50%, the bank's payout ratio isn't high, and it has been increasing its dividend payments since 2011. But its overall streak of paying dividends goes back more than 150 years to 1868 when it made its first dividend payment. Its price-to-earnings (P/E) multiple of 8 is incredibly low and offers investors terrific value.
While bank stocks could be risky buys heading into a possible recession next year, CIBC's low multiple gives investors a good margin of safety, potentially limiting the downside risk for the stock in the near term. And in the long haul, CIBC is an excellent stock to invest in as the business is highly profitable, generating a strong profit margin of 28% over the trailing 12 months.
3. Intel
Tech stock and chipmaker Intel is another high-yielding investment that can make for a solid buy right now. Investors are wary of the company's efforts to build out its foundry business as that will come with added costs and could put pressure on the dividend. Earlier this year, the company announced it would be committing $36 billion to produce chips in Europe and that its investment will increase to more than double that over the course of a decade.
Given the strong need for capital, Intel is arguably the riskiest dividend stock on this list. But its payout ratio of 45% remains modest. Concerned investors, however, will point to the company's negative free cash flow of $13.3 billion over the past 12 months as a problem.
But during that time, the company's changes in working capital (e.g., changes in receivables and inventory) resulted in an outflow of more than $10 billion. Those are items that can and will fluctuate over the course of business, and that means those outflows could eventually turn into inflows.
Plus, with $22.6 billion in cash and short-term investments on its books (as of the end of September), the company has strong financial resources to help fund its growth and to help buy time for the cash flow situation to improve. Intel's dividend costs the company approximately $1.5 billion each quarter.
Strong demand in the chip market and Intel reporting solid operating profits of around 12% should give investors confidence in the business in the long run. Management also increased the dividend by 5% earlier this year -- a move that likely wouldn't have happened if the company had been concerned about the safety of its payouts.
Intel is a bit of a contrarian investment, but with a yield of 5.4% and a P/E of only eight, it could be an underrated dividend stock to buy right now.
10 stocks we like better than Novartis Ag
When our award-winning analyst team has a stock tip, it can pay to listen. After all, the newsletter they have run for over a decade, Motley Fool Stock Advisor, has tripled the market.*
They just revealed what they believe are the ten best stocks for investors to buy right now... and Novartis Ag wasn't one of them! That's right -- they think these 10 stocks are even better buys.
See the 10 stocks
*Stock Advisor returns as of December 1, 2022
David Jagielski has no position in any of the stocks mentioned. The Motley Fool has positions in and recommends Intel. The Motley Fool recommends the following options: long January 2023 $57.50 calls on Intel, long January 2025 $45 calls on Intel, and short January 2025 $45 puts on Intel. The Motley Fool has a disclosure policy.
The views and opinions expressed herein are the views and opinions of the author and do not necessarily reflect those of Nasdaq, Inc.","Novartis (NYSE: NVS), Canadian Imperial Bank of Commerce (NYSE: CM), and Intel (NASDAQ: INTC) are solid stocks with great yields to consider buying right now. Earlier this year, the company announced it would be committing $36 billion to produce chips in Europe and that its investment will increase to more than double that over the course of a decade. Concerned investors, however, will point to the company's negative free cash flow of $13.3 billion over the past 12 months as a problem.","Novartis (NYSE: NVS), Canadian Imperial Bank of Commerce (NYSE: CM), and Intel (NASDAQ: INTC) are solid stocks with great yields to consider buying right now. Trading at just 9 times earnings, the stock is an incredibly cheap buy given the attractive growth and dividend income it offers investors; the average S&P 500 stock trades at a multiple of 19. The Motley Fool recommends the following options: long January 2023 $57.50 calls on Intel, long January 2025 $45 calls on Intel, and short January 2025 $45 puts on Intel.","Novartis (NYSE: NVS), Canadian Imperial Bank of Commerce (NYSE: CM), and Intel (NASDAQ: INTC) are solid stocks with great yields to consider buying right now. Trading at just 9 times earnings, the stock is an incredibly cheap buy given the attractive growth and dividend income it offers investors; the average S&P 500 stock trades at a multiple of 19. While bank stocks could be risky buys heading into a possible recession next year, CIBC's low multiple gives investors a good margin of safety, potentially limiting the downside risk for the stock in the near term.","Novartis (NYSE: NVS), Canadian Imperial Bank of Commerce (NYSE: CM), and Intel (NASDAQ: INTC) are solid stocks with great yields to consider buying right now. While bank stocks could be risky buys heading into a possible recession next year, CIBC's low multiple gives investors a good margin of safety, potentially limiting the downside risk for the stock in the near term. Intel Tech stock and chipmaker Intel is another high-yielding investment that can make for a solid buy right now.",2022,4
