Date,Article_title,Stock_symbol,Url,Publisher,Author,Article,Lsa_summary,Luhn_summary,Textrank_summary,Lexrank_summary,Year,sentiment_score
2022-03-24 00:00:00+00:00,Top Semiconductor Stocks To Watch Before April 2022,INTC,https://www.nasdaq.com/articles/top-semiconductor-stocks-to-watch-before-april-2022,,,"3 Semiconductor Stocks To Watch Right Now 
The stock market has had its fair share of ups and downs since the start of the year. Semiconductor stocks are not spared from the volatility in the broader market. That is especially so considering that supply chain disruptions have been causing a shortage of semiconductor chips. In fact, it may even come as a surprise for some that almost every industry in the world today is reliant on semiconductors. For instance, the personal computers that we use require microprocessors, memory, graphic processing units, and many more. These are all semiconductor components that play crucial roles in making the machines operational. 
Elsewhere, even the medical field utilizes advanced technology that requires semiconductors. Risky surgeries are now being aided by machines to improve precision. And, none of these would be possible without semiconductor chips. Similarly, as many newer vehicles come equipped with digital displays and semi-autonomous features, the auto industry needs more semiconductor chips than ever.
We only need to look at what Intel’s (NASDAQ: INTC) CEO Pat Gelsinger has to say. He believes that “there is an urgent need for the federal government to incentivize more private sector investment in the United States to enable a resilient and innovative semiconductor ecosystem.” On top of that, Micron’s (NASDAQ: MU) CEO Sanjay Mehrotra also calls on Congress to pass the refundable investment tax credit to create a long-term incentive that may invigorate domestic manufacturing in the industry. With that said, could we see a strong rebound from semiconductor stocks soon? If you think so, here are some of the top semiconductor stocks in the stock market today. 
Semiconductor Stocks To Buy [Or Sell] Right Now
NVIDIA Corporation (NASDAQ: NVDA)
Axcelis Technologies Inc (NASDAQ: ACLS)
Veeco Instruments Inc. (NASDAQ: VECO)
NVIDIA
NVIDIA is a tech giant that has been on the rise at an unprecedented pace over the past few years. The company provides graphics and computer solutions around the world. NVIDIA invented the programmable shading graphic processing units (GPUs) two decades ago, defining modern real-time computer graphics. Today, it has reinvented computer graphics again. The company’s new approach using the NVIDIA RTX™ fuses rasterization and programmable shading with ray tracing and artificial intelligence to make graphics more realistic and almost cinematic. 
On Tuesday, NVIDIA announced the launch of its new NVIDIA Omniverse™ features during the Game Developers Conference. This includes updates to Omniverse Audio2Face™, Omniverse Nucleus Cloud, Omniverse DeepSearch, and the introduction of Unreal Engine 5 Omniverse Connector. Therefore, it will make it easier for developers to share assets, sort asset libraries, and deploy AI to animate characters’ facial expressions in future games. Needless to say, these new developments would help address the challenges of doing business in today’s world. 
On top of that, the company also recently announced the availability of its Jetson AGX Orin™ developer kit. This is the world’s most powerful, compact, and energy-efficient AI supercomputer for the field of robotics and autonomous machines. Besides that, there is also news reporting that NVIDIA is now open to the idea of using Intel to manufacture its chips. Intel’s CEO Pat Gelsinger also confirmed that there were ongoing discussions with Nvidia. Given these exciting developments, would you buy NVDA stock?
Source: TD Ameritrade TOS
 [Read More] Top Stock Market News For Today March 24, 2022
Axcelis
Following that, we will be looking at Axcelis. Essentially, the company designs, manufactures, and services ion implantation and other processing equipment used in the fabrication of semiconductor chips. Additionally, it also provides aftermarket lifecycle products and services such as used tools, spare parts, maintenance services as well as customer training. Impressively, ACLS stock has been riding on strong bullish momentum. The stock has risen more than 115% over the past year. 
Last week, Axcelis announced that it has shipped multiple of its Purion VXE™ high energy systems to multiple leading CMOS image sensor manufacturers in Asia. The Purion XVE is an extended energy range solution for its Purion XE™ high energy implanter. Evidently, the company remains a market leader in the image sensor market. Its growth in this segment appears to be sustainable and benefits from long-term trends such as the growing Internet of Things (IoT), mobile, and automotive markets. 
Financially, the company has also been firing on all cylinders. During its fourth quarter, its revenue came in at $205.7 million, surpassing guidance and representing an increase of 14.7% compared to the third quarter. Net income for the quarter was $35.7 million or $1.05 per diluted share, up 29.8% compared to the prior quarter. Meanwhile, its revenue for the full year 2021 was $662.4 million, up 40% year-over-year, and is a company record. Overall, Axcelis appears to be in a prime position for a strong year ahead. With that in mind, do you consider ACLS stock a top semiconductor stock to watch?
Source: TD Ameritrade TOS
 [Read More] Stock Market Today: Dow Jones, S&P 500 Rise As NATO Leaders Convene; Nikola Surges As EV Truck Production Begins
Veeco
Last but not least, we have the developer and manufacturer of semiconductor and thin-film process equipment, Veeco. In detail, its products are primarily sold to make electronic devices. The company covers a range of markets that includes semiconductor, photonics, communication and data storage, sensors, and even power markets. Despite trading sideways for most of the year, VECO stock has still risen more than 35% within the past year.
Recently, Veeco announced that a world-leading semiconductor manufacturer ordered multiple of its WaferStorm Wet Processing Systems. These are used for advanced packaging applications. The advantages that it brings are the low cost of ownership and process performance as compared to other platforms. Besides that, some customers operate its LSA201 Laser Spike Annealing System for their front-end-of-line processes. All in all, the growing demand for the company’s products puts it in a strong position for further long-term growth. 
In February, Veeco announced its fourth-quarter and full-year 2021 financials. The company reported a revenue of $153.0 million, compared to $138.9 million in the same period last year. Furthermore, its GAAP net income turned positive to $8.2 million as compared to a net loss of $0.1 million in the prior year’s quarter. Safe to say, it was a successful year for the company as it continues to advance its product innovation and penetrate new customers. All things considered, do you think VECO stock will have more room to grow?
Source: TD Ameritrade TOS
If you enjoyed this article and you’re interested in learning how to trade so you can have the best chance to profit consistently then you need to checkout this YouTube channel.
CLICK HERE RIGHT NOW!!
The views and opinions expressed herein are the views and opinions of the author and do not necessarily reflect those of Nasdaq, Inc.","We only need to look at what Intel’s (NASDAQ: INTC) CEO Pat Gelsinger has to say. The company’s new approach using the NVIDIA RTX™ fuses rasterization and programmable shading with ray tracing and artificial intelligence to make graphics more realistic and almost cinematic. Its growth in this segment appears to be sustainable and benefits from long-term trends such as the growing Internet of Things (IoT), mobile, and automotive markets.","We only need to look at what Intel’s (NASDAQ: INTC) CEO Pat Gelsinger has to say. Semiconductor Stocks To Buy [Or Sell] Right Now NVIDIA Corporation (NASDAQ: NVDA) Axcelis Technologies Inc (NASDAQ: ACLS) Veeco Instruments Inc. (NASDAQ: VECO) Source: TD Ameritrade TOS [Read More] Top Stock Market News For Today March 24, 2022 Axcelis Following that, we will be looking at Axcelis.","We only need to look at what Intel’s (NASDAQ: INTC) CEO Pat Gelsinger has to say. If you think so, here are some of the top semiconductor stocks in the stock market today. Semiconductor Stocks To Buy [Or Sell] Right Now NVIDIA Corporation (NASDAQ: NVDA) Axcelis Technologies Inc (NASDAQ: ACLS) Veeco Instruments Inc. (NASDAQ: VECO)","We only need to look at what Intel’s (NASDAQ: INTC) CEO Pat Gelsinger has to say. If you think so, here are some of the top semiconductor stocks in the stock market today. Semiconductor Stocks To Buy [Or Sell] Right Now NVIDIA Corporation (NASDAQ: NVDA) Axcelis Technologies Inc (NASDAQ: ACLS) Veeco Instruments Inc. (NASDAQ: VECO)",2022,3
2022-03-24 00:00:00+00:00,Is iShares MSCI USA Value Factor ETF (VLUE) a Strong ETF Right Now?,INTC,https://www.nasdaq.com/articles/is-ishares-msci-usa-value-factor-etf-vlue-a-strong-etf-right-now-1,,,"A smart beta exchange traded fund, the iShares MSCI USA Value Factor ETF (VLUE) debuted on 04/16/2013, and offers broad exposure to the Style Box - Large Cap Value category of the market.
What Are Smart Beta ETFs?
For a long time now, the ETF industry has been flooded with products based on market capitalization weighted indexes, which are designed to represent the broader market or a particular market segment.
A good option for investors who believe in market efficiency, market cap weighted indexes offer a low-cost, convenient, and transparent way of replicating market returns.
If you're the kind of investor who would rather try and beat the market through good stock selection, then smart beta funds are your best choice; this fund class is known for tracking non-cap weighted strategies.
This kind of index follows this same mindset, as it attempts to pick stocks that have better chances of risk-return performance; non-cap weighted strategies base selection on certain fundamental characteristics, or a mix of such characteristics.
Methodologies like equal-weighting, one of the simplest options out there, fundamental weighting, and volatility/momentum based weighting are all choices offered to investors in this space, but not all of them can deliver superior returns.
Fund Sponsor & Index
Managed by Blackrock, VLUE has amassed assets over $12.92 billion, making it one of the larger ETFs in the Style Box - Large Cap Value. Before fees and expenses, VLUE seeks to match the performance of the MSCI USA Enhanced Value Index.
The MSCI USA Enhanced Value Index is based on a traditional market capitalization-weighted parent index, the MSCI USA Index which includes U.S. large and mid capitalization stocks.
Cost & Other Expenses
Cost is an important factor in selecting the right ETF, and cheaper funds can significantly outperform their more expensive cousins if all other fundamentals are the same.
Annual operating expenses for VLUE are 0.15%, which makes it one of the cheaper products in the space.
The fund has a 12-month trailing dividend yield of 2.32%.
Sector Exposure and Top Holdings
Most ETFs are very transparent products, and disclose their holdings on a daily basis. ETFs also offer diversified exposure, which minimizes single stock risk, though it's still important for investors to research a fund's holdings.
Representing 25.60% of the portfolio, the fund has heaviest allocation to the Information Technology sector; Healthcare and Consumer Discretionary round out the top three.
Taking into account individual holdings, At&t Inc (T) accounts for about 6.44% of the fund's total assets, followed by Intel Corporation Corp (INTC) and General Motors (GM).
VLUE's top 10 holdings account for about 26.48% of its total assets under management.
Performance and Risk
The ETF has lost about -5.67% so far this year and it's up approximately 5.90% in the last one year (as of 03/24/2022). In the past 52-week period, it has traded between $100.54 and $114.92.
The ETF has a beta of 1.05 and standard deviation of 26.04% for the trailing three-year period, making it a medium risk choice in the space. With about 153 holdings, it effectively diversifies company-specific risk.
Alternatives
IShares MSCI USA Value Factor ETF is an excellent option for investors seeking to outperform the Style Box - Large Cap Value segment of the market. There are other ETFs in the space which investors could consider as well.
IShares Russell 1000 Value ETF (IWD) tracks Russell 1000 Value Index and the Vanguard Value ETF (VTV) tracks CRSP U.S. Large Cap Value Index. IShares Russell 1000 Value ETF has $57.56 billion in assets, Vanguard Value ETF has $100.51 billion. IWD has an expense ratio of 0.19% and VTV charges 0.04%.
Investors looking for cheaper and lower-risk options should consider traditional market cap weighted ETFs that aim to match the returns of the Style Box - Large Cap Value.
Bottom Line
To learn more about this product and other ETFs, screen for products that match your investment objectives and read articles on latest developments in the ETF investing universe, please visit Zacks ETF Center.

Want key ETF info delivered straight to your inbox?
Zacks’ free Fund Newsletter will brief you on top news and analysis, as well as top-performing ETFs, each week.
Get it free >>

Want the latest recommendations from Zacks Investment Research? Today, you can download 7 Best Stocks for the Next 30 Days. Click to get this free report
 
iShares MSCI USA Value Factor ETF (VLUE): ETF Research Reports
 
Intel Corporation (INTC): Free Stock Analysis Report
 
AT&T Inc. (T): Free Stock Analysis Report
 
General Motors Company (GM): Free Stock Analysis Report
 
Vanguard Value ETF (VTV): ETF Research Reports
 
iShares Russell 1000 Value ETF (IWD): ETF Research Reports
 
To read this article on Zacks.com click here.
The views and opinions expressed herein are the views and opinions of the author and do not necessarily reflect those of Nasdaq, Inc.","Taking into account individual holdings, At&t Inc (T) accounts for about 6.44% of the fund's total assets, followed by Intel Corporation Corp (INTC) and General Motors (GM). Intel Corporation (INTC): Free Stock Analysis Report A smart beta exchange traded fund, the iShares MSCI USA Value Factor ETF (VLUE) debuted on 04/16/2013, and offers broad exposure to the Style Box - Large Cap Value category of the market.","Taking into account individual holdings, At&t Inc (T) accounts for about 6.44% of the fund's total assets, followed by Intel Corporation Corp (INTC) and General Motors (GM). Intel Corporation (INTC): Free Stock Analysis Report A smart beta exchange traded fund, the iShares MSCI USA Value Factor ETF (VLUE) debuted on 04/16/2013, and offers broad exposure to the Style Box - Large Cap Value category of the market.","Taking into account individual holdings, At&t Inc (T) accounts for about 6.44% of the fund's total assets, followed by Intel Corporation Corp (INTC) and General Motors (GM). Intel Corporation (INTC): Free Stock Analysis Report A smart beta exchange traded fund, the iShares MSCI USA Value Factor ETF (VLUE) debuted on 04/16/2013, and offers broad exposure to the Style Box - Large Cap Value category of the market.","Taking into account individual holdings, At&t Inc (T) accounts for about 6.44% of the fund's total assets, followed by Intel Corporation Corp (INTC) and General Motors (GM). Intel Corporation (INTC): Free Stock Analysis Report A smart beta exchange traded fund, the iShares MSCI USA Value Factor ETF (VLUE) debuted on 04/16/2013, and offers broad exposure to the Style Box - Large Cap Value category of the market.",2022,3
2022-03-24 00:00:00+00:00,May 6th Options Now Available For Intel (INTC),INTC,https://www.nasdaq.com/articles/may-6th-options-now-available-for-intel-intc,,,"Investors in Intel Corp (Symbol: INTC) saw new options begin trading today, for the May 6th expiration. At Stock Options Channel, our YieldBoost formula has looked up and down the INTC options chain for the new May 6th contracts and identified one put and one call contract of particular interest.
The put contract at the $50.00 strike price has a current bid of $2.47. If an investor was to sell-to-open that put contract, they are committing to purchase the stock at $50.00, but will also collect the premium, putting the cost basis of the shares at $47.53 (before broker commissions). To an investor already interested in purchasing shares of INTC, that could represent an attractive alternative to paying $50.37/share today.
Because the $50.00 strike represents an approximate 1% discount to the current trading price of the stock (in other words it is out-of-the-money by that percentage), there is also the possibility that the put contract would expire worthless. The current analytical data (including greeks and implied greeks) suggest the current odds of that happening are 99%. Stock Options Channel will track those odds over time to see how they change, publishing a chart of those numbers on our website under the contract detail page for this contract. Should the contract expire worthless, the premium would represent a 4.94% return on the cash commitment, or 41.93% annualized — at Stock Options Channel we call this the YieldBoost.
Below is a chart showing the trailing twelve month trading history for Intel Corp, and highlighting in green where the $50.00 strike is located relative to that history:
Turning to the calls side of the option chain, the call contract at the $52.00 strike price has a current bid of $1.75. If an investor was to purchase shares of INTC stock at the current price level of $50.37/share, and then sell-to-open that call contract as a ""covered call,"" they are committing to sell the stock at $52.00. Considering the call seller will also collect the premium, that would drive a total return (excluding dividends, if any) of 6.71% if the stock gets called away at the May 6th expiration (before broker commissions). Of course, a lot of upside could potentially be left on the table if INTC shares really soar, which is why looking at the trailing twelve month trading history for Intel Corp, as well as studying the business fundamentals becomes important. Below is a chart showing INTC's trailing twelve month trading history, with the $52.00 strike highlighted in red:
Considering the fact that the $52.00 strike represents an approximate 3% premium to the current trading price of the stock (in other words it is out-of-the-money by that percentage), there is also the possibility that the covered call contract would expire worthless, in which case the investor would keep both their shares of stock and the premium collected. The current analytical data (including greeks and implied greeks) suggest the current odds of that happening are 99%. On our website under the contract detail page for this contract, Stock Options Channel will track those odds over time to see how they change and publish a chart of those numbers (the trading history of the option contract will also be charted). Should the covered call contract expire worthless, the premium would represent a 3.47% boost of extra return to the investor, or 29.49% annualized, which we refer to as the YieldBoost.
Meanwhile, we calculate the actual trailing twelve month volatility (considering the last 253 trading day closing values as well as today's price of $50.37) to be 29%. For more put and call options contract ideas worth looking at, visit StockOptionsChannel.com.
Top YieldBoost Calls of the Nasdaq 100 »
The views and opinions expressed herein are the views and opinions of the author and do not necessarily reflect those of Nasdaq, Inc.","Of course, a lot of upside could potentially be left on the table if INTC shares really soar, which is why looking at the trailing twelve month trading history for Intel Corp, as well as studying the business fundamentals becomes important. Below is a chart showing INTC's trailing twelve month trading history, with the $52.00 strike highlighted in red: Considering the fact that the $52.00 strike represents an approximate 3% premium to the current trading price of the stock (in other words it is out-of-the-money by that percentage), there is also the possibility that the covered call contract would expire worthless, in which case the investor would keep both their shares of stock and the premium collected. Investors in Intel Corp (Symbol: INTC) saw new options begin trading today, for the May 6th expiration.","Below is a chart showing INTC's trailing twelve month trading history, with the $52.00 strike highlighted in red: Considering the fact that the $52.00 strike represents an approximate 3% premium to the current trading price of the stock (in other words it is out-of-the-money by that percentage), there is also the possibility that the covered call contract would expire worthless, in which case the investor would keep both their shares of stock and the premium collected. The current analytical data (including greeks and implied greeks) suggest the current odds of that happening are 99%. Investors in Intel Corp (Symbol: INTC) saw new options begin trading today, for the May 6th expiration.","Below is a chart showing INTC's trailing twelve month trading history, with the $52.00 strike highlighted in red: Considering the fact that the $52.00 strike represents an approximate 3% premium to the current trading price of the stock (in other words it is out-of-the-money by that percentage), there is also the possibility that the covered call contract would expire worthless, in which case the investor would keep both their shares of stock and the premium collected. Investors in Intel Corp (Symbol: INTC) saw new options begin trading today, for the May 6th expiration. At Stock Options Channel, our YieldBoost formula has looked up and down the INTC options chain for the new May 6th contracts and identified one put and one call contract of particular interest.","At Stock Options Channel, our YieldBoost formula has looked up and down the INTC options chain for the new May 6th contracts and identified one put and one call contract of particular interest. Below is a chart showing INTC's trailing twelve month trading history, with the $52.00 strike highlighted in red: Considering the fact that the $52.00 strike represents an approximate 3% premium to the current trading price of the stock (in other words it is out-of-the-money by that percentage), there is also the possibility that the covered call contract would expire worthless, in which case the investor would keep both their shares of stock and the premium collected. Investors in Intel Corp (Symbol: INTC) saw new options begin trading today, for the May 6th expiration.",2022,3
