Date,Article_title,Stock_symbol,Url,Publisher,Author,Article,Lsa_summary,Luhn_summary,Textrank_summary,Lexrank_summary,Year,sentiment_score
2022-05-05 00:00:00+00:00,The Smart Way to Buy Advanced Micro Devices After Earnings,INTC,https://www.nasdaq.com/articles/the-smart-way-to-buy-advanced-micro-devices-after-earnings,,,"InvestorPlace - Stock Market News, Stock Advice & Trading Tips
Advanced Micro Devices (AMD) shares jumped 9% on better-than-expected earnings and a less hawkish tone from the Federal Reserve.
The outsized gains have spectators wondering if the worst is over and if it’s time to bottom fish the fallen angel.
Directional trades remain tricky, but cash flow strategies on AMD stock could be worth a shot.
Source: JHVEPhoto / Shutterstock.com
It may not seem like it based on the 9% advance, but Advanced Micro Devices (NASDAQ:AMD) actually took investors on a wild ride Wednesday. AMD stock leaped out of the gate on the back of an earnings hat trick. The company beat on the top and bottom lines while raising forward guidance.
The upbeat forecast set AMD apart from the likes of Intel (NASDAQ:INTC), which offered disappointing forecasts during its report. Despite the strong open, AMD stock quickly reversed, nearly filling its 8% gap ahead of the Federal Reserve meeting.
But what could have been an ominous bearish reversal was rescued by Fed Chair Jerome Powell in its post-meeting presser. As widely expected, the Federal Reserve raised interest rates by half a percent. More importantly, Powell laid to rest concerns of an even larger rate hike next month.
With that, a market bracing for the worst went wild. AMD stock capitalized on the buying bonanza, reclaimed early-morning losses and finished up over 9%.
Let’s take a closer look at the earnings report. Then I’ll break down the AMD stock price chart and explain why bulls still face an uphill battle.
AMD Advanced Micro Devices $94.53
Advanced Micro Devices Smashed Earnings
AMD released its first-quarter numbers on Tuesday and gave shareholders something to cheer about. Earnings per share came in at $1.13 versus 91 cents expected, marking a 117% year-over-year increase.
7 Restaurant Stocks Ready for a 'Revenge Travel' Rally
Revenue ballooned to $5.89 billion, topping the $5.52 billion expected. This marked a 71% increase compared to the year ago quarter. The company anticipates $6.5 billion in sales for the second quarter, which is well above analyst forecasts of $6.38 billion.
Advanced Micro Devices hit all the right notes, giving plenty of evidence to support buying shares. Unfortunately, the solid fundamental backdrop is competing with souring sentiment and troublesome technicals on AMD’s price chart.
AMD Stock Needs Time
Source: The thinkorswim® platform from TD Ameritrade
Despite earnings and sales growth continuing to dazzle, AMD’s share price has fallen nearly 50% from last year’s peak. Red-hot inflation and the accompanying upward pressure placed on interest rates have investors re-pricing growth stocks.
The negative sentiment surrounding Russia’s invasion of Ukraine isn’t helping matters, either. Given the drubbing suffered over the past six months, it will take more than a single thrust to reverse the trend.
In fairness to the bulls, yesterday was impressive. Returning to close at the high of the day after falling so far in the morning was an intraday reversal for the history books. Moreover, volume ballooned past 225 million shares to show significant buying pressure. AMD stock closed above the 20-day moving average and a short-term resistance zone.
Unfortunately, many bearish arguments remain in play. First, the downswing preceding this week’s rally carried the downtrend to a new low on increasing momentum. Second, the 20-day and 50-day moving averages are still gliding lower.
Third, we’ve seen three previous bounce attempts fail in recent months. And finally, we didn’t see any immediate follow-through Thursday morning. Therefore, we need time and more bullish price action to signal that a sustained trend reversal is forming. I’m not a fan of aggressive directional plays here for these reasons.
How to Trade AMD Stock Now
The higher probability and smarter way to wade in is with a cash flow-based options strategy that will still profit if AMD doesn’t see substantial upside. Selling puts is my favorite play here. Because of this morning’s weakness, I would wait for an up day before pulling the trigger.
The Trade: Sell the June 10 $80 naked put for $2.
Consider this a bet that AMD stock stays above $80 for the next month. If it does, you’ll pocket the premium received. If it doesn’t, you’re on the hook for buying shares at $78.
On the date of publication, Tyler Craig was LONG AMD. The opinions expressed in this article are those of the writer, subject to the InvestorPlace.com Publishing Guidelines.
The post The Smart Way to Buy Advanced Micro Devices After Earnings appeared first on InvestorPlace.
The views and opinions expressed herein are the views and opinions of the author and do not necessarily reflect those of Nasdaq, Inc.","The upbeat forecast set AMD apart from the likes of Intel (NASDAQ:INTC), which offered disappointing forecasts during its report. Directional trades remain tricky, but cash flow strategies on AMD stock could be worth a shot. Despite the strong open, AMD stock quickly reversed, nearly filling its 8% gap ahead of the Federal Reserve meeting.","The upbeat forecast set AMD apart from the likes of Intel (NASDAQ:INTC), which offered disappointing forecasts during its report. InvestorPlace - Stock Market News, Stock Advice & Trading Tips Advanced Micro Devices (AMD) shares jumped 9% on better-than-expected earnings and a less hawkish tone from the Federal Reserve. As widely expected, the Federal Reserve raised interest rates by half a percent.","The upbeat forecast set AMD apart from the likes of Intel (NASDAQ:INTC), which offered disappointing forecasts during its report. InvestorPlace - Stock Market News, Stock Advice & Trading Tips Advanced Micro Devices (AMD) shares jumped 9% on better-than-expected earnings and a less hawkish tone from the Federal Reserve. AMD Advanced Micro Devices $94.53 Advanced Micro Devices Smashed Earnings AMD released its first-quarter numbers on Tuesday and gave shareholders something to cheer about.","The upbeat forecast set AMD apart from the likes of Intel (NASDAQ:INTC), which offered disappointing forecasts during its report. InvestorPlace - Stock Market News, Stock Advice & Trading Tips Advanced Micro Devices (AMD) shares jumped 9% on better-than-expected earnings and a less hawkish tone from the Federal Reserve. Then I’ll break down the AMD stock price chart and explain why bulls still face an uphill battle.",2022,2
2022-05-05 00:00:00+00:00,Is This the Best Semiconductor Stock of 2022?,INTC,https://www.nasdaq.com/articles/is-this-the-best-semiconductor-stock-of-2022,,,"Today's video focuses on recent news affecting the tech industry. The main topics will be Spotify (NYSE: SPOT) and its push into the metaverse, positive news affecting Intel (NASDAQ: INTC), and Qualcomm's (NASDAQ: QCOM) recent earnings report. Here are some highlights.
Spotify has recently entered the metaverse by creating an experience inside Roblox's (NYSE: RBLX) platform. The long-term plan for the metaverse is for it to be a digital concert hall where Spotify can host digital concerts or other experiences for selected artists. The Spotify experience will transform into a theme park focused on K-Pop music and K-Pop artists in the upcoming weeks.
Intel has not been a popular stock to own, mainly due to its low growth. Intel recently reported its first-quarter earnings, and revenue was down 1% year over year (YoY), unlike many other semiconductor companies reporting solid double-digit growth. The ship might be turning around for Intel. In the video, I discuss how one of Intel's consumer products has become a bestseller.
Qualcomm is a stock that is also not popular even though it is seeing strong growth as its considered a company that provides solutions for phones. Still, Qualcomm has started expanding into other emerging markets like automotive and high-performance computing. Qualcomm recently reported 61% YoY revenue growth driven by strength in all its segments.
*Stock prices used were the market prices of May 3, 2022. The video was published on May 3, 2022.

10 stocks we like better than Intel
When our award-winning analyst team has a stock tip, it can pay to listen. After all, the newsletter they have run for over a decade, Motley Fool Stock Advisor, has tripled the market.*
They just revealed what they believe are the ten best stocks for investors to buy right now... and Intel wasn't one of them! That's right -- they think these 10 stocks are even better buys.
See the 10 stocks
*Stock Advisor returns as of April 7, 2022

Jose Najarro has positions in Qualcomm, Roblox Corporation, and Spotify Technology. The Motley Fool has positions in and recommends Intel, Qualcomm, Roblox Corporation, and Spotify Technology. The Motley Fool recommends the following options: long January 2023 $57.50 calls on Intel and short January 2023 $57.50 puts on Intel. The Motley Fool has a disclosure policy. Jose is an affiliate of The Motley Fool and may be compensated for promoting its services. If you choose to subscribe through his link, he will earn some extra money that supports his channel. His opinions remain his own and are unaffected by The Motley Fool.
The views and opinions expressed herein are the views and opinions of the author and do not necessarily reflect those of Nasdaq, Inc.","The main topics will be Spotify (NYSE: SPOT) and its push into the metaverse, positive news affecting Intel (NASDAQ: INTC), and Qualcomm's (NASDAQ: QCOM) recent earnings report. Spotify has recently entered the metaverse by creating an experience inside Roblox's (NYSE: RBLX) platform. Qualcomm recently reported 61% YoY revenue growth driven by strength in all its segments.","The main topics will be Spotify (NYSE: SPOT) and its push into the metaverse, positive news affecting Intel (NASDAQ: INTC), and Qualcomm's (NASDAQ: QCOM) recent earnings report. Qualcomm recently reported 61% YoY revenue growth driven by strength in all its segments. The Motley Fool has positions in and recommends Intel, Qualcomm, Roblox Corporation, and Spotify Technology.","The main topics will be Spotify (NYSE: SPOT) and its push into the metaverse, positive news affecting Intel (NASDAQ: INTC), and Qualcomm's (NASDAQ: QCOM) recent earnings report. The Motley Fool has positions in and recommends Intel, Qualcomm, Roblox Corporation, and Spotify Technology. The Motley Fool recommends the following options: long January 2023 $57.50 calls on Intel and short January 2023 $57.50 puts on Intel.","The main topics will be Spotify (NYSE: SPOT) and its push into the metaverse, positive news affecting Intel (NASDAQ: INTC), and Qualcomm's (NASDAQ: QCOM) recent earnings report. That's right -- they think these 10 stocks are even better buys. The Motley Fool has positions in and recommends Intel, Qualcomm, Roblox Corporation, and Spotify Technology.",2022,4
2022-05-04 00:00:00+00:00,Why Advanced Micro Devices Stock Fell 21.8% in April,INTC,https://www.nasdaq.com/articles/why-advanced-micro-devices-stock-fell-21.8-in-april,,,"What happened
Shares of Advanced Micro Devices (NASDAQ: AMD) fell 21.8% in a rough April, according to data from S&P Global Market Intelligence. The semiconductor company was hit hard in a bad market for technology stocks, especially those that cater to consumer PCs.
Semiconductors tend to be sensitive to market movements, both to the upside and the downside. In addition, higher-valued growth stocks were hit especially hard last month, as the market became increasingly worried about inflation and higher interest rates. As a high-growth semiconductor stock, AMD found itself on the wrong end of the general market mood.
Yet as Tuesday night's earnings report showed, there's certainly nothing wrong with AMD's operational performance at the business level.
So what
There wasn't too much company-specific news during April, aside from the announcement early in the month that AMD would be purchasing data center platform company Pensando for $1.9 billion. Pensando makes a customized processor and software stack that allows customers to optimize data workloads across multiple types of computing chips and architectures. It should go a long way toward bolstering AMD's data center offerings, which consist of its EPYC processors, graphics chips (GPUs), Xilinx field-programmable gate arrays (FPGAs), and other system-on-chips (SOCs).
Still, the Pensando acquisition was not the reason for AMD's decline last month. More likely, investors took note of high inflation and the need for the Fed to raise interest rates quickly. Again, higher rates mean future earnings are discounted more, which hurts growth stocks. Hiking rates too far could cause a recession, which wouldn't be good for chip stocks, either.
Moreover, in the middle of the month, analysts at Baird downgraded AMD's prominent GPU competitor Nvidia (NASDAQ: NVDA). That followed a big downgrade from Truist for AMD, Intel (NASDAQ: INTC), as well as Nvidia. These downgrades came as channel checks from both analysts revealed slowing demand for consumer devices, such as personal computers. Obviously, PCs boomed during the pandemic due to people working from home more, so there could be a bit of a hangover as people go back to the office.
At the end of the month, Intel released an earnings report that beat expectations but disappointed in terms of second-quarter guidance, compounding fears about the PC sector. AMD is currently taking market share from Intel in both personal computing as well as data centers, but the tepid Intel forecast was extrapolated to the whole sector.
Image source: Getty Images.
Now what
As it turns out, the market might have been a bit too pessimistic in April -- on AMD as well as other chip stocks. Tuesday night, AMD delivered impressive first-quarter results that blew away expectations for revenue and earnings per share (EPS). Overall revenue grew 71%, with enterprise, custom, and embedded chips skyrocketing 88%, reflecting the strong growth of the cloud. Even the computing and graphics segment, which is exposed to PCs, grew 33%, as market share gains were able to overcome some softness in the industry. EPS was up 117% to $1.13, beating expectations for $0.91.
On the conference call, CEO Lisa Su addressed the PC market concern, saying, ""Although the PC market is experiencing some softness coming off multiple quarters of near-record unit shipments, our focus remains on the premium, gaming, and commercial portions of the market, where we see strong growth opportunities and expect to continue gaining overall client revenue share.""
So while the market appeared to sell AMD ahead of potential bad news and recession in April, it looks like the selling might have been overdone, given AMD's strong ongoing results and market share gains.
10 stocks we like better than Advanced Micro Devices
When our award-winning analyst team has a stock tip, it can pay to listen. After all, the newsletter they have run for over a decade, Motley Fool Stock Advisor, has tripled the market.*
They just revealed what they believe are the ten best stocks for investors to buy right now... and Advanced Micro Devices wasn't one of them! That's right -- they think these 10 stocks are even better buys.
See the 10 stocks
*Stock Advisor returns as of April 7, 2022
Billy Duberstein has no position in any of the stocks mentioned. His clients may own shares of the companies mentioned. The Motley Fool has positions in and recommends Advanced Micro Devices, Intel, and Nvidia. The Motley Fool recommends the following options: long January 2023 $57.50 calls on Intel and short January 2023 $57.50 puts on Intel. The Motley Fool has a disclosure policy.
The views and opinions expressed herein are the views and opinions of the author and do not necessarily reflect those of Nasdaq, Inc.","That followed a big downgrade from Truist for AMD, Intel (NASDAQ: INTC), as well as Nvidia. So what There wasn't too much company-specific news during April, aside from the announcement early in the month that AMD would be purchasing data center platform company Pensando for $1.9 billion. It should go a long way toward bolstering AMD's data center offerings, which consist of its EPYC processors, graphics chips (GPUs), Xilinx field-programmable gate arrays (FPGAs), and other system-on-chips (SOCs).","That followed a big downgrade from Truist for AMD, Intel (NASDAQ: INTC), as well as Nvidia. What happened Shares of Advanced Micro Devices (NASDAQ: AMD) fell 21.8% in a rough April, according to data from S&P Global Market Intelligence. The Motley Fool has positions in and recommends Advanced Micro Devices, Intel, and Nvidia.","That followed a big downgrade from Truist for AMD, Intel (NASDAQ: INTC), as well as Nvidia. AMD is currently taking market share from Intel in both personal computing as well as data centers, but the tepid Intel forecast was extrapolated to the whole sector. On the conference call, CEO Lisa Su addressed the PC market concern, saying, ""Although the PC market is experiencing some softness coming off multiple quarters of near-record unit shipments, our focus remains on the premium, gaming, and commercial portions of the market, where we see strong growth opportunities and expect to continue gaining overall client revenue share.""","That followed a big downgrade from Truist for AMD, Intel (NASDAQ: INTC), as well as Nvidia. AMD is currently taking market share from Intel in both personal computing as well as data centers, but the tepid Intel forecast was extrapolated to the whole sector. * They just revealed what they believe are the ten best stocks for investors to buy right now... and Advanced Micro Devices wasn't one of them!",2022,2
2022-05-04 00:00:00+00:00,EV firm Atlis plans U.S. stock market listing amid IPO drought,INTC,https://www.nasdaq.com/articles/ev-firm-atlis-plans-u.s.-stock-market-listing-amid-ipo-drought,,,"May 4 (Reuters) - Atlis Motor Vehicles has become the latest startup in the electric-vehicle space to unveil plans for an initial public offering as the global push towards electrification accelerates.
The Mesa, Arizona-based company is developing an electric truck that it says can match the towing and payload capabilities of diesel-powered vehicles and will be optimal for use in the agriculture, utility and construction industries.
The company intends to list on the Nasdaq this summer under the ticker symbol ""AMV"" and will use the IPO proceeds to scale up operations, it said on Wednesday. Atlis declined to disclose how much it expected to raise through its offering.
While there is strong investor interest in the EV sector due to the success of Tesla Inc TSLA.O and concerns over climate change, Atlis' listing plans come at a time when aglobal marketrout has stalled IPO activity in the United States.
Jitters over the Ukraine conflict and aggressive policy tightening by the Federal Reserve have in recent months forced several companies such as file-sharing firm WeTransfer and bitcoin miner Rhodium Enterprise to shelve their listing plans.
However, some heavyweights from the software, technology and automotive sectors - including social media firm Reddit Inc, business software company ServiceTitan and Intel Corp's INTC.O self-driving car unit Mobileye - are slated to go public in the coming months.
(Reporting by Niket Nishant in Bengaluru and Ben Klayman in Detroit; Editing by Aditya Soni)
((Niket.Nishant@thomsonreuters.com;))
The views and opinions expressed herein are the views and opinions of the author and do not necessarily reflect those of Nasdaq, Inc.","However, some heavyweights from the software, technology and automotive sectors - including social media firm Reddit Inc, business software company ServiceTitan and Intel Corp's INTC.O self-driving car unit Mobileye - are slated to go public in the coming months. May 4 (Reuters) - Atlis Motor Vehicles has become the latest startup in the electric-vehicle space to unveil plans for an initial public offering as the global push towards electrification accelerates. The Mesa, Arizona-based company is developing an electric truck that it says can match the towing and payload capabilities of diesel-powered vehicles and will be optimal for use in the agriculture, utility and construction industries.","However, some heavyweights from the software, technology and automotive sectors - including social media firm Reddit Inc, business software company ServiceTitan and Intel Corp's INTC.O self-driving car unit Mobileye - are slated to go public in the coming months. While there is strong investor interest in the EV sector due to the success of Tesla Inc TSLA.O and concerns over climate change, Atlis' listing plans come at a time when aglobal marketrout has stalled IPO activity in the United States. Jitters over the Ukraine conflict and aggressive policy tightening by the Federal Reserve have in recent months forced several companies such as file-sharing firm WeTransfer and bitcoin miner Rhodium Enterprise to shelve their listing plans.","However, some heavyweights from the software, technology and automotive sectors - including social media firm Reddit Inc, business software company ServiceTitan and Intel Corp's INTC.O self-driving car unit Mobileye - are slated to go public in the coming months. While there is strong investor interest in the EV sector due to the success of Tesla Inc TSLA.O and concerns over climate change, Atlis' listing plans come at a time when aglobal marketrout has stalled IPO activity in the United States. Jitters over the Ukraine conflict and aggressive policy tightening by the Federal Reserve have in recent months forced several companies such as file-sharing firm WeTransfer and bitcoin miner Rhodium Enterprise to shelve their listing plans.","However, some heavyweights from the software, technology and automotive sectors - including social media firm Reddit Inc, business software company ServiceTitan and Intel Corp's INTC.O self-driving car unit Mobileye - are slated to go public in the coming months. May 4 (Reuters) - Atlis Motor Vehicles has become the latest startup in the electric-vehicle space to unveil plans for an initial public offering as the global push towards electrification accelerates. The Mesa, Arizona-based company is developing an electric truck that it says can match the towing and payload capabilities of diesel-powered vehicles and will be optimal for use in the agriculture, utility and construction industries.",2022,3
