Date,Article_title,Stock_symbol,Url,Publisher,Author,Article,Lsa_summary,Luhn_summary,Textrank_summary,Lexrank_summary,Year,sentiment_score
2022-05-06 00:00:00+00:00,"U.S. lawmakers to open formal chips, China bill negotiations",INTC,https://www.nasdaq.com/articles/u.s.-lawmakers-to-open-formal-chips-china-bill-negotiations,,,"WASHINGTON, May 6 (Reuters) - Congressional negotiators will meet Thursday to open formal talks to hammer out a compromise measure that would fund $52 billion in semiconductor manufacturing subsidies and boost U.S. competitiveness with Chinese technology, a source told Reuters.
The Senate passed its version of the bill in June 2021, while the House passed a similar bill in February. More than 100 House and Senate lawmakers have been named to a ""conference committee"" that will meet for the first time Thursday to open talks. Aides say it could still take months before a final agreement is reached.
(Reporting by David Shepardson;editing by Diane Craft)
((David.Shepardson@thomsonreuters.com; 2028988324;))
The views and opinions expressed herein are the views and opinions of the author and do not necessarily reflect those of Nasdaq, Inc.","WASHINGTON, May 6 (Reuters) - Congressional negotiators will meet Thursday to open formal talks to hammer out a compromise measure that would fund $52 billion in semiconductor manufacturing subsidies and boost U.S. competitiveness with Chinese technology, a source told Reuters. More than 100 House and Senate lawmakers have been named to a ""conference committee"" that will meet for the first time Thursday to open talks. (Reporting by David Shepardson;editing by Diane Craft) ((David.Shepardson@thomsonreuters.com; 2028988324;)) The views and opinions expressed herein are the views and opinions of the author and do not necessarily reflect those of Nasdaq, Inc.","WASHINGTON, May 6 (Reuters) - Congressional negotiators will meet Thursday to open formal talks to hammer out a compromise measure that would fund $52 billion in semiconductor manufacturing subsidies and boost U.S. competitiveness with Chinese technology, a source told Reuters. The Senate passed its version of the bill in June 2021, while the House passed a similar bill in February. More than 100 House and Senate lawmakers have been named to a ""conference committee"" that will meet for the first time Thursday to open talks.","WASHINGTON, May 6 (Reuters) - Congressional negotiators will meet Thursday to open formal talks to hammer out a compromise measure that would fund $52 billion in semiconductor manufacturing subsidies and boost U.S. competitiveness with Chinese technology, a source told Reuters. Aides say it could still take months before a final agreement is reached. (Reporting by David Shepardson;editing by Diane Craft) ((David.Shepardson@thomsonreuters.com; 2028988324;)) The views and opinions expressed herein are the views and opinions of the author and do not necessarily reflect those of Nasdaq, Inc.","WASHINGTON, May 6 (Reuters) - Congressional negotiators will meet Thursday to open formal talks to hammer out a compromise measure that would fund $52 billion in semiconductor manufacturing subsidies and boost U.S. competitiveness with Chinese technology, a source told Reuters. The Senate passed its version of the bill in June 2021, while the House passed a similar bill in February. More than 100 House and Senate lawmakers have been named to a ""conference committee"" that will meet for the first time Thursday to open talks.",2022,3
2022-05-06 00:00:00+00:00,Dow Analyst Moves: INTC,INTC,https://www.nasdaq.com/articles/dow-analyst-moves%3A-intc-1,,,"The latest tally of analyst opinions from the major brokerage houses shows that among the 30 stocks making up the Dow Jones Industrial Average, Intel is the #27 analyst pick. Within the broader S&P 500, when components were ranked in terms of analyst favorites, INTC claims the #474 spot.
Looking at the stock price movement year to date, Intel is lower by about 12.4%.
VIDEO: Dow Analyst Moves: INTC
The views and opinions expressed herein are the views and opinions of the author and do not necessarily reflect those of Nasdaq, Inc.","Within the broader S&P 500, when components were ranked in terms of analyst favorites, INTC claims the #474 spot. VIDEO: Dow Analyst Moves: INTC The views and opinions expressed herein are the views and opinions of the author and do not necessarily reflect those of Nasdaq, Inc. The latest tally of analyst opinions from the major brokerage houses shows that among the 30 stocks making up the Dow Jones Industrial Average, Intel is the #27 analyst pick.","Within the broader S&P 500, when components were ranked in terms of analyst favorites, INTC claims the #474 spot. VIDEO: Dow Analyst Moves: INTC The views and opinions expressed herein are the views and opinions of the author and do not necessarily reflect those of Nasdaq, Inc. The latest tally of analyst opinions from the major brokerage houses shows that among the 30 stocks making up the Dow Jones Industrial Average, Intel is the #27 analyst pick.","Within the broader S&P 500, when components were ranked in terms of analyst favorites, INTC claims the #474 spot. VIDEO: Dow Analyst Moves: INTC The views and opinions expressed herein are the views and opinions of the author and do not necessarily reflect those of Nasdaq, Inc. The latest tally of analyst opinions from the major brokerage houses shows that among the 30 stocks making up the Dow Jones Industrial Average, Intel is the #27 analyst pick.","Within the broader S&P 500, when components were ranked in terms of analyst favorites, INTC claims the #474 spot. VIDEO: Dow Analyst Moves: INTC The views and opinions expressed herein are the views and opinions of the author and do not necessarily reflect those of Nasdaq, Inc. The latest tally of analyst opinions from the major brokerage houses shows that among the 30 stocks making up the Dow Jones Industrial Average, Intel is the #27 analyst pick.",2022,3
2022-05-06 00:00:00+00:00,AMD Stock Still Belongs on Investors’ Growth and Value Shopping Lists,INTC,https://www.nasdaq.com/articles/amd-stock-still-belongs-on-investors-growth-and-value-shopping-lists,,,"InvestorPlace - Stock Market News, Stock Advice & Trading Tips
When will the Advanced Micro Devices (AMD) free fall end?
AMD stock is down 37% already, so it should find suitors.
This should be an opportunity to accumulate AMD stock for the long term.
Source: JHVEPhoto / Shutterstock.com
Advanced Micro Devices (NASDAQ:AMD) stock fell 6% yesterday. But I’ll argue today that it’s not through any specific fault of its own. My long-term prognosis for AMD stock is still optimal. Short term, we can remain on guard, but there aren’t any internal issues that need fixing. Firs, Thursday was a painful day for all of Wall Street not just AMD. Wednesday’s jubilation after the FOMC meeting, turned into a bull funeral. The bears came back with a vengeance and completely demolished investors the next day.
Secondly, the chip sector is already reeling from shortages and backlogs. The effects of locking down the world for Covid-19 still linger. The 2020 disruption has caught up with the manufacturers and is creating serious bottlenecks. The tech sector is feeling this more than most other industries. Regardless, AMD has managed to compensate and adapt judging by the reports so far.
Ticker Company Current Price
AMD Advanced Micro Devices $93.87
Supply Chain Issues Are Partly to Blame
Despite the abysmal sourcing conditions, AMD has continued to deliver strong results. Management reported earnings this week and the stock rallied for good reason. AMD grew sales 71% and earnings 117%, leaving no doubt over the quality of the team. The drop yesterday merely brings AMD back to its pre-earnings base.
With such blowout numbers, the opinions are almost unanimously positive. I found one price target downgrade, but it was from $165 to $150, so it’s not an issue. According to Yahoo Finance, AMD needs to rally more than 40% before it reaches its average price target.
7 Transportation Stocks to Avoid During These Trying Times
This month there are challenges from the Federal Reserve fears. There is also the matter of the old Wall Street adage of sell in May and go away. But, in the long term, these are mere temporary hiccups. There are technical challenges as long as it’s under $102 per share. But there are support zones below and would find footing with the markets.
Meanwhile, the downside now creates opportunities for new investors. Under the leadership of Lisa Su AMD stock continues to shine. The financial metrics are beyond reproach from all aspects. Although Intel (NASDAQ:INTC) is still larger and Nvidia (NASDAQ:NVDA) much flashier, AMD is a star.
Management more than tripled revenues and net income in just five years. Regardless, AMD managed to hold its valuation at a reasonable level. In fact, it is 30% cheaper than its rival NVDA. Even from an absolute basis it’s on par with similar fast growing companies.
AMD Stock Belongs On All Stock Shopping Lists
Source: Charts by TradingView
The company’s earnings report should give investors confidence in AMD. The company beat expectations and forecast a strong outlook despite the current challenges it faces. The team is executing well on plans and not hiding behind excuses. The field is competitive, but they are a top contender with plenty of room to prosper.
All aspects of their businesses are growing, and the trend is not about to fade. Demand will remain strong for a decade as we digitize the world. There are new applications coming up constantly, so AMD will be busy. The move to the metaverse alone could fuel a new kind of tech application. It doesn’t take a wild imagination to see AMD prosper under such scenarios.
Retail investors would do well to form their own opinions of AMD stock. When the bullish thesis is this obvious we don’t need the experts. Wall Street tends to complicate things with cryptic ratings. Here is a clear main street statement: If the markets are higher in the future, then so is AMD!
On the date of publication, Nicolas Chahine did not have (either directly or indirectly) any positions in the securities mentioned in this article. The opinions expressed in this article are those of the writer, subject to the InvestorPlace.com Publishing Guidelines.
The post AMD Stock Still Belongs on Investors’ Growth and Value Shopping Lists appeared first on InvestorPlace.
The views and opinions expressed herein are the views and opinions of the author and do not necessarily reflect those of Nasdaq, Inc.","Although Intel (NASDAQ:INTC) is still larger and Nvidia (NASDAQ:NVDA) much flashier, AMD is a star. Source: JHVEPhoto / Shutterstock.com Advanced Micro Devices (NASDAQ:AMD) stock fell 6% yesterday. On the date of publication, Nicolas Chahine did not have (either directly or indirectly) any positions in the securities mentioned in this article.","Although Intel (NASDAQ:INTC) is still larger and Nvidia (NASDAQ:NVDA) much flashier, AMD is a star. Source: JHVEPhoto / Shutterstock.com Advanced Micro Devices (NASDAQ:AMD) stock fell 6% yesterday. Ticker Company Current Price AMD Advanced Micro Devices $93.87 Supply Chain Issues Are Partly to Blame Despite the abysmal sourcing conditions, AMD has continued to deliver strong results.","Although Intel (NASDAQ:INTC) is still larger and Nvidia (NASDAQ:NVDA) much flashier, AMD is a star. InvestorPlace - Stock Market News, Stock Advice & Trading Tips When will the Advanced Micro Devices (AMD) free fall end? Ticker Company Current Price AMD Advanced Micro Devices $93.87 Supply Chain Issues Are Partly to Blame Despite the abysmal sourcing conditions, AMD has continued to deliver strong results.","Although Intel (NASDAQ:INTC) is still larger and Nvidia (NASDAQ:NVDA) much flashier, AMD is a star. AMD stock is down 37% already, so it should find suitors. Ticker Company Current Price AMD Advanced Micro Devices $93.87 Supply Chain Issues Are Partly to Blame Despite the abysmal sourcing conditions, AMD has continued to deliver strong results.",2022,4
2022-05-06 00:00:00+00:00,2 Reddit Stocks to Buy and Hold for Years,INTC,https://www.nasdaq.com/articles/2-reddit-stocks-to-buy-and-hold-for-years-1,,,"There was a time when stock-picking was left up to your advisor rather than the crowd. The advent of the internet and online access to stock research put some of that power in investors' hands, but they were still ultimately steered by professionals. The web'sinvestment advicebulletin boards, conversely, were the proverbial wild west.
The amateur crowd has gotten rather savvy in recent years, though, collectively identifying quality names with plans to hold onto them for the long haul. Here's a closer look at two of the Reddit crowd's favorite stocks right now that make good sense as long-term picks.
1. Advanced Micro Devices
In an arena that includes powerhouses like Intel (NASDAQ: INTC) and Nvidia (NASDAQ: NVDA) as competitors, it's easy to look past Advanced Micro Devices (NASDAQ: AMD). But that would be a mistake. See, AMD has found its niche as a computer tech manufacturer.
That niche is value, by the way. While Intel's processors are still the preferred brand among consumers as well as corporations operating data centers, the company's CPUs aren't cheap. Advanced Micro Devices offers solid processing performance at a more affordable price. Certainly, there are exceptions to this generalization, but not many. And, AMD does particularly well with individual video gamers, who are generally far more budget-minded than an enterprise customer might be.
Advanced Micro Devices' graphics cards also fit the bill for cost-conscious consumers. Although Nvidia's overall portfolio of graphics processing tech may be superior -- particularly for artificial intelligence applications -- AMD's lower prices makes its wares far more accessible to most consumers. In fact, four of the top five picks on Techspot's current list of cost-effective GPUs are AMD cards.
Image source: Getty Images.
The company's hold on its sliver of the computer hardware market is at least partially evident in last quarter's results. Revenue of $5.9 billion was not only record-breaking and 71% better than year-ago levels, but topped analyst expectations of just over $5.0 billion. Operating earnings of $1.13 per share also beat the consensus of $0.91, more than doubling the bottom line of $0.52 per share booked during the first quarter of last year.
It was the reason for the beat, however, that makes AMD such a compelling name to step into here. While it's a hit with consumers, the company is clearly upping its enterprise game. Sales of computer processors used in servers more than doubled for the third quarter in a row thanks to last year's acquisition of Xilinx, data centers are a key reason Advanced Micro Devices is modeling 69% top-line growth for the quarter now underway.
Simply put, AMD is working its way deeper into the institutional market without losing sight of the consumer market. It's a shift that could have a multi-year impact, particularly in light of Intel's 7-nanometer foundry woes.
2. Airbnb
The other surprisingly favorite stock among Reddit's users worth pointing out here is the home-rental platform Airbnb (NASDAQ: ABNB).
It's difficult to say to what degree the pandemic altered the leisure travel landscape. It's not exactly a stretch to say, however, that hotels were fighting a significant cultural shift -- as well as affordability issues -- even before COVID-19 rattled the world. As it turns out, a great number of leisure travelers are OK with staying at an individual's rental house as a lower-cost alternative to a hotel stay, and more people are embracing the idea every day.
AirDNA (not to be confused with AirBNB itself) says short-term rental demand grew 22.4% in 2021, and despite the unofficial, effective end to the pandemic, the market research company estimates demand for such rentals will grow another 14.1% this year. That growth isn't expected to cool anytime soon either. Precedence Research estimates the annual vacation rental market will swell from 2020's $22.7 billion to $111.2 billion per year by 2030 as more individuals convert homes into travel-lodging spots and more consumers gain comfort with the idea.
This outlook puts Airbnb in an enviable position. It's already one of the industry's biggest players, boasting a portfolio of more than 6 million rental homes. As the business matures, though, look for people with homes to rent to gravitate to the listing sites attracting the biggest crowd of would-be vacationers. That again makes Airbnb a compelling prospect, as it's arguably the most recognized brand name in the business.
The proof of its growing reach is evident in the numbers. Last quarter's total booking of 102.1 million nights was not only record-breaking but 26% better than pre-COVID bookings from three years back. Revenue of $1.5 billion was 80% better than it was three years ago, indicating its 4 million home-owning hosts' pricing power is firming up. That's pricing power that helps Airbnb's top and bottom lines as well.
The company isn't yet profitable, for the record. But, this year's projected 31% increase in revenue should carry Airbnb out of the red and into the black, with full-year earnings of $1.26 per share in the cards. That swing to a profit could be a game-changer for the stock's performance.
Find out why Airbnb, Inc. is one of the 10 best stocks to buy now
Our award-winning analyst team has spent more than a decade beating the market. After all, the newsletter they have run for over a decade, Motley Fool Stock Advisor, has tripled the market.*
They just revealed their ten top stock picks for investors to buy right now. Airbnb, Inc. is on the list -- but there are nine others you may be overlooking.
Click here to get access to the full list!
*Stock Advisor returns as of April 7, 2022
James Brumley has no position in any of the stocks mentioned. The Motley Fool has positions in and recommends Advanced Micro Devices, Airbnb, Inc., Intel, and Nvidia. The Motley Fool recommends the following options: long January 2023 $57.50 calls on Intel and short January 2023 $57.50 puts on Intel. The Motley Fool has a disclosure policy.
The views and opinions expressed herein are the views and opinions of the author and do not necessarily reflect those of Nasdaq, Inc.","Advanced Micro Devices In an arena that includes powerhouses like Intel (NASDAQ: INTC) and Nvidia (NASDAQ: NVDA) as competitors, it's easy to look past Advanced Micro Devices (NASDAQ: AMD). The amateur crowd has gotten rather savvy in recent years, though, collectively identifying quality names with plans to hold onto them for the long haul. While Intel's processors are still the preferred brand among consumers as well as corporations operating data centers, the company's CPUs aren't cheap.","Advanced Micro Devices In an arena that includes powerhouses like Intel (NASDAQ: INTC) and Nvidia (NASDAQ: NVDA) as competitors, it's easy to look past Advanced Micro Devices (NASDAQ: AMD). AirDNA (not to be confused with AirBNB itself) says short-term rental demand grew 22.4% in 2021, and despite the unofficial, effective end to the pandemic, the market research company estimates demand for such rentals will grow another 14.1% this year. The Motley Fool has positions in and recommends Advanced Micro Devices, Airbnb, Inc., Intel, and Nvidia.","Advanced Micro Devices In an arena that includes powerhouses like Intel (NASDAQ: INTC) and Nvidia (NASDAQ: NVDA) as competitors, it's easy to look past Advanced Micro Devices (NASDAQ: AMD). AirDNA (not to be confused with AirBNB itself) says short-term rental demand grew 22.4% in 2021, and despite the unofficial, effective end to the pandemic, the market research company estimates demand for such rentals will grow another 14.1% this year. The Motley Fool has positions in and recommends Advanced Micro Devices, Airbnb, Inc., Intel, and Nvidia.","Advanced Micro Devices In an arena that includes powerhouses like Intel (NASDAQ: INTC) and Nvidia (NASDAQ: NVDA) as competitors, it's easy to look past Advanced Micro Devices (NASDAQ: AMD). Precedence Research estimates the annual vacation rental market will swell from 2020's $22.7 billion to $111.2 billion per year by 2030 as more individuals convert homes into travel-lodging spots and more consumers gain comfort with the idea. After all, the newsletter they have run for over a decade, Motley Fool Stock Advisor, has tripled the market.",2022,3
