Date,Article_title,Stock_symbol,Url,Publisher,Author,Article,Lsa_summary,Luhn_summary,Textrank_summary,Lexrank_summary,Year,sentiment_score
2022-01-26 00:00:00+00:00,"As Crypto Crashes, It Will Take Nvidia Stock Down With It",INTC,https://www.nasdaq.com/articles/as-crypto-crashes-it-will-take-nvidia-stock-down-with-it,,,"InvestorPlace - Stock Market News, Stock Advice & Trading Tips
Over the long term, driven by strong demand for its chips from data centers and companies incorporating artificial intelligence, Nvidia (NASDAQ:NVDA) stock will almost certainly outperform the Nasdaq exchange and the S&P 500. In the short term and the medium term, however, there are multiple indications that NVDA stock is poised to be badly damaged by the bursting of the crypto bubble.
NVDA) logo on a microchip"" width=""300"" height=""169"">
Source: Antonio Baccardi / Shutterstock.com
In previous columns about Nvidia, I’ve warned that its stock performance could be derailed by a crypto plunge. But recent developments have made me much more certain that cryptos are poised to tumble soon and that the retreat is likely to lower Nvidia’s stock price by a sizeable amount.
What’s more, even if cryptos don’t sink tremendously, new developments have left Nvidia’s revenue from crypto miners poised to tumble.
The Bursting of the Crypto Bubble
Defying the forecasts of crypto bulls, Bitcoin (BTC-USD) and other prominent crypto names have plunged in recent weeks. In the last three months, Bitcoin itself has tumbled 37%, Ethereum (ETH-USD) has given back 38%, and Cardano (ADA-USD) has slumped 49%. And while I understand that there are many thousands of other cryptocurrencies, some of which have been rallying recently, I doubt whether the jumps of those flash-in-the-pan names will be sustained as the general macro environment for cryptos becomes more bearish.
7 Hot Stocks Poised to Get Even Hotter in Q1
Macro trends are becoming more difficult for cryptos for two reasons. One is that U.S. government stimulus is rapidly fading, while the Federal Reserve is about to tremendously pull back its own accommodations and has already begun the process of doing so. The recent, sharp pullback of the top cryptos in the wake of the stimulus cuts and the inflation surge has left me even more convinced that government stimulus, rather than inflation or concerns about traditional currencies is the primary factor that determines crypto prices.
And the other macro factor that will make the environment more difficult for cryptos is increased government regulation. In the U.S., Securities and Exchange Commission (SEC) Chairman Gary Gensler wants to regulate crypto exchanges this year, while the IRS is also cracking down on cryptos.
And ominously for Nvidia and NVDA stock, the Russian central bank recently urged the country’s government to ban crypto mining. That’s problematic for Nvidia because “Russia is the world’s third-largest player in bitcoin mining, behind the United States and Kazakhstan,” according to CNBC.
Moreover, Kazakhstan’s government could impose new regulations on crypto after mass protests there. Saying the quiet part out loud, Russia’s central bank complained that cryptos hurt its ability to control monetary policy.
I’ve long warned that governments will vehemently oppose cryptos for that reason, and the statement by the Russian central bank validates my thesis. Consequently, I believe that we’ve just seen the tip of the iceberg when it comes to government regulation and stifling of cryptos.
NVDA Stock and Crypto Mining
In an intriguing column, published on Dec. 27, Seeking Alpha contributor EnerTuition explained that the demand for gaming graphics cards by crypto miners has greatly pushed up the average selling prices of Nvidia’s graphics cards. In fact, EnerTuition says that in some cases, the prices of Nvidia’s chips have doubled in less than 18 months, and they blame the increase on crypto miners.
So if crypto prices plunge and crypto miners consequentially stop buying Nvidia’s gaming cards, Nvidia’s overall gaming revenue will probably tumble. And since the revenue of Nvidia’s gaming business came in at $2.94 billion in the third quarter, out of its total Q3 revenue of $7.1 billion, such a plunge would indeed be a big deal for NVDA stock.
Meanwhile, even if cryptos don’t plunge, Nvidia’s sales from crypto miners could be about to tumble. That’s because of a few factors, including the possibility of Russia banning mining and Intel’s (NASDAQ:INTC) entrance into the gaming card market this quarter. Additionally, the Seeking Alpha contributor points out, Ethereum’s likely imminent switch to a proof-of-stake model will meaningfully undermine demand for Nvidia’s gaming cards.
Nvidia’s revenue from crypto miners looks poised to tumble, meaningfully lowering the company’s top and bottom lines. At that point, investors will probably be able to buy the shares at a much lower price, so it makes sense to wait for awhile longer before hitting the buy button on the shares.
On the date of publication, Larry Ramer did not have (either directly or indirectly) any positions in the securities mentioned in this article. 
Larry has conducted research and written articles on U.S. stocks for 14 years. He has been employed by The Fly and Israel’s largest business newspaper, Globes. Among his highly successful contrarian picks have been solar stocks, Ford, Plug Power and Exxon. You can reach him on StockTwits at @larryramer. Larry began writing columns for InvestorPlace in 2015.
The post As Crypto Crashes, It Will Take Nvidia Stock Down With It appeared first on InvestorPlace.
The views and opinions expressed herein are the views and opinions of the author and do not necessarily reflect those of Nasdaq, Inc.","That’s because of a few factors, including the possibility of Russia banning mining and Intel’s (NASDAQ:INTC) entrance into the gaming card market this quarter. NVDA) logo on a microchip"" width=""300"" height=""169""> Source: Antonio Baccardi / Shutterstock.com In previous columns about Nvidia, I’ve warned that its stock performance could be derailed by a crypto plunge. And while I understand that there are many thousands of other cryptocurrencies, some of which have been rallying recently, I doubt whether the jumps of those flash-in-the-pan names will be sustained as the general macro environment for cryptos becomes more bearish.","That’s because of a few factors, including the possibility of Russia banning mining and Intel’s (NASDAQ:INTC) entrance into the gaming card market this quarter. What’s more, even if cryptos don’t sink tremendously, new developments have left Nvidia’s revenue from crypto miners poised to tumble. NVDA Stock and Crypto Mining In an intriguing column, published on Dec. 27, Seeking Alpha contributor EnerTuition explained that the demand for gaming graphics cards by crypto miners has greatly pushed up the average selling prices of Nvidia’s graphics cards.","That’s because of a few factors, including the possibility of Russia banning mining and Intel’s (NASDAQ:INTC) entrance into the gaming card market this quarter. The Bursting of the Crypto Bubble Defying the forecasts of crypto bulls, Bitcoin (BTC-USD) and other prominent crypto names have plunged in recent weeks. NVDA Stock and Crypto Mining In an intriguing column, published on Dec. 27, Seeking Alpha contributor EnerTuition explained that the demand for gaming graphics cards by crypto miners has greatly pushed up the average selling prices of Nvidia’s graphics cards.","That’s because of a few factors, including the possibility of Russia banning mining and Intel’s (NASDAQ:INTC) entrance into the gaming card market this quarter. And the other macro factor that will make the environment more difficult for cryptos is increased government regulation. I’ve long warned that governments will vehemently oppose cryptos for that reason, and the statement by the Russian central bank validates my thesis.",2022,2
2022-01-26 00:00:00+00:00,"1 Green Flag for AMD in 2022, and 1 Red Flag",INTC,https://www.nasdaq.com/articles/1-green-flag-for-amd-in-2022-and-1-red-flag,,,"Advanced Micro Devices' (NASDAQ: AMD) stock price has declined nearly 20% this year as rising interest rates have caused investors to cash out of higher-growth tech stocks. AMD also faces concerns about slower PC sales in a post-lockdown market, as well as tougher competition from Intel (NASDAQ: INTC) and Nvidia (NASDAQ: NVDA) in CPUs and GPUs, respectively.
AMD is also still slogging through the ongoing chip shortage, which is causing traffic jams at its main manufacturing partner Taiwan Semiconductor Manufacturing (NYSE: TSM) (TSMC), and facing unresolved regulatory challenges for its planned takeover of Xilinx (NASDAQ: XLNX).
Image source: AMD.
AMD remains a polarizing stock. The bulls believe it will remain ahead of Intel in the CPU race by relying on TSMC's smaller and denser chipmaking technologies, and that it will keep pace with Nvidia by selling cheaper GPUs that provide comparable performance. They also believe it will benefit from the secular growth of the data center, gaming console, and PC gaming markets. The bears believe that it's only a matter of time before Intel catches up to TSMC in the process race and Nvidia chips away at AMD's lower-end market.
AMD's long-term performance favors the bulls, but its short-term performance definitely supports the bears. That probably won't change anytime soon, but investors should focus on two recent developments -- a green flag and a red one -- that provide fresh support to both camps.
The green flag: China could approve the Xilinx deal soon
AMD agreed to buy Xilinx, one of the world's largest producers of field-programmable gate arrays (FPGAs), for $35 billion in an all-stock deal in October 2020. At the time, AMD claimed it would close the deal by the end of 2021. But last month, it postponed the deal closing to the first quarter of 2022.
The deal has been approved in every market except for China. Buying Xilinx would make AMD much more competitive against Intel, which acquired Xilinx's top FPGA competitor Altera for $16.7 billion in 2015.
Unlike CPUs, which are programmed for specific markets, FPGAs can be reprogrammed after being manufactured, which means they can be customized for a much wider range of devices. In data centers, they can complement CPUs by accelerating certain processing tasks.
Therefore, AMD's purchase of Xilinx could complement its Epyc server chips and make it more competitive in the data center market against Intel. However, Xilinx and Intel already hold a near-duopoly in FPGA chips, and letting AMD purchase Xilinx would effectively split the FPGA market between the world's two largest suppliers of x86 CPUs for data centers.
However, AMD still only controls a low-single-digit share of the data center CPU market, according to PassMark Software, so the acquisition should be less controversial than Intel's purchase of Altera -- which was approved in China before the trade and tech wars escalated under the Trump administration.
That's why investors likely breathed a sigh of relief when Dealreporter claimed that China's State Administration for Market Regulation (SAMR) was finally getting ready to approve the deal. Investors should take that green flag with a grain of salt, but China's approval of the deal should remove a major roadblock for AMD's fledgling data center business.
The red flag: Piper Sandler downgrades AMD
Meanwhile, a bright red flag appeared when a prolific analyst suddenly downgraded AMD. On Jan. 20, Piper Sandler's Harsh Kumar downgraded AMD from ""overweight"" to ""neutral"" while reducing his share price target from $140 to $130 -- which implies an upside potential of less than 10%.
Kumar attributed that downgrade to the potential slowdown of the PC market as fewer people worked from home, with the Xilinx acquisition throttling its near-term earnings growth and ""broader market dynamics"" (such as rising inflation and interest rates) capping the gains of pricier growth stocks.
Those concerns are valid, but I think they're overblown. HP's latest results indicated that robust commercial sales of PCs could offset declining sales of consumer PCs, and AMD previously said the Xilinx acquisition would be ""immediately accretive"" to its margins, cash flow, and earnings per share.
As for rising inflation and higher interest rates, I believe AMD will remain better-insulated from those macro headwinds than other high-growth tech companies because it's still firmly profitable on a generally accepted accounting principles (GAAP) basis. In addition, AMD's stock isn't particularly expensive at 42 times forward earnings -- especially when analysts expect its earnings to more than double in 2021 and grow another 27% in 2022.
Does the good news outweigh the bad news?
I believe the long-awaited approval of the Xilinx deal matters a lot more to investors than Piper's downgrade of the stock. If AMD finally seals the Xilinx deal, it will easily outweigh Piper's near-term concerns about a temporary slowdown in PC sales, acquisition-related costs, and macro-related headwinds.
10 stocks we like better than Advanced Micro Devices
When our award-winning analyst team has a stock tip, it can pay to listen. After all, the newsletter they have run for over a decade, Motley Fool Stock Advisor, has tripled the market.*
They just revealed what they believe are the ten best stocks for investors to buy right now... and Advanced Micro Devices wasn't one of them! That's right -- they think these 10 stocks are even better buys.
See the 10 stocks
*Stock Advisor returns as of January 10, 2022
Leo Sun has no position in any of the stocks mentioned. The Motley Fool owns and recommends Advanced Micro Devices, Intel, Nvidia, and Taiwan Semiconductor Manufacturing. The Motley Fool recommends Xilinx and recommends the following options: long January 2023 $57.50 calls on Intel and short January 2023 $57.50 puts on Intel. The Motley Fool has a disclosure policy.
The views and opinions expressed herein are the views and opinions of the author and do not necessarily reflect those of Nasdaq, Inc.","AMD also faces concerns about slower PC sales in a post-lockdown market, as well as tougher competition from Intel (NASDAQ: INTC) and Nvidia (NASDAQ: NVDA) in CPUs and GPUs, respectively. The bulls believe it will remain ahead of Intel in the CPU race by relying on TSMC's smaller and denser chipmaking technologies, and that it will keep pace with Nvidia by selling cheaper GPUs that provide comparable performance. However, AMD still only controls a low-single-digit share of the data center CPU market, according to PassMark Software, so the acquisition should be less controversial than Intel's purchase of Altera -- which was approved in China before the trade and tech wars escalated under the Trump administration.","AMD also faces concerns about slower PC sales in a post-lockdown market, as well as tougher competition from Intel (NASDAQ: INTC) and Nvidia (NASDAQ: NVDA) in CPUs and GPUs, respectively. Advanced Micro Devices' (NASDAQ: AMD) stock price has declined nearly 20% this year as rising interest rates have caused investors to cash out of higher-growth tech stocks. The green flag: China could approve the Xilinx deal soon AMD agreed to buy Xilinx, one of the world's largest producers of field-programmable gate arrays (FPGAs), for $35 billion in an all-stock deal in October 2020.","AMD also faces concerns about slower PC sales in a post-lockdown market, as well as tougher competition from Intel (NASDAQ: INTC) and Nvidia (NASDAQ: NVDA) in CPUs and GPUs, respectively. Advanced Micro Devices' (NASDAQ: AMD) stock price has declined nearly 20% this year as rising interest rates have caused investors to cash out of higher-growth tech stocks. The green flag: China could approve the Xilinx deal soon AMD agreed to buy Xilinx, one of the world's largest producers of field-programmable gate arrays (FPGAs), for $35 billion in an all-stock deal in October 2020.","AMD also faces concerns about slower PC sales in a post-lockdown market, as well as tougher competition from Intel (NASDAQ: INTC) and Nvidia (NASDAQ: NVDA) in CPUs and GPUs, respectively. Advanced Micro Devices' (NASDAQ: AMD) stock price has declined nearly 20% this year as rising interest rates have caused investors to cash out of higher-growth tech stocks. I believe the long-awaited approval of the Xilinx deal matters a lot more to investors than Piper's downgrade of the stock.",2022,2
2022-01-26 00:00:00+00:00,Intel first-quarter revenue forecast ahead of expectations,INTC,https://www.nasdaq.com/articles/intel-first-quarter-revenue-forecast-ahead-of-expectations,,,"Jan 26 (Reuters) - Chipmaker Intel Corp INTC.O forecast first-quarter revenue above Wall Street expectations on Wednesday, placing bets on its in-house chip-making capacity to meet strong demand from PC, data center and artificial intelligence markets even through a global semiconductor supply crunch.
The company expects first-quarter revenue of about $18.3 billion, compared to analysts' average estimates of $17.62 billion, according to IBES data from Refinitiv.
(Reporting By Chavi Mehta and Jane Lanhee Lee; Editing by Bernard Orr)
((jane.lee@thomsonreuters.com; +1-415-344-3912; Reuters Messaging: jane.lee.thomsonreuters@reuters.net))
The views and opinions expressed herein are the views and opinions of the author and do not necessarily reflect those of Nasdaq, Inc.","Jan 26 (Reuters) - Chipmaker Intel Corp INTC.O forecast first-quarter revenue above Wall Street expectations on Wednesday, placing bets on its in-house chip-making capacity to meet strong demand from PC, data center and artificial intelligence markets even through a global semiconductor supply crunch. The company expects first-quarter revenue of about $18.3 billion, compared to analysts' average estimates of $17.62 billion, according to IBES data from Refinitiv. (Reporting By Chavi Mehta and Jane Lanhee Lee; Editing by Bernard Orr) ((jane.lee@thomsonreuters.com; +1-415-344-3912; Reuters Messaging: jane.lee.thomsonreuters@reuters.net)) The views and opinions expressed herein are the views and opinions of the author and do not necessarily reflect those of Nasdaq, Inc.","Jan 26 (Reuters) - Chipmaker Intel Corp INTC.O forecast first-quarter revenue above Wall Street expectations on Wednesday, placing bets on its in-house chip-making capacity to meet strong demand from PC, data center and artificial intelligence markets even through a global semiconductor supply crunch. The company expects first-quarter revenue of about $18.3 billion, compared to analysts' average estimates of $17.62 billion, according to IBES data from Refinitiv. (Reporting By Chavi Mehta and Jane Lanhee Lee; Editing by Bernard Orr) ((jane.lee@thomsonreuters.com; +1-415-344-3912; Reuters Messaging: jane.lee.thomsonreuters@reuters.net)) The views and opinions expressed herein are the views and opinions of the author and do not necessarily reflect those of Nasdaq, Inc.","Jan 26 (Reuters) - Chipmaker Intel Corp INTC.O forecast first-quarter revenue above Wall Street expectations on Wednesday, placing bets on its in-house chip-making capacity to meet strong demand from PC, data center and artificial intelligence markets even through a global semiconductor supply crunch. The company expects first-quarter revenue of about $18.3 billion, compared to analysts' average estimates of $17.62 billion, according to IBES data from Refinitiv. (Reporting By Chavi Mehta and Jane Lanhee Lee; Editing by Bernard Orr) ((jane.lee@thomsonreuters.com; +1-415-344-3912; Reuters Messaging: jane.lee.thomsonreuters@reuters.net)) The views and opinions expressed herein are the views and opinions of the author and do not necessarily reflect those of Nasdaq, Inc.","Jan 26 (Reuters) - Chipmaker Intel Corp INTC.O forecast first-quarter revenue above Wall Street expectations on Wednesday, placing bets on its in-house chip-making capacity to meet strong demand from PC, data center and artificial intelligence markets even through a global semiconductor supply crunch. The company expects first-quarter revenue of about $18.3 billion, compared to analysts' average estimates of $17.62 billion, according to IBES data from Refinitiv. (Reporting By Chavi Mehta and Jane Lanhee Lee; Editing by Bernard Orr) ((jane.lee@thomsonreuters.com; +1-415-344-3912; Reuters Messaging: jane.lee.thomsonreuters@reuters.net)) The views and opinions expressed herein are the views and opinions of the author and do not necessarily reflect those of Nasdaq, Inc.",2022,4
