Date,Article_title,Stock_symbol,Url,Publisher,Author,Article,Lsa_summary,Luhn_summary,Textrank_summary,Lexrank_summary,Year,sentiment_score
2022-12-20 00:00:00+00:00,Could Intel's Pain Become This Dividend Stock's Gain?,INTC,https://www.nasdaq.com/articles/could-intels-pain-become-this-dividend-stocks-gain,,,"Intel (NASDAQ: INTC) is enduring a painful year. Because of worsening economic conditions, the semiconductor manufacturer's revenue tumbled 20% in the third quarter, while its earnings plummeted even further. That's putting pressure on its financial profile as the company strives to fund its ambitious expansion program while maintaining its high-yielding dividend.
This painful situation led Intel to seek outside-the-box ways to finance its growth to maintain its balance sheet strength and investor payout. It did that by unveiling a first-of-its-kind semiconductor co-investment program, with Brookfield Infrastructure (NYSE: BIPC)(NYSE: BIP) signing on as the first participant. Intel's pain looks to be Brookfield's gain.
Getting creative to ease its financial pain
Intel has an ambitious expansion plan to grow its chip-making capacity in the U.S. It's investing upwards of $30 billion to build two leading-edge chip factories in Arizona. It also plans to spend more than $20 billion to build two more factories in Ohio. On top of that, Intel is investing heavily in several other capital projects worldwide.
While the company generates lots of cash and has a cash-rich balance sheet, deteriorating market conditions are making it harder for the company to fund its expansion and dividend while maintaining a strong financial profile. The company sees its full-year net capital spending coming in at $21 billion on a non-GAAP basis and projects that its adjusted free cash flow will be negative-$2 billion to $4 billion. That's causing the company to burn through cash as it also funds its dividend, which has totaled nearly $4.5 billion over the first nine months of the year. As a result, its cash, equivalents, and short-term investments have fallen from $29.3 billion toward the end of last year to $22.6 billion in early October. Meanwhile, debt has risen from $33.5 billion to $37.2 billion.
This situation led Intel to strike a funding partnership with Brookfield for its two plants in Arizona. They will jointly invest up to $30 billion, with Intel funding 51% and Brookfield financing 49% of the cost. That arrangement will enable Intel to protect its cash and debt capacity for other investments while allowing the company to continue growing its dividend.
A perfect fit for Brookfield
Intel's need for a funding partner came at the perfect time for Brookfield Infrastructure. The company has nearly completed its current backlog of capital projects, which includes the Heartland Petrochemical Complex in Canada and the second phase of its electricity transmission line build-out in Brazil. It was able to replenish its capital project backlog with this deal. The company's total equity commitment will only be about $500 million, with the rest sourced from its institutional partners and non-resource debt that the company has already secured. Brookfield can finance the equity portion with retained cash flows and the proceeds from its capital recycling program. It will fund most of that equity closer to the project's commissioning in 2024.
The investment also aligns with Brookfield's thematic approach to capitalize on the digitalization and deglobalization megatrends. The funding partnership will help Intel onshore some of its manufacturing capacity. It will also support increased digitalization by supplying the country with more semiconductors.
Finally, the investment should produce attractive returns for Brookfield. It's partnering with a highly creditworthy counterparty in Intel, and it isn't assuming any technological risk. It will receive 49% of the revenue generated from these facilities, which should be relatively stable because of growing semiconductor demand. According to an estimate by IDC, global chip revenues should reach $1 trillion by 2030, up from its projection of $638 billion for this year. That aligns with its strategy of investing in assets that produce predictable cash flow.
This investment puts Brookfield in an even stronger position to deliver organic growth at or above its 6% to 9% target range over the next few years. The company should have no problem delivering on its objective of expanding its 4.4%-yielding dividend at a 5% to 9% annual rate.
An ideal investment for Brookfield
Intel's financial troubles couldn't have come at a better time for Brookfield Infrastructure. It was able to capitalize on Intel's need for a funding partner to replenish its capital project backlog. The investment aligns with the company's thematic approach while positioning it to earn attractive returns. That further bolsters the company's growth profile, which should enable it to continue increasing its attractive dividend.
10 stocks we like better than Intel
When our award-winning analyst team has a stock tip, it can pay to listen. After all, the newsletter they have run for over a decade, Motley Fool Stock Advisor, has tripled the market.*
They just revealed what they believe are the ten best stocks for investors to buy right now... and Intel wasn't one of them! That's right -- they think these 10 stocks are even better buys.
See the 10 stocks
*Stock Advisor returns as of December 1, 2022
Matthew DiLallo has positions in Brookfield Infrastructure, Brookfield Infrastructure Partners, and Intel and has the following options: long January 2025 $30 calls on Intel and short January 2025 $30 puts on Intel. The Motley Fool has positions in and recommends Intel. The Motley Fool recommends Brookfield Infrastructure and Brookfield Infrastructure Partners and recommends the following options: long January 2023 $57.50 calls on Intel, long January 2025 $45 calls on Intel, and short January 2025 $45 puts on Intel. The Motley Fool has a disclosure policy.
The views and opinions expressed herein are the views and opinions of the author and do not necessarily reflect those of Nasdaq, Inc.",Intel (NASDAQ: INTC) is enduring a painful year. This painful situation led Intel to seek outside-the-box ways to finance its growth to maintain its balance sheet strength and investor payout. That arrangement will enable Intel to protect its cash and debt capacity for other investments while allowing the company to continue growing its dividend.,"Intel (NASDAQ: INTC) is enduring a painful year. The investment aligns with the company's thematic approach while positioning it to earn attractive returns. See the 10 stocks *Stock Advisor returns as of December 1, 2022 Matthew DiLallo has positions in Brookfield Infrastructure, Brookfield Infrastructure Partners, and Intel and has the following options: long January 2025 $30 calls on Intel and short January 2025 $30 puts on Intel.","Intel (NASDAQ: INTC) is enduring a painful year. They will jointly invest up to $30 billion, with Intel funding 51% and Brookfield financing 49% of the cost. See the 10 stocks *Stock Advisor returns as of December 1, 2022 Matthew DiLallo has positions in Brookfield Infrastructure, Brookfield Infrastructure Partners, and Intel and has the following options: long January 2025 $30 calls on Intel and short January 2025 $30 puts on Intel.","Intel (NASDAQ: INTC) is enduring a painful year. They will jointly invest up to $30 billion, with Intel funding 51% and Brookfield financing 49% of the cost. It was able to capitalize on Intel's need for a funding partner to replenish its capital project backlog.",2022,3
2022-12-20 00:00:00+00:00,Could Amazon's New Chip Be the End of AMD and Other Chip Stocks?,INTC,https://www.nasdaq.com/articles/could-amazons-new-chip-be-the-end-of-amd-and-other-chip-stocks,,,"Today's video focuses on Amazon (NASDAQ: AMZN) and its recently announced processor, Graviton3E, and what it means for semiconductor companies like Advanced Micro Devices (NASDAQ: AMD), Intel (NASDAQ: INTC), and Nvidia (NASDAQ: NVDA). Check out the short video to learn more, consider subscribing, and click the special offer link below.
*Stock prices used were the market prices of Dec. 19, 2022. The video was published on Dec. 19, 2022.
Find out why Amazon.com is one of the 10 best stocks to buy now
Our award-winning analyst team has spent more than a decade beating the market. After all, the newsletter they have run for over a decade, Motley Fool Stock Advisor, has tripled the market.*
They just revealed their ten top stock picks for investors to buy right now. Amazon.com is on the list -- but there are nine others you may be overlooking.
Click here to get access to the full list!
*Stock Advisor returns as of December 1, 2022
John Mackey, CEO of Whole Foods Market, an Amazon subsidiary, is a member of The Motley Fool's board of directors. Jose Najarro has positions in Advanced Micro Devices and Nvidia. The Motley Fool has positions in and recommends Advanced Micro Devices, Amazon.com, Intel, and Nvidia. The Motley Fool recommends the following options: long January 2023 $57.50 calls on Intel, long January 2025 $45 calls on Intel, and short January 2025 $45 puts on Intel. The Motley Fool has a disclosure policy. Jose Najarro is an affiliate of The Motley Fool and may be compensated for promoting its services. If you choose to subscribe through their link, they will earn some extra money that supports their channel. Their opinions remain their own and are unaffected by The Motley Fool.
The views and opinions expressed herein are the views and opinions of the author and do not necessarily reflect those of Nasdaq, Inc.","Today's video focuses on Amazon (NASDAQ: AMZN) and its recently announced processor, Graviton3E, and what it means for semiconductor companies like Advanced Micro Devices (NASDAQ: AMD), Intel (NASDAQ: INTC), and Nvidia (NASDAQ: NVDA). Check out the short video to learn more, consider subscribing, and click the special offer link below. Find out why Amazon.com is one of the 10 best stocks to buy now Our award-winning analyst team has spent more than a decade beating the market.","Today's video focuses on Amazon (NASDAQ: AMZN) and its recently announced processor, Graviton3E, and what it means for semiconductor companies like Advanced Micro Devices (NASDAQ: AMD), Intel (NASDAQ: INTC), and Nvidia (NASDAQ: NVDA). The Motley Fool has positions in and recommends Advanced Micro Devices, Amazon.com, Intel, and Nvidia. The Motley Fool recommends the following options: long January 2023 $57.50 calls on Intel, long January 2025 $45 calls on Intel, and short January 2025 $45 puts on Intel.","Today's video focuses on Amazon (NASDAQ: AMZN) and its recently announced processor, Graviton3E, and what it means for semiconductor companies like Advanced Micro Devices (NASDAQ: AMD), Intel (NASDAQ: INTC), and Nvidia (NASDAQ: NVDA). The Motley Fool has positions in and recommends Advanced Micro Devices, Amazon.com, Intel, and Nvidia. The Motley Fool recommends the following options: long January 2023 $57.50 calls on Intel, long January 2025 $45 calls on Intel, and short January 2025 $45 puts on Intel.","Today's video focuses on Amazon (NASDAQ: AMZN) and its recently announced processor, Graviton3E, and what it means for semiconductor companies like Advanced Micro Devices (NASDAQ: AMD), Intel (NASDAQ: INTC), and Nvidia (NASDAQ: NVDA). Check out the short video to learn more, consider subscribing, and click the special offer link below. After all, the newsletter they have run for over a decade, Motley Fool Stock Advisor, has tripled the market.",2022,4
2022-12-20 00:00:00+00:00,Intel Has a $39 Billion Graphics Opportunity,INTC,https://www.nasdaq.com/articles/intel-has-a-%2439-billion-graphics-opportunity,,,"The graphics card market had been a two-horse race for many years. Nvidia (NASDAQ: NVDA) has been at it since the company was founded in 1993, and Advanced Micro Devices (NASDAQ: AMD) entered the market with the acquisition of ATI in 2006. It's been Nvidia and AMD battling each other since then, with Nvidia generally coming out on top in terms of market share.
This year brought a third player into the mix: CPU giant Intel (NASDAQ: INTC). Intel is not new to the graphics business -- many of the company's PC CPUs include integrated graphics chips, and the company briefly sold stand-alone graphics cards in the late 1990s. But as video games have exploded in graphical complexity, and as graphics cards have found applications outside of gaming, Intel has largely been stuck on the sidelines.
A strong but messy start
Intel is on the sidelines no more, although there was some sloppy execution along the way. Intel's first graphics card, the Arc A380, targeted the low end of the market and initially launched in China. Gaming performance wasn't particularly good or consistent, and issues with software drivers only made things worse.
It turns out that Intel had attempted to take a shortcut on the software side, using its integrated graphics software as a foundation. That software couldn't provide adequate performance, leaving Intel playing catch-up as it readied the launch of its mid-range Arc A750 and Arc A770 graphics cards. Rumors emerged that Intel was scrapping the whole effort as it struggled to bring competent products to market.
Intel did eventually launch those graphics cards, and they received generally positive reviews. Tom's Hardware called the Arc A770, priced at $329, a ""potent mainstream competitor,"" praising its performance for the price. Software was still a problem at launch, particularly for older games, but Intel has made strides to fix its mistakes.
Intel was forced to abandon its goal of shipping 4 million graphics card units this year as software issues pushed back launch dates, but the company is in a good position to be a major player in the mainstream graphics card market in 2023 and beyond.
A massive opportunity
Jon Peddie Research expects the market for discrete graphics cards to grow to $39 billion by 2026, up from just under $32 billion over the past 12 months. The market is in flux right now -- demand for PCs has plunged, and excess inventories of last-gen graphics cards have triggered board partners to cut way back on orders. Unit shipments were down nearly 32% year over year in the third quarter as a result.
Even in a tough market, Intel has priced its cards aggressively enough to make a splash. The company only competes in the mid-range -- the A750 and A770 are priced at $289 and $329, respectively -- but that's where the most popular graphics cards live. According to Steam's hardware and software survey, the top seven most-used graphics cards on the platform are mid-range cards from Nvidia. By focusing on the mid-range, Intel is going after a high-volume portion of the market.
If AMD's experience trying to win at the high end of the market is any indication, Intel may never even make a real attempt. AMD's latest high-end graphics cards represent its best effort in years, but they still fall short of Nvidia's products, particularly when it comes to ray tracing performance. If Intel does make a run at the high end, it's probably not going to happen anytime soon.
Even if Intel sticks to mid-range and low-end graphics cards, a big chunk of the $39 billion market will be up for grabs. The company's relationships with PC OEMs certainly give it a leg up, and its software will only improve over time. Intel is on a path to becoming a solid player in the graphics card market, generating billions of dollars in revenue each year.
10 stocks we like better than Intel
When our award-winning analyst team has a stock tip, it can pay to listen. After all, the newsletter they have run for over a decade, Motley Fool Stock Advisor, has tripled the market.*
They just revealed what they believe are the ten best stocks for investors to buy right now... and Intel wasn't one of them! That's right -- they think these 10 stocks are even better buys.
See the 10 stocks
*Stock Advisor returns as of December 1, 2022
Timothy Green has positions in Intel. The Motley Fool has positions in and recommends Advanced Micro Devices, Intel, and Nvidia. The Motley Fool recommends the following options: long January 2023 $57.50 calls on Intel, long January 2025 $45 calls on Intel, and short January 2025 $45 puts on Intel. The Motley Fool has a disclosure policy.
The views and opinions expressed herein are the views and opinions of the author and do not necessarily reflect those of Nasdaq, Inc.","This year brought a third player into the mix: CPU giant Intel (NASDAQ: INTC). The market is in flux right now -- demand for PCs has plunged, and excess inventories of last-gen graphics cards have triggered board partners to cut way back on orders. AMD's latest high-end graphics cards represent its best effort in years, but they still fall short of Nvidia's products, particularly when it comes to ray tracing performance.","This year brought a third player into the mix: CPU giant Intel (NASDAQ: INTC). Intel was forced to abandon its goal of shipping 4 million graphics card units this year as software issues pushed back launch dates, but the company is in a good position to be a major player in the mainstream graphics card market in 2023 and beyond. The Motley Fool has positions in and recommends Advanced Micro Devices, Intel, and Nvidia.","This year brought a third player into the mix: CPU giant Intel (NASDAQ: INTC). Intel is not new to the graphics business -- many of the company's PC CPUs include integrated graphics chips, and the company briefly sold stand-alone graphics cards in the late 1990s. Intel was forced to abandon its goal of shipping 4 million graphics card units this year as software issues pushed back launch dates, but the company is in a good position to be a major player in the mainstream graphics card market in 2023 and beyond.","This year brought a third player into the mix: CPU giant Intel (NASDAQ: INTC). The company only competes in the mid-range -- the A750 and A770 are priced at $289 and $329, respectively -- but that's where the most popular graphics cards live. Intel is on a path to becoming a solid player in the graphics card market, generating billions of dollars in revenue each year.",2022,4
