Date,Article_title,Stock_symbol,Url,Publisher,Author,Article,Lsa_summary,Luhn_summary,Textrank_summary,Lexrank_summary,Year,sentiment_score
2022-03-24 00:00:00+00:00,"Intel: Short-Term Pains, Long-Term Gains",INTC,https://www.nasdaq.com/articles/intel%3A-short-term-pains-long-term-gains,,,"Intel (INTC) has fallen technologically behind the competition over the last few years, which has led many investors to believe Intel is dead in the water. To correct Intel's course, former CTO Pat Gelsinger returned to Intel as CEO in February 2021.
The groundwork is now being done to expand into the lucrative foundry business while continuing the core x86 CPU business. The current macroeconomic and geopolitical climate is beneficial for Intel. I am bullish on Intel because of its long-term growth potential. 
Expanding into the Foundry Business
Historically, Intel has only designed and manufactured its own chips in its foundries. Intel is now opening up its foundries to third parties and expanding its capacity.  
The foundry business has enormous barriers to entry; luckily, Intel meets them. One of the key barriers is access to the technology needed to create modern chips. Intel has an existing investment in ASML Holding (ASML), the only company to provide machines for extreme-ultraviolet lithography (EUV).
ASML is also the only company producing the machines for High-NA EUV, which is expected to be used for Intel's 18A process in 2025. Even though Intel has a 15% stake in ASML, it still has to back order the $150+ million machines, showing how difficult it would be for a new player to start manufacturing modern chips. 
Intel is rapidly expanding its foundry capacity. Some of the notable investments Intel has made to expand capacity include: investing €33 billion into operations across Europe, acquiring Tower Semiconductors for $5.4 billion, investing over $20 billion into two new foundries in Ohio, and $20 billion for two foundries in Arizona. 
The expansion allows for Intel to turn the threat of ARM and RISC-V architectures into an opportunity. Apple (AAPL) dropping Intel for its own Apple M1 chips was a major blow to Intel. Intel could potentially win back Apple for manufacturing its ARM-based M1 chips. 
The M1 chip is currently produced by Taiwan Semiconductor Manufacturing Company or TSMC (TSM). Apple switched to TSMC because TSMC is able to manufacture a more effective node. The switch ultimately allowed Apple to have similar performance with more battery life due to the superior node and ARM architecture. 
The crux of Intel investing in foundries is if it is unable to regain technological dominance. If it can't regain dominance, high-end silicon customers like Apple will remain at TSMC. On the other hand, if Intel is able to gain industry dominance, even direct competitors Advanced Micro Devices (AMD) and Nvidia (NVDA) would likely flock to Intel foundries. 
Intel has relied purely on improving other chip processes over raw transistor size reductions for years now. Intel's non-density innovation is illustrated by continuing performance improvements on the 14nm transistor over its extended lifetime. 
One of the key introductions is the use of chiplets instead of the traditional monolithic system on a chip (SOC). Chiplets allow for better yields, reducing wasted silicon wafers and offering better optimization for specific uses. 
In summary, Intel is setting itself up for the long game, investing heavily to expand its business. 
Macro Environment
The current macro environment is beneficial to Intel. Geopolitical tensions and supply chain issues have pushed the U.S. and EU to invest heavily in localizing semiconductor manufacturing. 
TSMC, which is located in Taiwan, is estimated to produce more than 90% of the world's advanced chips. China has had a perpetual threat to invade Taiwan. A Chinese invasion is a threat to the international semiconductor industry. To defend against losing access to vital chips, both the U.S. and EU are looking to localize manufacturing. 
The Innovation Act, which is making its way through Congress, would give the semiconductor industry $52 billion in funding. Intel would be the likely recipient of the lion's share as Biden praised the company during the Union Address. If passed, Intel will pour another $80 billion into its Ohio foundries for a total of $100 billion.
On the other side of the Atlantic, the European Union is pushing for 20% of total chips manufactured to come from the EU by 2030. The EU has a planned investment of $49 billion. As a result, Intel is investing €33 billion into fabrication and research across the Union. 
Intel is deepening relationships with both sides of the Atlantic, which will allow for long-term growth. 
Funding Investments
Due to the rapid investment, CapEx hit an all-time high of $20.3 billion in 2021, a 40.7% increase year-over-year. The question is, can Intel keep up the spending?
Intel should be able to continue to have heavy investment into expanding its foundry segment.
Intel had a free cash flow of over $9.6 billion in 2021. The fact that Intel is able to retain a positive free cash flow after investing heavily is promising.
Intel is spinning off its autonomous driving business Mobileye as an IPO. Mobileye is expected to be valued at more than $50 billion. Intel is going to retain a majority of shares, so it could sell up to $25 billion while retaining a majority. The cash injection will help pay for immediate investments.
As a last line of defense, Intel would be able to drop its dividend and share buybacks, but the market will punish the stock price if this occurs. 
The bearish case against Intel's finances is the stagnation of growth. Revenue only grew 1.5% year-over-year for 2021 and is expected to drop for Q1 2022.
EPS is in a worse state than revenue; EPS fell 7.5% in 2021. The Q1-2022 guidance shows a 40% decline in EPS for the quarter to $0.80.
The lack of growth is exhibited in the low P/E of 10.6. 
Ultimately, Intel is pushing for long-term growth, but the trade-off is that short-term growth will most likely be negative or insignificant. 
Wall Street's Take
Turning to Wall Street, Intel is a Hold base on eight Buys, 13 Holds, and seven Sell ratings over the last three months. 
The average Intel stock price target is $53.90, representing 4.9% upside potential.
Conclusion
Intel's short-term stagnation should be made up for in the long term. I am more bullish than analysis consensus; I believe Intel is a Buy. 
Download the TipRanks mobile app now
To find good ideas for stocks trading at attractive valuations, visit TipRanks’ Best Stocks to Buy, a newly launched tool that unites all of TipRanks’ equity insights.
Read full Disclaimer & Disclosure
The views and opinions expressed herein are the views and opinions of the author and do not necessarily reflect those of Nasdaq, Inc.","Intel (INTC) has fallen technologically behind the competition over the last few years, which has led many investors to believe Intel is dead in the water. Even though Intel has a 15% stake in ASML, it still has to back order the $150+ million machines, showing how difficult it would be for a new player to start manufacturing modern chips. The switch ultimately allowed Apple to have similar performance with more battery life due to the superior node and ARM architecture.","Intel (INTC) has fallen technologically behind the competition over the last few years, which has led many investors to believe Intel is dead in the water. Some of the notable investments Intel has made to expand capacity include: investing €33 billion into operations across Europe, acquiring Tower Semiconductors for $5.4 billion, investing over $20 billion into two new foundries in Ohio, and $20 billion for two foundries in Arizona. The M1 chip is currently produced by Taiwan Semiconductor Manufacturing Company or TSMC (TSM).","Intel (INTC) has fallen technologically behind the competition over the last few years, which has led many investors to believe Intel is dead in the water. Expanding into the Foundry Business Historically, Intel has only designed and manufactured its own chips in its foundries. Some of the notable investments Intel has made to expand capacity include: investing €33 billion into operations across Europe, acquiring Tower Semiconductors for $5.4 billion, investing over $20 billion into two new foundries in Ohio, and $20 billion for two foundries in Arizona.","Intel (INTC) has fallen technologically behind the competition over the last few years, which has led many investors to believe Intel is dead in the water. Expanding into the Foundry Business Historically, Intel has only designed and manufactured its own chips in its foundries. Some of the notable investments Intel has made to expand capacity include: investing €33 billion into operations across Europe, acquiring Tower Semiconductors for $5.4 billion, investing over $20 billion into two new foundries in Ohio, and $20 billion for two foundries in Arizona.",2022,3
2022-03-24 00:00:00+00:00,"US STOCKS-Wall St resumes rally, led by Nasdaq as chipmakers soar",INTC,https://www.nasdaq.com/articles/us-stocks-wall-st-resumes-rally-led-by-nasdaq-as-chipmakers-soar,,,"By Caroline Valetkevitch
NEW YORK, March 24 (Reuters) - Major U.S. stock indexes rallied more than 1% on Thursday, extending the market's recent rebound, as investors snapped up beaten-down shares of chipmakers and big growth names and as oil prices dropped.
Nvidia Corp's stock NVDA.Ogained 9.8%, leading a rally across the chip sector and hitting its highest level since mid-January. Intel Corp INTC.Oclimbed 6.9%, and both stocks helped to boost the S&P 500 and the Nasdaq.
The Philadelphia SE semiconductor index <.SOX> jumped 5.1% in its biggest daily percentage gain since Feb. 15, while it remains down about 10% for the year so far. Apple AAPL.O shares rose for an eighth consecutive day after getting hammered earlier this month.
The three major indexes have rallied in six of the last eight sessions, with all three having rebounded after the S&P 500 and the Dow confirmed they are in correction and the Nasdaq established it is in a bear market.
""The bear market was the dip to buy,"" said Jake Dollarhide, chief executive officer of Longbow Asset Management in Tulsa, Oklahoma, which has about $50 million in assets under management. ""People finally said hey, this is a good entry point.""
""They are seeing more value in tech for the first time in a long time,"" he said.
Oil prices fell after rallying sharply on Wednesday. O/R
Data earlier showed the number of Americans filing new claims for jobless benefits dropped to a 52-1/2-year low last week, while unemployment rolls continued to shrink.
The Dow Jones Industrial Average .DJI rose 349.44 points, or 1.02%, to 34,707.94, the S&P 500 .SPX gained 63.92 points, or 1.43%, to 4,520.16 and the Nasdaq Composite .IXIC added 269.24 points, or 1.93%, to 14,191.84.
Investors watched for the next developments in the Ukraine-Russia crisis. Western leaders have agreed to increase military aid to Ukraine and tighten sanctions on Russia whose invasion of its neighbor entered a second month.
Uber Technologies Inc UBER.Nclimbed 5% after the ride-hailing firm reached a deal to list all New York City taxis on its app.
Volume on U.S. exchanges was relatively low at 11.03 billion shares, compared with the 14.3 billion average for the full session over the last 20 trading days.
Advancing issues outnumbered declining ones on the NYSE by a 1.96-to-1 ratio; on Nasdaq, a 2.03-to-1 ratio favored advancers.
The S&P 500 posted 29 new 52-week highs and four new lows; the Nasdaq Composite recorded 58 new highs and 60 new lows.
(Additional reporting by Devik Jain and Amruta Khandekar in Bengaluru; Editing by Marguerita Choy)
((caroline.valetkevitch@thomsonreuters.com))
The views and opinions expressed herein are the views and opinions of the author and do not necessarily reflect those of Nasdaq, Inc.","Intel Corp INTC.Oclimbed 6.9%, and both stocks helped to boost the S&P 500 and the Nasdaq. By Caroline Valetkevitch NEW YORK, March 24 (Reuters) - Major U.S. stock indexes rallied more than 1% on Thursday, extending the market's recent rebound, as investors snapped up beaten-down shares of chipmakers and big growth names and as oil prices dropped. O/R Data earlier showed the number of Americans filing new claims for jobless benefits dropped to a 52-1/2-year low last week, while unemployment rolls continued to shrink.","Intel Corp INTC.Oclimbed 6.9%, and both stocks helped to boost the S&P 500 and the Nasdaq. By Caroline Valetkevitch NEW YORK, March 24 (Reuters) - Major U.S. stock indexes rallied more than 1% on Thursday, extending the market's recent rebound, as investors snapped up beaten-down shares of chipmakers and big growth names and as oil prices dropped. The Dow Jones Industrial Average .DJI rose 349.44 points, or 1.02%, to 34,707.94, the S&P 500 .SPX gained 63.92 points, or 1.43%, to 4,520.16 and the Nasdaq Composite .IXIC added 269.24 points, or 1.93%, to 14,191.84.","Intel Corp INTC.Oclimbed 6.9%, and both stocks helped to boost the S&P 500 and the Nasdaq. By Caroline Valetkevitch NEW YORK, March 24 (Reuters) - Major U.S. stock indexes rallied more than 1% on Thursday, extending the market's recent rebound, as investors snapped up beaten-down shares of chipmakers and big growth names and as oil prices dropped. The three major indexes have rallied in six of the last eight sessions, with all three having rebounded after the S&P 500 and the Dow confirmed they are in correction and the Nasdaq established it is in a bear market.","Intel Corp INTC.Oclimbed 6.9%, and both stocks helped to boost the S&P 500 and the Nasdaq. By Caroline Valetkevitch NEW YORK, March 24 (Reuters) - Major U.S. stock indexes rallied more than 1% on Thursday, extending the market's recent rebound, as investors snapped up beaten-down shares of chipmakers and big growth names and as oil prices dropped. Nvidia Corp's stock NVDA.Ogained 9.8%, leading a rally across the chip sector and hitting its highest level since mid-January.",2022,4
2022-03-24 00:00:00+00:00,"Up 15% Over The Last Month, NVIDIA Stock Could Continue Rallying",INTC,https://www.nasdaq.com/articles/up-15-over-the-last-month-nvidia-stock-could-continue-rallying,,,"NVIDIA Corporation stock (NASDAQ: NVDA) is up almost 15% in the past month (21 trading days), outperforming the S&P 500 which was up a little more than 3% over this period. If you look at the change over the last five and ten days, too, the stock has risen 18% and 26%, outperforming the broader market on both occasions. This jump was largely a result of NVDA’s most recent FY ’22 earnings (NVDA’s fiscal year ends in January), which saw revenue rise strongly to $26.9 billion, up from $16.7 billion in FY ’21. Additionally, a much slower rise in operating expenses and COGS meant that operating income rose more than 2.2x to $10 billion in FY ’22. Combined with a roughly unchanged effective tax rate, EPS rose from$1.76 in FY ’21 to $3.91 in FY ’22, a more than 2x jump.
Now, is NVDA stock set to continue its outperformance or could we expect a pullback? We believe that there is a strong 68% chance of a rise in NVDA stock over the next month (21 trading days) based on our machine learning analysis of trends in the stock price over the last ten years. See our analysis on NVDA Stock Chance of Rise. Additionally, for details about NVDA’s revenue and comparison to peers, see NVIDIA (NVDA) Revenue Comparison.
Twenty-One Day: NVDA 14%, vs. S&P500 3.4%; Outperformed market
(17% likelihood event; 68% probability of rise over next 21 days)
NVDA stock rose 14% the last twenty-one trading days (one month), compared to a broader market (S&P500) rise of 3.4%
A change of 14% or more over twenty-one trading days is a 17% likelihood event, which has occurred 431 times out of 2516 in the last 10 years
Of these 431 instances, the stock has seen a positive movement over the next twenty-one trading days on 295 occasions
This points to a 68% probability for the stock rising over the next twenty-one trading days
Ten Day: NVDA 26%, vs. S&P500 7.9%; Outperformed market
(<1% likelihood event; 62% probability of rise over next 10 days)
NVDA stock gained 26% over the last ten trading days (two weeks), compared to a broader market (S&P500) rise of 7.9%
A change of 26% or more over ten trading days is a <1% likelihood event, which has occurred 21 times out of 2516 in the last 10 years
Of these 21 instances, the stock has seen a positive movement over the next ten trading days on 13 occasions
This points to a 62% probability for the stock rising over the next ten trading days
Five Day: NVDA 18%, vs. S&P500 5.3%; Outperformed market
(<1% likelihood event; 64% probability of rise over next five days)
NVDA stock rallied 18% over a five-day trading period ending 3/21/2022, compared to the broader market (S&P500) which was up around 5.3% over this period.
A change of 18% or more over five trading days (one week) is a <1% likelihood event, which has occurred 22 times out of 2516 in the last 10 years
Of these 22 instances, the stock has seen a positive movement over the next five trading days on 14 occasions
This points to a 64% probability for the stock rising over the next five trading days
What if you’re looking for a more balanced portfolio instead? Here’s a high-quality portfolio that’s beaten the market consistently since the end of 2016.
Returns Mar 2022
MTD [1] 2022
YTD [1] 2017-22
Total [2]
 NVDA Return 9% -10% 895%
 S&P 500 Return 3% -6% 101%
 Trefis MS Portfolio Return 3% -8% 263%
[1] Month-to-date and year-to-date as of 3/22/2022
[2] Cumulative total returns since the end of 2016
  Invest with Trefis Market Beating Portfolios
See all Trefis Price Estimates
The views and opinions expressed herein are the views and opinions of the author and do not necessarily reflect those of Nasdaq, Inc.","NVIDIA Corporation stock (NASDAQ: NVDA) is up almost 15% in the past month (21 trading days), outperforming the S&P 500 which was up a little more than 3% over this period. If you look at the change over the last five and ten days, too, the stock has risen 18% and 26%, outperforming the broader market on both occasions. This jump was largely a result of NVDA’s most recent FY ’22 earnings (NVDA’s fiscal year ends in January), which saw revenue rise strongly to $26.9 billion, up from $16.7 billion in FY ’21.","We believe that there is a strong 68% chance of a rise in NVDA stock over the next month (21 trading days) based on our machine learning analysis of trends in the stock price over the last ten years. Twenty-One Day: NVDA 14%, vs. S&P500 3.4%; Outperformed market (17% likelihood event; 68% probability of rise over next 21 days) NVDA stock rose 14% the last twenty-one trading days (one month), compared to a broader market (S&P500) rise of 3.4% A change of 14% or more over twenty-one trading days is a 17% likelihood event, which has occurred 431 times out of 2516 in the last 10 years Of these 431 instances, the stock has seen a positive movement over the next twenty-one trading days on 295 occasions This points to a 68% probability for the stock rising over the next twenty-one trading days Ten Day: NVDA 26%, vs. S&P500 7.9%; Outperformed market (<1% likelihood event; 62% probability of rise over next 10 days) NVDA stock gained 26% over the last ten trading days (two weeks), compared to a broader market (S&P500) rise of 7.9% A change of 26% or more over ten trading days is a <1% likelihood event, which has occurred 21 times out of 2516 in the last 10 years Of these 21 instances, the stock has seen a positive movement over the next ten trading days on 13 occasions This points to a 62% probability for the stock rising over the next ten trading days Five Day: NVDA 18%, vs. S&P500 5.3%; Outperformed market (<1% likelihood event; 64% probability of rise over next five days) NVDA stock rallied 18% over a five-day trading period ending 3/21/2022, compared to the broader market (S&P500) which was up around 5.3% over this period. Total [2] NVDA Return 9% -10% 895% S&P 500 Return 3% -6% 101% Trefis MS Portfolio Return 3% -8% 263% [1] Month-to-date and year-to-date as of 3/22/2022 [2] Cumulative total returns since the end of 2016 Invest with Trefis Market Beating Portfolios See all Trefis Price Estimates The views and opinions expressed herein are the views and opinions of the author and do not necessarily reflect those of Nasdaq, Inc.","Twenty-One Day: NVDA 14%, vs. S&P500 3.4%; Outperformed market (17% likelihood event; 68% probability of rise over next 21 days) NVDA stock rose 14% the last twenty-one trading days (one month), compared to a broader market (S&P500) rise of 3.4% A change of 14% or more over twenty-one trading days is a 17% likelihood event, which has occurred 431 times out of 2516 in the last 10 years Of these 431 instances, the stock has seen a positive movement over the next twenty-one trading days on 295 occasions This points to a 68% probability for the stock rising over the next twenty-one trading days Ten Day: NVDA 26%, vs. S&P500 7.9%; Outperformed market (<1% likelihood event; 62% probability of rise over next 10 days) NVDA stock gained 26% over the last ten trading days (two weeks), compared to a broader market (S&P500) rise of 7.9% A change of 26% or more over ten trading days is a <1% likelihood event, which has occurred 21 times out of 2516 in the last 10 years Of these 21 instances, the stock has seen a positive movement over the next ten trading days on 13 occasions This points to a 62% probability for the stock rising over the next ten trading days Five Day: NVDA 18%, vs. S&P500 5.3%; Outperformed market (<1% likelihood event; 64% probability of rise over next five days) NVDA stock rallied 18% over a five-day trading period ending 3/21/2022, compared to the broader market (S&P500) which was up around 5.3% over this period. A change of 18% or more over five trading days (one week) is a <1% likelihood event, which has occurred 22 times out of 2516 in the last 10 years Of these 22 instances, the stock has seen a positive movement over the next five trading days on 14 occasions This points to a 64% probability for the stock rising over the next five trading days What if you’re looking for a more balanced portfolio instead? Total [2] NVDA Return 9% -10% 895% S&P 500 Return 3% -6% 101% Trefis MS Portfolio Return 3% -8% 263% [1] Month-to-date and year-to-date as of 3/22/2022 [2] Cumulative total returns since the end of 2016 Invest with Trefis Market Beating Portfolios See all Trefis Price Estimates The views and opinions expressed herein are the views and opinions of the author and do not necessarily reflect those of Nasdaq, Inc.","This jump was largely a result of NVDA’s most recent FY ’22 earnings (NVDA’s fiscal year ends in January), which saw revenue rise strongly to $26.9 billion, up from $16.7 billion in FY ’21. We believe that there is a strong 68% chance of a rise in NVDA stock over the next month (21 trading days) based on our machine learning analysis of trends in the stock price over the last ten years. Total [2] NVDA Return 9% -10% 895% S&P 500 Return 3% -6% 101% Trefis MS Portfolio Return 3% -8% 263% [1] Month-to-date and year-to-date as of 3/22/2022 [2] Cumulative total returns since the end of 2016 Invest with Trefis Market Beating Portfolios See all Trefis Price Estimates The views and opinions expressed herein are the views and opinions of the author and do not necessarily reflect those of Nasdaq, Inc.",2022,4
