Date,Article_title,Stock_symbol,Url,Publisher,Author,Article,Lsa_summary,Luhn_summary,Textrank_summary,Lexrank_summary,Year,sentiment_score
2022-03-29 00:00:00+00:00,Nvidia Is a Screaming Buy Following its Vibrant GTC Show,INTC,https://www.nasdaq.com/articles/nvidia-is-a-screaming-buy-following-its-vibrant-gtc-show,,,"InvestorPlace - Stock Market News, Stock Advice & Trading Tips
Nvidia (NASDAQ:NVDA) was among the best performing tech stocks of 2021. Although the stock did come under pressure this year, it has so far weathered the market-wide downturn relatively better than most of its tech peers. NVDA stock is down about 6% year-to-date (YTD) compared to the 9.5% drop for the Nasdaq 100 Index.
Source: JHVEPhoto / Shutterstock.com
Industry-leading growth, solid product momentum, strong execution and innovation are all secret recipes that have powered the Nvidia growth engine. The only pushback now seems to be the stock’s stretched valuation.
Is Nvidia still a buy at current levels?
How NVDA Stock Makes Money
Nvidia derives the bulk of its revenues by selling gaming chips, predominantly to the PC industry. These graphic processing units (GPUs) also go into streaming services and console gaming devices.
The company is also heavily reliant on data center chips that power compute-intensive workloads such as artificial intelligence (AI), data analytics, graphics and scientific computing across hyperscale, cloud enterprise, public sector and edge data centers.
7 Retail Stocks Worth a Buy Now
Professional visualization, automotive, and “OEMs & others” round up Nvidia’s business segments. The automotive business provides cockpit autonomous vehicles platforms, as well as AI cockpit and infotainment solutions.
Segment-wise Revenue Breakup For Nvidia In Q4’21
Source: Chart by Shanthi Rexaline
Nvidia took to the hot-and-happening metaverse by unveiling its Omniverse enterprise platform in April 2021. This platform is meant to facilitate real time collaboration of global 3D design teams in a shared virtual space.
Nvidia Evolving as Diversified Tech Play
Nvidia is not about merely chips anymore. It has developed a whole new array of products, bestowing on it the advantage of a diversified company.
The four-day 2022 GPU Technology Conference (GTC) underlined Nvidia’s ambitious plans. The company bumped up its long-term total addressable market opportunity to $1 trillion. The break-up works out as follows:
Gaming: $100 billion
Software (AI enterprise software & omniverse enterprise software): $300 billion
Chips & systems: $300 billion
Automotive: $300 billion
To put things in perspective, Nvidia is now seeing more potential outside of Gaming, which makes the biggest contribution to the top line.
Nvidia’s Hot New Technologies
Nvidia is currently targeting a massive AI inflection. At the GTC, Chief Executive Officer Jensen Huang announced updates to the company’s AI platform and the AI accelerated program that would ensure performance and reliability of AI applications developed by partners.
The Nvidia founder sees the company’s AI as the “software tool box of the world’s AI community.”
“Our GTC 2022 release is massive. Whether it’s creating more engaging chatbots and virtual assistants, building smarter recommendations to help consumers make better purchasing decisions, or orchestrating AI services at the largest scales, your superpowered gem is in NVIDIA AI.”
The auto end market is another promising opportunity for Nvidia, given the accelerated electric vehicle (EV) transformation that is underway. Team Green is cementing its position in the automotive segment with the latest Nvidia Drive Hyperion 8 platform and Drive Orin system-on-a-chip. The who’s who of the auto industry have all stitched up partnerships with Nvidia. The company puts the value of its automotive pipeline at over $11 billion.
Not to mention the metaverse opportunity. At the GTC 2022, the company announced Omniverse for developers.
Nvidia also launched Nvidia OVX, a computing system, to operate complex digital twin simulations that will run within the Nvidia Omniverse.
JPMorgan (NYSE:JPM) analyst Harlan Sur summarized Nvidia’s all-pervasive push as follows:
“With leading silicon hardware and software platforms and a strong ecosystem, Nvidia is well positioned to continue to benefit from major secular trends in artificial intelligence, high performance computing, gaming, and autonomous vehicles.”
NVDA Stock Trades at Elevated Valuation
Notwithstanding the recent pullback, NVDA stock is still trading at an elevated multiple of 51.08 times its forward earnings. This is amongst the highest in the industry. In comparison, AMD (NASDAQ:AMD) and Qualcomm (NASDAQ:QCOM) trade at forward price-to-earnings multiples of 28.09 and 13.18, respectively.
Nvidia’s trailing twelve months (TTM) price-to-sales (P/S) ratio is at 26.51. The metric is at 9.03 for Broadcom (NASDAQ:AVGO), 2.5 for Intel (NASDAQ:INTC), 8.52 for AMD and 12.31 for Marvell Technology (NASDAQ: MRVL).
Bottom Line on Nvidia Stock
Nvidia’s premium valuation may deter some investors. Sifting through the company’s performance metrics over the quarters, we see that the it has been able to grow revenues at a robust clip of 50% or more for seven straight quarters.
After bottoming in mid-2019, margins have been trending higher thanks to strong topline growth and operational efficiency. Nvidia is among those very few companies that consistently outperform relative to expectations on the bottom line. More importantly, Nvidia’s future holds a lot of promise as it finds itself in the sweet spot of cutting-edge technological innovation.
The recent pullback in shares presents an attractive entry point for those investors looking to ride the potential upside promised by this tech growth story.
On the date of publication, Shanthi Rexaline did not have (either directly or indirectly) any positions in the securities mentioned in this article. The opinions expressed in this article are those of the writer, subject to the InvestorPlace.com Publishing Guidelines.
The post Nvidia Is a Screaming Buy Following its Vibrant GTC Show appeared first on InvestorPlace.
The views and opinions expressed herein are the views and opinions of the author and do not necessarily reflect those of Nasdaq, Inc.","The metric is at 9.03 for Broadcom (NASDAQ:AVGO), 2.5 for Intel (NASDAQ:INTC), 8.52 for AMD and 12.31 for Marvell Technology (NASDAQ: MRVL). How NVDA Stock Makes Money Nvidia derives the bulk of its revenues by selling gaming chips, predominantly to the PC industry. JPMorgan (NYSE:JPM) analyst Harlan Sur summarized Nvidia’s all-pervasive push as follows: “With leading silicon hardware and software platforms and a strong ecosystem, Nvidia is well positioned to continue to benefit from major secular trends in artificial intelligence, high performance computing, gaming, and autonomous vehicles.” NVDA Stock Trades at Elevated Valuation Notwithstanding the recent pullback, NVDA stock is still trading at an elevated multiple of 51.08 times its forward earnings.","The metric is at 9.03 for Broadcom (NASDAQ:AVGO), 2.5 for Intel (NASDAQ:INTC), 8.52 for AMD and 12.31 for Marvell Technology (NASDAQ: MRVL). InvestorPlace - Stock Market News, Stock Advice & Trading Tips Nvidia (NASDAQ:NVDA) was among the best performing tech stocks of 2021. The break-up works out as follows: Gaming: $100 billion Software (AI enterprise software & omniverse enterprise software): $300 billion Chips & systems: $300 billion Automotive: $300 billion To put things in perspective, Nvidia is now seeing more potential outside of Gaming, which makes the biggest contribution to the top line.","The metric is at 9.03 for Broadcom (NASDAQ:AVGO), 2.5 for Intel (NASDAQ:INTC), 8.52 for AMD and 12.31 for Marvell Technology (NASDAQ: MRVL). The break-up works out as follows: Gaming: $100 billion Software (AI enterprise software & omniverse enterprise software): $300 billion Chips & systems: $300 billion Automotive: $300 billion To put things in perspective, Nvidia is now seeing more potential outside of Gaming, which makes the biggest contribution to the top line. Nvidia also launched Nvidia OVX, a computing system, to operate complex digital twin simulations that will run within the Nvidia Omniverse.","The metric is at 9.03 for Broadcom (NASDAQ:AVGO), 2.5 for Intel (NASDAQ:INTC), 8.52 for AMD and 12.31 for Marvell Technology (NASDAQ: MRVL). InvestorPlace - Stock Market News, Stock Advice & Trading Tips Nvidia (NASDAQ:NVDA) was among the best performing tech stocks of 2021. How NVDA Stock Makes Money Nvidia derives the bulk of its revenues by selling gaming chips, predominantly to the PC industry.",2022,3
2022-03-29 00:00:00+00:00,Intel (INTC) Outpaces Stock Market Gains: What You Should Know,INTC,https://www.nasdaq.com/articles/intel-intc-outpaces-stock-market-gains%3A-what-you-should-know-2,,,"In the latest trading session, Intel (INTC) closed at $52.25, marking a +1.44% move from the previous day. This change outpaced the S&P 500's 1.23% gain on the day. Elsewhere, the Dow gained 0.97%, while the tech-heavy Nasdaq added 0.44%.
Prior to today's trading, shares of the world's largest chipmaker had gained 7.99% over the past month. This has outpaced the Computer and Technology sector's gain of 3.63% and the S&P 500's gain of 4.69% in that time.
Investors will be hoping for strength from Intel as it approaches its next earnings release, which is expected to be April 28, 2022. In that report, analysts expect Intel to post earnings of $0.80 per share. This would mark a year-over-year decline of 42.45%. Meanwhile, the Zacks Consensus Estimate for revenue is projecting net sales of $18.32 billion, down 6.88% from the year-ago period.
For the full year, our Zacks Consensus Estimates are projecting earnings of $3.49 per share and revenue of $75.39 billion, which would represent changes of -36.2% and -3.38%, respectively, from the prior year.
Investors should also note any recent changes to analyst estimates for Intel. These recent revisions tend to reflect the evolving nature of short-term business trends. As a result, we can interpret positive estimate revisions as a good sign for the company's business outlook.
Research indicates that these estimate revisions are directly correlated with near-term share price momentum. We developed the Zacks Rank to capitalize on this phenomenon. Our system takes these estimate changes into account and delivers a clear, actionable rating model.
The Zacks Rank system ranges from #1 (Strong Buy) to #5 (Strong Sell). It has a remarkable, outside-audited track record of success, with #1 stocks delivering an average annual return of +25% since 1988. Within the past 30 days, our consensus EPS projection has moved 0.01% higher. Intel is currently a Zacks Rank #3 (Hold).
Digging into valuation, Intel currently has a Forward P/E ratio of 14.77. Its industry sports an average Forward P/E of 15.06, so we one might conclude that Intel is trading at a discount comparatively.
Meanwhile, INTC's PEG ratio is currently 1.97. This popular metric is similar to the widely-known P/E ratio, with the difference being that the PEG ratio also takes into account the company's expected earnings growth rate. The Semiconductor - General was holding an average PEG ratio of 2.49 at yesterday's closing price.
The Semiconductor - General industry is part of the Computer and Technology sector. This industry currently has a Zacks Industry Rank of 18, which puts it in the top 8% of all 250+ industries.
The Zacks Industry Rank gauges the strength of our individual industry groups by measuring the average Zacks Rank of the individual stocks within the groups. Our research shows that the top 50% rated industries outperform the bottom half by a factor of 2 to 1.
Make sure to utilize Zacks.com to follow all of these stock-moving metrics, and more, in the coming trading sessions.

Infrastructure Stock Boom to Sweep America
A massive push to rebuild the crumbling U.S. infrastructure will soon be underway. It’s bipartisan, urgent, and inevitable. Trillions will be spent. Fortunes will be made.
The only question is “Will you get into the right stocks early when their growth potential is greatest?”
Zacks has released a Special Report to help you do just that, and today it’s free.Discover 5 special companies that look to gain the most from construction and repair to roads, bridges, and buildings, plus cargo hauling and energy transformation on an almost unimaginable scale.
Download FREE: How To Profit From Trillions On Spending For Infrastructure >>

Want the latest recommendations from Zacks Investment Research? Today, you can download 7 Best Stocks for the Next 30 Days. Click to get this free report
 
Intel Corporation (INTC): Free Stock Analysis Report
 
To read this article on Zacks.com click here.
 
Zacks Investment Research
The views and opinions expressed herein are the views and opinions of the author and do not necessarily reflect those of Nasdaq, Inc.","In the latest trading session, Intel (INTC) closed at $52.25, marking a +1.44% move from the previous day. Meanwhile, INTC's PEG ratio is currently 1.97. Intel Corporation (INTC): Free Stock Analysis Report","In the latest trading session, Intel (INTC) closed at $52.25, marking a +1.44% move from the previous day. Meanwhile, INTC's PEG ratio is currently 1.97. Intel Corporation (INTC): Free Stock Analysis Report","In the latest trading session, Intel (INTC) closed at $52.25, marking a +1.44% move from the previous day. Meanwhile, INTC's PEG ratio is currently 1.97. Intel Corporation (INTC): Free Stock Analysis Report","In the latest trading session, Intel (INTC) closed at $52.25, marking a +1.44% move from the previous day. Meanwhile, INTC's PEG ratio is currently 1.97. Intel Corporation (INTC): Free Stock Analysis Report",2022,3
2022-03-29 00:00:00+00:00,"Technology Sector Update for 03/29/2022: INTC,SSYS,LMT,QUMU,ESLT",INTC,https://www.nasdaq.com/articles/technology-sector-update-for-03-29-2022%3A-intcssyslmtqumueslt,,,"Technology stocks were surging late in Tuesday trading, with the SPDR Technology Select Sector ETF (XLK) rising 2.1% and the Philadelphia Semiconductor Index gaining 2.3% this afternoon.
In company news, Intel (INTC) was getting a late boost, rising 1.3%, amid a broader market rally and the chipmaker this afternoon also announcing plans to build an artificial intelligence incubator laboratory at Chandler Gilbert Community College near Phoenix, Arizona. The new lab will offer an associate degree program, with the company saying it wants to make the program available in all 50 US states by 2023.
Stratasys (SSYS) rose 7.4MT) and Metropolitan State University of Denver to generate qualification data for the companies' Antero 840CN03 thermoplastic composite material and allowing industry partners to produce space and aviation parts using Stratasys FDM 3D printers. Lockheed Martin shares were 1.8% lower this afternoon.
Qumu (QUMU) climbed 6% after the software firm said it was becoming an authorized reseller of LiveU video-streaming technology, adding to its existing portfolio of video storage, distribution and analytic tools for business customers. Financial terms of the new partnership were not disclosed.
Among decliners, Elbit Systems (ESLT) slid 8.1% after the Israeli security and defense contractor Tuesday reported non-GAAP Q4 net income of $2.14 per share, down from $2.38 per share during the same quarter in 2020 and lagging the Capital IQ expecting a $2.32 per share adjusted profit for the three months ended Dec. 31.
The views and opinions expressed herein are the views and opinions of the author and do not necessarily reflect those of Nasdaq, Inc.","In company news, Intel (INTC) was getting a late boost, rising 1.3%, amid a broader market rally and the chipmaker this afternoon also announcing plans to build an artificial intelligence incubator laboratory at Chandler Gilbert Community College near Phoenix, Arizona. Stratasys (SSYS) rose 7.4MT) and Metropolitan State University of Denver to generate qualification data for the companies' Antero 840CN03 thermoplastic composite material and allowing industry partners to produce space and aviation parts using Stratasys FDM 3D printers. Qumu (QUMU) climbed 6% after the software firm said it was becoming an authorized reseller of LiveU video-streaming technology, adding to its existing portfolio of video storage, distribution and analytic tools for business customers.","In company news, Intel (INTC) was getting a late boost, rising 1.3%, amid a broader market rally and the chipmaker this afternoon also announcing plans to build an artificial intelligence incubator laboratory at Chandler Gilbert Community College near Phoenix, Arizona. Qumu (QUMU) climbed 6% after the software firm said it was becoming an authorized reseller of LiveU video-streaming technology, adding to its existing portfolio of video storage, distribution and analytic tools for business customers. The views and opinions expressed herein are the views and opinions of the author and do not necessarily reflect those of Nasdaq, Inc.","In company news, Intel (INTC) was getting a late boost, rising 1.3%, amid a broader market rally and the chipmaker this afternoon also announcing plans to build an artificial intelligence incubator laboratory at Chandler Gilbert Community College near Phoenix, Arizona. Stratasys (SSYS) rose 7.4MT) and Metropolitan State University of Denver to generate qualification data for the companies' Antero 840CN03 thermoplastic composite material and allowing industry partners to produce space and aviation parts using Stratasys FDM 3D printers. Among decliners, Elbit Systems (ESLT) slid 8.1% after the Israeli security and defense contractor Tuesday reported non-GAAP Q4 net income of $2.14 per share, down from $2.38 per share during the same quarter in 2020 and lagging the Capital IQ expecting a $2.32 per share adjusted profit for the three months ended Dec. 31.","In company news, Intel (INTC) was getting a late boost, rising 1.3%, amid a broader market rally and the chipmaker this afternoon also announcing plans to build an artificial intelligence incubator laboratory at Chandler Gilbert Community College near Phoenix, Arizona. Technology stocks were surging late in Tuesday trading, with the SPDR Technology Select Sector ETF (XLK) rising 2.1% and the Philadelphia Semiconductor Index gaining 2.3% this afternoon. The new lab will offer an associate degree program, with the company saying it wants to make the program available in all 50 US states by 2023.",2022,4
2022-03-29 00:00:00+00:00,INTC Crosses Above Key Moving Average Level,INTC,https://www.nasdaq.com/articles/intc-crosses-above-key-moving-average-level,,,"In trading on Tuesday, shares of Intel Corp (Symbol: INTC) crossed above their 200 day moving average of $51.98, changing hands as high as $52.06 per share. Intel Corp shares are currently trading trading flat on the day. The chart below shows the one year performance of INTC shares, versus its 200 day moving average:
Looking at the chart above, INTC's low point in its 52 week range is $43.625 per share, with $68.49 as the 52 week high point — that compares with a last trade of $51.45. The INTC DMA information above was sourced from TechnicalAnalysisChannel.com
Click here to find out which 9 other dividend stocks recently crossed above their 200 day moving average »
The views and opinions expressed herein are the views and opinions of the author and do not necessarily reflect those of Nasdaq, Inc.","In trading on Tuesday, shares of Intel Corp (Symbol: INTC) crossed above their 200 day moving average of $51.98, changing hands as high as $52.06 per share. The chart below shows the one year performance of INTC shares, versus its 200 day moving average: Looking at the chart above, INTC's low point in its 52 week range is $43.625 per share, with $68.49 as the 52 week high point — that compares with a last trade of $51.45. The INTC DMA information above was sourced from TechnicalAnalysisChannel.com Click here to find out which 9 other dividend stocks recently crossed above their 200 day moving average » The views and opinions expressed herein are the views and opinions of the author and do not necessarily reflect those of Nasdaq, Inc.","In trading on Tuesday, shares of Intel Corp (Symbol: INTC) crossed above their 200 day moving average of $51.98, changing hands as high as $52.06 per share. The chart below shows the one year performance of INTC shares, versus its 200 day moving average: Looking at the chart above, INTC's low point in its 52 week range is $43.625 per share, with $68.49 as the 52 week high point — that compares with a last trade of $51.45. The INTC DMA information above was sourced from TechnicalAnalysisChannel.com Click here to find out which 9 other dividend stocks recently crossed above their 200 day moving average » The views and opinions expressed herein are the views and opinions of the author and do not necessarily reflect those of Nasdaq, Inc.","In trading on Tuesday, shares of Intel Corp (Symbol: INTC) crossed above their 200 day moving average of $51.98, changing hands as high as $52.06 per share. The chart below shows the one year performance of INTC shares, versus its 200 day moving average: Looking at the chart above, INTC's low point in its 52 week range is $43.625 per share, with $68.49 as the 52 week high point — that compares with a last trade of $51.45. The INTC DMA information above was sourced from TechnicalAnalysisChannel.com Click here to find out which 9 other dividend stocks recently crossed above their 200 day moving average » The views and opinions expressed herein are the views and opinions of the author and do not necessarily reflect those of Nasdaq, Inc.","In trading on Tuesday, shares of Intel Corp (Symbol: INTC) crossed above their 200 day moving average of $51.98, changing hands as high as $52.06 per share. The chart below shows the one year performance of INTC shares, versus its 200 day moving average: Looking at the chart above, INTC's low point in its 52 week range is $43.625 per share, with $68.49 as the 52 week high point — that compares with a last trade of $51.45. The INTC DMA information above was sourced from TechnicalAnalysisChannel.com Click here to find out which 9 other dividend stocks recently crossed above their 200 day moving average » The views and opinions expressed herein are the views and opinions of the author and do not necessarily reflect those of Nasdaq, Inc.",2022,3
