Date,Article_title,Stock_symbol,Url,Publisher,Author,Article,Lsa_summary,Luhn_summary,Textrank_summary,Lexrank_summary,Year,sentiment_score
2022-12-16 00:00:00+00:00,"IYW, IBM, INTU, INTC: Large Outflows Detected at ETF",INTC,https://www.nasdaq.com/articles/iyw-ibm-intu-intc%3A-large-outflows-detected-at-etf,,,"Looking today at week-over-week shares outstanding changes among the universe of ETFs covered at ETF Channel, one standout is the iShares U.S. Technology ETF (Symbol: IYW) where we have detected an approximate $92.5 million dollar outflow -- that's a 1.1% decrease week over week (from 105,650,000 to 104,450,000). Among the largest underlying components of IYW, in trading today International Business Machines Corp (Symbol: IBM) is off about 1.7%, Intuit Inc (Symbol: INTU) is off about 2.4%, and Intel Corp (Symbol: INTC) is lower by about 1.7%. For a complete list of holdings, visit the IYW Holdings page » The chart below shows the one year price performance of IYW, versus its 200 day moving average:
Looking at the chart above, IYW's low point in its 52 week range is $69.49 per share, with $117.36 as the 52 week high point — that compares with a last trade of $76.38. Comparing the most recent share price to the 200 day moving average can also be a useful technical analysis technique -- learn more about the 200 day moving average ».
Exchange traded funds (ETFs) trade just like stocks, but instead of ''shares'' investors are actually buying and selling ''units''. These ''units'' can be traded back and forth just like stocks, but can also be created or destroyed to accommodate investor demand. Each week we monitor the week-over-week change in shares outstanding data, to keep a lookout for those ETFs experiencing notable inflows (many new units created) or outflows (many old units destroyed). Creation of new units will mean the underlying holdings of the ETF need to be purchased, while destruction of units involves selling underlying holdings, so large flows can also impact the individual components held within ETFs.
Click here to find out which 9 other ETFs experienced notable outflows »
Also see:
 APA market cap history
 Top Ten Hedge Funds Holding CLSC
 Institutional Holders of SPMD
The views and opinions expressed herein are the views and opinions of the author and do not necessarily reflect those of Nasdaq, Inc.","Among the largest underlying components of IYW, in trading today International Business Machines Corp (Symbol: IBM) is off about 1.7%, Intuit Inc (Symbol: INTU) is off about 2.4%, and Intel Corp (Symbol: INTC) is lower by about 1.7%. These ''units'' can be traded back and forth just like stocks, but can also be created or destroyed to accommodate investor demand. Creation of new units will mean the underlying holdings of the ETF need to be purchased, while destruction of units involves selling underlying holdings, so large flows can also impact the individual components held within ETFs.","Among the largest underlying components of IYW, in trading today International Business Machines Corp (Symbol: IBM) is off about 1.7%, Intuit Inc (Symbol: INTU) is off about 2.4%, and Intel Corp (Symbol: INTC) is lower by about 1.7%. For a complete list of holdings, visit the IYW Holdings page » The chart below shows the one year price performance of IYW, versus its 200 day moving average: Looking at the chart above, IYW's low point in its 52 week range is $69.49 per share, with $117.36 as the 52 week high point — that compares with a last trade of $76.38. Each week we monitor the week-over-week change in shares outstanding data, to keep a lookout for those ETFs experiencing notable inflows (many new units created) or outflows (many old units destroyed).","Among the largest underlying components of IYW, in trading today International Business Machines Corp (Symbol: IBM) is off about 1.7%, Intuit Inc (Symbol: INTU) is off about 2.4%, and Intel Corp (Symbol: INTC) is lower by about 1.7%. Looking today at week-over-week shares outstanding changes among the universe of ETFs covered at ETF Channel, one standout is the iShares U.S. Technology ETF (Symbol: IYW) where we have detected an approximate $92.5 million dollar outflow -- that's a 1.1% decrease week over week (from 105,650,000 to 104,450,000). For a complete list of holdings, visit the IYW Holdings page » The chart below shows the one year price performance of IYW, versus its 200 day moving average: Looking at the chart above, IYW's low point in its 52 week range is $69.49 per share, with $117.36 as the 52 week high point — that compares with a last trade of $76.38.","Among the largest underlying components of IYW, in trading today International Business Machines Corp (Symbol: IBM) is off about 1.7%, Intuit Inc (Symbol: INTU) is off about 2.4%, and Intel Corp (Symbol: INTC) is lower by about 1.7%. Looking today at week-over-week shares outstanding changes among the universe of ETFs covered at ETF Channel, one standout is the iShares U.S. Technology ETF (Symbol: IYW) where we have detected an approximate $92.5 million dollar outflow -- that's a 1.1% decrease week over week (from 105,650,000 to 104,450,000). For a complete list of holdings, visit the IYW Holdings page » The chart below shows the one year price performance of IYW, versus its 200 day moving average: Looking at the chart above, IYW's low point in its 52 week range is $69.49 per share, with $117.36 as the 52 week high point — that compares with a last trade of $76.38.",2022,3
2022-12-16 00:00:00+00:00,Alphabet (GOOGL) Bolsters Waymo Efforts With Latest Move (Revised),INTC,https://www.nasdaq.com/articles/alphabet-googl-bolsters-waymo-efforts-with-latest-move-revised,,,"Alphabet’s GOOGL self-driving unit Waymo, which has been running well on the streets of San Francisco, CA on the back of its Early Rider program called Trusted Tester, has now applied for a final permit in California at the California Public Utilities Commission.

With the help of this final permit, Waymo will be able to sell its self-driving car rides in San Francisco.

Notably, the latest application by Waymo might take months to get approved.

The latest move bodes well for the company’s deepening focus on making its autonomous vehicles popular in San Francisco.

Recently, Waymo started welcoming people to hail a ride in a self-driving Jaguar I-Pace. Booking for pickups is available via the Waymo One app.

Waymo’s arrival in San Francisco marks its very first expansion outside Phoenix, AZ.
Alphabet Inc. Price and Consensus
Alphabet Inc. price-consensus-chart | Alphabet Inc. Quote
Expanding Waymo Efforts
The recent step is in sync with the company’s strengthening efforts toward expanding its operations and fleet and making the vehicles more rider-friendly.

The company is also gearing up to make its ride-hailing vehicles fully driverless on the streets of San Francisco.

Further, Waymo in Bellevue marks Alphabet’s second Waymo expansion outside Phoenix, AZ.

Waymo launched a rider-only service in downtown Phoenix, where it has been operating its autonomous vehicles with a company specialist seated in the driver's seat until now. The service in downtown Phoenix will be confined to a specific area, which is constrained by Interstate 17 on the west and south, Camelback Road on the north and 44th Street on the east.

Waymo plans to roll out the driverless robotaxi service to regular passengers and expand its operating area eventually in downtown Phoenix.

Apart from these efforts, Alphabet’s partnership with Geely, a China-based automotive company, remains noteworthy. Per the terms of the deal, Geely’s electric mobility brand, Zeekr, will design and develop electric vehicles for Waymo, into which Waymo Driver will be integrated.

The vehicles will be introduced on the roads of the United States first. With the Geely partnership, Waymo will expand its Waymo One fleet.

The above-mentioned endeavors will help Alphabet further penetrate the booming autonomous driving space.

According to a Fortune Business Insights report, the global autonomous car market is expected to reach $11.03 billion by 2028, with a CAGR of 31.3% between 2021 and 2028.

Per a report by Mordor Intelligence, the worldwide driverless vehicle market is expected to see a CAGR of 18.06% between 2021 and 2026.

We believe that Alphabet’s growing prospects in this promising market will help it win investors’ confidence in the days ahead.

Coming to the price performance, Alphabet has lost 37.3% on a year-to-date basis against the industry’s decline of 36.5%.
Intensifying Competition
However, Alphabet which currently carries a Zacks Rank #4 (Sell), faces stiff competition from the companies like Intel INTC, Amazon AMZN and Baidu BIDU. These are also making every effort to capitalize on the growth prospects in the autonomous driving space.

You can see the complete list of today’s Zacks #1 Rank (Strong Buy) stocks here.

Intel is gaining from the low power consumption of Mobileye chips and the ability to create maps for self-driving systems. The company plans to introduce a pilot program for autonomous taxis and ride-hailing services in Munich and Tel Aviv in 2022.

In April 2022, the company gave a sneak peek at its robotaxi ride by rolling out a video of a 40-minute autonomous car ride around Jerusalem.

In addition to this, Mobileye’s partnership with German electric mobility unit Benteler EV Systems and Beep to develop and deploy self-driving, fully electric shuttles in the United States by 2024 remains noteworthy.

Amazon’s buyout of Zoox, a developer of autonomous ride-hailing vehicles, remains a major positive. The company’s launch of its first self-driving robotaxi strengthened its position in the autonomous driving space. Zoox also operates an engineering office and operations facility in Seattle. The facility acts as a base for its autonomous vehicle testing.

Currently, the company is gearing up to test its robotaxi in California. It has applied for a permit in California to test-drive its vehicles.

Meanwhile, Baidu is gaining from the strong momentum of Apollo Go Robotaxi service across China on the back of its increasing availability in several cities and a growing number of rides.

Apollo Go is available in 10 cities, namely Beijing, Shanghai, Guangzhou, Shenzhen, Chongqing, Changsha, Cangzhou, Yangquan, Wuzhen Water Town and Wuhan.

(We are reissuing this article to correct a mistake. The original article, issued on December 14, 2022, should no longer be relied upon.)
Zacks Top 10 Stocks for 2023
In addition to the investment ideas discussed above, would you like to know about our 10 top picks for the entirety of 2023? From inception in 2012 through November, the Zacks Top 10 Stocks portfolio has tripled the market, gaining an impressive +884.5% versus the S&P 500’s +287.4%.
Now our Director of Research is combing through 4,000 companies covered by the Zacks Rank to handpick the best 10 tickers to buy and hold. Don’t miss your chance to get in on these stocks when they’re released on January 3.
Be First to New Top 10 Stocks >>
Want the latest recommendations from Zacks Investment Research? Today, you can download 7 Best Stocks for the Next 30 Days. Click to get this free report
Amazon.com, Inc. (AMZN) : Free Stock Analysis Report
Intel Corporation (INTC) : Free Stock Analysis Report
Baidu, Inc. (BIDU) : Free Stock Analysis Report
Alphabet Inc. (GOOGL) : Free Stock Analysis Report
To read this article on Zacks.com click here.
Zacks Investment Research
The views and opinions expressed herein are the views and opinions of the author and do not necessarily reflect those of Nasdaq, Inc.","Intensifying Competition However, Alphabet which currently carries a Zacks Rank #4 (Sell), faces stiff competition from the companies like Intel INTC, Amazon AMZN and Baidu BIDU. Click to get this free report Amazon.com, Inc. (AMZN) : Free Stock Analysis Report Intel Corporation (INTC) : Free Stock Analysis Report Baidu, Inc. (BIDU) : Free Stock Analysis Report Alphabet Inc. (GOOGL) : Free Stock Analysis Report To read this article on Zacks.com click here. The service in downtown Phoenix will be confined to a specific area, which is constrained by Interstate 17 on the west and south, Camelback Road on the north and 44th Street on the east.","Intensifying Competition However, Alphabet which currently carries a Zacks Rank #4 (Sell), faces stiff competition from the companies like Intel INTC, Amazon AMZN and Baidu BIDU. Click to get this free report Amazon.com, Inc. (AMZN) : Free Stock Analysis Report Intel Corporation (INTC) : Free Stock Analysis Report Baidu, Inc. (BIDU) : Free Stock Analysis Report Alphabet Inc. (GOOGL) : Free Stock Analysis Report To read this article on Zacks.com click here. In addition to this, Mobileye’s partnership with German electric mobility unit Benteler EV Systems and Beep to develop and deploy self-driving, fully electric shuttles in the United States by 2024 remains noteworthy.","Click to get this free report Amazon.com, Inc. (AMZN) : Free Stock Analysis Report Intel Corporation (INTC) : Free Stock Analysis Report Baidu, Inc. (BIDU) : Free Stock Analysis Report Alphabet Inc. (GOOGL) : Free Stock Analysis Report To read this article on Zacks.com click here. Intensifying Competition However, Alphabet which currently carries a Zacks Rank #4 (Sell), faces stiff competition from the companies like Intel INTC, Amazon AMZN and Baidu BIDU. Alphabet Inc. Price and Consensus Alphabet Inc. price-consensus-chart | Alphabet Inc. Quote Expanding Waymo Efforts The recent step is in sync with the company’s strengthening efforts toward expanding its operations and fleet and making the vehicles more rider-friendly.","Intensifying Competition However, Alphabet which currently carries a Zacks Rank #4 (Sell), faces stiff competition from the companies like Intel INTC, Amazon AMZN and Baidu BIDU. Click to get this free report Amazon.com, Inc. (AMZN) : Free Stock Analysis Report Intel Corporation (INTC) : Free Stock Analysis Report Baidu, Inc. (BIDU) : Free Stock Analysis Report Alphabet Inc. (GOOGL) : Free Stock Analysis Report To read this article on Zacks.com click here. Alphabet Inc. Price and Consensus Alphabet Inc. price-consensus-chart | Alphabet Inc. Quote Expanding Waymo Efforts The recent step is in sync with the company’s strengthening efforts toward expanding its operations and fleet and making the vehicles more rider-friendly.",2022,2
