Date,Article_title,Stock_symbol,Url,Publisher,Author,Article,Lsa_summary,Luhn_summary,Textrank_summary,Lexrank_summary,Year,sentiment_score
2022-05-11 00:00:00+00:00,"After Hours Most Active for May 11, 2022 : QQQ, AAPL, TAL, PBR, LUMN, VTRS, INTC, UBER, MSFT, ERIC, DIS, ATUS",INTC,https://www.nasdaq.com/articles/after-hours-most-active-for-may-11-2022-%3A-qqq-aapl-tal-pbr-lumn-vtrs-intc-uber-msft-eric,,,"The NASDAQ 100 After Hours Indicator is up 33.51 to 12,001.07. The total After hours volume is currently 112,215,916 shares traded.

The following are the most active stocks for the after hours session:

Invesco QQQ Trust, Series 1 (QQQ) is +0.86 at $292.70, with 5,256,709 shares traded., following a 52-week high recorded in today's regular session.

Apple Inc. (AAPL) is +0.27 at $146.77, with 4,488,812 shares traded. Over the last four weeks they have had 5 up revisions for the earnings forecast, for the fiscal quarter ending Mar 2023. The consensus EPS forecast is $1.56. As reported by Zacks, the current mean recommendation for AAPL is in the ""buy range"".

TAL Education Group (TAL) is -0.01 at $3.36, with 4,103,924 shares traded. TAL's current last sale is 76.36% of the target price of $4.4.

Petroleo Brasileiro S.A.- Petrobras (PBR) is +0.03 at $14.11, with 3,876,035 shares traded. PBR's current last sale is 86.83% of the target price of $16.25.

Lumen Technologies, Inc. (LUMN) is -0.06 at $10.55, with 3,338,088 shares traded. Over the last four weeks they have had 3 up revisions for the earnings forecast, for the fiscal quarter ending Jun 2022. The consensus EPS forecast is $0.45. LUMN's current last sale is 95.91% of the target price of $11.

Viatris Inc. (VTRS) is unchanged at $10.39, with 3,110,998 shares traded. Over the last four weeks they have had 3 up revisions for the earnings forecast, for the fiscal quarter ending Dec 2022. The consensus EPS forecast is $0.88. VTRS's current last sale is 76.96% of the target price of $13.5.

Intel Corporation (INTC) is +0.11 at $42.94, with 3,009,728 shares traded. Over the last four weeks they have had 7 up revisions for the earnings forecast, for the fiscal quarter ending Sep 2022. The consensus EPS forecast is $0.92. , following a 52-week high recorded in today's regular session.

Uber Technologies, Inc. (UBER) is +0.12 at $22.69, with 2,963,843 shares traded. Over the last four weeks they have had 4 up revisions for the earnings forecast, for the fiscal quarter ending Jun 2022. The consensus EPS forecast is $-0.25. , following a 52-week high recorded in today's regular session.

Microsoft Corporation (MSFT) is unchanged at $260.55, with 2,821,158 shares traded. Over the last four weeks they have had 3 up revisions for the earnings forecast, for the fiscal quarter ending Jun 2022. The consensus EPS forecast is $2.33. As reported by Zacks, the current mean recommendation for MSFT is in the ""buy range"".

Ericsson (ERIC) is unchanged at $7.46, with 2,636,453 shares traded., following a 52-week high recorded in today's regular session.

Walt Disney Company (The) (DIS) is +2.99 at $108.20, with 2,597,426 shares traded., following a 52-week high recorded in today's regular session.

Altice USA, Inc. (ATUS) is +0.13 at $8.90, with 2,534,896 shares traded., following a 52-week high recorded in today's regular session.
The views and opinions expressed herein are the views and opinions of the author and do not necessarily reflect those of Nasdaq, Inc.","Intel Corporation (INTC) is +0.11 at $42.94, with 3,009,728 shares traded. Ericsson (ERIC) is unchanged at $7.46, with 2,636,453 shares traded., following a 52-week high recorded in today's regular session. Walt Disney Company (The) (DIS) is +2.99 at $108.20, with 2,597,426 shares traded., following a 52-week high recorded in today's regular session.","Over the last four weeks they have had 3 up revisions for the earnings forecast, for the fiscal quarter ending Jun 2022. Intel Corporation (INTC) is +0.11 at $42.94, with 3,009,728 shares traded. Over the last four weeks they have had 4 up revisions for the earnings forecast, for the fiscal quarter ending Jun 2022.","Intel Corporation (INTC) is +0.11 at $42.94, with 3,009,728 shares traded. Invesco QQQ Trust, Series 1 (QQQ) is +0.86 at $292.70, with 5,256,709 shares traded., following a 52-week high recorded in today's regular session. Ericsson (ERIC) is unchanged at $7.46, with 2,636,453 shares traded., following a 52-week high recorded in today's regular session.","Intel Corporation (INTC) is +0.11 at $42.94, with 3,009,728 shares traded. Apple Inc. (AAPL) is +0.27 at $146.77, with 4,488,812 shares traded. TAL's current last sale is 76.36% of the target price of $4.4.",2022,3
2022-05-11 00:00:00+00:00,More Delays Are Incoming for This Semiconductor Giant,INTC,https://www.nasdaq.com/articles/more-delays-are-incoming-for-this-semiconductor-giant,,,"The market sell-off continues to affect the semiconductor industry. On Monday, May 9, some popular names were down over 9%. Today's video focuses on recent news affecting Intel (NASDAQ: INTC), Nvidia (NASDAQ: NVDA), and Advanced Micro Devices (NASDAQ: AMD). Here are some highlights.
Intel has recently entered the discrete graphics card market with its Arc Alchemist gaming cards. In the first quarter of 2022, it released Arc to various laptops, and in the second quarter of 2022, it was supposed to release graphics cards for the desktop market. Unfortunately, the desktop graphics cards have been pushed to the summer of 2022, and laptops with Arc are very hard to find as it seems there is a very low supply.
Intel is also entering the high-performance computing market with its Ponte Vecchio graphics card. During Intel'searnings call management confirmed that it had started testing the product with customers. Intel has not shown much revenue growth in the past, but maybe this new market could be the catalyst that triggers growth for the company.
On May 6, the SEC charged Nvidia with a $5.5 million fine due to Nvidia providing inadequate disclosures about the impact of crypto mining on its revenue. The penalties were for two 10-Q forms for its fiscal year 2018, where Nvidia did not disclose that its gaming business sales were driven significantly by crypto mining.
*Stock prices used were the closing prices of May 9, 2022. The video was published on May 9, 2022.

10 stocks we like better than Intel
When our award-winning analyst team has a stock tip, it can pay to listen. After all, the newsletter they have run for over a decade, Motley Fool Stock Advisor, has tripled the market.*
They just revealed what they believe are the ten best stocks for investors to buy right now... and Intel wasn't one of them! That's right -- they think these 10 stocks are even better buys.
See the 10 stocks
*Stock Advisor returns as of April 7, 2022

Jose Najarro has positions in Advanced Micro Devices and Nvidia. The Motley Fool has positions in and recommends Advanced Micro Devices, Intel, and Nvidia. The Motley Fool recommends the following options: long January 2023 $57.50 calls on Intel and short January 2023 $57.50 puts on Intel. The Motley Fool has a disclosure policy. Jose is an affiliate of The Motley Fool and may be compensated for promoting its services. If you choose to subscribe through his link, he will earn some extra money that supports his channel. His opinions remain his own and are unaffected by The Motley Fool.
The views and opinions expressed herein are the views and opinions of the author and do not necessarily reflect those of Nasdaq, Inc.","Today's video focuses on recent news affecting Intel (NASDAQ: INTC), Nvidia (NASDAQ: NVDA), and Advanced Micro Devices (NASDAQ: AMD). Unfortunately, the desktop graphics cards have been pushed to the summer of 2022, and laptops with Arc are very hard to find as it seems there is a very low supply. Intel is also entering the high-performance computing market with its Ponte Vecchio graphics card.","Today's video focuses on recent news affecting Intel (NASDAQ: INTC), Nvidia (NASDAQ: NVDA), and Advanced Micro Devices (NASDAQ: AMD). Intel has recently entered the discrete graphics card market with its Arc Alchemist gaming cards. The Motley Fool has positions in and recommends Advanced Micro Devices, Intel, and Nvidia.","Today's video focuses on recent news affecting Intel (NASDAQ: INTC), Nvidia (NASDAQ: NVDA), and Advanced Micro Devices (NASDAQ: AMD). The Motley Fool has positions in and recommends Advanced Micro Devices, Intel, and Nvidia. The Motley Fool recommends the following options: long January 2023 $57.50 calls on Intel and short January 2023 $57.50 puts on Intel.","Today's video focuses on recent news affecting Intel (NASDAQ: INTC), Nvidia (NASDAQ: NVDA), and Advanced Micro Devices (NASDAQ: AMD). The Motley Fool has positions in and recommends Advanced Micro Devices, Intel, and Nvidia. The Motley Fool has a disclosure policy.",2022,3
2022-05-11 00:00:00+00:00,"Notable ETF Outflow Detected - SOXX, AMD, INTC, QCOM",INTC,https://www.nasdaq.com/articles/notable-etf-outflow-detected-soxx-amd-intc-qcom,,,"Looking today at week-over-week shares outstanding changes among the universe of ETFs covered at ETF Channel, one standout is the iShares Semiconductor ETF (Symbol: SOXX) where we have detected an approximate $158.8 million dollar outflow -- that's a 2.2% decrease week over week (from 18,600,000 to 18,200,000). Among the largest underlying components of SOXX, in trading today Advanced Micro Devices Inc (Symbol: AMD) is up about 3.9%, Intel Corp (Symbol: INTC) is down about 0.2%, and Qualcomm Inc (Symbol: QCOM) is higher by about 0.4%. For a complete list of holdings, visit the SOXX Holdings page » The chart below shows the one year price performance of SOXX, versus its 200 day moving average:
Looking at the chart above, SOXX's low point in its 52 week range is $385.99 per share, with $559.02 as the 52 week high point — that compares with a last trade of $400.76. Comparing the most recent share price to the 200 day moving average can also be a useful technical analysis technique -- learn more about the 200 day moving average ».
Exchange traded funds (ETFs) trade just like stocks, but instead of ''shares'' investors are actually buying and selling ''units''. These ''units'' can be traded back and forth just like stocks, but can also be created or destroyed to accommodate investor demand. Each week we monitor the week-over-week change in shares outstanding data, to keep a lookout for those ETFs experiencing notable inflows (many new units created) or outflows (many old units destroyed). Creation of new units will mean the underlying holdings of the ETF need to be purchased, while destruction of units involves selling underlying holdings, so large flows can also impact the individual components held within ETFs.
Click here to find out which 9 other ETFs experienced notable outflows »
The views and opinions expressed herein are the views and opinions of the author and do not necessarily reflect those of Nasdaq, Inc.","Among the largest underlying components of SOXX, in trading today Advanced Micro Devices Inc (Symbol: AMD) is up about 3.9%, Intel Corp (Symbol: INTC) is down about 0.2%, and Qualcomm Inc (Symbol: QCOM) is higher by about 0.4%. For a complete list of holdings, visit the SOXX Holdings page » The chart below shows the one year price performance of SOXX, versus its 200 day moving average: Looking at the chart above, SOXX's low point in its 52 week range is $385.99 per share, with $559.02 as the 52 week high point — that compares with a last trade of $400.76. These ''units'' can be traded back and forth just like stocks, but can also be created or destroyed to accommodate investor demand.","Among the largest underlying components of SOXX, in trading today Advanced Micro Devices Inc (Symbol: AMD) is up about 3.9%, Intel Corp (Symbol: INTC) is down about 0.2%, and Qualcomm Inc (Symbol: QCOM) is higher by about 0.4%. For a complete list of holdings, visit the SOXX Holdings page » The chart below shows the one year price performance of SOXX, versus its 200 day moving average: Looking at the chart above, SOXX's low point in its 52 week range is $385.99 per share, with $559.02 as the 52 week high point — that compares with a last trade of $400.76. Each week we monitor the week-over-week change in shares outstanding data, to keep a lookout for those ETFs experiencing notable inflows (many new units created) or outflows (many old units destroyed).","Among the largest underlying components of SOXX, in trading today Advanced Micro Devices Inc (Symbol: AMD) is up about 3.9%, Intel Corp (Symbol: INTC) is down about 0.2%, and Qualcomm Inc (Symbol: QCOM) is higher by about 0.4%. Looking today at week-over-week shares outstanding changes among the universe of ETFs covered at ETF Channel, one standout is the iShares Semiconductor ETF (Symbol: SOXX) where we have detected an approximate $158.8 million dollar outflow -- that's a 2.2% decrease week over week (from 18,600,000 to 18,200,000). For a complete list of holdings, visit the SOXX Holdings page » The chart below shows the one year price performance of SOXX, versus its 200 day moving average: Looking at the chart above, SOXX's low point in its 52 week range is $385.99 per share, with $559.02 as the 52 week high point — that compares with a last trade of $400.76.","Among the largest underlying components of SOXX, in trading today Advanced Micro Devices Inc (Symbol: AMD) is up about 3.9%, Intel Corp (Symbol: INTC) is down about 0.2%, and Qualcomm Inc (Symbol: QCOM) is higher by about 0.4%. Looking today at week-over-week shares outstanding changes among the universe of ETFs covered at ETF Channel, one standout is the iShares Semiconductor ETF (Symbol: SOXX) where we have detected an approximate $158.8 million dollar outflow -- that's a 2.2% decrease week over week (from 18,600,000 to 18,200,000). For a complete list of holdings, visit the SOXX Holdings page » The chart below shows the one year price performance of SOXX, versus its 200 day moving average: Looking at the chart above, SOXX's low point in its 52 week range is $385.99 per share, with $559.02 as the 52 week high point — that compares with a last trade of $400.76.",2022,3
2022-05-11 00:00:00+00:00,Should You Invest in the SPDR NYSE Technology ETF (XNTK)?,INTC,https://www.nasdaq.com/articles/should-you-invest-in-the-spdr-nyse-technology-etf-xntk-0,,,"Designed to provide broad exposure to the Technology - Broad segment of the equity market, the SPDR NYSE Technology ETF (XNTK) is a passively managed exchange traded fund launched on 09/25/2000.
While an excellent vehicle for long term investors, passively managed ETFs are a popular choice among institutional and retail investors due to their low costs, transparency, flexibility, and tax efficiency.
Additionally, sector ETFs offer convenient ways to gain low risk and diversified exposure to a broad group of companies in particular sectors. Technology - Broad is one of the 16 broad Zacks sectors within the Zacks Industry classification. It is currently ranked 6, placing it in top 38%.
Index Details
The fund is sponsored by State Street Global Advisors. It has amassed assets over $429.09 million, making it one of the average sized ETFs attempting to match the performance of the Technology - Broad segment of the equity market. XNTK seeks to match the performance of the NYSE Technology Index before fees and expenses.
The NYSE Technology Index is composed of 35 leading U.S.-listed technology-related companies.
Costs
Expense ratios are an important factor in the return of an ETF and in the long term, cheaper funds can significantly outperform their more expensive counterparts, other things remaining the same.
Annual operating expenses for this ETF are 0.35%, making it one of the least expensive products in the space.
It has a 12-month trailing dividend yield of 0.47%.
Sector Exposure and Top Holdings
It is important to delve into an ETF's holdings before investing despite the many upsides to these kinds of funds like diversified exposure, which minimizes single stock risk. And, most ETFs are very transparent products that disclose their holdings on a daily basis.
This ETF has heaviest allocation in the Information Technology sector--about 67.20% of the portfolio. Consumer Discretionary and Telecom round out the top three.
Looking at individual holdings, Micron Technology Inc. (MU) accounts for about 3.74% of total assets, followed by International Business Machines Corporation (IBM) and Intel Corporation (INTC).
The top 10 holdings account for about 33.89% of total assets under management.
Performance and Risk
The ETF has lost about -33.96% so far this year and is down about -21.20% in the last one year (as of 05/11/2022). In that past 52-week period, it has traded between $109.42 and $175.28.
The ETF has a beta of 1.19 and standard deviation of 31.64% for the trailing three-year period. With about 36 holdings, it has more concentrated exposure than peers.
Alternatives
SPDR NYSE Technology ETF holds a Zacks ETF Rank of 1 (Strong Buy), which is based on expected asset class return, expense ratio, and momentum, among other factors. Because of this, XNTK is an excellent option for investors seeking exposure to the Technology ETFs segment of the market. There are other additional ETFs in the space that investors could consider as well.
Technology Select Sector SPDR ETF (XLK) tracks Technology Select Sector Index and the Vanguard Information Technology ETF (VGT) tracks MSCI US Investable Market Information Technology 25/50 Index. Technology Select Sector SPDR ETF has $41.31 billion in assets, Vanguard Information Technology ETF has $42.92 billion. XLK has an expense ratio of 0.10% and VGT charges 0.10%.
Bottom Line
To learn more about this product and other ETFs, screen for products that match your investment objectives and read articles on latest developments in the ETF investing universe, please visit Zacks ETF Center.

Want key ETF info delivered straight to your inbox?
Zacks’ free Fund Newsletter will brief you on top news and analysis, as well as top-performing ETFs, each week.
Get it free >>

Want the latest recommendations from Zacks Investment Research? Today, you can download 7 Best Stocks for the Next 30 Days. Click to get this free report
 
SPDR NYSE Technology ETF (XNTK): ETF Research Reports
 
Intel Corporation (INTC): Free Stock Analysis Report
 
International Business Machines Corporation (IBM): Free Stock Analysis Report
 
Micron Technology, Inc. (MU): Free Stock Analysis Report
 
Technology Select Sector SPDR ETF (XLK): ETF Research Reports
 
Vanguard Information Technology ETF (VGT): ETF Research Reports
 
To read this article on Zacks.com click here.
The views and opinions expressed herein are the views and opinions of the author and do not necessarily reflect those of Nasdaq, Inc.","Looking at individual holdings, Micron Technology Inc. (MU) accounts for about 3.74% of total assets, followed by International Business Machines Corporation (IBM) and Intel Corporation (INTC). Intel Corporation (INTC): Free Stock Analysis Report It has amassed assets over $429.09 million, making it one of the average sized ETFs attempting to match the performance of the Technology - Broad segment of the equity market.","Looking at individual holdings, Micron Technology Inc. (MU) accounts for about 3.74% of total assets, followed by International Business Machines Corporation (IBM) and Intel Corporation (INTC). Intel Corporation (INTC): Free Stock Analysis Report Designed to provide broad exposure to the Technology - Broad segment of the equity market, the SPDR NYSE Technology ETF (XNTK) is a passively managed exchange traded fund launched on 09/25/2000.","Looking at individual holdings, Micron Technology Inc. (MU) accounts for about 3.74% of total assets, followed by International Business Machines Corporation (IBM) and Intel Corporation (INTC). Intel Corporation (INTC): Free Stock Analysis Report Technology Select Sector SPDR ETF (XLK) tracks Technology Select Sector Index and the Vanguard Information Technology ETF (VGT) tracks MSCI US Investable Market Information Technology 25/50 Index.","Looking at individual holdings, Micron Technology Inc. (MU) accounts for about 3.74% of total assets, followed by International Business Machines Corporation (IBM) and Intel Corporation (INTC). Intel Corporation (INTC): Free Stock Analysis Report XNTK seeks to match the performance of the NYSE Technology Index before fees and expenses.",2022,3
2022-05-10 00:00:00+00:00,"Intel launches new AI chips, challenging Nvidia's market",INTC,https://www.nasdaq.com/articles/intel-launches-new-ai-chips-challenging-nvidias-market,,,"By Steven Scheer and Jane Lanhee Lee
JERUSALEM/SAN FRANCISCO, May 10 (Reuters) - Intel Corp INTC.O on Tuesday launched a new chip called Gaudi2 focused on artificial intelligence computing, as the chip manufacturer makes a bigger push into the AI chip market currently dominated by Nvidia Corp NVDA.O.
Gaudi2 is the second generation processor by Habana Labs, an Israeli AI chip startup Intel bought in late 2019 for about $2 billion. AI chip startups have been getting huge investments in recent years as AI computing is one of the fastest growing areas for data centers.
Prying market share away from Nvidia has been a challenge as many AI researchers and companies have been accustomed to using Nvidia’s software platform CUDA. So in addition to new chips for AI computing, Intel told Reuters it has been focusing on its software development.
“CUDA is not a moat that Nvidia can really stand on for long,” said chief business officer at Habana Labs Eitan Medina, adding that Intel’s software platform is open standard, free to download and use from GitHub, the software development site. “Now the question is who can do the work efficiently?”
Medina said the Gaudi2 was twice as fast as Habana's previous AI chip and manufactured at Taiwan Semiconductor Manufacturing Co’s 2330.TW 7-nanometer transistor technology from 16-nanometers previously. Generally the smaller the transistor size, the faster and more powerful the chip is.
Intel also launched a new chip called Greco for inferencing work: taking an AI algorithm and making a prediction or identifying an object.
Sandra Rivera, who heads Intel's data center and AI, said the AI chip market is estimated to grow some 25% a year in the next five years to reach around $50 billion. ""We intend to invest and innovate to lead this market,” she said, adding that increasingly the investments will be in software, both for expanding Intel's team and buying other companies.
(Reporting By Steven Scheer in Jerusalem and Jane Lanhee Lee in San Francisco; Editing by David Gregorio)
((jane.lee@thomsonreuters.com; +1-415-344-3912; Reuters Messaging: jane.lee.thomsonreuters@reuters.net))
The views and opinions expressed herein are the views and opinions of the author and do not necessarily reflect those of Nasdaq, Inc.","By Steven Scheer and Jane Lanhee Lee JERUSALEM/SAN FRANCISCO, May 10 (Reuters) - Intel Corp INTC.O on Tuesday launched a new chip called Gaudi2 focused on artificial intelligence computing, as the chip manufacturer makes a bigger push into the AI chip market currently dominated by Nvidia Corp NVDA.O. Gaudi2 is the second generation processor by Habana Labs, an Israeli AI chip startup Intel bought in late 2019 for about $2 billion. So in addition to new chips for AI computing, Intel told Reuters it has been focusing on its software development.","By Steven Scheer and Jane Lanhee Lee JERUSALEM/SAN FRANCISCO, May 10 (Reuters) - Intel Corp INTC.O on Tuesday launched a new chip called Gaudi2 focused on artificial intelligence computing, as the chip manufacturer makes a bigger push into the AI chip market currently dominated by Nvidia Corp NVDA.O. “CUDA is not a moat that Nvidia can really stand on for long,” said chief business officer at Habana Labs Eitan Medina, adding that Intel’s software platform is open standard, free to download and use from GitHub, the software development site. Sandra Rivera, who heads Intel's data center and AI, said the AI chip market is estimated to grow some 25% a year in the next five years to reach around $50 billion.","By Steven Scheer and Jane Lanhee Lee JERUSALEM/SAN FRANCISCO, May 10 (Reuters) - Intel Corp INTC.O on Tuesday launched a new chip called Gaudi2 focused on artificial intelligence computing, as the chip manufacturer makes a bigger push into the AI chip market currently dominated by Nvidia Corp NVDA.O. AI chip startups have been getting huge investments in recent years as AI computing is one of the fastest growing areas for data centers. Sandra Rivera, who heads Intel's data center and AI, said the AI chip market is estimated to grow some 25% a year in the next five years to reach around $50 billion.","By Steven Scheer and Jane Lanhee Lee JERUSALEM/SAN FRANCISCO, May 10 (Reuters) - Intel Corp INTC.O on Tuesday launched a new chip called Gaudi2 focused on artificial intelligence computing, as the chip manufacturer makes a bigger push into the AI chip market currently dominated by Nvidia Corp NVDA.O. Gaudi2 is the second generation processor by Habana Labs, an Israeli AI chip startup Intel bought in late 2019 for about $2 billion. AI chip startups have been getting huge investments in recent years as AI computing is one of the fastest growing areas for data centers.",2022,4
