Date,Article_title,Stock_symbol,Url,Publisher,Author,Article,Lsa_summary,Luhn_summary,Textrank_summary,Lexrank_summary,Year,sentiment_score
2022-03-28 00:00:00+00:00,Is It Too Late to Buy Nvidia Stock?,INTC,https://www.nasdaq.com/articles/is-it-too-late-to-buy-nvidia-stock-2,,,"Nvidia (NASDAQ: NVDA) stock has started flying once again, with shares of the graphics card specialist gaining 32% since March 14. The stock is now trading at 72 times trailing earnings, which is higher than the multiple it was trading at in the middle of March. Does this mean that investors who didn't take advantage of the pullback in Nvidia stock have missed an opportunity to buy this fast-growing tech company? Let's find out.
Nvidia is expensive, but the valuation remains attractive
There is no doubt that Nvidia remains an expensive stock to buy. However, investors looking for a growth stock should note that the graphics card specialist was trading at a whopping 90 times earnings last year. Going back to 2020, Nvidia remained expensive with a price-to-earnings ratio of 85. It was only in 2019 that Nvidia's valuation was at a relatively cheap 60 times earnings.
NVDA PE Ratio data by YCharts
Since early 2020, Nvidia stock has jumped a massive 400%. The stock handsomely rewarded investors who had bought at 60 times earnings back in 2019. So, growth-oriented investors still have an opportunity to buy the stock before it gets even more expensive due to multiple upcoming catalysts that should help the company maintain its outstanding growth pace.
Hot tech trends should ensure rapid long-term growth
At Nvidia's recent developer conference, the company revealed new products that support its aggressive pursuit of fast-growing markets such as artificial intelligence (AI)-enabled data centers, autonomous vehicles, and digital twin applications.
Nvidia unveiled the Grace Central Processing Unit (CPU) Superchip, which will target the high-performance computing (HPC) market and AI data centers. Nvidia says that this chip combines two interconnected server CPUs, and is capable of ""providing the highest performance and twice the memory bandwidth and energy-efficiency compared to today's leading server chips.""
The chipmaker also said that leading players in the HPC, supercomputing, cloud, and hyperscale markets are already working with Nvidia to integrate the Grace Superchip into their applications. The product should be available in the first half of 2023. This move will be huge for Nvidia, marking its entry into a market where the company is currently absent.
By 2023, the server CPU market is expected to generate $19 billion in revenue. The space is currently dominated by Nvidia rivals Intel and AMD. According to Mercury Research, Intel controlled nearly 90% of the server CPU market at the end of 2021, with AMD holding the remaining market share. Nvidia's foray into this space is going to unlock a massive opportunity for the chipmaker that has the potential to substantially boost its revenue.
At the same developer conference, the chipmaker announced that its automotive pipeline had increased to $11 billion, a sizable increase from the $8 billion it was sitting on a year ago. This pipeline could soon translate into real revenue: the company's self-driving platforms are now in production and BYD, the world's second-largest electric vehicle manufacturer, announced it will build its next-generation fleet on Nvidia's DRIVE Hyperion architecture.
BYD is just one of many companies tapping Nvidia's autonomous driving system to power their self-driving vehicles. With these partnerships, it wouldn't be surprising to see the chipmaker's automotive business gain robust traction in the future. By expanding this business segment, Nvidia could generate substantial revenue: last fiscal year, automotive brought in $566 million for the company, accounting for only 2% of total revenue.
Image source: Getty Images.
Nvidia OVX was another key product revealed at the conference that could supercharge long-term company growth. Nvidia has described OVX as being ""purpose-built to operate complex digital twin simulations"" of buildings, factories, warehouses, autonomous vehicles, or entire environments.
Digital twins will be the building blocks of the metaverse, as the technology creates virtual copies of physical objects and spaces such as offices, schools, colleges, stadiums, and other locations. As the metaverse aims to connect people within virtual 3D spaces, the digital twin market is going to expand at a terrific pace in the future. A third-party estimate projects that the current $10.27 billion digital twin market could grow at an annual pace of 35% through 2027.
Still a good buy
Nvidia's revenue shot up 61% in fiscal year 2022 to $26.9 billion. Adjusted earnings were up 78% to $4.44 per share. So far, the video gaming and data center markets have been the pillars of this terrific growth, and they are likely to help the company maintain its momentum in the long run. And now that the company is ready to tap into more lucrative markets, its revenue and earnings could grow substantially over the long run.
Investment bank Cowen (NASDAQ: COWN) estimates that Nvidia could generate $140 billion in revenue and $28 per share in earnings by 2028. That would be a huge jump over last year's numbers, and indicates that Nvidia could remain a top growth stock for a long time to come.
10 stocks we like better than Nvidia
When our award-winning analyst team has a stock tip, it can pay to listen. After all, the newsletter they have run for over a decade, Motley Fool Stock Advisor, has tripled the market.*
They just revealed what they believe are the ten best stocks for investors to buy right now... and Nvidia wasn't one of them! That's right -- they think these 10 stocks are even better buys.
See the 10 stocks
*Stock Advisor returns as of March 3, 2022
Harsh Chauhan has no position in any of the stocks mentioned. The Motley Fool owns and recommends Advanced Micro Devices, Intel, and Nvidia. The Motley Fool recommends the following options: long January 2023 $57.50 calls on Intel and short January 2023 $57.50 puts on Intel. The Motley Fool has a disclosure policy.
The views and opinions expressed herein are the views and opinions of the author and do not necessarily reflect those of Nasdaq, Inc.","Hot tech trends should ensure rapid long-term growth At Nvidia's recent developer conference, the company revealed new products that support its aggressive pursuit of fast-growing markets such as artificial intelligence (AI)-enabled data centers, autonomous vehicles, and digital twin applications. This pipeline could soon translate into real revenue: the company's self-driving platforms are now in production and BYD, the world's second-largest electric vehicle manufacturer, announced it will build its next-generation fleet on Nvidia's DRIVE Hyperion architecture. Digital twins will be the building blocks of the metaverse, as the technology creates virtual copies of physical objects and spaces such as offices, schools, colleges, stadiums, and other locations.","Hot tech trends should ensure rapid long-term growth At Nvidia's recent developer conference, the company revealed new products that support its aggressive pursuit of fast-growing markets such as artificial intelligence (AI)-enabled data centers, autonomous vehicles, and digital twin applications. At the same developer conference, the chipmaker announced that its automotive pipeline had increased to $11 billion, a sizable increase from the $8 billion it was sitting on a year ago. By expanding this business segment, Nvidia could generate substantial revenue: last fiscal year, automotive brought in $566 million for the company, accounting for only 2% of total revenue.","Does this mean that investors who didn't take advantage of the pullback in Nvidia stock have missed an opportunity to buy this fast-growing tech company? Nvidia is expensive, but the valuation remains attractive There is no doubt that Nvidia remains an expensive stock to buy. Hot tech trends should ensure rapid long-term growth At Nvidia's recent developer conference, the company revealed new products that support its aggressive pursuit of fast-growing markets such as artificial intelligence (AI)-enabled data centers, autonomous vehicles, and digital twin applications.","By 2023, the server CPU market is expected to generate $19 billion in revenue. That would be a huge jump over last year's numbers, and indicates that Nvidia could remain a top growth stock for a long time to come. * They just revealed what they believe are the ten best stocks for investors to buy right now... and Nvidia wasn't one of them!",2022,4
2022-03-28 00:00:00+00:00,Intel's Audacious Turnaround Plan in 1 Chart,INTC,https://www.nasdaq.com/articles/intels-audacious-turnaround-plan-in-1-chart,,,"When a company faces no real competition for a long time, complacency inevitably sets in. That's the story of Intel (NASDAQ: INTC) for much of the 2010s. Advanced Micro Devices, the other half of the x86 processor duopoly, was a train wreck until around 2017. It didn't matter that Intel was running into all sorts of problems on the manufacturing side. The profits kept flowing.
After years of pushing out uncompetitive products, AMD turned the market for PC and server CPUs on its head with its Zen-powered chips. This was partly enabled by Intel's chronic manufacturing delays, and partly by the rapid technological progress made by third-party foundry Taiwan Semiconductor Manufacturing (TSMC). Intel sat idly by as its manufacturing edge slipped away, and AMD took advantage.
AMD has been winning market share, which is particularly problematic in the lucrative server chip market. Meanwhile, companies Apple and others have been able to have their own custom chips manufactured by TSMC using bleeding-edge tech that Intel simply can't match. In all, it's not a good situation for the half-century-old semiconductor giant.
A bold comeback plan
Pat Gelsinger, an Intel veteran who had left to lead VMware, was brought back as CEO in early 2021. It didn't take long for Gelsinger to begin charting Intel's comeback. Instead of abandoning manufacturing, which some had been calling for, Gelsinger doubled down on the business of making chips. Not only would Intel beat back the threat from AMD, but it would also build out its very own foundry business to rival TSMC.
If this plan sounds expensive, that's because it is. To make all of this happen, Intel will dramatically increase how much it spends each year on building and maintaining its factories.
Chart by author. Data source: Intel.
For the past decade, Intel's annual capital expenditures averaged around $12.5 billion. The most Intel ever spent before Gelsinger took over was $16 billion in 2019. Spending ticked up last year as the beginnings of Gelsinger's strategy was put into motion. Starting this year, Intel will be going all out as it works its way back into a position of dominance.
Intel plans to spend around 35% of its revenue, or approximately $27 billion, on capital expenditures this year. This capital intensity will persist through at least 2024, and Intel doesn't expect to be producing any meaningful free cash flow during this time. Only in 2025 and beyond, according to Intel's plan, will it be able to cool off its spending.
Intel has committed $20 billion to build a new fabrication complex in Ohio, and that investment could rise to $100 billion by the time it's all said and done. Whether or not the CHIPS Act, which would provide $52 billion in incentives for the semiconductor industry, is signed into law will dictate how much cash Intel pours into this new facility.
Intel is also investing as much as 80 billion euros into the European Union over the next decade, including an initial 17 billion euros for a fabrication complex in Germany. As in the U.S., Intel is hoping to receive billions in incentives to pay for part of this new facility. The details haven't been ironed out yet, but Germany is reportedly looking to grant Intel around $5.5 billion.
The semiconductor industry is in desperate need of more capacity, and Intel's investments will help bring supply and demand back into sync over time. This level of spending is also necessary for Intel to catch up in terms of technology. The company has no hope of landing clients that need the most advanced manufacturing processes if it doesn't offer them.
For Intel investors, the next few years will require a lot of faith. Profits are going to take a big hit, free cash flow will dry up, and the future of the company depends on the success of an audacious plan to spend nearly $100 billion over the next three years undoing its mistakes and building out an entirely new line of business.
Intel needed a bold strategy, and Gelsinger delivered. Now let's see if it works.
10 stocks we like better than Intel
When our award-winning analyst team has a stock tip, it can pay to listen. After all, the newsletter they have run for over a decade, Motley Fool Stock Advisor, has tripled the market.*
They just revealed what they believe are the ten best stocks for investors to buy right now... and Intel wasn't one of them! That's right -- they think these 10 stocks are even better buys.
See the 10 stocks
*Stock Advisor returns as of March 3, 2022
Timothy Green owns Intel. The Motley Fool owns and recommends Advanced Micro Devices, Apple, Intel, and Taiwan Semiconductor Manufacturing. The Motley Fool recommends VMware and recommends the following options: long January 2023 $57.50 calls on Intel, long March 2023 $120 calls on Apple, short January 2023 $57.50 puts on Intel, and short March 2023 $130 calls on Apple. The Motley Fool has a disclosure policy.
The views and opinions expressed herein are the views and opinions of the author and do not necessarily reflect those of Nasdaq, Inc.","That's the story of Intel (NASDAQ: INTC) for much of the 2010s. Meanwhile, companies Apple and others have been able to have their own custom chips manufactured by TSMC using bleeding-edge tech that Intel simply can't match. A bold comeback plan Pat Gelsinger, an Intel veteran who had left to lead VMware, was brought back as CEO in early 2021.","That's the story of Intel (NASDAQ: INTC) for much of the 2010s. This was partly enabled by Intel's chronic manufacturing delays, and partly by the rapid technological progress made by third-party foundry Taiwan Semiconductor Manufacturing (TSMC). The Motley Fool owns and recommends Advanced Micro Devices, Apple, Intel, and Taiwan Semiconductor Manufacturing.","That's the story of Intel (NASDAQ: INTC) for much of the 2010s. Intel plans to spend around 35% of its revenue, or approximately $27 billion, on capital expenditures this year. The Motley Fool owns and recommends Advanced Micro Devices, Apple, Intel, and Taiwan Semiconductor Manufacturing.","That's the story of Intel (NASDAQ: INTC) for much of the 2010s. It didn't take long for Gelsinger to begin charting Intel's comeback. After all, the newsletter they have run for over a decade, Motley Fool Stock Advisor, has tripled the market.",2022,3
2022-03-28 00:00:00+00:00,"SK Hynix CEO says top shareholder to secure $1.6 bln for M&A in chips, blockchain",INTC,https://www.nasdaq.com/articles/sk-hynix-ceo-says-top-shareholder-to-secure-%241.6-bln-for-ma-in-chips-blockchain,,,"SEOUL, March 28 (Reuters) - The CEO of South Korean chipmaker SK Hynix 000660.KS said on Monday that its largest shareholder, SK Square 402340.KS, is considering merger and acquisition deals involving chip companies.
""We are considering investment in companies ranging from those that are big in scale to those that are small,"" Co-CEO of SK Hynix Park Jung-ho, who is also CEO of SK Square, said at the latter's annual shareholders meeting.
SK Square, which owns 20.1% of SK Hynix, plans to secure 2 trillion won ($1.63 billion) or more of its own for investments over the next three years, as well as establish a joint investment base with domestic and foreign investors, to invest intensively in areas such as chips and blockchain.
SK Square executives were involved in SK Group's large-scale chip M&As in the past decade such as the acquisition of SK Hynix in 2012, SK Hynix investing 395 billion yen ($3.21 billion) in a stake in Kioxia in 2017, and SK Hynix signing the $9 billion acquisition of Intel's INTC.O NAND business in 2020, SK Square said in a statement.
($1 = 1,226.8400 won)
($1 = 123.1000 yen)
(Reporting by Joyce Lee; editing by Jason Neely)
((joyce.lee@tr.com;))
The views and opinions expressed herein are the views and opinions of the author and do not necessarily reflect those of Nasdaq, Inc.","SK Square executives were involved in SK Group's large-scale chip M&As in the past decade such as the acquisition of SK Hynix in 2012, SK Hynix investing 395 billion yen ($3.21 billion) in a stake in Kioxia in 2017, and SK Hynix signing the $9 billion acquisition of Intel's INTC.O NAND business in 2020, SK Square said in a statement. SEOUL, March 28 (Reuters) - The CEO of South Korean chipmaker SK Hynix 000660.KS said on Monday that its largest shareholder, SK Square 402340.KS, is considering merger and acquisition deals involving chip companies. ""We are considering investment in companies ranging from those that are big in scale to those that are small,"" Co-CEO of SK Hynix Park Jung-ho, who is also CEO of SK Square, said at the latter's annual shareholders meeting.","SK Square executives were involved in SK Group's large-scale chip M&As in the past decade such as the acquisition of SK Hynix in 2012, SK Hynix investing 395 billion yen ($3.21 billion) in a stake in Kioxia in 2017, and SK Hynix signing the $9 billion acquisition of Intel's INTC.O NAND business in 2020, SK Square said in a statement. SEOUL, March 28 (Reuters) - The CEO of South Korean chipmaker SK Hynix 000660.KS said on Monday that its largest shareholder, SK Square 402340.KS, is considering merger and acquisition deals involving chip companies. SK Square, which owns 20.1% of SK Hynix, plans to secure 2 trillion won ($1.63 billion) or more of its own for investments over the next three years, as well as establish a joint investment base with domestic and foreign investors, to invest intensively in areas such as chips and blockchain.","SK Square executives were involved in SK Group's large-scale chip M&As in the past decade such as the acquisition of SK Hynix in 2012, SK Hynix investing 395 billion yen ($3.21 billion) in a stake in Kioxia in 2017, and SK Hynix signing the $9 billion acquisition of Intel's INTC.O NAND business in 2020, SK Square said in a statement. SEOUL, March 28 (Reuters) - The CEO of South Korean chipmaker SK Hynix 000660.KS said on Monday that its largest shareholder, SK Square 402340.KS, is considering merger and acquisition deals involving chip companies. SK Square, which owns 20.1% of SK Hynix, plans to secure 2 trillion won ($1.63 billion) or more of its own for investments over the next three years, as well as establish a joint investment base with domestic and foreign investors, to invest intensively in areas such as chips and blockchain.","SK Square executives were involved in SK Group's large-scale chip M&As in the past decade such as the acquisition of SK Hynix in 2012, SK Hynix investing 395 billion yen ($3.21 billion) in a stake in Kioxia in 2017, and SK Hynix signing the $9 billion acquisition of Intel's INTC.O NAND business in 2020, SK Square said in a statement. SEOUL, March 28 (Reuters) - The CEO of South Korean chipmaker SK Hynix 000660.KS said on Monday that its largest shareholder, SK Square 402340.KS, is considering merger and acquisition deals involving chip companies. ""We are considering investment in companies ranging from those that are big in scale to those that are small,"" Co-CEO of SK Hynix Park Jung-ho, who is also CEO of SK Square, said at the latter's annual shareholders meeting.",2022,4
