Date,Article_title,Stock_symbol,Url,Publisher,Author,Article,Lsa_summary,Luhn_summary,Textrank_summary,Lexrank_summary,Year,sentiment_score
2022-01-27 00:00:00+00:00,China conditionally approves AMD's $35 bln deal for Xilinx,INTC,https://www.nasdaq.com/articles/china-conditionally-approves-amds-%2435-bln-deal-for-xilinx-0,,,"Adds background, detail
SHANGHAI, Jan 27 (Reuters) - China's market regulator has conditionally approved semiconductor group Advanced Micro Devices Inc's AMD.O $35 billion all-stock deal for peer Xilinx XLNX.O, it said on Thursday.
The regulatory approval from Beijing brings the purchase, which was first announced in October 2020, closer to completion.
In a public notice, China's State Administration for Market Regulation said it will approve the deal on condition that AMD and Xilinx do not force tie-in sales of products or discriminate against customers that buy one set of products but not another.
The regulator added that the newly merged entity must also ensure ""the flexibility and programmability of Xilinx FPGAs"" and ""that their development methods are compatible with ARM-based processors"".
It must also make sure that its GPUs and FPGA products sold to China are interoperable with products in the China market.
The merger comes as both AMD and Xilinx compete against Intel Corp INTC.O to penetrate the market for data center chips.
Washington and Beijing have at times brought pending mergers in the chip sector to a halt by withholding regulatory approval.
In March 2021, Applied Materials Inc AMAT.O abandoned its planned $2.2 billion purchase of Japan's Kokusai Electric Corp, citing a lack of regulatory approval from China.
In December U.S.-listed chipmaker Magnachip Semiconductor Corp MX.N announced it would terminate a $1.4 billion buyout plan from Chinese private equity firm Wise Road Capital following a probe into the deal from Washington's Committee on Foreign Investment in the United States (CFIUS).
(Reporting by Brenda Goh and Josh Horwitz; Editing by Toby Chopra and Jan Harvey)
((brenda.goh@thomsonreuters.com; +86 (0) 21 2083 0088; Reuters Messaging: brenda.goh.thomsonreuters.com@reuters.net))
The views and opinions expressed herein are the views and opinions of the author and do not necessarily reflect those of Nasdaq, Inc.","The merger comes as both AMD and Xilinx compete against Intel Corp INTC.O to penetrate the market for data center chips. Adds background, detail SHANGHAI, Jan 27 (Reuters) - China's market regulator has conditionally approved semiconductor group Advanced Micro Devices Inc's AMD.O $35 billion all-stock deal for peer Xilinx XLNX.O, it said on Thursday. In March 2021, Applied Materials Inc AMAT.O abandoned its planned $2.2 billion purchase of Japan's Kokusai Electric Corp, citing a lack of regulatory approval from China.","The merger comes as both AMD and Xilinx compete against Intel Corp INTC.O to penetrate the market for data center chips. Adds background, detail SHANGHAI, Jan 27 (Reuters) - China's market regulator has conditionally approved semiconductor group Advanced Micro Devices Inc's AMD.O $35 billion all-stock deal for peer Xilinx XLNX.O, it said on Thursday. In a public notice, China's State Administration for Market Regulation said it will approve the deal on condition that AMD and Xilinx do not force tie-in sales of products or discriminate against customers that buy one set of products but not another.","The merger comes as both AMD and Xilinx compete against Intel Corp INTC.O to penetrate the market for data center chips. Adds background, detail SHANGHAI, Jan 27 (Reuters) - China's market regulator has conditionally approved semiconductor group Advanced Micro Devices Inc's AMD.O $35 billion all-stock deal for peer Xilinx XLNX.O, it said on Thursday. In a public notice, China's State Administration for Market Regulation said it will approve the deal on condition that AMD and Xilinx do not force tie-in sales of products or discriminate against customers that buy one set of products but not another.","The merger comes as both AMD and Xilinx compete against Intel Corp INTC.O to penetrate the market for data center chips. The regulatory approval from Beijing brings the purchase, which was first announced in October 2020, closer to completion. In a public notice, China's State Administration for Market Regulation said it will approve the deal on condition that AMD and Xilinx do not force tie-in sales of products or discriminate against customers that buy one set of products but not another.",2022,2
2022-01-27 00:00:00+00:00,"Top Stock Market News For Today January 27, 2022",INTC,https://www.nasdaq.com/articles/top-stock-market-news-for-today-january-27-2022,,,"Stock Market Futures Mixed Following Federal Reserve Policy Update
Stock market futures are mixed during today’s early morning trading. This is likely as investors digest the latest statements from the Federal Open Market Committee (FOMC). Now, among the key takeaways from the FOMC meeting would be its decision to hold interest rates at near-zero for now. Even so, there remains a focus on withdrawing pandemic-era policies amidst rising inflation. This is evident from the following statement from the Fed. “With inflation well above 2% and a strong labor market, the Committee expects it will soon be appropriate to raise the target range for the federal funds rate.”
Now, the current move by the Federal Reserve is not all that surprising. This is because policymakers have and continue to reiterate that ending the central banks’ asset purchase program is their first priority. On this front, the FOMC affirms that it will likely complete the process by early March. By extension, we could see the first interest rate hike within the next two months. For one thing, increasing interest rates would help to address the current issue with inflation. This would primarily raise borrowing costs and reduce demand for goods in general.
For today, investors could be closely watching how these updates weigh in on earnings in Big Tech in the stock market today. As of 7:24 a.m. ET, the Dow & S&P 500 are declining by 0.26%, and 0.09%, while Nasdaq futures are trading higher by 0.15%.
[Read More] Best Artificial Intelligence Stocks To Buy Right Now? 5 To Watch
Apple Earnings On Tap After Closing Bell Today; Reportedly Making Bold Push Into Fintech
Apple (NASDAQ: AAPL) is the next FAANG member reporting quarterly earnings figures today. With the consumer tech titan coming under the microscope today, investors will likely be tuning in to AAPL stock today. Accordingly, Wall Street is currently expecting Apple to report an earnings per share of $1.88 on revenue of $118.7 billion. Now, to begin with, these figures are commendable even after accounting for the company’s massive operations. However, after a solid two years of strong iPhone sales amidst the pandemic, things appear to be normalizing for Apple. According to a statement to its component suppliers, the demand for iPhone 13’s is weakening. Because of this, the focus could be on Apple’s iPhone revenue this quarter.
Aside from its earnings, Apple does not seem to be slowing down in the least bit on the operational front. According to sources from Bloomberg, the company is planning to test out new fintech services. This would see small businesses being able to accept digital payments directly from iPhones. In other words, Apple could be looking to turn iPhones into payment terminals. More importantly, the report suggests that all this will be done without additional hardware through near-field communication (NFC) tech.
Should all this be the case, Apple would be stepping up to the plate against firms like Block (NYSE: SQ). Regardless of how you look at it, Apple seems to be having an exciting week. With that in mind, investors may want to consider taking a closer look at AAPL stock now.
Source: TD Ameritrade TOS
Tesla Posts Strong Earnings And Reveals Plans To Rev Up Autonomous Vehicle Tech And Production Efforts
Elsewhere, Tesla (NASDAQ: TSLA) reported positive numbers in its fourth-quarter earnings yesterday. After the closing bell, the company reported earnings of $2.52 on record quarterly revenue of $17.72 billion. Notably, this would be well above estimates of $2.36 and $16.57 billion respectively. In detail, the electric vehicle (EV) goliath saw its total revenue soar by 65% year-over-year. Over the same period, its automotive revenue is currently looking at sizable gains of 71%. Also, Tesla’s net income is up by a whopping 760%, totaling $2.32 billion.
Despite all of this, TSLA stock ended the post-market trading hours in the red. For the most part, this would be due to CEO Elon Musk’s latest update on Tesla’s operation. According to Musk, the EV firm will likely remain “chip-limited” this year and lack any new models in 2022. Furthermore, he also notes that Tesla’s factories have been and still are running below capacity. The reason for this is supply chain issues becoming a “main limiting factor,” in Musk’s words.
While all this may appear to be negative, the company has also been holding its ground. Throughout 2021, Tesla hit record production figures and is looking to expand beyond its 600,000 units per year manufacturing capacity. After considering all of this data, investors looking for long-term buys could be eyeing TSLA stock.
Source: TD Ameritrade TOS
[Read More] Best Monthly Dividend Stocks To Buy Now? 5 For Your List
Intel Reports Solid Earnings Beats And Provides Optimistic Guidance
Similar to Tesla, Intel (NASDAQ: INTC) also posted better-than-expected figures in its latest earnings report. Diving in, the semiconductor maker raked in a total revenue of $19.5 billion for the quarter. This would exceed consensus forecasts of $18.31 billion. Moreover, Intel recorded an earnings per share of $1.09, beating expectations of $0.91. If that wasn’t enough, the company’s Client Computing Group, its largest division, raked in a revenue of $10.1 billion. To put things into perspective, this is against estimates of $9.6 billion and marks a 7% year-over-year dip.
Commenting on the company’s overall performance is CEO Pat Gelsinger. He says, “Q4 represented a great finish to a great year. We exceeded top-line quarterly guidance by over $1 billion and delivered the best quarterly and full-year revenue in the company’s history.” Adding to that, Gelsinger highlights, “Our disciplined focus on execution across technology development, manufacturing, and our traditional and emerging businesses is reflected in our results. We remain committed to driving long-term, sustainable growth as we relentlessly execute our IDM 2.0 strategy.”
Additionally, Gelsinger also talked about the company’s next-generation server chip, Sapphire Rapids. According to the CEO, Sapphire Rapids is set to begin shipping this quarter with plans for production boosts in Q2. All in all, it seems like Intel is kicking into high gear across the board. Because of that, INTC stock could be in focus in the stock market now.
Source: TD Ameritrade TOS
[Read More] Best Lithium Battery Stocks To Buy Now? 4 To Know
Notable Earnings To Know In The Stock Market Today
Not to mention, there are plenty of massive companies reporting their earnings today as well. This ranges from some of the biggest names in consumer tech to industrial giants, and consumer staples. In the pre-market hours, we have Mastercard (NYSE: MA), Nucor (NYSE: NUE), McDonald’s (NYSE: MCD), and Altria (NYSE: MO) on tap. Also, two key airline operators, JetBlue (NASDAQ: JBLU) and Southwest (NYSE: LUV) fall in this group as well.
Alternatively, for those looking towards earnings after the closing bell, there is a strong focus on tech. Aside from Apple, Robinhood (NASDAQ: HOOD), Visa (NYSE: V), Western Digital (NASDAQ: WDC), and Atlassian (NASDAQ: TEAM) are reporting earnings. Between major tech earnings and FOMC policy updates, investors have plenty to consider in the stock market now.
If you enjoyed this article and you’re interested in learning how to trade so you can have the best chance to profit consistently then you need to checkout this YouTube channel. CLICK HERE RIGHT NOW!
The views and opinions expressed herein are the views and opinions of the author and do not necessarily reflect those of Nasdaq, Inc.","5 For Your List Intel Reports Solid Earnings Beats And Provides Optimistic Guidance Similar to Tesla, Intel (NASDAQ: INTC) also posted better-than-expected figures in its latest earnings report. Because of that, INTC stock could be in focus in the stock market now. We remain committed to driving long-term, sustainable growth as we relentlessly execute our IDM 2.0 strategy.” Additionally, Gelsinger also talked about the company’s next-generation server chip, Sapphire Rapids.","5 For Your List Intel Reports Solid Earnings Beats And Provides Optimistic Guidance Similar to Tesla, Intel (NASDAQ: INTC) also posted better-than-expected figures in its latest earnings report. Because of that, INTC stock could be in focus in the stock market now. Stock Market Futures Mixed Following Federal Reserve Policy Update Stock market futures are mixed during today’s early morning trading.","5 For Your List Intel Reports Solid Earnings Beats And Provides Optimistic Guidance Similar to Tesla, Intel (NASDAQ: INTC) also posted better-than-expected figures in its latest earnings report. Because of that, INTC stock could be in focus in the stock market now. 5 To Watch Apple Earnings On Tap After Closing Bell Today; Reportedly Making Bold Push Into Fintech Apple (NASDAQ: AAPL) is the next FAANG member reporting quarterly earnings figures today.","Because of that, INTC stock could be in focus in the stock market now. 5 For Your List Intel Reports Solid Earnings Beats And Provides Optimistic Guidance Similar to Tesla, Intel (NASDAQ: INTC) also posted better-than-expected figures in its latest earnings report. Because of this, the focus could be on Apple’s iPhone revenue this quarter.",2022,4
2022-01-27 00:00:00+00:00,US STOCKS-Tech stocks set to push Wall Street higher at open,INTC,https://www.nasdaq.com/articles/us-stocks-tech-stocks-set-to-push-wall-street-higher-at-open,,,"By Bansari Mayur Kamdar and Devik Jain
Jan 27 (Reuters) - Wall Street was set to open higher on Thursday, helped by gains in megacap tech-focused firms a day after hawkish comments from the Federal Reserve weighed on markets.
Netflix Inc NFLX.O jumped 4% in premarket trading as billionaire investor William Ackman amassed a new stake in the streaming service company worth more than $1 billion.
Tech-heavy Nasdaq futures NQcv1 rose 0.4%.
Apple AAPL.O, Microsoft MSFT.O, Meta Platforms FB.O and Alphabet GOOGL.O gained nearly 1% each, with the iPhone maker set to report results after markets close.
U.S. two-year yields, which are sensitive to interest rate expectations, rose to their highest levels since February 2020 after the Fed on Wednesday indicated a rate hike in March and reaffirmed plans to end its bond purchases that month before launching a significant reduction in its asset holdings. US/
Fed Chair Jerome Powell warned inflation remains above its long-run goal and supply problems are bigger and more long-lasting than previously thought.
Traders priced in nearly five rate increases by December after the Fed announcement, after previously fully pricing for four.
""Market has priced in the rate hikes, (but) they've not completely priced in the quantitative tightening, because we don't know what it's going to be and we don't know the impact,"" said Thomas Hayes, managing member at Great Hill Capital LLC in New York.
Adding to investor concerns were festering geopolitical tensions in Ukraine. The U.S. said on Wednesday it had set out a diplomatic path to address Russian demands in eastern Europe, as Moscow held security talks with the West and intensified its military build-up near Ukraine with new drills.
The S&P 500 index nosedived in the previous session reversing all its early gains amid volatile trading, flirting with a correction for its third straight session.
The bellwether index would have to close 10% or more below its record closing high reached on Jan. 3, to confirm it entered correction territory. It ended the session 9.3% below that level on Wednesday.
Latest data showed the U.S. economy grew by 6.9% in the fourth quarter, far ahead of economists expectations of 5.5% growth.
Meanwhile, the fourth-quarter earnings season is in full swing with analysts expecting earnings from S&P 500 companies to grow 24.4% year-over-year, according to Refinitiv, as of Wednesday.
Tesla Inc TSLA.O slipped 0.4% after warning that supply chain issues will last throughout 2022, while chipmaker Intel Corp INTC.O fell 2.9% on a downbeat first-quarter earnings forecast due to global supply chain problems.
At 8:38 a.m. ET, Dow e-minis 1YMcv1 were up 43 points, or 0.13%, S&P 500 e-minis EScv1 were up 14.25 points, or 0.33%, and Nasdaq 100 e-minis NQcv1 were up 62.5 points, or 0.44%.
Digital workflow company ServiceNow Inc NOW.N gained 10.7% after reporting upbeat revenue and profit for the fourth quarter, helped by strong subscription growth.
(Reporting by Bansari Mayur Kamdar and Devik Jain in Bengaluru; Editing by Shounak Dasgupta)
((BansariMayur.Kamdar@thomsonreuters.com))
The views and opinions expressed herein are the views and opinions of the author and do not necessarily reflect those of Nasdaq, Inc.","Tesla Inc TSLA.O slipped 0.4% after warning that supply chain issues will last throughout 2022, while chipmaker Intel Corp INTC.O fell 2.9% on a downbeat first-quarter earnings forecast due to global supply chain problems. By Bansari Mayur Kamdar and Devik Jain Jan 27 (Reuters) - Wall Street was set to open higher on Thursday, helped by gains in megacap tech-focused firms a day after hawkish comments from the Federal Reserve weighed on markets. Netflix Inc NFLX.O jumped 4% in premarket trading as billionaire investor William Ackman amassed a new stake in the streaming service company worth more than $1 billion.","Tesla Inc TSLA.O slipped 0.4% after warning that supply chain issues will last throughout 2022, while chipmaker Intel Corp INTC.O fell 2.9% on a downbeat first-quarter earnings forecast due to global supply chain problems. By Bansari Mayur Kamdar and Devik Jain Jan 27 (Reuters) - Wall Street was set to open higher on Thursday, helped by gains in megacap tech-focused firms a day after hawkish comments from the Federal Reserve weighed on markets. (Reporting by Bansari Mayur Kamdar and Devik Jain in Bengaluru; Editing by Shounak Dasgupta) ((BansariMayur.Kamdar@thomsonreuters.com)) The views and opinions expressed herein are the views and opinions of the author and do not necessarily reflect those of Nasdaq, Inc.","Tesla Inc TSLA.O slipped 0.4% after warning that supply chain issues will last throughout 2022, while chipmaker Intel Corp INTC.O fell 2.9% on a downbeat first-quarter earnings forecast due to global supply chain problems. By Bansari Mayur Kamdar and Devik Jain Jan 27 (Reuters) - Wall Street was set to open higher on Thursday, helped by gains in megacap tech-focused firms a day after hawkish comments from the Federal Reserve weighed on markets. U.S. two-year yields, which are sensitive to interest rate expectations, rose to their highest levels since February 2020 after the Fed on Wednesday indicated a rate hike in March and reaffirmed plans to end its bond purchases that month before launching a significant reduction in its asset holdings.","Tesla Inc TSLA.O slipped 0.4% after warning that supply chain issues will last throughout 2022, while chipmaker Intel Corp INTC.O fell 2.9% on a downbeat first-quarter earnings forecast due to global supply chain problems. By Bansari Mayur Kamdar and Devik Jain Jan 27 (Reuters) - Wall Street was set to open higher on Thursday, helped by gains in megacap tech-focused firms a day after hawkish comments from the Federal Reserve weighed on markets. Traders priced in nearly five rate increases by December after the Fed announcement, after previously fully pricing for four.",2022,2
