Date,Article_title,Stock_symbol,Url,Publisher,Author,Article,Lsa_summary,Luhn_summary,Textrank_summary,Lexrank_summary,Year,sentiment_score
2022-03-31 00:00:00+00:00,EXCLUSIVE-U.S. warned firms about Russia's Kaspersky software day after invasion -sources,INTC,https://www.nasdaq.com/articles/exclusive-u.s.-warned-firms-about-russias-kaspersky-software-day-after-invasion-sources-0,,,"By Christopher Bing
March 31 (Reuters) - The U.S. government began privately warning some American companies the day after Russia invaded Ukraine that Moscow could manipulate software designed by Russian cybersecurity company Kaspersky to cause harm, according to a senior U.S. official and two people familiar with the matter.
The classified briefings are part of Washington's broader strategy to prepare providers of critical infrastructure such as water, telecoms and energy for potential Russian intrusions.
President Joe Biden said last week that sanctions imposed on Russia for its Feb. 24 attack on Ukraine could result in a backlash, including cyber disruptions, but the White House did not offer specifics.
""The risk calculation has changed with the Ukraine conflict,"" said the senior U.S. official about Kaspersky's software. ""It has increased.""
Kaspersky, one of the cybersecurity industry's most popular anti-virus software makers, is headquartered in Moscow and was founded by Eugene Kaspersky, who U.S. officials describe as a former Russian intelligence officer.
A Kaspersky spokeswoman said in a statement that the briefings about purported risks of Kaspersky software would be ""further damaging"" to Kaspersky’s reputation ""without giving the company the opportunity to respond directly to such concerns"" and that it ""is not appropriate or just.""
The senior U.S. official said Kaspersky's Russia-based staff could be coerced into providing or helping establish remote access into their customers' computers by Russian law enforcement or intelligence agencies.
Eugene Kaspersky, according to his company website, graduated from the Institute of Cryptography, Telecommunications and Computer Science, which the Soviet KGB previously administered. The company spokeswoman said that Kaspersky worked as a ""software engineer"" during military service.
The Russian cybersecurity firm, which has an office in the United States, lists partnerships with Microsoft, Intel and IBM on its website. Microsoft declined to comment. Intel and IBM did not respond to requests for comment.
On March 25, the Federal Communications Commission added Kaspersky to its list of communications equipment and service providers deemed threats to U.S. national security.
It is not the first time Washington has said Kaspersky could be influenced by the Kremlin.
The Trump administration spent months banning Kaspersky from government systems and warning numerous companies to not use the software in 2017 and 2018.
U.S. security agencies conducted a series of similar cybersecurity briefings surrounding the Trump ban. The content of those meetings four years ago was comparable to the new briefings, said one of the people familiar with the matter.
Over the years, Kaspersky has consistently denied wrongdoing or any secret partnership with Russian intelligence.
It is unclear whether a specific incident or piece of new intelligence led to the security briefings. The senior official declined to comment on classified information.
Until now no U.S. or allied intelligence agency has ever offered direct, public proof of a backdoor in Kaspersky software.
Following the Trump decision, Kaspersky opened a series of transparency centers, where it says partners can review its code to check for malicious activity. A company blog post at the time explained the goal was to build trust with customers after the U.S. accusations.
But the U.S. official said the transparency centers are not ""even a fig leaf"" because they do not address the U.S. government's concern.
""Moscow software engineers handle the [software] updates, that's where the risk comes,"" they said. ""They can send malicious commands through the updaters and that comes from Russia.""
Cybersecurity experts say that because of how anti-virus software normally functions on computers where it is installed, it requires a deep level of control to discovery malware. This makes anti-virus software an inherently advantageous channel to conduct espionage.
In addition, Kaspersky's products are also sometimes sold under white label sales agreements. This means the software can be packaged and renamed in commercial deals by information technology contractors, making their origin difficult to immediately determine.
While not referring to Kaspersky by name, Britain's cybersecurity center on Tuesday said organizations providing services related to Ukraine or critical infrastructure should reconsider the risk associated with using Russian computer technology in their supply chains.
""We have no evidence that the Russian state intends to suborn Russian commercial products and services to cause damage to UK interests, but the absence of evidence is not evidence of absence,"" the National Cyber Security Centre said in a blog post.
(Reporting by Christopher Bing; editing by Chris Sanders and Grant McCool)
((Christopher.Bing@thomsonreuters.com; +1 202-510-0174;))
The views and opinions expressed herein are the views and opinions of the author and do not necessarily reflect those of Nasdaq, Inc.","President Joe Biden said last week that sanctions imposed on Russia for its Feb. 24 attack on Ukraine could result in a backlash, including cyber disruptions, but the White House did not offer specifics. The senior U.S. official said Kaspersky's Russia-based staff could be coerced into providing or helping establish remote access into their customers' computers by Russian law enforcement or intelligence agencies. While not referring to Kaspersky by name, Britain's cybersecurity center on Tuesday said organizations providing services related to Ukraine or critical infrastructure should reconsider the risk associated with using Russian computer technology in their supply chains.","By Christopher Bing March 31 (Reuters) - The U.S. government began privately warning some American companies the day after Russia invaded Ukraine that Moscow could manipulate software designed by Russian cybersecurity company Kaspersky to cause harm, according to a senior U.S. official and two people familiar with the matter. U.S. security agencies conducted a series of similar cybersecurity briefings surrounding the Trump ban. The senior official declined to comment on classified information.","By Christopher Bing March 31 (Reuters) - The U.S. government began privately warning some American companies the day after Russia invaded Ukraine that Moscow could manipulate software designed by Russian cybersecurity company Kaspersky to cause harm, according to a senior U.S. official and two people familiar with the matter. Kaspersky, one of the cybersecurity industry's most popular anti-virus software makers, is headquartered in Moscow and was founded by Eugene Kaspersky, who U.S. officials describe as a former Russian intelligence officer. A Kaspersky spokeswoman said in a statement that the briefings about purported risks of Kaspersky software would be ""further damaging"" to Kaspersky’s reputation ""without giving the company the opportunity to respond directly to such concerns"" and that it ""is not appropriate or just.""","""The risk calculation has changed with the Ukraine conflict,"" said the senior U.S. official about Kaspersky's software. U.S. security agencies conducted a series of similar cybersecurity briefings surrounding the Trump ban. The senior official declined to comment on classified information.",2022,2
2022-03-31 00:00:00+00:00,"Notable Thursday Option Activity: SPWR, INTC, STNG",INTC,https://www.nasdaq.com/articles/notable-thursday-option-activity%3A-spwr-intc-stng,,,"Among the underlying components of the Russell 3000 index, we saw noteworthy options trading volume today in SunPower Corp (Symbol: SPWR), where a total of 18,005 contracts have traded so far, representing approximately 1.8 million underlying shares. That amounts to about 43.7% of SPWR's average daily trading volume over the past month of 4.1 million shares. Particularly high volume was seen for the $20.50 strike put option expiring April 01, 2022, with 2,842 contracts trading so far today, representing approximately 284,200 underlying shares of SPWR. Below is a chart showing SPWR's trailing twelve month trading history, with the $20.50 strike highlighted in orange:
Intel Corp (Symbol: INTC) options are showing a volume of 152,385 contracts thus far today. That number of contracts represents approximately 15.2 million underlying shares, working out to a sizeable 43.2% of INTC's average daily trading volume over the past month, of 35.2 million shares. Particularly high volume was seen for the $51 strike call option expiring April 01, 2022, with 7,597 contracts trading so far today, representing approximately 759,700 underlying shares of INTC. Below is a chart showing INTC's trailing twelve month trading history, with the $51 strike highlighted in orange:
And Scorpio Tankers Inc (Symbol: STNG) options are showing a volume of 4,784 contracts thus far today. That number of contracts represents approximately 478,400 underlying shares, working out to a sizeable 42.9% of STNG's average daily trading volume over the past month, of 1.1 million shares. Particularly high volume was seen for the $19 strike call option expiring May 20, 2022, with 1,220 contracts trading so far today, representing approximately 122,000 underlying shares of STNG. Below is a chart showing STNG's trailing twelve month trading history, with the $19 strike highlighted in orange:
For the various different available expirations for SPWR options, INTC options, or STNG options, visit StockOptionsChannel.com.
Today's Most Active Call & Put Options of the S&P 500 »
The views and opinions expressed herein are the views and opinions of the author and do not necessarily reflect those of Nasdaq, Inc.","Particularly high volume was seen for the $51 strike call option expiring April 01, 2022, with 7,597 contracts trading so far today, representing approximately 759,700 underlying shares of INTC. Below is a chart showing SPWR's trailing twelve month trading history, with the $20.50 strike highlighted in orange: Intel Corp (Symbol: INTC) options are showing a volume of 152,385 contracts thus far today. That number of contracts represents approximately 15.2 million underlying shares, working out to a sizeable 43.2% of INTC's average daily trading volume over the past month, of 35.2 million shares.","Below is a chart showing SPWR's trailing twelve month trading history, with the $20.50 strike highlighted in orange: Intel Corp (Symbol: INTC) options are showing a volume of 152,385 contracts thus far today. That number of contracts represents approximately 15.2 million underlying shares, working out to a sizeable 43.2% of INTC's average daily trading volume over the past month, of 35.2 million shares. Particularly high volume was seen for the $51 strike call option expiring April 01, 2022, with 7,597 contracts trading so far today, representing approximately 759,700 underlying shares of INTC.","That number of contracts represents approximately 15.2 million underlying shares, working out to a sizeable 43.2% of INTC's average daily trading volume over the past month, of 35.2 million shares. Particularly high volume was seen for the $51 strike call option expiring April 01, 2022, with 7,597 contracts trading so far today, representing approximately 759,700 underlying shares of INTC. Below is a chart showing SPWR's trailing twelve month trading history, with the $20.50 strike highlighted in orange: Intel Corp (Symbol: INTC) options are showing a volume of 152,385 contracts thus far today.","Below is a chart showing SPWR's trailing twelve month trading history, with the $20.50 strike highlighted in orange: Intel Corp (Symbol: INTC) options are showing a volume of 152,385 contracts thus far today. That number of contracts represents approximately 15.2 million underlying shares, working out to a sizeable 43.2% of INTC's average daily trading volume over the past month, of 35.2 million shares. Particularly high volume was seen for the $51 strike call option expiring April 01, 2022, with 7,597 contracts trading so far today, representing approximately 759,700 underlying shares of INTC.",2022,3
2022-03-31 00:00:00+00:00,"After Hours Most Active for Mar 31, 2022 : AAPL, T, QQQ, BCS, BAC, MSFT, INTC, LITTU, CMCSA, PFE, WFC, F",INTC,https://www.nasdaq.com/articles/after-hours-most-active-for-mar-31-2022-%3A-aapl-t-qqq-bcs-bac-msft-intc-littu-cmcsa-pfe-wfc,,,"The NASDAQ 100 After Hours Indicator is up 58.8 to 14,897.29. The total After hours volume is currently 108,676,620 shares traded.

The following are the most active stocks for the after hours session:

Apple Inc. (AAPL) is +0.24 at $174.85, with 6,581,820 shares traded. As reported by Zacks, the current mean recommendation for AAPL is in the ""buy range"".

AT&T Inc. (T) is +0.1 at $23.73, with 4,037,564 shares traded. T's current last sale is 79.1% of the target price of $30.

Invesco QQQ Trust, Series 1 (QQQ) is +0.26 at $362.80, with 3,690,566 shares traded. This represents a 14.88% increase from its 52 Week Low.

Barclays PLC (BCS) is +0.0599 at $7.96, with 3,524,361 shares traded. BCS's current last sale is 66.89% of the target price of $11.9.

Bank of America Corporation (BAC) is +0.13 at $41.35, with 3,402,798 shares traded. As reported by Zacks, the current mean recommendation for BAC is in the ""buy range"".

Microsoft Corporation (MSFT) is +1.57 at $309.88, with 3,189,828 shares traded. MSFT's current last sale is 85.13% of the target price of $364.

Intel Corporation (INTC) is +0.18 at $49.74, with 3,003,631 shares traded. INTC's current last sale is 93.85% of the target price of $53.

Logistics Innovation Technologies Corp. (LITTU) is -0.06 at $9.79, with 2,650,000 shares traded.

Comcast Corporation (CMCSA) is +0.3 at $47.12, with 2,415,731 shares traded. As reported by Zacks, the current mean recommendation for CMCSA is in the ""buy range"".

Pfizer, Inc. (PFE) is +0.22 at $51.99, with 2,409,647 shares traded. As reported by Zacks, the current mean recommendation for PFE is in the ""buy range"".

Wells Fargo & Company (WFC) is +0.09 at $48.55, with 2,372,977 shares traded. As reported by Zacks, the current mean recommendation for WFC is in the ""buy range"".

Ford Motor Company (F) is -0.01 at $16.90, with 2,090,686 shares traded. F's current last sale is 82.44% of the target price of $20.5.
The views and opinions expressed herein are the views and opinions of the author and do not necessarily reflect those of Nasdaq, Inc.","Intel Corporation (INTC) is +0.18 at $49.74, with 3,003,631 shares traded. INTC's current last sale is 93.85% of the target price of $53. As reported by Zacks, the current mean recommendation for AAPL is in the ""buy range"".","Intel Corporation (INTC) is +0.18 at $49.74, with 3,003,631 shares traded. INTC's current last sale is 93.85% of the target price of $53. As reported by Zacks, the current mean recommendation for AAPL is in the ""buy range"".","Intel Corporation (INTC) is +0.18 at $49.74, with 3,003,631 shares traded. INTC's current last sale is 93.85% of the target price of $53. The total After hours volume is currently 108,676,620 shares traded.","Intel Corporation (INTC) is +0.18 at $49.74, with 3,003,631 shares traded. INTC's current last sale is 93.85% of the target price of $53. The NASDAQ 100 After Hours Indicator is up 58.8 to 14,897.29.",2022,3
2022-03-31 00:00:00+00:00,Why AMD Stock Crashed on Thursday,INTC,https://www.nasdaq.com/articles/why-amd-stock-crashed-on-thursday,,,"What happened
For the second day running, shares of semiconductor giant Advanced Micro Devices (NASDAQ: AMD) fell in Thursday trading as selling accelerated. As of 11:25 a.m. ET, AMD shares are down 6.1%.
And Barclays is to blame.
Image source: Getty Images.
So what
As StreetInsider.com reports this morning, British banker Barclays just downgraded AMD stock to ""equalweight"" (i.e., hold) and slashed its price target by 22%, to just $115 a share. Of course, AMD stock was trading closer to $119 a share before the downgrade -- so despite the rating technically saying only to hold, investors sold.
The news isn't all bad. In its note, Barclays forecast continued market-share gains for AMD (at Intel's (NASDAQ: INTC) expense) ""in both the client and server markets."" Indeed, Barclays believes sales growth could exceed 31% in fiscal 2022. Problem is, by the time 2023 rolls around, Barclays believes ""cyclical risk [will arrive] across several end markets (PC, Gaming, and broad-based/XLNX).""
All three of these markets, you see, have been ""running at elevated levels"" for AMD, but both Intel and ARM are becoming more competitive. Barclays believes that by the 2024/2025 time frame, Intel could catch back up to AMD, and ARM could even take ""more share.""
Now what
So...not such great news for Advanced Micro Devices here -- but don't make the mistake of assuming that this is all good news for Intel. As Barclays confides, it's still unclear how much progress Intel has made ""in closing the process gap"" with AMD's chips. Although it's true that Intel stock at less than 11 times earnings looks a lot cheaper than AMD stock at 48 times earnings, Barclays still rates Intel stock ""underweight"" (i.e., sell) with a $45 price target.
The worst it will say about AMD is that the future is too murky for it to recommend buying AMD now that the stock has run up 47% over the past year. And if the worst Barclays sees for AMD is a $115 stock price, then the downside risk here doesn't look too bad.
10 stocks we like better than Advanced Micro Devices
When our award-winning analyst team has a stock tip, it can pay to listen. After all, the newsletter they have run for over a decade, Motley Fool Stock Advisor, has tripled the market.*
They just revealed what they believe are the ten best stocks for investors to buy right now... and Advanced Micro Devices wasn't one of them! That's right -- they think these 10 stocks are even better buys.
See the 10 stocks
*Stock Advisor returns as of March 3, 2022
Rich Smith has no position in any of the stocks mentioned. The Motley Fool owns and recommends Advanced Micro Devices and Intel. The Motley Fool recommends Barclays and recommends the following options: long January 2023 $57.50 calls on Intel and short January 2023 $57.50 puts on Intel. The Motley Fool has a disclosure policy.
The views and opinions expressed herein are the views and opinions of the author and do not necessarily reflect those of Nasdaq, Inc.","In its note, Barclays forecast continued market-share gains for AMD (at Intel's (NASDAQ: INTC) expense) ""in both the client and server markets."" What happened For the second day running, shares of semiconductor giant Advanced Micro Devices (NASDAQ: AMD) fell in Thursday trading as selling accelerated. So what As StreetInsider.com reports this morning, British banker Barclays just downgraded AMD stock to ""equalweight"" (i.e., hold) and slashed its price target by 22%, to just $115 a share.","In its note, Barclays forecast continued market-share gains for AMD (at Intel's (NASDAQ: INTC) expense) ""in both the client and server markets."" What happened For the second day running, shares of semiconductor giant Advanced Micro Devices (NASDAQ: AMD) fell in Thursday trading as selling accelerated. Although it's true that Intel stock at less than 11 times earnings looks a lot cheaper than AMD stock at 48 times earnings, Barclays still rates Intel stock ""underweight"" (i.e., sell) with a $45 price target.","In its note, Barclays forecast continued market-share gains for AMD (at Intel's (NASDAQ: INTC) expense) ""in both the client and server markets."" Although it's true that Intel stock at less than 11 times earnings looks a lot cheaper than AMD stock at 48 times earnings, Barclays still rates Intel stock ""underweight"" (i.e., sell) with a $45 price target. The worst it will say about AMD is that the future is too murky for it to recommend buying AMD now that the stock has run up 47% over the past year.","In its note, Barclays forecast continued market-share gains for AMD (at Intel's (NASDAQ: INTC) expense) ""in both the client and server markets."" Barclays believes that by the 2024/2025 time frame, Intel could catch back up to AMD, and ARM could even take ""more share."" * They just revealed what they believe are the ten best stocks for investors to buy right now... and Advanced Micro Devices wasn't one of them!",2022,2
2022-03-31 00:00:00+00:00,Chip supply chain bites own tail,INTC,https://www.nasdaq.com/articles/chip-supply-chain-bites-own-tail,,,"Reuters
Reuters


(The author is a Reuters Breakingviews columnist. The opinions expressed are their own.)
NEW YORK (Reuters Breakingviews) - The semiconductor supply chain has become so tangled that its head is biting its tail. ASM International is one company that supplies gear needed to make chips. In an interview with Nikkei Asia the Dutch company’s boss, Benjamin Loh, said https://asia.nikkei.com/Editor-s-Picks/Interview/Chip-tool-maker-warns-of-delays-as-semiconductor-crunch-bites lead times for producing its machines have extended because it is having trouble finding enough chips itself.
Semiconductor producers like Taiwan Semiconductor Manufacturing and Intel are responding to shortages by trying to ramp up production. Their new factories need machines in them, and that has swamped the makers. Fellow Dutch firm ASML, which makes lithography machines for chipmakers, has also warned of problems increasing its output.
Another wrinkle is that ASM International’s biggest customers focus on producing cutting-edge chips. Yet the worst shortages are in less advanced semiconductors – the ones AMS International is having to fight over with other users, including carmakers. History shows that chip shortages resolve themselves thanks to market forces and innovation. But today's supply chain woes will take a while to straighten out. (By Robert Cyran)
Follow @Breakingviews https://twitter.com/Breakingviews on Twitter
Capital Calls - More concise insights on global finance:
RBC’s rich UK wealth swoop may not be the last
Kweichow Moutai serves up potent new shot
China state money puts wind in Ferretti IPO sails
Nielsen takes its reboot off air
Singapore gets D.C. gold medal treatment
(Editing by Richard Beales and Sharon Lam)
The views and opinions expressed herein are the views and opinions of the author and do not necessarily reflect those of Nasdaq, Inc.","In an interview with Nikkei Asia the Dutch company’s boss, Benjamin Loh, said https://asia.nikkei.com/Editor-s-Picks/Interview/Chip-tool-maker-warns-of-delays-as-semiconductor-crunch-bites lead times for producing its machines have extended because it is having trouble finding enough chips itself. Fellow Dutch firm ASML, which makes lithography machines for chipmakers, has also warned of problems increasing its output. (By Robert Cyran) Follow @Breakingviews https://twitter.com/Breakingviews on Twitter Capital Calls - More concise insights on global finance: RBC’s rich UK wealth swoop may not be the last Kweichow Moutai serves up potent new shot China state money puts wind in Ferretti IPO sails Nielsen takes its reboot off air Singapore gets D.C. gold medal treatment (Editing by Richard Beales and Sharon Lam) The views and opinions expressed herein are the views and opinions of the author and do not necessarily reflect those of Nasdaq, Inc.","NEW YORK (Reuters Breakingviews) - The semiconductor supply chain has become so tangled that its head is biting its tail. ASM International is one company that supplies gear needed to make chips. (By Robert Cyran) Follow @Breakingviews https://twitter.com/Breakingviews on Twitter Capital Calls - More concise insights on global finance: RBC’s rich UK wealth swoop may not be the last Kweichow Moutai serves up potent new shot China state money puts wind in Ferretti IPO sails Nielsen takes its reboot off air Singapore gets D.C. gold medal treatment (Editing by Richard Beales and Sharon Lam) The views and opinions expressed herein are the views and opinions of the author and do not necessarily reflect those of Nasdaq, Inc.","NEW YORK (Reuters Breakingviews) - The semiconductor supply chain has become so tangled that its head is biting its tail. In an interview with Nikkei Asia the Dutch company’s boss, Benjamin Loh, said https://asia.nikkei.com/Editor-s-Picks/Interview/Chip-tool-maker-warns-of-delays-as-semiconductor-crunch-bites lead times for producing its machines have extended because it is having trouble finding enough chips itself. (By Robert Cyran) Follow @Breakingviews https://twitter.com/Breakingviews on Twitter Capital Calls - More concise insights on global finance: RBC’s rich UK wealth swoop may not be the last Kweichow Moutai serves up potent new shot China state money puts wind in Ferretti IPO sails Nielsen takes its reboot off air Singapore gets D.C. gold medal treatment (Editing by Richard Beales and Sharon Lam) The views and opinions expressed herein are the views and opinions of the author and do not necessarily reflect those of Nasdaq, Inc.",NEW YORK (Reuters Breakingviews) - The semiconductor supply chain has become so tangled that its head is biting its tail. ASM International is one company that supplies gear needed to make chips. Semiconductor producers like Taiwan Semiconductor Manufacturing and Intel are responding to shortages by trying to ramp up production.,2022,2
