Date,Article_title,Stock_symbol,Url,Publisher,Author,Article,Lsa_summary,Luhn_summary,Textrank_summary,Lexrank_summary,Year,sentiment_score
2022-12-18 00:00:00+00:00,"Got $5,000? 3 Stocks to Hold for the Next 20 Years",INTC,https://www.nasdaq.com/articles/got-%245000-3-stocks-to-hold-for-the-next-20-years-3,,,"The world has changed a lot over the last 20 years. It seems inevitable that it will continue evolving over the next two decades. While it's impossible to know exactly what the future might look like, we can see certain long-term trends emerging that give us a glimpse into what's ahead. We're witnessing companies bringing their businesses into the digital age, the economy transitioning energy sources, and the reversal of globalization.
Investors who plug into these megatrends by investing in stocks poised to capitalize on them should do very well over the next couple of decades. A great way to start is by investing $5,000 or so across American Tower (NYSE: AMT), Brookfield Infrastructure (NYSE: BIPC)(NYSE: BIP), and Enbridge (NYSE: ENB). Here's why that move could pay big dividends in the coming years.
Plugged into the data megatrend
American Tower is a real estate investment trust (REIT) focused on owning and leasing data infrastructure like cell towers and data centers. Data usage is growing rapidly as businesses undergo digital transformation initiatives to bring more of their business processes online. Likewise, consumers are using more data as they stream videos and other content at home and on the go. As a result, companies need more infrastructure to store and transmit data at faster speeds.
This trend should allow American Tower to add more tenants and sites to its global tower portfolio and expand its data center business. These drivers should enable American Tower to grow its cash flow and dividend at healthy rates.
American Tower currently offers a dividend yield of nearly 2.9%. It has grown that payout at a double-digit rate for over a decade. Given the growth ahead, it should have plenty of power to continue increasing its payout. Add that income to its earnings growth, and American Tower could produce market-crushing total returns over the next 20 years.
Powered by three megatrends
Global infrastructure operator Brookfield Infrastructure has positioned its business to capitalize on three megatrends: Digitalization, decarbonization, and deglobalization. The company sees a $1 trillion investment opportunity to upgrade global data infrastructure over the next five years.
The world needs to replace copper wires with fiber to increase network speeds, build more wireless infrastructure to support 5G network upgrades, the Internet of Things, and artificial intelligence, and add significantly more data center capacity. Brookfield has invested billions of dollars in building data infrastructure platforms to capitalize on those opportunities.
Brookfield has also made several investments around the decarbonization theme. It sees opportunities to help companies decarbonize their operations and assist people with reducing their energy consumption. It also has a large-scale natural gas infrastructure business to help supply the world with more of that lower-carbon fuel.
The company is also investing heavily in the deglobalization theme. Persistent supply chain issues are leading more companies to onshore manufacturing capacity. Brookfield recently pledged to invest up to $15 billion to help Intel (NASDAQ: INTC) build two new semiconductor manufacturing facilities in the U.S. as the country seeks to onshore chipmaking capabilities. That deal will help Intel fund its large-scale manufacturing capacity expansion program.
Brookfield sees tremendous investment opportunities across these megatrends. They should enable the company to grow its cash flow at a 6% to 11% annual rate over the long term. That should support 5% to 9% yearly growth in its 3.5%-yielding dividend.
Fueled by the energy transition
Energy infrastructure giant Enbridge is in an excellent position to capitalize on the energy transition theme. The company has steadily shifted its focus to lower-carbon energy sources like natural gas and renewables over the years.
It has an extensive backlog of capital projects to continue expanding in those areas. It's building several offshore wind farms in Europe. Meanwhile, it recently acquired an onshore renewable energy developer in North America. On top of that, it continues to expand its extensive gas infrastructure, including investing in an export facility.
That backlog has Enbridge on track to grow its cash flow per share at a 5% to 7% annual rate through at least 2024. Meanwhile, it has increased visibility into its post-2024 growth prospects after securing several large-scale projects this year. Those growth drivers should enable Enbridge to continue expanding its 6.9%-yielding dividend, which it has done for 28 straight years.
Megatrend-driven growth
American Tower, Brookfield Infrastructure, and Enbridge have aligned their businesses to capitalize on at least one megatrend. Because of that, they should be able to grow for decades to come. That makes them great stocks to buy and hold for the ultra-long term.
10 stocks we like better than American Tower
When our award-winning analyst team has a stock tip, it can pay to listen. After all, the newsletter they have run for over a decade, Motley Fool Stock Advisor, has tripled the market.*
They just revealed what they believe are the ten best stocks for investors to buy right now… and American Tower wasn't one of them! That's right -- they think these 10 stocks are even better buys.
See the 10 stocks
*Stock Advisor returns as of December 1, 2022
Matthew DiLallo has positions in American Tower, Brookfield Infrastructure, Brookfield Infrastructure Partners, Enbridge, and Intel and has the following options: long January 2025 $30 calls on Intel and short January 2025 $30 puts on Intel. The Motley Fool has positions in and recommends American Tower, Enbridge, and Intel. The Motley Fool recommends Brookfield Infrastructure and Brookfield Infrastructure Partners and recommends the following options: long January 2023 $57.50 calls on Intel, long January 2025 $45 calls on Intel, and short January 2025 $45 puts on Intel. The Motley Fool has a disclosure policy.
The views and opinions expressed herein are the views and opinions of the author and do not necessarily reflect those of Nasdaq, Inc.","Brookfield recently pledged to invest up to $15 billion to help Intel (NASDAQ: INTC) build two new semiconductor manufacturing facilities in the U.S. as the country seeks to onshore chipmaking capabilities. We're witnessing companies bringing their businesses into the digital age, the economy transitioning energy sources, and the reversal of globalization. The company has steadily shifted its focus to lower-carbon energy sources like natural gas and renewables over the years.","Brookfield recently pledged to invest up to $15 billion to help Intel (NASDAQ: INTC) build two new semiconductor manufacturing facilities in the U.S. as the country seeks to onshore chipmaking capabilities. Powered by three megatrends Global infrastructure operator Brookfield Infrastructure has positioned its business to capitalize on three megatrends: Digitalization, decarbonization, and deglobalization. See the 10 stocks *Stock Advisor returns as of December 1, 2022 Matthew DiLallo has positions in American Tower, Brookfield Infrastructure, Brookfield Infrastructure Partners, Enbridge, and Intel and has the following options: long January 2025 $30 calls on Intel and short January 2025 $30 puts on Intel.","Brookfield recently pledged to invest up to $15 billion to help Intel (NASDAQ: INTC) build two new semiconductor manufacturing facilities in the U.S. as the country seeks to onshore chipmaking capabilities. Plugged into the data megatrend American Tower is a real estate investment trust (REIT) focused on owning and leasing data infrastructure like cell towers and data centers. See the 10 stocks *Stock Advisor returns as of December 1, 2022 Matthew DiLallo has positions in American Tower, Brookfield Infrastructure, Brookfield Infrastructure Partners, Enbridge, and Intel and has the following options: long January 2025 $30 calls on Intel and short January 2025 $30 puts on Intel.","Brookfield recently pledged to invest up to $15 billion to help Intel (NASDAQ: INTC) build two new semiconductor manufacturing facilities in the U.S. as the country seeks to onshore chipmaking capabilities. Powered by three megatrends Global infrastructure operator Brookfield Infrastructure has positioned its business to capitalize on three megatrends: Digitalization, decarbonization, and deglobalization. Those growth drivers should enable Enbridge to continue expanding its 6.9%-yielding dividend, which it has done for 28 straight years.",2022,4
2022-12-18 00:00:00+00:00,AMD Thinks It Can Seriously Challenge Intel and Nvidia in 2023,INTC,https://www.nasdaq.com/articles/amd-thinks-it-can-seriously-challenge-intel-and-nvidia-in-2023,,,"In today's video, Jose Najarro and Nick Rossolillo discuss Advanced Micro Devices (NASDAQ: AMD) and its recent Dec. 6 presentation at the Arete Tech Conference. Management shared great information on how AMD can grow its data center solutions, especially in the accelerator market. Check out the short video to learn more, consider subscribing, and click the special offer link below.
*Stock prices used were the market prices of Dec. 13, 2022. The video was published on Dec. 15, 2022.
10 stocks we like better than Advanced Micro Devices
When our award-winning analyst team has a stock tip, it can pay to listen. After all, the newsletter they have run for over a decade, Motley Fool Stock Advisor, has tripled the market.*
They just revealed what they believe are the ten best stocks for investors to buy right now... and Advanced Micro Devices wasn't one of them! That's right -- they think these 10 stocks are even better buys.
See the 10 stocks
*Stock Advisor returns as of December 1, 2022
Jose Najarro has positions in Advanced Micro Devices and Nvidia. Nicholas Rossolillo has positions in Advanced Micro Devices and Nvidia. The Motley Fool has positions in and recommends Advanced Micro Devices, Intel, and Nvidia. The Motley Fool recommends the following options: long January 2023 $57.50 calls on Intel, long January 2025 $45 calls on Intel, and short January 2025 $45 puts on Intel. The Motley Fool has a disclosure policy. Jose Najarro is an affiliate of The Motley Fool and may be compensated for promoting its services. If you choose to subscribe through their link they will earn some extra money that supports their channel. Their opinions remain their own and are unaffected by The Motley Fool.
The views and opinions expressed herein are the views and opinions of the author and do not necessarily reflect those of Nasdaq, Inc.","In today's video, Jose Najarro and Nick Rossolillo discuss Advanced Micro Devices (NASDAQ: AMD) and its recent Dec. 6 presentation at the Arete Tech Conference. Management shared great information on how AMD can grow its data center solutions, especially in the accelerator market. * They just revealed what they believe are the ten best stocks for investors to buy right now... and Advanced Micro Devices wasn't one of them!","In today's video, Jose Najarro and Nick Rossolillo discuss Advanced Micro Devices (NASDAQ: AMD) and its recent Dec. 6 presentation at the Arete Tech Conference. The Motley Fool has positions in and recommends Advanced Micro Devices, Intel, and Nvidia. The Motley Fool recommends the following options: long January 2023 $57.50 calls on Intel, long January 2025 $45 calls on Intel, and short January 2025 $45 puts on Intel.","See the 10 stocks *Stock Advisor returns as of December 1, 2022 Jose Najarro has positions in Advanced Micro Devices and Nvidia. The Motley Fool has positions in and recommends Advanced Micro Devices, Intel, and Nvidia. The Motley Fool recommends the following options: long January 2023 $57.50 calls on Intel, long January 2025 $45 calls on Intel, and short January 2025 $45 puts on Intel.","Check out the short video to learn more, consider subscribing, and click the special offer link below. See the 10 stocks *Stock Advisor returns as of December 1, 2022 Jose Najarro has positions in Advanced Micro Devices and Nvidia. The Motley Fool has positions in and recommends Advanced Micro Devices, Intel, and Nvidia.",2022,3
2022-12-17 00:00:00+00:00,"Big Tech is Designing Chips Too, Should Semiconductor Investors Worry?",INTC,https://www.nasdaq.com/articles/big-tech-is-designing-chips-too-should-semiconductor-investors-worry,,,"In today's video, Jose Najarro and Nick Rossolillo discuss Amazon (NASDAQ: AMZN), Advanced Micro Devices (NASDAQ: AMD), Intel (NASDAQ: INTC), Apple (NASDAQ: AAPL), Alphabet (NASDAQ: GOOGL) (NASDAQ: GOOG), and why big tech investing in chip design might not be the worst thing. The fears are that it could be another Apple and Intel story. Check out the short video to learn more, consider subscribing, and click the special offer link below.
*Stock prices used were the market prices of December 13, 2022. The video was published on December 15, 2022.
Find out why Amazon.com is one of the 10 best stocks to buy now
Our award-winning analyst team has spent more than a decade beating the market. After all, the newsletter they have run for over a decade, Motley Fool Stock Advisor, has tripled the market.*
They just revealed their ten top stock picks for investors to buy right now. Amazon.com is on the list -- but there are nine others you may be overlooking.
Click here to get access to the full list!
*Stock Advisor returns as of December 1, 2022
John Mackey, CEO of Whole Foods Market, an Amazon subsidiary, is a member of The Motley Fool's board of directors. Suzanne Frey, an executive at Alphabet, is a member of The Motley Fool's board of directors. Jose Najarro has positions in Advanced Micro Devices and Alphabet. Nicholas Rossolillo has positions in Advanced Micro Devices, Alphabet, Amazon.com, and Apple. The Motley Fool has positions in and recommends Advanced Micro Devices, Alphabet, Amazon.com, Apple, and Intel. The Motley Fool recommends the following options: long January 2023 $57.50 calls on Intel, long January 2025 $45 calls on Intel, long March 2023 $120 calls on Apple, short January 2025 $45 puts on Intel, and short March 2023 $130 calls on Apple. The Motley Fool has a disclosure policy. Jose Najarro is an affiliate of The Motley Fool and may be compensated for promoting its services. If you choose to subscribe through their link they will earn some extra money that supports their channel. Their opinions remain their own and are unaffected by The Motley Fool.
The views and opinions expressed herein are the views and opinions of the author and do not necessarily reflect those of Nasdaq, Inc.","In today's video, Jose Najarro and Nick Rossolillo discuss Amazon (NASDAQ: AMZN), Advanced Micro Devices (NASDAQ: AMD), Intel (NASDAQ: INTC), Apple (NASDAQ: AAPL), Alphabet (NASDAQ: GOOGL) (NASDAQ: GOOG), and why big tech investing in chip design might not be the worst thing. Find out why Amazon.com is one of the 10 best stocks to buy now Our award-winning analyst team has spent more than a decade beating the market. *Stock Advisor returns as of December 1, 2022 John Mackey, CEO of Whole Foods Market, an Amazon subsidiary, is a member of The Motley Fool's board of directors.","In today's video, Jose Najarro and Nick Rossolillo discuss Amazon (NASDAQ: AMZN), Advanced Micro Devices (NASDAQ: AMD), Intel (NASDAQ: INTC), Apple (NASDAQ: AAPL), Alphabet (NASDAQ: GOOGL) (NASDAQ: GOOG), and why big tech investing in chip design might not be the worst thing. The Motley Fool has positions in and recommends Advanced Micro Devices, Alphabet, Amazon.com, Apple, and Intel. The Motley Fool recommends the following options: long January 2023 $57.50 calls on Intel, long January 2025 $45 calls on Intel, long March 2023 $120 calls on Apple, short January 2025 $45 puts on Intel, and short March 2023 $130 calls on Apple.","In today's video, Jose Najarro and Nick Rossolillo discuss Amazon (NASDAQ: AMZN), Advanced Micro Devices (NASDAQ: AMD), Intel (NASDAQ: INTC), Apple (NASDAQ: AAPL), Alphabet (NASDAQ: GOOGL) (NASDAQ: GOOG), and why big tech investing in chip design might not be the worst thing. The Motley Fool has positions in and recommends Advanced Micro Devices, Alphabet, Amazon.com, Apple, and Intel. The Motley Fool recommends the following options: long January 2023 $57.50 calls on Intel, long January 2025 $45 calls on Intel, long March 2023 $120 calls on Apple, short January 2025 $45 puts on Intel, and short March 2023 $130 calls on Apple.","In today's video, Jose Najarro and Nick Rossolillo discuss Amazon (NASDAQ: AMZN), Advanced Micro Devices (NASDAQ: AMD), Intel (NASDAQ: INTC), Apple (NASDAQ: AAPL), Alphabet (NASDAQ: GOOGL) (NASDAQ: GOOG), and why big tech investing in chip design might not be the worst thing. Check out the short video to learn more, consider subscribing, and click the special offer link below. Jose Najarro has positions in Advanced Micro Devices and Alphabet.",2022,4
2022-12-16 00:00:00+00:00,Digging Deep to Find Value: Stocks to Consider for 2023,INTC,https://www.nasdaq.com/articles/digging-deep-to-find-value%3A-stocks-to-consider-for-2023,,,"W
e are at that time when looking back at the year that was will become a very popular thing to do for fund managers and the like who will measure their performance against stock indices and averages. The problem this year is that averages are misleading. As the year has gone on, the spread of performance between sectors and styles of stocks has grown to the point where the average of them tells us just about nothing.
The best performing SPDR Sector ETF by far is energy (XLE), which has returned 54% so far this year, as compared to the worst performing, consumer discretionary (XLY), which has lost 33%. That massive spread is why looking at the performance of any average is limited in its usefulness. Even within those sector averages, there are distortions, too. The big losses in XLY are driven mainly by its two biggest components, Amazon (AMZN) and Tesla (TSLA) which, combined, make up nearly 37% of the fund and which have dropped 49% and 54%, respectively. That drags the sector down, more than negating some small positive years from stocks like McDonald’s (MCD).
With the exception of energy stocks, what sector or industry a company operates in has not been a major factor in how their stocks have performed. What has mattered is how high their P/E, or earnings multiple, was coming into the year. Sky-high P/Es, based on assumptions of strong growth, are really no more, certainly when it comes to established businesses.
All of this matters to investors because it makes one of the more popular year-end strategies questionable at best. Many investors look at underperformers from the year and invest in these on the basis that, in markets, everything eventually returns to the mean. That strategy will not be as effective as it has been in the past. If a stock has fallen to below an average multiple because an industry is out of favor it will probably bounce back, but if it has dropped from an earnings multiple of, say, ten times the average to five times, it may never regain that 10x level. That isn’t to say that stocks like AMZN and TSLA can’t bounce back next year -- they certainly can, but it will probably be based on earnings growth that outstrips now-reduced expectations rather than an expansion of the adjusted multiples.
So, what investors should be looking for as this year ends are not necessarily the worst performers of the year, but underperformers with P/Es that are already below average. Or, to put it another way, good old-fashioned value.
That brings in an old strategy known as the “Dogs of the Dow”, which identifies the best value in the group of stocks that make up the Dow Jones Industrial Average based on those that have the highest dividend yield. It may seem strange to look for opportunity based on yield at a time when the Fed is raising interest rates, thereby reducing the value of a stock’s yield, but the whole point of the strategy is that it ignores what is happening now and assumes that things will change before too long. It is, in many ways, the ultimate contrarian strategy. Like any strategy, though, it is best applied selectively.
According to the website Dogsofthedow.com, the top ten dogs right now are as follows:
And there are a few there that stand out to me, both as possibilities and as stocks that may be value traps.
Starting with the negative, Verizon (VZ) may have the highest yield in the Dow, but in current circumstances it may not represent the best value. One could argue that the telecoms industry is one that will do well whatever economic conditions next year brings, but their problems are not really based on their industry, but more about their competitiveness within it. That can be seen by the fact that VZ is down 23% YTD, whereas its competitor, AT&T (T) has gained over 6% this year. The problem is that VZ lost their network superiority, and that will take a long time to fix, so a recovery next year looks unlikely.
On the positive side, there are a couple of stocks on this list that do offer serious upside. Two of the “old tech” names there, Intel (INTC) and Cisco (CSCO), have been dragged down by pessimism around tech, but that has been about adjusting inflated P/Es more than anything, and they don’t fit that description. If anything, at 8.4 and 17.2, respectively, their P/Es look low in an environment where companies are expecting to expand IT spending, whatever the state of the economy.
Others that appeal to me include Walgreens Boots Alliance (WBA), with a P/E of 7.8 and Chevron (CVX) which, despite huge gains this year still appears on the list and has a P/E of 9.6.
Overall, the lesson when looking back at the year is that investors should be careful about using simplistic analysis. The variation in performance, both between and within sectors, has been so great that lumping things together will give a false impression. However, digging a little deeper and looking at stocks individually will reveal that there is some value to be found.
* In addition to contributing here, Martin Tillier works as Head of Research at the crypto platform SmartFI.
The views and opinions expressed herein are the views and opinions of the author and do not necessarily reflect those of Nasdaq, Inc.","Two of the “old tech” names there, Intel (INTC) and Cisco (CSCO), have been dragged down by pessimism around tech, but that has been about adjusting inflated P/Es more than anything, and they don’t fit that description. The big losses in XLY are driven mainly by its two biggest components, Amazon (AMZN) and Tesla (TSLA) which, combined, make up nearly 37% of the fund and which have dropped 49% and 54%, respectively. That isn’t to say that stocks like AMZN and TSLA can’t bounce back next year -- they certainly can, but it will probably be based on earnings growth that outstrips now-reduced expectations rather than an expansion of the adjusted multiples.","Two of the “old tech” names there, Intel (INTC) and Cisco (CSCO), have been dragged down by pessimism around tech, but that has been about adjusting inflated P/Es more than anything, and they don’t fit that description. If a stock has fallen to below an average multiple because an industry is out of favor it will probably bounce back, but if it has dropped from an earnings multiple of, say, ten times the average to five times, it may never regain that 10x level. That isn’t to say that stocks like AMZN and TSLA can’t bounce back next year -- they certainly can, but it will probably be based on earnings growth that outstrips now-reduced expectations rather than an expansion of the adjusted multiples.","Two of the “old tech” names there, Intel (INTC) and Cisco (CSCO), have been dragged down by pessimism around tech, but that has been about adjusting inflated P/Es more than anything, and they don’t fit that description. e are at that time when looking back at the year that was will become a very popular thing to do for fund managers and the like who will measure their performance against stock indices and averages. If a stock has fallen to below an average multiple because an industry is out of favor it will probably bounce back, but if it has dropped from an earnings multiple of, say, ten times the average to five times, it may never regain that 10x level.","Two of the “old tech” names there, Intel (INTC) and Cisco (CSCO), have been dragged down by pessimism around tech, but that has been about adjusting inflated P/Es more than anything, and they don’t fit that description. e are at that time when looking back at the year that was will become a very popular thing to do for fund managers and the like who will measure their performance against stock indices and averages. That isn’t to say that stocks like AMZN and TSLA can’t bounce back next year -- they certainly can, but it will probably be based on earnings growth that outstrips now-reduced expectations rather than an expansion of the adjusted multiples.",2022,4
