Date,Article_title,Stock_symbol,Url,Publisher,Author,Article,Lsa_summary,Luhn_summary,Textrank_summary,Lexrank_summary,Year,sentiment_score
2022-03-25 00:00:00+00:00,3 Dividend-Paying Tech Stocks to Buy Right Now,INTC,https://www.nasdaq.com/articles/3-dividend-paying-tech-stocks-to-buy-right-now-2,,,"Most people hear the phrase ""technology stocks"" these days and immediately think of volatile, rapid-growing investments suitable only for the boldest investors. But this description paints with too broad a brush! There are several established tech stocks that not only grow but are also profitable and pay dividends to their shareholders, rewarding them for owning stock in the business.
Finding them does require some searching and some research and I can help with that. Here are three dividend-paying tech stocks that have industry-leading businesses in their respective specialties. Long-term investors might want to consider them as potential additions to their portfolios.
Image source: Getty Images.
1. Apple
There's an investing adage that says, ""Start by investing in what you know."" Technology giant Apple (NASDAQ: AAPL) is a stock that most people are very familiar with. An estimated 1.65 billion people worldwide use Apple devices; its phones, computers, watches, and various services regularly touch consumers' daily lives.
This dominance and brand recognition has created one of the largest companies in the world, with annual revenue of more than $365 billion. Apple converts roughly 25% of its revenue into free cash flow, making it a powerful cash-generating machine. The company returns a lot of it to shareholders in the form of stock buybacks ($85.5 billion in 2021 alone). But it also distributes dividends ($0.88 per share in 2021), and management has raised the payout the past nine years at an average increase of 9.4% annually. The dividend itself yields 0.5% at the current share price.
Dividend investors might scoff at the low dividend yield, but part of the reason for that low yield is the significant growth Apple still generates despite its massive size which has led to outsized stock price appreciation. Revenue growth has averaged 15% per year over the past three years, while earnings per share have outrun it, averaging 23.5% growth per year thanks to stock buybacks. Apple is a total package and fits in just about any long-term portfolio.
2. Verizon
Another company you've probably heard of is telecom giant Verizon Communications (NYSE: VZ). It's one of only a handful of wireless telecom companies in the U.S., and the massive network infrastructure built over decades with billions of dollars of investment has built quite the competitive moat. It simply doesn't make sense for a new competitor to spend the time and money to try to penetrate the wireless industry.
Cell phones have effectively become a utility and their importance makes Verizon's business reliable in almost any economic scenario, ensuring steady monthly income. That steady cash generation has helped the company pay a steady dividend. Verizon's stock price has been relatively flat over the past five years. Couple that with steady dividend increases and the yield now tops 5% at the current share price, which gives investors a healthy dose of income for holding shares.
Verizon hasn't traditionally been a fast-growing company; management has raised the payout for the past 17 years, but the average yearly raise has amounted to just over 2% over the past five years. The company could see an uptick in growth as 5G rolls out and becomes more central to the economy. New technologies like autonomous driving, streaming, and connected devices (IoT -- internet of things) could increase the demand for network services.
3. Intel
An increasingly digital world means more components are needed to power the computers and devices that make things work. Chipmaker Intel (NASDAQ: INTC) is a titan in the industry, inventing the x86 CPU chip architecture used throughout the world today. The industry has become increasingly competitive, but Intel still produces about 65% of x86 chips in circulation.
This long-standing success has made Intel one of the largest tech companies globally; its stock has a market cap of almost $200 billion, and its revenue totaled $79 billion in 2021. Intel generated $11.3 billion in free cash flow in 2021, some of which went to investors as dividends. The company has increased its payout for the past seven years, raising it an average of 6.2% annually over the past five years. Investors can get a solid 3% dividend yield at the current share price.
There's currently a shortage of semiconductor chips, and Intel is taking advantage of the challenge by investing heavily into becoming a leading chip manufacturer. It's spending $20 billion to build two chip factories (called ""fabs"") in Ohio and another $20 billion to expand capabilities in Arizona. This will make Intel the leading U.S. chip producer by a wide margin, which could invite growth opportunities from working more closely with the government and other U.S. businesses.
10 stocks we like better than Apple
When our award-winning analyst team has a stock tip, it can pay to listen. After all, the newsletter they have run for over a decade, Motley Fool Stock Advisor, has tripled the market.*
They just revealed what they believe are the ten best stocks for investors to buy right now... and Apple wasn't one of them! That's right -- they think these 10 stocks are even better buys.
See the 10 stocks
*Stock Advisor returns as of March 3, 2022
Justin Pope has no position in any of the stocks mentioned. The Motley Fool owns and recommends Apple and Intel. The Motley Fool recommends Verizon Communications and recommends the following options: long January 2023 $57.50 calls on Intel, long March 2023 $120 calls on Apple, short January 2023 $57.50 puts on Intel, and short March 2023 $130 calls on Apple. The Motley Fool has a disclosure policy.
The views and opinions expressed herein are the views and opinions of the author and do not necessarily reflect those of Nasdaq, Inc.","Chipmaker Intel (NASDAQ: INTC) is a titan in the industry, inventing the x86 CPU chip architecture used throughout the world today. An estimated 1.65 billion people worldwide use Apple devices; its phones, computers, watches, and various services regularly touch consumers' daily lives. Cell phones have effectively become a utility and their importance makes Verizon's business reliable in almost any economic scenario, ensuring steady monthly income.","Chipmaker Intel (NASDAQ: INTC) is a titan in the industry, inventing the x86 CPU chip architecture used throughout the world today. Revenue growth has averaged 15% per year over the past three years, while earnings per share have outrun it, averaging 23.5% growth per year thanks to stock buybacks. Verizon hasn't traditionally been a fast-growing company; management has raised the payout for the past 17 years, but the average yearly raise has amounted to just over 2% over the past five years.","Chipmaker Intel (NASDAQ: INTC) is a titan in the industry, inventing the x86 CPU chip architecture used throughout the world today. Dividend investors might scoff at the low dividend yield, but part of the reason for that low yield is the significant growth Apple still generates despite its massive size which has led to outsized stock price appreciation. Revenue growth has averaged 15% per year over the past three years, while earnings per share have outrun it, averaging 23.5% growth per year thanks to stock buybacks.","Chipmaker Intel (NASDAQ: INTC) is a titan in the industry, inventing the x86 CPU chip architecture used throughout the world today. There are several established tech stocks that not only grow but are also profitable and pay dividends to their shareholders, rewarding them for owning stock in the business. Revenue growth has averaged 15% per year over the past three years, while earnings per share have outrun it, averaging 23.5% growth per year thanks to stock buybacks.",2022,4
2022-03-25 00:00:00+00:00,"Dow Movers: HD, BA",INTC,https://www.nasdaq.com/articles/dow-movers%3A-hd-ba,,,"In early trading on Friday, shares of Boeing topped the list of the day's best performing Dow Jones Industrial Average components, trading up 1.2%. Year to date, Boeing has lost about 5.0% of its value.
And the worst performing Dow component thus far on the day is Home Depot, trading down 1.3%. Home Depot is lower by about 24.9% looking at the year to date performance.
Two other components making moves today are Intel, trading down 0.8%, and American Express, trading up 1.1% on the day.
VIDEO: Dow Movers: HD, BA
The views and opinions expressed herein are the views and opinions of the author and do not necessarily reflect those of Nasdaq, Inc.","In early trading on Friday, shares of Boeing topped the list of the day's best performing Dow Jones Industrial Average components, trading up 1.2%. And the worst performing Dow component thus far on the day is Home Depot, trading down 1.3%. Home Depot is lower by about 24.9% looking at the year to date performance.","In early trading on Friday, shares of Boeing topped the list of the day's best performing Dow Jones Industrial Average components, trading up 1.2%. And the worst performing Dow component thus far on the day is Home Depot, trading down 1.3%. VIDEO: Dow Movers: HD, BA The views and opinions expressed herein are the views and opinions of the author and do not necessarily reflect those of Nasdaq, Inc.","In early trading on Friday, shares of Boeing topped the list of the day's best performing Dow Jones Industrial Average components, trading up 1.2%. And the worst performing Dow component thus far on the day is Home Depot, trading down 1.3%. Two other components making moves today are Intel, trading down 0.8%, and American Express, trading up 1.1% on the day.","And the worst performing Dow component thus far on the day is Home Depot, trading down 1.3%. Home Depot is lower by about 24.9% looking at the year to date performance. VIDEO: Dow Movers: HD, BA The views and opinions expressed herein are the views and opinions of the author and do not necessarily reflect those of Nasdaq, Inc.",2022,3
2022-03-25 00:00:00+00:00,These Are 5 of the Fastest-Growing Large-Cap Stocks on the Planet,INTC,https://www.nasdaq.com/articles/these-are-5-of-the-fastest-growing-large-cap-stocks-on-the-planet-0,,,"There's a common thought in the investing universe that you need to take a ton of risk in order to generate strong returns in the stock market. This often pushes you toward small, speculative companies that haven't yet proven themselves to the market, but it doesn't have to be that way.
Large-cap stocks, or companies worth $10 billion or more by market cap, are still growing leaps and bounds, enough to produce stunning returns for your portfolio, and they're more established than smaller, riskier names. Here are five of the fastest-growing large-cap companies to consider for your portfolio.
Image source: Getty Images.
1. Datadog
Software company Datadog (NASDAQ: DDOG) operates a platform that monitors customers' cloud activity and analyzes it to provide insights and data. These insights give Datadog's customers (other companies) valuable information on user experience, security, network status, and more. The company operates as a software-as-a-service (SaaS) platform, thus generating recurring revenue.
Companies are becoming increasingly digital, moving more parts of their business operations into the cloud, removing the need for on-site servers and storage. Datadog has benefited from this trend, growing revenue 70% to $1.0 billion in 2021. That marked an acceleration from 2020 when revenue increased 66%, a rarity given how many tech stocks saw their growth slow last year as pandemic conditions eased.
2. Advanced Micro Devices
Many emerging technologies require computing power, and semiconductor company Advanced Micro Devices (NASDAQ: AMD) is poised to help provide the hardware to power applications like supercomputing, 5G, artificial intelligence, and more. AMD has traditionally competed with rival Intel, but AMD has gained ground in recent years due to technological advancements in bringing new chip architectures to market.
The company generated $16.4 billion in revenue in 2021, up 68% and an impressive leap considering its already large revenue base. AMD also recently closed its massive $50 billion acquisition of Xilinx, which gives it a strong foothold in adaptive computing products and increases AMD's total addressable market to an estimated $135 billion.
3. Sea Limited
E-commerce, gaming, and digital payments are all ""hot"" growth industries for investors, and internet conglomerate Sea Limited (NYSE: SE) does all three. The company primarily serves Southeast Asia but has expanded to new markets like Latin America and parts of Europe. The company's mobile game Freefire is among the most popular mobile games globally.
Sea is growing at a blistering pace -- revenue increased 128% last year, extending a multiyear streak of triple-digit top-line gains. That kind of growth won't last forever, but Sea has a lot of levers to pull to drive future growth. Management is guiding for its fintech business to expand 155% this year, which should help offset an expected slowdown in the gaming business.
4. Snowflake
Data is becoming an essential resource for businesses to analyze and learn from. However, most companies have outdated storage methods, often keeping data segregated in various formats and locations. Snowflake (NYSE: SNOW) operates a cloud-based platform that enables companies to efficiently store and share data.
Simplifying that process seems to be solving a massive problem for Snowflake's customers. The company recently closed its fiscal 2022, growing revenue 106% to $1.2 billion. The company has an impressive 178% net revenue retention rate, which means Snowflake's customers are spending much more with the company with each passing year. With just under 6,000 customers, there's a huge market for Snowflake to pick up new customers in the years ahead.
5. The Trade Desk
Ad money is steadily flowing out of outdated media formats, like broadcast television, and into new digital ones, such as connected TV devices for streaming. The Trade Desk (NASDAQ: TTD) operates one of the leading independent ad-technology exchanges, where companies can buy digital ad campaigns, target them toward a specific audience, and see how their campaigns perform.
It's not the fastest-growing company on this list -- 2021 revenue was up 43%. But that marked an increase from the previous two fiscal years. There's a significant tailwind in the advertising industry with an estimated $155 billion spent on programmatic ads in 2021, a figure which should keep growing, and The Trade Desk can lean into that opportunity for years to come.
10 stocks we like better than Datadog
When our award-winning analyst team has a stock tip, it can pay to listen. After all, the newsletter they have run for over a decade, Motley Fool Stock Advisor, has tripled the market.*
They just revealed what they believe are the ten best stocks for investors to buy right now... and Datadog wasn't one of them! That's right -- they think these 10 stocks are even better buys.
See the 10 stocks
*Stock Advisor returns as of March 3, 2022
Justin Pope has no position in any of the stocks mentioned. The Motley Fool owns and recommends Advanced Micro Devices, Datadog, Intel, Sea Limited, Snowflake Inc., and The Trade Desk. The Motley Fool recommends the following options: long January 2023 $57.50 calls on Intel and short January 2023 $57.50 puts on Intel. The Motley Fool has a disclosure policy.
The views and opinions expressed herein are the views and opinions of the author and do not necessarily reflect those of Nasdaq, Inc.","Large-cap stocks, or companies worth $10 billion or more by market cap, are still growing leaps and bounds, enough to produce stunning returns for your portfolio, and they're more established than smaller, riskier names. The Trade Desk Ad money is steadily flowing out of outdated media formats, like broadcast television, and into new digital ones, such as connected TV devices for streaming. There's a significant tailwind in the advertising industry with an estimated $155 billion spent on programmatic ads in 2021, a figure which should keep growing, and The Trade Desk can lean into that opportunity for years to come.","Datadog Software company Datadog (NASDAQ: DDOG) operates a platform that monitors customers' cloud activity and analyzes it to provide insights and data. Advanced Micro Devices Many emerging technologies require computing power, and semiconductor company Advanced Micro Devices (NASDAQ: AMD) is poised to help provide the hardware to power applications like supercomputing, 5G, artificial intelligence, and more. The Motley Fool owns and recommends Advanced Micro Devices, Datadog, Intel, Sea Limited, Snowflake Inc., and The Trade Desk.","Large-cap stocks, or companies worth $10 billion or more by market cap, are still growing leaps and bounds, enough to produce stunning returns for your portfolio, and they're more established than smaller, riskier names. Datadog Software company Datadog (NASDAQ: DDOG) operates a platform that monitors customers' cloud activity and analyzes it to provide insights and data. The company has an impressive 178% net revenue retention rate, which means Snowflake's customers are spending much more with the company with each passing year.","Datadog Software company Datadog (NASDAQ: DDOG) operates a platform that monitors customers' cloud activity and analyzes it to provide insights and data. The company recently closed its fiscal 2022, growing revenue 106% to $1.2 billion. The Motley Fool owns and recommends Advanced Micro Devices, Datadog, Intel, Sea Limited, Snowflake Inc., and The Trade Desk.",2022,3
2022-03-24 00:00:00+00:00,"Thursday Sector Leaders: Technology & Communications, Materials",INTC,https://www.nasdaq.com/articles/thursday-sector-leaders%3A-technology-communications-materials-0,,,"Looking at the sectors faring best as of midday Thursday, shares of Technology & Communications companies are outperforming other sectors, higher by 1.5%. Within the sector, NVIDIA Corp (Symbol: NVDA) and Intel Corp (Symbol: INTC) are two of the day's stand-outs, showing a gain of 9.6% and 6.0%, respectively. Among technology ETFs, one ETF following the sector is the Technology Select Sector SPDR ETF (Symbol: XLK), which is up 1.8% on the day, and down 9.49% year-to-date. NVIDIA Corp, meanwhile, is down 4.46% year-to-date, and Intel Corp is up 0.05% year-to-date. Combined, NVDA and INTC make up approximately 6.2% of the underlying holdings of XLK.
The next best performing sector is the Materials sector, up 1.1%. Among large Materials stocks, Nucor Corp. (Symbol: NUE) and Linde plc (Symbol: LIN) are the most notable, showing a gain of 3.9% and 3.0%, respectively. One ETF closely tracking Materials stocks is the Materials Select Sector SPDR ETF (XLB), which is up 1.5% in midday trading, and down 2.65% on a year-to-date basis. Nucor Corp., meanwhile, is up 33.88% year-to-date, and Linde plc, is down 8.28% year-to-date. Combined, NUE and LIN make up approximately 20.1% of the underlying holdings of XLB.
Comparing these stocks and ETFs on a trailing twelve month basis, below is a relative stock price performance chart, with each of the symbols shown in a different color as labeled in the legend at the bottom:
Here's a snapshot of how the S&P 500 components within the various sectors are faring in afternoon trading on Thursday. As you can see, nine sectors are up on the day, while none of the sectors are down.
SECTOR % CHANGE
Technology & Communications +1.5%
Materials +1.1%
Healthcare +0.9%
Services +0.8%
Utilities +0.8%
Industrial +0.7%
Energy +0.7%
Consumer Products +0.6%
Financial +0.3%
10 ETFs With Stocks That Insiders Are Buying »
The views and opinions expressed herein are the views and opinions of the author and do not necessarily reflect those of Nasdaq, Inc.","Within the sector, NVIDIA Corp (Symbol: NVDA) and Intel Corp (Symbol: INTC) are two of the day's stand-outs, showing a gain of 9.6% and 6.0%, respectively. Combined, NVDA and INTC make up approximately 6.2% of the underlying holdings of XLK. Combined, NUE and LIN make up approximately 20.1% of the underlying holdings of XLB.","Within the sector, NVIDIA Corp (Symbol: NVDA) and Intel Corp (Symbol: INTC) are two of the day's stand-outs, showing a gain of 9.6% and 6.0%, respectively. Combined, NVDA and INTC make up approximately 6.2% of the underlying holdings of XLK. Among technology ETFs, one ETF following the sector is the Technology Select Sector SPDR ETF (Symbol: XLK), which is up 1.8% on the day, and down 9.49% year-to-date.","Within the sector, NVIDIA Corp (Symbol: NVDA) and Intel Corp (Symbol: INTC) are two of the day's stand-outs, showing a gain of 9.6% and 6.0%, respectively. Combined, NVDA and INTC make up approximately 6.2% of the underlying holdings of XLK. Among technology ETFs, one ETF following the sector is the Technology Select Sector SPDR ETF (Symbol: XLK), which is up 1.8% on the day, and down 9.49% year-to-date.","Within the sector, NVIDIA Corp (Symbol: NVDA) and Intel Corp (Symbol: INTC) are two of the day's stand-outs, showing a gain of 9.6% and 6.0%, respectively. Combined, NVDA and INTC make up approximately 6.2% of the underlying holdings of XLK. Among technology ETFs, one ETF following the sector is the Technology Select Sector SPDR ETF (Symbol: XLK), which is up 1.8% on the day, and down 9.49% year-to-date.",2022,4
