Date,Article_title,Stock_symbol,Url,Publisher,Author,Article,Lsa_summary,Luhn_summary,Textrank_summary,Lexrank_summary,Year,sentiment_score
2022-05-24 00:00:00+00:00,ANALYSIS-Beaten-down U.S. retail stocks may still be too pricy for investors,DLTR,https://www.nasdaq.com/articles/analysis-beaten-down-u.s.-retail-stocks-may-still-be-too-pricy-for-investors-0,,,"By Lewis Krauskopf and Sinéad Carew
NEW YORK, May 23 (Reuters) - Shares of U.S. retailers and consumer-oriented stocks took a beating last week, but may not yet be low enough to tempt long-term investors who remain worried about whether surging inflation will continue to hurt corporate bottom-lines and cause shoppers to cut back.
Last week, consumer staples .SPLRCS dived 8.6% and consumer discretionary .SPLRCD tumbled 7.4%, the biggest declines of any S&P 500 sectors, with inflation hammering corporate results. Shares of some companies fared far worse, with Walmart WMT.N swooning 19.5% for the week and Target TGT.N plunging 29% after disappointing results.
Investors worry more declines could be in store if consumers cut spending in the face of higher prices. Among earnings reports due this week are Best Buy BBY.N on Tuesday and Dollar General DG.N and Costco Wholesale COST.O on Thursday.
“I think it has been a wake-up call to investors that the consumer is being impacted by higher inflation ... sooner than what I think the Street was anticipating,” said Robert Pavlik, senior portfolio manager at Dakota Wealth Management. “We are only at the beginning of people trading down and changing their spending patterns.”
The latest consumer price index jumped 8.3% on an annual basis. Prices for gasoline stand more than 50% higher than a year ago, according to AAA.
The Fed has promised to keep raising U.S. interest rates until inflation is squashed, a key factor hitting risk appetite for investors and putting the S&P 500 on the cusp of a bear market, defined as a 20% decline from its record high.
Kim Forrest, chief investment officer at Bokeh Capital Partners, believes surging oil and gasoline prices will keep undermining consumer spending.
""I'd be very cautious of discretionary retail at this point,"" she said. ""So many people are affected by high gas prices and high fuel prices.""
A survey by Morgan Stanley found that more than half of consumers plan to cut spending over the next six months due to inflation. The bank said most cuts were expected to come from categories such as dining out and footwear and apparel.
To be sure, the slump in share prices has made valuations more tempting. The forward price-to-earnings ratio for the S&P 500 retailing index .SPXRT, for which Amazon AMZN.O makes up half the weight, has come down to 25.4 times from 33.9 times at the end of 2021, according to Refinitiv Datastream.
Peter Tuz, president of Chase Investment Counsel, said he would likely take a closer look in coming days at whether Target shares warrant buying after sliding 25% the day of its earnings report.
""A stock like Target, when it falls 25%, you ought to look at it,"" Tuz said. ""You may decide not to buy it, but it’s one of America’s premier retailers.""
Mona Mahajan, senior investment strategist at Edward Jones, said that while the ""risk/reward is certainly getting more interesting"" in retail, she wants to see evidence of ebbing inflation.
""While we're seeing interesting opportunities forming, we'd like to have some confirmation of the inflation story before we really step in,"" Mahajan said.
(Reporting by Lewis Krauskopf and Sinead Carew; Editing by Ira Iosebashvili and David Gregorio)
((lewis.krauskopf@thomsonreuters.com; 646-223-6082; Reuters Messaging: lewis.krauskopf.thomsonreuters.com@reuters.net, Twitter: @LKrauskopf))
The views and opinions expressed herein are the views and opinions of the author and do not necessarily reflect those of Nasdaq, Inc.","By Lewis Krauskopf and Sinéad Carew NEW YORK, May 23 (Reuters) - Shares of U.S. retailers and consumer-oriented stocks took a beating last week, but may not yet be low enough to tempt long-term investors who remain worried about whether surging inflation will continue to hurt corporate bottom-lines and cause shoppers to cut back. The Fed has promised to keep raising U.S. interest rates until inflation is squashed, a key factor hitting risk appetite for investors and putting the S&P 500 on the cusp of a bear market, defined as a 20% decline from its record high. Kim Forrest, chief investment officer at Bokeh Capital Partners, believes surging oil and gasoline prices will keep undermining consumer spending.","By Lewis Krauskopf and Sinéad Carew NEW YORK, May 23 (Reuters) - Shares of U.S. retailers and consumer-oriented stocks took a beating last week, but may not yet be low enough to tempt long-term investors who remain worried about whether surging inflation will continue to hurt corporate bottom-lines and cause shoppers to cut back. Among earnings reports due this week are Best Buy BBY.N on Tuesday and Dollar General DG.N and Costco Wholesale COST.O on Thursday. Peter Tuz, president of Chase Investment Counsel, said he would likely take a closer look in coming days at whether Target shares warrant buying after sliding 25% the day of its earnings report.","By Lewis Krauskopf and Sinéad Carew NEW YORK, May 23 (Reuters) - Shares of U.S. retailers and consumer-oriented stocks took a beating last week, but may not yet be low enough to tempt long-term investors who remain worried about whether surging inflation will continue to hurt corporate bottom-lines and cause shoppers to cut back. Last week, consumer staples .SPLRCS dived 8.6% and consumer discretionary .SPLRCD tumbled 7.4%, the biggest declines of any S&P 500 sectors, with inflation hammering corporate results. Investors worry more declines could be in store if consumers cut spending in the face of higher prices.","By Lewis Krauskopf and Sinéad Carew NEW YORK, May 23 (Reuters) - Shares of U.S. retailers and consumer-oriented stocks took a beating last week, but may not yet be low enough to tempt long-term investors who remain worried about whether surging inflation will continue to hurt corporate bottom-lines and cause shoppers to cut back. Last week, consumer staples .SPLRCS dived 8.6% and consumer discretionary .SPLRCD tumbled 7.4%, the biggest declines of any S&P 500 sectors, with inflation hammering corporate results. Investors worry more declines could be in store if consumers cut spending in the face of higher prices.",2022,2
2022-05-23 00:00:00+00:00,ANALYSIS-Beaten-down U.S. retail stocks may still be too pricy for investors,DLTR,https://www.nasdaq.com/articles/analysis-beaten-down-u.s.-retail-stocks-may-still-be-too-pricy-for-investors,,,"By Lewis Krauskopf and Sinéad Carew
NEW YORK, May 23 (Reuters) - Shares of U.S. retailers and consumer-oriented stocks took a beating last week, but may not yet be low enough to tempt long-term investors who remain worried about whether surging inflation will continue to hurt corporate bottom-lines and cause shoppers to cut back.
Last week, consumer staples .SPLRCS dived 8.6% and consumer discretionary .SPLRCD tumbled 7.4%, the biggest declines of any S&P 500 sectors, with inflation hammering corporate results. Shares of some companies fared far worse, with Walmart WMT.N swooning 19.5% for the week and Target TGT.N plunging 29% after disappointing results.
Investors worry more declines could be in store if consumers cut spending in the face of higher prices. Among earnings reports due this week are Best Buy BBY.N on Tuesday and Dollar General DG.N and Costco Wholesale COST.O on Thursday.
“I think it has been a wake-up call to investors that the consumer is being impacted by higher inflation ... sooner than what I think the Street was anticipating,” said Robert Pavlik, senior portfolio manager at Dakota Wealth Management. “We are only at the beginning of people trading down and changing their spending patterns.”
The latest consumer price index jumped 8.3% on an annual basis. Prices for gasoline stand more than 50% higher than a year ago, according to AAA.
The Fed has promised to keep raising U.S. interest rates until inflation is squashed, a key factor hitting risk appetite for investors and putting the S&P 500 on the cusp of a bear market, defined as a 20% decline from its record high.
Kim Forrest, chief investment officer at Bokeh Capital Partners, believes surging oil and gasoline prices will keep undermining consumer spending.
""I'd be very cautious of discretionary retail at this point,"" she said. ""So many people are affected by high gas prices and high fuel prices.""
A survey by Morgan Stanley found that more than half of consumers plan to cut spending over the next six months due to inflation. The bank said most cuts were expected to come from categories such as dining out and footwear and apparel.
To be sure, the slump in share prices has made valuations more tempting. The forward price-to-earnings ratio for the S&P 500 retailing index .SPXRT, for which Amazon AMZN.O makes up half the weight, has come down to 25.4 times from 33.9 times at the end of 2021, according to Refinitiv Datastream.
Peter Tuz, president of Chase Investment Counsel, said he would likely take a closer look in coming days at whether Target shares warrant buying after sliding 25% the day of its earnings report.
""A stock like Target, when it falls 25%, you ought to look at it,"" Tuz said. ""You may decide not to buy it, but it’s one of America’s premier retailers.""
Mona Mahajan, senior investment strategist at Edward Jones, said that while the ""risk/reward is certainly getting more interesting"" in retail, she wants to see evidence of ebbing inflation.
""While we're seeing interesting opportunities forming, we'd like to have some confirmation of the inflation story before we really step in,"" Mahajan said.
(Reporting by Lewis Krauskopf and Sinead Carew; Editing by Ira Iosebashvili and David Gregorio)
((lewis.krauskopf@thomsonreuters.com; 646-223-6082; Reuters Messaging: lewis.krauskopf.thomsonreuters.com@reuters.net, Twitter: @LKrauskopf))
The views and opinions expressed herein are the views and opinions of the author and do not necessarily reflect those of Nasdaq, Inc.","By Lewis Krauskopf and Sinéad Carew NEW YORK, May 23 (Reuters) - Shares of U.S. retailers and consumer-oriented stocks took a beating last week, but may not yet be low enough to tempt long-term investors who remain worried about whether surging inflation will continue to hurt corporate bottom-lines and cause shoppers to cut back. The Fed has promised to keep raising U.S. interest rates until inflation is squashed, a key factor hitting risk appetite for investors and putting the S&P 500 on the cusp of a bear market, defined as a 20% decline from its record high. Kim Forrest, chief investment officer at Bokeh Capital Partners, believes surging oil and gasoline prices will keep undermining consumer spending.","By Lewis Krauskopf and Sinéad Carew NEW YORK, May 23 (Reuters) - Shares of U.S. retailers and consumer-oriented stocks took a beating last week, but may not yet be low enough to tempt long-term investors who remain worried about whether surging inflation will continue to hurt corporate bottom-lines and cause shoppers to cut back. Among earnings reports due this week are Best Buy BBY.N on Tuesday and Dollar General DG.N and Costco Wholesale COST.O on Thursday. Peter Tuz, president of Chase Investment Counsel, said he would likely take a closer look in coming days at whether Target shares warrant buying after sliding 25% the day of its earnings report.","By Lewis Krauskopf and Sinéad Carew NEW YORK, May 23 (Reuters) - Shares of U.S. retailers and consumer-oriented stocks took a beating last week, but may not yet be low enough to tempt long-term investors who remain worried about whether surging inflation will continue to hurt corporate bottom-lines and cause shoppers to cut back. Last week, consumer staples .SPLRCS dived 8.6% and consumer discretionary .SPLRCD tumbled 7.4%, the biggest declines of any S&P 500 sectors, with inflation hammering corporate results. Investors worry more declines could be in store if consumers cut spending in the face of higher prices.","By Lewis Krauskopf and Sinéad Carew NEW YORK, May 23 (Reuters) - Shares of U.S. retailers and consumer-oriented stocks took a beating last week, but may not yet be low enough to tempt long-term investors who remain worried about whether surging inflation will continue to hurt corporate bottom-lines and cause shoppers to cut back. Last week, consumer staples .SPLRCS dived 8.6% and consumer discretionary .SPLRCD tumbled 7.4%, the biggest declines of any S&P 500 sectors, with inflation hammering corporate results. Investors worry more declines could be in store if consumers cut spending in the face of higher prices.",2022,2
2022-05-20 00:00:00+00:00,"Nasdaq 100 Movers: ROST, PANW",DLTR,https://www.nasdaq.com/articles/nasdaq-100-movers%3A-rost-panw,,,"In early trading on Friday, shares of Palo Alto Networks topped the list of the day's best performing components of the Nasdaq 100 index, trading up 12.6%. Year to date, Palo Alto Networks has lost about 11.7% of its value.
And the worst performing Nasdaq 100 component thus far on the day is Ross Stores, trading down 22.9%. Ross Stores is lower by about 37.5% looking at the year to date performance.
Two other components making moves today are Dollar Tree, trading down 4.7%, and CrowdStrike Holdings, trading up 9.5% on the day.
VIDEO: Nasdaq 100 Movers: ROST, PANW
The views and opinions expressed herein are the views and opinions of the author and do not necessarily reflect those of Nasdaq, Inc.","In early trading on Friday, shares of Palo Alto Networks topped the list of the day's best performing components of the Nasdaq 100 index, trading up 12.6%. And the worst performing Nasdaq 100 component thus far on the day is Ross Stores, trading down 22.9%. VIDEO: Nasdaq 100 Movers: ROST, PANW The views and opinions expressed herein are the views and opinions of the author and do not necessarily reflect those of Nasdaq, Inc.","In early trading on Friday, shares of Palo Alto Networks topped the list of the day's best performing components of the Nasdaq 100 index, trading up 12.6%. Year to date, Palo Alto Networks has lost about 11.7% of its value. And the worst performing Nasdaq 100 component thus far on the day is Ross Stores, trading down 22.9%.","In early trading on Friday, shares of Palo Alto Networks topped the list of the day's best performing components of the Nasdaq 100 index, trading up 12.6%. And the worst performing Nasdaq 100 component thus far on the day is Ross Stores, trading down 22.9%. Two other components making moves today are Dollar Tree, trading down 4.7%, and CrowdStrike Holdings, trading up 9.5% on the day.","In early trading on Friday, shares of Palo Alto Networks topped the list of the day's best performing components of the Nasdaq 100 index, trading up 12.6%. And the worst performing Nasdaq 100 component thus far on the day is Ross Stores, trading down 22.9%. VIDEO: Nasdaq 100 Movers: ROST, PANW The views and opinions expressed herein are the views and opinions of the author and do not necessarily reflect those of Nasdaq, Inc.",2022,2
2022-05-20 00:00:00+00:00,"Retail sell-off: discounters, auto stores lead losses",DLTR,https://www.nasdaq.com/articles/retail-sell-off%3A-discounters-auto-stores-lead-losses,,,"By Sinéad Carew
May 20 (Reuters) - A rout in consumer stocks gained more steam on Friday, as shares of Ross Stores ROST.O led a retreat of other discount stores to cap off a bleak week for retailers.
Ross shares were down 24.4% at $70.06 after falling as low as $69.75 after the discount apparel retailer cut its 2022 same-store-sales estimate to a decline of 2%-4% versus an earlier flat-to-up 3% target.
Dollar General DG.N, which is due to report earnings next week, lost 8.4% after falling 14% in the last three sessions. Dollar Tree DLTR.O fell 7.7%. T.J. Maxx parent co TJX Co TJX.N fell 8.2%.
Among auto retailers, Advance Auto Parts AAP.N was down 9.7% and Autozone AZO.N fell 9.1% with both expected to report quarterly results in the week ahead. Shares in rival O' Reilly Auto ORLY.O were down 5.8%.
While Walmart WMT.N and Target TGT.N earlier this week reported that store traffic was still strong, high inflation ate into their profits. With fuel and freight costs still rising and supply chains still disrupted Mona Mahajan, senior investment strategist at Edward Jones, sees sector-wide repercussions.
""It's hard to see how some of these smaller retailers can withstand the margin pressures if some giants like Walmart and Target haven't been able to,"" she said.
But generally healthy balance sheets and retail sales data released earlier this week suggest healthy U.S. spending.
""In a recessionary environment you'd see consumers going towards those bargain brands for sure. But we haven't yet seen that,"" Mahajan said.
The S&P 500 Consumer discretionary sector .SPLRCD was down 3.7% after hitting its lowest point since July 2020, on track for a weekly decline of more than 9%, its seventh in a row and its biggest weekly loss since March 2020.
Target was down 1.1%, tracking a roughly 31% weekly loss. Walmart falling 1.0%, was eying a 20% weekly drop.
Macys M.N was down 9.5% and Kohl's M.N, was down 13.4% and about 19% for the week after its results also disappointed.
(Reporting By Sinéad Carew;Editing by Elaine Hardcastle)
((sinead.carew@thomsonreuters.com;))
The views and opinions expressed herein are the views and opinions of the author and do not necessarily reflect those of Nasdaq, Inc.","Dollar Tree DLTR.O fell 7.7%. Ross shares were down 24.4% at $70.06 after falling as low as $69.75 after the discount apparel retailer cut its 2022 same-store-sales estimate to a decline of 2%-4% versus an earlier flat-to-up 3% target. While Walmart WMT.N and Target TGT.N earlier this week reported that store traffic was still strong, high inflation ate into their profits.","Dollar Tree DLTR.O fell 7.7%. By Sinéad Carew May 20 (Reuters) - A rout in consumer stocks gained more steam on Friday, as shares of Ross Stores ROST.O led a retreat of other discount stores to cap off a bleak week for retailers. While Walmart WMT.N and Target TGT.N earlier this week reported that store traffic was still strong, high inflation ate into their profits.","Dollar Tree DLTR.O fell 7.7%. By Sinéad Carew May 20 (Reuters) - A rout in consumer stocks gained more steam on Friday, as shares of Ross Stores ROST.O led a retreat of other discount stores to cap off a bleak week for retailers. Among auto retailers, Advance Auto Parts AAP.N was down 9.7% and Autozone AZO.N fell 9.1% with both expected to report quarterly results in the week ahead.","Dollar Tree DLTR.O fell 7.7%. Among auto retailers, Advance Auto Parts AAP.N was down 9.7% and Autozone AZO.N fell 9.1% with both expected to report quarterly results in the week ahead. While Walmart WMT.N and Target TGT.N earlier this week reported that store traffic was still strong, high inflation ate into their profits.",2022,2
2022-05-19 00:00:00+00:00,"Notable Thursday Option Activity: ROST, AZO, DLTR",DLTR,https://www.nasdaq.com/articles/notable-thursday-option-activity%3A-rost-azo-dltr,,,"Looking at options trading activity among components of the S&P 500 index, there is noteworthy activity today in Ross Stores Inc (Symbol: ROST), where a total volume of 35,670 contracts has been traded thus far today, a contract volume which is representative of approximately 3.6 million underlying shares (given that every 1 contract represents 100 underlying shares). That number works out to 112.5% of ROST's average daily trading volume over the past month, of 3.2 million shares. Particularly high volume was seen for the $75 strike put option expiring June 17, 2022, with 5,108 contracts trading so far today, representing approximately 510,800 underlying shares of ROST. Below is a chart showing ROST's trailing twelve month trading history, with the $75 strike highlighted in orange:
AutoZone, Inc. (Symbol: AZO) saw options trading volume of 1,958 contracts, representing approximately 195,800 underlying shares or approximately 102.3% of AZO's average daily trading volume over the past month, of 191,420 shares. Particularly high volume was seen for the $2250 strike call option expiring June 24, 2022, with 172 contracts trading so far today, representing approximately 17,200 underlying shares of AZO. Below is a chart showing AZO's trailing twelve month trading history, with the $2250 strike highlighted in orange:
And Dollar Tree Inc (Symbol: DLTR) saw options trading volume of 19,436 contracts, representing approximately 1.9 million underlying shares or approximately 80.9% of DLTR's average daily trading volume over the past month, of 2.4 million shares. Particularly high volume was seen for the $155 strike put option expiring June 03, 2022, with 1,525 contracts trading so far today, representing approximately 152,500 underlying shares of DLTR. Below is a chart showing DLTR's trailing twelve month trading history, with the $155 strike highlighted in orange:
For the various different available expirations for ROST options, AZO options, or DLTR options, visit StockOptionsChannel.com.
Today's Most Active Call & Put Options of the S&P 500 »
The views and opinions expressed herein are the views and opinions of the author and do not necessarily reflect those of Nasdaq, Inc.","Particularly high volume was seen for the $155 strike put option expiring June 03, 2022, with 1,525 contracts trading so far today, representing approximately 152,500 underlying shares of DLTR. Below is a chart showing AZO's trailing twelve month trading history, with the $2250 strike highlighted in orange: And Dollar Tree Inc (Symbol: DLTR) saw options trading volume of 19,436 contracts, representing approximately 1.9 million underlying shares or approximately 80.9% of DLTR's average daily trading volume over the past month, of 2.4 million shares. Below is a chart showing DLTR's trailing twelve month trading history, with the $155 strike highlighted in orange: For the various different available expirations for ROST options, AZO options, or DLTR options, visit StockOptionsChannel.com.","Below is a chart showing AZO's trailing twelve month trading history, with the $2250 strike highlighted in orange: And Dollar Tree Inc (Symbol: DLTR) saw options trading volume of 19,436 contracts, representing approximately 1.9 million underlying shares or approximately 80.9% of DLTR's average daily trading volume over the past month, of 2.4 million shares. Particularly high volume was seen for the $155 strike put option expiring June 03, 2022, with 1,525 contracts trading so far today, representing approximately 152,500 underlying shares of DLTR. Below is a chart showing DLTR's trailing twelve month trading history, with the $155 strike highlighted in orange: For the various different available expirations for ROST options, AZO options, or DLTR options, visit StockOptionsChannel.com.","Below is a chart showing AZO's trailing twelve month trading history, with the $2250 strike highlighted in orange: And Dollar Tree Inc (Symbol: DLTR) saw options trading volume of 19,436 contracts, representing approximately 1.9 million underlying shares or approximately 80.9% of DLTR's average daily trading volume over the past month, of 2.4 million shares. Particularly high volume was seen for the $155 strike put option expiring June 03, 2022, with 1,525 contracts trading so far today, representing approximately 152,500 underlying shares of DLTR. Below is a chart showing DLTR's trailing twelve month trading history, with the $155 strike highlighted in orange: For the various different available expirations for ROST options, AZO options, or DLTR options, visit StockOptionsChannel.com.","Below is a chart showing AZO's trailing twelve month trading history, with the $2250 strike highlighted in orange: And Dollar Tree Inc (Symbol: DLTR) saw options trading volume of 19,436 contracts, representing approximately 1.9 million underlying shares or approximately 80.9% of DLTR's average daily trading volume over the past month, of 2.4 million shares. Particularly high volume was seen for the $155 strike put option expiring June 03, 2022, with 1,525 contracts trading so far today, representing approximately 152,500 underlying shares of DLTR. Below is a chart showing DLTR's trailing twelve month trading history, with the $155 strike highlighted in orange: For the various different available expirations for ROST options, AZO options, or DLTR options, visit StockOptionsChannel.com.",2022,3
