Date,Article_title,Stock_symbol,Url,Publisher,Author,Article,Lsa_summary,Luhn_summary,Textrank_summary,Lexrank_summary,Year,sentiment_score
2022-05-26 00:00:00+00:00,"Jobless Claims, Q1 GDP Both Fall; Macy's, Dollar Tree Beat",DLTR,https://www.nasdaq.com/articles/jobless-claims-q1-gdp-both-fall-macys-dollar-tree-beat,,,"Thursday, May 25, 2022

This morning, as most Thursday morning’s, we see new weekly jobless claims data. Initial Jobless Claims last week went down by 8000 to 210K, which is good news following two of the previous three weeks moving noticeably higher. Today’s headline number also beat the 215K analysts had been expecting.

Continuing Claims did move up, however, to 1.35 million. However, this is off the 1.315 million we saw the previous week, which was the lowest weekly print since before Francis Ford Coppola had made a successful movie. At 1.35 million, we’re still seeing exceptionally strong employment in the U.S. currently — or at least as of two weeks ago, from which these numbers are reported.

The first revision to Q1 GDP is also out this morning, sliding a tad further into the negative to -1.5% from the -1.4% first reported, and worse than the -1.3% expected. We hope to see this snap back in Q2 or else we’ll be looking at the first technical recession (two straight quarters of negative growth) since the start of the pandemic.

Consumption jumped notably to 3.1% from 2.7% originally reported, while pricing stayed firm at 7%, with the Pricing Index 8.1%. Personal Consumption Expenditures (PCE) quarter over quarter dipped 10 basis points to +5.1% — still high, considering what we’re up against on inflation metrics.

None of this has had much effect on pre-market futures, which are buoyant on strong Q1 earnings results from Macy’s M and Dollar Tree DLTR — +12% and +15% this morning, respectively — among others. The Dow has gained another +170 points at this hour, while the S&P 500 is +20 and the Nasdaq is +30 points. We continue to see blue chips outgain tech and the wider market, but we are happy to take positive index developments of whatever stripe.

After the opening bell, Pending Home Sales for April are expected to have dropped -2.0%, following -1.2% in March. Higher prices — both in input costs for supplies and workforce as well as mortgage rates scaling higher — are keeping interested parties from pulling the trigger on home buys, and we’ve seen the softening in the housing market in other metrics of late, as well. A continuation of this will eventually start showing up in inflation data, as well.

Tomorrow morning we’ll continue the economic narrative with PCE inflation for April. In our last read, we saw +6.6% year over year PCE inflation, which is something we’re obviously interested in seeing some down. Should we get some notable good news on this tack, we may be looking at the first up-week for market indices in many weeks.

Questions or comments about this article and/or its author? Click here>>

Just Released: Zacks Top 10 Stocks for 2022
In addition to the investment ideas discussed above, would you like to know about our 10 top buy-and-hold tickers for the entirety of 2022?
Last year's 2021 Zacks Top 10 Stocks portfolio returned gains as high as +147.7%. Now a brand-new portfolio has been handpicked from over 4,000 companies covered by the Zacks Rank. Don’t miss your chance to get in on these long-term buys
Access Zacks Top 10 Stocks for 2022 today >>

Want the latest recommendations from Zacks Investment Research? Today, you can download 7 Best Stocks for the Next 30 Days. Click to get this free report
 
Macy's, Inc. (M): Free Stock Analysis Report
 
Dollar Tree, Inc. (DLTR): Free Stock Analysis Report
 
To read this article on Zacks.com click here.
 
Zacks Investment Research
 
Want the latest recommendations from Zacks Investment Research? Today, you can download 7 Best Stocks for the Next 30 Days. Click to get this free report
The views and opinions expressed herein are the views and opinions of the author and do not necessarily reflect those of Nasdaq, Inc.","None of this has had much effect on pre-market futures, which are buoyant on strong Q1 earnings results from Macy’s M and Dollar Tree DLTR — +12% and +15% this morning, respectively — among others. Dollar Tree, Inc. (DLTR): Free Stock Analysis Report We hope to see this snap back in Q2 or else we’ll be looking at the first technical recession (two straight quarters of negative growth) since the start of the pandemic.","Dollar Tree, Inc. (DLTR): Free Stock Analysis Report None of this has had much effect on pre-market futures, which are buoyant on strong Q1 earnings results from Macy’s M and Dollar Tree DLTR — +12% and +15% this morning, respectively — among others. Last year's 2021 Zacks Top 10 Stocks portfolio returned gains as high as +147.7%.","None of this has had much effect on pre-market futures, which are buoyant on strong Q1 earnings results from Macy’s M and Dollar Tree DLTR — +12% and +15% this morning, respectively — among others. Dollar Tree, Inc. (DLTR): Free Stock Analysis Report This morning, as most Thursday morning’s, we see new weekly jobless claims data.","None of this has had much effect on pre-market futures, which are buoyant on strong Q1 earnings results from Macy’s M and Dollar Tree DLTR — +12% and +15% this morning, respectively — among others. Dollar Tree, Inc. (DLTR): Free Stock Analysis Report This morning, as most Thursday morning’s, we see new weekly jobless claims data.",2022,4
2022-05-26 00:00:00+00:00,"Nasdaq 100 Movers: KHC, DLTR",DLTR,https://www.nasdaq.com/articles/nasdaq-100-movers%3A-khc-dltr,,,"In early trading on Thursday, shares of Dollar Tree topped the list of the day's best performing components of the Nasdaq 100 index, trading up 17.8%. Year to date, Dollar Tree registers a 12.0% gain.
And the worst performing Nasdaq 100 component thus far on the day is Kraft Heinz, trading down 6.3%. Kraft Heinz is showing a gain of 3.1% looking at the year to date performance.
Two other components making moves today are Datadog, trading down 4.3%, and Baidu, trading up 10.4% on the day.
VIDEO: Nasdaq 100 Movers: KHC, DLTR
The views and opinions expressed herein are the views and opinions of the author and do not necessarily reflect those of Nasdaq, Inc.","VIDEO: Nasdaq 100 Movers: KHC, DLTR The views and opinions expressed herein are the views and opinions of the author and do not necessarily reflect those of Nasdaq, Inc. And the worst performing Nasdaq 100 component thus far on the day is Kraft Heinz, trading down 6.3%. Kraft Heinz is showing a gain of 3.1% looking at the year to date performance.","VIDEO: Nasdaq 100 Movers: KHC, DLTR The views and opinions expressed herein are the views and opinions of the author and do not necessarily reflect those of Nasdaq, Inc. In early trading on Thursday, shares of Dollar Tree topped the list of the day's best performing components of the Nasdaq 100 index, trading up 17.8%. Year to date, Dollar Tree registers a 12.0% gain.","VIDEO: Nasdaq 100 Movers: KHC, DLTR The views and opinions expressed herein are the views and opinions of the author and do not necessarily reflect those of Nasdaq, Inc. In early trading on Thursday, shares of Dollar Tree topped the list of the day's best performing components of the Nasdaq 100 index, trading up 17.8%. And the worst performing Nasdaq 100 component thus far on the day is Kraft Heinz, trading down 6.3%.","VIDEO: Nasdaq 100 Movers: KHC, DLTR The views and opinions expressed herein are the views and opinions of the author and do not necessarily reflect those of Nasdaq, Inc. In early trading on Thursday, shares of Dollar Tree topped the list of the day's best performing components of the Nasdaq 100 index, trading up 17.8%. And the worst performing Nasdaq 100 component thus far on the day is Kraft Heinz, trading down 6.3%.",2022,4
2022-05-26 00:00:00+00:00,"US STOCKS-Wall Street climbs 1% on upbeat results, Fed relief",DLTR,https://www.nasdaq.com/articles/us-stocks-wall-street-climbs-1-on-upbeat-results-fed-relief,,,"By Devik Jain and Anisha Sircar
May 26 (Reuters) - U.S. stock indexes climbed on Thursday after upbeat annual forecasts from several retailers, while data confirmed the U.S. economy contracted in the first quarter, easing concerns about aggressive interest rate hikes.
All of the 11 major S&P sectors advanced in early trading, with consumer discretionary .SPLRCD up 3%, followed by a 1.7% rise in the financials sector .SPSY.
Macy's Inc M.N jumped 12.1% after the department store raised its annual profit forecast, as party-wear demand rebounds.
Dollar General Corp DG.N and Dollar Tree DLTR.O gained 13.2% and 17.8% respectively, after raising their annual sales forecasts, as more Americans turn to discount store shopping with inflation at a four-decade high.
Meanwhile, the Commerce Department's report showed U.S. gross domestic product fell at a 1.5% annualized rate last quarter, revised down from the 1.4% decline reported in April under the weight of a record-trade deficit. The economy grew at a robust 6.9% pace in the fourth quarter.
Separately, weekly jobless claims fell to 210,000 last week, consistent with a tight labor market despite rising interest rates and tightening financial conditions.
""These numbers are indicative that growth is slowing, demand is slowing and maybe prices are even starting to slow. And if all those three things are in place, then the case for a dovish pivot will build over the summer months,"" said Thomas Hayes, chairman of Great Hill Capital.
The report came a day after the minutes of the Federal Reserve's May meeting showed most policymakers backed rate hikes of 50 basis points in June and July to tame inflation, but appeared flexible to possibly change course in September.
Markets have sold off sharply this year on growing worries about an economic slowdown due to aggressive Fed policy moves aimed at reining in surging prices. The war in Ukraine, pandemic-related lockdowns in China and recent dismal earnings forecasts have also weighed down markets.
The blue-chip Dow .DJI and the benchmark S&P 500 .SPX have lost 10.5% and 15.4% year-to-date, while the tech-heavy Nasdaq .IXIC has fallen 25.9% as high-multiple growth stocks took a hit from rising interest rates.
""The reality is a lot more complicated at this juncture and so we will have these counter trend rallies in any bear market environment,"" said Hans Olsen, chief investment officer of Fiduciary Trust Company.
At 10:06 a.m. ET, the Dow Jones Industrial Average .DJI was up 442.60 points, or 1.38%, at 32,562.88, the S&P 500 .SPX was up 55.00 points, or 1.38%, at 4,033.73, and the Nasdaq Composite .IXIC was up 162.14 points, or 1.42%, at 11,596.89.
U.S.-listed shares of Alibaba Group BABA.N jumped 11.5% after the company posted upbeat fourth-quarter revenue on growing demand for some of its niche online shopping services in China.
Advancing issues outnumbered decliners by a 7.18-to-1 ratio on the NYSE and a 3.32-to-1 ratio on the Nasdaq.
The S&P index saw three new 52-week highs and 29 new lows, while the Nasdaq recorded 19 new highs and 66 new lows.
(Reporting by Devik Jain and Anisha Sircar in Bengaluru; Editing by Saumyadeb Chakrabarty and Vinay Dwivedi)
((Devik.Jain@thomsonreuters.com))
The views and opinions expressed herein are the views and opinions of the author and do not necessarily reflect those of Nasdaq, Inc.","Dollar General Corp DG.N and Dollar Tree DLTR.O gained 13.2% and 17.8% respectively, after raising their annual sales forecasts, as more Americans turn to discount store shopping with inflation at a four-decade high. By Devik Jain and Anisha Sircar May 26 (Reuters) - U.S. stock indexes climbed on Thursday after upbeat annual forecasts from several retailers, while data confirmed the U.S. economy contracted in the first quarter, easing concerns about aggressive interest rate hikes. The report came a day after the minutes of the Federal Reserve's May meeting showed most policymakers backed rate hikes of 50 basis points in June and July to tame inflation, but appeared flexible to possibly change course in September.","Dollar General Corp DG.N and Dollar Tree DLTR.O gained 13.2% and 17.8% respectively, after raising their annual sales forecasts, as more Americans turn to discount store shopping with inflation at a four-decade high. By Devik Jain and Anisha Sircar May 26 (Reuters) - U.S. stock indexes climbed on Thursday after upbeat annual forecasts from several retailers, while data confirmed the U.S. economy contracted in the first quarter, easing concerns about aggressive interest rate hikes. Macy's Inc M.N jumped 12.1% after the department store raised its annual profit forecast, as party-wear demand rebounds.","Dollar General Corp DG.N and Dollar Tree DLTR.O gained 13.2% and 17.8% respectively, after raising their annual sales forecasts, as more Americans turn to discount store shopping with inflation at a four-decade high. By Devik Jain and Anisha Sircar May 26 (Reuters) - U.S. stock indexes climbed on Thursday after upbeat annual forecasts from several retailers, while data confirmed the U.S. economy contracted in the first quarter, easing concerns about aggressive interest rate hikes. Meanwhile, the Commerce Department's report showed U.S. gross domestic product fell at a 1.5% annualized rate last quarter, revised down from the 1.4% decline reported in April under the weight of a record-trade deficit.","Dollar General Corp DG.N and Dollar Tree DLTR.O gained 13.2% and 17.8% respectively, after raising their annual sales forecasts, as more Americans turn to discount store shopping with inflation at a four-decade high. By Devik Jain and Anisha Sircar May 26 (Reuters) - U.S. stock indexes climbed on Thursday after upbeat annual forecasts from several retailers, while data confirmed the U.S. economy contracted in the first quarter, easing concerns about aggressive interest rate hikes. Macy's Inc M.N jumped 12.1% after the department store raised its annual profit forecast, as party-wear demand rebounds.",2022,4
2022-05-26 00:00:00+00:00,U.S. GDP Declined 1.5% in Q1 2022,DLTR,https://www.nasdaq.com/articles/u.s.-gdp-declined-1.5-in-q1-2022,,,"This morning, as most Thursday morning’s, we see new weekly jobless claims data. Initial Jobless Claims last week went down by 8000 to 210K, which is good news following two of the previous three weeks moving noticeably higher. Today’s headline number also beat the 215K analysts had been expecting.

Continuing Claims did move up, however, to 1.35 million. However, this is off the 1.315 million we saw the previous week, which was the lowest weekly print since before Francis Ford Coppola had made a successful movie. At 1.35 million, we’re still seeing exceptionally strong employment in the U.S. currently — or at least as of two weeks ago, from which these numbers are reported.

The first revision to Q1 GDP is also out this morning, sliding a tad further into the negative to -1.5% from the -1.4% first reported, and worse than the -1.3% expected. We hope to see this snap back in Q2 or else we’ll be looking at the first technical recession (two straight quarters of negative growth) since the start of the pandemic.

Consumption jumped notably to 3.1% from 2.7% originally reported, while pricing stayed firm at 7%, with the Pricing Index 8.1%. Personal Consumption Expenditures (PCE) quarter over quarter dipped 10 basis points to +5.1% — still high, considering what we’re up against on inflation metrics.

None of this has had much effect on pre-market futures, which are buoyant on strong Q1 earnings results from Macy’s M and Dollar Tree DLTR — +12% and +15% this morning, respectively — among others. The Dow has gained another +170 points at this hour, while the S&P 500 is +20 and the Nasdaq is +30 points. We continue to see blue chips outgain tech and the wider market, but we are happy to take positive index developments of whatever stripe.

After the opening bell, Pending Home Sales for April are expected to have dropped -2.0%, following -1.2% in March. Higher prices — both in input costs for supplies and workforce as well as mortgage rates scaling higher — are keeping interested parties from pulling the trigger on home buys, and we’ve seen the softening in the housing market in other metrics of late, as well. A continuation of this will eventually start showing up in inflation data, as well.

Tomorrow morning we’ll continue the economic narrative with PCE inflation for April. In our last read, we saw +6.6% year over year PCE inflation, which is something we’re obviously interested in seeing some down. Should we get some notable good news on this tack, we may be looking at the first up-week for market indices in many weeks.

Just Released: Zacks Top 10 Stocks for 2022
In addition to the investment ideas discussed above, would you like to know about our 10 top buy-and-hold tickers for the entirety of 2022?
Last year's 2021 Zacks Top 10 Stocks portfolio returned gains as high as +147.7%. Now a brand-new portfolio has been handpicked from over 4,000 companies covered by the Zacks Rank. Don’t miss your chance to get in on these long-term buys
Access Zacks Top 10 Stocks for 2022 today >>

Want the latest recommendations from Zacks Investment Research? Today, you can download 7 Best Stocks for the Next 30 Days. Click to get this free report
 
Macy's, Inc. (M): Free Stock Analysis Report
 
Dollar Tree, Inc. (DLTR): Free Stock Analysis Report
 
To read this article on Zacks.com click here.
 
Zacks Investment Research
The views and opinions expressed herein are the views and opinions of the author and do not necessarily reflect those of Nasdaq, Inc.","None of this has had much effect on pre-market futures, which are buoyant on strong Q1 earnings results from Macy’s M and Dollar Tree DLTR — +12% and +15% this morning, respectively — among others. Dollar Tree, Inc. (DLTR): Free Stock Analysis Report We hope to see this snap back in Q2 or else we’ll be looking at the first technical recession (two straight quarters of negative growth) since the start of the pandemic.","Dollar Tree, Inc. (DLTR): Free Stock Analysis Report None of this has had much effect on pre-market futures, which are buoyant on strong Q1 earnings results from Macy’s M and Dollar Tree DLTR — +12% and +15% this morning, respectively — among others. Last year's 2021 Zacks Top 10 Stocks portfolio returned gains as high as +147.7%.","None of this has had much effect on pre-market futures, which are buoyant on strong Q1 earnings results from Macy’s M and Dollar Tree DLTR — +12% and +15% this morning, respectively — among others. Dollar Tree, Inc. (DLTR): Free Stock Analysis Report Initial Jobless Claims last week went down by 8000 to 210K, which is good news following two of the previous three weeks moving noticeably higher.","None of this has had much effect on pre-market futures, which are buoyant on strong Q1 earnings results from Macy’s M and Dollar Tree DLTR — +12% and +15% this morning, respectively — among others. Dollar Tree, Inc. (DLTR): Free Stock Analysis Report Initial Jobless Claims last week went down by 8000 to 210K, which is good news following two of the previous three weeks moving noticeably higher.",2022,4
2022-05-26 00:00:00+00:00,"US STOCKS-Wall Street surges on upbeat forecasts from retailers, Fed relief",DLTR,https://www.nasdaq.com/articles/us-stocks-wall-street-surges-on-upbeat-forecasts-from-retailers-fed-relief,,,"By Devik Jain and Anisha Sircar
May 26 (Reuters) - U.S. stock indexes climbed in a broad-based rally on Thursday after upbeat annual forecasts from several retailers, while data confirmed the U.S. economy contracted in the first quarter, easing concerns about aggressive interest rate hikes.
All of the 11 major S&P sectors advanced, with consumer discretionary .SPLRCD up 4.1%, followed by a 1.9% rise in the financials sector .SPSY.
The small-cap Russell 200 .RUT index added 2.1%.
Macy's Inc M.N surged 16.2% after the department store raised its annual profit forecast, as party-wear demand rebounds.
Dollar General Corp DG.N and Dollar Tree DLTR.O gained 11.7% and 18.4% respectively, after lifting their annual sales forecasts, as more Americans turn to discount store shopping with inflation at a four-decade high.
Meanwhile, the Commerce Department's report showed U.S. GDP fell at a 1.5% annualized rate last quarter amid a record trade deficit and a sequential decline in the pace of inventory accumulation. The economy grew at a robust 6.9% in the fourth quarter.
Separately, weekly jobless claims fell to 210,000 last week, consistent with a tight labor market despite rising interest rates and tightening financial conditions.
""For a market that looks forward, the thought is that we're near a bottom in terms of the type of news we're getting and maybe prices have already discounted the slowdown that we're seeing,"" said Rick Meckler, partner at Cherry Lane Investments in New Vernon, New Jersey.
""The data is raising hopes of a potential dovish pivot later this year.""
The reports came a day after the minutes of the Federal Reserve's May meeting showed most policymakers backed rate hikes of 50 basis points in June and July to tame inflation, but appeared flexible to possibly change course in September.
Markets have sold off sharply this year on growing worries about an economic slowdown due to aggressive Fed policy moves aimed at reining in surging prices. The war in Ukraine, pandemic-related lockdowns in China and recent dismal earnings forecasts have also weighed down markets.
The blue-chip Dow .DJI and the benchmark S&P 500 .SPX have lost 10.3% and 15.1% year-to-date, while the tech-heavy Nasdaq .IXIC has fallen 25.4% as high-multiple growth stocks took a hit from rising interest rates.
Still, the S&P 500 and the Nasdaq appear set to snap their 7-week losing streak, the longest since the dotcom bust in 2001, with the benchmark indexes up 3.7% so far this week.
The CBOE volatility index .VIX hit its lowest level since May 18 at 27.61 points.
""The reality is a lot more complicated at this juncture and so we will have these counter trend rallies in any bear market environment,"" said Hans Olsen, chief investment officer of Fiduciary Trust Company.
At 11:37 a.m. ET, the Dow Jones Industrial Average .DJI was up 479.02 points, or 1.49%, at 32,599.30, the S&P 500 .SPX had advanced 66.23 points, or 1.66%, to 4,044.96, and the Nasdaq Composite .IXIC was up 232.38 points, or 2.03%, at 11,667.12.
Advancing issues outnumbered decliners by a 7.29-to-1 ratio on the NYSE and by a 3.50-to-1 ratio on the Nasdaq.
The S&P index recorded three new 52-week highs and 29 new lows, while the Nasdaq saw 21 new highs and 79 new lows.
(Reporting by Devik Jain and Anisha Sircar in Bengaluru; Editing by Saumyadeb Chakrabarty and Vinay Dwivedi)
((Devik.Jain@thomsonreuters.com))
The views and opinions expressed herein are the views and opinions of the author and do not necessarily reflect those of Nasdaq, Inc.","Dollar General Corp DG.N and Dollar Tree DLTR.O gained 11.7% and 18.4% respectively, after lifting their annual sales forecasts, as more Americans turn to discount store shopping with inflation at a four-decade high. By Devik Jain and Anisha Sircar May 26 (Reuters) - U.S. stock indexes climbed in a broad-based rally on Thursday after upbeat annual forecasts from several retailers, while data confirmed the U.S. economy contracted in the first quarter, easing concerns about aggressive interest rate hikes. Meanwhile, the Commerce Department's report showed U.S. GDP fell at a 1.5% annualized rate last quarter amid a record trade deficit and a sequential decline in the pace of inventory accumulation.","Dollar General Corp DG.N and Dollar Tree DLTR.O gained 11.7% and 18.4% respectively, after lifting their annual sales forecasts, as more Americans turn to discount store shopping with inflation at a four-decade high. By Devik Jain and Anisha Sircar May 26 (Reuters) - U.S. stock indexes climbed in a broad-based rally on Thursday after upbeat annual forecasts from several retailers, while data confirmed the U.S. economy contracted in the first quarter, easing concerns about aggressive interest rate hikes. Macy's Inc M.N surged 16.2% after the department store raised its annual profit forecast, as party-wear demand rebounds.","Dollar General Corp DG.N and Dollar Tree DLTR.O gained 11.7% and 18.4% respectively, after lifting their annual sales forecasts, as more Americans turn to discount store shopping with inflation at a four-decade high. By Devik Jain and Anisha Sircar May 26 (Reuters) - U.S. stock indexes climbed in a broad-based rally on Thursday after upbeat annual forecasts from several retailers, while data confirmed the U.S. economy contracted in the first quarter, easing concerns about aggressive interest rate hikes. Separately, weekly jobless claims fell to 210,000 last week, consistent with a tight labor market despite rising interest rates and tightening financial conditions.","Dollar General Corp DG.N and Dollar Tree DLTR.O gained 11.7% and 18.4% respectively, after lifting their annual sales forecasts, as more Americans turn to discount store shopping with inflation at a four-decade high. By Devik Jain and Anisha Sircar May 26 (Reuters) - U.S. stock indexes climbed in a broad-based rally on Thursday after upbeat annual forecasts from several retailers, while data confirmed the U.S. economy contracted in the first quarter, easing concerns about aggressive interest rate hikes. Separately, weekly jobless claims fell to 210,000 last week, consistent with a tight labor market despite rising interest rates and tightening financial conditions.",2022,4
