Date,Article_title,Stock_symbol,Url,Publisher,Author,Article,Lsa_summary,Luhn_summary,Textrank_summary,Lexrank_summary,Year,sentiment_score
2022-02-11 00:00:00+00:00,Stocks & ETFs to Fall for in the Valentines' Week,DLTR,https://www.nasdaq.com/articles/stocks-etfs-to-fall-for-in-the-valentines-week,,,"The United States will be showered with love as 53% of its adults are planning to celebrate this Valentine’s Day. The pandemic has not dampened the excitement among consumers. About 27% of the population who are not celebrating, still plan to observe the occasion. Total spending would be a total of $23.9 billion (up from $21.8 billion in 2021), per NRF.
January data from Google Search reveled searches for “Valentine’s Day gifts for her” were up 300% year over year and searches for “best Valentine’s Day gifts for him” were up 200%.  Consumers are spending $175.41 on average this year, up about 6% from last year, per the report. Naturally, the day of love translates into a great day for business. Exchanging chocolates, greeting cards, flowers, gifting precious metals should remain at the front and in the center.
Let’s dive a little deeper:
Candies, Cards & Flowers Continue to Remain Ageless  
Since the pandemic can’t affect exchanging gifts like classic candies, cards and flowers, these businesses should see no adverse impact this year. About 56% of consumers are planning to buy candies, followed by greetings cards (40%) and flowers (37%). The Hershey Company HSY is likely to be one of the best bets this year. Shares of companies like 1-800 Flowers.Com Inc. FLWS should also get a nudge-up.
Who Forget Gifting Diamonds to His Valentine?
Apart from candies, flowers or greeting cards, gifting jewelry this Valentine’s Day has become popular than ever before. Total spending on jewelry could touch a high of $6.2 billion, per NRF. About 30% of men (up from 27% in 2021) and 14% of women (up from 10% in 2021) are planning to buy jewelry. Spending projections have also increased as per person spend for men went up from $59 in 2021 to $75 while per person spend for women doubled to $24. Zacks Rank #2 (Buy) Brilliant Earth Group BRLT is a great pick here.
Gifting An Experience: A Booming Trend
About 41% (up from 33% in 2021) is planning an evening out while 41% plan on gifting an experience, up from 36% last year. In this regard, restaurant ETF AdvisorShares Restaurant ETF EATZ and experience ETFs like Defiance Hotel, Airline, and Cruise ETF CRUZ and ALPS Global Travel Beneficiaries ETF JRNY should benefit.
 Shopping Online Amid the Pandemic
Online purchasing would continue to rule as about 41% of consumers are planning to buy their Valentine’s gifts online this year — the highest in the survey’s history. ProShares Online Retail ETF ONLN is a beneficiary of the trend. With all the celebration around, who can get forget Amazon AMZN, a hot destination of online shopping.
Dollar Store: A Winner Too?
Visiting department stores (32%), discount stores (28%), and local small businesses and specialty stores (18%) would also remain a trend. Consumers have been showing an inclination for small businesses as one of the top five shopping destinations. Several discount retailers like Costco COST and Dollar Tree DLTR may win from the trend and make VanEck Vectors Retail ETF RTH a winner.

Infrastructure Stock Boom to Sweep America
A massive push to rebuild the crumbling U.S. infrastructure will soon be underway. It’s bipartisan, urgent, and inevitable. Trillions will be spent. Fortunes will be made.
The only question is “Will you get into the right stocks early when their growth potential is greatest?”
Zacks has released a Special Report to help you do just that, and today it’s free. Discover 5 special companies that look to gain the most from construction and repair to roads, bridges, and buildings, plus cargo hauling and energy transformation on an almost unimaginable scale.
Download FREE: How to Profit from Trillions on Spending for Infrastructure >>

Want the latest recommendations from Zacks Investment Research? Today, you can download 7 Best Stocks for the Next 30 Days. Click to get this free report
 
Amazon.com, Inc. (AMZN): Free Stock Analysis Report
 
Dollar Tree, Inc. (DLTR): Free Stock Analysis Report
 
Hershey Company The (HSY): Free Stock Analysis Report
 
Costco Wholesale Corporation (COST): Free Stock Analysis Report
 
1800 FLOWERS.COM, Inc. (FLWS): Free Stock Analysis Report
 
VanEck Retail ETF (RTH): ETF Research Reports
 
ProShares Online Retail ETF (ONLN): ETF Research Reports
 
AdvisorShares Restaurant ETF (EATZ): ETF Research Reports
 
Defiance Hotel, Airline, and Cruise ETF (CRUZ): ETF Research Reports
 
ALPS Global Travel Beneficiaries ETF (JRNY): ETF Research Reports
 
Brilliant Earth Group, Inc. (BRLT): Free Stock Analysis Report
 
To read this article on Zacks.com click here.
 
Zacks Investment Research
The views and opinions expressed herein are the views and opinions of the author and do not necessarily reflect those of Nasdaq, Inc.","Several discount retailers like Costco COST and Dollar Tree DLTR may win from the trend and make VanEck Vectors Retail ETF RTH a winner. Dollar Tree, Inc. (DLTR): Free Stock Analysis Report Exchanging chocolates, greeting cards, flowers, gifting precious metals should remain at the front and in the center.","Several discount retailers like Costco COST and Dollar Tree DLTR may win from the trend and make VanEck Vectors Retail ETF RTH a winner. Dollar Tree, Inc. (DLTR): Free Stock Analysis Report In this regard, restaurant ETF AdvisorShares Restaurant ETF EATZ and experience ETFs like Defiance Hotel, Airline, and Cruise ETF CRUZ and ALPS Global Travel Beneficiaries ETF JRNY should benefit.","Several discount retailers like Costco COST and Dollar Tree DLTR may win from the trend and make VanEck Vectors Retail ETF RTH a winner. Dollar Tree, Inc. (DLTR): Free Stock Analysis Report January data from Google Search reveled searches for “Valentine’s Day gifts for her” were up 300% year over year and searches for “best Valentine’s Day gifts for him” were up 200%.","Several discount retailers like Costco COST and Dollar Tree DLTR may win from the trend and make VanEck Vectors Retail ETF RTH a winner. Dollar Tree, Inc. (DLTR): Free Stock Analysis Report About 56% of consumers are planning to buy candies, followed by greetings cards (40%) and flowers (37%).",2022,4
2022-02-11 00:00:00+00:00,"Expedia Group (EXPE) Q4 Earnings Beat, Revenues Rise Y/Y",DLTR,https://www.nasdaq.com/articles/expedia-group-expe-q4-earnings-beat-revenues-rise-y-y,,,"Expedia Group, Inc. EXPE reported adjusted earnings of $1.06 per share for fourth-quarter 2021, which surpassed the Zacks Consensus Estimate by 9.3%.

Notably, the bottom line compares favorably with the prior-year quarter’s loss of $2.64 per share but declined 69.9% sequentially.

Revenues of $2.28 billion surged 148% year over year but declined 23.1% from the previous quarter. Further, the figure missed the Zacks Consensus Estimate of $2.36 billion.

Year-over-year revenues growth was driven by strong recovery across all its lines of business, owing to increasing travel resiliency of people. Moreover, improved travel demand from the year-ago quarter contributed well.

However, the sequential fall was primarily attributed to the travel disruptions caused by the rapidly spreading COVID variant, Omicron.

Nevertheless, the impacts of the current COVID-19 wave seem to be less severe than that of the previous waves, which remains a major positive.

Expedia Group’s gross bookings were $17.5 billion, which increased 131% year over year. However, the figure decreased 6.7% from the prior quarter, owing to a sequential decline in lodging, air, and other travel products due to the seasonality effect and disruptions caused by Omicron.

Although the coronavirus pandemic-led uncertainties continue to persist in the global travel industry, growing confidence among people regarding travel remains a tailwind. Optimism regarding the ongoing vaccination drive remains another positive.
Expedia Group, Inc. Price, Consensus and EPS Surprise
  Expedia Group, Inc. price-consensus-eps-surprise-chart | Expedia Group, Inc. Quote
Revenues by Segment
Retail: The company generated $1.73 billion in revenues (75.9% of total revenues) from the segment, surging 146% year over year.

B2B: The segment yielded revenues of $481 million (21.1% of total revenues), up 159% from the year-ago quarter.

trivago: Revenues from the segment totaled $99 million (4.3% of revenues), up 162% year over year.
Revenues by Business Model
The Merchant model generated revenues of $1.48 billion (65% of revenues), up 184% year over year. Merchant gross bookings were $9.14 billion, up 120% from the prior-year quarter.

The Agency division generated revenues of $611 million (27% of revenues), improving 125% from the prior-year quarter. Agency gross bookings were $8.3 billion, up 144% year over year.

Advertising & Media and Other generated $188 million of revenues (8% of the top line), increasing 47% from the year-ago quarter. This can primarily be attributed to the strong performance of Expedia Group Media Solutions and trivago.
Revenues by Geography
Expedia Group generated $1.66 billion in revenues (72.6% of total revenues) from domestic regions, up 137% from the prior-year quarter.

Revenues generated from international regions totaled $624 million (27.4% of revenues), up 182% on a year-over-year basis.
Revenues by Product Line
Lodging revenues accounted for 75% of total revenues. The company witnessed 116% growth in Lodging revenues, owing to the solid momentum in stayed room nights, which grew 74%. The company witnessed a 24% rise in revenues per room night.

Air revenues accounted for 3% of revenues. Notably, the company witnessed 68% growth in Air revenues, owing to growth of 92% in air tickets sold.
Operating Details
Adjusted EBITDA was $479 million in the reported quarter compared with ($160) million in the year-ago quarter.

Adjusted selling and marketing expenses were $1.03 billion, up 107% year over year. As a percentage of revenues, the figure contracted 883 basis points (bps) year over year.

Adjusted general and administrative expenses were $133 million, up 30% year over year. The figure contracted 534 bps year over year as a percentage of revenues.

Adjusted technology and content expenses were $248 million, up 10% from the year-ago quarter. The figure contracted to 10.8% from 24.4% in the year-ago quarter as a percentage of revenues.

The company reported a fourth-quarter operating income of $163 million against the loss of $463 million in the year-ago quarter.
Balance Sheet & Cash Flow
As of Dec 31, 2021, cash and cash equivalents were $4.11 billion, down from $5.03 billion as of Sep 30, 2021. Short-term investments were $200 million at the end of the reported quarter, which was nil as the end of the previous quarter.

Long-term debt was $7.715 billion at the end of the fourth quarter compared with $7.712 billion at the end of the third quarter.

Expedia Group generated $285 million of cash from operations in the quarter under review against $1.2 billion of cash used in operations in the last reported quarter.

Free cash flow was $142 million in the fourth quarter.
Zacks Rank & Stocks to Consider
Currently, Expedia carries a Zacks Rank #3 (Hold). 
Some better-ranked companies in the retail-wholesale sector are AutoNation AN, Dollar Tree DLTR and The Kroger KR, each presently carrying a Zacks Rank #2 (Buy). You can see the complete list of today’s Zacks #1 Rank (Strong Buy) stocks here.
AutoNation has gained 35% over a year. The long-term earnings growth rate for AN is currently projected at 23.55%. 
Dollar Tree has gained 27.3% over a year. The long-term earnings growth rate for DLTR is currently projected at 12.18%. 
Kroger has gained 33% over a year. The long-term earnings growth rate for KR is currently projected at 8.37%.

Infrastructure Stock Boom to Sweep America
A massive push to rebuild the crumbling U.S. infrastructure will soon be underway. It’s bipartisan, urgent, and inevitable. Trillions will be spent. Fortunes will be made.
The only question is “Will you get into the right stocks early when their growth potential is greatest?”
Zacks has released a Special Report to help you do just that, and today it’s free. Discover 5 special companies that look to gain the most from construction and repair to roads, bridges, and buildings, plus cargo hauling and energy transformation on an almost unimaginable scale.
Download FREE: How to Profit from Trillions on Spending for Infrastructure >>

Want the latest recommendations from Zacks Investment Research? Today, you can download 7 Best Stocks for the Next 30 Days. Click to get this free report
 
Dollar Tree, Inc. (DLTR): Free Stock Analysis Report
 
The Kroger Co. (KR): Free Stock Analysis Report
 
AutoNation, Inc. (AN): Free Stock Analysis Report
 
Expedia Group, Inc. (EXPE): Free Stock Analysis Report
 
To read this article on Zacks.com click here.
 
Zacks Investment Research
The views and opinions expressed herein are the views and opinions of the author and do not necessarily reflect those of Nasdaq, Inc.","Some better-ranked companies in the retail-wholesale sector are AutoNation AN, Dollar Tree DLTR and The Kroger KR, each presently carrying a Zacks Rank #2 (Buy). The long-term earnings growth rate for DLTR is currently projected at 12.18%. Dollar Tree, Inc. (DLTR): Free Stock Analysis Report","Some better-ranked companies in the retail-wholesale sector are AutoNation AN, Dollar Tree DLTR and The Kroger KR, each presently carrying a Zacks Rank #2 (Buy). The long-term earnings growth rate for DLTR is currently projected at 12.18%. Dollar Tree, Inc. (DLTR): Free Stock Analysis Report","Some better-ranked companies in the retail-wholesale sector are AutoNation AN, Dollar Tree DLTR and The Kroger KR, each presently carrying a Zacks Rank #2 (Buy). The long-term earnings growth rate for DLTR is currently projected at 12.18%. Dollar Tree, Inc. (DLTR): Free Stock Analysis Report","Some better-ranked companies in the retail-wholesale sector are AutoNation AN, Dollar Tree DLTR and The Kroger KR, each presently carrying a Zacks Rank #2 (Buy). The long-term earnings growth rate for DLTR is currently projected at 12.18%. Dollar Tree, Inc. (DLTR): Free Stock Analysis Report",2022,3
2022-02-11 00:00:00+00:00,5 Stocks to Gift Your Loved Ones This Valentine Day,DLTR,https://www.nasdaq.com/articles/5-stocks-to-gift-your-loved-ones-this-valentine-day,,,"Valentine’s Day is around the corner and people are splurging on gifts. This should translate into high consumer spending and result in an upside in the stock market.

Spending is expected to hit the second highest in 15 years as Americans are expected to spend an average of $175.41 per person or a total of $23.9 billion on Valentine’s Day this year as per the National Retail Federation’s survey. This is up from $164.76 or $21.8 billion in 2021 and behind $27.48 billion spent in 2020.

Given an uptick in seasonal sales, companies selling Valentine’s Day products will see a boost in sales and a resultant surge in their stock price. So, hearty investors could show their affection and love to some stocks in order to exploit the near-term trend. This includes Amazon.com AMZN, Darden Restaurants DRI, Dollar Tree DLTR, Hershey Company HSY, and Signet Jewelers SIG. These stocks have a Zacks Rank #1 (Strong Buy), #2 (Buy) or 3 (Hold), suggesting their strong performances in the near term. You can see the complete list of today’s Zacks #1 Rank stocks here.

About 53% of Americans plan to celebrate Valentine's Day this year, up slightly from 52% in 2021. Online continues to be the hot spot for Valentine’s Day shopping, visited by 41%, followed by department stores at 32%, discount stores at 28%, local small businesses at 18% and florists at 17%.

Candy (56%), greeting cards (40%) and flowers (37%) remain the most popular gift items this Valentine’s Day. About 31% of respondents plan to gift an “evening out” this year, up from 24% in 2021 for a total of $4.3 billion. About 22% will opt to gift jewelry to a special someone. Total spending on jewelry is estimated at $6.2 billion, up from $4.1 billion in 2021 and the highest in the survey’s history.
Stocks to Splurge On
Amazon is one of the largest e-commerce providers, with sprawling operations in North America, now spreading across the globe. The AMZN stock saw a solid earnings estimate revision of 76 cents over the past 30 days for this year and has a market cap of $1.6 trillion.

Amazon has a Zacks Rank #3 and a Growth Score of A.

Darden Restaurants is one of the largest casual dining restaurant operators worldwide. With a market cap of $18.7 billion, it has an estimated earnings growth of 74.9% for the fiscal year (ending May 2022).

DRI has a Zacks Rank #3 and a Growth Score of B.

Dollar Tree is an operator of discount variety stores offering merchandise and other assortments. DLTR saw a positive earnings estimate revision of 25 cents over the past 30 days for this year with an expected earnings growth of 9.9%.

Dollar Tree has a Zacks Rank #2 and a Value Score of B. DLTR has a market cap of $31.8 billion.

Hershey is the largest chocolate manufacturer in North America as well as a global leader in chocolate and non-chocolate confectionery. It manufactures pantry items like baking ingredients, toppings and beverages; and gum and mint refreshment products; snack bites and mixes, as well as spreads. HSY saw a positive earnings estimate revision of 25 cents over the past 30 days for this year with an expected earnings growth of 9.9%.

Hershey has a Zacks Rank #2 and Growth Score of B. HSY has a market cap of $41.9 billion.

Signet Jewelers is a retailer of diamond jewelry, watches as well as other products. The company is often considered as the leading retailer of diamond jewelry and has a market cap of $4.6 billion. SIG saw a solid earnings estimate revision of $1.32 over the past 30 days for the fiscal year (ending January 2023).

Signet Jewelers carries a Zacks Rank #1 and has a Growth Score of B.

Infrastructure Stock Boom to Sweep America
A massive push to rebuild the crumbling U.S. infrastructure will soon be underway. It’s bipartisan, urgent, and inevitable. Trillions will be spent. Fortunes will be made.
The only question is “Will you get into the right stocks early when their growth potential is greatest?”
Zacks has released a Special Report to help you do just that, and today it’s free. Discover 5 special companies that look to gain the most from construction and repair to roads, bridges, and buildings, plus cargo hauling and energy transformation on an almost unimaginable scale.
Download FREE: How to Profit from Trillions on Spending for Infrastructure >>

Want the latest recommendations from Zacks Investment Research? Today, you can download 7 Best Stocks for the Next 30 Days. Click to get this free report
 
Amazon.com, Inc. (AMZN): Free Stock Analysis Report
 
Dollar Tree, Inc. (DLTR): Free Stock Analysis Report
 
Hershey Company The (HSY): Free Stock Analysis Report
 
Darden Restaurants, Inc. (DRI): Free Stock Analysis Report
 
Signet Jewelers Limited (SIG): Free Stock Analysis Report
 
To read this article on Zacks.com click here.
 
Zacks Investment Research
The views and opinions expressed herein are the views and opinions of the author and do not necessarily reflect those of Nasdaq, Inc.","This includes Amazon.com AMZN, Darden Restaurants DRI, Dollar Tree DLTR, Hershey Company HSY, and Signet Jewelers SIG. DLTR saw a positive earnings estimate revision of 25 cents over the past 30 days for this year with an expected earnings growth of 9.9%. Dollar Tree has a Zacks Rank #2 and a Value Score of B. DLTR has a market cap of $31.8 billion.","This includes Amazon.com AMZN, Darden Restaurants DRI, Dollar Tree DLTR, Hershey Company HSY, and Signet Jewelers SIG. Dollar Tree, Inc. (DLTR): Free Stock Analysis Report DLTR saw a positive earnings estimate revision of 25 cents over the past 30 days for this year with an expected earnings growth of 9.9%.","This includes Amazon.com AMZN, Darden Restaurants DRI, Dollar Tree DLTR, Hershey Company HSY, and Signet Jewelers SIG. DLTR saw a positive earnings estimate revision of 25 cents over the past 30 days for this year with an expected earnings growth of 9.9%. Dollar Tree has a Zacks Rank #2 and a Value Score of B. DLTR has a market cap of $31.8 billion.","Dollar Tree has a Zacks Rank #2 and a Value Score of B. DLTR has a market cap of $31.8 billion. This includes Amazon.com AMZN, Darden Restaurants DRI, Dollar Tree DLTR, Hershey Company HSY, and Signet Jewelers SIG. DLTR saw a positive earnings estimate revision of 25 cents over the past 30 days for this year with an expected earnings growth of 9.9%.",2022,4
