Date,Article_title,Stock_symbol,Url,Publisher,Author,Article,Lsa_summary,Luhn_summary,Textrank_summary,Lexrank_summary,Year,sentiment_score
2022-05-18 00:00:00+00:00,"Wednesday's ETF Movers: IVOG, VCR",DLTR,https://www.nasdaq.com/articles/wednesdays-etf-movers%3A-ivog-vcr,,,"In trading on Wednesday, the Vanguard S&P Mid-Cap 400 Growth ETF is outperforming other ETFs, up about 2.8% on the day. Components of that ETF showing particular strength include shares of Six Flags Entertainment, up about 4.6% and shares of Sunpower, up about 1.4% on the day.
And underperforming other ETFs today is the Vanguard Consumer Discretionary ETF, off about 5.5% in Wednesday afternoon trading. Among components of that ETF with the weakest showing on Wednesday were shares of Target, lower by about 25%, and shares of Dollar Tree, lower by about 16.8% on the day.
VIDEO: Wednesday's ETF Movers: IVOG, VCR
The views and opinions expressed herein are the views and opinions of the author and do not necessarily reflect those of Nasdaq, Inc.","Components of that ETF showing particular strength include shares of Six Flags Entertainment, up about 4.6% and shares of Sunpower, up about 1.4% on the day. Among components of that ETF with the weakest showing on Wednesday were shares of Target, lower by about 25%, and shares of Dollar Tree, lower by about 16.8% on the day. VIDEO: Wednesday's ETF Movers: IVOG, VCR The views and opinions expressed herein are the views and opinions of the author and do not necessarily reflect those of Nasdaq, Inc.","In trading on Wednesday, the Vanguard S&P Mid-Cap 400 Growth ETF is outperforming other ETFs, up about 2.8% on the day. Among components of that ETF with the weakest showing on Wednesday were shares of Target, lower by about 25%, and shares of Dollar Tree, lower by about 16.8% on the day. VIDEO: Wednesday's ETF Movers: IVOG, VCR The views and opinions expressed herein are the views and opinions of the author and do not necessarily reflect those of Nasdaq, Inc.","In trading on Wednesday, the Vanguard S&P Mid-Cap 400 Growth ETF is outperforming other ETFs, up about 2.8% on the day. And underperforming other ETFs today is the Vanguard Consumer Discretionary ETF, off about 5.5% in Wednesday afternoon trading. Among components of that ETF with the weakest showing on Wednesday were shares of Target, lower by about 25%, and shares of Dollar Tree, lower by about 16.8% on the day.","In trading on Wednesday, the Vanguard S&P Mid-Cap 400 Growth ETF is outperforming other ETFs, up about 2.8% on the day. Components of that ETF showing particular strength include shares of Six Flags Entertainment, up about 4.6% and shares of Sunpower, up about 1.4% on the day. And underperforming other ETFs today is the Vanguard Consumer Discretionary ETF, off about 5.5% in Wednesday afternoon trading.",2022,2
2022-05-18 00:00:00+00:00,"Wednesday Sector Laggards: Services, Consumer Products",DLTR,https://www.nasdaq.com/articles/wednesday-sector-laggards%3A-services-consumer-products-0,,,"Looking at the sectors faring worst as of midday Wednesday, shares of Services companies are underperforming other sectors, showing a 5.9% loss. Within the sector, Target Corp (Symbol: TGT) and Dollar Tree Inc (Symbol: DLTR) are two of the day's laggards, showing a loss of 27.5% and 16.6%, respectively. Among the largest ETFs, one ETF closely following services stocks is the iShares U.S. Consumer Services ETF (Symbol: IYC), which is down 6.4% on the day, and down 29.63% year-to-date. Target Corp, meanwhile, is down 31.76% year-to-date, and Dollar Tree Inc, is down 7.22% year-to-date. Combined, TGT and DLTR make up approximately 2.5% of the underlying holdings of IYC.
The next worst performing sector is the Consumer Products sector, showing a 5.5% loss. Among large Consumer Products stocks, Newell Brands Inc (Symbol: NWL) and J.M. Smucker Co. (Symbol: SJM) are the most notable, showing a loss of 10.2% and 9.9%, respectively. One ETF closely tracking Consumer Products stocks is the iShares U.S. Consumer Goods ETF (IYK), which is down 5.0% in midday trading, and down 0.81% on a year-to-date basis. Newell Brands Inc, meanwhile, is down 4.14% year-to-date, and J.M. Smucker Co., is down 3.36% year-to-date. SJM makes up approximately 0.7% of the underlying holdings of IYK.
Comparing these stocks and ETFs on a trailing twelve month basis, below is a relative stock price performance chart, with each of the symbols shown in a different color as labeled in the legend at the bottom:
Here's a snapshot of how the S&P 500 components within the various sectors are faring in afternoon trading on Wednesday. As you can see, none of the sectors are up on the day, while nine sectors are down.
SECTOR % CHANGE
Utilities -0.8%
Healthcare -2.4%
Financial -2.8%
Materials -3.3%
Energy -3.7%
Technology & Communications -3.8%
Industrial -4.0%
Consumer Products -5.5%
Services -5.9%
10 ETFs With Stocks That Insiders Are Buying »
The views and opinions expressed herein are the views and opinions of the author and do not necessarily reflect those of Nasdaq, Inc.","Within the sector, Target Corp (Symbol: TGT) and Dollar Tree Inc (Symbol: DLTR) are two of the day's laggards, showing a loss of 27.5% and 16.6%, respectively. Combined, TGT and DLTR make up approximately 2.5% of the underlying holdings of IYC. Among large Consumer Products stocks, Newell Brands Inc (Symbol: NWL) and J.M.","Within the sector, Target Corp (Symbol: TGT) and Dollar Tree Inc (Symbol: DLTR) are two of the day's laggards, showing a loss of 27.5% and 16.6%, respectively. Combined, TGT and DLTR make up approximately 2.5% of the underlying holdings of IYC. Among the largest ETFs, one ETF closely following services stocks is the iShares U.S. Consumer Services ETF (Symbol: IYC), which is down 6.4% on the day, and down 29.63% year-to-date.","Within the sector, Target Corp (Symbol: TGT) and Dollar Tree Inc (Symbol: DLTR) are two of the day's laggards, showing a loss of 27.5% and 16.6%, respectively. Combined, TGT and DLTR make up approximately 2.5% of the underlying holdings of IYC. Among the largest ETFs, one ETF closely following services stocks is the iShares U.S. Consumer Services ETF (Symbol: IYC), which is down 6.4% on the day, and down 29.63% year-to-date.","Within the sector, Target Corp (Symbol: TGT) and Dollar Tree Inc (Symbol: DLTR) are two of the day's laggards, showing a loss of 27.5% and 16.6%, respectively. Combined, TGT and DLTR make up approximately 2.5% of the underlying holdings of IYC. Among the largest ETFs, one ETF closely following services stocks is the iShares U.S. Consumer Services ETF (Symbol: IYC), which is down 6.4% on the day, and down 29.63% year-to-date.",2022,2
2022-05-18 00:00:00+00:00,"Why Dollar Tree, Tractor Supply, and BJ's Wholesale Club Stocks All Fell Today",DLTR,https://www.nasdaq.com/articles/why-dollar-tree-tractor-supply-and-bjs-wholesale-club-stocks-all-fell-today,,,"What happened
Wednesday was a rough day for investors in many retailing stocks. Dollar Tree (NASDAQ: DLTR), Tractor Supply (NASDAQ: TSCO), and BJ's Wholesale Club (NYSE: BJ) shares each fell by more than 10% by 12:30 p.m. ET, compared to a 2.7% slump in the S&P 500.
The retailing segment seemed to drive the decline in the wider market, and that pressure came from tough earnings news out of Target (NYSE: TGT), one of the industry's biggest players.
Image source: Getty Images.
So what
Target said early Wednesday that sales expanded roughly 4% to $24.8 billion in the selling period that ended in late April. That result edged past expectations and was powered by healthy customer traffic.
However, as Walmart revealed earlier in the week, the gains came with a big drawback.
Profitability plunged, with operating margin diving to 5% of sales from 10% a year ago. That decline suggests at least part of the margin gains that Target enjoyed in earlier phases of the pandemic was just a temporary factor. The profit margin was ""well below where we expect to operate over time,"" CEO Brian Cornell said in a press release .
Just about every retailing business fell along with Target in response to this news. Smaller peers like Dollar Tree may face similar margin declines, and investors are worried about the discount chain's upcoming earnings report, slated for Thursday, May 26.
Tractor Supply, meanwhile, posted a fantastic increase in its profitability over the past two years that was driven by many of the same factors that pushed Target's higher. These include a tilt in demand toward fast home delivery and premium products. The company gave no indication of an impending reversal of its profitability wins in late April. But Wall Street is concerned that such a downgrade is coming.
BJ's Wholesale reports its earnings results on Thursday, and investors are worried that the wholesale retailer will scale back expectations on short-term profits for the same reason that Target did today.
Now what
It might seem like an overreaction for investors to push the share prices down for BJ's, Tractor Supply, and Dollar Tree, given that these companies have yet to update shareholders on their latest operating trends. And Target's results hardly painted a dark picture of consumer spending trends. Customer traffic is still rising in its stores even compared to soaring results last year. And the retailer affirmed its 2022 sales outlook that calls for modest growth overall.
Yet Target dramatically reduced its short-term profitability outlook. And until these companies can prove otherwise, Wall Street is assuming that Dollar Tree, BJ's, and Tractor Supply will walk a similar path with their next earnings announcements.
10 stocks we like better than Dollar Tree Inc
When our award-winning analyst team has a stock tip, it can pay to listen. After all, the newsletter they have run for over a decade, Motley Fool Stock Advisor, has tripled the market.*
They just revealed what they believe are the ten best stocks for investors to buy right now... and Dollar Tree Inc wasn't one of them! That's right -- they think these 10 stocks are even better buys.
See the 10 stocks
*Stock Advisor returns as of April 7, 2022
Demitri Kalogeropoulos has no position in any of the stocks mentioned. The Motley Fool recommends Tractor Supply. The Motley Fool has a disclosure policy.
The views and opinions expressed herein are the views and opinions of the author and do not necessarily reflect those of Nasdaq, Inc.","Dollar Tree (NASDAQ: DLTR), Tractor Supply (NASDAQ: TSCO), and BJ's Wholesale Club (NYSE: BJ) shares each fell by more than 10% by 12:30 p.m. The retailing segment seemed to drive the decline in the wider market, and that pressure came from tough earnings news out of Target (NYSE: TGT), one of the industry's biggest players. Smaller peers like Dollar Tree may face similar margin declines, and investors are worried about the discount chain's upcoming earnings report, slated for Thursday, May 26.","Dollar Tree (NASDAQ: DLTR), Tractor Supply (NASDAQ: TSCO), and BJ's Wholesale Club (NYSE: BJ) shares each fell by more than 10% by 12:30 p.m. BJ's Wholesale reports its earnings results on Thursday, and investors are worried that the wholesale retailer will scale back expectations on short-term profits for the same reason that Target did today. Now what It might seem like an overreaction for investors to push the share prices down for BJ's, Tractor Supply, and Dollar Tree, given that these companies have yet to update shareholders on their latest operating trends.","Dollar Tree (NASDAQ: DLTR), Tractor Supply (NASDAQ: TSCO), and BJ's Wholesale Club (NYSE: BJ) shares each fell by more than 10% by 12:30 p.m. BJ's Wholesale reports its earnings results on Thursday, and investors are worried that the wholesale retailer will scale back expectations on short-term profits for the same reason that Target did today. Now what It might seem like an overreaction for investors to push the share prices down for BJ's, Tractor Supply, and Dollar Tree, given that these companies have yet to update shareholders on their latest operating trends.","Dollar Tree (NASDAQ: DLTR), Tractor Supply (NASDAQ: TSCO), and BJ's Wholesale Club (NYSE: BJ) shares each fell by more than 10% by 12:30 p.m. And until these companies can prove otherwise, Wall Street is assuming that Dollar Tree, BJ's, and Tractor Supply will walk a similar path with their next earnings announcements. * They just revealed what they believe are the ten best stocks for investors to buy right now... and Dollar Tree Inc wasn't one of them!",2022,2
2022-05-18 00:00:00+00:00,Relative Strength Alert For Dollar Tree,DLTR,https://www.nasdaq.com/articles/relative-strength-alert-for-dollar-tree,,,"Legendary investor Warren Buffett advises to be fearful when others are greedy, and be greedy when others are fearful. One way we can try to measure the level of fear in a given stock is through a technical analysis indicator called the Relative Strength Index, or RSI, which measures momentum on a scale of zero to 100. A stock is considered to be oversold if the RSI reading falls below 30.
In trading on Wednesday, shares of Dollar Tree Inc (Symbol: DLTR) entered into oversold territory, hitting an RSI reading of 23.1, after changing hands as low as $128.02 per share. By comparison, the current RSI reading of the S&P 500 ETF (SPY) is 37.7. A bullish investor could look at DLTR's 23.1 RSI reading today as a sign that the recent heavy selling is in the process of exhausting itself, and begin to look for entry point opportunities on the buy side. The chart below shows the one year performance of DLTR shares:
Looking at the chart above, DLTR's low point in its 52 week range is $84.26 per share, with $177.19 as the 52 week high point — that compares with a last trade of $130.73.
Free Report: Top 7%+ Dividends (paid monthly)
Find out what 9 other oversold stocks you need to know about »
The views and opinions expressed herein are the views and opinions of the author and do not necessarily reflect those of Nasdaq, Inc.","A bullish investor could look at DLTR's 23.1 RSI reading today as a sign that the recent heavy selling is in the process of exhausting itself, and begin to look for entry point opportunities on the buy side. The chart below shows the one year performance of DLTR shares: Looking at the chart above, DLTR's low point in its 52 week range is $84.26 per share, with $177.19 as the 52 week high point — that compares with a last trade of $130.73. In trading on Wednesday, shares of Dollar Tree Inc (Symbol: DLTR) entered into oversold territory, hitting an RSI reading of 23.1, after changing hands as low as $128.02 per share.","A bullish investor could look at DLTR's 23.1 RSI reading today as a sign that the recent heavy selling is in the process of exhausting itself, and begin to look for entry point opportunities on the buy side. The chart below shows the one year performance of DLTR shares: Looking at the chart above, DLTR's low point in its 52 week range is $84.26 per share, with $177.19 as the 52 week high point — that compares with a last trade of $130.73. In trading on Wednesday, shares of Dollar Tree Inc (Symbol: DLTR) entered into oversold territory, hitting an RSI reading of 23.1, after changing hands as low as $128.02 per share.","In trading on Wednesday, shares of Dollar Tree Inc (Symbol: DLTR) entered into oversold territory, hitting an RSI reading of 23.1, after changing hands as low as $128.02 per share. A bullish investor could look at DLTR's 23.1 RSI reading today as a sign that the recent heavy selling is in the process of exhausting itself, and begin to look for entry point opportunities on the buy side. The chart below shows the one year performance of DLTR shares: Looking at the chart above, DLTR's low point in its 52 week range is $84.26 per share, with $177.19 as the 52 week high point — that compares with a last trade of $130.73.","In trading on Wednesday, shares of Dollar Tree Inc (Symbol: DLTR) entered into oversold territory, hitting an RSI reading of 23.1, after changing hands as low as $128.02 per share. A bullish investor could look at DLTR's 23.1 RSI reading today as a sign that the recent heavy selling is in the process of exhausting itself, and begin to look for entry point opportunities on the buy side. The chart below shows the one year performance of DLTR shares: Looking at the chart above, DLTR's low point in its 52 week range is $84.26 per share, with $177.19 as the 52 week high point — that compares with a last trade of $130.73.",2022,4
2022-05-17 00:00:00+00:00,"US STOCKS-Wall Street ends sharply higher, fueled by Apple",DLTR,https://www.nasdaq.com/articles/us-stocks-wall-street-ends-sharply-higher-fueled-by-apple,,,"By Noel Randewich and Amruta Khandekar
May 17 (Reuters) - Wall Street finished sharply higher on Tuesday, lifted by Apple, Tesla and other megacap growth stocks after strong retail sales in April eased worries about slowing economic growth.
Ten of the 11 major S&P sector indexes advanced, with financials .SPSY, materials .SPLRCM, consumer discretionary .SPLRCD and technology .SPLRCT all gaining more than 2%.
Investors were cheered by data showing U.S. retail sales increased 0.9% in April as consumers bought motor vehicles amid an improvement in supply and frequented restaurants.
Recently punished shares of Microsoft Corp MSFT.O, Apple Inc AAPL.O, Tesla Inc TSLA.O and Amazon AMZN.O gained between 2% and 5.1%, driving the S&P 500 and the Nasdaq higher.
Tuesday's broad rally followed weeks of selling on the U.S. stock market that last week saw the S&P 500 sink to its lowest level since March 2021.
""The largest pockets of stocks that investors tend to buy have been essentially beaten up. They're either in correction or bear market territory,"" said Sylvia Jablonski, chief investment officer of Defiance ETF. ""I think investors are looking at these opportunities to buy on the dip, and I suspect that today is a good day to do that.""
The S&P 500 Banks index .SPXBK jumped 3.8%, with Citigroup C.N climbing almost 8% after Warren Buffett's Berkshire Hathaway BRKa.N disclosed a nearly $3 billion investment in the U.S. lender.
Another set of economic data showed industrial production accelerated 1.1% last month, higher than estimates of 0.5%, and faster than a 0.9% advance in March.
""This is consistent with continued economic growth in the second quarter and not a recession underway,"" said Bill Adams, chief economist for Comerica Bank in Dallas.
The U.S. Federal Reserve will ""keep pushing"" to tighten U.S. monetary policy until it is clear inflation is declining, Fed Chair Jerome Powell said at an event on Tuesday.
Traders are pricing in an 85% chance of a 50-basis point rate hike in June. FEDWATCH
The S&P 500 climbed 2.02% to end the session at 4,088.85 points.
The Nasdaq gained 2.76% to 11,984.52 points, while Dow Jones Industrial Average rose 1.34% to 32,654.59 points.
Underscoring Wall Street's recent volatility, the S&P 500 has gained or lost 2% or more in a session some 39 times so far in 2022, compared to 24 times in all of 2021.
Walmart Inc WMT.N tumbled 11.4% after the retail giant cut its annual profit forecast, signaling a hit to its margins. That marked the biggest one-day percentage drop for Walmart's stock since 1987.
Retailers Costco COST.O, Target TGT.N and Dollar Tree DLTR.O fell between 0.8% and 3.2%.
United Airlines Holdings Inc UAL.O gained 7.9% after the carrier lifted its current-quarter revenue forecast, boosting shares of Delta Air DAL.N, American Airlines AAL.O and Spirit Airlines SAVE.N.
A positive first-quarter earnings season has been overshadowed by worries about the conflict in Ukraine, soaring inflation, COVID-19 lockdowns in China and aggressive policy tightening by central banks.
The S&P 500 is down about 14% so far in 2022, and the Nasdaq is off around 23%, hit by tumbling growth stocks.
U.S.-listed Chinese stocks jumped on hopes that China will ease its crackdown on the technology sector.
Advancing issues outnumbered declining ones on the NYSE by a 2.92-to-1 ratio; on Nasdaq, a 3.19-to-1 ratio favored advancers.
The S&P 500 posted one new 52-week high and 30 new lows; the Nasdaq Composite recorded 24 new highs and 126 new lows.
Volume on U.S. exchanges was 12.0 billion shares, compared with a 13.3 billion average over the last 20 trading days.
Strong U.S. retail sales, manufacturing output boost economic outlook
GRAPHIC-S&P 500's busiest tradeshttps://tmsnrt.rs/3lmLfaJ
(Reporting by Amruta Khandekar and Devik Jain in Bengaluru, and Noel Randewich in Oakland, Calif.; Editing by Shounak Dasgupta and Lisa Shumaker)
((noel.randewich@tr.com; Twitter: @randewich))
The views and opinions expressed herein are the views and opinions of the author and do not necessarily reflect those of Nasdaq, Inc.","Retailers Costco COST.O, Target TGT.N and Dollar Tree DLTR.O fell between 0.8% and 3.2%. Investors were cheered by data showing U.S. retail sales increased 0.9% in April as consumers bought motor vehicles amid an improvement in supply and frequented restaurants. The U.S. Federal Reserve will ""keep pushing"" to tighten U.S. monetary policy until it is clear inflation is declining, Fed Chair Jerome Powell said at an event on Tuesday.","Retailers Costco COST.O, Target TGT.N and Dollar Tree DLTR.O fell between 0.8% and 3.2%. By Noel Randewich and Amruta Khandekar May 17 (Reuters) - Wall Street finished sharply higher on Tuesday, lifted by Apple, Tesla and other megacap growth stocks after strong retail sales in April eased worries about slowing economic growth. Investors were cheered by data showing U.S. retail sales increased 0.9% in April as consumers bought motor vehicles amid an improvement in supply and frequented restaurants.","Retailers Costco COST.O, Target TGT.N and Dollar Tree DLTR.O fell between 0.8% and 3.2%. By Noel Randewich and Amruta Khandekar May 17 (Reuters) - Wall Street finished sharply higher on Tuesday, lifted by Apple, Tesla and other megacap growth stocks after strong retail sales in April eased worries about slowing economic growth. The Nasdaq gained 2.76% to 11,984.52 points, while Dow Jones Industrial Average rose 1.34% to 32,654.59 points.","Retailers Costco COST.O, Target TGT.N and Dollar Tree DLTR.O fell between 0.8% and 3.2%. By Noel Randewich and Amruta Khandekar May 17 (Reuters) - Wall Street finished sharply higher on Tuesday, lifted by Apple, Tesla and other megacap growth stocks after strong retail sales in April eased worries about slowing economic growth. Ten of the 11 major S&P sector indexes advanced, with financials .SPSY, materials .SPLRCM, consumer discretionary .SPLRCD and technology .SPLRCT all gaining more than 2%.",2022,2
