Date,Article_title,Stock_symbol,Url,Publisher,Author,Article,Lsa_summary,Luhn_summary,Textrank_summary,Lexrank_summary,Year,sentiment_score
2022-02-18 00:00:00+00:00,"S&P 500 Movers: PPL, NFLX",DLTR,https://www.nasdaq.com/articles/sp-500-movers%3A-ppl-nflx,,,"In early trading on Friday, shares of Netflix topped the list of the day's best performing components of the S&P 500 index, trading up 4.0%. Year to date, Netflix has lost about 33.3% of its value.
And the worst performing S&P 500 component thus far on the day is PPL, trading down 5.3%. PPL is lower by about 11.3% looking at the year to date performance.
Two other components making moves today are Intel, trading down 4.6%, and Dollar Tree, trading up 3.6% on the day.
VIDEO: S&P 500 Movers: PPL, NFLX
The views and opinions expressed herein are the views and opinions of the author and do not necessarily reflect those of Nasdaq, Inc.","And the worst performing S&P 500 component thus far on the day is PPL, trading down 5.3%. PPL is lower by about 11.3% looking at the year to date performance. VIDEO: S&P 500 Movers: PPL, NFLX The views and opinions expressed herein are the views and opinions of the author and do not necessarily reflect those of Nasdaq, Inc.","In early trading on Friday, shares of Netflix topped the list of the day's best performing components of the S&P 500 index, trading up 4.0%. Year to date, Netflix has lost about 33.3% of its value. And the worst performing S&P 500 component thus far on the day is PPL, trading down 5.3%.","In early trading on Friday, shares of Netflix topped the list of the day's best performing components of the S&P 500 index, trading up 4.0%. And the worst performing S&P 500 component thus far on the day is PPL, trading down 5.3%. Two other components making moves today are Intel, trading down 4.6%, and Dollar Tree, trading up 3.6% on the day.","And the worst performing S&P 500 component thus far on the day is PPL, trading down 5.3%. PPL is lower by about 11.3% looking at the year to date performance. VIDEO: S&P 500 Movers: PPL, NFLX The views and opinions expressed herein are the views and opinions of the author and do not necessarily reflect those of Nasdaq, Inc.",2022,3
2022-02-18 00:00:00+00:00,Friday's Stock Winners Show Which Way the Wind's Blowing,DLTR,https://www.nasdaq.com/articles/fridays-stock-winners-show-which-way-the-winds-blowing,,,"The stock market completed another troubling week, with major market indexes moving still lower on Friday. There are a host of issues to look at, including the Russia-Ukraine conflict, the Federal Reserve's monetary policy tightening, and ongoing economic pressures from supply chain disruptions and other problems. Those worries sent the Dow Jones Industrial Average (DJINDICES: ^DJI), S&P 500 (SNPINDEX: ^GSPC), and Nasdaq Composite (NASDAQINDEX: ^IXIC) lower again on Friday, extending the correction still further.
INDEX
DAILY PERCENTAGE CHANGE
DAILY POINT CHANGE
Dow
(0.68%)
(233)
S&P 500
(0.72%)
(31)
Nasdaq
(1.23%)
(169)
Data source: Yahoo! Finance.
Even though the markets were down, investors focused on some success stories. The kinds of stocks they looked at, though, revealed some of the thought process that the investing community seems to be moving toward. Here we'll look more closely at why Dollar Tree (NASDAQ: DLTR) and Matson (NYSE: MATX) both moved higher significantly on Friday.
Money grows at Dollar Tree
Shares of Dollar Tree finished up more than 5% on Friday. The dollar store retailer made an upper level management move that gave investors a signal that some more drastic changes might be coming to the company in the near future.
Executive board Chair Bob Sasser announced that he will retire from his position. The move will happen before Dollar Tree's 2022 shareholder meeting, according to the release. The 70-year-old Sasser will retain the honorary title of chairman emeritus after retiring.
Sasser has worked with Dollar Tree for more than 20 years, including leading the company as CEO from 2003 to 2017. In his time with the company, Dollar Tree's size has grown more than tenfold using several key metrics, including store count, size of its workforce, annual revenue, and market capitalization of its stock.
It might seem odd for the departure of such a prominent player in Dollar Tree's success to prompt an upward move in the stock price. However, traders are speculating that the activist investors who have focused on Dollar Tree might now have more of a free hand to suggest more sweeping changes at Dollar Tree. If those moves prove to be shareholder-friendly, then it could push the dollar store stock price back to all-time highs and then some.
Image source: Getty Images.
Matson ships it
Meanwhile, shares of marine shipping company Matson were higher by 11% on Friday. Favorable financial results on Thursday evening helped lift the Hawaii-based company, and better times ahead could continue to lift the stock.
Matson's fourth-quarter financial report was positively stellar. Operating revenue jumped more than 80% year over year to $1.27 billion, wrapping up a year with a 65% rise in operating sales compared to 2020 levels. Net income soared more than four times from year-earlier levels in the fourth quarter, with earnings coming in at $9.39 per share.
Supply chain issues are helping Matson dramatically. Its service to China is an important element of its ocean transportation segment, with elevated demand for expedited service helping to boost sales. Meanwhile, Matson is also seeing hefty volume in its domestic trade, and its logistics business is benefiting from inventory restocking efforts and strong supply and demand dynamics in its core markets.
Even after today's jump, Matson's stock price remains below $100 per share. That puts a ridiculously low earnings multiple on the stock that clearly anticipates supply chain disruptions putting a big crimp in Matson's bottom line going forward. Even if earnings do fall, the question is whether they'll fall so much as to justify making the stock look like an attractive value right now.
10 stocks we like better than Dollar Tree
When our award-winning analyst team has a stock tip, it can pay to listen. After all, the newsletter they have run for over a decade, Motley Fool Stock Advisor, has tripled the market.*
They just revealed what they believe are the ten best stocks for investors to buy right now... and Dollar Tree wasn't one of them! That's right -- they think these 10 stocks are even better buys.
See the 10 stocks
*Stock Advisor returns as of January 20, 2022
Dan Caplinger has no position in any of the stocks mentioned. The Motley Fool has no position in any of the stocks mentioned. The Motley Fool has a disclosure policy.
The views and opinions expressed herein are the views and opinions of the author and do not necessarily reflect those of Nasdaq, Inc.","Here we'll look more closely at why Dollar Tree (NASDAQ: DLTR) and Matson (NYSE: MATX) both moved higher significantly on Friday. There are a host of issues to look at, including the Russia-Ukraine conflict, the Federal Reserve's monetary policy tightening, and ongoing economic pressures from supply chain disruptions and other problems. The dollar store retailer made an upper level management move that gave investors a signal that some more drastic changes might be coming to the company in the near future.","Here we'll look more closely at why Dollar Tree (NASDAQ: DLTR) and Matson (NYSE: MATX) both moved higher significantly on Friday. Money grows at Dollar Tree Shares of Dollar Tree finished up more than 5% on Friday. Matson ships it Meanwhile, shares of marine shipping company Matson were higher by 11% on Friday.","Here we'll look more closely at why Dollar Tree (NASDAQ: DLTR) and Matson (NYSE: MATX) both moved higher significantly on Friday. In his time with the company, Dollar Tree's size has grown more than tenfold using several key metrics, including store count, size of its workforce, annual revenue, and market capitalization of its stock. 10 stocks we like better than Dollar Tree When our award-winning analyst team has a stock tip, it can pay to listen.",Here we'll look more closely at why Dollar Tree (NASDAQ: DLTR) and Matson (NYSE: MATX) both moved higher significantly on Friday. Money grows at Dollar Tree Shares of Dollar Tree finished up more than 5% on Friday. * They just revealed what they believe are the ten best stocks for investors to buy right now... and Dollar Tree wasn't one of them!,2022,3
2022-02-18 00:00:00+00:00,"Notable Friday Option Activity: KRTX, DLTR, BLMN",DLTR,https://www.nasdaq.com/articles/notable-friday-option-activity%3A-krtx-dltr-blmn,,,"Looking at options trading activity among components of the Russell 3000 index, there is noteworthy activity today in Karuna Therapeutics Inc (Symbol: KRTX), where a total volume of 972 contracts has been traded thus far today, a contract volume which is representative of approximately 97,200 underlying shares (given that every 1 contract represents 100 underlying shares). That number works out to 47.9% of KRTX's average daily trading volume over the past month, of 203,025 shares. Particularly high volume was seen for the $120 strike call option expiring April 14, 2022, with 253 contracts trading so far today, representing approximately 25,300 underlying shares of KRTX. Below is a chart showing KRTX's trailing twelve month trading history, with the $120 strike highlighted in orange:
Dollar Tree Inc (Symbol: DLTR) saw options trading volume of 9,817 contracts, representing approximately 981,700 underlying shares or approximately 46.4% of DLTR's average daily trading volume over the past month, of 2.1 million shares. Particularly high volume was seen for the $145 strike call option expiring February 18, 2022, with 814 contracts trading so far today, representing approximately 81,400 underlying shares of DLTR. Below is a chart showing DLTR's trailing twelve month trading history, with the $145 strike highlighted in orange:
And Bloomin' Brands Inc (Symbol: BLMN) options are showing a volume of 8,178 contracts thus far today. That number of contracts represents approximately 817,800 underlying shares, working out to a sizeable 45.6% of BLMN's average daily trading volume over the past month, of 1.8 million shares. Especially high volume was seen for the $25 strike call option expiring February 18, 2022, with 1,947 contracts trading so far today, representing approximately 194,700 underlying shares of BLMN. Below is a chart showing BLMN's trailing twelve month trading history, with the $25 strike highlighted in orange:
For the various different available expirations for KRTX options, DLTR options, or BLMN options, visit StockOptionsChannel.com.
Today's Most Active Call & Put Options of the S&P 500 »
The views and opinions expressed herein are the views and opinions of the author and do not necessarily reflect those of Nasdaq, Inc.","Particularly high volume was seen for the $145 strike call option expiring February 18, 2022, with 814 contracts trading so far today, representing approximately 81,400 underlying shares of DLTR. Below is a chart showing KRTX's trailing twelve month trading history, with the $120 strike highlighted in orange: Dollar Tree Inc (Symbol: DLTR) saw options trading volume of 9,817 contracts, representing approximately 981,700 underlying shares or approximately 46.4% of DLTR's average daily trading volume over the past month, of 2.1 million shares. Below is a chart showing DLTR's trailing twelve month trading history, with the $145 strike highlighted in orange: And Bloomin' Brands Inc (Symbol: BLMN) options are showing a volume of 8,178 contracts thus far today.","Below is a chart showing KRTX's trailing twelve month trading history, with the $120 strike highlighted in orange: Dollar Tree Inc (Symbol: DLTR) saw options trading volume of 9,817 contracts, representing approximately 981,700 underlying shares or approximately 46.4% of DLTR's average daily trading volume over the past month, of 2.1 million shares. Particularly high volume was seen for the $145 strike call option expiring February 18, 2022, with 814 contracts trading so far today, representing approximately 81,400 underlying shares of DLTR. Below is a chart showing DLTR's trailing twelve month trading history, with the $145 strike highlighted in orange: And Bloomin' Brands Inc (Symbol: BLMN) options are showing a volume of 8,178 contracts thus far today.","Below is a chart showing KRTX's trailing twelve month trading history, with the $120 strike highlighted in orange: Dollar Tree Inc (Symbol: DLTR) saw options trading volume of 9,817 contracts, representing approximately 981,700 underlying shares or approximately 46.4% of DLTR's average daily trading volume over the past month, of 2.1 million shares. Particularly high volume was seen for the $145 strike call option expiring February 18, 2022, with 814 contracts trading so far today, representing approximately 81,400 underlying shares of DLTR. Below is a chart showing DLTR's trailing twelve month trading history, with the $145 strike highlighted in orange: And Bloomin' Brands Inc (Symbol: BLMN) options are showing a volume of 8,178 contracts thus far today.","Below is a chart showing KRTX's trailing twelve month trading history, with the $120 strike highlighted in orange: Dollar Tree Inc (Symbol: DLTR) saw options trading volume of 9,817 contracts, representing approximately 981,700 underlying shares or approximately 46.4% of DLTR's average daily trading volume over the past month, of 2.1 million shares. Below is a chart showing BLMN's trailing twelve month trading history, with the $25 strike highlighted in orange: For the various different available expirations for KRTX options, DLTR options, or BLMN options, visit StockOptionsChannel.com. Particularly high volume was seen for the $145 strike call option expiring February 18, 2022, with 814 contracts trading so far today, representing approximately 81,400 underlying shares of DLTR.",2022,3
2022-02-18 00:00:00+00:00,Dollar Tree: Executive Chairman Bob Sasser To Retire - Quick Facts,DLTR,https://www.nasdaq.com/articles/dollar-tree%3A-executive-chairman-bob-sasser-to-retire-quick-facts,,,"(RTTNews) - Dollar Tree, Inc. (DLTR) said Bob Sasser plans to retire from his role as Executive Chairman of Board prior to the 2022 Annual Meeting of Shareholders. The Board has decided to bestow Bob Sasser with the honorary title of Chairman Emeritus upon his retirement.
Sasser joined the company in 1999 as Chief Operating Officer, served as President and Chief Operating Officer from 2001 to 2003, and then as Chief Executive Officer from 2003 to 2017. He has served as Executive Chairman of the Board for the past five years.
""Dollar Tree would not be the company it is today without Bob Sasser,"" said Gregory Bridgeford, Lead Independent Director.
The views and opinions expressed herein are the views and opinions of the author and do not necessarily reflect those of Nasdaq, Inc.","(RTTNews) - Dollar Tree, Inc. (DLTR) said Bob Sasser plans to retire from his role as Executive Chairman of Board prior to the 2022 Annual Meeting of Shareholders. The Board has decided to bestow Bob Sasser with the honorary title of Chairman Emeritus upon his retirement. ""Dollar Tree would not be the company it is today without Bob Sasser,"" said Gregory Bridgeford, Lead Independent Director.","(RTTNews) - Dollar Tree, Inc. (DLTR) said Bob Sasser plans to retire from his role as Executive Chairman of Board prior to the 2022 Annual Meeting of Shareholders. Sasser joined the company in 1999 as Chief Operating Officer, served as President and Chief Operating Officer from 2001 to 2003, and then as Chief Executive Officer from 2003 to 2017. He has served as Executive Chairman of the Board for the past five years.","(RTTNews) - Dollar Tree, Inc. (DLTR) said Bob Sasser plans to retire from his role as Executive Chairman of Board prior to the 2022 Annual Meeting of Shareholders. Sasser joined the company in 1999 as Chief Operating Officer, served as President and Chief Operating Officer from 2001 to 2003, and then as Chief Executive Officer from 2003 to 2017. The views and opinions expressed herein are the views and opinions of the author and do not necessarily reflect those of Nasdaq, Inc.","(RTTNews) - Dollar Tree, Inc. (DLTR) said Bob Sasser plans to retire from his role as Executive Chairman of Board prior to the 2022 Annual Meeting of Shareholders. Sasser joined the company in 1999 as Chief Operating Officer, served as President and Chief Operating Officer from 2001 to 2003, and then as Chief Executive Officer from 2003 to 2017. He has served as Executive Chairman of the Board for the past five years.",2022,3
2022-02-17 00:00:00+00:00,"Walmart (WMT) Beats Q4 Earnings Estimates, Hikes Dividend",DLTR,https://www.nasdaq.com/articles/walmart-wmt-beats-q4-earnings-estimates-hikes-dividend,,,"Walmart Inc. WMT reported fourth-quarter fiscal 2022 results, wherein the top and the bottom lines advanced year over year and surpassed the respective Zacks Consensus Estimate. The company continued to increase its share in the U.S. grocery market. The company’s solid efforts to enhance the e-commerce game have been helping it stay firm against the growing competition.

Walmart concluded fiscal 2022 on a strong note, with impressive momentum in all three segments. WMT performed well amid escalated supply-chain costs as well as pandemic-related hurdles. Encouragingly, management unveiled a hike in its annual dividend.
Quarter in Detail
Walmart’s adjusted earnings of $1.53 per share rose 10.1% from the year-ago period’s figure of $1.39 and beat the Zacks Consensus Estimate of $1.50. Total revenues of $152.9 billion grew 0.5% and beat the consensus mark of $151.4 billion. On a constant-currency (cc) basis, total revenues climbed 0.6% to $153 billion. Revenues were hurt to the tune of about $10.2 billion related to divestitures.
Walmart Inc. Price, Consensus and EPS Surprise

Walmart Inc. price-consensus-eps-surprise-chart | Walmart Inc. Quote
Consolidated gross profit margin expanded 10 basis points (bps) to 23.8%. Management remains focused on competitive pricing globally. The gross margin at Walmart U.S. grew 54 bps due to efficient price management and a mix, somewhat countered by high supply-chain costs that came in at more than $400 million.

Adjusted operating income at cc rose 6.2% to $6 billion. However, the metric was adversely impacted by divestitures to the tune of about 60 bps. Consolidated operating expenses as a percentage of sales remained flat year over year. This reflects robust sales growth and a decline in expenses for COVID-19, offset by investments in wages.

Image Source: Zacks Investment Research
Segment Details
Walmart U.S.: The segment’s net sales grew 5.7% to $105.3 billion in the reported quarter. U.S. comp sales, excluding fuel, improved 5.6% due to a 3.1% rise in transactions and a 2.4% increase in the average ticket. Comp sales represented robust underlying business trends, led by in-store traffic and aided by sturdy consumer spending and robust holiday season sales. Comp sales grew across the general merchandise, grocery and health & wellness categories. The segment saw an increased market share in grocery.

E-commerce negatively impacted comps by 80 bps. E-commerce sales in the segment rose 1%. On a two-year stack basis, e-commerce sales surged 70%. As of the fourth quarter, Walmart U.S. had 4,600 pickup locations and 3,500 same-day delivery stores. The company remodeled more than 140 stores during the reported quarter. Adjusted operating income at the Walmart U.S. segment grew 0.3% to $5.2 billion.

Walmart International: The segment’s net sales fell 22.6% to $27 billion. Divestitures hurt the segment’s net sales by $10.1 billion. On a cc basis, net sales dropped 22.1% to $27.2 billion. The strength in Flipkart, Mexico and China was an upside. Adjusted operating income, on a cc basis, slumped 12% to $0.8 billion.

Sam’s Club: The segment, which comprises membership warehouse clubs, witnessed a net sales increase of 16.5% to $19.2 billion. Sam’s Club comp sales, excluding fuel, grew 10.4%. While transactions grew 7%, the average ticket rose 3.2%. Comp sales saw broad-based strength across categories, mainly led by food. However, tobacco hurt comp sales.

Membership income climbed 9.1% in the quarter, reflecting solid membership trends, with a record total member count. The plus penetration rate also ascended and reached an all-time high. E-commerce fueled comps by 100 bps. E-commerce net sales jumped 21% at Sam’s Club on a robust direct-to-home show and solid curbside performance. The segment’s operating income came in at $0.5 billion, up 41.1% year over year.
Other Financial Updates & Developments
Walmart ended the quarter with cash and cash equivalents of $14.8 billion, long-term debt of $34.9 billion and total equity of $91.9 billion. In fiscal 2022, WMT generated operating cash flow of $24.2 billion and incurred capital expenditures of $13.1 billion, resulting in free cash flow of $11.1 billion.

The company allocated $6.2 billion for dividend payouts and $9.8 billion for share buybacks during the fiscal. In a separate release, Walmart raised its annual dividend by about 2%, taking it to $2.24 per share for fiscal 2023. This marks the company’s 49th straight annual dividend hike.
Guidance
Walmart issued its view for fiscal 2023. The company expects consolidated net sales growth of nearly 3% at cc. Excluding divestitures, the metric is likely to grow nearly 4%.

U.S. comp sales, excluding fuel, are likely to be more than 3%.

Consolidated operating income is expected to grow nearly 3% at cc and at a greater rate than net sales on excluding divestitures. Management envisions earnings per share (EPS) growth in the mid-single digit range. Excluding divestitures, it is expected to rise 5-6%.

Shares of this Zacks Rank #3 (Hold) company have dropped 10.4% in the past six months compared with the industry’s decline of 8.9%.
3 Retail Stocks to Bet on
Here are three better-ranked stocks – Albertsons Companies ACI, Boot Barn Holdings, Inc. BOOT and Dollar Tree DLTR.

Albertsons Companies, a leading food and drug retailer in the United States, sports a Zacks Rank #1 (Strong Buy). The company has an expected EPS growth rate of 8% for three to five years. You can see the complete list of today’s Zacks #1 Rank stocks here.

The Zacks Consensus Estimate for Albertsons Companies’ current financial-year sales suggests growth of 1.6% from the year-ago period. ACI has a trailing four-quarter earnings surprise of 31.8%, on average.

Boot Barn, which is a lifestyle retail chain, carries a Zacks Rank #1. The company has a trailing four-quarter earnings surprise of 47.1%, on average.

The Zacks Consensus Estimate for Boot Barn’s current financial-year sales suggests growth of 62.6% from the year-ago period. BOOT has an expected EPS growth rate of 20% for three to five years.

Dollar Tree, the operator of discount variety retail stores, holds a Zacks Rank #2 (Buy). Dollar Tree has a trailing four-quarter earnings surprise of 8.8%, on average. The company has an expected EPS growth rate of 12.2% for three to five years.

The Zacks Consensus Estimate for DLTR’s current financial-year sales suggests growth of 3.4% from the year-ago period.

7 Best Stocks for the Next 30 Days
Just released: Experts distill 7 elite stocks from the current list of 220 Zacks Rank #1 Strong Buys. They deem these tickers ""Most Likely for Early Price Pops.""
Since 1988, the full list has beaten the market more than 2X over with an average gain of +25.4% per year. So be sure to give these hand-picked 7 your immediate attention. 
See them now >>

Want the latest recommendations from Zacks Investment Research? Today, you can download 7 Best Stocks for the Next 30 Days. Click to get this free report
 
Walmart Inc. (WMT): Free Stock Analysis Report
 
Dollar Tree, Inc. (DLTR): Free Stock Analysis Report
 
Albertsons Companies, Inc. (ACI): Free Stock Analysis Report
 
Boot Barn Holdings, Inc. (BOOT): Free Stock Analysis Report
 
To read this article on Zacks.com click here.
 
Zacks Investment Research
The views and opinions expressed herein are the views and opinions of the author and do not necessarily reflect those of Nasdaq, Inc.","BOOT and Dollar Tree DLTR. The Zacks Consensus Estimate for DLTR’s current financial-year sales suggests growth of 3.4% from the year-ago period. Dollar Tree, Inc. (DLTR): Free Stock Analysis Report","BOOT and Dollar Tree DLTR. The Zacks Consensus Estimate for DLTR’s current financial-year sales suggests growth of 3.4% from the year-ago period. Dollar Tree, Inc. (DLTR): Free Stock Analysis Report","BOOT and Dollar Tree DLTR. The Zacks Consensus Estimate for DLTR’s current financial-year sales suggests growth of 3.4% from the year-ago period. Dollar Tree, Inc. (DLTR): Free Stock Analysis Report","BOOT and Dollar Tree DLTR. The Zacks Consensus Estimate for DLTR’s current financial-year sales suggests growth of 3.4% from the year-ago period. Dollar Tree, Inc. (DLTR): Free Stock Analysis Report",2022,3
