Date,Article_title,Stock_symbol,Url,Publisher,Author,Article,Lsa_summary,Luhn_summary,Textrank_summary,Lexrank_summary,Year,sentiment_score
2022-11-16 00:00:00+00:00,"US STOCKS-S&P 500, Nasdaq slip on Micron's supply cut, Target outlook",DLTR,https://www.nasdaq.com/articles/us-stocks-sp-500-nasdaq-slip-on-microns-supply-cut-target-outlook,,,"By Amruta Khandekar and Ankika Biswas
Nov 16 (Reuters) - The S&P 500 and Nasdaq fell on Wednesday as a grim outlook from Target spurred fresh concerns for retailers heading into the crucial holiday season, while Micron's supply cut triggered a selloff in the chip sector.
Target Corp TGT.N tumbled as much as 17% in early trading as a pullback in consumer spending despite heavy discounting cut its third-quarter profit by half.
Its bleak results jolted the retail sector, with shares of Macy's Inc M.N, Best Buy Co Inc BBY.N and Dollar Tree Inc DLTR.O dropping between 1.6% and 8.9%.
Meanwhile, Micron Technology Inc MU.O said it will reduce memory chip supply in 2023 and make more cuts to its capital spending plan, as it struggles to clear excess inventory due to a demand slump.
Shares of other chip stocks such as Intel Corp INTC.O, Advanced Micro Devices AMD.O, Applied Materials AMAT.O and Lam Research LRCX.O fell between 2% and 6%, weighing heavily on the tech-heavy Nasdaq.
""There are two things weighing on market sentiment; you're seeing softer demand in two sectors with Target in the retail sector and Micron with the chips,"" said Dennis Dick, market structure analyst and trader at Triple D Trading, highlighting Micron's drag on other chipmakers.
Investors will also keep an eye on chipmaker Nvidia Corp's NVDA.O earnings, which is expected later in the day.
Despite the sales warning from Target, data showed U.S. retail sales increased more than expected in October, boosted by purchases of motor vehicles and suggesting that consumer spending remained stable.
The data and earnings reports come on the heels of upbeat quarterly results from Walmart Inc WMT.N on Tuesday that had added to market optimism driven by a softer-than-expected producer prices report.
All the three main indexes ended higher in the previous session as geopolitical worries were overshadowed by expectations that the improved inflation outlook would allow the Federal Reserve to shift to smaller interest rate hikes as soon as December.
Several Fed officials have also signaled that the central bank could slow its pace of tightening while stressing the need to continue to raise borrowing costs to stamp out high inflation.
San Francisco Federal Reserve Bank President Mary Daly on Wednesday said it is reasonable for the U.S. central bank to raise its policy rate to the 4.75%-5.25% range by early next year, with a 5% policy rate as a ""reasonable starting point.""
At 13:04 a.m. ET, the Dow Jones Industrial Average .DJI was up 18.28 points, or 0.05%, at 33,611.20, the S&P 500 .SPX was down 20.36 points, or 0.51%, at 3,971.37, and the Nasdaq Composite .IXIC was down 124.92 points, or 1.10%, at 11,233.49.
Among other stocks, home improvement retailer Lowe's Companies Inc LOW.N jumped 4.9% after increasing its annual profit forecast on steady demand.
U.S.-listed shares of Grab Holdings Ltd GRAB.O rose 1.4% after the ride-hailing and food delivery firm bumped up its 2022 revenue forecast.
Declining issues outnumbered advancers for a 1.73-to-1 ratio on the NYSE and for a 2.23-to-1 ratio on the Nasdaq.
The S&P index recorded three new 52-week highs and two new lows, while the Nasdaq recorded 50 new highs and 104 new lows.
(Reporting by Bansari Mayur Kamdar, Ankika Biswas and Amruta Khandekar in Bengaluru; Editing by Shounak Dasgupta and Arun Koyyur)
((BansariMayur.Kamdar@thomsonreuters.com; Twitter: @BansariKamdar))
The views and opinions expressed herein are the views and opinions of the author and do not necessarily reflect those of Nasdaq, Inc.","Its bleak results jolted the retail sector, with shares of Macy's Inc M.N, Best Buy Co Inc BBY.N and Dollar Tree Inc DLTR.O dropping between 1.6% and 8.9%. By Amruta Khandekar and Ankika Biswas Nov 16 (Reuters) - The S&P 500 and Nasdaq fell on Wednesday as a grim outlook from Target spurred fresh concerns for retailers heading into the crucial holiday season, while Micron's supply cut triggered a selloff in the chip sector. Meanwhile, Micron Technology Inc MU.O said it will reduce memory chip supply in 2023 and make more cuts to its capital spending plan, as it struggles to clear excess inventory due to a demand slump.","Its bleak results jolted the retail sector, with shares of Macy's Inc M.N, Best Buy Co Inc BBY.N and Dollar Tree Inc DLTR.O dropping between 1.6% and 8.9%. Despite the sales warning from Target, data showed U.S. retail sales increased more than expected in October, boosted by purchases of motor vehicles and suggesting that consumer spending remained stable. San Francisco Federal Reserve Bank President Mary Daly on Wednesday said it is reasonable for the U.S. central bank to raise its policy rate to the 4.75%-5.25% range by early next year, with a 5% policy rate as a ""reasonable starting point.""","Its bleak results jolted the retail sector, with shares of Macy's Inc M.N, Best Buy Co Inc BBY.N and Dollar Tree Inc DLTR.O dropping between 1.6% and 8.9%. By Amruta Khandekar and Ankika Biswas Nov 16 (Reuters) - The S&P 500 and Nasdaq fell on Wednesday as a grim outlook from Target spurred fresh concerns for retailers heading into the crucial holiday season, while Micron's supply cut triggered a selloff in the chip sector. ""There are two things weighing on market sentiment; you're seeing softer demand in two sectors with Target in the retail sector and Micron with the chips,"" said Dennis Dick, market structure analyst and trader at Triple D Trading, highlighting Micron's drag on other chipmakers.","Its bleak results jolted the retail sector, with shares of Macy's Inc M.N, Best Buy Co Inc BBY.N and Dollar Tree Inc DLTR.O dropping between 1.6% and 8.9%. By Amruta Khandekar and Ankika Biswas Nov 16 (Reuters) - The S&P 500 and Nasdaq fell on Wednesday as a grim outlook from Target spurred fresh concerns for retailers heading into the crucial holiday season, while Micron's supply cut triggered a selloff in the chip sector. San Francisco Federal Reserve Bank President Mary Daly on Wednesday said it is reasonable for the U.S. central bank to raise its policy rate to the 4.75%-5.25% range by early next year, with a 5% policy rate as a ""reasonable starting point.""",2022,2
2022-11-16 00:00:00+00:00,3 Reasons Dollar Tree Stock Is a No-Brainer Buy,DLTR,https://www.nasdaq.com/articles/3-reasons-dollar-tree-stock-is-a-no-brainer-buy,,,"With the S&P 500 down 17% year to date, 2022 hasn't been kind to stock market investors. But not every company has been hurt by the bear market. Discount retailer Dollar Tree (NASDAQ: DLTR) has seen its share price jump 17% in the same period. Let's discuss three reasons why it can continue outperforming.
A recession-proof business
According to a Bloomberg survey of economists in October, 60% believe the U.S. economy will enter a recession within 12 months. An economic downturn could be catastrophic for many retail companies because less consumer spending means fewer sales and profits. Dollar Tree bucks the trend. As a dollar store, its business model focuses on getting prices as low as possible.
It pulls off its strategy through a no-frills shopping experience, low labor costs, and by locating its stores in underserved (mainly rural) communities where space and labor are cheaper.
That said, Dollar Tree is not completely immune from macroeconomic challenges like inflation (which stands at 7.7% annually as of October). The company is dealing with this headwind by raising its standard price; it went from $1 to $1.25 in late 2021. But as a deep-discount store, Dollar Tree is naturally better-suited to handle this challenge than its big-box retailer rivals (such as Walmart and Target) because dollar stores are typically the cheapest option for consumers when money is tight.
Business is booming
Dollar Tree's business is holding up well in this challenging economy. Second-quarter net sales jumped 6.7% year over year to $6.77 billion as inflation drives consumers to its low-priced goods. Inflation is a double-edged sword because it increases freight costs and changes the company's product mix in favor of lower-margin consumable products. But so far, Dollar Tree has shrugged off these headwinds -- with its gross margin actually improving from 29.4% to 31.4% in the period.
To keep powering growth, Dollar Tree continues to expand its store count, opening 127 new locations to bring its total to 16,231 in the period. The company also rolled out its new ""Plus"" offering to 697 more stores. Dollar Tree Plus offers higher-priced items of $3 and $5, which can expand selection and help boost same-store sales going forward.
Image source: Getty Images.
Dollar Tree is also a cash cow. Second-quarter net income soared by 27.4% to $359.9 million, and management expects earnings per share to be between $7.10 and $7.40 for all of 2022 (an increase of 25% over the prior year at the midpoint).
The company returns value to shareholders through a generous buyback program, which retired 250 million worth of shares in the first half of 2022 with an additional $2.25 billion authorized for repurchase in the future. Buybacks can benefit investors by increasing the fundamental value of their shares relative to earnings and cash flow.
A good valuation
Despite its strong performance in 2022, Dollar Tree is still reasonably valued compared to the wider market. With a forward price-to-earnings multiple of 18.9, Dollar Tree trades lower than the S&P 500 average of 19.4. With strong bottom-line growth and a recession-resistant business model, the stock looks like a no-brainer buy at these prices.
10 stocks we like better than Dollar Tree Inc
When our award-winning analyst team has a stock tip, it can pay to listen. After all, the newsletter they have run for over a decade, Motley Fool Stock Advisor, has tripled the market.*
They just revealed what they believe are the ten best stocks for investors to buy right now... and Dollar Tree Inc wasn't one of them! That's right -- they think these 10 stocks are even better buys.
See the 10 stocks
*Stock Advisor returns as of November 7, 2022
Will Ebiefung has no position in any of the stocks mentioned. The Motley Fool has positions in and recommends Target and Walmart Inc. The Motley Fool has a disclosure policy.
The views and opinions expressed herein are the views and opinions of the author and do not necessarily reflect those of Nasdaq, Inc.","Discount retailer Dollar Tree (NASDAQ: DLTR) has seen its share price jump 17% in the same period. To keep powering growth, Dollar Tree continues to expand its store count, opening 127 new locations to bring its total to 16,231 in the period. Second-quarter net income soared by 27.4% to $359.9 million, and management expects earnings per share to be between $7.10 and $7.40 for all of 2022 (an increase of 25% over the prior year at the midpoint).","Discount retailer Dollar Tree (NASDAQ: DLTR) has seen its share price jump 17% in the same period. Second-quarter net sales jumped 6.7% year over year to $6.77 billion as inflation drives consumers to its low-priced goods. To keep powering growth, Dollar Tree continues to expand its store count, opening 127 new locations to bring its total to 16,231 in the period.","Discount retailer Dollar Tree (NASDAQ: DLTR) has seen its share price jump 17% in the same period. But as a deep-discount store, Dollar Tree is naturally better-suited to handle this challenge than its big-box retailer rivals (such as Walmart and Target) because dollar stores are typically the cheapest option for consumers when money is tight. 10 stocks we like better than Dollar Tree Inc When our award-winning analyst team has a stock tip, it can pay to listen.","Discount retailer Dollar Tree (NASDAQ: DLTR) has seen its share price jump 17% in the same period. As a dollar store, its business model focuses on getting prices as low as possible. Business is booming Dollar Tree's business is holding up well in this challenging economy.",2022,4
2022-11-16 00:00:00+00:00,"The Zacks Analyst Blog Highlights Macy's, Lululemon Athletica, Dollar General and Dollar Tree",DLTR,https://www.nasdaq.com/articles/the-zacks-analyst-blog-highlights-macys-lululemon-athletica-dollar-general-and-dollar-tree,,,"For Immediate Release
Chicago, IL – November 16, 2022 – Zacks.com announces the list of stocks featured in the Analyst Blog. Every day the Zacks Equity Research analysts discuss the latest news and events impacting stocks and the financial markets. Stocks recently featured in the blog include: Macy's, Inc. M, lululemon athletica LULU, Dollar General DG and Dollar Tree DLTR.
Here are highlights from Tuesday’s Analyst Blog:
What's in the Cards for Macy's Earnings?
Macy's, Inc. is likely to register both top- and bottom-line declines from the respective year-ago fiscal quarter’s reported numbers in its third-quarter fiscal 2022 results on Nov 17, before the opening bell. The Zacks Consensus Estimate for revenues is pegged at $5,175 million, suggesting a 4.9% dip from the prior-year quarter’s reported figure.
The Zacks Consensus Estimate for quarterly earnings has been stable at 19 cents per share in the past 30 days. The consensus mark indicates a decline from $1.23 a share earned in the year-earlier quarter. Macy's bottom line surpassed the Zacks Consensus Estimate by 17.7% in the last reported quarter. M has a trailing four-quarter earnings surprise of 80.8%, on average.
We expect revenues to be down 4.6% from the prior-year fiscal quarter’s reading to $5,192.4 million and adjusted earnings to plunge 84.1% to 20 cents per share in the quarter under review.
Factors to Note
Soft consumer demand due to the inflationary environment and incremental promotional pressures is likely to have weighed on Macy’s third-quarter performance. Markdowns to optimize inventory levels within overstock categories and the possibility of an elevated promotional environment, given the high inventory levels, might have hurt margins and the bottom line. Also, deleveraged SG&A expenses are concerns.
On its lastearnings call management had expected third-quarter net sales of $5,160-$5,230 million, indicating a decline from the net sales of $5,440 million reported in the year-ago period. M had envisioned third-quarter adjusted earnings of 15-21 cents a share, suggesting a decrease from $1.23 reported in the third quarter of fiscal 2021.
Despite the aforementioned headwinds, we expect Macy’s solid execution of the Polaris strategy, robust omni-channel capabilities, curated merchandise assortment and initiatives to provide customers with a seamless shopping experience to have provided some cushion to its quarterly performance.
What the Zacks Model Unveils
Our proven model predicts an earnings beat for Macy’s this time around. The combination of a positive Earnings ESP and a Zacks Rank #1 (Strong Buy), 2 (Buy) or 3 (Hold) increases the odds of an earnings beat, which is precisely the case here. You can uncover the best stocks to buy or sell before they’re reported with our Earnings ESP Filter.
  Macy's, Inc. price-eps-surprise | Macy's, Inc. Quote
Macy’s currently has a Zacks Rank #3 and an Earnings ESP of +18.92%.
More Stocks With Favorable Combinations
Here are some other companies worth considering, as our model shows that these too have the right combination of elements to beat on earnings this season:
lululemon athletica currently has an Earnings ESP of +1.50% and a Zacks Rank #2. LULU is likely to register an increase in the bottom line from the year-ago quarter’s reported figure when it reports third-quarter fiscal 2022 results. The Zacks Consensus Estimate for quarterly earnings has been stable at $1.95 per share over the past 30 days, suggesting 20.4% growth from the year-ago quarter’s reported number. You can see the complete list of today’s Zacks #1 Rank stocks here.
lululemon athletica’s top line is expected to rise from the prior-year quarter’s reported number. The Zacks Consensus Estimate for quarterly revenues is pegged at $1.80 billion, suggesting a 24.4% rise from the figure reported in the prior-year quarter. LULU delivered an earnings beat of 10.4%, on average, in the trailing four quarters.
Dollar Genera lhas an Earnings ESP of +2.35% and a Zacks Rank #3, currently. DG is likely to register top-line growth from the year-ago fiscal quarter’s tally in its third-quarter fiscal 2022 numbers. The Zacks Consensus Estimate for quarterly revenues is pegged at $9.43 billion, suggesting 10.7% growth from the figure reported in the prior-year fiscal quarter.
The Zacks Consensus Estimate for Dollar General’s earnings for the fiscal third quarter is pegged at $2.54 per share, suggesting 22.1% growth from the year-ago fiscal quarter’s tally. The consensus mark has been stable in the past 30 days. DG delivered an earnings beat of 2.2%, on average, in the trailing four quarters.
Dollar Tree has an Earnings ESP of +6.57% and a Zacks Rank of 3, currently. DLTR is likely to register top-line growth from the year-earlier fiscal quarter’s actuals when it reports third-quarter fiscal 2022 numbers. The Zacks Consensus Estimate for quarterly revenues is pegged at $6.83 billion, suggesting 6.5% growth from the figure reported in the prior-year fiscal quarter.
The Zacks Consensus Estimate for Dollar Tree’s earnings for the fiscal third quarter is pegged at $1.16 per share, suggesting 20.8% growth from the year-ago fiscal quarter’s tally. The consensus mark has been stable in the past 30 days. DLTR delivered an earnings beat of 8.6%, on average, in the trailing four quarters.
Stay on top of upcoming earnings announcements with the Zacks Earnings Calendar.
Why Haven’t You Looked at Zacks' Top Stocks?
Our 5 best-performing strategies have blown away the S&P's impressive +28.8% gain in 2021. Amazingly, they soared +40.3%, +48.2%, +67.6%, +94.4%, and +95.3%. Today you can access their live picks without cost or obligation.
See Stocks Free >>
Media Contact
Zacks Investment Research
800-767-3771 ext. 9339
support@zacks.com
https://www.zacks.com
Past performance is no guarantee of future results. Inherent in any investment is the potential for loss. This material is being provided for informational purposes only and nothing herein constitutes investment, legal, accounting or tax advice, or a recommendation to buy, sell or hold a security. No recommendation or advice is being given as to whether any investment is suitable for a particular investor. It should not be assumed that any investments in securities, companies, sectors or markets identified and described were or will be profitable. All information is current as of the date of herein and is subject to change without notice. Any views or opinions expressed may not reflect those of the firm as a whole. Zacks Investment Research does not engage in investment banking, market making or asset management activities of any securities. These returns are from hypothetical portfolios consisting of stocks with Zacks Rank = 1 that were rebalanced monthly with zero transaction costs. These are not the returns of actual portfolios of stocks. The S&P 500 is an unmanaged index. Visit https://www.zacks.com/performance for information about the performance numbers displayed in this press release.

Infrastructure Stock Boom to Sweep America
A massive push to rebuild the crumbling U.S. infrastructure will soon be underway. It’s bipartisan, urgent, and inevitable. Trillions will be spent. Fortunes will be made.
The only question is “Will you get into the right stocks early when their growth potential is greatest?”
Zacks has released a Special Report to help you do just that, and today it’s free. Discover 5 special companies that look to gain the most from construction and repair to roads, bridges, and buildings, plus cargo hauling and energy transformation on an almost unimaginable scale.
Download FREE: How To Profit From Trillions On Spending For Infrastructure >>

Want the latest recommendations from Zacks Investment Research? Today, you can download 7 Best Stocks for the Next 30 Days. Click to get this free report
 
Macy's, Inc. (M): Free Stock Analysis Report
 
Dollar General Corporation (DG): Free Stock Analysis Report
 
Dollar Tree, Inc. (DLTR): Free Stock Analysis Report
 
lululemon athletica inc. (LULU): Free Stock Analysis Report
 
To read this article on Zacks.com click here.
 
Zacks Investment Research
The views and opinions expressed herein are the views and opinions of the author and do not necessarily reflect those of Nasdaq, Inc.","Stocks recently featured in the blog include: Macy's, Inc. M, lululemon athletica LULU, Dollar General DG and Dollar Tree DLTR. DLTR is likely to register top-line growth from the year-earlier fiscal quarter’s actuals when it reports third-quarter fiscal 2022 numbers. DLTR delivered an earnings beat of 8.6%, on average, in the trailing four quarters.","Stocks recently featured in the blog include: Macy's, Inc. M, lululemon athletica LULU, Dollar General DG and Dollar Tree DLTR. DLTR is likely to register top-line growth from the year-earlier fiscal quarter’s actuals when it reports third-quarter fiscal 2022 numbers. DLTR delivered an earnings beat of 8.6%, on average, in the trailing four quarters.","Stocks recently featured in the blog include: Macy's, Inc. M, lululemon athletica LULU, Dollar General DG and Dollar Tree DLTR. DLTR is likely to register top-line growth from the year-earlier fiscal quarter’s actuals when it reports third-quarter fiscal 2022 numbers. DLTR delivered an earnings beat of 8.6%, on average, in the trailing four quarters.","Stocks recently featured in the blog include: Macy's, Inc. M, lululemon athletica LULU, Dollar General DG and Dollar Tree DLTR. DLTR is likely to register top-line growth from the year-earlier fiscal quarter’s actuals when it reports third-quarter fiscal 2022 numbers. DLTR delivered an earnings beat of 8.6%, on average, in the trailing four quarters.",2022,4
