Date,Article_title,Stock_symbol,Url,Publisher,Author,Article,Lsa_summary,Luhn_summary,Textrank_summary,Lexrank_summary,Year,sentiment_score
2022-02-02 00:00:00+00:00,"US STOCKS-Nasdaq futures jump after Alphabet, AMD results",EBAY,https://www.nasdaq.com/articles/us-stocks-nasdaq-futures-jump-after-alphabet-amd-results,,,"For a Reuters live blog on U.S., UK and European stock markets, click LIVE/ or type LIVE/ in a news window
Alphabet rises on upbeat sales, stock split
AMD surges on strong outlook, results; lifts chipmakers
PayPal slides on weak first-quarter outlook
Starbucks down after lowering profit forecast
Futures up: Dow 0.10%, S&P 0.74%, Nasdaq 1.45%
Adds comment, details; updates prices
By Bansari Mayur Kamdar and Medha Singh
Feb 2 (Reuters) - Nasdaq 100 futures jumped 1.5% on Wednesday, rising for the fourth straight session after a turbulent start to the year, as Google-parent Alphabet and chipmaker Advanced Micro Devices' shares surged following strong fourth-quarter results.
Alphabet Inc GOOGL.O rose 10.4% in premarket trading after reporting record quarterly sales on Tuesday, and said it plans to undertake a 20-to-one stock split.
The stock split should make it more appealing to retail investors, said Neil Wilson, chief market analyst for Markets.com, adding that Alphabet earnings will underpin a return in confidence in beaten down technology names.
""After all the tumult of January, solid earnings can be a catalyst for gains.""
Last month the tech-heavy Nasdaq .IXIC fell as much as 19% from its all-time high in November as investors dumped highly valued growth stocks on prospects of faster-than-expected rate hikes.
Traders are betting on five rate hikes this year after hawkish comments from the U.S. Federal Reserve last month.
Advanced Micro Devices Inc AMD.O climbed 11.1% after it forecast 2022 revenue above expectations on Tuesday, following strong quarterly demand for its semiconductors, despite global supply snags.
The chipmaker's strong outlook lifted shares of peers Nvidia Corp NVDA.O, Qualcomm Inc QCOM.O and Micron Technology Inc MU.O between 2.8% and 5.2%.
At 7:01 a.m. ET, Dow e-minis 1YMcv1 were up 37 points, or 0.1%, S&P 500 e-minis EScv1 were up 33.5 points, or 0.74%, and Nasdaq 100 e-minis NQcv1 were up 218 points, or 1.45%.
Investors will be keeping an eye out for the ADP National Employment Report later in the day that is expected to show private payrolls added 207,000 jobs in January, after they jumped by 807,000 jobs in the previous month.
Megacaps Meta Platforms Inc FB.O and Amazon.com Inc AMZN.O rose about 3% each ahead of their earnings this week.
Of the companies that have reported results so far during this earnings season, 78.8% of them have beaten analysts' earnings estimates, compared with an average of 84% over the past four quarters, according to Refinitiv data.
PayPal Holdings Inc PYPL.O slumped 16.8% after forecasting first-quarter revenue and profit well below expectations, as it prepares to take a hit from eBay Inc's EBAY.O ongoing move to ditch its payments services.
Starbucks Corp SBUX.O fell 2.6% as the coffee chain lowered its estimates for profits this year and said it will raise menu prices in 2022 and reduce some spending to offset soaring costs for labor and goods.
(Reporting by Bansari Mayur Kamdar and Medha Singh in Bengaluru; Editing by Shounak Dasgupta)
((BansariMayur.Kamdar@thomsonreuters.com))
The views and opinions expressed herein are the views and opinions of the author and do not necessarily reflect those of Nasdaq, Inc.","PayPal Holdings Inc PYPL.O slumped 16.8% after forecasting first-quarter revenue and profit well below expectations, as it prepares to take a hit from eBay Inc's EBAY.O ongoing move to ditch its payments services. For a Reuters live blog on U.S., UK and European stock markets, click LIVE/ or type LIVE/ in a news window Alphabet rises on upbeat sales, stock split AMD surges on strong outlook, results; lifts chipmakers PayPal slides on weak first-quarter outlook Starbucks down after lowering profit forecast Futures up: Dow 0.10%, S&P 0.74%, Nasdaq 1.45% Adds comment, details; updates prices By Bansari Mayur Kamdar and Medha Singh Feb 2 (Reuters) - Nasdaq 100 futures jumped 1.5% on Wednesday, rising for the fourth straight session after a turbulent start to the year, as Google-parent Alphabet and chipmaker Advanced Micro Devices' shares surged following strong fourth-quarter results. The stock split should make it more appealing to retail investors, said Neil Wilson, chief market analyst for Markets.com, adding that Alphabet earnings will underpin a return in confidence in beaten down technology names.","PayPal Holdings Inc PYPL.O slumped 16.8% after forecasting first-quarter revenue and profit well below expectations, as it prepares to take a hit from eBay Inc's EBAY.O ongoing move to ditch its payments services. For a Reuters live blog on U.S., UK and European stock markets, click LIVE/ or type LIVE/ in a news window Alphabet rises on upbeat sales, stock split AMD surges on strong outlook, results; lifts chipmakers PayPal slides on weak first-quarter outlook Starbucks down after lowering profit forecast Futures up: Dow 0.10%, S&P 0.74%, Nasdaq 1.45% Adds comment, details; updates prices By Bansari Mayur Kamdar and Medha Singh Feb 2 (Reuters) - Nasdaq 100 futures jumped 1.5% on Wednesday, rising for the fourth straight session after a turbulent start to the year, as Google-parent Alphabet and chipmaker Advanced Micro Devices' shares surged following strong fourth-quarter results. Advanced Micro Devices Inc AMD.O climbed 11.1% after it forecast 2022 revenue above expectations on Tuesday, following strong quarterly demand for its semiconductors, despite global supply snags.","PayPal Holdings Inc PYPL.O slumped 16.8% after forecasting first-quarter revenue and profit well below expectations, as it prepares to take a hit from eBay Inc's EBAY.O ongoing move to ditch its payments services. For a Reuters live blog on U.S., UK and European stock markets, click LIVE/ or type LIVE/ in a news window Alphabet rises on upbeat sales, stock split AMD surges on strong outlook, results; lifts chipmakers PayPal slides on weak first-quarter outlook Starbucks down after lowering profit forecast Futures up: Dow 0.10%, S&P 0.74%, Nasdaq 1.45% Adds comment, details; updates prices By Bansari Mayur Kamdar and Medha Singh Feb 2 (Reuters) - Nasdaq 100 futures jumped 1.5% on Wednesday, rising for the fourth straight session after a turbulent start to the year, as Google-parent Alphabet and chipmaker Advanced Micro Devices' shares surged following strong fourth-quarter results. The stock split should make it more appealing to retail investors, said Neil Wilson, chief market analyst for Markets.com, adding that Alphabet earnings will underpin a return in confidence in beaten down technology names.","PayPal Holdings Inc PYPL.O slumped 16.8% after forecasting first-quarter revenue and profit well below expectations, as it prepares to take a hit from eBay Inc's EBAY.O ongoing move to ditch its payments services. For a Reuters live blog on U.S., UK and European stock markets, click LIVE/ or type LIVE/ in a news window Alphabet rises on upbeat sales, stock split AMD surges on strong outlook, results; lifts chipmakers PayPal slides on weak first-quarter outlook Starbucks down after lowering profit forecast Futures up: Dow 0.10%, S&P 0.74%, Nasdaq 1.45% Adds comment, details; updates prices By Bansari Mayur Kamdar and Medha Singh Feb 2 (Reuters) - Nasdaq 100 futures jumped 1.5% on Wednesday, rising for the fourth straight session after a turbulent start to the year, as Google-parent Alphabet and chipmaker Advanced Micro Devices' shares surged following strong fourth-quarter results. The stock split should make it more appealing to retail investors, said Neil Wilson, chief market analyst for Markets.com, adding that Alphabet earnings will underpin a return in confidence in beaten down technology names.",2022,2
