Date,Article_title,Stock_symbol,Url,Publisher,Author,Article,Lsa_summary,Luhn_summary,Textrank_summary,Lexrank_summary,Year,sentiment_score
2022-05-24 00:00:00+00:00,The 7 Best Retail Stocks to Buy Now,DLTR,https://www.nasdaq.com/articles/the-7-best-retail-stocks-to-buy-now,,,"InvestorPlace - Stock Market News, Stock Advice & Trading Tips
Retail stocks are beaten down, laying several opportunities out for investors. 
Target (TGT): If Target maintains its pledge then it will build serious consumer loyalty for a long time to come. 
Albertsons (ACI): Downside is fully priced in already with plenty of growth expected. 
Lowe’s (LOW): Reaffirmed revenue numbers should reassure investors that Lowe’s is the homebuilding supplier to buy. 
Dollar Tree (DLTR): EPS numbers tell a strong story for the discount retailer. 
BJ’s Wholesale (BJ): Strong earnings and relative value make BJ’s a buy.
Amazon (AMZN): The world’s largest e-commerce firm is deeply discounted following the tech wreck. 
Home Depot (HD): Tons of upside remains following unexpectedly positive results. 
Source: mTaira / Shutterstock.com
Retail stocks have seen better days. But the crash earlier this week has investors seeing opportunity as the sector receives attention on the bad news. The crash was led by Walmart (NYSE:WMT) and Target (NYSE:TGT), which were hit particularly hard by rising costs. 
For its part, Walmart placed the blame on supply chain and employee costs. Retailers like Walmart had been able to increase prices and maintain strong results throughout the pandemic despite higher costs. In the first quarter, however, the company was unable to accurately forecast relevant factors, leading to lower than anticipated EPS figures. 
Target similarly reported disappointing results also noting that fuel and freight costs would be $1 billion higher in 2022 than the firm had prior anticipated. It should be noted that Target has pledged to try and absorb those higher prices rather than raise prices at its stores. 
7 Large-Cap Stocks to Buy Right Now
The news may seem grim given that recession woes continue to rise as the pace of negative news seems to increase by the day. But there is a silver lining here. 
TGT Target Corporation $146.30
ACI Albertsons Companies, Inc. $28.75
LOW Lowe’s Companies, Inc. $184.03
DLTR Dollar Tree, Inc. $128.85
BJ BJ’s Wholesale Club Holdings, Inc. $54.32
AMZN Amazon.com, Inc. $2,084.41
HD The Home Depot, Inc. $285.10
Best Retail Stocks to Buy: Target (TGT) 
Source: jejim / Shutterstock.com
There is a reasonable, if risky, bet to be made on Target immediately following the weaker than expected results. And the reason to make that bet can be found in the company’s promise to customers in the face of rising costs: It is planning not to increase prices to raise profits as the firm knows customers are seeking affordability more than ever. 
CFO Michael Fiddelke was quoted stating, “While we don’t like the impact to our profitability in the short term, we know it is the right thing to do for our guests and our business over the long term.”
Target now knows it has to play a bit of a long game. The idea is straightforward: Absorb those greater macroeconomic problems in its operations, reward customers with unwavering prices and build long-term loyalty. Given that TGT stock has fallen from $215 to $155 and is showing signs of resistance now is the time to buy. 
Albertsons (ACI) 
Source: Ken Wolter / Shutterstock.com
Invest in Albertsons (NYSE:ACI) because all of the current negativity is fully priced into its shares. For one, ACI stock also took a hit as Walmart and Target pulled the broader retail sector down last week. 
Second, Albertsons had already been moving downward since early April when the firm announced full-year profits might be slightly weaker than analysts had predicted. The point here is that the so-called weakness is fairly minor. The company forecast an earnings range between $2.70 and $2.85 for fiscal year 2022. That put the midpoint below the $2.81 consensus expectation, pulling prices downward. 
But at the same time management also noted that same-store sales growth should reach 2-3% for the fiscal year, well above consensus expectations of 1.3% same-store sales growth. 
7 REITs to Buy for the Second Half of 2022
The average target stock price sits at $35.65 with a high water mark of $48. That indicates upside between 24% and 67% if those analyst prices pan out. 
Best Retail Stocks to Buy: Lowe’s (LOW) 
Source: Helen89 / Shutterstock.com
Lowe’s (NYSE:LOW) is proving that it has strength despite widespread fear surrounding retail stocks. Yes, it did suffer following the retail stock crash last week. But it quickly rebounded. The broader news that Walmart and Target had disappointed carved a chunk out of the home improvement firm’s market capitalization that was quickly filled less than 24 hours later. 
The net effect was that LOW stock dropped a few dollars, which could occur on a normal day with no significant news. 
The reason for its strength relative to other retail stocks is clear: The company didn’t show any real weakness. In fact, EPS figures reached $3.51, well ahead of the $3.22 Wall Street had forecast for the North Carolina headquartered firm. 
What should also interest investors is that Lowe’s reaffirmed its 2022 revenue outlook of between $97 and $99 billion and EPS between $13.10 to $13.60. Pundits are worried that rising interest rates will affect home improvement spending and house sales, and thus LOW stock, but this latest report seems to refute the notion that Lowe’s investor base will suffer. 
Dollar Tree (DLTR) 
Source: shutterstock.com/Jonathan Weiss
There’s good reason to invest in Dollar Tree (NASDAQ:DLTR) ahead of earnings on May 26. The reason is that analysts haven’t wavered on the discount retailer stock even as things have gone sideways for the retail sector. 
Here’s what I mean. Yes, DLTR stock did take a hit with share prices dropping from the mid $150s to the mid $130s on sector news. But at the same time, consensus per share earnings expectations are not wavering according to Yahoo! Finance. A week ago analysts were expecting Dollar Tree to post EPS numbers of $2.01 on May 26th. Those EPS expectations have since lowered a single cent to $2.00. 
In other words, if investors were expecting Walmart and Target to negatively affect earnings for Dollar Tree, they may be mistaken. 
7 Dividend Stocks to Boost Your Retirement Savings
Further, Dollar Tree has surprised investors in three of the last four quarters with EPS numbers that have well-exceeded expectations. The one exception was Q3 when the firm provided a 96-cent EPS that was exactly as expected. 
Best Retail Stocks to Buy: BJ’s Wholesale (BJ) 
Source: Helen89 / Shutterstock.com
BJ’s (NYSE:BJ) posted very strong numbers well above expectations on May 19. Both earnings and revenues were well ahead of where Wall Street expected them to be. The wholesale club posted an EPS of 87 cents, well above the 72 cents Wall Street was looking for. Likewise, the company’s $4.5 billion in revenue was well ahead of the $4.24 billion that was anticipated. 
Club sales increased 14.4% during the quarter and 4.1% without the impact of gasoline sales. 
Here’s the reason to buy BJ stock: It is showing that it can rebound quickly while its competitor Costco (NYSE:COST) has wavered. It seems that investors are interested in moving their capital toward BJ’s with its lower P/E ratio of 15.9 while Costco sports a P/E ratio nearly double that of BJ’s. 
That implies that while Costco garnered lots of attention as inflation numbers spiked, BJ’s turn to receive an influx of capital may be at hand. 
Amazon (AMZN) 
Source: Tada Images / Shutterstock.com
It’s no secret that Amazon (NASDAQ:AMZN) has fallen precipitously through 2022. During the so-called tech wreck, it has dropped from levels above $3,500 per share to current levels below $2,200. 
As my colleague Dana Blankenhorn notes, you don’t lose anything if you don’t sell. His take is that Amazon has always been a long-term investment and that AMZN stock has every possibility of reaching those former highs again. So those who invested when prices were higher have little to fear if he is correct. Further, if Amazon retraces those former highs, there’s a ton of upside for those who purchase shares now. 
7 Undervalued Stocks to Buy Before Investors Catch On
His thesis is that Amazon’s cloud dominance all but ensures that a rebound will occur. He goes on to note that AWS, as a dominant cloud force, gives Amazon’s other businesses an innate advantage. He also asserts that AWS alone could be as valuable as the entirety of Amazon if it were forced to break up right now. That’s something to think about as AMZN stock continues to trade at low prices. 
Best Retail Stocks to Buy: Home Depot (HD) 
Source: Northfoto / Shutterstock.com
Investors should breathe a sigh of relief with Home Depot (NYSE:HD). Concerns of an ongoing slowdown in demand for home improvement are not coming to fruition based on earnings from the company. 
In fact, Home Depot just reported its highest ever Q1 sales. That led to EPS figures of $4.06 where analysts were expecting $3.69. There’s more good news: Home Depot raised sales guidance for 2022 to 3% on the positive results. 
Cooler weather had tamped down expectations for first-quarter results as home improvement activity was expected to slow as a result. Now is the time to buy as HD stock remains well below consensus prices and plenty of upside remains. 
On the date of publication, Alex Sirois did not have (either directly or indirectly) any positions in the securities mentioned in this article. The opinions expressed in this article are those of the writer, subject to the InvestorPlace.com Publishing Guidelines.
The post The 7 Best Retail Stocks to Buy Now appeared first on InvestorPlace.
The views and opinions expressed herein are the views and opinions of the author and do not necessarily reflect those of Nasdaq, Inc.","Dollar Tree (DLTR): EPS numbers tell a strong story for the discount retailer. TGT Target Corporation $146.30 ACI Albertsons Companies, Inc. $28.75 LOW Lowe’s Companies, Inc. $184.03 DLTR Dollar Tree, Inc. $128.85 BJ BJ’s Wholesale Club Holdings, Inc. $54.32 AMZN Amazon.com, Inc. $2,084.41 HD The Home Depot, Inc. $285.10 Best Retail Stocks to Buy: Target (TGT) Source: jejim / Shutterstock.com There is a reasonable, if risky, bet to be made on Target immediately following the weaker than expected results. Dollar Tree (DLTR) Source: shutterstock.com/Jonathan Weiss There’s good reason to invest in Dollar Tree (NASDAQ:DLTR) ahead of earnings on May 26.","TGT Target Corporation $146.30 ACI Albertsons Companies, Inc. $28.75 LOW Lowe’s Companies, Inc. $184.03 DLTR Dollar Tree, Inc. $128.85 BJ BJ’s Wholesale Club Holdings, Inc. $54.32 AMZN Amazon.com, Inc. $2,084.41 HD The Home Depot, Inc. $285.10 Best Retail Stocks to Buy: Target (TGT) Source: jejim / Shutterstock.com There is a reasonable, if risky, bet to be made on Target immediately following the weaker than expected results. Dollar Tree (DLTR) Source: shutterstock.com/Jonathan Weiss There’s good reason to invest in Dollar Tree (NASDAQ:DLTR) ahead of earnings on May 26. Dollar Tree (DLTR): EPS numbers tell a strong story for the discount retailer.","TGT Target Corporation $146.30 ACI Albertsons Companies, Inc. $28.75 LOW Lowe’s Companies, Inc. $184.03 DLTR Dollar Tree, Inc. $128.85 BJ BJ’s Wholesale Club Holdings, Inc. $54.32 AMZN Amazon.com, Inc. $2,084.41 HD The Home Depot, Inc. $285.10 Best Retail Stocks to Buy: Target (TGT) Source: jejim / Shutterstock.com There is a reasonable, if risky, bet to be made on Target immediately following the weaker than expected results. Dollar Tree (DLTR): EPS numbers tell a strong story for the discount retailer. Dollar Tree (DLTR) Source: shutterstock.com/Jonathan Weiss There’s good reason to invest in Dollar Tree (NASDAQ:DLTR) ahead of earnings on May 26.","TGT Target Corporation $146.30 ACI Albertsons Companies, Inc. $28.75 LOW Lowe’s Companies, Inc. $184.03 DLTR Dollar Tree, Inc. $128.85 BJ BJ’s Wholesale Club Holdings, Inc. $54.32 AMZN Amazon.com, Inc. $2,084.41 HD The Home Depot, Inc. $285.10 Best Retail Stocks to Buy: Target (TGT) Source: jejim / Shutterstock.com There is a reasonable, if risky, bet to be made on Target immediately following the weaker than expected results. Dollar Tree (DLTR): EPS numbers tell a strong story for the discount retailer. Dollar Tree (DLTR) Source: shutterstock.com/Jonathan Weiss There’s good reason to invest in Dollar Tree (NASDAQ:DLTR) ahead of earnings on May 26.",2022,4
2022-05-24 00:00:00+00:00,Here's How Dollar Tree (DLTR) Looks Just Before Q1 Earnings,DLTR,https://www.nasdaq.com/articles/heres-how-dollar-tree-dltr-looks-just-before-q1-earnings,,,"Dollar Tree, Inc. DLTR is likely to register an increase in the top and bottom lines when it reports first-quarter fiscal 2022 results on May 26, before market open. The Zacks Consensus Estimate for revenues is pegged at $6.74 billion, indicating an improvement of 4.1% from the prior-year quarter.

The bottom line of the operator of discount variety retail stores is also expected to increase year over year. The Zacks Consensus Estimate for fiscal first-quarter earnings is pegged at $1.99 per share, suggesting growth of 24.4% from the year-ago period. The figure has moved down by a penny in the past seven days.
 
The company has a trailing four-quarter earnings surprise of 11.8%, on average. In the last reported quarter, the Chesapeake, VA-based company outperformed the Zacks Consensus Estimate by 12.3%.
Dollar Tree, Inc. Price and EPS Surprise
  Dollar Tree, Inc. price-eps-surprise | Dollar Tree, Inc. Quote
Factors to Consider
Dollar Tree has been gaining from strength in the H2, Dollar Tree Plus and the new Combo Stores, which are part of the company’s Key Real Estate Initiatives. It is also poised to benefit from the expansion of the aforementioned stores as part of the plan. The company has been progressing well with its store optimization initiatives. These efforts are likely to have boosted its sales and comps in the to-be-reported quarter.

The Family Dollar H2 stores have been performing well, with the newest format store, Combo Store, exceeding expectations. At the Dollar Tree banner, its multi-price point Dollar Tree Plus! concept store has been gaining popularity among customers, particularly for the discretionary categories. This has helped improve store productivity.

Also, its Crafter’s Square offerings have been performing well, driven by the expansion of its Crafter’s Square offerings to include essential and seasonal products. The initiatives are expected to have boosted the company’s top line in the to-be-reported quarter.

Dollar Tree’s restructuring and expansion initiatives, including steady store openings and improvement of distribution centers, are likely to have driven revenues. The company has been on track to leverage Family Dollar and Dollar Tree distribution center systems, and combined merchandise.

The company’s digital and omni-channel capabilities and same-day delivery service with Instacart are also expected to have driven traffic trends in the fiscal first quarter.

The aforementioned factors instill optimism regarding the upcoming results.

On the last reported quarter’searnings call management predicted consolidated net sales of $6.63-$6.78 billion for first-quarter fiscal 2022, with enterprise same-store sales growth in the low-single digits. It anticipated earnings of $1.95-$2.10 per share for the fiscal first quarter.

However, DLTR has continued to reel under dismal margins due to increased freight costs, which have been denting the bottom line. The company has been impacted by all aspects of freight, including higher costs for inland transportation by truck and rail.

Management, on its last reported quarter’searnings call envisioned freight and supply-chain disruptions to remain headwinds in the near term. It expected cost pressures from import and domestic freight to continue in the first half of 2022 due to the annualization of fiscal 2021 rates. Additionally, management predicted diesel fuel prices to remain significantly higher in 2022. These factors are likely to have resulted in higher freight costs and a consequent decline in the gross margin in the fiscal first quarter.

The company has also been witnessing higher SG&A expenses for the past several quarters, owing to incremental COVID-related expenses as well as elevated payroll and store re-banner costs.

On its last reported quarter’searnings call management expected the pressures related to in-store and distribution center payroll costs to persist due to competitive markets, states increasing minimum wages, unemployment levels and completing the ongoing initiatives. This is expected to have resulted in higher SG&A expenses in the to-be-reported quarter.
What the Zacks Model Unveils
Our proven model does not conclusively predict an earnings beat for Dollar Tree this time around. The combination of a positive Earnings ESP and a Zacks Rank #1 (Strong Buy), 2 (Buy) or 3 (Hold) increases the chances of an earnings beat. But that’s not the case here. You can uncover the best stocks to buy or sell before they’re reported with our Earnings ESP Filter.

Dollar Tree has a Zacks Rank #3 and an Earnings ESP of -4.88%.
Stocks With Favorable Combination
Here are some companies you may want to consider, as our model shows that these have the right combination of elements to post an earnings beat this season:

The Kroger Co. KR currently has an Earnings ESP of +2.95% and a Zacks Rank of 2. The company is expected to have registered top and bottom-line growth in first-quarter fiscal 2022. The Zacks Consensus Estimate for KR’s quarterly revenues is pegged at $43.2 billion, which suggests a rise of 4.7% from the figure reported in the prior-year quarter.

You can see the complete list of today's Zacks #1 Rank stocks here.

The Zacks Consensus Estimate for Kroger’s quarterly earnings moved up 6.7% in the last 30 days to $1.27 per share, suggesting 6.7% growth from the year-ago quarter's reported number. KR has delivered an earnings beat of 22.1%, on average, in the trailing four quarters.

Designer Brands DBI has an Earnings ESP of +4.35% and a Zacks Rank #2 at present. The company is expected to have registered top and bottom-line growth in first-quarter fiscal 2022. The Zacks Consensus Estimate for DBI’s quarterly revenues is pegged at $806.7 million, which suggests a rise of 14.7% from the figure reported in the prior-year quarter.

The Zacks Consensus Estimate for Designer Brands’ quarterly earnings moved up by a penny in the last 30 days to 23 cents per share, suggesting 91.7% growth from the year-ago quarter's reported number. DBI has delivered an earnings beat of 112.8%, on average, in the trailing four quarters.

Casey's General Stores CASY currently has an Earnings ESP of +7.07% and a Zacks Rank #3. The company is anticipated to have registered top and bottom-line growth in fourth-quarter fiscal 2022. The Zacks Consensus Estimate for CASY’s quarterly earnings moved up by a penny in the last seven days to $1.49 per share, suggesting 33% growth from the year-ago quarter's reported number.

The Zacks Consensus Estimate for Casey's quarterly revenues is pegged at $3.4 billion, suggesting growth of 44.7% from the figure reported in the prior-year quarter. CASY has delivered an earnings beat of 21.6%, on average, in the trailing four quarters.

Stay on top of upcoming earnings announcements with the Zacks Earnings Calendar.

Zacks Names ""Single Best Pick to Double""
From thousands of stocks, 5 Zacks experts each have chosen their favorite to skyrocket +100% or more in months to come. From those 5, Director of Research Sheraz Mian hand-picks one to have the most explosive upside of all.
It’s a little-known chemical company that’s up 65% over last year, yet still dirt cheap. With unrelenting demand, soaring 2022 earnings estimates, and $1.5 billion for repurchasing shares, retail investors could jump in at any time.
This company could rival or surpass other recent Zacks’ Stocks Set to Double like Boston Beer Company which shot up +143.0% in little more than 9 months and NVIDIA which boomed +175.9% in one year.
Free: See Our Top Stock and 4 Runners Up >>

Want the latest recommendations from Zacks Investment Research? Today, you can download 7 Best Stocks for the Next 30 Days. Click to get this free report
 
Dollar Tree, Inc. (DLTR): Free Stock Analysis Report
 
The Kroger Co. (KR): Free Stock Analysis Report
 
Casey's General Stores, Inc. (CASY): Free Stock Analysis Report
 
Designer Brands Inc. (DBI): Free Stock Analysis Report
 
To read this article on Zacks.com click here.
 
Zacks Investment Research
The views and opinions expressed herein are the views and opinions of the author and do not necessarily reflect those of Nasdaq, Inc.","Dollar Tree, Inc. DLTR is likely to register an increase in the top and bottom lines when it reports first-quarter fiscal 2022 results on May 26, before market open. However, DLTR has continued to reel under dismal margins due to increased freight costs, which have been denting the bottom line. Dollar Tree, Inc. (DLTR): Free Stock Analysis Report","Dollar Tree, Inc. DLTR is likely to register an increase in the top and bottom lines when it reports first-quarter fiscal 2022 results on May 26, before market open. However, DLTR has continued to reel under dismal margins due to increased freight costs, which have been denting the bottom line. Dollar Tree, Inc. (DLTR): Free Stock Analysis Report","Dollar Tree, Inc. DLTR is likely to register an increase in the top and bottom lines when it reports first-quarter fiscal 2022 results on May 26, before market open. However, DLTR has continued to reel under dismal margins due to increased freight costs, which have been denting the bottom line. Dollar Tree, Inc. (DLTR): Free Stock Analysis Report","Dollar Tree, Inc. DLTR is likely to register an increase in the top and bottom lines when it reports first-quarter fiscal 2022 results on May 26, before market open. However, DLTR has continued to reel under dismal margins due to increased freight costs, which have been denting the bottom line. Dollar Tree, Inc. (DLTR): Free Stock Analysis Report",2022,3
