Date,Article_title,Stock_symbol,Url,Publisher,Author,Article,Lsa_summary,Luhn_summary,Textrank_summary,Lexrank_summary,Year,sentiment_score
2022-02-17 00:00:00+00:00,"Holiday-Shortened Week Jam-Packed With Earnings, Economic Indicators",EBAY,https://www.nasdaq.com/articles/holiday-shortened-week-jam-packed-with-earnings-economic-indicators,,,"Markets will be closed for President's Day on Monday, but investors shouldn't let a day off next week fool them. The final full week of February will be a busy one, with more inflation data on deck by way of personal consumption expenditures (PCE), and 5-year inflation expectations out on Friday. The purchasing managers index (PMI), as well as the S&P Case-Shiller home price index will be other weekly highlights. 
Earnings season is still in full swing, and there will be plenty of big names shaking up the scene next week. This list includes Anheuser-Busch InBev (BUD), Beyond Meat (BYND), Booking Holdings (BKNG), DraftKings (DKNG), eBay (EBAY), Etsy (ETSY), Five9 (FIVN), Home Depot (HD), Intuit (INTU), Macy's (M), Monster Beverage (MNST), Papa John's (PZZA), and Wayfair (W).
Below is a list of key market events scheduled for the upcoming week. All economic dates listed below are tentative and subject to change.
Markets will be closed in observance of President's Day on Monday, Feb. 21.
The market will reopen with a bang on Tuesday, Feb. 22, with the S&P Case-Shiller home price index, the FHFA home price index, and the consumer confidence index all due out. Investors will also want to look out for the Markit services and manufacturing purchasing managers' indexes (PMI), which will be released shortly after the open. 
There will be a lull on Wednesday, Feb. 23, with nothing on the calendar. 
It gets busy again on Thursday, Feb. 24, however, when initial and continuing jobless claims, details on fourth-quarter gross domestic income, gross domestic product (GDP) revision, and new home sales for January are due out. 
Things will pick up even more on Friday, Feb. 25. Investors can expect data on personal income, consumer spending, and the University of Michigan consumer sentiment report. There will also be more inflation data to dig through, including PCE updates, as well as monthly core inflation for January, and 5-year inflation expectations. 
The views and opinions expressed herein are the views and opinions of the author and do not necessarily reflect those of Nasdaq, Inc.","This list includes Anheuser-Busch InBev (BUD), Beyond Meat (BYND), Booking Holdings (BKNG), DraftKings (DKNG), eBay (EBAY), Etsy (ETSY), Five9 (FIVN), Home Depot (HD), Intuit (INTU), Macy's (M), Monster Beverage (MNST), Papa John's (PZZA), and Wayfair (W). Earnings season is still in full swing, and there will be plenty of big names shaking up the scene next week. Investors will also want to look out for the Markit services and manufacturing purchasing managers' indexes (PMI), which will be released shortly after the open.","This list includes Anheuser-Busch InBev (BUD), Beyond Meat (BYND), Booking Holdings (BKNG), DraftKings (DKNG), eBay (EBAY), Etsy (ETSY), Five9 (FIVN), Home Depot (HD), Intuit (INTU), Macy's (M), Monster Beverage (MNST), Papa John's (PZZA), and Wayfair (W). The market will reopen with a bang on Tuesday, Feb. 22, with the S&P Case-Shiller home price index, the FHFA home price index, and the consumer confidence index all due out. It gets busy again on Thursday, Feb. 24, however, when initial and continuing jobless claims, details on fourth-quarter gross domestic income, gross domestic product (GDP) revision, and new home sales for January are due out.","This list includes Anheuser-Busch InBev (BUD), Beyond Meat (BYND), Booking Holdings (BKNG), DraftKings (DKNG), eBay (EBAY), Etsy (ETSY), Five9 (FIVN), Home Depot (HD), Intuit (INTU), Macy's (M), Monster Beverage (MNST), Papa John's (PZZA), and Wayfair (W). The final full week of February will be a busy one, with more inflation data on deck by way of personal consumption expenditures (PCE), and 5-year inflation expectations out on Friday. The purchasing managers index (PMI), as well as the S&P Case-Shiller home price index will be other weekly highlights.","This list includes Anheuser-Busch InBev (BUD), Beyond Meat (BYND), Booking Holdings (BKNG), DraftKings (DKNG), eBay (EBAY), Etsy (ETSY), Five9 (FIVN), Home Depot (HD), Intuit (INTU), Macy's (M), Monster Beverage (MNST), Papa John's (PZZA), and Wayfair (W). Markets will be closed for President's Day on Monday, but investors shouldn't let a day off next week fool them. The final full week of February will be a busy one, with more inflation data on deck by way of personal consumption expenditures (PCE), and 5-year inflation expectations out on Friday.",2022,3
2022-02-17 00:00:00+00:00,Should You Buy eBay Stock Ahead of Earnings?,EBAY,https://www.nasdaq.com/articles/should-you-buy-ebay-stock-ahead-of-earnings,,,"eBay (NASDAQ: EBAY) was one of the prime beneficiaries at the onset of the pandemic. Folks looked to the e-commerce retailer and auction site for goods they needed and wanted while avoiding shopping in person.
The trend is reversing for eBay as economies are reopening worldwide. With that backdrop, the company is scheduled to report fourth-quarter earnings on Wednesday, Feb. 23. While long-term investors generally don't buy or sell a stock based on short-term events, there are some who use earnings reports as markers for whether or not to add to their holdings or as clues for potential discount opportunities. With that in mind, let's see if investors should buy this retailer's stock before the report's release.
Image source: Getty Images.
eBay is taking a larger share of each transaction
eBay doesn't own or sell the products on its platform. Instead, it creates and manages the platform that brings together buyers and sellers. To generate revenue, eBay collects a varying fee from every transaction on the platform.
Arguably, buyers and sellers are equally crucial to eBay's success. Buyers would stop visiting the site if there weren't attractive items to buy. In contrast, sellers would stop going through the trouble of listing items if there weren't many willing buyers.
The coronavirus pandemic brought millions of new buyers to eBay. From Q2 2020 to Q1 2021, eBay's total active buyers increased from 161 million to 166 million. That said, eBay is now shedding active buyers as economies reopen and shoppers again have alternatives.
Further, management implemented a new strategy of reduced marketing and promotions aimed at lower-value buyers. The two forces acting together have caused active buyers to fall from the peak of 166 million to 154 million at the end of Q3.
Fewer buyers could be one of the main reasons gross merchandise value (total value of sales) has fallen by over 12% year over year to $19.4 billion. The metric is vital because eBay derives its revenue by taking a percentage of this value as its fee. Still, eBay increased its revenue year over year, despite falling gross merchandise value.
How did it accomplish this feat? By raising the percentage it takes from each transaction. eBay's transaction take rate has increased from 9.2% in Q2 2020 to 12.1% in Q3 2021.
You might assume that sellers aren't too thrilled about the increased levy. However, you couldn't tell by the number of sellers on eBay's platform, which remained flat at 19 million over the last year.
Beefing up services
Perhaps sellers are pleased with how eBay offers more value for the increased fees. In recent quarters, eBay has been beefing up its services to induce more transactions. One of the primary friction points on eBay's platform is trust between buyers and sellers, and that's precisely where management has focused on increased investments.
In the latest of these initiatives, eBay announced on Jan. 25 it would offer an authentication service for trading cards over $750 listed on eBay. Consumers can now shop with peace of mind, knowing that eBay will authenticate these cards to ensure they're not fakes and are delivered as advertised.
Trading cards are a significant category on eBay, accounting for $2 billion in gross merchandise value in the first half of 2021. Authentication for trading cards comes in addition to expensive handbags, sneakers, and watches.
Is eBay stock a buy?
eBay stock is trading at a price-to-free-cash-flow ratio of 15.7 and a forward price-to-earnings ratio of 13.2. These prices are roughly what it has sold for, on average, in the last five years. The company may continue to experience headwinds in the near term as the stay-at-home trend reverses.
However, in the longer run, an increasing share of shopping is moving online. Further, eBay is now taking a larger share of each transaction and reinvesting some of the increases, beefing up its services. eBay may not be an explosive growth stock, but it offers investors good value at its current price. The stock is likely worth buying before or after the upcoming earnings report, especially if you are planning to buy and hold long enough to benefit from the company's growth over time.
10 stocks we like better than eBay
When our award-winning analyst team has a stock tip, it can pay to listen. After all, the newsletter they have run for over a decade, Motley Fool Stock Advisor, has tripled the market.*
They just revealed what they believe are the ten best stocks for investors to buy right now... and eBay wasn't one of them! That's right -- they think these 10 stocks are even better buys.
See the 10 stocks
*Stock Advisor returns as of January 20, 2022
Parkev Tatevosian has no position in any of the stocks mentioned. The Motley Fool recommends eBay and recommends the following options: short January 2022 $82.50 calls on eBay. The Motley Fool has a disclosure policy.
The views and opinions expressed herein are the views and opinions of the author and do not necessarily reflect those of Nasdaq, Inc.","One of the primary friction points on eBay's platform is trust between buyers and sellers, and that's precisely where management has focused on increased investments. Consumers can now shop with peace of mind, knowing that eBay will authenticate these cards to ensure they're not fakes and are delivered as advertised. eBay (NASDAQ: EBAY) was one of the prime beneficiaries at the onset of the pandemic.","From Q2 2020 to Q1 2021, eBay's total active buyers increased from 161 million to 166 million. Still, eBay increased its revenue year over year, despite falling gross merchandise value. In the latest of these initiatives, eBay announced on Jan. 25 it would offer an authentication service for trading cards over $750 listed on eBay.","eBay is taking a larger share of each transaction eBay doesn't own or sell the products on its platform. In the latest of these initiatives, eBay announced on Jan. 25 it would offer an authentication service for trading cards over $750 listed on eBay. The Motley Fool recommends eBay and recommends the following options: short January 2022 $82.50 calls on eBay.","However, you couldn't tell by the number of sellers on eBay's platform, which remained flat at 19 million over the last year. Is eBay stock a buy? eBay (NASDAQ: EBAY) was one of the prime beneficiaries at the onset of the pandemic.",2022,4
2022-02-17 00:00:00+00:00,Is Adyen the Best Payment Processing Stock to Buy?,EBAY,https://www.nasdaq.com/articles/is-adyen-the-best-payment-processing-stock-to-buy,,,"Adyen (OTC: ADYE.Y) isn't a household name to most American investors, but it should be. The Netherlands-based fintech is becoming a payment processing leader, especially among larger companies. In this Fool Live video clip, recorded on Jan. 27, Fool.com contributors Matt Frankel and Lou Whiteman discuss why Adyen is a stock that investors should put on their radar.
10 stocks we like better than Adyen
When our award-winning analyst team has a stock tip, it can pay to listen. After all, the newsletter they have run for over a decade, Motley Fool Stock Advisor, has tripled the market.*
They just revealed what they believe are the ten best stocks for investors to buy right now... and Adyen wasn't one of them! That's right -- they think these 10 stocks are even better buys.
See the 10 stocks
*Stock Advisor returns as of January 20, 2022
Matt Frankel: Guys, what do you think of Adyen currently? Business-wise, I feel they're one of the best-in-class in operations, financials, and tailwinds. But even after a decent drop, it's a crime to call it reasonably valued. Any thoughts?
Well, I don't necessarily agree with that it's a crime to call it reasonably valued, and I'll tell you why. If you're not familiar, Adyen is a payment processor. They're based in the Netherlands, which is why a lot of Americans haven't heard of them. They're truly a global payment processor, so their volume is right between Square (NYSE: SQ) and PayPal (NASDAQ: PYPL), so they are big. They focus on big merchants. They don't have a consumer-facing business really, which is why a lot of Americans haven't heard of them either. Their customers include companies like Microsoft (NASDAQ: MSFT), Etsy (NASDAQ: ETSY), Uber (NYSE: UBER), the big ones, eBay (NASDAQ: EBAY). If you remember a few years ago, eBay dropped PayPal as its main payment processor and that made a lot of news that was in favor of Adyen.
No other payment processor has gotten the attraction with large enterprises the way Adyen has. They do it profitably and they do it all over the world. The U.S. is about a quarter of their revenue and climbing. I like Adyen, I think, if you want some foreign exposure. Of course there's other dynamics at play like foreign exchange risk, because most of the revenue is not in U.S. dollars. But if you want a payment processing company that's not Square or PayPal, that's one to definitely look at.
Lou Whiteman: Much more embedded, too, with these big businesses, as you mentioned. I mean, Square has artisanal roots and PayPal, mostly small businesses. Adyen has a lot of really huge customers -- the one-stop shop, whether or not it's point-of-sale or online. I do say, I'll tell you without going -- because this goes well beyond fintech, so I will keep this brief, but valuation is a weird topic right now. I hear it a lot on Motley Fool Live sometimes in terms of, I hated this idea of, well, such and such company was at this value. The business hasn't changed, so we'll get back to it. I hate that analysis, because that doesn't even consider the fact that it might have been a mistake three months ago.
But where I do think it works is if this is when you have to start looking at total addressable market and see what's out there. Adyen, I think, is pretty early in a huge land grab with multiple winners, but they are coming into the United States. I think Dick's Sporting Goods (NYSE: DKS), you're going to see them coming into new markets. The other big catalyst out there is, honestly, as, Matt, as you say, people don't know about if they just decide to get a New York listing, I think that would be a huge catalyst toward getting higher. I really like this company. I don't own it, but this is one I keep looking at, saying, why don't I own this?
Teresa Kersten, an employee of LinkedIn, a Microsoft subsidiary, is a member of The Motley Fool's board of directors. Lou Whiteman owns Etsy, Microsoft, and PayPal Holdings. Matthew Frankel, CFP® owns Block and has the following options: short January 2024 $200 calls on Block. The Motley Fool owns and recommends Adyen, Block, Etsy, Microsoft, and PayPal Holdings. The Motley Fool recommends Adyen, Uber Technologies, and eBay and recommends the following options: short January 2022 $82.50 calls on eBay. The Motley Fool has a disclosure policy.
The views and opinions expressed herein are the views and opinions of the author and do not necessarily reflect those of Nasdaq, Inc.","If you remember a few years ago, eBay dropped PayPal as its main payment processor and that made a lot of news that was in favor of Adyen. Their customers include companies like Microsoft (NASDAQ: MSFT), Etsy (NASDAQ: ETSY), Uber (NYSE: UBER), the big ones, eBay (NASDAQ: EBAY). The Motley Fool recommends Adyen, Uber Technologies, and eBay and recommends the following options: short January 2022 $82.50 calls on eBay.","Their customers include companies like Microsoft (NASDAQ: MSFT), Etsy (NASDAQ: ETSY), Uber (NYSE: UBER), the big ones, eBay (NASDAQ: EBAY). The Motley Fool recommends Adyen, Uber Technologies, and eBay and recommends the following options: short January 2022 $82.50 calls on eBay. If you remember a few years ago, eBay dropped PayPal as its main payment processor and that made a lot of news that was in favor of Adyen.","Their customers include companies like Microsoft (NASDAQ: MSFT), Etsy (NASDAQ: ETSY), Uber (NYSE: UBER), the big ones, eBay (NASDAQ: EBAY). The Motley Fool recommends Adyen, Uber Technologies, and eBay and recommends the following options: short January 2022 $82.50 calls on eBay. If you remember a few years ago, eBay dropped PayPal as its main payment processor and that made a lot of news that was in favor of Adyen.","Their customers include companies like Microsoft (NASDAQ: MSFT), Etsy (NASDAQ: ETSY), Uber (NYSE: UBER), the big ones, eBay (NASDAQ: EBAY). If you remember a few years ago, eBay dropped PayPal as its main payment processor and that made a lot of news that was in favor of Adyen. The Motley Fool recommends Adyen, Uber Technologies, and eBay and recommends the following options: short January 2022 $82.50 calls on eBay.",2022,3
2022-02-17 00:00:00+00:00,PayPal's User Growth Will Slow: Should Investors Worry?,EBAY,https://www.nasdaq.com/articles/paypals-user-growth-will-slow%3A-should-investors-worry,,,"Since hitting an all-time high of $308.53 last July, shares of PayPal Holdings (NASDAQ: PYPL) have fallen dramatically, losing more than 60% of their value at Wednesday's prices. The company's revenue growth has decelerated, as the pandemic boost seems to be fading away. Investors are now questioning the payments giant's future.
Additionally, the company's massive user base, now at 426 million, isn't likely to expand at the rapid pace we've seen over the past few years. That's because PayPal's management team will no longer try to add as many customers to its platform as possible, instead opting to focus on increasing engagement.
Here's why that's not necessarily a bad thing.
Image source: Getty Images.
Quality over quantity
In 2020 and 2021, PayPal added a total of 121 million net new active accounts. The business undoubtedly benefited from the rise in electronic payments, as traditional brick-and-mortar retailers were temporarily shuttered during the initial stage of the pandemic.
2022 won't come close to resembling the recent past for PayPal, as management expects to add just 15 million to 20 million net new active accounts during the year. And CEO Dan Schulman even walked back his prior target of having a total of 750 million active accounts by 2025.
Instead of quantity, the leadership team will now emphasize gaining high-value customers who are engaging more with PayPal or Venmo and will increase revenue per active account. To do this, PayPal is paring back on utilizing incentive-based campaigns, which actually resulted in 4.5 million illegitimate accounts (that needed to be deleted) in the most recent quarter. Capital will now be invested mainly to get existing customers to engage more, a strategy that management believes reduces churn and results in a stickier, more lucrative user base.
""From an overall marketing point of view, our marketing investment, it's going to be relatively on par with what we did last year, but we are going to rebalance quite a bit toward marketing new products and services to our base, possibly additional investment in incentives for engagement and other things like that,"" Erica Gessert, PayPal's senior vice president of finance and analytics, said on the fourth-quarter earnings call.
New features like buy now, pay later and cryptocurrency trading have shown outstanding success at getting customers to transact more on PayPal's platform. These types of users generate a far better return on investment for the business than less engaged accounts, a group PayPal will start to let drop off instead of trying to keep.
Should investors worry?
Even if new user signups slow down this year, the management team thinks 2023 will be a return to normalized levels of customer adds. They forecast the massive fintech will add roughly 35 million new accounts on an annual basis starting next year, when some of the pandemic-related choppiness hopefully starts to subside.
Adding 35 million highly engaged net new active accounts year in and year out -- which don't require costly incentives and promotions on PayPal's part -- seems like a positive situation for the company. Therefore, I don't think investors have anything to worry about here. All of the problems facing PayPal right now appear to be temporary, yet the market is treating the business like its remarkable success is sure to be over, punishing the stock over the past several months.
Shareholders should pay close attention to revenue per active account going forward to make sure the leadership team is executing on its strategic pivot. Because the stock has been beaten down so much, now might be a good time to buy PayPal shares for investors who have been on the sidelines.
10 stocks we like better than PayPal Holdings
When our award-winning analyst team has a stock tip, it can pay to listen. After all, the newsletter they have run for over a decade, Motley Fool Stock Advisor, has tripled the market.*
They just revealed what they believe are the ten best stocks for investors to buy right now... and PayPal Holdings wasn't one of them! That's right -- they think these 10 stocks are even better buys.
See the 10 stocks
*Stock Advisor returns as of January 20, 2022
Neil Patel has no position in any of the stocks mentioned. The Motley Fool owns and recommends PayPal Holdings. The Motley Fool recommends eBay and recommends the following options: short January 2022 $82.50 calls on eBay. The Motley Fool has a disclosure policy.
The views and opinions expressed herein are the views and opinions of the author and do not necessarily reflect those of Nasdaq, Inc.","The Motley Fool recommends eBay and recommends the following options: short January 2022 $82.50 calls on eBay. Since hitting an all-time high of $308.53 last July, shares of PayPal Holdings (NASDAQ: PYPL) have fallen dramatically, losing more than 60% of their value at Wednesday's prices. The business undoubtedly benefited from the rise in electronic payments, as traditional brick-and-mortar retailers were temporarily shuttered during the initial stage of the pandemic.","The Motley Fool recommends eBay and recommends the following options: short January 2022 $82.50 calls on eBay. Quality over quantity In 2020 and 2021, PayPal added a total of 121 million net new active accounts. 2022 won't come close to resembling the recent past for PayPal, as management expects to add just 15 million to 20 million net new active accounts during the year.","The Motley Fool recommends eBay and recommends the following options: short January 2022 $82.50 calls on eBay. 2022 won't come close to resembling the recent past for PayPal, as management expects to add just 15 million to 20 million net new active accounts during the year. ""From an overall marketing point of view, our marketing investment, it's going to be relatively on par with what we did last year, but we are going to rebalance quite a bit toward marketing new products and services to our base, possibly additional investment in incentives for engagement and other things like that,"" Erica Gessert, PayPal's senior vice president of finance and analytics, said on the fourth-quarter earnings call.","The Motley Fool recommends eBay and recommends the following options: short January 2022 $82.50 calls on eBay. 2022 won't come close to resembling the recent past for PayPal, as management expects to add just 15 million to 20 million net new active accounts during the year. After all, the newsletter they have run for over a decade, Motley Fool Stock Advisor, has tripled the market.",2022,3
