Date,Article_title,Stock_symbol,Url,Publisher,Author,Article,Lsa_summary,Luhn_summary,Textrank_summary,Lexrank_summary,Year,sentiment_score
2022-02-13 00:00:00+00:00,Shopify Earnings: Watch for a New 2022 Outlook,EBAY,https://www.nasdaq.com/articles/shopify-earnings%3A-watch-for-a-new-2022-outlook,,,"Shopify (NYSE: SHOP) stock has plummeted since late 2021 as investors worry about slowing growth for the e-commerce tech platform. The nearly 50% decline might mean market-thumping returns from here, though, if the business maintains some of the impressive momentum shareholders have enjoyed over the past few years.
With that idea in mind, let's look at a few metrics to follow in Shopify's upcoming earnings report, set for Wednesday, Feb. 16.
Image source: Getty Images.
Market share updates
The pandemic added noise around Shopify's growth rate as more commerce was temporarily done online. The company notched several quarters of over 90% year-over-year growth in 2020 and 2021, for example.
Executives said that the selling period through late September represented a more normalized environment. Revenue expanded 46% thanks to a growing merchant base, higher selling volumes, and increased spending on its premium services. ""The strength of Shopify's flywheel was on display"" in the third quarter, CFO Amy Shapero said in late October.
Management said that the fourth-quarter period would likely be strong even as Shopify adds fewer merchants compared to the record result in late 2020. Shopify should reach roughly $1.7 billion in sales, according to Wall Street analysts, which would translate into an over 70% increase.
Look for market share to rise against huge peers like Amazon (NASDAQ: AMZN) and eBay (NASDAQ: EBAY). ""We expect our [transaction volumes] in the fourth quarter to continue to grow substantially faster than the e-commerce market,"" Shapero told investors in October.
Cash and finances
Management at the time warned about several short-term pressures to cash flow and profitability, including the fact that soaring platform engagement is falling in comparison to 2020. Rising costs and supply chain challenges aren't helping, either.
Still, look for Shopify to report impressive gross profitability that's offset slightly by rising spending on the platform. Adjusted operating income rose to 18% of sales through the first nine months of 2021 compared to 12% a year earlier. The rate of increase slowed sharply in Q3, though, and might decelerate even more over the next few quarters.
SHOP Operating Margin (TTM) data by YCharts
That decline helps explain why many investors have become more conservative about the stock lately. It's unclear where Shopify's profitability will settle after jumping higher through most of the past two years.
The outlook
The biggest question heading into Wednesday's report is whether CEO Tobi Lütke and his team see a bright 2022 ahead. Management's long-term outlook is likely brighter than ever, but the next 12 months might be characterized by slower growth and rising costs.
These factors wouldn't hurt the bullish investing thesis. Shopify is spending more on its platform to handle record engagement, after all. And sales trends were always bound to take a step backward after demand stampeded online through the early phases of the pandemic.
That's why investors should look at the stock's slump over the last few months as a buying opportunity instead of any sign that the business is stumbling. Shopify is gaining share in an industry that's likely to grow quickly over many more years, notwithstanding a temporary pullback as the world emerges from the pandemic.
Find out why Shopify is one of the 10 best stocks to buy now
Our award-winning analyst team has spent more than a decade beating the market. After all, the newsletter they have run for over a decade, Motley Fool Stock Advisor, has tripled the market.*
They just revealed their ten top stock picks for investors to buy right now. Shopify is on the list -- but there are nine others you may be overlooking.
Click here to get access to the full list!
*Stock Advisor returns as of January 10, 2022
John Mackey, CEO of Whole Foods Market, an Amazon subsidiary, is a member of The Motley Fool's board of directors. Demitri Kalogeropoulos owns Amazon and Shopify. The Motley Fool owns and recommends Amazon and Shopify. The Motley Fool recommends eBay and recommends the following options: long January 2023 $1,140 calls on Shopify, short January 2022 $82.50 calls on eBay, and short January 2023 $1,160 calls on Shopify. The Motley Fool has a disclosure policy.
The views and opinions expressed herein are the views and opinions of the author and do not necessarily reflect those of Nasdaq, Inc.","Look for market share to rise against huge peers like Amazon (NASDAQ: AMZN) and eBay (NASDAQ: EBAY). The Motley Fool recommends eBay and recommends the following options: long January 2023 $1,140 calls on Shopify, short January 2022 $82.50 calls on eBay, and short January 2023 $1,160 calls on Shopify. Shopify (NYSE: SHOP) stock has plummeted since late 2021 as investors worry about slowing growth for the e-commerce tech platform.","The Motley Fool recommends eBay and recommends the following options: long January 2023 $1,140 calls on Shopify, short January 2022 $82.50 calls on eBay, and short January 2023 $1,160 calls on Shopify. Look for market share to rise against huge peers like Amazon (NASDAQ: AMZN) and eBay (NASDAQ: EBAY). Revenue expanded 46% thanks to a growing merchant base, higher selling volumes, and increased spending on its premium services.","The Motley Fool recommends eBay and recommends the following options: long January 2023 $1,140 calls on Shopify, short January 2022 $82.50 calls on eBay, and short January 2023 $1,160 calls on Shopify. Look for market share to rise against huge peers like Amazon (NASDAQ: AMZN) and eBay (NASDAQ: EBAY). Shopify (NYSE: SHOP) stock has plummeted since late 2021 as investors worry about slowing growth for the e-commerce tech platform.","Look for market share to rise against huge peers like Amazon (NASDAQ: AMZN) and eBay (NASDAQ: EBAY). The Motley Fool recommends eBay and recommends the following options: long January 2023 $1,140 calls on Shopify, short January 2022 $82.50 calls on eBay, and short January 2023 $1,160 calls on Shopify. Rising costs and supply chain challenges aren't helping, either.",2022,2
2022-02-10 00:00:00+00:00,Is eBay a Top Stock to Buy and Hold in 2022 and Beyond?,EBAY,https://www.nasdaq.com/articles/is-ebay-a-top-stock-to-buy-and-hold-in-2022-and-beyond,,,"With so many e-commerce stocks competing for your attention, you may have overlooked one of the trailblazers in this space, eBay (NASDAQ: EBAY). In this segment of Backstage Pass, recorded on Jan. 11, Fool contributor Demitri Kalogeropoulos and Fool analyst Asit Sharma take a look at the household name stock.
10 stocks we like better than eBay
When our award-winning analyst team has a stock tip, it can pay to listen. After all, the newsletter they have run for over a decade, Motley Fool Stock Advisor, has tripled the market.*
They just revealed what they believe are the ten best stocks for investors to buy right now... and eBay wasn't one of them! That's right -- they think these 10 stocks are even better buys.
See the 10 stocks
*Stock Advisor returns as of January 10, 2022
Demitri Kalogeropoulos: The company I'm bringing to highlight today is eBay. I'm sure everyone knows this. We were talking about e-commerce a bit. There's a lot of ways to get exposure to the e-commerce space. eBay is unique for a bunch of reasons, I have been following the company for a while.
Obviously, it's a marketplace that some people don't know that it's one of the top three e-commerce companies in the world basically because they handle so much volume.
They facilitated about $20 billion worth of merchandise sales in the past quarter. That, for example, compared to Amazon (NASDAQ: AMZN), which is the leader basically, Amazon is more in that $58 billion space, almost three times as much but still, these are huge numbers. eBay is a global company.
But it's a marketplace, so they're not selling their own products, they're just connecting buyers to sellers, so the actual eBay's revenue is in that more like $2.5 billion range.
That's one of the things that's interesting about this stock because it's got that asset-light model, a whole different approach. It doesn't have to spend all that cash on the fulfillment centers and the big inventory. It can just focus on basically doing that connection and gets paid to similar. We've talked about Etsy (NASDAQ: ETSY) before.
It's that similar model where they charge sellers a fee somewhere around that. eBay is in around that 10% range. Etsy's is way higher. That does wonders if you like finances in a company and you prefer that over really high-growth.
eBay's operating margin is somewhere around 25% of sales and you can compare that to about 6% for Amazon and Walmart (NYSE: WMT). Similarly, huge e-commerce giants.
It's also a cash-generating machine because of that model and they pour most of that cash right back to the shareholders. They spent $2 billion just last quarter on buybacks and they paid a dividend so we don't get a lot of that. That's still pretty rare in the e-commerce industry.
Obviously, it's not growing as quickly because that's the trade-off when they don't operate their own inventory. Sales growing about 10% in this past quarter. But if you like a dominant brand with an asset-light operating model and you like direct cash returns, you might want to take a closer look at eBay.
Asit Sharma: Nice. That was really succinct, Demitri. A really good overview there. You've been a fan for a while as I remember of this company.
Kalogeropoulos: I've been following them there for a while. It's just like I said, some of those numbers are just head-turning. I think it's something like operating cash flow with something like 30% of sales routinely. It's just so much. Such a cash business. That's really what attracts me.
Sharma: Sometimes the best investments are right in front of us.
John Mackey, CEO of Whole Foods Market, an Amazon subsidiary, is a member of The Motley Fool's board of directors. Asit Sharma owns Etsy. Demitri Kalogeropoulos owns Amazon. Rachel Warren owns Amazon and Etsy. The Motley Fool owns and recommends Amazon and Etsy. The Motley Fool recommends eBay and recommends the following options: short January 2022 $82.50 calls on eBay. The Motley Fool has a disclosure policy.
The views and opinions expressed herein are the views and opinions of the author and do not necessarily reflect those of Nasdaq, Inc.","But it's a marketplace, so they're not selling their own products, they're just connecting buyers to sellers, so the actual eBay's revenue is in that more like $2.5 billion range. But if you like a dominant brand with an asset-light operating model and you like direct cash returns, you might want to take a closer look at eBay. With so many e-commerce stocks competing for your attention, you may have overlooked one of the trailblazers in this space, eBay (NASDAQ: EBAY).","See the 10 stocks *Stock Advisor returns as of January 10, 2022 Demitri Kalogeropoulos: The company I'm bringing to highlight today is eBay. With so many e-commerce stocks competing for your attention, you may have overlooked one of the trailblazers in this space, eBay (NASDAQ: EBAY). 10 stocks we like better than eBay When our award-winning analyst team has a stock tip, it can pay to listen.","With so many e-commerce stocks competing for your attention, you may have overlooked one of the trailblazers in this space, eBay (NASDAQ: EBAY). See the 10 stocks *Stock Advisor returns as of January 10, 2022 Demitri Kalogeropoulos: The company I'm bringing to highlight today is eBay. The Motley Fool recommends eBay and recommends the following options: short January 2022 $82.50 calls on eBay.","See the 10 stocks *Stock Advisor returns as of January 10, 2022 Demitri Kalogeropoulos: The company I'm bringing to highlight today is eBay. eBay is a global company. With so many e-commerce stocks competing for your attention, you may have overlooked one of the trailblazers in this space, eBay (NASDAQ: EBAY).",2022,3
2022-02-10 00:00:00+00:00,Is Adyen Stock a Buy Now?,EBAY,https://www.nasdaq.com/articles/is-adyen-stock-a-buy-now,,,"Adyen (OTC: ADYE.Y), the Dutch digital payments company that convinced eBay to ditch PayPal (NASDAQ: PYPL) back in 2018, lost nearly 40% of its market value over the past three months as rising interest rates sparked a grueling rotation away from higher-growth tech stocks.
PayPal's messy fourth-quarter report in early February exacerbated the pain by dragging down Adyen and its other fintech peers. But has Adyen's steep decline, which reset its valuations to more sustainable levels, made it a worthwhile investment for patient investors again?
The differences between Adyen and its rivals
Adyen provides an end-to-end platform for payments, data, and financial management services. Its software can be directly integrated into existing online, mobile, and in-store payment platforms with a few lines of code. That integration enables merchants to accept over 250 payment methods, including credit cards, debit cards, mobile wallets, and other payment apps.
Image source: Getty Images.
Adyen doesn't provide a dedicated consumer-facing app like PayPal, nor does it provide peer-to-peer payment services like PayPal's Venmo and Block's (NYSE: SQ) Cash App. It also doesn't provide any cryptocurrency trading services, stock trading tools, or physical debit cards.
Instead, Adyen's backend services enable merchants to issue their own virtual payment cards, which function as branded mobile wallets, and maintain their own payment and data systems.
That behind-the-scenes approach makes Adyen more comparable to PayPal's Braintree, Shopify Payments, and Stripe. It also makes Adyen easier to analyze than PayPal and Block, which both have a lot more moving parts.
How fast is Adyen growing?
Adyen posted its full-year numbers for 2021 on Feb. 9. Its growth in revenue, processed volume, and earnings before interest, taxes, depreciation, and amortization (EBITDA) all accelerated significantly from 2020, when the pandemic shut down many brick-and-mortar businesses.
GROWTH (YOY)
2018
2019
2020
2021
Net Revenue
60%
42%
28%
46%
Processed Volume
47%
51%
27%
70%
EBITDA
83%
54%
27%
57%
Data source: Adyen. YOY = Year-over-year.
Ayden's growth improved throughout 2021 as those headwinds waned, and it maintained its long-term outlook for growing its annual revenue at a compound annual growth rate (CAGR) ""between the mid-twenties and low-thirties in the medium term"" by roping in more businesses.
However, Adyen's take rate -- or the percentage of each transaction it retains as revenue -- dipped from 22.5% in 2020 to 19.4% in 2021. It attributed that decline to a higher mix of lower-margin retail customers, which partly offset the growth of its higher-margin enterprise customers.
On the bright side, Adyen's EBITDA margin still expanded from 59% in 2020 to 63% in 2021 as its operating leverage improved. It also reiterated its long-term guidance for boosting its EBITDA margin ""above 65%"".
It's growing a lot faster than PayPal
Analysts expect Adyen's revenue and EBITDA to both rise 38% in 2022, and for its net income to grow 42%. Based on those estimates, Adyen's stock trades at 38 times this year's sales and 80 times forward earnings.
That makes it a lot pricier than PayPal, which trades at just five times this year's sales and 27 times forward earnings. However, analysts expect PayPal's revenue and earnings to increase just 16% and 1%, respectively, this year, as it grapples with its final decoupling from eBay (which ends in the second half of 2022), competitive challenges, and various macroeconomic headwinds.
Adyen's stock looks more attractively valued than it did three months ago, but its high valuations could still expose it to rising inflation and interest rates.
Is it the right time to buy Adyen?
Adyen is arguably a simpler and better-run fintech company than PayPal or Block. It's not suffering a major slowdown like PayPal, and it isn't obsessed with the volatile Bitcoin market like Block.
But Adyen's stock is still priced for perfection at these levels, and its upside potential could be capped by the market's limited appetite for high-growth stocks. I'd recommend nibbling on Adyen at these levels, but investors should realize they're still paying a hefty premium for this fintech favorite -- even after it was nearly cut in half over the past three months.
10 stocks we like better than Adyen N.V.
When our award-winning analyst team has a stock tip, it can pay to listen. After all, the newsletter they have run for over a decade, Motley Fool Stock Advisor, has tripled the market.*
They just revealed what they believe are the ten best stocks for investors to buy right now... and Adyen N.V. wasn't one of them! That's right -- they think these 10 stocks are even better buys.
See the 10 stocks
*Stock Advisor returns as of January 20, 2022
Leo Sun owns Block, Inc. and PayPal Holdings. The Motley Fool owns and recommends Adyen N.V., Bitcoin, Block, Inc., PayPal Holdings, and Shopify. The Motley Fool recommends Adyen and eBay and recommends the following options: long January 2023 $1,140 calls on Shopify, short January 2022 $82.50 calls on eBay, and short January 2023 $1,160 calls on Shopify. The Motley Fool has a disclosure policy.
The views and opinions expressed herein are the views and opinions of the author and do not necessarily reflect those of Nasdaq, Inc.","Adyen (OTC: ADYE.Y), the Dutch digital payments company that convinced eBay to ditch PayPal (NASDAQ: PYPL) back in 2018, lost nearly 40% of its market value over the past three months as rising interest rates sparked a grueling rotation away from higher-growth tech stocks. However, analysts expect PayPal's revenue and earnings to increase just 16% and 1%, respectively, this year, as it grapples with its final decoupling from eBay (which ends in the second half of 2022), competitive challenges, and various macroeconomic headwinds. The Motley Fool recommends Adyen and eBay and recommends the following options: long January 2023 $1,140 calls on Shopify, short January 2022 $82.50 calls on eBay, and short January 2023 $1,160 calls on Shopify.","The Motley Fool recommends Adyen and eBay and recommends the following options: long January 2023 $1,140 calls on Shopify, short January 2022 $82.50 calls on eBay, and short January 2023 $1,160 calls on Shopify. Adyen (OTC: ADYE.Y), the Dutch digital payments company that convinced eBay to ditch PayPal (NASDAQ: PYPL) back in 2018, lost nearly 40% of its market value over the past three months as rising interest rates sparked a grueling rotation away from higher-growth tech stocks. However, analysts expect PayPal's revenue and earnings to increase just 16% and 1%, respectively, this year, as it grapples with its final decoupling from eBay (which ends in the second half of 2022), competitive challenges, and various macroeconomic headwinds.","Adyen (OTC: ADYE.Y), the Dutch digital payments company that convinced eBay to ditch PayPal (NASDAQ: PYPL) back in 2018, lost nearly 40% of its market value over the past three months as rising interest rates sparked a grueling rotation away from higher-growth tech stocks. However, analysts expect PayPal's revenue and earnings to increase just 16% and 1%, respectively, this year, as it grapples with its final decoupling from eBay (which ends in the second half of 2022), competitive challenges, and various macroeconomic headwinds. The Motley Fool recommends Adyen and eBay and recommends the following options: long January 2023 $1,140 calls on Shopify, short January 2022 $82.50 calls on eBay, and short January 2023 $1,160 calls on Shopify.","Adyen (OTC: ADYE.Y), the Dutch digital payments company that convinced eBay to ditch PayPal (NASDAQ: PYPL) back in 2018, lost nearly 40% of its market value over the past three months as rising interest rates sparked a grueling rotation away from higher-growth tech stocks. However, analysts expect PayPal's revenue and earnings to increase just 16% and 1%, respectively, this year, as it grapples with its final decoupling from eBay (which ends in the second half of 2022), competitive challenges, and various macroeconomic headwinds. The Motley Fool recommends Adyen and eBay and recommends the following options: long January 2023 $1,140 calls on Shopify, short January 2022 $82.50 calls on eBay, and short January 2023 $1,160 calls on Shopify.",2022,4
2022-02-09 00:00:00+00:00,Dutch payment company Adyen's H2 core profit jumps 51%,EBAY,https://www.nasdaq.com/articles/dutch-payment-company-adyens-h2-core-profit-jumps-51-0,,,"By Toby Sterling
AMSTERDAM, Feb 9 (Reuters) - Adyen NV ADYEN.AS, the Dutch company that helps to process payments for Netflix, Facebook and Uber, on Wednesday said prospects for its business remained strong as it reported a 51% jump in second-half core earnings.
Earnings before interest, depreciation, and amortization (EBITDA) rose to 357.3 million euros ($408.0 million) in the July-December period, while revenue rose 47% to 556.5 million euros.
Analysts had expected EBITDA of 346 million euros on revenue of 552 million, Refinitiv Eikon data showed.
Adyen shares have fallen 27% this year amid a wider technology sell-off.
The company is profitable but enjoys a high valuation based on expectations of continued strong growth.
Adyen said its EBITDA margin in the second half rose to 64% from 62%, and repeated its medium-term target of a compounded annual growth rate of around 25%-30%.
Recent critical analyst reports have focused on the company's exposure to large clients including eBay EBAY.O and Facebook owner Meta FB.0.
The company says it is benefiting from long-term trends in the way consumers order and pay for goods, which have accelerated during the COVID-19 pandemic.
Adyen also helps vendors handle payments in stores and is often attractive to large companies that sell both online and offline goods, and in multiple countries.
""Results were bolstered by the unrelenting rise of online commerce globally, and an increasing need for merchants to implement unified commerce shopper journeys,"" Adyen said, as well as the ""disappearance of cash"".
($1 = 0.8757 euros)
(Reporting by Bart Meijer; editing by Tom Hogue and Jason Neely)
((Bart.Meijer@thomsonreuters.com; +31 20 504 5006; Reuters Messaging: bart.meijer@thomsonreuters.com))
The views and opinions expressed herein are the views and opinions of the author and do not necessarily reflect those of Nasdaq, Inc.","Recent critical analyst reports have focused on the company's exposure to large clients including eBay EBAY.O and Facebook owner Meta FB.0. By Toby Sterling AMSTERDAM, Feb 9 (Reuters) - Adyen NV ADYEN.AS, the Dutch company that helps to process payments for Netflix, Facebook and Uber, on Wednesday said prospects for its business remained strong as it reported a 51% jump in second-half core earnings. Adyen also helps vendors handle payments in stores and is often attractive to large companies that sell both online and offline goods, and in multiple countries.","Recent critical analyst reports have focused on the company's exposure to large clients including eBay EBAY.O and Facebook owner Meta FB.0. By Toby Sterling AMSTERDAM, Feb 9 (Reuters) - Adyen NV ADYEN.AS, the Dutch company that helps to process payments for Netflix, Facebook and Uber, on Wednesday said prospects for its business remained strong as it reported a 51% jump in second-half core earnings. Earnings before interest, depreciation, and amortization (EBITDA) rose to 357.3 million euros ($408.0 million) in the July-December period, while revenue rose 47% to 556.5 million euros.","Recent critical analyst reports have focused on the company's exposure to large clients including eBay EBAY.O and Facebook owner Meta FB.0. By Toby Sterling AMSTERDAM, Feb 9 (Reuters) - Adyen NV ADYEN.AS, the Dutch company that helps to process payments for Netflix, Facebook and Uber, on Wednesday said prospects for its business remained strong as it reported a 51% jump in second-half core earnings. Earnings before interest, depreciation, and amortization (EBITDA) rose to 357.3 million euros ($408.0 million) in the July-December period, while revenue rose 47% to 556.5 million euros.","Recent critical analyst reports have focused on the company's exposure to large clients including eBay EBAY.O and Facebook owner Meta FB.0. By Toby Sterling AMSTERDAM, Feb 9 (Reuters) - Adyen NV ADYEN.AS, the Dutch company that helps to process payments for Netflix, Facebook and Uber, on Wednesday said prospects for its business remained strong as it reported a 51% jump in second-half core earnings. Earnings before interest, depreciation, and amortization (EBITDA) rose to 357.3 million euros ($408.0 million) in the July-December period, while revenue rose 47% to 556.5 million euros.",2022,2
