Date,Article_title,Stock_symbol,Url,Publisher,Author,Article,Lsa_summary,Luhn_summary,Textrank_summary,Lexrank_summary,Year,sentiment_score
2022-11-15 00:00:00+00:00,What's in the Cards for Applied Materials (AMAT) Q4 Earnings?,DLTR,https://www.nasdaq.com/articles/whats-in-the-cards-for-applied-materials-amat-q4-earnings,,,"Applied Materials, Inc. AMAT is set to report fourth-quarter fiscal 2022 results on Nov 17.

For the fiscal fourth quarter, AMAT expects net sales of $6.4 billion (+/- 250 million). The Zacks Consensus Estimate for revenues is pegged at $6.4 billion, suggesting growth of 4.5% from the year-ago fiscal quarter’s reading.

Applied Materials projects non-GAAP earnings of $1.54-$1.78 per share. The Zacks Consensus Estimate for earnings is pegged at $1.73 per share, indicating a decline of 10.8% from the year-ago fiscal quarter’s reported figure.

AMAT’s bottom line surpassed the Zacks Consensus Estimate in two of the trailing four quarters, missed the same once and matched the mark on another occasion, the average earnings surprise being 2.26%.
Applied Materials, Inc. Price and EPS Surprise
Applied Materials, Inc. price-eps-surprise | Applied Materials, Inc. Quote
Factors to Consider
Applied Materials is likely to have persistently suffered supply-chain disruptions during the fiscal fourth quarter.

Further, sluggishness in memory spending, weak demand in the consumer electronics space and softness in AMAT’s 200mm equipment business are expected to impact the upcoming results negatively.

Additionally, escalating tensions between the United States and China inducing new export checks by the U.S. regime to cripple the Chinese semiconductor companies, might have marred AMAT’s financial prospects in the to-be-reported quarter.

The export curbs prompted AMAT to stop its shipment of equipment in the quarter under review to wholly-China-owned factories that manufacture advanced logic chips. This is likely to have hurt top-line growth in the fiscal fourth quarter.

Nevertheless, Applied Materials’ portfolio strength, expanding position in memory and increasing new design wins are likely to have driven its performance in the fiscal fourth quarter.

Growth opportunities across specialty nodes and new nodes ramp across foundry, logic, NAND and DRAM are expected to have benefited AMAT in the to-be-reported fiscal quarter.

The growing adoption of IoT, AI and Big Data is expected to have contributed to the performance in the fiscal fourth quarter.

Further, strengthening ICAPS portfolio is expected to have benefited the company in the quarter under review.

However, Applied Materials is likely to have continued suffering sluggishness in its Display and Adjacent Markets segment in the fiscal quarter under review.

Uncertainties related to the COVID-19 pandemic are likely to have induced headwinds to AMAT in the soon-to-be-reported fiscal quarter.
What Our Model Says
Our proven model does not conclusively predict an earnings beat for Applied Materials this time around. The combination of a positive Earnings ESP and a Zacks Rank #1 (Strong Buy), 2 (Buy) or 3 (Hold) increases the odds of an earnings beat, which is precisely the case here. You can uncover the best stocks to buy or sell before they’re reported with our Earnings ESP Filter.

Applied Materials has an Earnings ESP of 0.00% and a Zacks Rank #5 (Strong Sell).
Stocks to Consider
Here are some stocks worth considering, as our model shows that these have the right combination of elements to beat on earnings this season.

Analog Devices ADI has an Earnings ESP of +1.10% and a Zacks Rank #3 at present. You can see the complete list of today’s Zacks #1 Rank stocks here.

Analog Devices is scheduled to release fourth-quarter fiscal 2022 results on Nov 22. The Zacks Consensus Estimate for ADI’s earnings is pegged at $2.58 per share, suggesting a 49.1% increase from the prior-year fiscal quarter’s reported figure.

Adobe ADBE has an Earnings ESP of +0.45% and a Zacks Rank of 3 at present.

Adobe is scheduled to release fourth-quarter fiscal 2022 results on Dec 15. The Zacks Consensus Estimate for ADBE’s earnings is pegged at $3.50 per share, suggesting a 9.4% rise from the prior-year fiscal quarter’s reported figure.

Dollar Tree DLTR has an Earnings ESP of +6.57% and is presently Zacks #3 Ranked.

Dollar Tree is set to report third-quarter 2022 results on Nov 22. The Zacks Consensus Estimate for DLTR’s earnings is pegged at $1.16 per share, suggesting a 20.8% increase from the prior-year fiscal period’s reported figure.

Stay on top of upcoming earnings announcements with the Zacks Earnings Calendar.

Zacks Names ""Single Best Pick to Double""
From thousands of stocks, 5 Zacks experts each have chosen their favorite to skyrocket +100% or more in months to come. From those 5, Director of Research Sheraz Mian hand-picks one to have the most explosive upside of all.
It’s a little-known chemical company that’s up 65% over last year, yet still dirt cheap. With unrelenting demand, soaring 2022 earnings estimates, and $1.5 billion for repurchasing shares, retail investors could jump in at any time.
This company could rival or surpass other recent Zacks’ Stocks Set to Double like Boston Beer Company which shot up +143.0% in little more than 9 months and NVIDIA which boomed +175.9% in one year.
Free: See Our Top Stock and 4 Runners Up >>

Want the latest recommendations from Zacks Investment Research? Today, you can download 7 Best Stocks for the Next 30 Days. Click to get this free report
 
Analog Devices, Inc. (ADI): Free Stock Analysis Report
 
Dollar Tree, Inc. (DLTR): Free Stock Analysis Report
 
Adobe Inc. (ADBE): Free Stock Analysis Report
 
Applied Materials, Inc. (AMAT): Free Stock Analysis Report
 
To read this article on Zacks.com click here.
 
Zacks Investment Research
The views and opinions expressed herein are the views and opinions of the author and do not necessarily reflect those of Nasdaq, Inc.","Dollar Tree DLTR has an Earnings ESP of +6.57% and is presently Zacks #3 Ranked. The Zacks Consensus Estimate for DLTR’s earnings is pegged at $1.16 per share, suggesting a 20.8% increase from the prior-year fiscal period’s reported figure. Dollar Tree, Inc. (DLTR): Free Stock Analysis Report","The Zacks Consensus Estimate for DLTR’s earnings is pegged at $1.16 per share, suggesting a 20.8% increase from the prior-year fiscal period’s reported figure. Dollar Tree DLTR has an Earnings ESP of +6.57% and is presently Zacks #3 Ranked. Dollar Tree, Inc. (DLTR): Free Stock Analysis Report","Dollar Tree DLTR has an Earnings ESP of +6.57% and is presently Zacks #3 Ranked. The Zacks Consensus Estimate for DLTR’s earnings is pegged at $1.16 per share, suggesting a 20.8% increase from the prior-year fiscal period’s reported figure. Dollar Tree, Inc. (DLTR): Free Stock Analysis Report","Dollar Tree DLTR has an Earnings ESP of +6.57% and is presently Zacks #3 Ranked. The Zacks Consensus Estimate for DLTR’s earnings is pegged at $1.16 per share, suggesting a 20.8% increase from the prior-year fiscal period’s reported figure. Dollar Tree, Inc. (DLTR): Free Stock Analysis Report",2022,4
2022-11-15 00:00:00+00:00,Buckle (BKE) to Report Q3 Earnings: What's in the Offing?,DLTR,https://www.nasdaq.com/articles/buckle-bke-to-report-q3-earnings%3A-whats-in-the-offing,,,"The Buckle, Inc. BKE is likely to register an increase in the top and bottom lines from the year-ago fiscal quarter’s reported figures in its third-quarter fiscal 2022 earnings on Nov 18, before market open. The Zacks Consensus Estimate for quarterly sales is pegged at $344 million, indicating growth of 7.7% from the year-ago fiscal period’s tally.

BKE registered higher sales in all three months of the fiscal quarter under review. This apparel, footwear and accessories retailer recorded net sales growth of 2.3%, 3.8% and 4.6%, for October, September and August, respectively.

The Zacks Consensus Estimate for quarterly earnings is pegged at $1.34 per share, suggesting a 6.4% rise from the year-ago fiscal period’s tally. The consensus mark has been stable in the past 30 days.

This Kearney, NE-based player’s trailing four-quarter earnings surprise is 12.7%, on average In the last reported quarter, BKE delivered an earnings surprise of 8.6%.
Key Factors to Note
Strength in Buckle’s men’s and women’s divisions coupled with gains from the online business is most likely to have boosted sales in the fiscal third quarter. Apart from men’s and women’s businesses, BKE is benefiting from its denims and private label business. Categories like accessory and tops have also been performing well for a while now.

BKE is focused on enhancing its omnichannel capabilities. It continues expanding its assortment offerings to meet consumers’ altering preferences. Buckle’s store-expansion efforts appear fruitful as well. Further, the comparable-store sales (comps) increased in all three months of the fiscal third quarter. Comps rose 1.4%, 2.7% and 5.8% in October, September and August, respectively.

While the aforementioned factors raise optimism about the quarterly performance, any deleverage in selling, general and administrative expenses is concerning. Also, a tough operating backdrop, including inflationary pressures and supply-chain headwinds, remains a deterrent.
What the Zacks Model Unveils
Our proven model does not conclusively predict an earnings beat for Buckle this time around. The combination of a positive Earnings ESP and a Zacks Rank #1 (Strong Buy), 2 (Buy) or 3 (Hold) increases the odds of an earnings beat. But that’s not the case here, as you see below. You can uncover the best stocks before they’re reported with our Earnings ESP Filter.

Buckle has a Zacks Rank #4 (Sell) and an Earnings ESP of 0.00%, making surprise prediction difficult.
Stocks with Favorable Combination
Here are three companies which according toour model have the right combination of elements to beat on earnings this season:

lululemon athletica LULU currently has an Earnings ESP of +1.50% and a Zacks Rank #2. LULU is likely to register an increase in the bottom line from the year-ago fiscal quarter’s reported figure in its third-quarter fiscal 2022 results. The Zacks Consensus Estimate for quarterly earnings has been stable at $1.95 per share over the past 30 days, suggesting 20.4% growth from the year-ago fiscal quarter’s reported number. You can see the complete list of today’s Zacks #1 Rank stocks here.

lululemon athletica’s top line is expected to rise from the prior-year fiscal quarter’s reported number. The Zacks Consensus Estimate for quarterly revenues is pegged at $1.80 billion, suggesting a 24.4% rise from the figure reported in the prior-year fiscal quarter. LULU delivered an earnings beat of 10.4%, on average, in the trailing four quarters.

Dollar General DG currently has an Earnings ESP of +2.35% and a Zacks Rank #3. DG is likely to register top-line growth from the year-ago fiscal quarter’s tally in its third-quarter fiscal 2022 numbers. The Zacks Consensus Estimate for quarterly revenues is pegged at $9.43 billion, suggesting 10.7% growth from the figure reported in the prior-year fiscal quarter.

The Zacks Consensus Estimate for Dollar General’s earnings for the fiscal third quarter is pegged at $2.54 per share, suggesting 22.1% growth from the year-ago fiscal quarter’s tally. The consensus mark has been stable in the past 30 days. DG delivered an earnings beat of 2.2%, on average, in the trailing four quarters.

Dollar Tree DLTR has an Earnings ESP of +6.57% and a Zacks Rank of 3, at present. DLTR is likely to register top-line growth from the year-earlier fiscal quarter’s actuals when it reports third-quarter fiscal 2022 numbers. The Zacks Consensus Estimate for quarterly revenues is pegged at $6.83 billion, suggesting 6.5% growth from the figure reported in the prior-year fiscal quarter.

The Zacks Consensus Estimate for Dollar Tree’s earnings for the fiscal third quarter is pegged at $1.16 per share, suggesting 20.8% growth from the year-ago fiscal quarter’s tally. The consensus mark has been stable in the past 30 days. DLTR delivered an earnings beat of 8.6%, on average, in the trailing four quarters.

Stay on top of upcoming earnings announcements with the Zacks Earnings Calendar.

Zacks Names ""Single Best Pick to Double""
From thousands of stocks, 5 Zacks experts each have chosen their favorite to skyrocket +100% or more in months to come. From those 5, Director of Research Sheraz Mian hand-picks one to have the most explosive upside of all.
It’s a little-known chemical company that’s up 65% over last year, yet still dirt cheap. With unrelenting demand, soaring 2022 earnings estimates, and $1.5 billion for repurchasing shares, retail investors could jump in at any time.
This company could rival or surpass other recent Zacks’ Stocks Set to Double like Boston Beer Company which shot up +143.0% in little more than 9 months and NVIDIA which boomed +175.9% in one year.
Free: See Our Top Stock and 4 Runners Up >>

Want the latest recommendations from Zacks Investment Research? Today, you can download 7 Best Stocks for the Next 30 Days. Click to get this free report
 
Dollar General Corporation (DG): Free Stock Analysis Report
 
Dollar Tree, Inc. (DLTR): Free Stock Analysis Report
 
lululemon athletica inc. (LULU): Free Stock Analysis Report
 
Buckle, Inc. The (BKE): Free Stock Analysis Report
 
To read this article on Zacks.com click here.
 
Zacks Investment Research
The views and opinions expressed herein are the views and opinions of the author and do not necessarily reflect those of Nasdaq, Inc.","Dollar Tree DLTR has an Earnings ESP of +6.57% and a Zacks Rank of 3, at present. DLTR is likely to register top-line growth from the year-earlier fiscal quarter’s actuals when it reports third-quarter fiscal 2022 numbers. DLTR delivered an earnings beat of 8.6%, on average, in the trailing four quarters.","Dollar Tree DLTR has an Earnings ESP of +6.57% and a Zacks Rank of 3, at present. DLTR is likely to register top-line growth from the year-earlier fiscal quarter’s actuals when it reports third-quarter fiscal 2022 numbers. DLTR delivered an earnings beat of 8.6%, on average, in the trailing four quarters.","Dollar Tree DLTR has an Earnings ESP of +6.57% and a Zacks Rank of 3, at present. DLTR is likely to register top-line growth from the year-earlier fiscal quarter’s actuals when it reports third-quarter fiscal 2022 numbers. DLTR delivered an earnings beat of 8.6%, on average, in the trailing four quarters.","Dollar Tree DLTR has an Earnings ESP of +6.57% and a Zacks Rank of 3, at present. DLTR is likely to register top-line growth from the year-earlier fiscal quarter’s actuals when it reports third-quarter fiscal 2022 numbers. DLTR delivered an earnings beat of 8.6%, on average, in the trailing four quarters.",2022,4
2022-11-15 00:00:00+00:00,5 Retailers Likely to Gain on Earnings Results This Month,DLTR,https://www.nasdaq.com/articles/5-retailers-likely-to-gain-on-earnings-results-this-month-0,,,"We are in the last major week of the third-quarter 2022 earnings season. So far, corporate America has shown mixed results. Although the earnings growth rate has declined systematically, margin pressures have come in less than expected.
Most of the sectors have already reported with the notable exception being the retail sector. Last quarter was a mixed one for retailers. Overall demand remains solid owing to strong savings by Americans. However, several retailers have warned of inventory accumulation and stiff margin pressures.
We have selected five retailers that are set to beat earnings results this month. These companies are - The TJX Companies Inc. TJX, Macy's Inc. M, Ross Stores Inc. ROST, Dollar Tree Inc. DLTR and Bath & Body Works Inc. BBWI.
Q3 Earnings Results So Far
Our third-quarter earnings estimate for the market’s benchmark, the S&P 500 Index, have shown a gradual decline in the past three and a half months. As of Nov 11, 461 companies on the S&P 500 Index have reported results.
Total earnings of these companies are up 2.6% from the same period last year on 12.4% higher revenues, with 69.4% beating EPS estimates and 67.9% beating revenue estimates. Our current estimate has projected that total earnings of the S&P 500 Index are expected to be up 1.5% year over year on 11.4% higher revenues.
Our Top Picks
We have chosen five retailers that will report earnings results this month. Each of these stocks carries a Zacks Rank #3 (Hold) and has a positive Earnings ESP. You can see the complete list of today’s Zacks #1 Rank (Strong Buy) stocks here.
Our research shows that for stocks with the combination of a Zacks Rank #3 or better and a positive Earnings ESP, the chance of an earnings beat is as high as 70%. These stocks are anticipated to appreciate after their earnings releases. You can uncover the best stocks to buy or sell before they’re reported with our Earnings ESP Filter.
The chart below shows the price performance of our five picks in the last quarter.

Image Source: Zacks Investment Research
The TJX Companies’ off-price business model, strategic store locations, impressive brands and fashion products, as well as supply-chain management have been working well. TJX has been benefiting from its solid store and e-commerce growth efforts. The TJX Companies is optimistic about growing its global store base by at least another 1,500 stores in the current locations.
Apart from this, TJX has been witnessing improved pre-tax profit margin, with management raising its guidance for the same for fiscal 2023. The TJX Companies now expects fiscal 2023 adjusted pretax profit margin of 9.7-9.9%.
TJX has an Earnings ESP of +0.63%. It has an expected earnings growth rate of 9% for the current year (ending January 2023). The TJX Companies recorded earnings surprises in three out of the last four reported quarters, with an average beat of 1.7%. TJX is set to release earnings results on Nov 16, before the opening bell.
Bath & Body Works operates as a specialty retailer of home fragrance, body care, and soaps and sanitizer products. BBWI sells its products under Bath & Body Works, White Barn, and other brand names through specialty retail stores and websites located in the United States and Canada. BBWI also sells through international stores operated by partners under franchise, license, and wholesale arrangements.
Bath & Body Works has an Earnings ESP of +62.21%. BBWI recorded earnings surprises in the last four reported quarters, with an average beat of 26.1%. Bath & Body Works is set to release earnings results on Nov 16, after the closing bell.
Macy's is an omnichannel retail organization, operating stores, websites and mobile applications under the Macy's, Bloomingdale's, and bluemercury brands. M has undertaken initiatives to gain market share, better engage with customers, and maintain a decent financial profile. Macy's believes that the Polaris Strategy positions it well to navigate through the dynamic retail landscape. Macy’s intends to focus on in-demand categories.
Macy's has an Earnings ESP of +18.92%. The company recorded earnings surprises in the last four reported quarters, with an average beat of 80.8%. M is set to release earnings results on Nov 17, before the opening bell.
Ross Stores is gaining from robust customer demand, accelerated vaccination rates, government stimulus payments and easing of COVID-19 restrictions. ROST’s sales benefited from broad-based growth across certain merchandise categories and regions, as well as robust comparable store sales.  
The children and men's categories performed well in the holiday selling period, and the Midwest and Southeast regions were the outperforming regions for Ross Stores. Sales trends were also robust at the dd's DISCOUNTS business.
ROST has an Earnings ESP of +3.13%. Ross Stores recorded earnings surprises in three out of the last four reported quarters, with an average beat of 14.1%. ROST is set to release earnings results on Nov 17, after the closing bell.
Dollar Tree has provided a robust view for fiscal 2022 sales, despite concerns regarding margins and the bottom line. For fiscal 2022, DLTR expects consolidated net sales of $27.85-$28.10 billion compared with the $27.76-$28.14 billion mentioned earlier.
Dollar Tree anticipates higher comps growth in fiscal 2022 to be offset by slightly reduced square footage growth compared with the prior view. DLTR anticipates enterprise comps growth of mid-single digits for fiscal 2022, including a high-single-digit increase in the Dollar Tree segment and positive comps in the Family Dollar segment.
DLTR has an Earnings ESP of +6.57%. It has an expected earnings growth rate of 25.5% for the current year (ending January 2023). The Zacks Consensus Estimate for current-year earnings improved 0.1% over the last 30 days.
Dollar Tree recorded earnings surprises in the last four reported quarters, with an average beat of 8.6%. The company is set to release earnings results on Nov 22, before the opening bell.
Stay on top of upcoming earnings announcements with the Zacks Earnings Calendar.

Zacks Names ""Single Best Pick to Double""
From thousands of stocks, 5 Zacks experts each have chosen their favorite to skyrocket +100% or more in months to come. From those 5, Director of Research Sheraz Mian hand-picks one to have the most explosive upside of all.
It’s a little-known chemical company that’s up 65% over last year, yet still dirt cheap. With unrelenting demand, soaring 2022 earnings estimates, and $1.5 billion for repurchasing shares, retail investors could jump in at any time.
This company could rival or surpass other recent Zacks’ Stocks Set to Double like Boston Beer Company which shot up +143.0% in little more than 9 months and NVIDIA which boomed +175.9% in one year.
Free: See Our Top Stock and 4 Runners Up >>

Want the latest recommendations from Zacks Investment Research? Today, you can download 7 Best Stocks for the Next 30 Days. Click to get this free report
 
Macy's, Inc. (M): Free Stock Analysis Report
 
The TJX Companies, Inc. (TJX): Free Stock Analysis Report
 
Dollar Tree, Inc. (DLTR): Free Stock Analysis Report
 
Ross Stores, Inc. (ROST): Free Stock Analysis Report
 
Bath & Body Works, Inc. (BBWI): Free Stock Analysis Report
 
To read this article on Zacks.com click here.
 
Zacks Investment Research
The views and opinions expressed herein are the views and opinions of the author and do not necessarily reflect those of Nasdaq, Inc.","These companies are - The TJX Companies Inc. TJX, Macy's Inc. M, Ross Stores Inc. ROST, Dollar Tree Inc. DLTR and Bath & Body Works Inc. BBWI. For fiscal 2022, DLTR expects consolidated net sales of $27.85-$28.10 billion compared with the $27.76-$28.14 billion mentioned earlier. DLTR anticipates enterprise comps growth of mid-single digits for fiscal 2022, including a high-single-digit increase in the Dollar Tree segment and positive comps in the Family Dollar segment.","These companies are - The TJX Companies Inc. TJX, Macy's Inc. M, Ross Stores Inc. ROST, Dollar Tree Inc. DLTR and Bath & Body Works Inc. BBWI. For fiscal 2022, DLTR expects consolidated net sales of $27.85-$28.10 billion compared with the $27.76-$28.14 billion mentioned earlier. DLTR anticipates enterprise comps growth of mid-single digits for fiscal 2022, including a high-single-digit increase in the Dollar Tree segment and positive comps in the Family Dollar segment.","These companies are - The TJX Companies Inc. TJX, Macy's Inc. M, Ross Stores Inc. ROST, Dollar Tree Inc. DLTR and Bath & Body Works Inc. BBWI. For fiscal 2022, DLTR expects consolidated net sales of $27.85-$28.10 billion compared with the $27.76-$28.14 billion mentioned earlier. DLTR anticipates enterprise comps growth of mid-single digits for fiscal 2022, including a high-single-digit increase in the Dollar Tree segment and positive comps in the Family Dollar segment.","These companies are - The TJX Companies Inc. TJX, Macy's Inc. M, Ross Stores Inc. ROST, Dollar Tree Inc. DLTR and Bath & Body Works Inc. BBWI. For fiscal 2022, DLTR expects consolidated net sales of $27.85-$28.10 billion compared with the $27.76-$28.14 billion mentioned earlier. DLTR anticipates enterprise comps growth of mid-single digits for fiscal 2022, including a high-single-digit increase in the Dollar Tree segment and positive comps in the Family Dollar segment.",2022,4
