Date,Article_title,Stock_symbol,Url,Publisher,Author,Article,Lsa_summary,Luhn_summary,Textrank_summary,Lexrank_summary,Year,sentiment_score
2022-03-18 00:00:00+00:00,The Smartest People on Wall Street Love This Stock,EBAY,https://www.nasdaq.com/articles/the-smartest-people-on-wall-street-love-this-stock,,,"When it comes to investing, one great thing you can do is learn from the professionals. One way you can do this is by seeing what the smart money is doing through their Form 13F filings.
The Securities and Exchange Commission requires 13F filings for an institutional investment manager with more than $100 million in qualifying securities. These filings are required quarterly and within 45 days of the end of the quarter.
These disclosures can give investors good insight into how the best minds on Wall Street are positioning their investment portfolios. One stock that major funds have been adding hand over fist is PayPal (NASDAQ: PYPL).
These two firms added millions of shares of PayPal in the quarter
During the fourth quarter, Two Sigma Advisers added 1.5 million shares of PayPal, while Clearbridge Investments added 2.6 million shares.
PayPal got beaten up since peaking at about $310 per share in February 2021, when its price-to-earnings ratio (P/E) was 86. By the end of 2021, it was down to $190 per share -- a price point that became attractive enough for Clearbridge to build a position, with the firm saying:
Long-term growth drivers remain intact, and it has increased innovation at both Venmo and core PayPal, adding new experiences around shopping and investing that we expect to positively contribute to growth in users and average revenue per user over the next five years.
Image source: Getty Images.
This is what caused the sell-off
Since the fourth-quarter report, PayPal has continued to sell off and now trades at about $110 per share. Investors had a couple of concerns in the past year. Among the biggest was that PayPal and eBay had begun the planned decoupling of their businesses, impacting PayPal's top-line growth.
According to PayPal, this decoupling took $1.4 billion off the top line, reducing growth by 7% in 2021. The separation will continue to be a headwind for the business this year, putting another $600 million of pressure on the top line. However, these headwinds will taper off, with eBay representing only 3% of its revenue and total payment volume (TPV) at the end of last year.
Investors, meanwhile, have a wary eye on inflationary pressures, which could pressure consumer spending. In 2021, consumer spending ended on a weak note, down 0.6%, while retail sales closed out down 2.5%. As a result, PayPal management was more conservative with its growth expectations, projecting revenue growth of 15% to 17% this year, down from its previous estimate of 18%.
PayPal continues to be a force in digital payments, and it's cheap
PayPal's price-to-earnings (P/E) ratio has come way down to about 31, and its forward P/E is even lower at 24, making it the cheapest it's been since being spun off from eBay. At prices like this, PayPal stock looks very appealing. Last year was still one of PayPal's best years in its history, as it surpassed $1 trillion in TPV which helped revenue increase 18% to $25.4 billion.
PYPL PE Ratio data by YCharts.
The company continues to grow its business. In recent years, it has expanded into allowing customers to buy cryptocurrencies, cash checks, and use ""buy now, pay later"" options. It also holds the spot as the most accepted digital wallet, with 76% of major retailers accepting PayPal, compared with Apple Pay's 27%, Affirm's 9%, and Afterpay's 6%.
PayPal will also shift its attention from adding customers to increasing customer engagement this year. Unlike subscription revenue models like Netflix, PayPal makes money when customers use the app. The company found that a third of its customers drove most of the spending volume. This shift in focus should help revenue continue to grow at management's 15% to 17% target.
Given PayPal's cheap valuation, strong projected growth, and continued dominance in digital payments, it's no wonder the smartest on Wall Street are buying the stock.
10 stocks we like better than PayPal Holdings
When our award-winning analyst team has a stock tip, it can pay to listen. After all, the newsletter they have run for over a decade, Motley Fool Stock Advisor, has tripled the market.*
They just revealed what they believe are the ten best stocks for investors to buy right now... and PayPal Holdings wasn't one of them! That's right -- they think these 10 stocks are even better buys.
See the 10 stocks
*Stock Advisor returns as of March 3, 2022
Courtney Carlsen has no position in any of the stocks mentioned. The Motley Fool owns and recommends PayPal Holdings. The Motley Fool recommends eBay and recommends the following options: short April 2022 $62.50 calls on eBay. The Motley Fool has a disclosure policy.
The views and opinions expressed herein are the views and opinions of the author and do not necessarily reflect those of Nasdaq, Inc.","However, these headwinds will taper off, with eBay representing only 3% of its revenue and total payment volume (TPV) at the end of last year. Among the biggest was that PayPal and eBay had begun the planned decoupling of their businesses, impacting PayPal's top-line growth. PayPal continues to be a force in digital payments, and it's cheap PayPal's price-to-earnings (P/E) ratio has come way down to about 31, and its forward P/E is even lower at 24, making it the cheapest it's been since being spun off from eBay.","PayPal continues to be a force in digital payments, and it's cheap PayPal's price-to-earnings (P/E) ratio has come way down to about 31, and its forward P/E is even lower at 24, making it the cheapest it's been since being spun off from eBay. Among the biggest was that PayPal and eBay had begun the planned decoupling of their businesses, impacting PayPal's top-line growth. However, these headwinds will taper off, with eBay representing only 3% of its revenue and total payment volume (TPV) at the end of last year.","PayPal continues to be a force in digital payments, and it's cheap PayPal's price-to-earnings (P/E) ratio has come way down to about 31, and its forward P/E is even lower at 24, making it the cheapest it's been since being spun off from eBay. Among the biggest was that PayPal and eBay had begun the planned decoupling of their businesses, impacting PayPal's top-line growth. However, these headwinds will taper off, with eBay representing only 3% of its revenue and total payment volume (TPV) at the end of last year.","Among the biggest was that PayPal and eBay had begun the planned decoupling of their businesses, impacting PayPal's top-line growth. However, these headwinds will taper off, with eBay representing only 3% of its revenue and total payment volume (TPV) at the end of last year. PayPal continues to be a force in digital payments, and it's cheap PayPal's price-to-earnings (P/E) ratio has come way down to about 31, and its forward P/E is even lower at 24, making it the cheapest it's been since being spun off from eBay.",2022,2
2022-03-18 00:00:00+00:00,Shopify Stock: Bear vs. Bull,EBAY,https://www.nasdaq.com/articles/shopify-stock%3A-bear-vs.-bull-0,,,"E-commerce enabler Shopify (NYSE: SHOP) surged at the pandemic onset as consumers shifted the majority of their spending online. Suddenly an online presence was vital for businesses while they were forced to shut their doors to in-person shoppers temporarily.
Now pandemic restrictions in many places have all but dropped, and folks are reducing online spending and visiting stores in person again. What's more, supply chain disruptions during the pandemic highlighted the limits of online shopping.
Regardless of which side of the fence you're on, it helps to consider the bull and bear cases on an investment.
Image source: Getty Images.
The bull case
Even before the onset of the pandemic, consumers were allocating more of their spending online. The convenience advantages over brick and mortar stores are several, including the fact that online stores are open 24/7, they ship to your doorstep, and they offer a more comprehensive selection, to name a few.
From the first quarter of 2010 to the first quarter of 2020 (before the outbreak), e-commerce sales as a portion of all retail sales increased from 4.2% to 11.5% in the U.S. That figure surged to 15.7% at the height of the pandemic before falling to 13% as of Q3 2021. And according to Statista, e-commerce spending will grow to $1.3 trillion in the U.S. in 2025, up from $767 billion in 2021.
Shopify's sales rose along with the growth in e-commerce spending. From 2012 to 2021, Shopify's revenue exploded from $24 million to $4.6 billion. If consumers are moving online, then businesses need to move online. Otherwise, they will lose sales to competitors.
Shopify helps entrepreneurs and even larger brands establish an online presence. It's no surprise, then, that its revenue has increased along with the growth of online spending. And perhaps more impressively, Shopify's revenue grew by 57% year over year in 2021 with the tailwinds from the pandemic receding.
And despite its rapid growth in the last decade, the company has room to go further. Management is working on several initiatives to keep the momentum going, including international expansion, supplying capital to client businesses, retail point of sale systems, and a fulfillment network. These excellent prospects may be why analysts expect Shopify to grow earnings per share at a compound annual rate of 38% over the next five years.
The bear argument
The bears likely concede that Shopify is a phenomenal growth stock. They will even grant that secular tailwinds, including e-commerce growth, are in its favor. But the bear argument centers around valuation. Shopify stock is not cheap. As of this writing, it is selling at price-to-sales (P/S) and price-to-free-cash-flow ratios of 17 and 178, respectively.
SHOP PS Ratio data by YCharts
Rival e-commerce platforms eBay and Amazon are trading at fraction of the price-to-sales ratios, at 3.4. Admittedly, Shopify is growing faster than the aforementioned and deserves a premium valuation. As mentioned earlier, Shopify is expected to grow earnings at a 38% rate over the next five years, while the same rates for eBay and Amazon are expected at 12.5% and 34.8% respectively.
But the bears will say a nearly 5X multiple is pushing it too far (see chart). The disparity has already been correcting itself, as Shopify's P/S ratio has fallen to 17 from a peak of over 60 reached several times in 2020 and 2021.
Shopify's stock is down 55% so far in 2022 as the bears have had the upper hand. However, it appears that the market has overcorrected. Shopify is now trading at the lowest P/S ratio in three years. What's more, it's selling at a lower price than it did before the outbreak. Since then, Shopify has signed up plenty of new customers who are unlikely to shut down their online businesses even after a pandemic.
Find out why Shopify is one of the 10 best stocks to buy now
Our award-winning analyst team has spent more than a decade beating the market. After all, the newsletter they have run for over a decade, Motley Fool Stock Advisor, has tripled the market.*
They just revealed their ten top stock picks for investors to buy right now. Shopify is on the list -- but there are nine others you may be overlooking.
Click here to get access to the full list!
*Stock Advisor returns as of March 3, 2022
John Mackey, CEO of Whole Foods Market, an Amazon subsidiary, is a member of The Motley Fool's board of directors. Parkev Tatevosian owns Amazon. The Motley Fool owns and recommends Amazon and Shopify. The Motley Fool recommends eBay and recommends the following options: long January 2023 $1,140 calls on Shopify, short April 2022 $62.50 calls on eBay, and short January 2023 $1,160 calls on Shopify. The Motley Fool has a disclosure policy.
The views and opinions expressed herein are the views and opinions of the author and do not necessarily reflect those of Nasdaq, Inc.","SHOP PS Ratio data by YCharts Rival e-commerce platforms eBay and Amazon are trading at fraction of the price-to-sales ratios, at 3.4. As mentioned earlier, Shopify is expected to grow earnings at a 38% rate over the next five years, while the same rates for eBay and Amazon are expected at 12.5% and 34.8% respectively. The Motley Fool recommends eBay and recommends the following options: long January 2023 $1,140 calls on Shopify, short April 2022 $62.50 calls on eBay, and short January 2023 $1,160 calls on Shopify.","The Motley Fool recommends eBay and recommends the following options: long January 2023 $1,140 calls on Shopify, short April 2022 $62.50 calls on eBay, and short January 2023 $1,160 calls on Shopify. SHOP PS Ratio data by YCharts Rival e-commerce platforms eBay and Amazon are trading at fraction of the price-to-sales ratios, at 3.4. As mentioned earlier, Shopify is expected to grow earnings at a 38% rate over the next five years, while the same rates for eBay and Amazon are expected at 12.5% and 34.8% respectively.","The Motley Fool recommends eBay and recommends the following options: long January 2023 $1,140 calls on Shopify, short April 2022 $62.50 calls on eBay, and short January 2023 $1,160 calls on Shopify. SHOP PS Ratio data by YCharts Rival e-commerce platforms eBay and Amazon are trading at fraction of the price-to-sales ratios, at 3.4. As mentioned earlier, Shopify is expected to grow earnings at a 38% rate over the next five years, while the same rates for eBay and Amazon are expected at 12.5% and 34.8% respectively.","SHOP PS Ratio data by YCharts Rival e-commerce platforms eBay and Amazon are trading at fraction of the price-to-sales ratios, at 3.4. As mentioned earlier, Shopify is expected to grow earnings at a 38% rate over the next five years, while the same rates for eBay and Amazon are expected at 12.5% and 34.8% respectively. The Motley Fool recommends eBay and recommends the following options: long January 2023 $1,140 calls on Shopify, short April 2022 $62.50 calls on eBay, and short January 2023 $1,160 calls on Shopify.",2022,2
2022-03-17 00:00:00+00:00,2 Metaverse Stocks to Buy if the Market Crashes Further,EBAY,https://www.nasdaq.com/articles/2-metaverse-stocks-to-buy-if-the-market-crashes-further,,,"The stock market correction has turned ugly lately. What started with high-growth tech stocks has now escalated to include most companies amid deepened geopolitical tensions, growing inflation risks, and more.
While unpleasant, a market correction is also an opportunity for long-term investors to buy stocks in good companies with strong tailwinds. One way to do this is to invest in the leading companies in the emerging metaverse. Let's take a look at two companies that are likely winners in the virtual worlds of the metaverse.
Image source: Getty Images.
Roblox (NYSE: RBLX)
Nowadays, having a conversation about the metaverse usually begins with Roblox. It is one of the first companies to foray into the metaverse and has been one of the most successful. Just ask any youngster in the U.S., Europe, and other parts of the world about Roblox, and they will give you an elaborate explanation of its platform and the popular games on it.
The popularity of the Roblox platform is also evident in its numbers. Daily active users (DAUs) more than tripled from 15.8 million in the first quarter of 2019 to 49.5 million in the fourth quarter of 2021. Similarly, bookings surged more than fivefold from $142 million to $770 million during the same period thanks to an increase in DAUs and higher spending per user. In addition, the company has delivered positive operating cash flow in each of the last 12 quarters.
Roblox had some great runs in the past. But can it continue to grow in the future? I think so. For starters, the metaverse is here to stay. Technologies like virtual reality and augmented reality are becoming more mature. Improvement in supporting infrastructures like 5G connectivity, high-performance chips, and low-cost computing will help power the metaverse into the future.
Besides, major tech companies like Meta Platforms, Microsoft, and Alphabet are investing heavily in this emerging industry. So it's hard to imagine it not taking off. Even JPMorgan expects the industry to create a trillion-dollar yearly revenue stream.
As the top dog, Roblox already has a head start with around 50 million DAUs as of Dec 2021. Moreover, it has a community of loyal developers who have been growing with the company. By building better games, these developers will help Roblox attract new users and retain existing ones. A growing user base, in turn, motivates game developers to invest even more in building quality games.
Bottom line: I think Roblox can sustain its flywheel of growing user base and innovative games. And as the metaverse industry develops, the gaming company is well-positioned to benefit from potential new-use cases in areas like education, e-commerce, advertising, and others. It is not a company to miss if you want to ride the metaverse wave.
Unity Software
Unity Software is a game-development platform that enables game creators to create and run interactive and real-time 2D and 3D content on almost any platform, including virtual reality and augmented reality devices.
While Unity provides a suite of tools, its most important feature is its game engine. Think of it as software to build games. With Unity's game engine, developers can now create their games at a low cost and with a short development cycle. Unity also enables developers to operate their games on its platform through hosting, customer management, and monetization.
Game developers are pretty much locked into Unity's ecosystem, making it very difficult for them to switch providers. Even if they do switch, the other choice is Unreal Engine. That probably explains Unity's high net-retention rate of 140% in December 2021, up from 138% in 2020.
With a sticky customer base within a limited market, Unity is well-positioned as game developers move toward the metaverse. After all, developers are already familiar with Unity, which understands their needs. Unity just has to sustain its innovation around these needs.
On top of that, Unity is leveraging its software capabilities to develop strategic partnerships with companies beyond the gaming industry. For example, the software provider partnered with Hyundai Motor to improve the efficiency and productivity of the manufacturing process. It also worked with eBay so that sellers can offer customers an interactive, 360-degree view of the items for sale.
In short, Unity has strategically positioned itself to prosper in the growing metaverse. And if investors have an opportunity to buy the stock on the dip (during a market crash, for example), they should grab it.
10 stocks we like better than Roblox Corporation
When our award-winning analyst team has a stock tip, it can pay to listen. After all, the newsletter they have run for over a decade, Motley Fool Stock Advisor, has tripled the market.*
They just revealed what they believe are the ten best stocks for investors to buy right now... and Roblox Corporation wasn't one of them! That's right -- they think these 10 stocks are even better buys.
See the 10 stocks
*Stock Advisor returns as of March 3, 2022
JPMorgan Chase is an advertising partner of The Ascent, a Motley Fool company. Suzanne Frey, an executive at Alphabet, is a member of The Motley Fool's board of directors. Randi Zuckerberg, a former director of market development and spokeswoman for Facebook and sister to Meta Platforms CEO Mark Zuckerberg, is a member of The Motley Fool's board of directors. Lawrence Nga has no position in any of the stocks mentioned. The Motley Fool owns and recommends Alphabet (A shares), Meta Platforms, Inc., Microsoft, Roblox Corporation, and Unity Software Inc. The Motley Fool recommends Alphabet (C shares) and eBay and recommends the following options: short April 2022 $62.50 calls on eBay. The Motley Fool has a disclosure policy.
The views and opinions expressed herein are the views and opinions of the author and do not necessarily reflect those of Nasdaq, Inc.","It also worked with eBay so that sellers can offer customers an interactive, 360-degree view of the items for sale. The Motley Fool recommends Alphabet (C shares) and eBay and recommends the following options: short April 2022 $62.50 calls on eBay. What started with high-growth tech stocks has now escalated to include most companies amid deepened geopolitical tensions, growing inflation risks, and more.","It also worked with eBay so that sellers can offer customers an interactive, 360-degree view of the items for sale. The Motley Fool recommends Alphabet (C shares) and eBay and recommends the following options: short April 2022 $62.50 calls on eBay. Besides, major tech companies like Meta Platforms, Microsoft, and Alphabet are investing heavily in this emerging industry.","It also worked with eBay so that sellers can offer customers an interactive, 360-degree view of the items for sale. The Motley Fool recommends Alphabet (C shares) and eBay and recommends the following options: short April 2022 $62.50 calls on eBay. Unity Software Unity Software is a game-development platform that enables game creators to create and run interactive and real-time 2D and 3D content on almost any platform, including virtual reality and augmented reality devices.","It also worked with eBay so that sellers can offer customers an interactive, 360-degree view of the items for sale. The Motley Fool recommends Alphabet (C shares) and eBay and recommends the following options: short April 2022 $62.50 calls on eBay. With Unity's game engine, developers can now create their games at a low cost and with a short development cycle.",2022,3
