Date,Article_title,Stock_symbol,Url,Publisher,Author,Article,Lsa_summary,Luhn_summary,Textrank_summary,Lexrank_summary,Year,sentiment_score
2022-11-15 00:00:00+00:00,"Zacks Industry Outlook Highlights Costco Wholesale, Target, Dollar General and Dollar Tree",DLTR,https://www.nasdaq.com/articles/zacks-industry-outlook-highlights-costco-wholesale-target-dollar-general-and-dollar-tree-0,,,"For Immediate Release
Chicago, IL – November 15, 2022 – Today, Zacks Equity Research discusses Costco Wholesale Corp. COST, Target Corp. TGT, Dollar General Corp. DG and Dollar Tree, Inc. DLTR.
Industry: Retail - Discount Stores
Link: https://www.zacks.com/commentary/2017812/4-stocks-to-watch-as-inflation-hit-consumers-turn-to-discount-stores
A strengthening labor market and strategic endeavors undertaken at company levels are working in tandem for the Zacks Retail – Discount Stores industry. Moreover, the strategy to sell products at discounted rates has helped industry players draw customers who are currently feeling the pinch of rising prices. People’s search for cheaper alternatives, be it essentials or other consumer goods, has been a tailwind for discount stores.
Meanwhile, industry participants have been focusing on deepening engagements with consumers, adding more compelling products, and enhancing digital and data analytics capabilities. Inventory management, supply-chain enhancement, cost-structure realignment and investment to accelerate digitization have been working in favor of companies like Costco Wholesale Corp., Target Corp., Dollar General Corp. and Dollar Tree, Inc.
About the Industry
The Zacks Retail - Discount Stores industry comprises companies that offer apparel, accessories, footwear, beauty products, personal and baby care products, cleaning products, pet supplies, and food and beverage products at lower prices than traditional retail outlets. The industry participants also provide home textiles, home furnishings, housewares, arts and crafts supplies, toys, and seasonal décor products.
These companies sell their products through stores, digital channels, or both. Some industry players operate membership shopping warehouse clubs, offering branded and private-label products in a range of merchandise categories. Most discount stores are gradually emerging as one-stop shopping destinations. The profitability of players depends on a prudent pricing model, a well-organized supply chain and an effective merchandising strategy.
3 Key Industry Trends to Watch
Consumers Seek Better Bargains Amid Inflation: The strategy to sell products at discounted prices has helped industry players draw customers who have been seeking both value and convenience amid rising prices. Under the current circumstances, people in the low-to-middle income groups have been showing a preference for discount stores to get quality products at reasonable prices.
Industry participants have been focusing on deepening engagements with consumers, creating innovative and compelling products, and enhancing digital and data analytics capabilities. Clearly, companies are leaving no stone unturned to tap any surge in demand.
Digitization is Key to Growth: With the change in consumer shopping patterns, industry participants have been evolving to play dual in-store and online roles. Initiatives such as building omni-channel, coming up with loyalty and marketing programs, enhancing the supply chain and providing faster delivery options, be it doorstep delivery, curbside pickup or buy online and pick up at store are worth mentioning.
Simultaneously, companies are investing in renovation, improved checkouts and mobile point-of-sale capabilities to keep stores relevant. Keeping in mind consumers’ product preferences and growing inclination toward online shopping, retailers have been replenishing shelves with in-demand merchandise and ramping up investments in digitization.
Pressure on Margins to Linger: Companies in the industry are vying for a bigger share on attributes such as price, products and speed to market. Further, the increasing dominance of e-commerce players has made the retail-discount space highly competitive. This has compelled a number of players to strengthen their digital ecosystem and boost shipping and delivery capabilities. While these endeavors drive sales, they entail high costs.
Apart from these, higher marketing, advertising and other store-related expenses might compress margins. Of late, the industry participants have been dealing with product cost inflation, tight labor market and supply-chain headwinds. Nonetheless, companies have been focusing on undertaking initiatives to mitigate cost-related challenges. These include streamlining operational structures, optimizing supply networks as well as adopting effective pricing policies.
Zacks Industry Rank Indicates Bright Prospects
The Zacks Retail – Discount Stores industry is housed within the broader Zacks Retail – Wholesale sector. The industry currently carries a Zacks Industry Rank #94, which places it in the top 37% of more than 250 Zacks industries.
The group’s Zacks Industry Rank, which is basically the average of the Zacks Rank of all the member stocks, indicates encouraging near-term prospects. Our research shows that the top 50% of the Zacks-ranked industries outperforms the bottom 50% by a factor of more than 2 to 1.
The industry’s position in the top 50% of the Zacks-ranked industries is a result of positive earnings outlook for the constituent companies in aggregate. Looking at the aggregate earnings estimate revisions, it appears that analysts are gaining confidence in this group’s earnings growth potential. Since the beginning of September 2022, the industry’s bottom-line estimate for the current financial year has jumped 3%.
Before we present a few stocks that you may want to consider for your portfolio, let’s take a look at the industry’s recent stock-market performance and valuation picture.
Industry vs. Broader Market
The Zacks Retail – Discount Stores industry has outpaced the broader Retail – Wholesale sector and the Zacks S&P 500 composite over the past year.
Stocks in this industry have collectively fallen 6.6% compared with the Zacks S&P 500 Composite’s decline of 16.3%. Meanwhile, the Zacks Retail – Wholesale sector has declined 30.1% in the said time frame.
Industry's Current Valuation
On the basis of the forward 12-month price-to-earnings (P/E) ratio, which is commonly used for valuing retail stocks, the industry is currently trading at 23.43 compared with the S&P 500’s 17.65 and the sector’s 21.59.
Over the last five years, the industry has traded as high as 29.98X and as low as 18.04X, with the median being at 23.14X.
4 Retail Discount Stores Stocks to Keep a Close Eye On
Costco: This Issaquah, WA-based company’s growth strategies, better price management, decent membership trends and increasing penetration of e-commerce business have been contributing to its performance. Cumulatively, these factors have been aiding this operator of membership warehouses in registering an impressive comparable sales run. Costco has been rapidly adopting the omni-channel mantra to provide a seamless shopping experience, whether online or in stores.
Costco has a trailing four-quarter earnings surprise of 7.7%, on average. It has an estimated long-term earnings growth rate of 10.3%. The Zacks Consensus Estimate for current financial-year revenues and EPS suggests growth of 8.3% and 10%, respectively, from the year-ago reported figure. Notably, shares of this Zacks Rank #3 (Hold) company have fallen 0.8% in the past year. You can see the complete list of today’s Zacks #1 Rank (Strong Buy) stocks here.
Target: This Minneapolis, MN-based company has been making multiple changes to its business model to adapt and stay relevant in the dynamic retail landscape. Target has been deploying resources to enhance omni-channel capabilities, come up with new brands, refurbish stores and expand same-day delivery options to provide customers seamless shopping experience. These have been contributing to the top line.
Impressively, Target has an estimated long-term earnings growth rate of 9.9%. The Zacks Consensus Estimate for current financial-year revenues suggests growth of 3.6% from the year-ago reported figure. We note that shares of this Zacks Rank #3 company have fallen 34.4% in the past year.
Dollar General: Better pricing, private label offerings, effective inventory management and merchandise initiatives have been aiding this Goodlettsville, TN-based company’s performance. These, along with a focus on consumable and non-consumable categories, are noteworthy. Dollar General has been offering “better-for-you” products at affordable prices. Additionally, it has been expanding cooler facilities to drive the sale of perishable items. The company’s initiatives such as DG Fresh, Fast Track and digitization should drive same-store sales.
Dollar General has a trailing four-quarter earnings surprise of 2.2%, on average. It has an estimated long-term earnings growth rate of 10.9%. The Zacks Consensus Estimate for current financial-year revenues and EPS suggests growth of 10.7% and 13.8%, respectively, from the year-ago reported figure. Shares of this Zacks Rank #3 company have advanced 9.8% in the past year.
Dollar Tree: This Chesapeake, VA-based company’s strategic initiatives, including the expansion of $3 and $5 Plus assortment in Dollar Tree stores, as well as Combo Stores and H2 Renovations at Family Dollar, provide tremendous opportunities to drive sales and traffic.
Impressively, Dollar Tree has a trailing four-quarter earnings surprise of 8.6%, on average. It has an estimated long-term earnings growth rate of 15.9%. The Zacks Consensus Estimate for current financial-year revenues and EPS suggests growth of 6.5% and 25.5%, respectively, from the year-ago reported figure. We note that shares of this Zacks Rank #3 company have rallied 28.2% in the past year.
Why Haven’t You Looked at Zacks' Top Stocks?
Our 5 best-performing strategies have blown away the S&P's impressive +28.8% gain in 2021. Amazingly, they soared +40.3%, +48.2%, +67.6%, +94.4%, and +95.3%. Today you can access their live picks without cost or obligation.
See Stocks Free >>
Join us on Facebook: https://www.facebook.com/ZacksInvestmentResearch/
Zacks Investment Research is under common control with affiliated entities (including a broker-dealer and an investment adviser), which may engage in transactions involving the foregoing securities for the clients of such affiliates.
Media Contact
Zacks Investment Research
800-767-3771 ext. 9339
support@zacks.com
https://www.zacks.com
Past performance is no guarantee of future results. Inherent in any investment is the potential for loss. This material is being provided for informational purposes only and nothing herein constitutes investment, legal, accounting or tax advice, or a recommendation to buy, sell or hold a security. No recommendation or advice is being given as to whether any investment is suitable for a particular investor. It should not be assumed that any investments in securities, companies, sectors or markets identified and described were or will be profitable. All information is current as of the date of herein and is subject to change without notice. Any views or opinions expressed may not reflect those of the firm as a whole. Zacks Investment Research does not engage in investment banking, market making or asset management activities of any securities. These returns are from hypothetical portfolios consisting of stocks with Zacks Rank = 1 that were rebalanced monthly with zero transaction costs. These are not the returns of actual portfolios of stocks. The S&P 500 is an unmanaged index. Visit https://www.zacks.com/performance for information about the performance numbers displayed in this press release.

Zacks Names ""Single Best Pick to Double""
From thousands of stocks, 5 Zacks experts each have chosen their favorite to skyrocket +100% or more in months to come. From those 5, Director of Research Sheraz Mian hand-picks one to have the most explosive upside of all.
It’s a little-known chemical company that’s up 65% over last year, yet still dirt cheap. With unrelenting demand, soaring 2022 earnings estimates, and $1.5 billion for repurchasing shares, retail investors could jump in at any time.
This company could rival or surpass other recent Zacks’ Stocks Set to Double like Boston Beer Company which shot up +143.0% in little more than 9 months and NVIDIA which boomed +175.9% in one year.
Free: See Our Top Stock and 4 Runners Up >>

Want the latest recommendations from Zacks Investment Research? Today, you can download 7 Best Stocks for the Next 30 Days. Click to get this free report
 
Target Corporation (TGT): Free Stock Analysis Report
 
Dollar General Corporation (DG): Free Stock Analysis Report
 
Dollar Tree, Inc. (DLTR): Free Stock Analysis Report
 
Costco Wholesale Corporation (COST): Free Stock Analysis Report
 
To read this article on Zacks.com click here.
 
Zacks Investment Research
The views and opinions expressed herein are the views and opinions of the author and do not necessarily reflect those of Nasdaq, Inc.","COST, Target Corp. TGT, Dollar General Corp. DG and Dollar Tree, Inc. DLTR. Dollar Tree, Inc. (DLTR): Free Stock Analysis Report Keeping in mind consumers’ product preferences and growing inclination toward online shopping, retailers have been replenishing shelves with in-demand merchandise and ramping up investments in digitization.","COST, Target Corp. TGT, Dollar General Corp. DG and Dollar Tree, Inc. DLTR. Dollar Tree, Inc. (DLTR): Free Stock Analysis Report Inventory management, supply-chain enhancement, cost-structure realignment and investment to accelerate digitization have been working in favor of companies like Costco Wholesale Corp., Target Corp., Dollar General Corp. and Dollar Tree, Inc. About the Industry The Zacks Retail - Discount Stores industry comprises companies that offer apparel, accessories, footwear, beauty products, personal and baby care products, cleaning products, pet supplies, and food and beverage products at lower prices than traditional retail outlets.","COST, Target Corp. TGT, Dollar General Corp. DG and Dollar Tree, Inc. DLTR. Dollar Tree, Inc. (DLTR): Free Stock Analysis Report Industry: Retail - Discount Stores Link: https://www.zacks.com/commentary/2017812/4-stocks-to-watch-as-inflation-hit-consumers-turn-to-discount-stores A strengthening labor market and strategic endeavors undertaken at company levels are working in tandem for the Zacks Retail – Discount Stores industry.","COST, Target Corp. TGT, Dollar General Corp. DG and Dollar Tree, Inc. DLTR. Dollar Tree, Inc. (DLTR): Free Stock Analysis Report Inventory management, supply-chain enhancement, cost-structure realignment and investment to accelerate digitization have been working in favor of companies like Costco Wholesale Corp., Target Corp., Dollar General Corp. and Dollar Tree, Inc. About the Industry The Zacks Retail - Discount Stores industry comprises companies that offer apparel, accessories, footwear, beauty products, personal and baby care products, cleaning products, pet supplies, and food and beverage products at lower prices than traditional retail outlets.",2022,3
2022-11-14 00:00:00+00:00,Dollar Tree (DLTR) Stock Moves -0.67%: What You Should Know,DLTR,https://www.nasdaq.com/articles/dollar-tree-dltr-stock-moves-0.67%3A-what-you-should-know,,,"Dollar Tree (DLTR) closed the most recent trading day at $164.50, moving -0.67% from the previous trading session. This move was narrower than the S&P 500's daily loss of 0.89%. Meanwhile, the Dow lost 0.63%, and the Nasdaq, a tech-heavy index, lost 0.24%.
Coming into today, shares of the discount retailer had gained 21.7% in the past month. In that same time, the Retail-Wholesale sector gained 4.27%, while the S&P 500 gained 11.42%.
Wall Street will be looking for positivity from Dollar Tree as it approaches its next earnings report date. This is expected to be November 22, 2022. In that report, analysts expect Dollar Tree to post earnings of $1.16 per share. This would mark year-over-year growth of 20.83%. Meanwhile, our latest consensus estimate is calling for revenue of $6.83 billion, up 6.5% from the prior-year quarter.
Looking at the full year, our Zacks Consensus Estimates suggest analysts are expecting earnings of $7.28 per share and revenue of $28.02 billion. These totals would mark changes of +25.52% and +6.47%, respectively, from last year.
Investors should also note any recent changes to analyst estimates for Dollar Tree. These recent revisions tend to reflect the evolving nature of short-term business trends. As such, positive estimate revisions reflect analyst optimism about the company's business and profitability.
Based on our research, we believe these estimate revisions are directly related to near-team stock moves. Investors can capitalize on this by using the Zacks Rank. This model considers these estimate changes and provides a simple, actionable rating system.
The Zacks Rank system ranges from #1 (Strong Buy) to #5 (Strong Sell). It has a remarkable, outside-audited track record of success, with #1 stocks delivering an average annual return of +25% since 1988. Over the past month, the Zacks Consensus EPS estimate has moved 0.06% higher. Dollar Tree currently has a Zacks Rank of #3 (Hold).
Digging into valuation, Dollar Tree currently has a Forward P/E ratio of 22.75. For comparison, its industry has an average Forward P/E of 23.75, which means Dollar Tree is trading at a discount to the group.
We can also see that DLTR currently has a PEG ratio of 1.44. This popular metric is similar to the widely-known P/E ratio, with the difference being that the PEG ratio also takes into account the company's expected earnings growth rate. The Retail - Discount Stores industry currently had an average PEG ratio of 2.22 as of yesterday's close.
The Retail - Discount Stores industry is part of the Retail-Wholesale sector. This industry currently has a Zacks Industry Rank of 94, which puts it in the top 38% of all 250+ industries.
The Zacks Industry Rank gauges the strength of our industry groups by measuring the average Zacks Rank of the individual stocks within the groups. Our research shows that the top 50% rated industries outperform the bottom half by a factor of 2 to 1.
Make sure to utilize Zacks.com to follow all of these stock-moving metrics, and more, in the coming trading sessions.

Just Released: Free Report Reveals Little-Known Strategies to Help Profit from the  $30 Trillion Metaverse Boom
It's undeniable. The metaverse is gaining steam every day. Just follow the money. Google. Microsoft. Adobe. Nike. Facebook even rebranded itself as Meta because Mark Zuckerberg believes the metaverse is the next iteration of the internet. The inevitable result? Many investors will get rich as the metaverse evolves. What do they know that you don't? They’re aware of the companies best poised to grow as the metaverse does. And in a new FREE report, Zacks is revealing those stocks to you. This week, you can download, The Metaverse - What is it? And How to Profit with These 5 Pioneering Stocks. It reveals specific stocks set to skyrocket as this emerging technology develops and expands. Don't miss your chance to access it for free with no obligation.
>>Show me how I could profit from the metaverse!

Want the latest recommendations from Zacks Investment Research? Today, you can download 7 Best Stocks for the Next 30 Days. Click to get this free report
 
Dollar Tree, Inc. (DLTR): Free Stock Analysis Report
 
To read this article on Zacks.com click here.
 
Zacks Investment Research
The views and opinions expressed herein are the views and opinions of the author and do not necessarily reflect those of Nasdaq, Inc.","Dollar Tree (DLTR) closed the most recent trading day at $164.50, moving -0.67% from the previous trading session. We can also see that DLTR currently has a PEG ratio of 1.44. Dollar Tree, Inc. (DLTR): Free Stock Analysis Report","Dollar Tree (DLTR) closed the most recent trading day at $164.50, moving -0.67% from the previous trading session. We can also see that DLTR currently has a PEG ratio of 1.44. Dollar Tree, Inc. (DLTR): Free Stock Analysis Report","Dollar Tree, Inc. (DLTR): Free Stock Analysis Report Dollar Tree (DLTR) closed the most recent trading day at $164.50, moving -0.67% from the previous trading session. We can also see that DLTR currently has a PEG ratio of 1.44.","Dollar Tree, Inc. (DLTR): Free Stock Analysis Report Dollar Tree (DLTR) closed the most recent trading day at $164.50, moving -0.67% from the previous trading session. We can also see that DLTR currently has a PEG ratio of 1.44.",2022,3
